"math/0307171","Michel Deza","Michel Deza, Viacheslav Grishukhin","Once more about the 52 four-dimensional parallelotopes","14 pages (submitted)",,,,"math.MG math.CO",,"  There are several works \cite{De} (and \cite{St}), \cite{En}, \cite{Co} and
\cite{Va} enumerating four-dimensional parallelotopes. In this work we give a
new enumeration showing that any four-dimensional parallelotope is either a
zonotope or the Minkowski sum of a zonotope with the regular 24-cell
$\{3,4,3\}$. Each zonotopal parallelotope is the Minkowski sum of segments
whose generating vectors form a unimodular system. There are exactly 17
four-dimensional unimodular systems. Hence, there are 17 four-dimensional
zonotopal parallelotopes. Other 35 four-dimensional parallelotopes are: the
regular 24-cell $\{3,4,3\}$ and 34 sums of the regular parallelotope with
non-zero zonotopal parallelotopes. For the nontrivial enumerating of the 34
sums we use a theorem discribing necessary and sufficient conditions when the
Minkowski sum of a parallelotope with a segment is a parallelotope.
","[{""version"":""v1"",""created"":""Fri, 11 Jul 2003 16:24:55 GMT""}]","2007-05-23"
"math/0307173","Nicholas J. Kuhn","Nicholas J. Kuhn","Tate cohomology and periodic localization of polynomial functors","25 pages. AmsLatex. Uses XYpics",,"10.1007/s00222-003-0354-z",,"math.AT",,"  In this paper, we show that Goodwillie calculus, as applied to functors from
stable homotopy to itself, interacts in striking ways with chromatic aspects of
the stable category.
  Localized at a fixed prime p, let T(n) be the telescope of a v_n self map of
a finite S--module of type n. The Periodicity Theorem of Hopkins and Smith
implies that the Bousfield localization functor associated to T(n) is
independent of choices.
  Goodwillie's general theory says that to any homotopy functor F from
S--modules to S--modules, there is an associated tower under F, {P_dF}, such
that F --> P_dF is the universal arrow to a d--excisive functor.
  Our first theorem says that P_dF --> P_{d-1}F always admits a homotopy
section after localization with respect to T(n) (and so also after localization
with respect to Morava K--theory K(n)). Thus, after periodic localization,
polynomial functors split as the product of their homogeneous factors.
  This theorem follows from our second theorem which is equivalent to the
following: for any finite group G, the Tate spectrum t_G(T(n)) is weakly
contractible. This strengthens and extends previous theorems of
Greenlees--Sadofsky, Hovey--Sadofsky, and Mahowald--Shick. The Periodicity
Theorem is used in an essential way in our proof.
  The connection between the two theorems is via a reformulation of a result of
McCarthy on dual calculus.
","[{""version"":""v1"",""created"":""Fri, 11 Jul 2003 21:16:53 GMT""}]","2015-06-26"
"math/0307174","Lasse Rempe","Lasse Rempe","An answer to a question of Herman, Baker and Rippon concerning Siegel
  disks","4 pages, 1 figure; appeared as preprint 02/7 in the Berichtsreihe des
  Mathematischen Seminars der CAU Kiel (2002)","Bull. London Math. Soc. 36 (2004), no. 4, 516-518","10.1112/S0024609304003157",,"math.DS math.CV",,"  We give a positive answer to a question of Herman, Baker and Rippon by
showing that, in the exponential family, the boundary of every unbounded Siegel
disk contains the singular value.
","[{""version"":""v1"",""created"":""Fri, 11 Jul 2003 21:23:40 GMT""}]","2007-12-11"
"math/0307175","Steve Zelditch","Steve Zelditch","Quantum maps and automorphisms",,"The breadth of symplectic and Poisson geometry, 623--654, Progr.
  Math., 232, Birkh\~A?user Boston, Boston, MA, 2005",,,"math.QA math-ph math.MP",,"  What does it mean to quantize a symplectic map $\chi$? In deformation
quantization, it means to construct an automorphism of the $*$ algebra
associated to $\chi$. In quantum chaos it means to construct unitary operators
$U_{\chi}$ such that $A \to U_{\chi} A U_{\chi}^*$ defines an automorphism of
the algebra of observables. In geometric quantization and in PDE it means to
construct a unitary Fourier integral (or Toeplitz) operator associated to the
graph of $\chi$. We compare the definitions in the setting of Kahler manifolds
$(M, g)$. The main result is a Toeplitz analogue of the Duistermaat-Singer
theorem on automorphisms of the pseudo-differential algebra, and its extension
to non-simply connected phase spaces, which often occur in applications
(quantized symplectic torus automorphisms.
","[{""version"":""v1"",""created"":""Sat, 12 Jul 2003 00:50:33 GMT""},{""version"":""v2"",""created"":""Sat, 23 Aug 2003 18:57:01 GMT""}]","2011-11-10"
"math/0307177","Ulrich Oertel","Ulrich Oertel, Jacek Swiatkowski","Contact Structures, sigma-confoliations, and contaminations in
  3-manifolds","66 pages, 26 figures",,,,"math.GT math.SG",,"  We propose in this paper a method for studying contact structures in
3-manifolds by means of branched surfaces. We explain what it means for a
contact structure to be carried by a branched surface embedded in a 3-manifold.
To make the transition from contact structures to branched surfaces, we first
define auxiliary objects called sigma-confoliations and pure contaminations,
both generalizing contact structures. We study various deformations of these
objects and show that the sigma-confoliations and pure contaminations obtained
by suitably modifying a contact structure remember the contact structure up to
isotopy.
  After defining tightness for all pure contaminations in a natural way,
generalizing the definition of tightness for contact structures, we obtain some
conditions on (the embedding of) a branched surface in a 3-manifold sufficient
to guarantee that any pure contamination carried by the branched surface is
tight. We also find conditions sufficient to prove that a branched surface
carries only overtwisted (non-tight) contact structures.
","[{""version"":""v1"",""created"":""Sat, 12 Jul 2003 01:48:38 GMT""},{""version"":""v2"",""created"":""Mon, 21 Jul 2003 02:48:46 GMT""}]","2009-09-29"
"math/0307178","Cestmir Burdik","C.Burdik, O.Navratil","The $q$-boson-fermion realizations of quantum suprealgebra
  $U_q(gl(2/1))$","8 pages","Phys.Atom.Nucl.68:1643-1645,2005; Yad.Fiz.68:1707-1709,2005","10.1134/1.2121910",,"math.QA math.RT",,"  We show that our construction of realizations for Lie algebras and quantum
algebras can be generalized to quantum superalgebras, too. We study an example
of quantum superalgebra $U_q(gl(2/1))$ and give the boson-fermion realization
with respect to one pair od q-deformed boson operator and 2 pairs of fermions.
","[{""version"":""v1"",""created"":""Sat, 12 Jul 2003 09:12:05 GMT""}]","2011-07-19"
"math/0307179","Rouchdi Bahloul","Rouchdi Bahloul","Demonstration constructive de l'existence de polynomes de Bernstein-Sato
  pour plusieurs fonctions analytiques","in french, 16 pages, 4 figures",,,,"math.RA math.AC",,"  In 1987, C. Sabbah proved the existence of Bernstein-Sato polynomials
associated with several analytic functions. The purpose of this article is to
give a more elementary and constructive proof of the result of C. Sabbah based
on the notion of the analytic Grobner fan of a D-module.
","[{""version"":""v1"",""created"":""Sat, 12 Jul 2003 10:43:48 GMT""}]","2007-05-23"
"math/0307180","Hiroshi Sato","Osamu Fujino and Hiroshi Sato","Introduction to the toric Mori theory","20 pages",,,,"math.AG",,"  The main purpose of this paper is to give a simple and non-combinatorial
proof of the toric Mori theory. Here, the toric Mori theory means the (log)
Minimal Model Program (MMP, for short) for toric varieties. We minimize the
arguments on fans and their decompositions. We recommend this paper to the
following people:
  (A) those who are uncomfortable with manipulating fans and their
decompositions,
  (B) those who are familiar with toric geometry but not with the MMP. People
in the category (A) will be relieved from tedious combinatorial arguments in
several problems. Those in the category (B) will discover the potential of the
toric Mori theory.
  As applications, we treat the Zariski decomposition on toric varieties and
the partial resolutions of non-degenerate hypersurface singularities. By these
applications, the reader will learn to use the toric Mori theory.
","[{""version"":""v1"",""created"":""Sat, 12 Jul 2003 12:22:00 GMT""},{""version"":""v2"",""created"":""Sun, 4 Apr 2004 07:47:24 GMT""}]","2016-09-07"
"nlin/0307019","Kevin A. Mitchell","K. A. Mitchell, J. P. Handley, B. Tighe, S. K. Knudson, and J. B.
  Delos","Geometry and Topology of Escape I: Epistrophes","15 pages, 9 figures, to appear in Chaos, first of two papers",,"10.1063/1.1598311",,"nlin.CD",,"  We consider a dynamical system given by an area-preserving map on a
two-dimensional phase plane and consider a one-dimensional line of initial
conditions within this plane. We record the number of iterates it takes a
trajectory to escape from a bounded region of the plane as a function along the
line of initial conditions, forming an ``escape-time plot''. For a chaotic
system, this plot is in general not a smooth function, but rather has many
singularities at which the escape time is infinite; these singularities form a
complicated fractal set. In this article we prove the existence of regular
repeated sequences, called ``epistrophes'', which occur at all levels of
resolution within the escape-time plot. (The word ``epistrophe'' comes from
rhetoric and means ``a repeated ending following a variable beginning''.) The
epistrophes give the escape-time plot a certain self-similarity, called
``epistrophic'' self-similarity, which need not imply either strict or
asymptotic self-similarity.
","[{""version"":""v1"",""created"":""Fri, 11 Jul 2003 21:05:25 GMT""}]","2016-09-08"
"nlin/0307020","Kevin A. Mitchell","K. A. Mitchell, J. P. Handley, S. K. Knudson, and J. B. Delos","Geometry and Topology of Escape II: Homotopic Lobe Dynamics","13 pages, 8 figures, to appear in Chaos, second of two papers",,"10.1063/1.1598312",,"nlin.CD",,"  We continue our study of the fractal structure of escape-time plots for
chaotic maps. In the preceding paper, we showed that the escape-time plot
contains regular sequences of successive escape segments, called epistrophes,
which converge geometrically upon each endpoint of every escape segment. In the
present paper, we use topological techniques to: (1) show that there exists a
minimal required set of escape segments within the escape-time plot; (2)
develop an algorithm which computes this minimal set; (3) show that the minimal
set eventually displays a recursive structure governed by an ``Epistrophe Start
Rule'': a new epistrophe is spawned Delta = D+1 iterates after the segment to
which it converges, where D is the minimum delay time of the complex.
","[{""version"":""v1"",""created"":""Fri, 11 Jul 2003 21:44:01 GMT""}]","2009-11-10"
"nlin/0307021","Marco Pedroni","Claudio Bartocci, Gregorio Falqui, and Marco Pedroni","A geometric approach to the separability of the Neumann-Rosochatius
  system","LaTeX file, 14 pages",,,"SISSA Preprint 62/2003/FM","nlin.SI math.DG",,"  We study the separability of the Neumann-Rosochatius system on the
n-dimensional sphere using the geometry of bi-Hamiltonian manifolds. Its
well-known separation variables are recovered by means of a separability
condition relating the Hamiltonian with a suitable (1,1) tensor field on the
sphere. This also allows us to iteratively construct the integrals of motion of
the system.
","[{""version"":""v1"",""created"":""Sat, 12 Jul 2003 14:31:01 GMT""}]","2007-05-23"
"nucl-th/0307051","Masayuki Yamagami","M. Yamagami, Nguyen Van Giai","Pairing effects on the collectivity of quadrupole states around 32Mg","14 pages, 9 figures","Phys.Rev. C69 (2004) 034301","10.1103/PhysRevC.69.034301",,"nucl-th",,"  The first 2+ states in N=20 isotones including neutron-rich nuclei 32Mg and
30Ne are studied by the Hartree-Fock-Bogoliubov plus quasiparticle random phase
approximation method based on the Green's function approach. The residual
interaction between the quasiparticles is consistently derived from the
hamiltonian density of Skyrme interactions with explicit velocity dependence.
The B(E2) transition probabilities and the excitation energies of the first 2+
states are well described within a single framework. We conclude that pairing
effects account largely for the anomalously large B(E2) value and the very low
excitation energy in 32Mg.
","[{""version"":""v1"",""created"":""Fri, 11 Jul 2003 18:36:44 GMT""}]","2009-11-10"
"nucl-th/0307052","Claudio Ciofi degli Atti","C. Ciofi degli Atti, L.P. Kaptari, B. Z. Kopeliovich","Final state interaction effects in semi-inclusive DIS off the deuteron","18 pages 6 figures A draft of the paper was erroneously sent instead
  of the paper itself","Eur.Phys.J. A19 (2004) 145-151","10.1140/epja/i2003-10117-0",,"nucl-th",,"  The effects of the final state interaction (FSI) in semi-exclusive
deep-inelastic scattering of electrons off the deuteron are analyzed paying
particular attention to two extreme kinematical regions: i) the one where FSI
effects are minimized, so that the quark distribution of bound nucleons could
be investigated, and ii) the one where the re-interaction of the produced
hadrons with the spectator nucleon is maximized, which would allow one to study
the mechanism of hadronization of highly virtual quark. It is demonstrated that
when the recoiling spectator nucleon is detected in the backward hemisphere
with low momentum the effects from FSI are negligible, whereas at large
transverse momenta of the spectator the FSI effects are rather large. Numerical
estimates show that the FSI corrections are sensitive to the theoretical models
of the hadronization mechanism.
","[{""version"":""v1"",""created"":""Fri, 11 Jul 2003 19:20:23 GMT""},{""version"":""v2"",""created"":""Thu, 24 Jul 2003 14:38:53 GMT""}]","2009-11-10"
"nucl-th/0307053","Koichi Saito","K. Saito (1), K. Tsushima (2) ((1) Tohoku College of Pharmacy, Japan,
  (2) Univ. of Georgia, USA)","Scalar and vector form factors of the in-medium nucleon","13 pages, 2 figures, references are up dated","Phys.Lett. B575 (2003) 4-10","10.1016/j.physletb.2003.09.055",,"nucl-th hep-ph nucl-ex",,"  Using the quark-meson coupling model, we calculate the form factors at sigma-
and omega-nucleon strong-interaction vertices in nuclear matter. The
Peierls-Yoccoz projection technique is used to take account of center of mass
and recoil corrections. We also apply the Lorentz contraction to the internal
quark wave function. The form factors are reduced by the nuclear medium
relative to those in vacuum. At normal nuclear matter density and Q^2 = 1
GeV^2, the reduction rate in the scalar form factor is about 15%, which is
almost identical to that in the vector one. We parameterize the ratios of the
form factors in symmetric nuclear matter to those in vacuum as a function of
nuclear density and momentum transfer.
","[{""version"":""v1"",""created"":""Sat, 12 Jul 2003 02:33:34 GMT""},{""version"":""v2"",""created"":""Fri, 7 Nov 2003 08:13:52 GMT""}]","2007-05-23"
"nucl-th/0307054","Shashi Kumar Dhiman","S.S. Chandel, S.K. Dhiman and R. Shyam","Structure of $^8B$ and astrophysical $S_{17}$ factor in Skyrme
  Hartree-Fock theory","some typos corrected","Phys.Rev. C68 (2003) 054320","10.1103/PhysRevC.68.054320",,"nucl-th",,"  We investigate the ground state structure of $^8$B within the Skyrme
Hartree-Fock framework where spin-orbit part of the effective interaction is
adjusted to reproduce the one-proton separation energy of this nucleus. Using
same set of force parameters, binding energies and root mean square radii of
other light p-shell unstable nuclei, $^8$Li, $^7$B,$^7$Be, and $^9$C, have been
calculated where a good agreement with corresponding experimental data is
obtained. The overlap integral of $^8$B and $^7$Be wave functions has been used
to determine the root mean square radius of the single proton in a particular
orbit and also the astrophysical S factor ($S_{17}$) for the $^{7}$Be($p,
\gamma)^{8}$B radiative capture reaction. It is found that the asymptotic
region (distances beyond 4 fm) of the p-shell single proton wave function
contributes more than half to the calculated value (4.93 fm) of the
corresponding single particle root mean square radius. We determine a $S_{17}$
21.1 eV.b which is in good agreement with the recommended value for near zero
energy $S_{17}$ of $19.0^{+4.0}_{-1.0}$ eV.b.
","[{""version"":""v1"",""created"":""Sat, 12 Jul 2003 07:56:21 GMT""},{""version"":""v2"",""created"":""Sat, 19 Jul 2003 06:59:18 GMT""}]","2009-11-10"
"nucl-th/0307055","Raj K. Gupta","Raj K. Gupta, M. Balasubramaniam, Rajesh Kumar and Narinder Singh","Oriented collisions for cold synthesis of superheavy nuclei","4 pages, 4 figures and 1 table",,,,"nucl-th",,"  The conditions of optimum orientations (lowest barrier and largest
interaction radius) for deformed colliding nuclei are introduced in ""cold""
fusion of superheavy nuclei. Also, the role of (octupole and) hexadecupole
deformations is studied. We have used the proximity potential and applied our
method to Ca-induced reactions.
","[{""version"":""v1"",""created"":""Sat, 12 Jul 2003 08:00:44 GMT""}]","2007-05-23"
"nucl-th/0307056","Jan Pisut","M.Jurcovicova, A.Nogova, J.Pisut, N.Pisutova, K.Tokar","Simple models of the contribution of intermediate state gluons to J\psi
  suppression at the CERN SPS","19 p[ages, 4 eps figures","ActaPhys.Hung.A21:1-16,2004",,,"nucl-th",,"  We construct three simple scenarios of the evolution of intermediate stage
gluons in Pb-Pb collisions at the CERN SPS. Only the scenario close to the
model of Kharzeev, Lourenco, Nardi and Satz agrees qualitatively with the data
of NA50 Collaboration.
","[{""version"":""v1"",""created"":""Sat, 12 Jul 2003 09:52:44 GMT""}]","2008-11-26"
"physics/0307063","Mauricio Ayala","Mauricio Ayala","Towards a necessary change in the mathematical principles of natural
  philosophy","LaTex File, 28 pages, 10 figures, first version in Spanish",,,,"physics.gen-ph",,"  Being mathematics a natural language to Mankind and to physics, it must be
constantly adapted to our necessities and our natural perception. Then,
mathematical concepts are not absolute to reality. Although mathematical
theories are constructions of our mind, and the existence of objects in such
theories is a matter of consistency or coherence of the theory (this allows us
to study them independently of other theories), in physics its not enough that
mathematical structures are coherent or consistent, these must have a much more
tangible reference to reality. Therefore any mathematical model not necessarily
is appropriate in physics. So, what sense has the concept of a point in
physics, that elementary notion used to represent the objects of the reality.
  If we consider that in a good model of reality, the existence of a
mathematical object with a physical reference must be equivalent to the
possibility of its construction, perception and verification of physical
existence, where the refutaction of the non-existence of an object does not
necessarily mean that it is possible to find a test of its existence. Then, one
obtains that the mathematical language becomes richer in structures, where the
point concept is replaced by more intuitive and perceivable concepts. On the
one hand, this possibly can lead us to a physics without infinites, and without
paradoxes, on the other hand, one restricts the use of mathematics and the use
of mental experiments in physics.
","[{""version"":""v1"",""created"":""Fri, 11 Jul 2003 20:00:29 GMT""}]","2007-05-23"
"physics/0307064","Gottfried Lichti","Gottfried Lichti","A Novel Flat Spacetime with Intrinsic Quantum Character","30 pages, 8 figures",,,,"physics.gen-ph",,"  Postulates which lead to Minkowski spacetime are amended in a subtle way, and
used to construct a consistent flat spacetime geometry with intrinsic quantum
character. Events in the new quantum geometry are described by labels of the
form (t, x, s) where t (time) and x (spatial extent) are familiar and s is a
positive integer. Structure-determining parameters for the novel spacetime are
explored in some detail. Particular structure parameters can be shown to
generate equations of mainstream quantum mechanics, and structure parameters
can also be chosen which lead to the appearance of quantum particles as
spatially extended moieties, such as strings. Further elaboration is required
before the new spacetime can be used as a comprehensive basis for physical
theory, however even at the unfinished level a new way of accounting for rest
mass emerges, and it is predicted that future experiments will fail to find
Higgs particles.
","[{""version"":""v1"",""created"":""Fri, 11 Jul 2003 20:10:24 GMT""}]","2007-05-23"
"physics/0307065","Armen Stepanyants","Armen Stepanyants","Has the Brain Maximized its Information Storage Capacity?","6 pages, 2 figures, 1 table",,,,"physics.bio-ph cond-mat.soft physics.gen-ph q-bio.NC",,"  Learning and memory may rely on the ability of neuronal circuits to
reorganize by dendritic spine remodeling. We have looked for geometrical
parameters of cortical circuits, which maximize information storage capacity
associated with this mechanism. In particular, we calculated optimal volume
fractions of various neuropil components. The optimal axonal and dendritic
volume fractions are not significantly different from anatomical measurements
in the mouse and rat neocortex, and the rat hippocampus. This has led us to
propose that the maximization of information storage capacity associated with
dendritic spine remodeling may have been an important driving force in the
evolution of the cortex.
","[{""version"":""v1"",""created"":""Fri, 11 Jul 2003 21:25:06 GMT""}]","2007-05-23"
"physics/0307067","Dr. Mario Rabinowitz","Mario Rabinowitz, A. P. Sakis Meliopoulos and Elias N. Glytsis, George
  J. Cokkinides","Nuclear Magnetohydrodynamic EMP, Solar Storms, and Substorms","29 pages, 14 figures, 5 tables","Int.J.Mod.Phys.B6:3353-3380,1992","10.1142/S0217979292001481",,"physics.gen-ph physics.soc-ph",,"  In addition to a fast electromagnetic pulse (EMP), a high altitude nuclear
burst produces a relatively slow magnetohydrodynarnic EMP (MHD EMP), whose
effects are like those from solar storm geomagnetically induced currents (SS
GIC). The MHD EMP electric field E < 10^-1 V/m and lasts < 10^2 sec, whereas
for solar storms E > 10^-2 V/m and lasts >10^3 sec. Although the solar storm
electric field is lower than MHD EMP, the solar storm effects are generally
greater due to their much longer duration. Substorms produce much smaller
effects than SS GIC, but occur much more frequently. This paper describes the
physics of such geomagnetic disturbances and analyzes their effects.
","[{""version"":""v1"",""created"":""Sat, 12 Jul 2003 05:50:51 GMT""}]","2008-11-26"
"quant-ph/0307089","Marcos C. de Oliveira","M. C. de Oliveira, S. S. Mizrahi, and V. V. Dodonov","A consistent quantum model for continuous photodetection processes","12 pages, 4 figures","J. Opt. B: Quantum Semiclass. Opt. 5, S271 (2003)","10.1088/1464-4266/5/3/358",,"quant-ph",,"  We are modifying some aspects of the continuous photodetection theory,
proposed by Srinivas and Davies [Optica Acta 28, 981 (1981)], which describes
the non-unitary evolution of a quantum field state subjected to a continuous
photocount measurement. In order to remedy inconsistencies that appear in their
approach, we redefine the `annihilation' and `creation' operators that enter in
the photocount superoperators. We show that this new approach not only still
satisfies all the requirements for a consistent photocount theory according to
Srinivas and Davies precepts, but also avoids some weird result appearing when
previous definitions are used.
","[{""version"":""v1"",""created"":""Fri, 11 Jul 2003 20:49:56 GMT""}]","2009-11-10"
