"cond-mat/0307300","Henrik Jeldtoft Jensen","Kajsa Dahlstedt and Henrik Jeldtoft Jensen","Fluctuation spectrum and size scaling of river flow and level","17 pages, 13 figures","Physica A, Vol. 348, p. 596 (2005)","10.1016/j.physa.2004.09.039",,"cond-mat.stat-mech",,"  We describe the statistical properties of two large river systems: the Danube
and the Mississippi. The properties of the two rivers are compared
qualitatively to the general properties of a critical steady state system.
Specifically, we test the recent suggestion by Bramwell, Fennell, Holdsworth
and Portelli [{\it Europhys. Lett.} {\bf 57}, 310 (2002)] that a universal
probability density function (PDF) exists for the fluctuations in river level,
namely the Bramwell-Holdsworth-Pinton (BHP) PDF. The statistical properties
investigated in this paper are: the PDF of the river flow and river level;
moment scaling with basin area; moment to moment scaling or relative scaling;
and power spectral properties of the data. We find that the moments of the flow
scale approximately with basin area and that the seasonally adjusted flows
exhibit relative moment scaling.
  Compared to the Mississippi, the Danube shows large deviations from spatial
scaling and the power spectra show considerable dependence on system size. This
might be due to water use and regulations as well as inhomogeneities in the
basin area.
  We also find that the PDF of level data in some, but not all, cases can be
qualitatively approximated by the BHP PDF. We discuss why this coincidence
appears to be accidental.
","[{""version"":""v1"",""created"":""Sat, 12 Jul 2003 07:49:06 GMT""}]","2016-08-31"
"cond-mat/0307301","James Phillips","J. C. Phillips","Fermats last theorem, the Riemann hypothesis, and synergistic glasses","5 pages",,,,"cond-mat.mes-hall",,"  The synergistic formation of zero (exponentially small) resistance states
(ESRS) in high mobility two-dimensional electron systems (2DES) in a static
magnetic field B and exposed to strong microwave (MW) radiation exhibits
hysteresis and an anomalous logarithmic dependence on MW power. These
synergistically organized states appear to be associated with a new kind of
energy gap \Delta. Here I show that a microscopic quantum model that involves
the Prime Number Theorem explains the MW power dependence of the energy gap
\Delta. The explanation involves remarkable convergence with the most abstract
ideas of modern mathematics.
","[{""version"":""v1"",""created"":""Sat, 12 Jul 2003 08:05:36 GMT""}]","2007-05-23"
"cond-mat/0307302","Gopalan Srinivasan","A.A. Bush, Y.K. Fetisov, K.E. Kamentsev, V.F. Meshcheryakov, and G.
  Srinivasan","Magnetic and microwave properties of (Ni,Co)Fe2O4-ferroelectric and
  (La,Ca,Sr)MnO3-ferroelectric multilayer structures",,"Journal of Magnetism and Magnetic Materials 258-259, 45 (2003)","10.1016/S0304-8853(02)01008-9",,"cond-mat.mtrl-sci",,"  Structural, magnetic and ferromagnetic resonance characterization studies
have been performed on lay-ered ferromagnetic-ferroelectric oxides that show
strong magnetoelectric coupling. The samples contained thick films of ferrites
or substituted lanthanum manganites for the ferromagnetic phase and lead
zirconate titanate for the ferroelectric phase, and were sintered high
temperatures. Results indicate defect free ferrites, but deterioration of
manganite parameters due to diffusion at the interface and accounts for poor
magnetoelectric coupling in manganite-PZT samples.
","[{""version"":""v1"",""created"":""Sat, 12 Jul 2003 14:55:01 GMT""}]","2009-11-10"
"cond-mat/0307303","J. K. Jain","Gun Sang Jeon, Kenneth L. Graham, and Jainendra K. Jain","Fractional statistics in the fractional quantum Hall effect","Phys. Rev. Lett., in press","Phys. Rev. Lett. 91, 036801 (2003)","10.1103/PhysRevLett.91.036801",,"cond-mat.mes-hall cond-mat.str-el",,"  A microscopic confirmation of the fractional statistics of the {\em
quasiparticles} in the fractional quantum Hall effect has so far been lacking.
We calculate the statistics of the composite-fermion quasiparticles at
$\nu=1/3$ and $\nu=2/5$ by evaluating the Berry phase for a closed loop
encircling another composite-fermion quasiparticle. A careful consideration of
subtle perturbations in the trajectory due to the presence of an additional
quasiparticle is crucial for obtaining the correct value of the statistics. The
conditions for the applicability of the fractional statistics concept are
discussed.
","[{""version"":""v1"",""created"":""Sat, 12 Jul 2003 15:01:46 GMT""}]","2018-09-25"
"cs/0307031","Praveen Boinee","P. Boinee, A. De Angelis, E. Milotti","Automatic Classification using Self-Organising Neural Networks in
  Astrophysical Experiments","9 Pages, corrected authors name format","S. Ciprini, A. De Angelis, P. Lubrano and O. Mansutti (eds.):
  Proc. of ``Science with the New Generation of High Energy Gamma-ray
  Experiments'' (Perugia, Italy, May 2003). Forum, Udine 2003, p. 177",,,"cs.NE astro-ph cs.AI",,"  Self-Organising Maps (SOMs) are effective tools in classification problems,
and in recent years the even more powerful Dynamic Growing Neural Networks, a
variant of SOMs, have been developed. Automatic Classification (also called
clustering) is an important and difficult problem in many Astrophysical
experiments, for instance, Gamma Ray Burst classification, or gamma-hadron
separation. After a brief introduction to classification problem, we discuss
Self-Organising Maps in section 2. Section 3 discusses with various models of
growing neural networks and finally in section 4 we discuss the research
perspectives in growing neural networks for efficient classification in
astrophysical problems.
","[{""version"":""v1"",""created"":""Sat, 12 Jul 2003 12:04:33 GMT""},{""version"":""v2"",""created"":""Wed, 16 Jul 2003 13:10:30 GMT""}]","2007-05-23"
"cs/0307032","Praveen Boinee","M. Frailis, A. De Angelis, V. Roberto","Data Management and Mining in Astrophysical Databases","10 pages, Latex","S. Ciprini, A. De Angelis, P. Lubrano and O. Mansutti (eds.):
  Proc. of ``Science with the New Generation of High Energy Gamma-ray
  Experiments'' (Perugia, Italy, May 2003). Forum, Udine 2003, p. 157",,,"cs.DB astro-ph physics.data-an",,"  We analyse the issues involved in the management and mining of astrophysical
data. The traditional approach to data management in the astrophysical field is
not able to keep up with the increasing size of the data gathered by modern
detectors. An essential role in the astrophysical research will be assumed by
automatic tools for information extraction from large datasets, i.e. data
mining techniques, such as clustering and classification algorithms. This asks
for an approach to data management based on data warehousing, emphasizing the
efficiency and simplicity of data access; efficiency is obtained using
multidimensional access methods and simplicity is achieved by properly handling
metadata. Clustering and classification techniques, on large datasets, pose
additional requirements: computational and memory scalability with respect to
the data size, interpretability and objectivity of clustering or classification
results. In this study we address some possible solutions.
","[{""version"":""v1"",""created"":""Sat, 12 Jul 2003 12:35:37 GMT""},{""version"":""v2"",""created"":""Wed, 16 Jul 2003 12:49:46 GMT""}]","2007-05-23"
"gr-qc/0307059","Carlos F. Sopuerta","Marco Bruni and Carlos F. Sopuerta","Covariant Fluid Dynamics: a Long Wave-Length Approximation","18 pages. LaTeX2e. IOP Style","Class.Quant.Grav. 20 (2003) 5275-5290","10.1088/0264-9381/20/24/003",,"gr-qc astro-ph",,"  In this paper we consider the Long-Wavelength Approximation Scheme (LWAS) in
the framework of the covariant fluid approach to general relativistic dynamics,
specializing to the particular case of irrotational dust matter. We discuss the
dynamics of these models during the approach to any spacelike singularity where
a BKL-type evolution is expected, studying the validity of this approximation
scheme and the role of the magnetic part of the Weyl tensor, $H_{ab}$. Our
analytic results confirm a previous numerical analysis: it is $H_{ab}$ that
destroys the pure Kasner-like approach to the singularity and eventually
produces the bounce to another Kasner phase. Expanding regions evolve as
separate universes where inhomogeneities and anisotropies die away.
","[{""version"":""v1"",""created"":""Fri, 11 Jul 2003 23:01:53 GMT""}]","2009-11-10"
"gr-qc/0307061","Yongge Ma","Xuejun Yang, Yongge Ma, Jianbing Shao, and Wei Zhou","Killing Reduction of 5-Dimensional Spacetimes","9 pages, references added","Phys.Rev. D68 (2003) 024006","10.1103/PhysRevD.68.024006",,"gr-qc hep-th",,"  In a 5-dimensional spacetime ($M,g_{ab}$) with a Killing vector field $\xi
^a$ which is either everywhere timelike or everywhere spacelike, the collection
of all trajectories of $\xi ^a$ gives a 4-dimensional space $S$. The reduction
of ($M,g_{ab}$) is studied in the geometric language, which is a generalization
of Geroch's method for the reduction of 4-dimensional spacetime. A
4-dimensional gravity coupled to a vector field and a scalar field on $S$ is
obtained by the reduction of vacuum Einstein's equations on $M$, which gives
also an alternative description of the 5-dimensional Kaluza-Klein theory.
Besides the symmetry-reduced action from the Hilbert action on $M$, an
alternative action of the fields on $S$ is also obtained, the variations of
which lead to the same fields equations as those reduced from the vacuum
Einstein equation on $M$.
","[{""version"":""v1"",""created"":""Sat, 12 Jul 2003 08:12:41 GMT""},{""version"":""v2"",""created"":""Fri, 25 Jul 2003 03:26:17 GMT""}]","2009-11-10"
"gr-qc/0307062","Carlos Augusto Romero Filho","A.Barros, V.B.Bezerra and C.Romero","Global aspects of gravitomagnetism","10 pages - Typeset using REVTEX","Mod.Phys.Lett. A18 (2003) 2673-2679","10.1142/S0217732303012143",,"gr-qc",,"  We consider global properties of gravitomagnetism by investigating the
gravitomagnetic field of a rotating cosmic string. We show that although the
gravitomagnetic field produced by such a configuration of matter vanishes
locally, it can be detected globally. In this context we discuss the
gravitational analogue of the Aharonov-Bohm effect.
","[{""version"":""v1"",""created"":""Sat, 12 Jul 2003 15:49:05 GMT""}]","2009-11-10"
"hep-ex/0307026","Andrei Gritsan","The BABAR Collaboration, B. Aubert, et al","Rates, Polarizations, and Asymmetries in Charmless Vector-Vector B Meson
  Decays","7 pages, 2 postscript figures, published in Phys. Rev. Lett","Phys.Rev.Lett.91:171802,2003","10.1103/PhysRevLett.91.171802","BABAR-PUB-03/018, SLAC-PUB-10016","hep-ex",,"  With a sample of approximately 89 million BBbar pairs collected with the
BABAR detector, we perform a search for B meson decays into pairs of charmless
vector mesons (phi, rho, and K*). We measure the branching fractions, determine
the degree of longitudinal polarization, and search for CP violation
asymmetries in the processes B->phiK*+, B->phiK*0, B->rho0K*+, and B->rho0rho+.
We also set an upper limit on the branching fraction for the decay B->rho0rho0.
","[{""version"":""v1"",""created"":""Fri, 11 Jul 2003 18:11:43 GMT""},{""version"":""v2"",""created"":""Tue, 4 Nov 2003 22:36:55 GMT""}]","2008-11-26"
"hep-lat/0307022","Wolfgang Bietenholz","David H. Adams and Wolfgang Bietenholz","Axial Anomaly and Index of the Overlap Hypercube Operator","21 pages, no figures, final version to appear in Eur. Phys. J. C","Eur.Phys.J. C34 (2004) 245-253","10.1140/epjc/s2004-01647-2","INLO-PUB-10/03, HU-EP-03/38, SFB/CPP-03-14","hep-lat",,"  The overlap hypercube fermion is constructed by inserting a lattice fermion
with hypercubic couplings into the overlap formula. One obtains an exact
Ginsparg-Wilson fermion, which is more complicated than the standard overlap
fermion, but which has improved practical properties and is of current interest
for use in numerical simulations. Here we deal with conceptual aspects of the
overlap hypercube Dirac operator. Specifically, we evaluate the axial anomaly
and the index, demonstrating that the correct classical continuum limit is
recovered. Our derivation is non-perturbative and therefore valid in all
topological sectors. At the non-perturbative level this result had previously
only been shown for the standard overlap Dirac operator with Wilson kernel. The
new techniques which we develop to accomplish this are of a general nature and
have the potential to be extended to overlap Dirac operators with even more
general kernels.
","[{""version"":""v1"",""created"":""Sat, 12 Jul 2003 14:42:59 GMT""},{""version"":""v2"",""created"":""Tue, 27 Jan 2004 09:23:35 GMT""}]","2009-11-10"
"hep-ph/0307163","Rabindra N. Mohapatra","Bhaskar Dutta and Rabindra N. Mohapatra","Lepton Electric Dipole Moments, Supersymmetric Seesaw and Leptogenesis
  Phase","22 pages, 6 figures, one reference added and monor typos corrected","Phys.Rev. D68 (2003) 113008","10.1103/PhysRevD.68.113008","UMD-PP-03-062","hep-ph",,"  We calculate the lepton electric dipole moments in a class of supersymmetric
seesaw models and explore the possibility that they may provide a way to probe
some of the CP violating phases responsible for the origin of matter via
leptogenesis. We show that in models where the right handed neutrino masses,
$M_R$ arise from the breaking of local B-L symmetry by a Higgs field with
B-L=2, some of the leptogenesis phases can lead to enhancement of the lepton
dipole moments compared to the prediction of models where $M_R$ is either
directly put in by hand or is a consequence of a higher dimensional operator.
","[{""version"":""v1"",""created"":""Fri, 11 Jul 2003 16:14:03 GMT""},{""version"":""v2"",""created"":""Sun, 20 Jul 2003 20:02:43 GMT""}]","2009-11-10"
"hep-ph/0307164","Pedro Fernando Simoes Costa","Pedro Costa, M. C. Ruivo and Yu. L. Kalinovsky","Anomalous decay of pion and eta at finite density","12 pages, 4 figures included; revised version, to be published in
  Phys. Lett. B","Phys.Lett. B577 (2003) 129-136; Erratum-ibid. B581 (2004) 274-275","10.1016/j.physletb.2003.10.020",,"hep-ph",,"  We study the anomalous decays $\pi^0, \eta \to\gamma\gamma$ in the framework
of the three--flavor Nambu--Jona-Lasinio [NJL] model, in the vacuum and in
quark matter in $\beta$ --equilibrium. It is found that the behavior of the
relevant observables essentially reflects a manifestation of the partial
restoration of chiral symmetry, in non strange and strange sectors. The
probability of such decays decreases with density, showing that anomalous
mesonic interactions are significantly affected by the medium.
","[{""version"":""v1"",""created"":""Fri, 11 Jul 2003 16:08:18 GMT""},{""version"":""v2"",""created"":""Thu, 30 Oct 2003 21:45:53 GMT""}]","2007-05-23"
"hep-ph/0307165","Ivan Vila","I.Vila","Performance and First Physics Results of the SVT Trigger at CDF II","Invited talk at the Workshop on the CKM Unitarity Triangle, IPPP
  Durham, April 2003 (eConf C0304052). 4 pages LaTeX, 6 eps figures","ECONF C0304052:FO008,2003",,,"hep-ph",,"  For the first time in a hadron collider, a novel trigger processor, the
Silicon Vertex Trigger (SVT), allows to select the long-lived heavy flavor
particles by cutting on the track impact parameter with a precision similar to
that of the offline reconstruction. Triggering on displaced tracks has enriched
the B-physics program by enhancing the B yields of the lepton-based triggers
and opened up full hadronic triggering at CDF. After a first commissioning
period, the SVT is fully operational, performing very closely to its design
capabilities. System performance and first physics results based on SVT
selected data samples are presented.
","[{""version"":""v1"",""created"":""Fri, 11 Jul 2003 22:32:57 GMT""}]","2010-04-22"
"hep-ph/0307166","Andrei Poblaguev","A.A. Poblaguev","On the analysis of the pi -> e nu gamma experimental data","5 pages, 2 figures","Phys.Rev. D68 (2003) 054020","10.1103/PhysRevD.68.054020",,"hep-ph",,"  The most general amplitude for the radiative pion decay pi -> e nu gamma
including terms beyond V-A theory is considered. The experimental constraints
on the decay amplitude components are discussed. A model independent
presentation of the results of high statistics and high resolution experiments
is suggested.
","[{""version"":""v1"",""created"":""Sat, 12 Jul 2003 00:03:14 GMT""}]","2009-11-10"
"hep-ph/0307167","Banibrata Mukhopadhyay","Banibrata Mukhopadhyay","Neutrino oscillations under gravity: mass independent oscillation","6 pages, revtex style; extra relevant references are added",,,,"hep-ph gr-qc",,"  I discuss the possibility of neutrino oscillation in presence of gravity. In
this respect I consider the propagation of neutrinos in the early phase of
universe and around black holes. It is seen that whether the rest masses of a
neutrino and corresponding anti-neutrino are considered to be same or not due
to space-time curvature effect non-zero oscillation probability between the
neutrino and anti-neutrino states comes out. Therefore I can conclude that
under gravity neutrino oscillation takes place which is independent of their
rest mass.
","[{""version"":""v1"",""created"":""Sat, 12 Jul 2003 09:53:06 GMT""},{""version"":""v2"",""created"":""Mon, 4 Aug 2003 07:49:41 GMT""}]","2007-05-23"
"hep-th/0307108","Vladimir Bazhanov","V.V. Bazhanov, S.L. Lukyanov and A.B. Zamolodchikov","Higher-level eigenvalues of Q-operators and Schroedinger equation","11 pages, LaTeX","Adv.Theor.Math.Phys.7:711-725,2004",,"RUNHETC-2003-22","hep-th cond-mat math-ph math.MP",,"  Relation between one-dimensional Schroedinger equation and the vacuum
eigenvalues of the Q-operators is extended to their higher-level eigenvalues.
","[{""version"":""v1"",""created"":""Fri, 11 Jul 2003 18:13:31 GMT""},{""version"":""v2"",""created"":""Wed, 24 Dec 2003 04:14:20 GMT""}]","2008-11-26"
"hep-th/0307111","Evgeny Ivanov","E. Ivanov and O. Lechtenfeld","N=4 Supersymmetric Mechanics in Harmonic Superspace","31 pages, LaTeX","JHEP 0309:073,2003","10.1088/1126-6708/2003/09/073","ITP-UH-05/03","hep-th",,"  We define N=4, d=1 harmonic superspace HR^{1+2|4} with an SU(2)/U(1) harmonic
part, SU(2) being one of two factors of the R-symmetry group SU(2)xSU(2) of
N=4, d=1 Poincar\'e supersymmetry. We reformulate, in this new setting, the
models of N=4 supersymmetric quantum mechanics associated with the off-shell
multiplets (3, 4, 1) and (4, 4, 0). The latter admit a natural description as
constrained superfields living in an analytic subspace of HR^{1+2|4}. We
construct the relevant superfield actions consisting of a sigma-model as well
as a superpotential parts and demonstrate that the superpotentials can be
written off shell in a manifestly N=4 supersymmetric form only in the analytic
superspace. The constraints implied by N=4 supersymmetry for the component
bosonic target-space metrics, scalar potentials and background one-forms
automatically follow from the harmonic superspace description. The analytic
superspace is shown to be closed under the most general N=4, d=1 superconformal
group D(2,1;\alpha). We give its action on the analytic superfields comprising
the (3, 4, 1) and (4, 4, 0) multiplets, reveal a surprising relation between
the latter and present the corresponding superconformally invariant actions.
The harmonic superspace approach suggests a natural generalization of these
multiplets, with a [2(n+1), 4n, 2(n-1)] off-shell content for n>2.
","[{""version"":""v1"",""created"":""Fri, 11 Jul 2003 16:01:59 GMT""}]","2014-11-18"
"hep-th/0307112","Lucian M. Ionescu","Lucian M. Ionescu, Michael Marsalli (Illinois State University)","A Hopf algebra deformation approach to renormalization","AMS-LaTex, 8 pages",,,,"hep-th",,"  We investigate the relation between Connes-Kreimer Hopf algebra approach to
renomalization and deformation quantization. Both approaches rely on
factorization, the correspondence being established at the level of Wiener-Hopf
algebras, and double Lie algebras/Lie bialgebras, via r-matrices.
  It is suggested that the QFTs obtained via deformation quantization and
renormalization correspond to each other in the sense of
Kontsevich/Cattaneo-Felder.
","[{""version"":""v1"",""created"":""Fri, 11 Jul 2003 16:16:25 GMT""}]","2007-05-23"
"hep-th/0307113","Plamen Bozhilov","D. Aleksandrova, P. Bozhilov","On the Classical String Solutions and String/Field Theory Duality","LaTeX, 15 pages, no figures; V2: some typos corrected; V3: no
  corrections, to appear in JHEP","JHEP 0308 (2003) 018","10.1088/1126-6708/2003/08/018",,"hep-th",,"  We classify almost all classical string configurations, considered in the
framework of the semi-classical limit of the string/gauge theory duality. Then,
we describe a procedure for obtaining the conserved quantities and the exact
classical string solutions in general string theory backgrounds, when the
string embedding coordinates depend non-linearly on the worldsheet time
parameter.
","[{""version"":""v1"",""created"":""Fri, 11 Jul 2003 17:49:51 GMT""},{""version"":""v2"",""created"":""Sun, 20 Jul 2003 15:10:36 GMT""},{""version"":""v3"",""created"":""Wed, 13 Aug 2003 18:47:05 GMT""}]","2007-05-23"
"hep-th/0307114","Marcelo Gomes","E. A. Asano, M. Gomes, A. G. Rodrigues and A. J. da Silva","(2+1)D Noncommutative CP$^{N-1}$ Model","31 pages, 11 figures, revtex4, minor corrections in some equations
  and in the text","Phys.Rev. D69 (2004) 065012","10.1103/PhysRevD.69.065012",,"hep-th",,"  We investigate possible extensions of the (2+1) dimensional $CP^{N-1}$ model
to the noncommutative space. Up to the leading nontrivial order of 1/N, we
prove that the model restricted to the left fundamental representation of the
gauge group is renormalizable and does not have dangerous infrared divergences.
In contrast, if the basic field $\phi$ transforms in accord with the adjoint
representation, infrared singularities are present in the two point function of
the auxiliary gauge field and also in the leading correction to the self-energy
of the $\phi$ field. These infrared divergences may produce nonintegrable
singularities leading at higher orders to a breakdown of the 1/N expansion.
Gauge invariance of the renormalization procedure is also discussed.
","[{""version"":""v1"",""created"":""Fri, 11 Jul 2003 20:53:18 GMT""},{""version"":""v2"",""created"":""Fri, 19 Sep 2003 19:36:52 GMT""},{""version"":""v3"",""created"":""Tue, 2 Dec 2003 12:52:55 GMT""}]","2009-11-10"
"hep-th/0307116","Gernot Akemann","G. Akemann","Equivalence of Matrix Models for Complex QCD Dirac Spectra","13 pages, 4 figures, references added","Acta Phys.Polon. B34 (2003) 4653-4666",,"SPhT T03/103","hep-th hep-lat hep-ph",,"  Two different matrix models for QCD with a non-vanishing quark chemical
potential are shown to be equivalent by mapping the corresponding partition
functions. The equivalence holds in the phase with broken chiral symmetry. It
is exact in the limit of weak non-Hermiticity, where the chemical potential
squared is rescaled with the volume. At strong non-Hermiticity it holds only
for small chemical potential. The first model proposed by Stephanov is directly
related to QCD and allows to analyze the QCD phase diagram. In the second model
suggested by the author all microscopic spectral correlation functions of
complex Dirac operators can be calculated in the broken phase. We briefly
compare those predictions to complex Dirac eigenvalues from quenched QCD
lattice simulations.
","[{""version"":""v1"",""created"":""Sat, 12 Jul 2003 13:56:28 GMT""},{""version"":""v2"",""created"":""Wed, 23 Jul 2003 09:53:42 GMT""}]","2007-05-23"
"math-ph/0307027","Paolo Maria Mariano","Paolo Maria Mariano","Cancellation of vorticity in steady-state non-isentropic flows of
  complex fluids","12 pages","J. Phys. A: Math. and Gen., 36 (2003), 9961-9972","10.1088/0305-4470/36/38/312",,"math-ph math.MP",,"  In steady-state non-isentropic flows of perfect fluids there is always
thermodynamic generation of vorticity when the difference between the product
of the temperature with the gradient of the entropy and the gradient of total
enthalpy is different from zero. We note that this property does not hold in
general for complex fluids for which the prominent influence of the material
substructure on the gross motion may cancel the thermodynamic vorticity. We
indicate the explicit condition for this cancellation (topological transition
from vortex sheet to shear flow) for general complex fluids described by
coarse-grained order parameters and extended forms of Ginzburg-Landau energies.
As a prominent sample case we treat first Korteweg's fluid, used commonly as a
model of capillary motion or phase transitions characterized by diffused
interfaces. Then we discuss general complex fluids. We show also that, when the
entropy and the total enthalpy are constant throughout the flow, vorticity may
be generated by the inhomogeneous character of the distribution of material
substructures, and indicate the explicit condition for such a generation. We
discuss also some aspects of unsteady motion and show that in two-dimensional
flows of incompressible perfect complex fluids the vorticity is in general not
conserved, due to a mechanism of transfer of energy between different levels.
","[{""version"":""v1"",""created"":""Fri, 11 Jul 2003 16:30:27 GMT""},{""version"":""v2"",""created"":""Tue, 16 Sep 2003 09:42:22 GMT""}]","2009-11-10"
