"astro-ph/0307262","Subharthi Ray","Subharthi Ray, Aquino L. Espindola, Manuel Malheiro, Jose' P. S. Lemos
  and Vilson T. Zanchin","Electrically charged compact stars and formation of charged black holes","10 pages, 9 figures, To appear in Phys Rev. D","Phys.Rev.D68:084004,2003","10.1103/PhysRevD.68.084004",,"astro-ph gr-qc hep-ph nucl-th",,"  We study the effect of electric charge in compact stars assuming that the
charge distribution is proportional to the mass density. The pressure and the
density of the matter inside the stars are large, and the gravitational field
is intense. This indicates that electric charge and a strong electric field can
also be present. The relativistic hydrostatic equilibrium equation, i.e., the
Tolman-Oppenheimer-Volkoff equation, is modified in order to include electric
charge. We perform a detailed numerical study of the effect of electric charge
using a polytropic equation of state. We conclude that in order to see any
appreciable effect on the phenomenology of the compact stars, the electric
fields have to be huge (~ 10^{21} V/m), which implies that the total charge is
Q ~ 10^{20} Coulomb. From the local effect of the forces experienced on a
single charged particle, it is expected that each individual charged particle
is quickly ejected from the star. This in turn produces a huge force imbalance,
and the gravitational force overwhelms the repulsive Coulomb and fluid pressure
forces. The star can then collapse to form a charged black hole before all the
charge leaves the system.
","[{""version"":""v1"",""created"":""Sat, 12 Jul 2003 00:07:13 GMT""},{""version"":""v2"",""created"":""Tue, 19 Aug 2003 22:49:02 GMT""}]","2009-11-10"
"astro-ph/0307263","Yasunori Fujii","Yasunori Fujii","Time-variability of the fine-structure constant expected from the Oklo
  constraint and the QSO absorption lines","10 pages, 4 figures. Expanded section 2 and added discussion on the
  Re decay in section 4","Phys.Lett. B573 (2003) 39-45","10.1016/j.physletb.2003.08.036",,"astro-ph",,"  The data from the QSO absorption lines indicating a nonzero time-variability
of the fine-structure constant has been re-analyzed on the basis of a
""damped-oscillator"" fit, as motivated by the same type of behavior of a scalar
field, dilaton, which mimics a cosmological constant to understand the
accelerating universe. We find nearly as good fit to the latest data as the
simple weighted mean. In this way, we offer a way to fit the more stringent
result from the Oklo phenomenon, as well.
","[{""version"":""v1"",""created"":""Sat, 12 Jul 2003 03:39:20 GMT""},{""version"":""v2"",""created"":""Fri, 1 Aug 2003 09:05:36 GMT""}]","2015-06-24"
"astro-ph/0307264","Roberto Maiolino","R. Maiolino, Y. Juarez, R. Mujica, N. Nagar, E. Oliva","Early star formation traced by the highest redshift quasars","Replaced to match the accepted version (ApJL in press), 5 pages","Astrophys.J.596:L155-L158,2003","10.1086/379600",,"astro-ph",,"  The iron abundance relative to alpha-elements in the circumnuclear region of
quasars is regarded as a clock of the star formation history and, more
specifically, of the enrichment by SNIa. We investigate the iron abundance in a
sample of 22 quasars in the redshift range 3.0<z<6.4 by measuring their rest
frame UV FeII bump, which is shifted into the near-IR, and by comparing it with
the MgII 2798 flux. The observations were performed with a device that can
obtain near-IR spectra in the range 0.8-2.4 um in one shot, thereby enabling an
optimal removal of the continuum underlying the FeII bump. We detect iron in
all quasars including the highest redshift (z=6.4) quasar currently known. The
uniform observational technique and the wide redshift range allows a reliable
study of the trend of the FeII/MgII ratio with redshift. We find the FeII/MgII
ratio is nearly constant at all redshifts, although there is marginal evidence
for a higher FeII/MgII ratio in the quasars at z~6. If the FeII/MgII ratio
reflects the Fe/alpha abundance, this result suggests that the z~6 quasars have
already undergone a major episode of iron enrichment. We discuss the possible
implications of this finding for the star formation history at z>6. We also
detect a population of weak iron emitters at z~4.5, which are possibly hosted
in systems that evolved more slowly. Alternatively, the trend of the FeII/MgII
ratio at high redshift may reflect significantly different physical conditions
of the circumnuclear gas in such high redshift quasars.
","[{""version"":""v1"",""created"":""Sat, 12 Jul 2003 05:33:44 GMT""},{""version"":""v2"",""created"":""Mon, 8 Sep 2003 09:28:41 GMT""}]","2009-11-10"
"astro-ph/0307265","Denise Goncalves","Denise R. Goncalves (1), Romano L.M. Corradi (2), Antonio Mampaso (1)
  and Mario Perinotto (3) ((1) Instituto de Astrofisica de Canarias, Tenerife,
  Spain, (2) Isaac Newton Group of Telescopes, La Palma, Spain (3) Universita
  di Firenze, Italy)","The physical parameters, excitation and chemistry of the rim, jets and
  knots of the planetary nebula NGC 7009","Figure 1 was changed because features were misidentified in the
  previous version. 17 pages including 5 figures and 3 tables. ApJ in press.
  Also available at http://www.iac.es/galeria/denise/","Astrophys.J.597:975-985,2003; Erratum-ibid.601:1161,2004","10.1086/378496","IAC 28/2003","astro-ph",,"  We present long-slit optical spectra along the major axis of the planetary
nebula NGC 7009. These data allow us to discuss the physical, excitation and
chemical properties of all the morphological components of the nebula,
including its remarkable systems of knots and jets. The main results of this
analysis are the following: i) the electron temperature throughout the nebula
is remarkably constant, T_e[OIII] = 10200K; ii) the bright inner rim and inner
pair of knots have similar densities of N_e = 6000cm^{-3}, whereas a much lower
density of N_e = 1500cm^{-3} is derived for the outer knots as well as for the
jets; iii) all the regions (rim, inner knots, jets and outer knots) are mainly
radiatively excited; and iv) there are no clear abundance changes across the
nebula for He, O, Ne, or S. There is a marginal evidence for an overabundance
of nitrogen in the outer knots (ansae), but the inner ones (caps) and the rim
have similar N/H values that are at variance with previous results. Our data
are compared to the predictions of theoretical models, from which we conclude
that the knots at the head of the jets are not matter accumulated during the
jet expansion through the circumstellar medium, neither can their origin be
explained by the proposed HD or MHD interacting-wind models for the formation
of jets/ansae, since the densities as well as the main excitation mechanisms of
the knots, disagree with model predictions.
","[{""version"":""v1"",""created"":""Sat, 12 Jul 2003 13:32:10 GMT""},{""version"":""v2"",""created"":""Thu, 18 Sep 2003 11:38:06 GMT""},{""version"":""v3"",""created"":""Fri, 19 Sep 2003 09:31:21 GMT""}]","2009-11-10"
"cond-mat/0307263","Jeffrey Lynn","J. W. Lynn, Q. Huang, C. M. Brown, V. L. Miller, M.L. Foo, R.E.
  Schaak, C. Y. Jones, E. A. Mackey, and R. J. Cava","Structure and Dynamics of Superconducting NaxCoO(2) Hydrate and Its
  Unhydrated Analog","14 pages, 7 figures, Phys. Rev. B (in press). Minor changes + two
  figures removed as requested by referee","Physical Review B68, 214516 (2003)","10.1103/PhysRevB.68.214516",,"cond-mat.supr-con",,"  Neutron scattering has been used to investigate the crystal structure and
lattice dynamics of superconducting Na0.3CoO2 1.4(H/D)2O, and the parent
Na0.3CoO2 material. The structure of Na0.3CoO2 consists of alternate layers of
CoO2 and Na and is the same as the structure at higher Na concentrations. For
the superconductor, the water forms two additional layers between the Na and
CoO2, increasing the c-axis lattice parameter of the hexagonal P63/mmc space
group from 11.16 A to 19.5 A. The Na ions are found to occupy a different
configuration from the parent compound, while the water forms a structure that
replicates the structure of ice. Both types of sites are only partially
occupied. The CoO2 layer in these structures is robust, on the other hand, and
we find a strong inverse correlation between the CoO2 layer thickness and the
superconducting transition temperature (TC increases with decreasing
thickness). The phonon density-of-states for Na0.3CoO2 exhibits distinct
acoustic and optic bands, with a high-energy cutoff of ~100 meV. The lattice
dynamical scattering for the superconductor is dominated by the hydrogen modes,
with librational and bending modes that are quite similar to ice, supporting
the structural model that the water intercalates and forms ice-like layers in
the superconductor.
","[{""version"":""v1"",""created"":""Fri, 11 Jul 2003 19:05:17 GMT""},{""version"":""v2"",""created"":""Fri, 24 Oct 2003 22:06:35 GMT""}]","2009-11-10"
"cond-mat/0307285","Albert Robledo","A. Robledo","Universal glassy dynamics at noise-perturbed onset of chaos. A route to
  ergodicity breakdown","5 pages, 1 figure","Physics Letters A 328, 467-472 (2004)","10.1016/j.physleta.2004.06.062",,"cond-mat.stat-mech nlin.CD",,"  The dynamics of iterates at the transition to chaos in one-dimensional
unimodal maps is shown to exhibit the characteristic elements of the glass
transition, e.g. two-step relaxation and aging. The properties of the
bifurcation gap induced by external noise, including a relationship between
relaxation time and entropy, are seen to be comparable to those of a
supercooled liquid above a glass transition temperature. Universal time
evolution obtained from the Feigenbaum RG transformation is expressed
analytically via $q$-exponentials, and interpreted in terms of nonextensive
statistics.
","[{""version"":""v1"",""created"":""Fri, 11 Jul 2003 16:59:45 GMT""}]","2013-08-29"
"cond-mat/0307286","Qing-Feng Sun","Qing-feng Sun, Hong Guo, Yupeng Wang","Anomalous Kondo effect of indirectly coupled double quantum dots","4 pages 3 figures",,,,"cond-mat.mes-hall",,"  We report theoretical investigations of indirectly coupled double quantum
dots (QD) side connected to an one-dimensional quantum wire. Due to quantum
interference controlled by the parameter $k_F L$, with $k_F$ the Fermi wave
number of the wire and $L$ the distance between the two QDs, distinctly
different Kondo resonances are predicted depending on the range of $k_F L$. A
true bound Kondo states is found while an anomalous Kondo resonance gives rise
to both reduction and enhancement of conductance.
","[{""version"":""v1"",""created"":""Fri, 11 Jul 2003 18:40:29 GMT""},{""version"":""v2"",""created"":""Tue, 4 Nov 2003 08:49:49 GMT""}]","2007-05-23"
"cond-mat/0307287","Konstantin Krutitsky","K.V.Krutitsky and R.Graham","Interference of atomic levels and superfluid -- Mott insulator phase
  transition in a two-component Bose-Einstein condensate",,"Phys.Rev.Lett. 91, 240406 (2003)","10.1103/PhysRevLett.91.240406",,"cond-mat quant-ph",,"  The superfluid -- Mott insulator phase transition in a Bose-Einstein
condensate of neutral atoms with doubly degenerate internal ground states in an
optical lattice is theoretically investigated. The optical lattice is created
by two counterpropagating linearly polarized laser beams with the angle
$\theta$ between the polarization vectors (lin-angle-lin configuration). The
phase diagram of the system and the critical values of the parameters are
worked out. It is shown that the sign of the detuning plays an important role
and that there is a strong suppression of the Mott transition in the case of
blue detuning. Varying the laser intensity and/or the angle $\theta$ one can
manipulate the Mott-insulator to superfluid quantum phase transition as well as
prepare the condensate in physically distinguishable ""ferromagnetic"" and
""antiferromagnetic"" superfluid states.
","[{""version"":""v1"",""created"":""Fri, 11 Jul 2003 16:08:01 GMT""},{""version"":""v2"",""created"":""Mon, 15 Dec 2003 11:46:29 GMT""}]","2009-11-10"
"cond-mat/0307288","Qing-Feng Sun","Wen Long, Qing-feng Sun, Hong Guo, Jian Wang","Gate-controllable spin-battery","3 pages, 3 figures, accepted by Appl. Phys. Lett","Appl. Phys. Lett. 83,1397 (2003)","10.1063/1.1603331",,"cond-mat.mes-hall",,"  We propose a gate-controllable spin-battery for spin current. The
spin-battery consists of a lateral double quantum dot under a uniform magnetic
field. A finite DC spin-current is driven out of the device by controlling a
set of gate voltages. Spin-current can also be delivered in the absence of
charge-current. The proposed device should be realizable using present
technology at low temperature.
","[{""version"":""v1"",""created"":""Fri, 11 Jul 2003 16:13:13 GMT""}]","2009-11-10"
"cond-mat/0307289","Emil Vasile Prodan","P. Nordlander and E. Prodan","Electronic structure and optical properties of metallic nanoshells",,,"10.1117/12.511665",,"cond-mat.mtrl-sci",,"  The electronic structure and optical properties of metallic nanoshells are
investigated using a jellium model and the Time Dependent Local Density
Approximation (TDLDA). An efficient numerical implementation enables
applications to nanoshells of realistic size with up to a million electrons. We
demonstrate how a frequency dependent background polarizability of the jellium
shell can be included in the TDLDA formalism. The energies of the plasmon
resonances are calculated for nanoshells of different sizes and with different
dielectric cores, dielectric embedding media, and dielectric shell backgrounds.
The plasmon energies are found to be in good agreement with the results from
classical Mie scattering theory using a Drude dielectric function. A comparison
with experimental data shows excellent agreement between theory and the
measured frequency dependent absorption spectra.
","[{""version"":""v1"",""created"":""Fri, 11 Jul 2003 16:22:18 GMT""}]","2009-11-10"
"cond-mat/0307290","Danuta Makowiec","D.Makowiec, P.Gnacinski, W.Miklaszeski","Amplified imitation in percolation model of stock market","lates + 12 files with figures",,"10.1016/j.physa.2003.09.014",,"cond-mat.stat-mech",,"  The herd behavior of the Cont Bouchaud model is amplified by allowing
clusters to copy decisions of some other cluster in the next time step. The
results of the model are compared to data from Warsaw Stock Exchange. It
follows that the mechanism of the amplified imitation could be responsible for
the sell decision on a poorly developed, emergent market.
","[{""version"":""v1"",""created"":""Fri, 11 Jul 2003 16:27:30 GMT""}]","2015-06-24"
"cond-mat/0307291","Yongyut Laosiritaworn","Y. Laosiritaworn, J. Poulter and J. B. Staunton","Mangetic properties of Ising thin-films with cubic lattices","18 pages, 9 figures, 2 tables",,"10.1103/PhysRevB.70.104413",,"cond-mat.stat-mech",,"  We have used Monte Carlo simulations to observe the magnetic behaviour of
Ising thin-films with cubic lattice structures as a function of temperature and
thickness especially in the critical region. The fourth order Binder cumulant
is used to extract critical temperatures, and an extension of finite size
scaling theory for reduced geometry is derived to calculate the critical
exponents. Magnetisation and magnetic susceptibility per spin in each layer are
also investigated. In addition, mean-field calculations are also performed for
comparison. We find that the magnetic behaviour changes from two dimensional to
three dimensional character with increasing thickness of the film. The
crossover of the critical temperature from a two dimensional to a bulk value is
also observed with both the Monte Carlo simulations and the mean-field
analysis. Nevertheless, the simulations have shown that the critical exponents
only vary a little from their two dimensional values. In particular, the
results for films with up to eight layers provide a strong indication of two
dimensional universality.
","[{""version"":""v1"",""created"":""Fri, 11 Jul 2003 16:52:40 GMT""}]","2009-11-10"
"cond-mat/0307292","Andrei Postnikov","A. V. Postnikov (1), Jens Kortus (2) and Stefan Bluegel (1 and 3) ((1)
  University of Osnabrueck,(2) Max-Planck Institut fuer Festkoerperforschung,
  Stuttgart, (3) Forschungszentrum Juelich - Germany)","Ab initio Simulations of Fe-based Ferric Wheels","10 pages, 3 embedded postscript figures, to be published in Molecular
  Physics Reports (proceedings of the Summer School on New Magnetics - Bedlewo,
  Poland, September 2003). Two references updated","Molecular Physics Reports 38, p.56-63 (2003)",,,"cond-mat.mtrl-sci",,"  Based on first-principles density-functional theory calculations we
investigate the electronic structure of hexanuclear ""ferric wheels"" M
Fe_6[N(CH_2 CH_2 O)_3]_6 Cl (M = Li, Na) in their antiferromagnetic ground
state. The electronic structure is presented in form of spin- and site-resolved
local densities of states. The latter clearly indicate that the magnetic moment
is distributed over several sites. The local moment at the iron site is still
the largest one with about 4 mu_B, thus indicating the valence state of iron to
be closer to Fe(II) than to commonly accepted Fe(III). The local spin of S=5/2
per iron site, following from magnetization measurements, is perfectly
reproduced if one takes the moments on the neighbor atoms into account. The
largest magnetic polarization is found on the apical oxygen atom, followed by
nitrogen bridging oxygens. These findings are confirmed by a map of spatial
spin density. A further goal of the present study has been a comparative test
of two different DFT implementations, Siesta and NRLMOL. They yield a very good
agreement down to small details in the electronic structure.
","[{""version"":""v1"",""created"":""Fri, 11 Jul 2003 17:58:37 GMT""},{""version"":""v2"",""created"":""Fri, 26 Sep 2003 17:22:01 GMT""}]","2007-05-23"
"cond-mat/0307293","Stephen Ducharme","Stephen Ducharme (Department of Physics and Astronomy, Center for
  Materials Research and Analysis, University of Nebraska, USA) and Vladimir
  Fridkin (Institute of Crystallography, Russian Academy of Sciences, Moscow)","Comment on: 'Depolarization corrections to the coercive field in
  thin-film ferroelectrics'","5 pages, 1 figure",,,,"cond-mat",,"  The Letter by Dawber et al. [J. Phys.: Condens. Matter 15 L393 (2003)] notes
that incomplete screening in the electrodes of a ferroelectric capacitor can
result in an underestimate for the true coercive field in films of nanometer
thickness. We show that their estimate of the magnitude of this correction it
too large in the case of ferroelectric copolymer Langmuir-Blodgett films and,
as a result, invalidates the claim that finite-size scaling of the
ferroelectric coercive field is evident in films thinner than 15 nm.
","[{""version"":""v1"",""created"":""Fri, 11 Jul 2003 18:34:23 GMT""}]","2007-05-23"
"cond-mat/0307294","Alexei Kaminski","A. Kaminski and S. Das Sarma","Magnetic and transport percolation in diluted magnetic semiconductors","9 pages, 5 figures",,"10.1103/PhysRevB.68.235210",,"cond-mat.mtrl-sci",,"  The ferromagnetic transition in a diluted magnetic semiconductor with
localized charge carriers is inevitably a percolation transition. In this work
we theoretically study the correlation between this magnetic percolation and
transport properties of the sample, including the possibility of a simultaneous
transport percolation. We find nontrivial signatures of the percolating
magnetic clusters in the transport properties of the system, including
interesting non-monotonic temperature dependence of the system resistivity.
","[{""version"":""v1"",""created"":""Fri, 11 Jul 2003 21:22:27 GMT""}]","2009-11-10"
"cond-mat/0307295","Udo Erdmann","Werner Ebeling and Udo Erdmann","Nonequilibrium statistical mechanics of swarms of driven particles","11 pages, 2 figures","Complexity, 8(4):23-30 (2003)","10.1002/cplx.10090",,"cond-mat.stat-mech physics.bio-ph",,"  As a rough model for the collective motions of cells and organisms we develop
here the statistical mechanics of swarms of self-propelled particles. Our
approach is closely related to the recently developed theory of active Brownian
motion and the theory of canonical-dissipative systems. Free motion and motion
of a swarms confined in an external field is studied. Briefly the case of
particles confined on a ring and interacting by repulsive forces is studied. In
more detail we investigate self-confinement by Morse-type attracting forces. We
begin with pairs N = 2; the attractors and distribution functions are
discussed, then the case N > 2 is discussed. Simulations for several dynamical
modes of swarms of active Brownian particles interacting by Morse forces are
presented. In particular we study rotations, drift, fluctuations of shape and
cluster formation.
","[{""version"":""v1"",""created"":""Fri, 11 Jul 2003 21:34:35 GMT""}]","2007-05-23"
"cond-mat/0307296","James P. Crutchfield","D. P. Varn and J. P. Crutchfield","From Finite to Infinite Range Order via Annealing: The Causal
  Architecture of Deformation Faulting in Annealed Close-Packed Crystals","7 pages, 6 figures; See
  http://www.santafe.edu/projects/CompMech/papers/iro.html",,"10.1016/j.physleta.2004.02.077",,"cond-mat.mtrl-sci cond-mat.stat-mech",,"  We analyze solid-state phase transformations that occur in zinc-sulfide
crystals during annealing using a random deformation-faulting mechanism with a
very simple interaction between adjacent close-packed double layers. We show
that, through annealing, infinite-range structures emerge from initially
short-range crystal order. That is, widely separated layers carry structurally
significant information and so layer stacking cannot be completely described by
any finite-range Markov process. We compare our results to two experimental
diffraction spectra, finding excellent agreement.
","[{""version"":""v1"",""created"":""Fri, 11 Jul 2003 22:50:18 GMT""}]","2009-11-10"
"cond-mat/0307297","Ramses van Zon","R. van Zon, E.G.D. Cohen","Comment on ``Reexamination of experimental tests of the fluctuation
  theorem"" by Narayan and Dhar","2 pages",,,,"cond-mat.stat-mech",,"  Our result in cond-mat/0305147 that, instead of the conventional heat
fluctuation theorem (FT), a new FT holds for heat fluctuations for a Brownian
particle in a moving confining potential[Wang et al. 2002], was claimed to be
disproved in a very recent preprint by Narayan and Dhar, cond-mat/0307148. This
comment is meant to show that their assertion is not correct. The point is that
they formulate their FT differently than we do ours. Effectively, their FT
speaks about a physically irrelevant limiting case of our new FT. This implies
that the two \FT s are not in contradiction with each other. Furthermore, we
point out an incorrect assumption in their derivation.
","[{""version"":""v1"",""created"":""Fri, 11 Jul 2003 23:42:40 GMT""}]","2007-05-23"
"cond-mat/0307298","Eugene V. Kholopov","Eugene V. Kholopov","Pyroelectric vector and related polarization effects","4 pages, 1 figure, 1 table, RevTeX4. Submitted to Physical Review
  Letters",,,,"cond-mat.mtrl-sci cond-mat.str-el math-ph math.MP",,"  The principal fact that the pyroelectric vector $\Pb^0$ typical of polar
crystals is invisible in equilibrium has been verified. Nevertheless, the
general formula for $\Pb^0$ as a definite bulk quantity associated only with
the inversion properties of a given charge distribution in the bulk has been
obtained. Its application to ferroelectric perovskites BaTiO$_3$, PbTiO$_3$,
and KNbO$_3$ is discussed.
","[{""version"":""v1"",""created"":""Sat, 12 Jul 2003 02:44:34 GMT""},{""version"":""v2"",""created"":""Mon, 15 Sep 2003 15:15:51 GMT""}]","2007-05-23"
"cond-mat/0307299","Michael Fogler","M. M. Fogler (UCSD), S.Teber (U MN), B. I. Shklovskii (U MN)","Variable-range hopping in quasi-one-dimensional electron crystals","20 pages, 7 figures. (v1) The abstract is abridged to 24 lines. For
  the full abstract, see the manuscript (v2) several changes in presentation
  per referee's comments. No change in results","Phys. Rev. B 69, 035413 (2004)","10.1103/PhysRevB.69.035413",,"cond-mat.mes-hall",,"  We study the effect of impurities on the ground state and the low-temperature
dc transport in a 1D chain and quasi-1D systems of many parallel chains. We
assume that strong interactions impose a short-range periodicicity of the
electron positions. The long-range order of such an electron crystal (or
equivalently, a $4 k_F$ charge-density wave) is destroyed by impurities. The 3D
array of chains behaves differently at large and at small impurity
concentrations $N$. At large $N$, impurities divide the chains into metallic
rods. The low-temperature conductivity is due to the variable-range hopping of
electrons between the rods. It obeys the Efros-Shklovskii (ES) law and
increases exponentially as $N$ decreases. When $N$ is small, the metallic-rod
picture of the ground state survives only in the form of rare clusters of
atypically short rods. They are the source of low-energy charge excitations. In
the bulk the charge excitations are gapped and the electron crystal is pinned
collectively. A strongly anisotropic screening of the Coulomb potential
produces an unconventional linear in energy Coulomb gap and a new law of the
variable-range hopping $-\ln\sigma \sim (T_1 / T)^{2/5}$. $T_1$ remains
constant over a finite range of impurity concentrations. At smaller $N$ the
2/5-law is replaced by the Mott law, where the conductivity gets suppressed as
$N$ goes down. Thus, the overall dependence of $\sigma$ on $N$ is nonmonotonic.
In 1D, the granular-rod picture and the ES apply at all $N$. The conductivity
decreases exponentially with $N$. Our theory provides a qualitative explanation
for the transport in organic charge-density wave compounds.
","[{""version"":""v1"",""created"":""Sat, 12 Jul 2003 04:10:08 GMT""},{""version"":""v2"",""created"":""Mon, 27 Oct 2003 19:26:00 GMT""}]","2007-05-23"
