"astro-ph/0307266","Paul Robert Shapiro","Paul R. Shapiro (University of Texas), Ilian T. Iliev (Osservatorio
  Astrofisico di Arcetri), and Alejandro C. Raga (Instituto de Ciencias
  Nucleares, UNAM)","Photoevaporation of Cosmological Minihalos during Reionization","34 pages, 34 figures, submitted to MNRAS. Computer animations at
  http://galileo.as.utexas.edu","Mon.Not.Roy.Astron.Soc.348:753,2004","10.1111/j.1365-2966.2004.07364.x",,"astro-ph",,"  We present the first gas dynamical simulations of the photoevaporation of
cosmological minihalos overtaken by the ionization fronts which swept through
the IGM during reionization in a LCDM universe, including the effects of
radiative transfer. We demonstrate the phenomenon of I-front trapping inside
minihalos, in which the weak, R-type fronts which traveled supersonically
across the IGM decelerated when they encountered the dense, neutral gas inside
minihalos, becoming D-type I-fronts, preceded by shock waves. For a minihalo
with virial temperature T_vir < 10^4 K, the I-front gradually burned its way
through the minihalo which trapped it, removing all of its baryonic gas by
causing a supersonic, evaporative wind to blow backwards into the IGM, away
from the exposed layers of minihalo gas just behind the advancing I-front. Such
hitherto neglected feedback effects were widespread during reionization. N-body
simulations and analytical estimates of halo formation suggest that sub-kpc
minihalos such as these, with T_vir < 10^4 K, were so common as to cover the
sky around larger-mass source halos and possibly dominate the absorption of
ionizing photons. This means that previous estimates of the number of ionizing
photons per H atom required to complete reionization which neglected this
effect may be too low. Regardless of their effect on the progress of
reionization, however, the minihalos were so abundant that random lines of
sight thru the high-z universe should encounter many of them, which suggests
that it may be possible to observe the processes described here in the
absorption spectra of distant sources.
","[{""version"":""v1"",""created"":""Sun, 13 Jul 2003 02:58:00 GMT""}]","2010-04-06"
"astro-ph/0307268","Eduardo L. Martin","Eduardo L. Martin and Maria Rosa Zapatero Osorio","Spectroscopic estimate of surface gravity for a planetary member in the
  Sigma Ori cluster","Accepted for publication in The Astrophysical Journal Letters","Astrophys.J.593:L113-L116,2003","10.1086/378313",,"astro-ph",,"  We present intermediate-resolution (R=1500) near-infrared spectroscopy from
1.17 $\mu$m to 1.37 $\mu$m of the spectral type T planetary candidate member in
the \sigori cluster S Ori 70 reported by Zapatero Osorio et al. (2002). The new
data have been obtained with NIRSPEC at the Keck II telescope. The best fit of
our mid-resolution spectrum of S Ori 70 with theoretical spectra gives log
g=3.5$\pm$0.5 cm s$^{-2}$ and T$_{\rm eff}$=1,100$^{+200}_{-100}$ K. The low
gravity of this object derived from spectral synthesis supports its youth and
membership to the young \sigori cluster. Using evolutionary models for an age
of 3 Myr, we obtain a mass of 3 \mjup and a radius of 0.16 $R_{\odot}$,
independent of the distance to the object. Our analysis confirms that S Ori 70
is the lowest mass cluster planet so far identified in the galaxy.
","[{""version"":""v1"",""created"":""Sun, 13 Jul 2003 04:00:39 GMT""}]","2009-11-10"
"astro-ph/0307269","Richard Woodard","R. P. Woodard","Fermion Self-Energy during Inflation","12 pages, LaTeX 2epsilon, 2 figures, Proceedings of XII International
  Conference on Selected Problems of Modern Physics, Dubna, June 8-11, 2003",,,"UFIFT-HEP-03-18","astro-ph hep-ph hep-th",,"  I report on work done with Tomislav Prokopec (Heidelberg, CERN). We computed
the one loop self-energy of a massless fermion during inflation. When the
fermion is free it experiences only a small amount of inflationary particle
production owing to the conformal invariance of its classical action. However,
when the fermion is Yukawa coupled to a massless, minimally coupled scalar,
there is copious production of fermions. In a more complicated model this
effect might generate baryon asymmetry during inflation.
","[{""version"":""v1"",""created"":""Sun, 13 Jul 2003 12:34:09 GMT""}]","2007-05-23"
"cond-mat/0307304","Kazuya Miyagawa","F. Kagawa, T. Itou, K. Miyagawa, K. Kanoda","Transport criticality of the first-order Mott transition in a
  quasi-two-dimensional organic conductor,
  $\kappa$-(BEDT-TTF)$_{2}$Cu[N(CN)$_{2}$]Cl","4 pages, 5 figures","Phys. Rev. B, 69, 064511 (2004)","10.1103/PhysRevB.69.064511",,"cond-mat.str-el",,"  An organic Mott insulator, $\kappa$-(BEDT-TTF)$_{2}$Cu[N(CN)$_{2}$]Cl, was
investigated by resistance measurements under continuously controllable He gas
pressure. The first-order Mott transition was demonstrated by observation of
clear jump in the resistance variation against pressure. Its critical endpoint
at 38 K is featured by vanishing of the resistive jump and critical divergence
in pressure derivative of resistance, $|\frac{1}{R}\frac{\partial R}{\partial
P}|$, which are consistent with the prediction of the dynamical mean field
theory and have phenomenological correspondence with the liquid-gas transition.
The present results provide the experimental basis for physics of the Mott
transition criticality.
","[{""version"":""v1"",""created"":""Sun, 13 Jul 2003 08:37:52 GMT""},{""version"":""v2"",""created"":""Thu, 18 Sep 2003 14:13:55 GMT""}]","2009-11-10"
"cond-mat/0307305","Mona Berciu","Mona Berciu and Boldizsar Janko","Nanoscale Zeeman localization of charge carriers in diluted magnetic
  semiconductor-permalloy hybrids","4 pages, 1 figure","Phys. Rev. Lett, 90, 246804 (2003)","10.1103/PhysRevLett.90.246804",,"cond-mat.mes-hall",,"  We investigate the possibility of charge carrier localization in magnetic
semiconductors due to the presence of a highly inhomogeneous external magnetic
field. As an example, we study in detail the properties of a magnetic
semiconductor-permalloy disk hybrid system. We find that the giant Zeeman
respose of the magnetic semiconductor in conjuction with the highly non-uniform
magnetic field created by the vortex state of a permalloy disk can lead to
Zeeman localized states at the interface of the two materials. These trapped
state are chiral, with chirality controlled by the orientation of the core
magnetization of the permalloy disk. We calculate the energy spectrum and the
eigenstates of these Zeeman localized states, and discuss their experimental
signatures in spectroscopic probes.
","[{""version"":""v1"",""created"":""Sat, 12 Jul 2003 17:07:01 GMT""}]","2009-11-10"
"cond-mat/0307307","Taro Yamashita","Taro Yamashita, Saburo Takahashi, and Sadamichi Maekawa","Crossed Andreev Reflection in Structures Consisting of a Superconductor
  with Ferromagnetic Leads","9 pages, 9 figures",,"10.1103/PhysRevB.68.174504",,"cond-mat.mes-hall cond-mat.supr-con",,"  A theory of crossed Andreev reflection in structures consisting of a
superconductor with two ferromagnetic leads is presented. The electric current
due to the crossed Andreev reflection strongly depends on the relative
orientation of the magnetization of two ferromagnetic leads. It is shown that
the dependence of the electric current and the magnetoresistance on the
distance between two ferromagnetic leads is understood by considering the
interference between the wave functions in ferromagnets. The current and the
magnetoresistance are calculated as functions of the exchange field and the
height of the interfacial barriers.
","[{""version"":""v1"",""created"":""Sun, 13 Jul 2003 06:21:46 GMT""},{""version"":""v2"",""created"":""Tue, 26 Oct 2004 08:49:18 GMT""}]","2009-11-10"
"cond-mat/0307308","Joseph Klafter","Iddo Eliazar and Joseph klafter","On the Extreme Flights of One-Sided Levy Processes","21 pages. This manuscript is an extended version of a contribution to
  a special Physica A volume in honor of Shlomo Havlin on his sixtieth birthday",,"10.1016/j.physa.2003.08.024",,"cond-mat.stat-mech",,"  We explore the statistical behavior of the order statistics of the flights of
One-sided Levy Processes (OLPs). We begin with the study of the extreme flights
of general OLPs,and then focus on the class of selfsimilar
processes,investigating the following issues:(i)the inner hierarchy of the
extreme flights - for example:how big is the 7th largest flight relative to the
2nd largest one?; and,(ii)the relative contribution of the extreme flights to
the entire 'flight aggregate' - for example: how big is the 3rd largest flight
relative to the OLP's value?. Furthermore, we show that all 'hierarchical'
results obtained - but not the 'aggregate' results - are explicitly extendable
to the class of OLPs with arbitrary power-law flight tails (which is far larger
than the selfsimilar class).
","[{""version"":""v1"",""created"":""Sun, 13 Jul 2003 13:45:28 GMT""}]","2015-06-24"
"cond-mat/0307309","Gopalan Srinivasan","G. Srinivasan, E. T. Rasmussen, A.A. Bush, K.E. Kamentsev, V.F.
  Meshcheryakov, and Y.K. Fetisov","Structural and magnetoelectric properties of MFe2O4-PZT (M=Ni,Co) and
  (La)x(Ca,Sr)1-x - PZT multilayers",,"Applied Physics A (Jan. 2003)","10.1007/s00339-002-1987-2",,"cond-mat.mtrl-sci",,"  Thick film layered magnetoelectric composites consisting of ferromagnetic and
ferroelectric phases have been synthesized with nickel ferrite (NFO), cobalt
ferrite (CFO), La0.7Sr0.3MnO3 (LSMO), or La0.7Ca0.3MnO3 (LCMO) and lead
zirconate titanate (PZT). Structural, magnetic and ferromagnetic resonance
characterization shows evidence for defect free ferrites, but deterioration of
manganite parameters. The resistivity and dielectric constants are smaller than
expected values. The magnetoelectric effect (ME) is stronger in ferrite-PZT
than in manganite-PZT. The ME voltage coefficient aE at room temperature is the
highest in NFO-PZT and the smallest for LCMO-PZT. The transverse ME effect is
an order of magnitude stronger than the longitudinal effect. The magnitude of
aE correlates well with magnetic permeability for the ferrites.
","[{""version"":""v1"",""created"":""Sun, 13 Jul 2003 14:08:04 GMT""}]","2009-11-10"
"cond-mat/0307310","J\""urgen R\""ohler","J. R\""ohler","On self-protecting singlets in cuprate superconductors","reviewed version, 7 pages, 10 figures","J. Superconductivity 17, 157 (2004)","10.1023/B:JOSC.0000011860.19159.2d",,"cond-mat.supr-con cond-mat.str-el",,"  The basal area (Cu-Cu grid) of the cuprate superconductors not only tends to
shrink on hole doping, as expected from single electron quantum chemistry, but
exhibits also an electronically incompressible ""hump'' around optimum doping
n_opt = 0.16. The hump collapses near critical doping n_crit = 0.19. We analyze
the origin of the hump in terms of a classical liquid of interacting
incompressible particles in a container with antiferromagnetic walls. Oxygen
holes interacting with the wall form singlets, protect themselves against other
holes by an incompressible ""spin fence'', and thus interact also with the
lattice. Occupation of the CuO_2 lattice with holes must therefore follow a
non-double-occupant constraint also for the oxygen cage enclosing the copper
hole. Closest packing of self-protecting singlets is found to occur around
critical doping; closest packing of paired self-protecting singlets around
optimum doping. These singlet-states are bosonic, but are not magnetic
polarons.
","[{""version"":""v1"",""created"":""Sun, 13 Jul 2003 15:04:26 GMT""},{""version"":""v2"",""created"":""Wed, 17 Dec 2003 17:03:15 GMT""}]","2009-11-10"
"cond-mat/0307311","Elisabeth Nicol","E.J. Nicol, J.P. Carbotte","Comparison of s- and d-wave gap symmetry in nonequilibrium
  superconductivity","14 pages, 11 figures","Phys. Rev. B, vol. 67, 214506 (2003).","10.1103/PhysRevB.67.214506",,"cond-mat.supr-con",,"  Recent application of ultrafast pump/probe optical techniques to
superconductors has renewed interest in nonequilibrium superconductivity and
the predictions that would be available for novel superconductors, such as the
high-Tc cuprates. We have reexamined two of the classical models which have
been used in the past to interpret nonequilibrium experiments with some
success: the mu* model of Owen and Scalapino and the T* model of Parker.
Predictions depend on pairing symmetry. For instance, the gap suppression due
to excess quasiparticle density n in the mu* model, varies as n^{3/2} in d-wave
as opposed to n for s-wave. Finally, we consider these models in the context of
S-I-N tunneling and optical excitation experiments. While we confirm that
recent pump/probe experiments in YBCO, as presently interpreted, are in
conflict with d-wave pairing, we refute the further claim that they agree with
s-wave.
","[{""version"":""v1"",""created"":""Sun, 13 Jul 2003 15:41:08 GMT""}]","2009-11-10"
"cs/0307034","Pat Morin","Danny Krizanc, Pat Morin and Michiel Smid","Range Mode and Range Median Queries on Lists and Trees","12 pages, 6 figures",,,,"cs.DS",,"  We consider algorithms for preprocessing labelled lists and trees so that,
for any two nodes u and v we can answer queries of the form: What is the mode
or median label in the sequence of labels on the path from u to v.
","[{""version"":""v1"",""created"":""Sat, 12 Jul 2003 21:41:56 GMT""}]","2007-05-23"
"cs/0307035","Pavel Motuzenko","Pavel Motuzenko","Adaptive Domain Model: Dealing With Multiple Attributes of Self-Managing
  Distributed Object Systems","6 pages, 3 figures",,,,"cs.AR cs.DC",,"  Self-managing software has emerged as modern systems have become more
complex. Some of the distributed object systems may contain thousands of
objects deployed on tens or even hundreds hosts. Development and support of
such systems often costs a lot. To solve this issue the systems, which are
capable supporting multiple self-managing attributes, should be created. In the
paper, the Adaptive domain concept is introduced as an extension to the basic
domain concept to support a generic adaptation environment for building
distributed object systems with multiple self-managing attributes.
","[{""version"":""v1"",""created"":""Sun, 13 Jul 2003 13:01:19 GMT""}]","2007-05-23"
"gr-qc/0307063","Yakov Itin","Yakov Itin and Friedrich W. Hehl","Maxwell's field coupled nonminimally to quadratic torsion: Induced axion
  field and birefringence of the vacuum","6 pages","Phys.Rev. D68 (2003) 127701","10.1103/PhysRevD.68.127701",,"gr-qc",,"  We consider a possible (parity conserving) interaction between the
electromagnetic field $F$ and a torsion field $T^\alpha$ of spacetime. For
generic elementary torsion, gauge invariant coupling terms of lowest order fall
into two classes that are both nonminimal and {\it quadratic} in torsion. These
two classes are displayed explicitly. The first class of the type $\sim F T^2$
yields (undesirable) modifications of the Maxwell equations. The second class
of the type $\sim F^2 T^2$ doesn't touch the Maxwell equations but rather
modifies the constitutive tensor of spacetime. Such a modification can be
completely described in the framework of metricfree electrodynamics. We
recognize three physical effects generated by the torsion: (i) An axion field
that induces an {\em optical activity} into spacetime, (ii) a modification of
the light cone structure that yields {\em birefringence} of the vacuum, and
(iii) a torsion dependence of the {\em velocity of light.} We study these
effects in the background of a Friedmann universe with torsion. {\it File
tor17.tex, 02 August 2003}
","[{""version"":""v1"",""created"":""Sun, 13 Jul 2003 08:48:43 GMT""},{""version"":""v2"",""created"":""Sun, 3 Aug 2003 14:19:06 GMT""}]","2009-11-10"
"hep-ex/0307027","Rudolf Oldeman","R. G. C. Oldeman (University of Pennsylvania, Philadelphia) (for the
  CDF collaboration)","Performance of CDF for B physics","Invited talk at the Workshop on the CKM Unitarity Triangle, IPPP
  Durham, April 2003 (eConf C0304052). 4 pages LaTeX, 2 eps figures","ECONF C0304052:FO005,2003",,"FERMILAB-CONF-03-156-E","hep-ex",,"  Hadron colliders can be an abundant source of heavy flavor quarks, but pose a
challenge to isolate the physics signals from the high backgrounds. The
upgraded CDF II detector, with its precise tracking capabilities and powerful
trigger system, is well equipped for this task. The detector is described with
an emphasis on actual performance and on techniques to maximize the heavy
flavor yield. Some first heavy flavor results are summarized.
","[{""version"":""v1"",""created"":""Sat, 12 Jul 2003 16:56:20 GMT""}]","2019-08-14"
"hep-ph/0307169","Shin'ichiro Ando","Shin'ichiro Ando","Decaying neutrinos and implications from the supernova relic neutrino
  observation","15 pages, 2 figures, corrected typos, added references. Final version
  to appear in Physics Letters B","Phys.Lett. B570 (2003) 11","10.1016/j.physletb.2003.07.009","UTAP-453","hep-ph astro-ph",,"  We propose that supernova relic neutrino (SRN) observation can be used to set
constraints on the neutrino decay models. Because of the long distance scale
from cosmological supernovae to the Earth, SRN have possibility to provide much
stronger limit than the present one obtained from solar neutrino observation.
Since the currently available data are only the upper limit on the flux
integrated over $E_{\bar\nu_e}>19.3$ MeV, the decay models on which we can set
constraints is quite restricted; they must satisfy specific conditions such
that the daughter neutrinos are active species, the neutrino mass spectrum is
quasi-degenerate, and the neutrino mass hierarchy is normal. Our numerical
calculation clearly indicates that the neutrino decay model with
$(\tau_2/m,\tau_3/m)\alt (10^{10},10^{10})$ [s/eV], where $\tau_i$ represents
the lifetime of mass eigenstates $\bar\nu_i$, appears to give the SRN flux that
is larger than the current upper limit. However, since the theoretical SRN
prediction contains many uncertainties concerning a supernova rate in the
universe or simulation of supernova explosions, we cannot conclude that there
exists the excluded parameter region of the neutrino lifetime. In the near
future, further reduced upper limit is actually expected, and it will provide
more severe constraints on the neutrino decay models.
","[{""version"":""v1"",""created"":""Sun, 13 Jul 2003 08:25:16 GMT""},{""version"":""v2"",""created"":""Thu, 7 Aug 2003 12:04:22 GMT""}]","2009-11-10"
"hep-ph/0307170","Brian G. Wybourne","B G Wybourne (UMK)","Group theory and the Pentaquark","8 pages, 3 figures, Latex, uses iopart, primarily of pedagogical
  interest Typos corrected and references updated and new references added.
  Minor text changes",,,,"hep-ph",,"  The group classification of exotic pentaquarks involving four standard quarks
and a single antiquark to produce pentaquarks of strangeness +1 is outlined.
","[{""version"":""v1"",""created"":""Sun, 13 Jul 2003 14:52:52 GMT""},{""version"":""v2"",""created"":""Mon, 21 Jul 2003 07:41:53 GMT""}]","2007-05-23"
"hep-th/0307118","Francesco Toppan","Francesco Toppan","Central extensions, classical non-equivariant maps and residual
  symmetries","8 pages, LaTex. Talk given at the International Conference
  ""Renormalization Group and Anomalies in Gravitation and Cosmology"", Ouro
  Preto, Brazil, March 2003. To appear in the Proceedings",,"10.1016/S0920-5632(03)02432-0","CBPF-NF-021/03","hep-th",,"  The arising of central extensions is discussed in two contexts. At first
classical counterparts of quantum anomalies (deserving being named as
""classical anomalies"") are associated with a peculiar subclass of the
non-equivariant maps. Further, the notion of ""residual symmetry"" for theories
formulated in given non-vanishing EM backgrounds is introduced. It is pointed
out that this is a Lie-algebraic, model-independent, concept.
","[{""version"":""v1"",""created"":""Sun, 13 Jul 2003 00:43:57 GMT""}]","2009-11-10"
"hep-th/0307119","Ichiro Oda","Ichiro Oda","Gravitational Localization of All Local Fields on the Brane","12 pages, no figures, Latex","Phys.Lett.B571:235-244,2003","10.1016/j.physletb.2003.07.076","EDO-EP-46","hep-th",,"  We present a new $(p - 1)$-brane solution to Einstein's equations in a
general space-time dimension. This solution is a natural generalization of the
stringlike defect solution with codimension 2 in 6 space-time dimensions, which
has been recently discovered by Gogberashvili and Singleton, to a general $(p -
1)$-brane solution with codimension $n$ in general $D = p + n$ space-time
dimensions. It is shown that all the local fields are localized on the brane
only through the gravitational interaction although this solution does not have
a warp factor and takes a finite value in the radial infinity. Thus, this
solution is a solution in an arbitrary space-time dimension realizing the idea
of ""gravitational trapping"" of the whole bulk fields on the brane within the
framework of a local field theory. Some problems associated with this solution
and localization are pointed out.
","[{""version"":""v1"",""created"":""Sun, 13 Jul 2003 07:29:17 GMT""}]","2011-07-19"
"hep-th/0307120","Takashi Okamura","Akira Kokado (1), Takashi Okamura (2) and Takesi Saito (2) ((1) Kobe
  Int. Univ., (2) Dept. of Phys., Kwansei Gakuin Univ.)","Hall effect in Noncommutative spaces","6 pages, no figure; v2: References added. Typos corrected",,,,"hep-th",,"  In order to investigate whether space coordinates are intrinsically
noncommutative, we make use of the Hall effect on the two-dimensional plane.
  We calculate the Hall conductivity in such a way that the noncommutative U(1)
gauge invariance is manifest. We find that the noncommutativity parameter theta
does not appear in the Hall conductivity itself, but the particle number
density of electron depends on theta.
  We point out that the peak of particle number density differs from that of
the charge density.
","[{""version"":""v1"",""created"":""Sun, 13 Jul 2003 14:43:20 GMT""},{""version"":""v2"",""created"":""Thu, 17 Jul 2003 06:39:33 GMT""}]","2007-05-23"
"math-ph/0307028","Louis Marchildon","Louis Marchildon","Lie Symmetries of Yang-Mills Equations","Published in 1995 in defunct journal. Posted now to make it more
  easily available","J. Group Theor. Phys. 3 (1995) 115-130",,,"math-ph math.MP",,"  We investigate Lie symmetries of general Yang-Mills equations. For this
purpose, we first write down the second prolongation of the symmetry generating
vector fields, and compute its action on the Yang-Mills equations. Determining
equations are then obtained, and solved completely. Provided that Yang-Mills
equations are locally solvable, this allows for a complete classification of
their Lie symmetries. Symmetries of Yang-Mills equations in the Lorentz gauge
are also investigated.
","[{""version"":""v1"",""created"":""Sun, 13 Jul 2003 14:24:12 GMT""}]","2015-05-26"
"math/0307182","Stewart Priddy","Malkhaz Bakuradze and Stewart Priddy","Transfer and complex oriented cohomology rings","Published by Algebraic and Geometric Topology at
  http://www.maths.warwick.ac.uk/agt/AGTVol3/agt-3-15.abs.html","Algebr. Geom. Topol. 3 (2003) 473-509","10.2140/agt.2003.3.473",,"math.AT",,"  For finite coverings we elucidate the interaction between transferred Chern
classes and Chern classes of transferred bundles. This involves computing the
ring structure for the complex oriented cohomology of various homotopy orbit
spaces. In turn these results provide universal examples for computing the
stable Euler classes (i.e. Tr^*(1)) and transferred Chern classes for p-fold
covers. Applications to the classifying spaces of p-groups are given.
","[{""version"":""v1"",""created"":""Sat, 12 Jul 2003 17:32:50 GMT""}]","2014-10-01"
"math/0307183","Vitaly Moroz","Vladimir Kondratiev, Vitali Liskevich, Vitaly Moroz, Zeev Sobol","A critical phenomenon for sublinear elliptic equations in cone-like
  domains","6 pages, 2 figures","Bull. Lond. Maths. Soc. 37 (2005), 585-591","10.1112/S0024609305004492",,"math.AP math.SP",,"  We study positive supersolutions to an elliptic equation $(*)$: $-\Delta
u=c|x|^{-s}u^p$, $p,s\in\bf R$ in cone-like domains in $\bf R^N$ ($N\ge 2$). We
prove that in the sublinear case $p<1$ there exists a critical exponent $p_*<1$
such that equation $(*)$ has a positive supersolution if and only if
$-\infty<p<p_*$. The value of $p_*$ is determined explicitly by $s$ and the
geometry of the cone.
","[{""version"":""v1"",""created"":""Sat, 12 Jul 2003 18:04:22 GMT""}]","2018-07-31"
"math/0307184","Andrea Altomani","Andrea Altomani and Mauro Nacinovich","Abelian extensions of semisimple graded CR algebras","25 pages, 5 figures","Adv. Geom. 4, No. 4, 433-457 (2004)","10.1515/advg.2004.4.4.433",,"math.RA math.CV math.RT",,"  In this paper we take up the problem of describing the CR vector bundles M
over compact standard CR manifolds S, which are themselves standard CR
manifolds. They are associated to special graded Abelian extensions of
semisimple graded CR algebras.
","[{""version"":""v1"",""created"":""Sat, 12 Jul 2003 20:11:05 GMT""}]","2009-02-18"
"nucl-th/0307057","Pravat  Kumar Jena","P.K.Jena and L.P.Singh (Utkal Univ., India)","SU(2) Chiral Sigma Model Study of Phase Transition in Hybrid Stars","14 pages, 5 figures","Mod.Phys.Lett. A18 (2003) 2135-2146","10.1142/S0217732303011976",,"nucl-th",,"  We use a modified SU(2) chiral sigma model to study nuclear matter component
and simple bag model for quark matter constituting a neutron star. We also
study the phase transition of nuclear matter to quark matter with the mixed
phase characterized by two conserved charges in the interior of highly dense
neutron stars. Stable solutions of Tolman-Oppenheimer-Volkoff equations
representing hybrid stars are obtained with a maximum mass of 1.67$M_{\odot}$
and radius around 8.9 km.
","[{""version"":""v1"",""created"":""Sun, 13 Jul 2003 04:26:56 GMT""}]","2009-11-10"
