"nucl-th/0307058","Yu-Xin Liu","Yu-xin Liu, Dong-feng Gao, Jian-hang Zhou, Hua Guo","Reevaluation of the density dependence of nucleon radius and mass in the
  global color symmetry model of QCD","18 pages, 3 figures","Nucl.Phys. A725 (2003) 127-138","10.1016/S0375-9474(03)01574-4",,"nucl-th",,"  With the global color symmetry model (GCM) at finite chemical potential, the
density dependence of the bag constant, the total energy and the radius of a
nucleon in nuclear matter is investigated. A relation between the nuclear
matter density and the chemical potential with the action of QCD being taken
into account is obtained. A maximal nuclear matter density for the existence of
the bag with three quarks confined within is given. The calculated results
indicate that, before the maximal density is reached, the bag constant and the
total energy of a nucleon decrease, and the radius of a nucleon increases
slowly, with the increasing of the nuclear matter density. As the maximal
nuclear matter density is reached, the mass of the nucleon vanishes and the
radius becomes infinite suddenly. It manifests that a phase transition from
nucleons to quarks takes place.
","[{""version"":""v1"",""created"":""Sun, 13 Jul 2003 13:28:38 GMT""}]","2009-11-10"
"physics/0307068","Keang-Po Ho","Keang-Po Ho","Phase Statistics of Soliton","8 pages, submitted to JOSA B","Journal of the Optical Society of America B: Optical Physics, vol.
  21, no. 2, pp. 266-272, February 2004","10.1364/JOSAB.21.000266",,"physics.optics",,"  The characteristic function of soliton phase jitter is found analytically
when the soliton is perturbed by amplifier noise. In additional to that from
amplitude jitter, the nonlinear phase noise due to frequency and timing jitter
is also analyzed. Because the nonlinear phase noise is not Gaussian
distributed, the overall phase jitter is also non-Gaussian. For a fixed mean
nonlinear phase shift, the contribution of nonlinear phase noise from frequency
and timing jitter decreases with distance and signal-to-noise ratio.
","[{""version"":""v1"",""created"":""Sun, 13 Jul 2003 09:15:11 GMT""}]","2013-01-15"
"quant-ph/0307090","Edward R. Floyd","Edward R. Floyd","Differences between the trajectory representation and Copenhagen
  regarding the past and present in quantum theory","4 pages REVTEX4. No figures. Submitted to ""Proceedings for the Eighth
  International Wigner Symposium"" (WYGSYM 8), 27-30 May 2003, CUNY, NY, NY",,,,"quant-ph hep-th",,"  We examine certain pasts and presents in the classically forbidden region. We
show that for a given past the trajectory representation does not permit some
presents while the Copenhagen predicts a finite probability for these presents
to exist. This suggests another gedanken experiment to invalidate either
Copenhagen or the trajectory representation.
","[{""version"":""v1"",""created"":""Sat, 12 Jul 2003 17:17:58 GMT""}]","2007-05-23"
"quant-ph/0307091","Aram Harrow","Aram W. Harrow","Coherent Communication of Classical Messages","5 pages, revtex, v2: updated references, v3: changed title, fixed
  error in eq (10)","Phys. Rev. Lett. 92, 097902 (2004)","10.1103/PhysRevLett.92.097902",,"quant-ph",,"  We define ""coherent communication"" in terms of a simple primitive, show it is
equivalent to the ability to send a classical message with a unitary or
isometric operation, and use it to relate other resources in quantum
information theory. Using coherent communication, we are able to generalize
super-dense coding to prepare arbitrary quantum states instead of only
classical messages. We also derive single-letter formulae for the classical and
quantum capacities of a bipartite unitary gate assisted by an arbitrary fixed
amount of entanglement per use.
","[{""version"":""v1"",""created"":""Sat, 12 Jul 2003 23:30:49 GMT""},{""version"":""v2"",""created"":""Mon, 25 Aug 2003 15:06:35 GMT""},{""version"":""v3"",""created"":""Fri, 9 Jan 2004 21:20:12 GMT""}]","2009-11-10"
