"cond-mat/0307562","Matthias Sperl","Matthias Sperl","Logarithmic Relaxation in a Colloidal System","13 pages, 13 figures, Phys. Rev. E, in print","Phys. Rev. E 68, 031405 (2003)","10.1103/PhysRevE.68.031405",,"cond-mat.soft",,"  The slow dynamics for a colloidal suspension of particles interacting with a
hard-core repulsion complemented by a short-ranged attraction is discussed
within the frame of mode-coupling theory for ideal glass transitions for
parameter points near a higher-order glass-transition singularity. The
solutions of the equations of motion for the density correlation functions are
solved for the square-well system in quantitative detail by asymptotic
expansion using the distance of the three control parameters packing fraction,
attraction strength and attraction range from their critical values as small
parameters. For given wave vectors, distinguished surfaces in parameter space
are identified where the next-to-leading order contributions for the expansion
vanish so that the decay functions exhibit a logarithmic decay over large time
intervals. For both coherent and tagged particle dynamics the leading-order
logarithmic decay is accessible in the liquid regime for wave vectors of
several times the principal peak in the structure factor. The logarithmic decay
in the correlation function is manifested in the mean-squared displacement as a
subdiffusive power law with an exponent varying sensitively with the control
parameters. Shifting parameters through the distinguished surfaces, the
correlation functions and the logarithm of the mean-squared displacement
considered as functions of the logarithm of the time exhibit a crossover from
concave to convex behavior, and a similar scenario is obtained when varying the
wave vector.
","[{""version"":""v1"",""created"":""Wed, 23 Jul 2003 08:23:08 GMT""}]","2007-05-23"
"cond-mat/0307563","Ryusuke Ikeda","Ryusuke Ikeda","Absence of Quantum Metallic Behavior in Disordered Granular
  Superconductors","4 pages, no figures",,,,"cond-mat.supr-con",,"  We examine the idea, postulated by Phillips et al., that a finite resistivity
in $T \to 0$ limit in disordered granular superconducting (SC) films is
explained as a consequence of the absence of phase stiffness in a phase glass
(PG) peculiar to granular systems. It is found that a coupling between the
nonzero PG order and the ordinary SC fluctuation makes the conductivity
divergent. However, an actual drop of resistivity is argued to occur due to
another SC glass ordering, induced by the precursory PG fluctuation,
corresponding to the vortex-glass transition in a nonzero magnetic field.
","[{""version"":""v1"",""created"":""Wed, 23 Jul 2003 09:06:44 GMT""}]","2007-05-23"
"cond-mat/0307564","Can-Ming Hu","K. Bittkau, Ch. Menk, Ch. Heyn, D. Heitmann, and C. -M. Hu","Far-infrared photo-conductivity of electrons in an array of
  nano-structured antidots","5 pages, 3 figures","Phys. Rev. B 68, 195303 (2003).","10.1103/PhysRevB.68.195303",,"cond-mat.mes-hall",,"  We present far-infrared (FIR) photo-conductivity measurements for a
two-dimensional electron gas in an array of nano-structured antidots. We
detect, resistively and spectrally resolved, both the magnetoplasmon and the
edge-magnetoplasmon modes. Temperature-dependent measurements demonstrates that
both modes contribute to the photo resistance by heating the electron gas via
resonant absorption of the FIR radiation. Influences of spin effect and phonon
bands on the collective excitations in the antidot lattice are observed.
","[{""version"":""v1"",""created"":""Wed, 23 Jul 2003 09:20:35 GMT""}]","2009-11-10"
"cond-mat/0307566","Horacio Wio","Jorge A. Revelli (CAB-IB, Argentina), Carlos. E. Budde (FAMAF-UNC,
  Argentina) and Horacio S. Wio (CAB-IB, Argentina, and IMEDEA, Spain)","Diffusion in Fluctuating Media: The Resonant Activation Problem","RevTex, 15 pgs, 8 figures, submitted to Eur.Phys.J.B",,,,"cond-mat.stat-mech cond-mat.dis-nn",,"  We present a one-dimensional model for diffusion in a fluctuating lattice;
that is a lattice which can be in two or more states. Transitions between the
lattice states are induced by a combination of two processes: one periodic
deterministic and the other stochastic. We study the dynamics of a system of
particles moving in that medium, and characterize the problem from different
points of view: mean first passage time (MFPT), probability of return to a
given site ($P_{s_0}$), and the total length displacement or number of visited
lattice sites ($\Lambda$). We observe a double {\it resonant activation}-like
phenomenon when we plot the MFPT and $P_{s_0}$ as functions of the intensity of
the transition rate stochastic component.
","[{""version"":""v1"",""created"":""Wed, 23 Jul 2003 10:28:54 GMT""}]","2007-05-23"
"cond-mat/0307567","Graeme J. Ackland","G.J.Ackland","Maximisation Principles and Daisyworld","17 pages 6 figures",,,,"cond-mat.stat-mech cond-mat.dis-nn q-bio",,"  We investigate whether the equilibrium time averaged state of a
self-organising system with many internal degrees of freedom, 2D- daisyworld,
can be described by optimising a single quantity. Unlike physical systems where
a principle of maximum energy production has been observed, Daisyworld follows
evolutionary dynamics rather than Hamiltonian dynamics. We find that this is
sufficient to invalidate the MEP principle, finding instead a different
principle, that the system self-organises to a state which maximises the amount
of life.
","[{""version"":""v1"",""created"":""Wed, 23 Jul 2003 10:46:05 GMT""}]","2007-05-23"
"cond-mat/0307568","Mats Jonson","L. Y. Gorelik, S. I. Kulinich, R. I. Shekhter, and M. Jonson","Resonant microwave properties of a voltage-biased single-Cooper-pair
  transistor","6 pages, 4 figures",,"10.1103/PhysRevB.69.094516",,"cond-mat.mes-hall",,"  We consider the microwave dynamics and transport properties of a
voltage-biased single-Cooper-pair transistor. The dynamics is shown to be
strongly affected by interference between multiple microwave-induced
inter-level transitions. As a result the magnitude and direction of the dc
Josephson current are extremely sensitive to small variations of the bias
voltage and to changes in the frequency of the microwave field.
","[{""version"":""v1"",""created"":""Wed, 23 Jul 2003 11:12:22 GMT""}]","2009-11-10"
"cond-mat/0307569","Olivier Rivoire","O. Rivoire, G. Biroli, O. C. Martin, M. Mezard","Glass models on Bethe lattices","24 pages, 11 figures; minor corrections + enlarged introduction and
  conclusion","Eur. Phys. J. B 37, 55-78 (2004)","10.1140/epjb/e2004-00030-4",,"cond-mat.stat-mech",,"  We consider ``lattice glass models'' in which each site can be occupied by at
most one particle, and any particle may have at most l occupied nearest
neighbors. Using the cavity method for locally tree-like lattices, we derive
the phase diagram, with a particular focus on the vitreous phase and the
highest packing limit. We also study the energy landscape via the
configurational entropy, and discuss different equilibrium glassy phases.
Finally, we show that a kinetic freezing, depending on the particular dynamical
rules chosen for the model, can prevent the equilibrium glass transitions.
","[{""version"":""v1"",""created"":""Wed, 23 Jul 2003 12:02:59 GMT""},{""version"":""v2"",""created"":""Thu, 18 Dec 2003 19:08:36 GMT""}]","2015-06-24"
"cond-mat/0307570","Heinrichs Jean","J. Heinrichs","Conductance and localization in disordered wires: role of evanescent
  states",,"Phys.Rev.B 68 155403 (2003)","10.1103/PhysRevB.68.155403",,"cond-mat.dis-nn",,"  This paper extends an earlier analytical scattering matrix treatment of
conductance and localization in coupled two- and three Anderson chain systems
for weak disorder when evanescent states are present at the Fermi level. Such
states exist typically when the interchain coupling exceeds the width of
propagating energy bands associated with the various transverse eigenvalues of
the coupled tight-binding systems. We calculate reflection- and transmission
coefficients in cases where, besides propagating states, one or two evanescent
states are available at the Fermi level for elastic scattering of electrons by
the disordered systems. We observe important qualitative changes in these
coefficients and in the related localization lengths due to ineffectiveness of
the evanescent modes for transmission and reflection in the various scattering
channels. In particular, the localization lengths are generally significantly
larger than the values obtained when evanescent modes are absent. Effects
associated with disorder mediated coupling between propagating and evanescent
modes are shown to be suppressed by quantum interference effects, in lowest
order for weak disorder.
","[{""version"":""v1"",""created"":""Wed, 23 Jul 2003 12:13:11 GMT""}]","2009-11-10"
"cond-mat/0307571","Heinrichs Jean","J. Heinrichs","Exact transmission moments in one-dimensional weak localization and
  single-parameter scaling",,"J.Phys.:Condens. Matter 15 (2003) 6969-6975","10.1088/0953-8984/15/41/006",,"cond-mat.dis-nn",,"  We obtain for the first time the expressions for the mean and the variance of
the transmission coefficient for an Anderson chain in the weak localization
regime, using exact expansions of the complex transmission- and reflection
coefficients to fourth order in the weakly disordered site energies. These
results confirm the validity of single-parameter scaling theory in a domain
where the higher transmission cumulants may be neglected. We compare our
results with earlier results for transmission cumulants in the weak
localization domain based on the phase randomization hypothesis.
","[{""version"":""v1"",""created"":""Wed, 23 Jul 2003 12:19:37 GMT""}]","2009-11-10"
"cond-mat/0307572","Heinrichs Jean","J. Heinrichs","The scaling of conductance in the Anderson model of localization in one
  dimension is a two-parameter scaling",,,,,"cond-mat.dis-nn",,"  The cumulants of the logarithm of the conductance (lng) in the localized
regime in the one-dimensional Anderson model are calculated exactly in the
second Born approximation for weak disorder. Only the first two cumulants turn
out to ne non-zero since the third and fourth cumulants vanish identically and
the higher cumulants are of higher order in the disorder. The variance and the
mean of lng vary linearly with length $L$ while their ratio is proportional to
the inverse localization length. The resulting exact log-normal distribution of
conductance thus corresponds to a special form of two-parameter scaling. This
contradicts the standard one-parameter scaling in the random phase
approximation.
","[{""version"":""v1"",""created"":""Wed, 23 Jul 2003 12:22:50 GMT""}]","2007-05-23"
"cond-mat/0307573","Tomasz Dietl","Tomasz Dietl","Spin order manipulations in nanostructures of II-VI ferromagnetic
  semiconductors","6 pages, 7 figures, Proceedings International Conference on
  Magnetism, Rome 2003, J. Magn. Magn. Mater., in press","J. Magn. Magn. Materials 272-276 (2004) 1969.","10.1016/j.jmmm.2003.12.323",,"cond-mat.mtrl-sci",,"  An overview of recent studies on ferromagnetism in Cr- and Mn-based II-VI
diluted magnetic semiconductors is presented emphasizing differences in
underlying exchange mechanisms. Examples of manipulations with spin ordering by
carrier density, dimensionality, light, and electric field are given.
","[{""version"":""v1"",""created"":""Wed, 23 Jul 2003 12:23:27 GMT""}]","2009-11-10"
"cond-mat/0307574","Marconi Barbosa Dr","Marconi Soares Barbosa and Luciano da Fontoura Costa and Esmerindo de
  Sousa Bernardes","Neuromorphometric characterization with shape functionals",,"Physical Review E 67 061910 (2003)","10.1103/PhysRevE.67.061910",,"cond-mat q-bio.NC",,"  This work presents a procedure to extract morphological information from
neuronal cells based on the variation of shape functionals as the cell geometry
undergoes a dilation through a wide interval of spatial scales. The targeted
shapes are alpha and beta cat retinal ganglion cells, which are characterized
by different ranges of dendritic field diameter. Image functionals are expected
to act as descriptors of the shape, gathering relevant geometric and
topological features of the complex cell form. We present a comparative study
of classification performance of additive shape descriptors, namely, Minkowski
functionals, and the nonadditive multiscale fractal. We found that the proposed
measures perform efficiently the task of identifying the two main classes alpha
and beta based solely on scale invariant information, while also providing
intraclass morphological assessment.
","[{""version"":""v1"",""created"":""Wed, 23 Jul 2003 12:59:02 GMT""}]","2009-11-10"
"cond-mat/0307576","Douglas Natelson","L.H. Yu and D. Natelson","Density of states and magnetoconductance of disordered Au point contacts","5 pages, 5 figures. Accepted to PRB as Brief Report",,"10.1103/PhysRevB.68.113407",,"cond-mat.mes-hall cond-mat.dis-nn",,"  We report the first low temperature magnetotransport measurements on
electrochemically fabricated atomic scale gold nanojunctions. As $T \to 0$, the
junctions exhibit nonperturbatively large zero bias anomalies (ZBAs) in their
differential conductance. We consider several explanations and find that the
ZBAs are consistent with a reduced local density of states (LDOS) in the
disordered metal. We suggest that this is a result of Coulomb interactions in a
granular metal with moderate intergrain coupling. Magnetoconductance of atomic
scale junctions also differs significantly from that of less geometrically
constrained devices, and supports this explanation.
","[{""version"":""v1"",""created"":""Wed, 23 Jul 2003 13:05:21 GMT""}]","2009-11-10"
"cond-mat/0307577","Alessandro Torcini","Lorenzo Bongini, Roberto Livi, Alessandro Torcini, Antonio Politi","Thermally activated processes in polymer dynamics","16 pages, Revtex - 19 EPS Figs - Submitted to Phys. Rev. E","Phys. Rev. E, 68 (2003) 061111","10.1103/PhysRevE.68.061111",,"cond-mat.stat-mech cond-mat.soft q-bio.BM",,"  Jumps between neighboring minima in the energy landscape of both
homopolymeric and heteropolymeric chains are numerically investigated by
determining the average escape time from different valleys. The numerical
results are compared to the theoretical expression derived by Langer [J.S.
Langer, Ann. Phys. 54 (1969) 258] with reference to a 2N-dimensional space. Our
simulations indicate that the dynamics within the native valley is well
described by a sequence of thermally activated process up to temperatures well
above the folding temperature. At larger temperatures, systematic deviations
from the Langer's estimate are instead observed. Several sources for such
discrepancies are thoroughly discussed.
","[{""version"":""v1"",""created"":""Wed, 23 Jul 2003 14:05:32 GMT""}]","2007-05-23"
"cond-mat/0307578","Efrat Shimshoni","Natan Andrei (Rutgers), Efrat Shimshoni (U of Haifa at Oranim) and
  Achim Rosch (Karlsruhe)","Low Temperature Transport Properties of Strongly Interacting Systems-
  Thermal Conductivity of Spin-1/2 Chains","6 pages, 6 colored figures; to appear in the proceedings of
  ""Highlights in CMP"", May 2003, Salerno, Italy",,"10.1063/1.1639599",,"cond-mat.str-el",,"  We outline a general approach to the computation of transport properties of
interacting systems at low temperetures and frequencies. We show that if the
fixed point and the irrelevant operators around it are known, then by studying
the structure of the softly violated conserved currents chracterizing the fixed
point one may set up an effective calculation in terms of a memory matrix
formalism. We apply this approach to the computation of thermal conductivity of
spin chains embedded in a matter matrix and interacting with its phonons. The
results are found to be in very good agreement with experiment.
","[{""version"":""v1"",""created"":""Wed, 23 Jul 2003 14:34:36 GMT""}]","2009-11-10"
"cond-mat/0307579","Barbara Drossel","Barbara Drossel and Mehran Kardar","Interplay between phase ordering and roughening on growing films","10 pages, 8 figures",,"10.1140/epjb/e2003-00359-0",,"cond-mat.stat-mech",,"  We study the interplay between surface roughening and phase separation during
the growth of binary films. Renormalization group calculations are performed on
a pair of equations coupling the interface height and order parameter
fluctuations. We find a larger roughness exponent at the critical point of the
order parameter compared to the disordered phase, and an increase in the upper
critical dimension for the surface roughening transition from two to four.
Numerical simulations performed on a solid-on-solid model with two types of
deposited particles corroborate some of these findings. However, for a range of
parameters not accessible to perturbative analysis, we find non-universal
behavior with a continuously varying dynamic exponent.
","[{""version"":""v1"",""created"":""Wed, 23 Jul 2003 14:53:29 GMT""}]","2009-11-10"
"cond-mat/0307581","Jay Kim","J.C. Kim, David G. Cahill, R.S. Averback","Formation and annihilation of nanocavities during keV ion irradiation of
  Ge","26 pages, 7 figures, to be published in Physical Review B",,"10.1103/PhysRevB.68.094109",,"cond-mat.mtrl-sci",,"  Nanocavities in Ge(111) created by 5 keV Xe ion irradiation are characterized
by ex situ transmission electron microscopy and Rutherford backscattering
spectrometry. Nanocavities nucleate near the surface and then undergo thermal
migration. Nanocavities with average diameter of 10 nm and areal density of 5.1
x 10-3 nm-2 are observed at 773 K, while nanocavities with average diameter of
2.9 nm and areal density of 3.1 x 10-3 nm-2 are observed at 673 K. The
estimated Xe gas pressure inside the nanocavities is 0.035 GPa at 773 K, much
smaller than the estimated equilibrium pressure 0.38 GPa. This result suggests
that the nanocavities grow beyond equilibrium size at 773 K. The nanocavities
are annihilated at the surface to form surface pits by the interaction of
displacement cascades of keV Xe ions with the nanocavities. These pits are
characterized by in situ scanning tunneling microscopy. Pits are created on
Ge(111) and Ge(001) at temperatures ~ 523-578 K by keV Xe ions even when less
than a bilayer (monolayer) of surface material is removed.
","[{""version"":""v1"",""created"":""Wed, 23 Jul 2003 15:29:13 GMT""}]","2009-11-10"
"cond-mat/0307582","Christopher Homes","J. J. Tu, C. C. Homes, L. H. Greene, G. D. Gu and M. Strongin","The absence of superfluid response in ac and bc-plane optical
  conductivities of optimally-doped Bi2212 single crylstals in the surface
  region","RevTeX 4 file, 4 pages, 4 eps figures",,,,"cond-mat.supr-con",,"  The optical properties of optimally-doped Bi_2Sr_2CaCu_2O_{8+\delta} (Bi2212)
have been measured normal to the edge planes [ac plane, bc plane, and
(1\bar{1}0) plane], for light polarized parallel to nodal and anti-nodal (gap)
directions, respectively. While the superfluid contribution can be obtained
from the optical conductivities in the (1\bar{1}0)-plane, it is unobservable in
the ac and bc-planes. This apparent asymmetry implies that the edge region of
high-T_c cuprates is unusual and further supports a d-wave symmetry of the
superconducting order parameter.
","[{""version"":""v1"",""created"":""Wed, 23 Jul 2003 15:38:16 GMT""}]","2007-05-23"
"cond-mat/0307583","Helmut Katzgraber","Helmut G. Katzgraber and A. P. Young","Geometry of large-scale low-energy excitations in the one-dimensional
  Ising spin glass with power-law interactions","7 pages, 6 figures, 8 tables","Phys. Rev. B 68, 224408 (2003)","10.1103/PhysRevB.68.224408",,"cond-mat.dis-nn",,"  Results are presented for the geometry of low-energy excitations in the
one-dimensional Ising spin chain with power-law interactions, in which the
model parameters are chosen to yield a finite spin-glass transition
temperature. Both finite-temperature and ground-state studies are carried out.
For the range of sizes studied the data cannot be fitted to any of the standard
spin-glass scenarios without including corrections to scaling. Incorporating
such corrections we find that the fractal dimension of the surface of the
excitations, is either equal to the space dimension, consistent with replica
symmetry breaking, or very slightly less than it. The latter case is consistent
with the droplet and ""trivial-nontrivial"" (TNT) pictures.
","[{""version"":""v1"",""created"":""Wed, 23 Jul 2003 15:50:39 GMT""},{""version"":""v2"",""created"":""Mon, 8 Dec 2003 17:22:35 GMT""}]","2007-05-23"
"gr-qc/0307096","Alexander E. Shalyt-Margolin","A.E.Shalyt-Margolin","Deformed density matrix, Density of entropy and Information problem","9 pages,no figures,some corrections",,,,"gr-qc",,"  Quantum Mechanics at Planck scale is considered as a deformation of the
conventional Quantum Mechanics. Similar to the earlier works of the author, the
main object of deformation is the density matrix. On this basis a notion of the
entropy density is introduced that is a matrix value used for a detail study of
the Information Problem at the Universe, and in particular, for the Information
Paradox Problem.
","[{""version"":""v1"",""created"":""Tue, 22 Jul 2003 20:32:13 GMT""},{""version"":""v2"",""created"":""Tue, 12 Aug 2003 11:28:20 GMT""},{""version"":""v3"",""created"":""Tue, 21 Oct 2003 11:32:02 GMT""}]","2007-05-23"
"gr-qc/0307097","Wei Liang Qian","Zai-Xiong Shen, Bin Wang and Ru-Keng Su","Quasinormal Modes in three-dimensional time-dependent Anti-de Sitter
  spacetime","8 pages and 7 figures","Chin.Phys.Lett. 21 (2004) 428-431","10.1088/0256-307X/21/3/003",,"gr-qc",,"  The massless scalar wave propagation in the time-dependent BTZ black hole
background has been studied. It is shown that in the quasi-normal ringing both
the decay and oscillation time-scales are modified in the time-dependent
background.
","[{""version"":""v1"",""created"":""Wed, 23 Jul 2003 06:05:47 GMT""},{""version"":""v2"",""created"":""Wed, 30 Jul 2003 06:16:44 GMT""}]","2009-11-10"
"gr-qc/0307098","Christopher J. Fewster","C.J. Fewster and B. Mistry","Quantum Weak Energy Inequalities for the Dirac field in Flat Spacetime","8 pages, REVTeX4, version to appear in Phys Rev D","Phys.Rev.D68:105010,2003","10.1103/PhysRevD.68.105010",,"gr-qc hep-th",,"  Quantum Weak Energy Inequalities (QWEIs) have been established for a variety
of quantum field theories in both flat and curved spacetimes. Dirac fields are
known (by a result of Fewster and Verch) to satisfy QWEIs under very general
circumstances. However this result does not provide an explicit formula for the
QWEI bound, so its magnitude has not previously been determined. In this paper
we present a new and explicit QWEI bound for Dirac fields of arbitrary mass in
four-dimensional Minkowski space. We follow the methods employed by Fewster and
Eveson for the scalar field, modified to take account of anticommutation
relations. A key ingredient is an identity for Fourier transforms established
by Fewster and Verch. We also compare our QWEI with those previously obtained
for scalar and spin-1 fields.
","[{""version"":""v1"",""created"":""Wed, 23 Jul 2003 10:52:18 GMT""},{""version"":""v2"",""created"":""Tue, 16 Sep 2003 15:00:05 GMT""}]","2008-11-26"
"gr-qc/0307099","Ozgur Delice","Ozgur Delice","Gravitational hedgehog, stringy hedgehog and stringy sphere","11 pages","JHEP 0311 (2003) 058","10.1088/1126-6708/2003/11/058",,"gr-qc",,"  We investigate the solutions of Einstein equations such that a hedgehog
solution is matched to different exterior or interior solutions via a spherical
shell. In the case where both the exterior and the interior regions are
hedgehog solutions or one of them is flat, the resulting spherical shell
becomes a stringy shell. We also consider more general matchings and see that
in this case the shell deviates from its stringy character.
","[{""version"":""v1"",""created"":""Wed, 23 Jul 2003 11:53:52 GMT""},{""version"":""v2"",""created"":""Tue, 21 Oct 2003 17:39:44 GMT""},{""version"":""v3"",""created"":""Wed, 3 Dec 2003 14:09:14 GMT""}]","2007-05-23"
"hep-ex/0307058","Zijin Guo","J.Z. Bai et al (BES Collaboration)","Partial Wave Analyses of $J/\psi\to\gamma K^+K^-$ and $\gamma
  K^0_SK^0_S$","16 pages, 5 figures","Phys.Rev.D68:052003,2003","10.1103/PhysRevD.68.052003",,"hep-ex",,"  Results are presented on $J/\psi $ radiative decays to $K^+K^-$ and
$K^0_SK^0_S$ based on a sample of 58M $J/\psi$ events taken with the BES II
detector. A partial wave analysis is carried out using the relativistic
covariant tensor amplitude method in the 1-2 GeV mass range. There is
conspicuous production due to the $f'_2(1525)$ and $f_0(1710)$. The latter
peaks at a mass of $1740\pm 4^{+10}_{-25}$ MeV with a width of
$166{^{+5}_{-8}}{^{+15}_{-10}}$ MeV. Spin 0 is strongly preferred over spin 2.
For the $f'_2(1525)$, the helicity amplitude ratios are determined to be $x^2 =
1.00\pm0.28^{+1.06}_{-0.36}$ and $y^2 = 0.44\pm{0.08}^{+0.10}_{-0.56}$.
","[{""version"":""v1"",""created"":""Tue, 22 Jul 2003 19:36:13 GMT""}]","2016-08-31"
