"astro-ph/0307409","Terry Jay Jones","Terry J. Jones","Polarimetry in the Visible and Infrared: Application to CMB Polarimetry","To be published in the proceedings of ""The Cosmic Microwave
  Background and its Polarization"", New Astronomy Reviews, (eds. S. Hanany and
  K.A. Olive)",,"10.1016/j.newar.2003.09.013",,"astro-ph",,"  Interstellar polarization from aligned dust grains can be measured both in
transmission at visible and near-infrared wavelengths and in emission at
far-infrared and sub-mm wavelengths. These observations can help predict the
behavior of foreground contamination of CMB polarimetry by dust in the Milky
Way. Fractional polarization in emission from aligned dust grains will be at
the higher range of currently observed values of 4-10%. Away from the galactic
plane, fluctuations in Q and U will be dominated by fluctuations in intensity,
and less influenced by fluctuations in fractional polarization and position
angle.
","[{""version"":""v1"",""created"":""Wed, 23 Jul 2003 15:53:35 GMT""}]","2015-06-24"
"cond-mat/0307539","Wonkee Kim","Wonkee Kim, F. Marsiglio, and J. P. Carbotte","Low Temperature Thermal Conductivity of High Purity
  YBa$_{2}$Cu$_{3}$O$_{6.99}$ in the Vortex State","3 figures",,,,"cond-mat.supr-con",,"  The low temperature thermal conductivity of a d-wave superconductor is
considered for arbitrary strength of the impurity potential. A random
distribution of vortices is included within the usual semiclassical approach.
The vortex-quasiparticle scattering is accounted for phenomenologically, in
addition to impurity scattering. Application of the theory to recent data on
high purity YBa$_{2}$Cu$_{3}$O$_{6.99}$ shows excellent agreement with
experiment, both in zero field and in the presence of an applied magnetic
field. We find that the strength of the impurity potential required to describe
the data deviates qualitatively from either the unitary or Born limits.
","[{""version"":""v1"",""created"":""Tue, 22 Jul 2003 17:26:38 GMT""}]","2007-05-23"
"cond-mat/0307542","Federico Corberi","Federico Corberi, Eugenio Lippiello and Marco Zannetti","Scaling of the linear response function from zero field cooled and
  thermoremanent magnetization in phase ordering kinetics","26 pages, 14 figures","Phys.Rev. E 68, 046131 (2003).","10.1103/PhysRevE.68.046131",,"cond-mat.stat-mech",,"  In this paper we investigate the relation between the scaling properties of
the linear response function $R(t,s)$, of the thermoremanent magnetization
(TRM) and of the zero field cooled magnetization (ZFC) in the context of phase
ordering kinetics. We explain why the retrival of the scaling properties of
$R(t,s)$ from those of TRM and ZFC is not trivial. Preasymptotic contributions
generate a long crossover in TRM, while ZFC is affected by a dangerous
irrelevant variable. Lack of understanding of both these points has generated
some confusion in the literature. The full picture relating the exponents of
all the quantities involved is explicitely illustrated in the framework of the
large $N$ model. Following this scheme, an assessment of the present status of
numerical simulations for the Ising model can be made. We reach the conclusion
that on the basis of the data available up to now, statements on the scaling
properties of $R(t,s)$ can be made from ZFC but not from TRM. From ZFC data for
the Ising model with $d=2,3,4$ we confirm the previously found linear
dependence on dimensionality of the exponent $a$ entering $R(t,s) \sim
s^{-(1+a)}f(t/s)$. We also find evidence that a recently derived form of the
scaling function $f(x)$, using local scale invariance arguments [M.Henkel,
M.Pleimling, C.Godr\`{e}che and J.M.Luck, Phys.Rev.Lett. {\bf 87}, 265701
(2001)], does not hold for the Ising model.
","[{""version"":""v1"",""created"":""Tue, 22 Jul 2003 16:19:34 GMT""}]","2009-11-10"
"cond-mat/0307543","Luca Leuzzi","A. Crisanti, L. Leuzzi, G. Parisi and T. Rizzo","On Spin-Glass Complexity","4 pages, 2 figures; Text changed in some parts, typos corrected,
  Refs. [17],[21] and [22] added, two Refs. removed","Phys. Rev. Lett. 92, 127203 (2004)","10.1103/PhysRevLett.92.127203",,"cond-mat.dis-nn cond-mat.stat-mech",,"  We study the quenched complexity in spin-glass mean-field models satisfying
the Becchi-Rouet-Stora-Tyutin supersymmetry. The outcome of such study,
consistent with recent numerical results, allows, in principle, to conjecture
the absence of any supersymmetric contribution to the complexity in the
Sherrington-Kirkpatrick model. The same analysis can be applied to any model
with a Full Replica Symmetry Breaking phase, e.g. the Ising $p$-spin model
below the Gardner temperature. The existence of different solutions, breaking
the supersymmetry, is also discussed.
","[{""version"":""v1"",""created"":""Tue, 22 Jul 2003 16:38:19 GMT""},{""version"":""v2"",""created"":""Mon, 1 Dec 2003 11:46:56 GMT""}]","2009-11-10"
"cond-mat/0307545","German Drazer","G. Drazer, H. Auradou, J. Koplik, J. P. Hulin","Fractal fronts in fractal fractures: large and small-scale structure","Submitted to Phys. Rev. Lett","Phys. Rev. Lett. 92, 014501 (2004)","10.1103/PhysRevLett.92.014501",,"cond-mat.stat-mech",,"  The evolution and spatial structure of displacement fronts in fractures with
self-affine rough walls are studied by numerical simulations. The fractures are
open and the two faces are identical but shifted along their mean plane, either
parallel or perpendicular to the flow. An initially flat front advected by the
flow is progressively distorted into a self-affine front with Hurst exponent
equal to that of the fracture walls. The lower cutoff of the self-affine regime
depends on the aperture and lateral shift, while the upper cutoff grows
linearly with the width of the front.
","[{""version"":""v1"",""created"":""Tue, 22 Jul 2003 17:34:04 GMT""}]","2016-05-02"
"cond-mat/0307546","David M. Harber","D.M. Harber, J.M. McGuirk, J.M. Obrecht, and E.A. Cornell","Thermally Induced Losses in Ultra-Cold Atoms Magnetically Trapped Near
  Room-Temperature Surfaces","Improved theory curve eliminates discrepancy. JLTP in press",,,,"cond-mat.soft quant-ph",,"  We have measured magnetic trap lifetimes of ultra-cold Rb87 atoms at
distances of 5-1000 microns from surfaces of conducting metals with varying
resistivity. Good agreement is found with a theoretical model for losses
arising from near-field magnetic thermal noise, confirming the complications
associated with holding trapped atoms close to conducting surfaces. A
dielectric surface (silicon) was found in contrast to be so benign that we are
able to evaporatively cool atoms to a Bose-Einstein condensate by using the
surface to selectively adsorb higher energy atoms.
","[{""version"":""v1"",""created"":""Tue, 22 Jul 2003 19:34:28 GMT""},{""version"":""v2"",""created"":""Tue, 22 Jul 2003 20:31:08 GMT""},{""version"":""v3"",""created"":""Tue, 26 Aug 2003 16:43:46 GMT""}]","2007-05-23"
"cond-mat/0307547","Nicola Scafetta","Nicola Scafetta, Timothy Imholt, J. A. Roberts and Bruce J. West","An intensity-expansion method to treat non-stationary time series: an
  application to the distance between prime numbers","11 pages, 7 figures, in press on 'Chaos, Solitons & Fractals'",,"10.1016/S0960-0779(03)00434-X",,"cond-mat.stat-mech",,"  We study the fractal properties of the distances between consecutive primes.
The distance sequence is found to be well described by a non-stationary
exponential probability distribution. We propose an intensity-expansion method
to treat this non-stationarity and we find that the statistics underlying the
distance between consecutive primes is Gaussian and that, by transforming the
distance sequence into a stationary one, the range of Gaussian randomness of
the sequence increases.
","[{""version"":""v1"",""created"":""Tue, 22 Jul 2003 19:34:48 GMT""}]","2015-06-24"
"cond-mat/0307548","Nicola Scafetta","Nicola Scafetta and Bruce J. West","Multiresolution Diffusion Entropy Analysis of time series: an
  application to births to teenagers in Texas","14 pages, 3 figures, 1 table. In press on 'Chaos, Solitons &
  Fractals'",,"10.1016/S0960-0779(03)00442-9",,"cond-mat.stat-mech",,"  The multiresolution diffusion entropy analysis is used to evaluate the
stochastic information left in a time series after systematic removal of
certain non-stationarities. This method allows us to establish whether the
identified patterns are sufficient to capture all relevant information
contained in a time series. If they do not, the method suggests the need for
further interpretation to explain the residual memory in the signal. We apply
the multiresolution diffusion entropy analysis to the daily count of births to
teens in Texas from 1964 through 2000 because it is a typical example of a
non-stationary time series, having an anomalous trend, an annual variation, as
well as short time fluctuations. The analysis is repeated for the three main
racial/ethnic groups in Texas (White, Hispanic and African American), as well
as, to married and unmarried teens during the years from 1994 to 2000 and we
study the differences that emerge among the groups.
","[{""version"":""v1"",""created"":""Tue, 22 Jul 2003 19:40:16 GMT""}]","2015-06-24"
"cond-mat/0307549","Douglas Natelson","L.H. Yu and D. Natelson","Zero-bias anomalies in electrochemically fabricated nanojunctions","4 pages, 4 figures","Appl. Phys. Lett. 82, 2332-2334 (2003)","10.1063/1.1565678",,"cond-mat.mes-hall",,"  A streamlined technique for the electrochemical fabrication of metal
nanojunctions (MNJs) between lithographically defined electrodes is presented.
The first low-temperature transport measurements in such structures reveal
suppression of the conductance near zero-bias. The size of the zero-bias
anomaly (ZBA) depends strongly on the fabrication electrochemistry and the
dimensions of the resulting MNJ. We present evidence that the nonperturbative
ZBA in atomic-scale junctions is due to a density of states suppression in the
leads.
","[{""version"":""v1"",""created"":""Tue, 22 Jul 2003 20:54:49 GMT""}]","2009-11-10"
"cond-mat/0307550","Daniel Huber","D. Huber, L.S. Tsimring","Dynamics of an Ensemble of Noisy Bistable Elements with Global
  Time-Delayed Coupling","4 pages, 3 figures. Accepted for publication in Phys. Rev. Lett",,"10.1103/PhysRevLett.91.260601",,"cond-mat.stat-mech nlin.AO",,"  The dynamics of an ensemble of bistable elements with global time-delayed
coupling under the influence of noise is studied analytically and numerically.
Depending on the noise level the system undergoes ordering transitions and
demonstrates multi-stability. That is, for a strong enough positive feedback it
exhibits a non-zero stationary mean field and a variety of stable oscillatory
mean field states are accessible for positive and negative feedback. The
regularity of the oscillatory states is maximal for a certain noise level,
i.e., the system demonstrates coherence resonance. While away from the
transition points the system dynamics is well described by a Gaussian
approximation, near the bifurcation points a description in terms of a
dichotomous theory is more adequate.
","[{""version"":""v1"",""created"":""Tue, 22 Jul 2003 21:08:26 GMT""},{""version"":""v2"",""created"":""Thu, 11 Dec 2003 03:42:50 GMT""}]","2009-11-10"
"cond-mat/0307551","Matteo Pasquali","Chris H. Wiggins, Alberto Montesi, Matteo Pasquali","The stochastic spectral dynamics of bending and tumbling","4 pages, 3 figures v2: corrected minor typo in formula for \Delta_t
  v3: resubmitted the correction of v2 (uploaded wrong file)",,,,"cond-mat.soft",,"  Traditional models of wormlike chains in shear flows at finite temperature
approximate the equation of motion via finite difference discretization (bead
and rod models). We introduce here a new method based on a spectral
representation in terms of the natural eigenfunctions. This formulation
separates tumbling and bending dynamics, clearly showing their interrelation,
naturally orders the bending dynamics according to the characteristic decay
rate of its modes, and displays coupling among bending modes in a general flow.
This hierarchy naturally yields a low dimensional stochastic dynamical system
which recovers and extends previous numerical results and which leads to a fast
and efficient numerical method for studying the stochastic nonlinear dynamics
of semiflexible polymers in general flows. This formulation will be useful for
studying other physical systems described by constrained stochastic partial
differential equations.
","[{""version"":""v1"",""created"":""Tue, 22 Jul 2003 21:58:46 GMT""},{""version"":""v2"",""created"":""Thu, 7 Aug 2003 18:37:12 GMT""}]","2007-05-23"
"cond-mat/0307552","Alexei Efros","D. N. Tsigankov, E. Pazy, B.D. Laikhtman, and A. L. Efros","Long time relaxation of interacting electrons in the regime of hopping
  conduction","25 pages, 8 figures, 1 table",,"10.1103/PhysRevB.68.184205",,"cond-mat.dis-nn",,"  Using numerical simulations we studied the long time relaxation of the
hopping conductivity. Even though no modern computation is able to simulate the
behavior of a large size system over minutes or hours so as to observe the
relaxation, still we have been able to show that the long time relaxation and
aging effect observed in experiments can be explained in terms of slow
transitions between different pseudoground states. This was achieved by showing
that different pseudoground states may have different conductivities and that
the dispersion of conductivities is in agreement with the experimental data. We
considered two different two-dimensional models with electron-electron
interaction: the lattice model and the random site model, corresponding to
``strong'' and ``weak'' effective disorder. For the lattice model, effectively
strong disorder, we have shown that the universality of the Coulomb gap, which
is responsible for the universal Efros-Shklovskii law for the conductivity,
suppresses the long time relaxation of conductivity since the universality
strongly decreases the dispersion of conductivities of the pseudoground states.
","[{""version"":""v1"",""created"":""Wed, 23 Jul 2003 01:02:16 GMT""}]","2009-11-10"
"cond-mat/0307553","Kazuhiko Kuroki","Kazuhiko Kuroki, Yukio Tanaka, Takashi Kimura, Ryotaro Arita","Quantum Monte Carlo study of the pairing symmetry competition in the
  Hubbard model",,,"10.1103/PhysRevB.69.214511",,"cond-mat.str-el",,"  To shed light into the pairing mechanism of possible spin-triplet
superconductors (TMTSF)$_2$X and Sr$_2$RuO$_4$, we study the competition among
various spin singlet and triplet pairing channels in the Hubbard model by
calculating the pairing interaction vertex using the ground state quantum Monte
Carlo technique. We model (TMTSF)$_2$X by a quarter-filled quasi-one
dimensional (quasi-1D) Hubbard model,and the $\gamma$ band of Sr$_2$RuO$_4$ by
a two dimensional (2D) Hubbard model with a band filling of $\sim 4/3$. For the
quasi-1D system, we find that triplet $f$-wave pairing not only dominates over
triplet p-wave in agreement with the spin fluctuation theory, but also looks
unexpectedly competitive against d-wave. For the 2D system, although the
results suggest presence of attractive interaction in the triplet pairing
channels, the d-wave pairing interaction is found to be larger than those of
the triplet channels.
","[{""version"":""v1"",""created"":""Wed, 23 Jul 2003 01:24:32 GMT""}]","2009-11-10"
"cond-mat/0307554","Felix Ritort","A. Crisanti and F Ritort","Intermittency of glassy relaxation and the emergence of a
  non-equilibrium spontaneous measure in the aging regime","Latex file, 8 pages + 5 postscript figures",,"10.1209/epl/i2003-10158-3",,"cond-mat.soft cond-mat.dis-nn",,"  We consider heat exchange processes between non-equilibrium aging systems (in
their activated regime) and the thermal bath in contact. We discuss a scenario
where two different heat exchange processes concur in the overall heat
dissipation: a stimulated fast process determined by the temperature of the
bath and a spontaneous intermittent process determined by the fact that the
system has been prepared in a non-equilibrium state. The latter is described by
a probability distribution function (PDF) that has an exponential tail of width
given by a parameter $\lambda$, and satisfies a fluctuation theorem (FT)
governed by that parameter. The value of $\lambda$ is proportional to the
so-called effective temperature, thereby providing a practical way to
experimentally measure it by analyzing the PDF of intermittent events.
","[{""version"":""v1"",""created"":""Wed, 23 Jul 2003 02:08:08 GMT""}]","2009-11-10"
"cond-mat/0307555","Lou Kondic","Lou Kondic and R. P. Behringer","Elastic Energy, Fluctuations and Temperature for Granular Materials","4 pages, 4 figures","Europhysics Letters, 67(2), pp. 205-211 (2004)","10.1209/epl/i2004-10061-5",,"cond-mat.soft cond-mat.stat-mech",,"  We probe, using a model system, elastic and kinetic energies for sheared
granular materials. For large enough $P/E_y$ (pressure/Young's modulus) and
$P/\rho v^2$ ($P/$kinetic energy density) elastic dominates kinetic energy, and
energy fluctuations become primarily elastic in nature. This regime has likely
been reached in recent experiments. We consider a generalization of the
granular temperature, $T_g$, with both kinetic and elastic terms and that
changes smoothly from one regime to the other. This $T_g$ is roughly consistent
with a temperature adapted from equilibrium statistical mechanics.
","[{""version"":""v1"",""created"":""Wed, 23 Jul 2003 02:40:42 GMT""}]","2007-05-23"
"cond-mat/0307556","Hoi Fung Chau","H. F. Chau, F. K. Chow and K. H. Ho","Minority Game With Peer Pressure","10 pages, 3 figures in revtex 4.0",,"10.1016/j.physa.2003.10.009",,"cond-mat.stat-mech",,"  To study the interplay between global market choice and local peer pressure,
we construct a minority-game-like econophysical model. In this so-called
networked minority game model, every selfish player uses both the historical
minority choice of the population and the historical choice of one's neighbors
in an unbiased manner to make decision. Results of numerical simulation show
that the level of cooperation in the networked minority game differs remarkably
from the original minority game as well as the prediction of the
crowd-anticrowd theory. We argue that the deviation from the crowd-anticrowd
theory is due to the negligence of the effect of a four point correlation
function in the effective Hamiltonian of the system.
","[{""version"":""v1"",""created"":""Wed, 23 Jul 2003 03:39:17 GMT""}]","2015-06-24"
"cond-mat/0307557","Andrea Markelz","J.-Y. Chen, J. Cerne, A. G. Markelz","Far Infrared Sensing Of The Oxidation State Of Heme Proteins","single pdf file containing figures, 4 pages",,,,"cond-mat.soft cond-mat.mtrl-sci q-bio",,"  We propose a biosensor based on the change of terahertz (THz) dielectric
response when a biotarget binds to a probe. The feasibility of this biosensor
is examined by studying the change of THz transmission for thin films of heme
proteins myoglobin (Mb) and cytochrome C (CytC) as a function oxygen binding.
We measure a strong increase in both the index and absorbance with oxygen
binding for both Mb and CytC. The measured changes occur for both dried and
samples hydrated at 80% r.h. suggesting that using terahertz time domain
spectroscopy (TTDS) to monitor the transmitted terahertz pulse through a
biomolecular probe thin film in ambient environmental conditions could be used
to determine the presence of a biomolecular target.
","[{""version"":""v1"",""created"":""Wed, 23 Jul 2003 04:22:24 GMT""}]","2007-05-23"
"cond-mat/0307558","Andrea Markelz","J.-Y. Chen, W. Cox, E. Tehan, F.V. Bright, J. Cerne, A. G. Markelz","Xerogel Protein Substrates for Far Infrared Studies","single pdf file, 5 pages, 4 figures",,,,"cond-mat.soft q-bio",,"  A number of researchers are attempting to develop a biosensor based on
terahertz sensing. Key to the realization of any biosensor system is the access
of the target molecules to the sensor. In the case of using terahertz
spectroscopy, there are limitations due to high attenuation by water and
sensitivity levels. In order to have a significant response at THz frequencies
generally requires a minimum pathlength of 100 microns. Solid thin films of
this thickness will have limited interaction with target molecules. We propose
to use xerogels as biomolecular probe substrates. We have characterized the THz
transmission of xerogel substrates as a function of hydration and protein
content. These measurements demonstrate that xerogels are excellent candidates
for biomolecular probe substrates to realize THz biosensors.
","[{""version"":""v1"",""created"":""Wed, 23 Jul 2003 04:37:29 GMT""}]","2007-05-23"
"cond-mat/0307559","Max Metlitski A.","Max A. Metlitski and Ariel R. Zhitnitsky","Vortex Rings in two Component Bose-Einstein Condensates","21 pages, 2 figures","JHEP 0406:017,2004","10.1088/1126-6708/2004/06/017",,"cond-mat hep-ph hep-th",,"  We study the structure of the vortex core in two-component Bose-Einstein
condensates. We demonstrate that the order parameter may not vanish and the
symmetry may not be restored in the core of the vortex. In this case such
vortices can form vortex rings known as vortons in particle physics literature.
In contrast with well-studied superfluid $^4He$, where similar vortex rings can
be stable due to Magnus force only if they move, the vortex rings in
two-component BECs can be stable even if they are at rest. This beautiful
effect was first discussed by Witten in the cosmic string context, where it was
shown that the stabilization occurs due to condensation of the second component
of the field in the vortex core. This second condensate trapped in the core may
carry a current along the vortex ring counteracting the effect of string
tension that causes the loop to shrink. We speculate that such vortons may have
been already observed in the laboratory. We also speculate that the
experimental study of topological structures in BECs can provide a unique
opportunity to study cosmology and astrophysics by doing laboratory
experiments.
","[{""version"":""v1"",""created"":""Wed, 23 Jul 2003 06:34:42 GMT""}]","2014-10-13"
"cond-mat/0307560","Liang-Jian Zou","Liang-Jian Zou, J.-L. Wang and Z. Zeng (Institute of Solid State
  Physics, Academia Sinica, Hefei, China)","Electronic States in Two-Dimensional Triangular Cobalt Oxides: Role of
  Electronic Correlation","minor errors corrected","Phys. Rev. B 69, 132505 (2004)","10.1103/PhysRevB.69.132505",,"cond-mat.str-el cond-mat.supr-con",,"  We obtain the electronic states and structures of two-dimensional cobalt
oxides, Na$_{x}$CoO$_{2}$ (x=0, 0.35, 0.5 and 0.75) by utilizing the
full-potential linear muffin-tin orbitals (FP-LMTO) methods, from which some
essential electronic interaction parameters are estimated: the bare on-site
Coulomb interaction of cobalt U$_{dd}$=7.5 eV renormalizes to 5 eV for x=0.35,
the $pd$ hybridizations t$_{pd\sigma}$ and t$_{pd\pi}$ are -1.40 and 0.70 eV,
respectively. The density of states at E$_{F}$ decreases from 6-7 states/eV in
the local density approximation (LDA) to about 1.0 states/eV in the LDA+U
scheme. The role of the intercalation of water molecules and the microscopic
mechanism of the superconductivity in Na$_{0.35}$CoO$_{2}$$\cdot$mH$_{2}$O is
discussed.
","[{""version"":""v1"",""created"":""Wed, 23 Jul 2003 06:48:49 GMT""},{""version"":""v2"",""created"":""Thu, 24 Jul 2003 09:34:00 GMT""}]","2009-11-10"
"cond-mat/0307561","Hans Hennig von Grunberg","Carsten Russ, Klaus Zahn and Hans-Hennig von Grunberg","Triplet correlations in two-dimensional colloidal model liquids","many pages, 8 figures, contribution to the special issue in J.Phys.
  Cond. Mat. of the CECAM meeting in LYON ''Many-body....''",,"10.1088/0953-8984/15/48/011",,"cond-mat.soft",,"  Three-body distribution functions in classical fluids have been theoretically
investigated many times, but have never been measured directly. We present
experimental three-point correlation functions that are computed from particle
configurations measured by means of video-microscopy in two types of
quasi-two-dimensional colloidal model fluids: a system of charged colloidal
particles and a system of paramagnetic colloids. In the first system the
particles interact via a Yukawa potential, in the second via a potential
$\Gamma/r^{3}$. We find for both systems very similar results: on increasing
the coupling between the particles one observes the gradual formation of a
crystal-like local order due to triplet correlations, even though the system is
still deep inside the fluid phase. These are mainly packing effects as is
evident from the close resemblance between the results for the two systems
having completely different pair-interaction potentials.
","[{""version"":""v1"",""created"":""Wed, 23 Jul 2003 08:07:42 GMT""}]","2009-11-10"
