"astro-ph/0307393","Micael Jarvis","M. Jarvis, G. Bernstein, B. Jain","The Skewness of the Aperture Mass Statistic","16 pages, accepted by MNRAS. Minor revisions; this replacement
  matches the accepted version","Mon.Not.Roy.Astron.Soc.352:338-352,2004","10.1111/j.1365-2966.2004.07926.x",,"astro-ph",,"  We present simple formulae for calculating the skewness and kurtosis of the
aperture mass statistic for weak lensing surveys which is insensitive to
masking effects of survey geometry or variable survey depth. The calculation is
the higher order analog of the formula given by Schneider et al (2002) which
has been used to compute the variance of the aperture mass from several lensing
surveys. As our formula requires the three-point shear correlation function, we
also present an efficient tree-based algorithm for measuring it. We show how
our algorithm would scale in computing time and memory usage for future lensing
surveys. Finally, we apply the procedure to our CTIO survey data, originally
described in Jarvis et al (2003). We find that the skewness is positive
(inconsistent with zero) at the 2 sigma level. However, the signal is too noisy
from this data to usefully constrain cosmology.
","[{""version"":""v1"",""created"":""Tue, 22 Jul 2003 19:07:56 GMT""},{""version"":""v2"",""created"":""Thu, 29 Apr 2004 18:25:08 GMT""}]","2009-11-10"
"astro-ph/0307394","Jon M. Miller","J. M. Miller (1), J. Raymond (1), A. C. Fabian (2), J. Homan (3), M.
  A. Nowak (4), R. Wijnands (5), M. van der Klis (6), T. Belloni (3), J. A.
  Tomsick (7), D. M. Smith (8), P. A. Charles (9), W. H. G. Lewin (4) ((1)
  Harvard-Smithsonian CfA, (2) Univ. of Cambridge IoA, (3) Oss. di Brera, (4)
  MIT, (5) Univ. of St. Andrew's, (6) Univ. of Amsterdam, (7) UC San Diego, (8)
  UC Berkeley, (9) Univ. of Southampton)","Chandra/HETGS Spectroscopy of the Galactic Black Hole GX 339-4: A
  Relativistic Iron Line and Evidence for a Seyfert-like Warm Absorber","20 pages, 11 postscript figure files (many in color), uses
  emulateapj.sty and apjfonts.sty, slightly expanded, accepted for publication
  in ApJ","Astrophys.J.601:450-465,2004","10.1086/380196",,"astro-ph",,"  We observed the Galactic black hole GX 339-4 with the Chandra High Energy
Transmission Grating Spectrometer (HETGS) for 75 ksec during the decline of its
2002-2003 outburst. The sensitivity of this observation provides an
unprecedented glimpse of a Galactic black hole at about a tenth of the
luminosity of the outburst peak. The continuum spectrum is well described by a
model consisting of multicolor disk blackbody (kT = 0.6 keV) and power-law
(Gamma = 2.5) components. X-ray reflection models yield improved fits. A
strong, relativistic Fe K-alpha emission line is revealed, indicating that the
inner disk extends to the innermost stable circular orbit. The breadth of the
line is sufficient to suggest that GX 339-4 may harbor a black hole with
significant angular momentum. Absorption lines from H-like and He-like O, and
He-like Ne and Mg are detected, as well as lines which are likely due to Ne II
and Ne III. The measured line properties make it difficult to associate the
absorption with the coronal phase of the interstellar medium. A scenario
wherein the absorption lines are due to an intrinsic AGN-like warm-absorber
geometry -- perhaps produced by a disk wind in an extended disk-dominated state
-- may be more viable. We compare our results to Chandra observations of the
Galactic black hole candidate XTE J1650-500, and discuss our findings in terms
of prominent models for Galactic black hole accretion flows and connections to
supermassive black holes.
","[{""version"":""v1"",""created"":""Tue, 22 Jul 2003 19:02:08 GMT""},{""version"":""v2"",""created"":""Tue, 30 Sep 2003 15:18:51 GMT""}]","2009-09-17"
"astro-ph/0307395","B. C. Kelly","Brandon C. Kelly, Timothy A. McKay","Morphological Classification of Galaxies by Shapelet Decomposition in
  the Sloan Digital Sky Survey","21 pages, 16 figures, accepted by AJ, minor changes per the referee's
  comments",,"10.1086/380934",,"astro-ph",,"  We describe application of the `shapelet' linear decomposition of galaxy
images to morphological classification using images of $\sim$ 3000 galaxies
from the Sloan Digital Sky Survey. After decomposing the galaxies we perform a
principal component analysis to reduce the number of dimensions of the shapelet
space to nine. We find that each of these nine principal components contains
unique morphological information, and give a description of each principal
component's contribution to a galaxy's morphology. We find that galaxies of
differing Hubble type separate cleanly in the shapelet space. We apply a
Gaussian mixture model to the 9-dimensional space spanned by the principal
components and use the results as a basis for classification. Using the mixture
model, we separate galaxies into seven classes and give a description of each
class's physical and morphological properties. We find that several of the
mixture model classes correlate well with the traditional Hubble types both in
their morphology and their physical parameters (e.g., color, velocity
dispersions, etc.). In addition, we find an additional class of late-type
morphology but with high velocity dispersions and very blue color; most of
these galaxies exhibit post-starburst activity. This method provides an
objective and quantitative alternative to traditional and subjective visual
classification.
","[{""version"":""v1"",""created"":""Tue, 22 Jul 2003 19:16:03 GMT""},{""version"":""v2"",""created"":""Thu, 16 Oct 2003 18:20:56 GMT""}]","2009-11-10"
"astro-ph/0307396","Jordi Miralda-Escude","Jordi Miralda-Escude","The Dark Age of the Universe","Review article, also available at
  http://www.astronomy.ohio-state.edu/~jordi/research.html","Science 300:1904-1909,2003","10.1126/science.1085325",,"astro-ph",,"  The Dark Age is the period between the time when the cosmic microwave
background was emitted and the time when the evolution of structure in the
universe led to the gravitational collapse of objects in which the first stars
were formed. The period of reionization started with the ionizing light from
the first stars, and it ended when all the atoms in the intergalactic medium
had been reionized. The most distant sources of light known at present are
galaxies and quasars at redshift z ~ 6, and their spectra indicate that the end
of reionization was occurring just at that time. The Cold Dark Matter theory
for structure formation predicts that the first sources formed much earlier.
","[{""version"":""v1"",""created"":""Tue, 22 Jul 2003 20:59:49 GMT""}]","2009-11-10"
"astro-ph/0307397","Tom Aldcroft","T. L. Aldcroft, A. Siemiginowska, M. Elvis, S. Mathur, F. Nicastro,
  and S. S. Murray","Chandra Observation of 3C 212: a New Look at the X-ray and UV Absorbers","8 pages, 6 figures, Accepted for publication in the Astrophysical
  Journal","Astrophys.J.597:751-758,2003","10.1086/378640",,"astro-ph",,"  The red quasar 3C 212 (z=1.049) is one of the most distant and most luminous
AGN which has shown evidence of an X-ray warm absorber. In order to further
investigate this unusual quasar, we used Chandra/ACIS-S to observe 3C 212 for
19.5 ksec, resulting in a net detection of ~4000 counts. The Chandra data
confirm the presence of an excess absorbing column N_H ~ 4 x 10^21 cm^-2 at the
quasar redshift, but we find no compelling evidence for a warm absorber. Using
both the Chandra and archival ROSAT PSPC data, we obtain very good fits for
both a partially covered neutral absorber and a low-ionization (U = 0.03)
photo-ionized absorber. In the ultraviolet, 3C 212 shows a strong associated
MgII absorber. Based on a moderate resolution (80 km/s) MMT spectrum we show
that the absorber is highly saturated and has a covering fraction less than
60%, implying that the absorber is truly intrinsic to the quasar.
Photo-ionization modeling of the MgII absorber yields a constraint on the
ionization parameter of U < 0.03, inconsistent with a warm UV/X-ray absorber.
In addition to our spectral analysis, we find evidence in the ACIS image data
for weak extended emission surrounding the quasar as well as emission
corresponding to the radio lobes at a distance of 5 arcsec from 3C 212. The
statistical significance of these features is low, but we briefly explore the
implications if the detections are valid.
","[{""version"":""v1"",""created"":""Tue, 22 Jul 2003 21:17:31 GMT""}]","2009-11-10"
"astro-ph/0307398","Chris Koresko","Eric Gaidos (Department of Geology and Geophysics, University of
  Hawaii, Honolulu) and Christopher Koresko (Michelson Science Center,
  California Institute of Technology)","A Survey of 10-Micron Silicate Emission from Dust around Young Sun-Like
  Stars","19 total pages, 5 Postscript figures, 2 tables, Latex","New Astron. 9 (2004) 33-42","10.1016/j.newast.2003.07.002",,"astro-ph",,"  We obtained low resolution (R = 100) mid-infrared (8-13 micron wavelengths)
spectra of 8 nearby young main sequence stars with the Keck 1 telescope and
Long-Wavelength Spectrometer (LWS) to search for 10 micron silicate (Si-O
stretch) emission from circumstellar dust. No stars exhibited readily apparent
emission: Spectra were then analyzed by least-squares fitting of a template
based on a spectrum of Comet Hale-Bopp. Using this technique, we were able to
constrain the level of silicate emission to a threshold ten times below what
was previously possible from space. We found one star, HD 17925, with a
spectrum statistically different from its calibrator and consistent with a
silicate emission peak of 7% of the photosphere at a wavelength of 10 microns.
Excess emission at 60 microns from this star has already been reported.
","[{""version"":""v1"",""created"":""Tue, 22 Jul 2003 23:03:37 GMT""}]","2015-06-24"
"astro-ph/0307399","Emmanuel Momjian","E. Momjian, J.D. Romney, C.L. Carilli, & T. H. Troland","Sensitive VLBI Continuum and H I Absorption Observations of NGC 7674:
  First Scientific Observations with the Combined Array VLBA, VLA & Arecibo","37 pages, 11 figures. ApJ accepted. To appear in the Nov. 10, 2003
  issue of ApJ. Please use the PDF version if the postscript doesn't show the
  figures","Astrophys.J.597:809-822,2003","10.1086/378562",,"astro-ph",,"  We present phase-referenced VLBI observations of the radio continuum emission
from, and the H I 21 cm absorption toward, the Luminous Infrared Galaxy NGC
7674. The observations were carried out at 1380 MHz using the VLBA, the phased
VLA, and theArecibo radio telescope. These observations constitute the first
scientific use of the Arecibo telescope in a VLBI observation with the VLBA.
The high- and low-resolution radio continuum images reveal several new
continuum structures in the nuclear region of this galaxy. At ~100 mas
resolution, we distinguish six continuum structures extending over 1.4 arcsec,
with a total flux density of 138 mJy. Only three of these structures were known
previously. All these structures seem to be related to AGN activity. At the
full resolution of the array, we only detect two of the six continuum
structures. Both are composed of several compact components with brightness
temperatures on the order of $10^{7}$ K. While it is possible that one of these
compact structures could host an AGN, they could also be shock-like features
formed by the interaction of the jet with compact interstellar clouds in the
nuclear region of this galaxy. Complex H I absorption is detected with our VLBI
array at both high and low angular resolution. Assuming that the widest H I
feature is associated with a rotating H I disk or torus feeding a central AGN,
we estimate an enclosed dynamical mass of ~7 x 10^7 M_sun, comparable to the
value derived from the hidden broad H$\beta$ emission in this galaxy. The
narrower H I lines could represent clumpy neutral hydrogen structures in the H
I torus. The detection of H I absorption toward some of the continuum
components, and its absence toward others, suggest an inclined H I disk or
torus in the central region of NGC 7674.
","[{""version"":""v1"",""created"":""Wed, 23 Jul 2003 05:40:33 GMT""}]","2009-11-10"
"astro-ph/0307401","Alexei Kniazev","Alexei Y. Kniazev, Eva K. Grebel, Lei Hao, Michael A. Strauss,
  Jonathan Brinkmann and Masataka Fukugita","Discovery of Eight New Extremely Metal--Poor Galaxies in the Sloan
  Digital Sky Survey","To appear in August 20 issue of ApJ Letters, 6 pages, 2 figures","Astrophys.J.593:L73-L76,2003","10.1086/378259",,"astro-ph",,"  We report the discovery of eight new extremely metal-poor galaxies (XMPGs;
12+log(O/H) < 7.65) and the recovery of four previously known or suspected
XMPGs (IZw18, HS0822+3542, HS0837+4717 and A1116+517) using Sloan Digital Sky
Survey (SDSS) spectroscopy. These new objects were identified after an analysis
of 250,000 galaxy spectra within an area of ~3000 deg^2 on the sky. Our oxygen
abundance determinations have an accuracy of $\le$ 0.1 dex and are based on the
temperature-sensitive [O {\sc iii}] $\lambda$4363 \AA line and on the direct
calculation of the electron temperature. We briefly discuss a new method of
oxygen abundance determinations using the [O {\sc ii}] $\lambda$7319,7330 \AA\
lines, which is particularly useful for SDSS emission-line spectra with
redshifts $\le$~0.024 since the [O {\sc ii}] $\lambda$3727 \AA emission line
falls outside of the SDSS wavelength range. We detect XMPGs with redshifts
ranging from 0.0005 to 0.0443 and $M_g$ luminosities from $-$12\fm4 to
$-$18\fm6. Our eight new XMPGs increase the number of known metal-deficient
galaxies by approximately one quarter. The estimated surface density of XMPGs
is 0.004 deg$^{-2}$ for $r$ $\le$ 17\fm77.
","[{""version"":""v1"",""created"":""Wed, 23 Jul 2003 10:30:07 GMT""}]","2009-11-10"
"astro-ph/0307402","John Robert Brucato","J. R. Brucato (1), G. Strazzulla (2), G. Baratta (2), L. Colangeli (1)
  ((1) INAF - Osservatorio Astronomico di Capodimonte, Napoli, Italy, (2) INAF
  - Osservatorio Astrofisico, Catania, Italy)","Forsterite Amorphisation by Ion Irradiation: Monitoring by Infrared
  Spectroscopy","14 pages, 7 figures, to be published in A&A","Astron.Astrophys.413:395-401,2004","10.1051/0004-6361:20031574",,"astro-ph",,"  We present experimental results on crystal--amorphous transition of
forsterite (Mg2SiO4) silicate under ion irradiation. The aim of this work is to
study the structural evolution of one of the most abundant crystalline
silicates observed in space driven by ion irradiation. To this aim, forsterite
films have been sythesised in laboratory and irradiated with low energy (30--60
keV) ion beams. Structural changes during irradiation with H+, He+, C+, and
Ar++ have been observed and monitored by infrared spectroscopy. The fraction of
crystalline forsterite converted into amorphous is a function of the energy
deposited by nuclear collision by ions in the target.
  Laboratory results indicate that ion irradiation is a mechanism potentially
active in space for the amorphisation of silicates. Physical properties
obtained in this work can be used to model the evolution of silicate grains
during their life cycle from evolved stars, through different interstellar
environments and up to be incorporated in Solar System objects.
","[{""version"":""v1"",""created"":""Wed, 23 Jul 2003 10:49:12 GMT""}]","2009-11-10"
"astro-ph/0307403","Belli Pierluigi","R. Bernabei (1), P. Belli (1), F. Cappella (1), R. Cerulli (1), F.
  Montecchia (1), F. Nozzoli (1), A. Incicchitti (2), D. Prosperi (2), C. J.
  Dai (3), H. H. Kuang (3), J. M. Ma (3), Z. P. Ye (3) ((1) Univ. and INFN
  Roma2, (2) Univ. and INFN Roma, (3) IHEP Beijing)","Dark Matter search","77 pages, 32 figures","Riv.Nuovo Cim.26N1:1-73,2003",,,"astro-ph hep-ex",,"  Main arguments on the Dark Matter particle direct detection approach are
addressed on the basis of the work and of the results of the about 100 kg
highly radiopure NaI(Tl) DAMA experiment (DAMA/NaI), which has been operative
at the Gran Sasso National Laboratory of the I.N.F.N. for more than one decade,
including the preparation. The effectiveness of the WIMP model independent
annual modulation signature is pointed out by discussing the results obtained
over 7 annual cycles (107731 kg day total exposure); the WIMP presence in the
galactic halo is strongly supported at 6.3 standard deviation C.L. The
complexity of the corollary model dependent quests for a candidate particle is
also addressed and several of the many possible scenarios are examined.
","[{""version"":""v1"",""created"":""Wed, 23 Jul 2003 13:04:10 GMT""}]","2011-07-19"
"astro-ph/0307404","Markos Georganopoulos","Markos Georganopoulos and Demosthenes Kazanas","Decelerating Flows in TeV Blazars: A Resolution to the BL Lac -- FR I
  Unification Problem","Accepted in ApJL","Astrophys.J.594:L27-L30,2003","10.1086/378557",,"astro-ph",,"  TeV emission from BL Lacertae (BL) objects is commonly modeled as
Synchrotron-Self Compton (SSC) radiation from relativistically moving
homogeneous plasma blobs. In the context of these models, the blob Lorentz
factors needed to reproduce the corrected for absorption by the diffuse IR
background (DIRB) TeV emission are large ($\delta \gtrsim 50$). The main reason
for this is that stronger beaming eases the problem of the lack of $\sim$ IR-UV
synchrotron seed photons needed to produce the de-absorbed $\sim $ few TeV peak
of the spectral energy distribution (SED). However, such high Doppler factors
are in strong disagreement with the unified scheme, according to which BLs are
FR I radio galaxies with their jets closely aligned to the line of sight. Here,
motivated by the detection of sub-luminal velocities in the sub-pc scale jets
of the best studied TeV blazars, MKN 421 and MKN 501, we examine the
possibility that the relativistic flows in the TeV BLs decelerate. In this
case, the problem of the missing seed photons is solved because of Upstream
Compton (UC) scattering, a process in which the upstream energetic electrons
from the fast base of the flow `see' the synchrotron seed photons produced in
the slow part of the flow relativistically beamed. Modest Lorentz factors
($\Gamma \sim 15$), decelerating down to values compatible with the recent
radio interferometric observations, reproduce the $\sim $ few TeV peak energy
of these sources. Furthermore, such decelerating flows are shown to be in
agreement with the BL - FR I unification, naturally reproducing the observed
BL/FR I broad band luminosity ratios.
","[{""version"":""v1"",""created"":""Wed, 23 Jul 2003 13:47:45 GMT""}]","2009-11-10"
"astro-ph/0307405","Richard I. Davies","R.I. Davies, A. Sternberg, M. Lehnert, L.E. Tacconi-Garman","Molecular Hydrogen Excitation in Ultraluminous Infrared Galaxies","accepted by ApJ (32 pages including figures)","Astrophys.J.597:907-922,2003","10.1086/378634",,"astro-ph",,"  We report medium resolution VLT ISAAC K-band spectroscopy of the nuclei of
seven ultraluminous infrared galaxies. After accounting for stellar absorption
features, we have detected several molecular hydrogen (H_2) v=1-0, 2-1, and 3-2
vibrational emission lines, as well as the HI Br\gamma and HeI 2^1P-2^1S
recombination lines. The relative H_2 line intensities show little variation
between the objects, suggesting that the H_2 excitation mechanisms in the
nuclei are similar in all the objects. The 1-0 emissions appear thermalised at
temperatures T\sim1000K. However, the 2-1 and 3-2 emissions show evidence of
being radiatively excited by far-ultraviolet (FUV) photons, suggesting that the
H_2 excitation in the ULIRGs may arise in dense photon dominated regions
(PDRs). We show that the line ratios in the nuclei are consistent with PDRs
with cloud densities between 10^4 to 10^5cm^{-3}, exposed to far ultraviolet
(FUV) radiation fields at least 10^3 times more intense than the ambient FUV
intensity in the local interstellar medium. We have constructed starburst
models for the ULIRGs based on their H_2 properties, as well as on the
intensities of the recombination lines. Our models provide a consistent picture
of young 1-5Myr star clusters surrounded by relatively dense PDRs which are
irradiated by intense FUV fluxes. Comparison to the inner few hundred parsecs
of the Milky Way indicates that the star formation efficiency in ULIRGs is
10--100 times higher than in the Galactic Center.
","[{""version"":""v1"",""created"":""Wed, 23 Jul 2003 14:04:50 GMT""}]","2009-11-10"
"astro-ph/0307406","Diego Gotz","D. Gotz, S. Mereghetti, K. Hurley, S. Deluit, M. Feroci, F. Frontera,
  A. Fruchter, J. Gorosabel, D.H. Hartmann, J. Hjorth, R. Hudec, I.F. Mirabel,
  E. Pian, G. Pizzichini, P. Ubertini, C. Winkler","Observation of GRB 030131 with the INTEGRAL satellite","Accepted for publication in A&A, 5 pages, 4 figures, latex","Astron.Astrophys. 409 (2003) 831-834","10.1051/0004-6361:20031128",,"astro-ph",,"  A long Gamma-Ray Burst (GRB) was detected with the instruments on board the
INTEGRAL satellite on January 31 2003. Although most of the GRB, which lasted
$\sim$150 seconds, occurred during a satellite slew, the automatic software of
the INTEGRAL Burst Alert System was able to detect it in near-real time. Here
we report the results obtained with the IBIS instrument, which detected GRB
030131 in the 15 keV - 200 keV energy range, and ESO/VLT observations of its
optical transient. The burst displays a complex time profile with numerous
peaks. The peak spectrum can be described by a single power law with photon
index $\Gamma\simeq$1.7 and has a flux of $\sim$2 photons cm$^{-2}$ s$^{-1}$ in
the 20-200 keV energy band. The high sensitivity of IBIS has made it possible
for the first time to perform detailed time-resolved spectroscopy of a GRB with
a fluence of 7$\times10^{-6}$ erg cm$^{-2}$ (20-200 keV).
","[{""version"":""v1"",""created"":""Wed, 23 Jul 2003 14:19:02 GMT""}]","2007-05-23"
"astro-ph/0307407","Olivier Chesneau","Olivier Chesneau, Sebastian Wolf and Armando Domiciano de Souza","Hot Stars Mass-loss studied with Spectro-Polarimetric INterferometry
  (SPIN)","15 pages, 21 figures, accepted in A&A","Astron.Astrophys.410:375-388,2003","10.1051/0004-6361:20031186",,"astro-ph",,"  We present a prospective work undertaken on Spectro-Polarimetric
INterferometry (SPIN). Our theoretical studies suggest that SPIN is a powerful
tool for studying the mass loss from early type stars. Based on Monte Carlo
simulations, we computed the expected SPIN signal for numerous hot star
spectral types covering a broad range of geometries and optical depths. The
SPIN technique is based on the detection and comparison of the fringe
characteristics (complex visibility) between two perpendicular directions of
polarization. In particular, we demonstrate that the SPIN technique is very
sensitive to the beta parameter from the so-called 'beta velocity law' for
optically thin winds. Moreover, the location where the bulk of polarization is
generated can be defined accurately. The required sensitivity for studying main
sequence OB star winds is still very demanding (inferior to 0.5%), but the
signal expected from denser winds or extended atmospheres is well within the
capabilities of existing interferometers. The visibility curves obtained in two
perpendicular polarizations for LBVs or WR stars can differ by more than 15%,
and their corresponding limb-darkened radii obtained by the fit of these curves
by more than 35%. The signal expected from the extended circumstellar
environment of Be stars and B[e] appears also to be easy to detect, relaxing
the required instrumental accuracy to 1%. For these spectral types, the SPIN
technique provide a good tool to extract the highly polarized and spatially
confined envelope contribution from the bright star emission.
","[{""version"":""v1"",""created"":""Wed, 23 Jul 2003 15:48:56 GMT""}]","2009-11-10"
"astro-ph/0307408","Frank Bertoldi","F. Bertoldi (MPIfR), P. Cox (IAS), R. Neri (IRAM), C.L. Carilli
  (NRAO), F. Walter (NRAO), A. Omont (IAP), A. Beelen (IAS), C. Henkel (MPIfR),
  X. Fan (U. Arizona), Michael A. Strauss (Princeton U.), K.M. Menten (MPIfR)","High-excitation CO in a quasar host galaxy at z=6.42","4 pages, 3 figures, A&A Letters","Astron.Astrophys.409:L47-L50,2003","10.1051/0004-6361:20031345",,"astro-ph",,"  We report the detection of high excitation CO emission from the most distant
quasar currently known, SDSS J114816.64+525150.3 (hereafter J1148+5251), at a
redshift z=6.419. The CO (J=6-5) and (J=7-6) lines were detected using the IRAM
Plateau de Bure interferometer, showing a width of ~280 km/s. An upper flux
limit for the CO (J=1-0) line was obtained from observations with the
Effelsberg 100-meter telescope. Assuming no gravitational magnification, we
estimate a molecular gas mass of ~2x10^10 M_sun. Using the CO (3-2)
observations by Walter et al. (2003), a comparison of the line flux ratios with
predictions from a large velocity gradient model suggests that the gas is
likely of high excitation, at densities ~10^5 cm^-3 and a temperature ~100 K.
Since in this case the CO lines appear to have moderate optical depths, the gas
must be extended over a few kpc. The gas mass detected in J1148+5251 can fuel
star formation at the rate implied by the far-infrared luminosity for less than
10 million years, a time comparable to the dynamical time of the region. The
gas must therefore be replenished quickly, and metal and dust enrichment must
occur fast. The strong dust emission and massive, dense gas reservoir at z~6.4
provide further evidence that vigorous star formation is co-eval with the rapid
growth of massive black holes at these early epochs of the Universe.
","[{""version"":""v1"",""created"":""Wed, 23 Jul 2003 15:43:13 GMT""}]","2009-11-10"
