"gr-qc/0312008","Jose Geraldo Pereira","R. Aldrovandi, J. G. Pereira, K. H. Vu","Selected Topics in Teleparallel Gravity","RevTeX4, 7 pages, 2 eps figures. Talk presented at the ""24th National
  Meeting of the Brazilian Physical Society"", section Particles and Fields,
  Caxambu MG, Brazil, from September/30 to October/04/2003","Braz.J.Phys.34:1374-1380,2004",,,"gr-qc hep-th",,"  Teleparallel gravity can be seen as a gauge theory for the translation group.
As such, its fundamental field is neither the tetrad nor the metric, but a
gauge potential assuming values in the Lie algebra of the translation group.
This gauge character makes of teleparallel gravity, despite its equivalence to
general relativity, a rather peculiar theory. A first important point is that
it does not rely on the universality of free fall, and consequently does not
require the equivalence principle to describe the gravitational interaction.
Another peculiarity is its similarity with Maxwell's theory, which allows an
Abelian nonintegrable phase factor approach, and consequently a global
formulation for gravitation. Application of these concepts to the motion of
spinless particles, as well as to the COW and gravitational Aharonov-Bohm
effects are presented and discussed.
","[{""version"":""v1"",""created"":""Mon, 1 Dec 2003 16:12:01 GMT""}]","2014-11-17"
"gr-qc/0312009","Sami Mohammad","M. Sami and Alexey Toporensky","Phantom Field and the Fate of Universe","RevTeX4, 5 pages and 3 eps figures; references updated","Mod.Phys.Lett.A19:1509,2004","10.1142/S0217732304013921",,"gr-qc astro-ph hep-ph hep-th",,"  In this paper we analyze the cosmological dynamics of phantom field in a
variety of potentials unbounded from above. We demonstrate that the nature of
future evolution generically depends upon the steepness of the phantom
potential and discuss the fate of Universe accordingly.
","[{""version"":""v1"",""created"":""Mon, 1 Dec 2003 18:10:27 GMT""},{""version"":""v2"",""created"":""Fri, 5 Dec 2003 13:19:43 GMT""}]","2008-11-26"
"gr-qc/0312010","Eric Poisson","Steve Detweiler and Eric Poisson","Low multipole contributions to the gravitational self-force","19 pages, revtex4, 3 figures, 1 table","Phys.Rev.D69:084019,2004","10.1103/PhysRevD.69.084019",,"gr-qc",,"  We calculate the unregularized monopole and dipole contributions to the
self-force acting on a particle of small mass in a circular orbit around a
Schwarzschild black hole. From a self-force point of view, these non-radiating
modes are as important as the radiating modes with l greater than 2. In fact,
we demonstrate how the dipole self-force contributes to the dynamics even at
the Newtonian level. The self-acceleration of a particle is an inherently
gauge-dependent concept, but the Lorenz gauge is often preferred because of its
hyperbolic wave operator. Our results are in the Lorenz gauge and are also
obtained in closed form, except for the even-parity dipole case where we
formulate and implement a numerical approach.
","[{""version"":""v1"",""created"":""Mon, 1 Dec 2003 22:07:53 GMT""}]","2010-05-12"
"gr-qc/0312011","Abel Camacho Mr.","Abel Camacho (Universidad Autonoma Metropolitana-Iztapalapa) and Abel
  Camacho-Galvan (DEPFI-UNAM)","Sagnac interferometry and non-Newtonian gravity","Accepted in General relativity and Gravitation","Gen.Rel.Grav. 36 (2004) 1207-1211","10.1023/B:GERG.0000018287.13676.5d",,"gr-qc quant-ph",,"  Sagnac interferometry has been employed in the context of gravity as a
proposal for the detection of the so called gravitomagnetic effect. In the
present work we explore the possibilities that this experimental device could
open up in the realm of non--Newtonian gravity. It will be shown that this
experimental approach allows us to explore an interval of values of the range
of the new force that up to now remains unexplored, namely, $\lambda\geq
10^{14}$ m.
","[{""version"":""v1"",""created"":""Mon, 1 Dec 2003 23:19:40 GMT""}]","2009-11-10"
"gr-qc/0312012","Hideo Kodama","Hideo Kodama (Kyoto University) and Akihiro Ishibashi (Univ. of
  Cambridge)","Stability of Generalised Static Black Holes in Higher Dimensions","14 pages. A talk given at the Seventh Hungarian Relativity Workshop,
  10-15 Aug. 2003, Sarospatak, Hungary. To appear in the proceedings",,,,"gr-qc",,"  We discuss the stability of (charged) static black holes in
higher-dimensional spacetimes with and without cosmological constant by using
gauge-invariant master equations of the Schroedinger equation type for black
hole perturbations derived by the authors recently. In particular, we show that
the stability of higher-dimensional Schwarzschild black holes can be proved
with the help of a technique called S-deformation of the master equations. We
also point out that higher-dimensional static black holes might be unstable
only against scalar-type perturbations in the neutral case and in the charged
case with spherically symmetric or flat horizons.
","[{""version"":""v1"",""created"":""Tue, 2 Dec 2003 07:54:40 GMT""}]","2007-05-23"
"gr-qc/0312013","Amos Ori","Amos Ori","Harmonic-gauge dipole metric perturbations for weak-field circular
  orbits in Schwarzschild spacetime","Latex","Phys.Rev. D70 (2004) 124027","10.1103/PhysRevD.70.124027",,"gr-qc",,"  We calculate the harmonic-gauge even l=1 mode of the linear metric
perturbation (MP) produced by a particle in a weak-field circular orbit around
a Schwarzschild black hole (BH). We focus on the Newtonian limit, i.e. the
limit in which the mass M of the central BH approaches zero (while fixing the
orbital radius and the small-object mass), and obtain explicit expressions for
the MP in this limit. We find that the MP are anomalous in this limit, namely,
they do not approach their standard, Coulomb-like, flat-space values. Instead,
the MP grows on approaching the BH, and this growth becomes worse as M
decreases. This anomalous behavior leads to some pathologies which we briefly
discuss. We also derive here the next-order correction (in the orbital
frequency $\Omega $) to the MP.
","[{""version"":""v1"",""created"":""Tue, 2 Dec 2003 09:00:11 GMT""}]","2009-11-10"
"gr-qc/0312014","Jorma Louko","Jorma Louko, Alberto Molgado","Group averaging in the (p,q) oscillator representation of SL(2,R)","34 pages. LaTeX with amsfonts, amsmath, amssymb. (References added;
  minor typos corrected.)","J.Math.Phys.45:1919-1943,2004","10.1063/1.1689001",,"gr-qc hep-th math-ph math.MP",,"  We investigate refined algebraic quantisation with group averaging in a
finite-dimensional constrained Hamiltonian system that provides a simplified
model of general relativity. The classical theory has gauge group SL(2,R) and a
distinguished o(p,q) observable algebra. The gauge group of the quantum theory
is the double cover of SL(2,R), and its representation on the auxiliary Hilbert
space is isomorphic to the (p,q) oscillator representation. When p>1, q>1 and
p+q == 0 (mod 2), we obtain a physical Hilbert space with a nontrivial
representation of the o(p,q) quantum observable algebra. For p=q=1, the system
provides the first example known to us where group averaging converges to an
indefinite sesquilinear form.
","[{""version"":""v1"",""created"":""Tue, 2 Dec 2003 10:08:08 GMT""},{""version"":""v2"",""created"":""Fri, 16 Jan 2004 17:16:49 GMT""}]","2014-11-17"
"gr-qc/0312015","Ashutosh Mahajan","Ashutosh Mahajan, Rituparno Goswami, Pankaj S.Joshi","Gravitational collapse from smooth initial data with vanishing radial
  pressure","10 pages,3 figures,revtex4,Revised Version","Class.Quant.Grav. 22 (2005) 271-282","10.1088/0264-9381/22/2/002",,"gr-qc",,"  We study here the spherical gravitational collapse assuming initial data to
be necessarily smooth, as motivated by the requirements based on physical
reasonableness. A tangential pressure model is constructed and analyzed in
order to understand the final fate of collapse explicitly in terms of the
density and pressure parameters at the initial epoch from which the
collapsedevelops. It is seen that both black holes and naked singularities are
produced as collapse end states even when the initial data is smooth. We show
that the outcome is decided entirely in terms of the initial data, as given by
density, pressure and velocity profiles at the initial epoch, from which the
collapse evolves.
","[{""version"":""v1"",""created"":""Tue, 2 Dec 2003 12:00:28 GMT""},{""version"":""v2"",""created"":""Fri, 17 Dec 2004 15:22:37 GMT""}]","2009-11-10"
"gr-qc/0312017","Jose Geraldo Pereira","R. Aldrovandi, J. P. Beltran Almeida, J. G. Pereira","Time-Varying Cosmological Term: Emergence and Fate of a FRW Universe","RevTeX, 7 pages, no figures. Version 3: title and presentation
  changes; an appendix and references added. Version to be published in
  Gravitation & Cosmology","Grav.Cosmol.11:277-283,2005",,,"gr-qc astro-ph",,"  A time-varying cosmological ""constant"" Lambda is consistent with Einstein's
equation, provided matter and/or radiation is created or destroyed to
compensate for it. Supposing an empty primordial universe endowed with a very
large cosmological term, matter will emerge gradually as Lambda decays.
Provided only radiation or ultrarelativistic matter is initially created, the
universe starts in a nearly de Sitter phase, which evolves towards a FRW regime
as expansion proceeds. If, at some cosmological time, the cosmological term
begins increasing again, as presently observed, expansion will accelerate and
matter and/or radiation will be transformed back into dark energy. It is shown
that such accelerated expansion is a route towards a new kind of gravitational
singular state, characterized by an empty, conformally transitive spacetime in
which all energy is dark.
","[{""version"":""v1"",""created"":""Tue, 2 Dec 2003 15:50:47 GMT""},{""version"":""v2"",""created"":""Tue, 2 Mar 2004 12:23:07 GMT""},{""version"":""v3"",""created"":""Tue, 12 Apr 2005 19:09:49 GMT""}]","2014-11-17"
"hep-ex/0312006","Yury Kudenko","V. Anisimovsky, A. Ivashkin, Yu. Kudenko (Institute for Nuclear
  Research, Moscow)","New search for T-violation in the decays of the charged kaon","10 pages, 4 figures, to be published in the Proceedings of the
  NANP'03, Dubna, Russia, June 23-28, 2003","Phys.Atom.Nucl. 67 (2004) 1989-1994; Yad.Fiz. 67 (2004) 2013-2017","10.1134/1.1825517",,"hep-ex",,"  We report the results of the measurement of T-violating transverse muon
polarization in the decays K^+ --> pi^0 mu^+ nu and K^+ --> mu^+ nu gamma
performed in the experiment E246 at KEK. Preliminary results obtained for the
entire data set taken in the period 1996-2000 are consistent with no
T-violation in both decays.
","[{""version"":""v1"",""created"":""Tue, 2 Dec 2003 09:06:00 GMT""}]","2009-11-10"
"hep-ex/0312007","Vassili Mochalov","V.V. Mochalov and A.N. Vasiliev","Universal threshold for single-spin asymmetries in fixed target
  experiments","9 pages, 8 figures, submitted to Sov. Journ of Nucl Phys","IHEP preprint 2003-26 (in Russian)",,,"hep-ex",,"  The analysis of inclusive $\pi$-meson single spin asymmetry measurements was
done. It was found that the single spin asymmetry starts to grow up at the same
value of the $\pi$-meson energy in the center of mass system for fixed target
experiments at the beam energy range from 13 to 200 GeV.
","[{""version"":""v1"",""created"":""Tue, 2 Dec 2003 10:11:10 GMT""}]","2007-05-23"
"hep-ex/0312008","Wolfgang Wagner","Wolfgang Wagner (for the CDF Collaboration)","Top Quark Cross-Section Measurements at the Tevatron","7 pages, 3 figures. To appear in the proceedings of International
  Europhysics Conference on High-Energy Physics (HEP 2003), Aachen, Germany,
  17-23 Jul 2003","Eur.Phys.J.C33:s238-s240,2004","10.1140/epjcd/s2003-03-120-7","Fermilab-Conf-03/384-E","hep-ex",,"  Run II of the Tevatron collider at Fermilab is well under way and data
samples larger than those of Run I are at hand. In this contribution I
summarize the current status of cross-section measurements for top-quark pair
production at the CDF and D0 experiments.
","[{""version"":""v1"",""created"":""Tue, 2 Dec 2003 15:10:07 GMT""}]","2009-11-10"
"hep-ex/0312009","Vassili Mochalov","V.Mochalov, N.Borisov, A.Davidenko, A.Fedorov, V.Grishin, V.Khodyrev,
  V.Kravtsov, A.Lukhanin, V.Matafonov, Yu.Matulenko, V.Medvedev, Yu.Melnick,
  A.Meschanin, D.Morozov, A.Neganov, L.Nogach, S.Nurushev, Yu.Plis,
  A.Prudkoglyad, P.Semenov, K.Shestermanov, V.Solovianov, L.Soloviev, Yu.Usov,
  A.Vasiliev, A.Yakutin","Recent Results from Protvino Polarized Experiment Proza-M","6 pages, 5 figures; Presented on X International Workshop on High
  Energy Spin Physics (SPIN-03), Dubna, September 16-20","Phys.Part.Nucl. 35 (2004) S121-125",,,"hep-ex",,"  Single Spin Asymmetry $A_N$ (SSA) was measured at the Protvino 70 GeV
accelerator. Asymmetry in the reaction $\ppdup$ is close to zero within error
bars at small $|\xf|$ and $p_T<1.5$ GeV/c. SSA in the reaction $\pimp$ at
polarized target fragmentation region equals to $(-13.8 \pm 3.8)%$ at
$|x_f|>0.4$. There is an indication that the asymmetry begins to rise up at the
same centre of mass system pion energy.
","[{""version"":""v1"",""created"":""Tue, 2 Dec 2003 11:23:20 GMT""}]","2007-05-23"
"hep-ex/0312010","Vassili Mochalov","V.Mochalov, S.Troshin, A.N. Vasiliev","Presence of the Universal Substructures in the Hadrons -- Constituent
  Quarks","4 pages, 3 figures, Presented on X International Workshop on High
  Energy Spin Physics (SPIN-03), Dubna, September 16-20",,,,"hep-ex",,"  The universality of single-spin asymmetry on inclusive $\pi$-meson production
is discussed. This universality can be related to the hadron substructure --
constituent quarks in the frame of the quark model for U-matrix.
","[{""version"":""v1"",""created"":""Tue, 2 Dec 2003 11:33:39 GMT""}]","2007-05-23"
"hep-lat/0312003","David Richards","LHP Collaboration: S. Basak, R. Edwards, R. Fiebig, G. Fleming, U. M.
  Heller, C. Morningstar, D. Richards, I. Sato, S. Wallace","Baryon operators and spectroscopy in lattice QCD","7 pages, 2 figures, to appear in Proceedings of Workshop on Lattice
  Hadron Physics 2003, Cairns, Australia, July 22 - July 30, 2003","Nucl.Phys.Proc.Suppl.128:186-192,2004","10.1016/S0920-5632(03)02476-9","JLAB-THY-03-204","hep-lat",,"  The construction of the operators and correlators required to determine the
excited baryon spectrum is presented, with the aim of exploring the spatial and
spin structure of the states while minimizing the number of propagator
inversions. The method used to construct operators that transform irreducibly
under the symmetries of the lattice is detailed, and the properties of example
operators are studied using domain-wall fermion valence propagators computed on
MILC asqtad dynamical lattices.
","[{""version"":""v1"",""created"":""Mon, 1 Dec 2003 19:52:36 GMT""}]","2014-11-17"
"hep-lat/0312004","Martin J. Savage","S.R. Beane, P.F.Bedaque, A. Parreno and M.J. Savage","Two Nucleons on a Lattice","13 pages, 6 figures","Phys.Lett.B585:106-114,2004","10.1016/j.physletb.2004.02.007","UNH-03-02, LBNL-54092, NT@UW-03-033","hep-lat hep-ph nucl-th",,"  The two-nucleon sector is near an infrared fixed point of QCD and as a result
the S-wave scattering lengths are unnaturally large compared to the effective
ranges and shape parameters. It is usually assumed that a lattice QCD
simulation of the two-nucleon sector will require a lattice that is much larger
than the scattering lengths in order to extract quantitative information. In
this paper we point out that this does not have to be the case: lattice QCD
simulations on much smaller lattices will produce rigorous results for nuclear
physics.
","[{""version"":""v1"",""created"":""Mon, 1 Dec 2003 21:56:26 GMT""}]","2008-11-26"
"hep-lat/0312005","Marco Panero","Michele Caselle, Martin Hasenbusch, Marco Panero","Effective String Picture for Confining Gauge Theories at Finite
  Temperature","Talk given at ``Confinement 2003'', RIKEN, Wako, Japan, July 21-24,
  2003; 5 pages, 2 figures, uses ws-procs9x6.cls",,"10.1142/9789812702845_0044","DESY-03-123","hep-lat",,"  We study the ``effective string picture'' of confinement, deriving
theoretical predictions for the interquark potential at finite temperature. At
low temperatures, the leading string correction to the linear confining
potential between a heavy quark-antiquark pair is the ""L\""uscher term''.
Assuming a Nambu-Goto effective string action, subleading contributions can be
worked out in an analytical way. We also discuss the contribution given by a
possible ``boundary term'' in the effective action, and compare these
predictions with high precision results from simulations of lattice Z(2) gauge
theory in three dimensions, obtained with an algorithm that exploits the
duality of the Z(2) gauge model with the Ising spin model.
","[{""version"":""v1"",""created"":""Tue, 2 Dec 2003 13:56:21 GMT""}]","2017-08-23"
"hep-ph/0312011","Daniele Fargion","D.Fargion","Detecting Solar Neutrino Flares and Flavors","13 pages, 4 figures ; minor editorial corrections","JHEP 0406 (2004) 045","10.1088/1126-6708/2004/06/045",,"hep-ph astro-ph hep-ex nucl-ex",,"  Intense solar flares originated in sun spots produce high energy particles
(protons, $\alpha$) well observable by satellites and ground-based detectors.
The flare onset produces signals in different energy bands (radio, X, gamma and
neutrons). The most powerful solar flares as the ones occurred on 23 February
1956, 29 September 1989 and the more recent on October 28th, and the 2nd, 4th,
13th of November 2003 released in sharp times the largest flare energies
(${E}_{FL} \simeq {10}^{31}\div {10}^{32} erg). The high energy solar flare
protons scatter within the solar corona and they must be source of a prompt
neutrino burst through the production of charged pions. Later on, solar flare
particles hitting the atmosphere may marginally increase the atmospheric
neutrino flux. The prompt solar neutrino flare may be detected in the largest
underground $\nu$ detectors. Our estimate for the October - November 2003 solar
flares gives a number of events above the unity. The electron/muon $\nu$
signals and spectra may reflect the neutrino flavour mixing. A surprising tau
appearance may occur for a hard {E}_nu_mu}} \to {E}_{{\nu}_{\tau}}\simeq> 4
GeV$) flare spectra.
","[{""version"":""v1"",""created"":""Mon, 1 Dec 2003 18:48:54 GMT""},{""version"":""v2"",""created"":""Sat, 6 Dec 2003 16:21:16 GMT""},{""version"":""v3"",""created"":""Fri, 16 Apr 2004 17:59:09 GMT""}]","2009-11-10"
"hep-ph/0312012","Marc Thormeier","Herbi K. Dreiner, Hitoshi Murayama, Marc Thormeier","Anomalous Flavor U(1)_X for Everything","Final version, 59 pages, 1 figure. Compared to v1, there is 1) an
  added discussion on subtleties with Kaehler canonicalization, 2) figure
  improved for printing, 3) references added, 4) correction on treatment of
  seesaw with masses generated by the Giudice-Masiero mechanism, 5) other minor
  corrections","Nucl.Phys.B729:278-316,2005","10.1016/j.nuclphysb.2005.08.047",,"hep-ph",,"  We present an ambitious model of flavor, based on an anomalous U(1)_X gauge
symmetry with one flavon, only two right-handed neutrinos and only two mass
scales: M_{grav} and m_{3/2}. In particular, there are no new scales introduced
for right-handed neutrino masses. The X-charges of the matter fields are such
that R-parity is conserved exactly, higher-dimensional operators are
sufficiently suppressed to guarantee a proton lifetime in agreement with
experiment, and the phenomenology is viable for quarks, charged leptons, as
well as neutrinos. In our model one of the three light neutrinos automatically
is massless. The price we have to pay for this very successful model are highly
fractional X-charges which can likely be improved with less restrictive
phenomenological ansatze for mass matrices.
","[{""version"":""v1"",""created"":""Mon, 1 Dec 2003 20:54:01 GMT""},{""version"":""v2"",""created"":""Fri, 16 Jul 2004 17:20:10 GMT""},{""version"":""v3"",""created"":""Thu, 2 Nov 2006 15:56:16 GMT""}]","2009-09-29"
"hep-ph/0312020","Richard Francois","Francois Richard","Physics of the linear collider","20 pages, 16 figures","Int.J.Mod.Phys. A19 (2004) 1240-1252","10.1142/S0217751X04019147","LAL03-59","hep-ph",,"  This presentation intends to illustrate the specific capabilities of an
e$^+$e$^-$ sub-TeV collider to provide answers on the basic issues in physics:
origin of mass, hierarchy of masses, cosmological problems. Some foreseeable
scenarios are discussed with a possible synergy with LHC.
","[{""version"":""v1"",""created"":""Mon, 1 Dec 2003 16:27:27 GMT""}]","2009-11-10"
"hep-ph/0312021","Ahmet T. Alan","A.T. Alan, A. Senol and O. Cakir","Anomalous Production of Fourth Family Up Quarks at Future Lepton Hadron
  Colliders","published version","Europhys.Lett. 66 (2004) 657-660","10.1209/epl/i2004-10031-y",,"hep-ph",,"  We investigate the production of fourth family up-type quarks using effective
lagrangian approach at future lepton-hadron colliders and study the kinematical
characteristics of the signal with an optimal set of cuts. We obtain the upper
mass limits 500 GeV at THERA and one TeV at Linac $\otimes$ LHC.
","[{""version"":""v1"",""created"":""Mon, 1 Dec 2003 17:27:46 GMT""},{""version"":""v2"",""created"":""Wed, 10 Dec 2003 18:44:21 GMT""},{""version"":""v3"",""created"":""Wed, 2 Jun 2004 15:08:19 GMT""}]","2009-11-10"
"hep-ph/0312022","St\'ephane Munier","S. Munier (Ecole polytechnique), A. Shoshi (Columbia University)","Diffractive photon dissociation in the saturation regime from the Good
  and Walker picture","17 pages, 7 figures, revtex","Phys.Rev. D69 (2004) 074022","10.1103/PhysRevD.69.074022","CPHT-RR.110.1203, CU-TP-1102","hep-ph",,"  Combining the QCD dipole model with the Good and Walker picture, we formulate
diffractive dissociation of a photon of virtuality Q^2 off a hadronic target,
in the kinematical regime in which Q is close to the saturation scale and much
smaller than the invariant mass of the diffracted system. We show how the
obtained formula compares to the HERA data and discuss what can be learnt from
such a phenomenology. In particular, we argue that diffractive observables in
these kinematics provide useful pieces of information on the saturation regime
of QCD.
","[{""version"":""v1"",""created"":""Mon, 1 Dec 2003 18:45:49 GMT""}]","2009-11-10"
"hep-ph/0312023","Michele Frigerio","Michele Frigerio (UCR, Sissa & INFN)","Oscillations and leptogenesis: what can we learn about right-handed
  neutrinos?","20 pages, latex, 1 figure. References added",,,,"hep-ph",,"  Inverting the type-I seesaw formula, we reconstruct the mass matrix of the
heavy right-handed neutrinos $N_i$. We analyze how the data on neutrino
oscillations affect the structure of this matrix. Under the assumption of
hierarchical Dirac-type neutrino masses $m_{Di}$, we compute the mixing angles
among $N_i$, their masses $M_i$ and the lepton asymmetries $\epsilon_i$
generated in their decays. Unless special cancellations take place, one finds
$M_i\propto m_{Di}^2$ and the generated baryon-to-photon ratio $\eta_B$ is much
smaller than the observed value. We show that successful baryogenesis via
leptogenesis occurs in a unique special case, which corresponds to mass
degeneracy and maximal mixing of $N_1$ and $N_2$.
","[{""version"":""v1"",""created"":""Mon, 1 Dec 2003 20:45:58 GMT""},{""version"":""v2"",""created"":""Wed, 7 Apr 2004 22:42:24 GMT""}]","2007-05-23"
"hep-ph/0312024","Scott Willenbrock","J. Campbell, R. K. Ellis, F. Maltoni, S. Willenbrock","Associated Production of a Z Boson and a Single Heavy-Quark Jet","15 pages, 9 figures. Version to appear in Phys. Rev. D","Phys.Rev.D69:074021,2004","10.1103/PhysRevD.69.074021",,"hep-ph",,"  The leading-order process for the production of a Z boson and a heavy-quark
jet at hadron colliders is gQ -> ZQ (Q=c,b). We calculate this cross section at
next-to-leading order at the Tevatron and the LHC, and compare it with other
sources of ZQ events. This process is a background to new physics, and can be
used to measure the heavy-quark distribution function.
","[{""version"":""v1"",""created"":""Mon, 1 Dec 2003 23:45:04 GMT""},{""version"":""v2"",""created"":""Thu, 15 Jan 2004 21:24:40 GMT""}]","2008-11-26"
"hep-ph/0312025","David London","Veronique Page and David London","CP Violation in B -> rho pi: New Physics Signals","8 pages, 1 figure (included), plain LaTeX. Analysis modified: QCD
  factorization used instead of naive factorization; larger |P/T| range taken;
  figure changed; other minor changes; references updated. To be published in
  PRD: Brief Reports","Phys.Rev. D70 (2004) 017501","10.1103/PhysRevD.70.017501","UdeM-GPP-TH-03-116, McGill/03-27","hep-ph",,"  A Dalitz-plot analysis of Bd(t) -> rho pi -> pi+ pi- pi0 decays allows one to
obtain the CP-violating phase \alpha. In addition, one can extract the various
tree (T) and penguin (P) amplitudes contributing to these decays. By comparing
the measured value of |P/T| with the theoretical prediction, one can detect the
presence of physics beyond the standard model.
","[{""version"":""v1"",""created"":""Tue, 2 Dec 2003 03:26:28 GMT""},{""version"":""v2"",""created"":""Sat, 12 Jun 2004 12:10:41 GMT""}]","2009-11-10"
