"cond-mat/0312296","Lars Kecke","Lars Kecke (1) and Wolfgang H\""ausler (1 and 2) ((1) University of
  Freiburg, Germany, (2) University of Hamburg, Germany)","Ladder approximation to spin velocities in quantum wires","6 pages, 6 figures, to appear in Physical Review B","Phys. Rev. B 69, 085103 (2004)","10.1103/PhysRevB.69.085103",,"cond-mat.mes-hall",,"  The spin sector of charge-spin separated single mode quantum wires is
studied, accounting for realistic microscopic electron-electron interactions.
We utilize the ladder approximation (LA) to the interaction vertex and exploit
thermodynamic relations to obtain spin velocities. Down to not too small
carrier densities our results compare well with existing quantum Monte-Carlo
(QMC) data. Analyzing second order diagrams we identify logarithmically
divergent contributions as crucial which the LA includes but which are missed,
for example, by the self-consistent Hartree-Fock approximation. Contrary to
other approximations the LA yields a non-trivial spin conductance. Its
considerably smaller computational effort compared to numerically exact
methods, such as the QMC method, enables us to study overall dependences on
interaction parameters. We identify the short distance part of the interaction
to govern spin sector properties.
","[{""version"":""v1"",""created"":""Thu, 11 Dec 2003 14:57:51 GMT""}]","2007-05-23"
"cond-mat/0312297","Francesco Cordero","F. Cordero, F. Craciun, A. Franco, D. Piazza and C. Galassi","Memory of multiple aging stages above the freezing temperature in the
  relaxor ferroelectric PLZT","Improved version accepted by Phys. Rev. Lett","Phys. Rev. Lett. 93, 097601 (2004)","10.1103/PhysRevLett.93.097601",,"cond-mat.dis-nn cond-mat.mtrl-sci",,"  The dynamic dielectric susceptibility and elastic compliance of the relaxor
ferroelectric PLZT 9/65/35 have been measured under different cooling and
heating protocols, in order to study aging and memory. The memory of multiple
aging stages has been found (several dips in the susceptibility curves on
heating), as in spin glass systems below the glass transition. Remarkably, in
PLZT the memory is retained also above the freezing temperature deduced from
the dynamic susceptibilities. The results are discussed in the light of the
existing models of aging and memory in spin and dipolar glasses.
","[{""version"":""v1"",""created"":""Thu, 11 Dec 2003 15:15:57 GMT""},{""version"":""v2"",""created"":""Tue, 13 Jul 2004 14:30:17 GMT""}]","2010-07-23"
"cond-mat/0312298","Haim Diamant","Bianxiao Cui, Haim Diamant, Binhua Lin and Stuart A. Rice","Anomalous hydrodynamic interaction in a quasi-two-dimensional suspension","4 pages, 4 figures","Phys. Rev. Lett. 92, 258301 (2004)","10.1103/PhysRevLett.92.258301",,"cond-mat.soft physics.chem-ph",,"  We have studied the correlated Brownian motion of micron-sized particles
suspended in water and confined between two plates. The hydrodynamic
interaction between the particles exhibits three anomalies. (i) The transverse
coupling is negative, i.e., particles exert ""anti-drag"" on one another when
moving perpendicular to their connecting line. (ii) The interaction decays with
inter-particle distance r as 1/r^2, faster than in unconfined suspensions but
slower than near a single wall. (iii) At large distances the pair interaction
is independent of concentration within the experimental accuracy. The confined
suspension thus provides an unusual example of long-range, yet essentially
pairwise correlations even at high concentration. These effects are shown to
arise from the two-dimensional dipolar form of the flow induced by
single-particle motion.
","[{""version"":""v1"",""created"":""Thu, 11 Dec 2003 15:29:33 GMT""},{""version"":""v2"",""created"":""Tue, 22 Jun 2004 08:22:14 GMT""}]","2007-05-23"
"cond-mat/0312299","S. A. Grigera","S. A. Grigera (St. Andrews), A. J. Schofield (Birmingham), S. Rabello
  and Q. Si (Rice)","Momentum Resolved tunneling in a Luttinger Liquid",,,,,"cond-mat.str-el",,"  We consider momentum resolved tunneling between a Luttinger liquid and a two
dimensional electron gas as a function of transverse magnetic field. We include
the effects of an anomalous exponent and Zeeman splitting on both the Luttinger
liquid and the two dimensional electron gas. We show that there are six
dispersing features that should be observed in magneto-tunneling, in contrast
with the four features that would be seen in a non-interacting one dimensional
electron gas. The strength of these features varies with the anomalous
exponent, being most pronounced when $\gamma_\rho=0$. We argue that this
measurement provides an important experimental signature of spin-charge
separation.
","[{""version"":""v1"",""created"":""Thu, 11 Dec 2003 15:37:20 GMT""}]","2007-05-23"
"cs/0312019","Aniello Buonocore","Laura Bozzelli, Massimo Benerecetti and Adriano Peron","Verification of recursive parallel systems","49 pages, 1 figure",,,,"cs.LO",,"  In this paper we consider the problem of proving properties of infinite
behaviour of formalisms suitable to describe (infinite state) systems with
recursion and parallelism. As a formal setting, we consider the framework of
Process Rewriting Systems (PRSs). For a meaningfull fragment of PRSs, allowing
to accommodate both Pushdown Automata and Petri Nets, we state decidability
results for a class of properties about infinite derivations (infinite term
rewritings). The given results can be exploited for the automatic verification
of some classes of linear time properties of infinite state systems described
by PRSs. In order to exemplify the assessed results, we introduce a meaningful
automaton based formalism which allows to express both recursion and
multi--treading.
","[{""version"":""v1"",""created"":""Thu, 11 Dec 2003 14:54:06 GMT""}]","2011-11-09"
"gr-qc/0312060","Hendryk Pfeiffer","Hendryk Pfeiffer","Diffeomorphisms from finite triangulations and absence of 'local'
  degrees of freedom","4 pages, RevTeX with combined PicTeX/postscript figures; v2:
  presentation improved, typos corrected","Phys.Lett.B591:197-201,2004","10.1016/j.physletb.2004.04.026","DAMTP-2003-132","gr-qc",,"  If the diffeomorphism symmetry of general relativity is fully implemented
into a path integral quantum theory, the path integral leads to a partition
function which is an invariant of smooth manifolds. We comment on the physical
implications of results on the classification of smooth and piecewise-linear
4-manifolds which show that the partition function can already be computed from
a triangulation of space-time. Such a triangulation characterizes the topology
and the differentiable structure, but is completely unrelated to any physical
cut-off. It can be arbitrarily refined without affecting the physical
predictions and without increasing the number of degrees of freedom
proportionally to the volume. Only refinements at the boundary have a physical
significance as long as the experimenters who observe through this boundary,
can increase the resolution of their measurements. All these are consequences
of the symmetries. The Planck scale cut-off expected in quantum gravity is
rather a dynamical effect.
","[{""version"":""v1"",""created"":""Wed, 10 Dec 2003 17:24:35 GMT""},{""version"":""v2"",""created"":""Mon, 26 Apr 2004 15:50:56 GMT""}]","2008-11-26"
"gr-qc/0312061","Carlo Ungarelli Dr","Carlo Ungarelli and Alberto Vecchio","A family of filters to search for frequency dependent gravitational wave
  stochastic backgrounds","4 pages, 4 figures, uses iopart.cls, accepted for publications on
  Classical and Quantum Gravity (Special Issue, Proceedings of Amaldi 2003)","Class.Quant.Grav. 21 (2004) S857-S860","10.1088/0264-9381/21/5/072",,"gr-qc",,"  We consider a three dimensional family of filters based on broken power law
spectra to search for gravitational wave stochastic backgrounds in the data
from Earth-based laser interferometers. We show that such templates produce the
necessary fitting factor for a wide class of cosmological backgrounds and
astrophysical foregrounds and that the total number of filters required to
search for those signals in the data from first generation laser
interferometers operating at the design sensitivity is fairly small
","[{""version"":""v1"",""created"":""Wed, 10 Dec 2003 17:54:29 GMT""}]","2009-11-10"
"gr-qc/0312062","Hans-Thomas Elze","Hans-Thomas Elze","Quantum features in statistical observations of ""timeless"" classical
  systems","7 pages. Invited talk at Int. Workshop Trends and Perspectives on
  Extensive and Non-Extensive Statistical Mechanics, Angra dos Reis (Brazil),
  Nov. 2003. To appear in Physica A","Physica A344:478-483,2004","10.1016/j.physa.2004.06.017",,"gr-qc quant-ph",,"  We pursue the view that quantum theory may be an emergent structure related
to large space-time scales. In particular, we consider classical Hamiltonian
systems in which the intrinsic proper time evolution parameter is related
through a probability distribution to the discrete physical time. This is
motivated by studies of ``timeless'' reparametrization invariant models, where
discrete physical time has recently been constructed based on coarse-graining
local observables. Describing such deterministic classical systems with the
help of path-integrals, primordial states can naturally be introduced which
follow unitary quantum mechanical evolution in suitable limits.
","[{""version"":""v1"",""created"":""Thu, 11 Dec 2003 14:05:02 GMT""}]","2014-11-17"
"gr-qc/0312063","Hrvoje Nikolic","H. Nikolic","Time in quantum gravity by weakening the Hamiltonian constraint","4 pages",,,,"gr-qc hep-th quant-ph",,"  We replace the usual Hamiltonian constraint of quantum gravity H|psi>=0 by a
weaker one <psi|H|psi>=0. This allows |psi> to satisfy the time-dependent
functional Schrodinger equation. In general, only the phase of the wave
function appears to be time independent. The resulting quantum theory has the
correct classical limit and thus provides a viable theory of quantum gravity
that solves the problem of time without introducing additional nongravitational
degrees of freedom.
","[{""version"":""v1"",""created"":""Thu, 11 Dec 2003 15:16:57 GMT""}]","2007-05-23"
"hep-ex/0312034","Pamela Morehouse","D. Asner (for the CLEO Collaboration)","The CLEO-c Research Program","5 pages, also available http://www.lns.cornell.edu/public/TALK/2003/,
  Presented at 9th International Conference on B Physics at Hadron
  Machines(Beauty2003), Pittsburgh, PA, Oct. 14-18, 2003","AIP Conf.Proc.722:82-86,2004","10.1063/1.1807301","CLEO TALK 03-29","hep-ex",,"  The CLEO-c research program will include studies of leptonic, semileptonic
and hadronic charm decays, searches for exotic and gluonic matter, and test for
physics beyond the Standard Model. In the summer of 2003 the experiment and the
CESR accelerator were modified to operate at center-of-mass energies between 3
and 5 GeV. Data at the psi(3770) resonance were recorded with the CLEO-c
detector in September 2003. beginning a new era in the exploration of the charm
sector.
","[{""version"":""v1"",""created"":""Wed, 10 Dec 2003 18:52:45 GMT""},{""version"":""v2"",""created"":""Thu, 11 Dec 2003 13:30:41 GMT""}]","2011-01-27"
"hep-ex/0312035","Krishna Kumar","the SLAC E158 Collaboration: P.L. Anthony, et al","Observation of Parity Nonconservation in Moller Scattering","Version 3 is the same as version 2. These versions contain minor text
  changes from referee comments and a change in the extracted value of Q^e_W
  and sin^2\theta_W due to a change in the theoretical calculation of the
  bremsstrahulung correction (ref. 16)","Phys.Rev.Lett.92:181602,2004","10.1103/PhysRevLett.92.181602",,"hep-ex nucl-ex",,"  We report a measurement of the parity-violating asymmetry in fixed target
electron-electron (Moller) scattering: A_PV = -175 +/- 30 (stat.) +/- 20
(syst.) parts per billion. This first direct observation of parity
nonconservation in Moller scattering leads to a measurement of the electron's
weak charge at low energy Q^e_W = -0.053 +/- 0.011. This is consistent with the
Standard Model expectation at the current level of precision:
sin^2\theta_W(M_Z)_MSbar = 0.2293 +/- 0.0024 (stat.) +/- 0.0016 (syst.) +/-
0.0006 (theory).
","[{""version"":""v1"",""created"":""Wed, 10 Dec 2003 20:38:55 GMT""},{""version"":""v2"",""created"":""Mon, 3 May 2004 15:28:43 GMT""},{""version"":""v3"",""created"":""Wed, 12 May 2004 03:33:38 GMT""}]","2010-03-19"
"hep-ex/0312036","Jochen Schieck R.","Jochen Schieck (for the OPAL collaboration)","Measurement of alpha_s in radiative hadronic events at OPAL","4 pages, 1 figure, contribution to the QCD '03 conference",,,"MPP-2003-136","hep-ex",,"  Hadronic final states with a hard isolated photon are studied using data
taken at centre-of-mass energies around $\Mz$ with the OPAL detector at LEP.
The strong coupling $\as$ is extracted by fitting event shape variables for the
reduced centre-of-mass energies ranging from 20 GeV to 80 GeV, and the energy
dependence of $\as$ is studied. Combining all the values using different event
shape variables and energies gives:
  \asmz=0.1176\pm 0.0012(stat.)^{+0.0093}_{-0.0085}(syst.).
","[{""version"":""v1"",""created"":""Wed, 10 Dec 2003 18:24:18 GMT""}]","2007-05-23"
"hep-ex/0312037","Mina Nozar","Mina Nozar","3pi photo-production with CLAS","Gluonic Excitations workshop proceedings",,,,"hep-ex",,"  The $3\pi$ system produced in the reaction $\gamma p \to
\pi^{+}\pi^{+}\pi^{-} n$ at $4.8-5.4$ GeV is investigated from the E01-017
(g6c) running of CLAS. This energy range allows for the study of excited mesons
in the 1-2 GeV mass range, in their decay to $3\pi$, proceeding through $\rho
\pi$ and $f_2 \pi$ emissions. At these energies, there is significant overlap
in phase space for events with $\rho$ and $f_2$ production, recoiling off an
excited baryon, such as the $\Delta(1232)$, $N^*(1520)$ and $N^*(1680)$. We
show that after few kinematic selections, events of the latter type are
suppressed in the final data set, allowing us to perform a PWA on the $3\pi$
system.
","[{""version"":""v1"",""created"":""Wed, 10 Dec 2003 19:38:58 GMT""}]","2007-05-23"
"hep-ph/0312131","Stephen Parke","Olga Mena and Stephen Parke (Fermilab)","Unified Graphical Summary of Neutrino Mixing Parameters","4 pages, Latex, 2 postscript figures","Phys.Rev. D69 (2004) 117301","10.1103/PhysRevD.69.117301","FERMILAB-Pub-03/377-T","hep-ph",,"  The neutrino mixing parameters are presented in a number of different ways by
the various experiments, e.g. SuperKamiokande, K2K, SNO, KamLAND and Chooz and
also by the Particle Data Group. In this paper, we argue that presenting the
data in terms of $\sin^2 \theta$, where $\theta$ is the mixing angle
appropriate for a given experiment has a direct physical interpretation. For
current atmospheric, solar and reactor neutrino experiments, the $\sin^2
\theta$'s are effectively the probability of finding a given flavor in a
particular neutrino mass eigenstate. The given flavor and particular mass
eigenstate varies from experiment to experiment, however, the use of $\sin^2
\theta$ provides a unified picture of all the data. Using this unified picture
we present a graphical way to represent these neutrino mixing parameters which
includes the uncertainties. All of this is performed in the context of the
present experimental status of three neutrino oscillations.
","[{""version"":""v1"",""created"":""Wed, 10 Dec 2003 20:39:01 GMT""}]","2009-11-10"
"hep-ph/0312142","Nora Brambilla","Nora Brambilla (Milano)","Potential models, sum rules, color singlet model versus NREFT in Heavy
  Quarkonium","Talk at the International Workshop on QCD: QCD@Work 2003- Conversano
  (Italy) 14-18 June 2003 (eConf C030614), 6 pages, uses wQCD03.cls",,,"IFUM-780-FT","hep-ph",,"  I briefly review how nonrelativistic effective field theories solve old
puzzles and open problems in heavy quarkonium physics.
","[{""version"":""v1"",""created"":""Wed, 10 Dec 2003 17:36:06 GMT""}]","2007-05-23"
"hep-ph/0312143","Luis A. Sanchez","William A. Ponce, Diego A. Gutierrez, Luis A. Sanchez","SU(3)_c X SU(4)_L X U(1)_x without exotic electric charges","RevTeX, 11 pages, 1 figure. Several formulas corrected. One reference
  added. Accepted for publication in Phys. Rev. D","Phys.Rev.D69:055007,2004","10.1103/PhysRevD.69.055007",,"hep-ph",,"  We present an extension of the Standard Model to the local gauge group
$SU(3)_c\otimes SU(4)_L\otimes U(1)_X$ with a family non-universal treatment
and anomalies canceled among the three families in a nontrivial fashion. The
mass scales, the gauge boson masses, and the masses for the spin 1/2 particles
in the model are analyzed. The neutral currents coupled to all neutral vector
bosons in the model are studied, and particular values of the parameters are
used in order to simplify the mixing between the three neutral currents present
in the theory, mixing which is further constrained by experimental results from
the CERN LEP, SLAC Linear Collider, and atomic parity violation.
","[{""version"":""v1"",""created"":""Wed, 10 Dec 2003 18:14:46 GMT""},{""version"":""v2"",""created"":""Sun, 15 Feb 2004 00:58:25 GMT""},{""version"":""v3"",""created"":""Tue, 9 Mar 2004 02:45:11 GMT""}]","2011-03-23"
"hep-ph/0312144","Dmitri Diakonov","Dmitri Diakonov (NORDITA and St. Petersburg NPI) and Victor Petrov
  (St. Petersburg NPI)","A heretical view on linear Regge trajectories","24 pages, 6 figures",,,"LNPI-88-1394, NORDITA-2003-92 NP","hep-ph",,"  We discuss a possibility that linear Regge trajectories originate not from
gluonic strings connecting quarks, as it is usually assumed, but from pion
excitations of light hadrons. From this point of view, at large angular momenta
both baryons and mesons lying on linear Regge trajectories are slowly rotating
thick strings of pion field, giving rise to a universal slope computable from
the pion decay constant. The finite resonance widths are mainly due to the
semiclassical radiation of pion fields by the rotating elongated chiral
solitons. Quantum fluctuations about the soliton determine a string theory
which, being quantized, gives the quantum numbers for Regge trajectories.
","[{""version"":""v1"",""created"":""Wed, 10 Dec 2003 19:07:35 GMT""}]","2007-05-23"
"hep-ph/0312145","Ulrich Nierste","Sebastian Jager and Ulrich Nierste","B_s-B_s-bar mixing in an SO(10) SUSY GUT model","4 pages, 2 figures","Eur.Phys.J.C33:s256-s258,2004","10.1140/epjcd/s2004-03-1581-y","FERMILAB-Conf-03/394-T","hep-ph",,"  We perform a renormalisation group analysis of the SO(10) model proposed by
Chang, Masiero and Murayama, which links the large atmospheric neutrino mixing
angle to loop-induced transitions between right-handed b and s quarks. We
compute the impact on B_s-B_s-bar mixing and find that the mass difference in
the B_s system can exceed its Standard Model value by a factor of 16.
","[{""version"":""v1"",""created"":""Wed, 10 Dec 2003 21:19:42 GMT""}]","2011-09-13"
"hep-ph/0312146","Igor Machulin","I.N. Machulin, S.V. Tolokonnikov","Neutrino flavour relaxation or neutrino oscillations?",,"JETP Lett. 79 (2004) 249-252; Pisma Zh.Eksp.Teor.Fiz. 79 (2004)
  307-310","10.1134/1.1759403",,"hep-ph",,"  We propose the new mechanism of neutrino flavour relaxation to explain the
experimentally observed changes of initial neutrino flavour fluxes. The test of
neutrino relaxation hypothesis is presented, using the data of modern reactor,
solar and accelerator experiments. The final choice between the standard
neutrino oscillations and the proposed neutrino flavour relaxation model can be
done in future experiments.
","[{""version"":""v1"",""created"":""Thu, 11 Dec 2003 00:13:47 GMT""}]","2009-11-10"
"hep-ph/0312147","Jae-hyeon Park","P. Ko (1), Jungil Lee (2 and 3), Taekoon Lee (4), Jae-hyeon Park (1)
  ((1) KAIST, (2) KIAS, (3) Argonne, (4) SNU)","Chiral perturbation theory for pentaquark baryons and its applications","4 pages","Phys.Lett. B611 (2005) 87-92","10.1016/j.physletb.2005.02.031","ANL-HEP-PR-03-102, KAIST-TH 2003/11, KIAS-P03085","hep-ph hep-ex nucl-th",,"  We construct a chiral lagrangian for pentaquark baryons assuming that the
recently found Theta^+ (1540) state belongs to an antidecuplet of SU(3) flavor
symmetry with J^P = (1/2)^(+-). We derive the Gell-Mann-Okubo formulae for the
antidecuplet baryon masses, and a possible mixing between the antidecuplet and
the pentaquark octet. Then we calculate the cross sections for pi^- p -> K^-
Theta^+ and gamma n -> K^- Theta^+ using our chiral lagrangian. The resulting
amplitudes respect the underlying chiral symmetry of QCD correctly. We also
describe how to include the light vector mesons in the chiral lagrangian.
","[{""version"":""v1"",""created"":""Thu, 11 Dec 2003 03:27:45 GMT""}]","2009-11-10"
"hep-ph/0312148","Alessandro Vicini","Alessandro Vicini","The electric charge at the two-loop level in the Standard Model and the
  precision measurements of Delta alpha_{had}","Talk given at the workshop SIGHAD03, Pisa, 8-10 October 2003, two
  references added",,"10.1016/S0920-5632(04)00018-0",,"hep-ph",,"  The complete calculation of the 2-loop electroweak corrections to the
renormalization of the electric charge in the Standard Model allows to discuss
in detail the value of the MSbar effective coupling $\hat e(m_Z)$. We discuss
the phenomenological impact of these results in view of the increasing accuracy
in the measurements of the cross-section of the reaction e+e- -->hadrons at low
energies.
","[{""version"":""v1"",""created"":""Thu, 11 Dec 2003 14:52:16 GMT""},{""version"":""v2"",""created"":""Tue, 16 Dec 2003 13:14:15 GMT""}]","2009-11-10"
"hep-ph/0312149","Dani\""el Boer","Daniel Boer","Theoretical aspects of spin physics","10 pages, 11 eps figures; Talk presented at the Ringberg Workshop
  `New Trends in HERA Physics 2003', Ringberg Castle, Tegernsee, Germany,
  September 28 - October 3, 2003",,"10.1142/9789812702722_0008",,"hep-ph",,"  A summary is given of how spin enters in collinearly factorizing processes.
Next, theoretical aspects of polarization in processes beyond collinear
factorization are discussed in more detail, with special focus on recent
developments concerning the color gauge invariant definitions of transverse
momentum dependent distribution and fragmentation functions, such as the Sivers
and Collins effect functions. This has particular relevance for azimuthal
single spin asymmetries, which currently receive much theoretical and
experimental attention.
","[{""version"":""v1"",""created"":""Thu, 11 Dec 2003 09:46:53 GMT""}]","2017-08-23"
"hep-ph/0312150","Hartmut Abele","H. Abele, E. Barberio, D. Dubbers, F. Glueck, J.C. Hardy, W.J.
  Marciano, A. Serebrov, N. Severijns","Quark Mixing, CKM Unitarity","accepted by EPJ C","Eur.Phys.J.C33:1-8,2004","10.1140/epjc/s2003-01574-8","HA-03-12","hep-ph",,"  In the Standard Model of elementary particles, quark-mixing is expressed in
terms of a 3 x 3 unitary matrix V, the so called Cabibbo-Kobayashi-Maskawa
(CKM) matrix. Significant unitarity checks are so far possible for the first
row of this matrix. This article reviews the experimental and theoretical
information on these matrix elements. On the experimental side, we find a 2.2
sigma to 2.7 sigma deviation from unitarity, which conflicts with the Standard
Model.
","[{""version"":""v1"",""created"":""Thu, 11 Dec 2003 11:30:00 GMT""}]","2012-07-03"
"hep-ph/0312151","Lev Okun","L.B Okun, M.V. Rotaev, M.G. Schepkin and I.S. Tsukerman","A remark on the ""Theory of neutrino oscillations""","2 pages, no figures",,,,"hep-ph",,"  It is shown that the derivation of standard oscillation phase in the plane
wave approximation without equal energy assumption is fraught with
inconsistencies.
","[{""version"":""v1"",""created"":""Thu, 11 Dec 2003 13:40:07 GMT""}]","2007-05-23"
"hep-ph/0312153","Christoph Adam","C. Adam and F.R. Klinkhamer","Comment on ""Vacuum Photon Splitting in Lorentz-Violating Quantum
  Electrodynamics""","3 pages revtex4",,,"KA-TP-06-200","hep-ph",,"  It has been argued in hep-ph/0212382 that there may be observable effects
from photon triple splitting in an extended version of quantum electrodynamics
with Lorentz violation in the fermion sector. The argument is based on an
analogy with photon splitting via collinear parametric down-conversion in
optically active crystals. In this Comment, we point out that the analogy is
misleading and that, at the order considered, the probability of on-shell
photon triple splitting is strictly zero.
","[{""version"":""v1"",""created"":""Thu, 11 Dec 2003 15:18:45 GMT""}]","2007-05-23"
"hep-ph/0312154","Steen Hannestad","Steen Hannestad (SDU), Georg Raffelt (MPP Munich)","Cosmological mass limits on neutrinos, axions, and other light particles","15 pages, 6 figures, matches version in JCAP","JCAP 0404 (2004) 008","10.1088/1475-7516/2004/04/008",,"hep-ph",,"  The small-scale power spectrum of the cosmological matter distribution
together with other cosmological data provides a sensitive measure of the hot
dark matter fraction, leading to restrictive neutrino mass limits. We extend
this argument to generic cases of low-mass thermal relics. We vary the cosmic
epoch of thermal decoupling, the radiation content of the universe, and the new
particle's spin degrees of freedom. Our treatment covers various scenarios of
active plus sterile neutrinos or axion-like particles. For three degenerate
massive neutrinos, we reproduce the well-known limit of m_nu < 0.34 eV. In a
3+1 scenario of 3 massless and 1 fully thermalized sterile neutrino we find
m_nu < 1.0 eV. Thermally produced QCD axions must obey m_a < 3.0 eV,
superseding limits from a direct telescope search, but leaving room for solar
eV-mass axions to be discovered by the CAST experiment.
","[{""version"":""v1"",""created"":""Thu, 11 Dec 2003 15:37:01 GMT""},{""version"":""v2"",""created"":""Fri, 16 Apr 2004 12:49:21 GMT""}]","2009-11-10"
