"hep-th/0312097","Scott Watson","Scott Watson and Robert Brandenberger","Linear Perturbations in Brane Gas Cosmology","17 pages, 1 figure","JHEP 0403:045,2004","10.1088/1126-6708/2004/03/045",,"hep-th astro-ph gr-qc hep-ph",,"  We consider the effect of string inhomogeneities on the time dependent
background of Brane Gas Cosmology. We derive the equations governing the linear
perturbations of the dilaton-gravity background in the presence of string
matter sources. We focus on long wavelength fluctuations and find that there
are no instabilities. Thus, the predictions of Brane Gas Cosmology are robust
against the introduction of linear perturbations. In particular, we find that
the stabilization of the extra dimensions (moduli) remains valid in the
presence of dilaton and string perturbations.
","[{""version"":""v1"",""created"":""Wed, 10 Dec 2003 20:44:39 GMT""}]","2010-02-03"
"hep-th/0312099","Markus A. Luty","Nima Arkani-Hamed, Hsin-Chia Cheng, Markus A. Luty, Shinji Mukohyama","Ghost Condensation and a Consistent Infrared Modification of Gravity","42 pages, LaTeX 2e","JHEP 0405 (2004) 074","10.1088/1126-6708/2004/05/074","HUTP-03/A081, UMD-PP-04-012","hep-th astro-ph gr-qc hep-ph",,"  We propose a theoretically consistent modification of gravity in the
infrared, which is compatible with all current experimental observations. This
is an analog of Higgs mechanism in general relativity, and can be thought of as
arising from ghost condensation--a background where a scalar field \phi has a
constant velocity, <\dot\phi> = M^2. The ghost condensate is a new kind of
fluid that can fill the universe, which has the same equation of state, \rho =
-p, as a cosmological constant, and can hence drive de Sitter expansion of the
universe. However, unlike a cosmological constant, it is a physical fluid with
a physical scalar excitation, which can be described by a systematic effective
field theory at low energies. The excitation has an unusual low-energy
dispersion relation \omega^2 \sim k^4 / M^2. If coupled to matter directly, it
gives rise to small Lorentz-violating effects and a new long-range 1/r^2 spin
dependent force. In the ghost condensate, the energy that gravitates is not the
same as the particle physics energy, leading to the possibility of both sources
that can gravitate and antigravitate. The Newtonian potential is modified with
an oscillatory behavior starting at the distance scale M_{Pl}/M^2 and the time
scale M_{Pl}^2/M^3. This theory opens up a number of new avenues for attacking
cosmological problems, including inflation, dark matter and dark energy.
","[{""version"":""v1"",""created"":""Wed, 10 Dec 2003 20:55:45 GMT""}]","2009-11-10"
"hep-th/0312100","Paolo Creminelli","Nima Arkani-Hamed, Paolo Creminelli, Shinji Mukohyama and Matias
  Zaldarriaga","Ghost Inflation","19 pages, v2:some corrections in sec. 4. Published version","JCAP 0404:001,2004","10.1088/1475-7516/2004/04/001","HUTP-03/A079","hep-th astro-ph gr-qc hep-ph",,"  We propose a new scenario for early cosmology, where an inflationary de
Sitter phase is obtained with a ghost condensate. The transition to radiation
dominance is triggered by the ghost itself, without any slow-roll potential.
Density perturbations are generated by fluctuations around the ghost condensate
and can be reliably computed in the effective field theory. The fluctuations
are scale invariant as a consequence of the de Sitter symmetries, however, the
size of the perturbations are parametrically different from conventional
slow-roll inflation, and the inflation happens at far lower energy scales. The
model makes definite predictions that distinguish it from standard inflation,
and can be sharply excluded or confirmed by experiments in the near future. The
tilt in the scalar spectrum is predicted to vanish (n_s=1), and the gravity
wave signal is negligible. The non-Gaussianities in the spectrum are predicted
to be observable: the 3-point function is determined up to an overall order 1
constant, and its magnitude is much bigger than in conventional inflation, with
an equivalent f_NL ~ 100, not far from the present WMAP bounds.
","[{""version"":""v1"",""created"":""Wed, 10 Dec 2003 18:51:46 GMT""},{""version"":""v2"",""created"":""Fri, 19 Mar 2004 23:06:32 GMT""}]","2011-05-05"
"hep-th/0312102","Ulf Gran","Eric Bergshoeff, Andres Collinucci, Ulf Gran, Mikkel Nielsen and
  Diederik Roest","Transient Quintessence from Group Manifold Reductions or how all roads
  lead to Rome","31 pages, 4 figures, 5 tables. v2: minor corrections, references
  added. v3: references and minor clarifications added","Class.Quant.Grav.21:1947-1970,2004","10.1088/0264-9381/21/8/003",,"hep-th astro-ph gr-qc",,"  We investigate the accelerating phases of cosmologies supported by a metric,
scalars and a single exponential scalar potential. The different solutions can
be represented by trajectories on a sphere and we find that quintessence
happens within the ""arctic circle"" of the sphere.
  Furthermore, we obtain multi-exponential potentials from 3D group manifold
reductions of gravity, implying that such potentials can be embedded in gauged
supergravities with an M-theory origin. We relate the double exponential case
to flux compactifications on maximally symmetric spaces and S-branes. In the
triple exponential case our analysis suggests the existence of two exotic
S(D-3)-branes in D dimensions.
","[{""version"":""v1"",""created"":""Wed, 10 Dec 2003 17:46:18 GMT""},{""version"":""v2"",""created"":""Fri, 12 Dec 2003 18:51:46 GMT""},{""version"":""v3"",""created"":""Thu, 8 Jan 2004 15:38:35 GMT""}]","2009-02-24"
"hep-th/0312114","Daniel Litim","Daniel F. Litim","Fixed points of quantum gravity","explanations added, typo in P_1 corrected, to be published by PRL","Phys.Rev.Lett.92:201301,2004","10.1103/PhysRevLett.92.201301","CERN-TH-2003-299, SHEP 03-32","hep-th hep-ph",,"  Euclidean quantum gravity is studied with renormalisation group methods.
Analytical results for a non-trivial ultraviolet fixed point are found for
arbitrary dimensions and gauge fixing parameter in the Einstein-Hilbert
truncation. Implications for quantum gravity in four dimensions are discussed.
","[{""version"":""v1"",""created"":""Wed, 10 Dec 2003 20:35:05 GMT""},{""version"":""v2"",""created"":""Tue, 16 Mar 2004 10:04:40 GMT""}]","2010-04-06"
"hep-th/0312115","Jacques Distler","Aaron Bergman, Jacques Distler and Uday Varadarajan","1+1 Dimensional Critical String Theory and Holography","9 pages, no figures. LaTeX2e (using utarticle.cls and utphys.bst)",,,"UTTG-07-03","hep-th",,"  In hep-th/0310120, Goheer, Kleban and Susskind argued that the holographic
principle is inconsistent with the existence of stable, Lorentz invariant, 1+1
dimensional compactifications. We note some difficulties with their analysis
and present two novel backgrounds of string theory with 1+1 noncompact
dimensions that satisfy their conditions yet possess 16 or 24 supersymmetries.
It is difficult to believe that such backgrounds could be unstable.
","[{""version"":""v1"",""created"":""Wed, 10 Dec 2003 22:13:53 GMT""}]","2007-05-23"
"hep-th/0312116","Gerald V. Dunne","Gerald V. Dunne and Christian Schubert","Self-duality, Helicity and Higher-loop Euler-Heisenberg Effective
  Actions","7 pp, latex, axodraw.sty; Based on talks given by G. Dunne at QTS3
  (Cincinnati, OH, Sept. 2003) and QFEXT03 (Norman, OK, Sept. 2003)",,"10.1142/9789812702340_0037",,"hep-th hep-ph math-ph math.MP",,"  The Euler-Heisenberg effective action in a self-dual background is remarkably
simple at two-loop. This simplicity is due to the inter-relationship between
self-duality, helicity and supersymmetry. Applications include two-loop
helicity amplitudes, beta-functions and nonperturbative effects. The two-loop
Euler-Heisenberg effective Lagrangian for QED in a self-dual background field
is naturally expressed in terms of one-loop quantities. This mirrors similar
behavior recently found in two-loop amplitudes in N=4 SUSY Yang-Mills theory.
","[{""version"":""v1"",""created"":""Thu, 11 Dec 2003 15:22:39 GMT""}]","2017-08-23"
"hep-th/0312118","Alexander Reshetnyak","A.A.Reshetnyak (Seversk State Technological Institute)","Basic features of General Superfield Quantization Method for gauge
  theories in Lagrangian formalism","v1: 6p., no figures, talk given at International Workshop
  ""Supersymmetries and Quantum Symmetries"" - SQS'03 (Dedicated to the 75th
  anniversary of the birth of V.I.Ogievetsky); JINR, Dubna; July 24-29, 2003;
  v2: final version, typos corrected, formulae (1), (5), (8), (14)-(16), (21),
  (26), (27), (30), (31), formulations and statements improved","Supersymmetries and Quantum Symmetries - (SQS'03): Proc. of
  Intern. Workshop (Dubna; July 24-29, 2003).- Dubna: JINR, 2004.- p.345-350",,,"hep-th",,"  The rules for superfield Lagrangian quantization method for general gauge
theories on a basis of their generalization to special superfield models within
a so-called $\theta$-superfield theory of fields ($\theta$-STF) are formulated.
The $\theta$-superfield generating functionals of Green's functions together
with effective action are constructed. Their properties including new
interpretation and superfield realization of BRST transformations, Ward
identities are studied.
","[{""version"":""v1"",""created"":""Thu, 11 Dec 2003 10:35:05 GMT""},{""version"":""v2"",""created"":""Mon, 18 Oct 2004 05:44:01 GMT""}]","2007-05-23"
"hep-th/0312119","Gesualdo Delfino","Gesualdo Delfino","Integrable field theory and critical phenomena. The Ising model in a
  magnetic field","42 pages; invited review article for J. Phys. A","J.Phys.A37:R45,2004","10.1088/0305-4470/37/14/R01",,"hep-th cond-mat.stat-mech hep-lat",,"  The two-dimensional Ising model is the simplest model of statistical
mechanics exhibiting a second order phase transition. While in absence of
magnetic field it is known to be solvable on the lattice since Onsager's work
of the forties, exact results for the magnetic case have been missing until the
late eighties, when A.Zamolodchikov solved the model in a field at the critical
temperature, directly in the scaling limit, within the framework of integrable
quantum field theory. In this article we review this field theoretical approach
to the Ising universality class, with particular attention to the results
obtained starting from Zamolodchikov's scattering solution and to their
comparison with the numerical estimates on the lattice. The topics discussed
include scattering theory, form factors, correlation functions, universal
amplitude ratios and perturbations around integrable directions. Although we
restrict our discussion to the Ising model, the emphasis is on the general
methods of integrable quantum field theory which can be used in the study of
all universality classes of critical behaviour in two dimensions.
","[{""version"":""v1"",""created"":""Thu, 11 Dec 2003 13:46:03 GMT""}]","2009-11-10"
"hep-th/0312120","Akifumi Sako","Akifumi Sako","Noncommutative Cohomological Field Theories and Topological Aspects of
  Matrix models","30 pages, LaTeX 2e. In ver.3 misprints corrected, published in
  Noncommutative Geometry and Physics,p321-355,World Scientific",,,,"hep-th math-ph math.MP",,"  We study topological aspects of matrix models and noncommutative
cohomological field theories (N.C.CohFT). N.C.CohFT have symmetry under the
arbitrary infinitesimal noncommutative parameter $\theta$ deformation. This
fact implies that N.C.CohFT possess a less sensitive topological property than
K-theory, but the classification of manifolds by N.C.CohFT has a possibility to
give a new view point of global characterization of noncommutative manifolds.
To investigate properties of N.C.CohFT, we construct some models whose fixed
point loci are given by sets of projection operators. Particularly, the
partition function on the Moyal plane is calculated by using a matrix model.
The moduli space of the matrix model is a union of Grassman manifolds. The
partition function of the matrix model is calculated using the Euler number of
the Grassman manifold. Identifying the N.C.CohFT with the matrix model, we get
the partition function of the N.C.CohFT. To check the independence of the
noncommutative parameters, we also study the moduli space in the large $\theta$
limit and the finite $\theta$, for the Moyal plane case. If the partition
function of N.C.CohFT is topological in the sense of the noncommutative
geometry, then it should have some relation with K-theory. Therefore we
investigate certain models of CohFT and N.C.CohFT from the point of view of
K-theory. These observations give us an analogy between CohFT and N.C.CohFT in
connection with K-theory. Furthermore, we verify it for the Moyal plane and
noncommutative torus cases that our partition functions are invariant under the
those deformations which do not change the K-theory. Finally, we discuss the
noncommutative cohomological Yang-Mills theory.
","[{""version"":""v1"",""created"":""Thu, 11 Dec 2003 15:43:46 GMT""},{""version"":""v2"",""created"":""Tue, 23 Dec 2003 23:12:09 GMT""},{""version"":""v3"",""created"":""Thu, 24 Nov 2005 16:40:54 GMT""}]","2007-05-23"
"math-ph/0312029","Quesne Christiane","C. Quesne, V.M. Tkachuk","More on a SUSYQM approach to the harmonic oscillator with nonzero
  minimal uncertainties in position and/or momentum","26 pages, no figure, new section 2.4 + small changes, accepted in J.
  Phys. A, Special issue on Supersymmetric Quantum Mechanics","J.Phys.A37:10095-10114,2004","10.1088/0305-4470/37/43/006","ULB/229/CQ/03/8","math-ph hep-th math.MP math.QA quant-ph",,"  We continue our previous application of supersymmetric quantum mechanical
methods to eigenvalue problems in the context of some deformed canonical
commutation relations leading to nonzero minimal uncertainties in position
and/or momentum. Here we determine for the first time the spectrum and the
eigenvectors of a one-dimensional harmonic oscillator in the presence of a
uniform electric field in terms of the deforming parameters $\alpha$, $\beta$.
We establish that whenever there is a nonzero minimal uncertainty in momentum,
i.e., for $\alpha \ne 0$, the correction to the harmonic oscillator eigenvalues
due to the electric field is level dependent. In the opposite case, i.e., for
$\alpha = 0$, we recover the conventional quantum mechanical picture of an
overall energy-spectrum shift even when there is a nonzero minimum uncertainty
in position, i.e., for $\beta \ne 0$. Then we consider the problem of a
$D$-dimensional harmonic oscillator in the case of isotropic nonzero minimal
uncertainties in the position coordinates, depending on two parameters $\beta$,
$\beta'$. We extend our methods to deal with the corresponding radial equation
in the momentum representation and rederive in a simple way both the spectrum
and the momentum radial wave functions previously found by solving the
differential equation. This opens the way to solving new $D$-dimensional
problems.
","[{""version"":""v1"",""created"":""Wed, 10 Dec 2003 16:20:54 GMT""},{""version"":""v2"",""created"":""Mon, 21 Jun 2004 13:57:23 GMT""}]","2011-07-19"
"math-ph/0312030","Jan Wetzel","A.G. Elashvili and V.G. Kac","Good Gradings of Simple Lie Algebras","needs AMS trans2-1.cls","Amer. Math. Soc. Transl. (2) vol 213 (2005), 85-104",,,"math-ph math.MP",,"  We study and give a complete classification of good $\ZZ$-gradings of all
simple finite-dimensional Lie algebras. This problem arose in the quantum
Hamiltonian reduction for affine Lie algebras.
","[{""version"":""v1"",""created"":""Wed, 10 Dec 2003 16:32:46 GMT""},{""version"":""v2"",""created"":""Fri, 17 Dec 2004 18:17:46 GMT""}]","2014-01-17"
"math-ph/0312031","Christoph Adam","C. Adam","Hopf maps as static solutions of the complex eikonal equation","13 pages, slight changes in presentation, one paragraph on the
  symmetries of the eikonal equation added. Version accepted for publication in
  JMP","J.Math.Phys. 45 (2004) 4017-4024","10.1063/1.1792931",,"math-ph hep-th math.MP",,"  We demonstrate that a class of torus-shaped Hopf maps with arbitrary linking
number obeys the static complex eikonal equation. Further, we explore the
geometric structure behind these solutions, explaining thereby the reason for
their existence. As this equation shows up as an integrability condition in
certain non-linear field theories, the existence of such solutions is of some
interest.
","[{""version"":""v1"",""created"":""Wed, 10 Dec 2003 18:43:40 GMT""},{""version"":""v2"",""created"":""Thu, 14 Oct 2004 17:20:09 GMT""}]","2009-11-10"
"math-ph/0312032","Alessandro Giuliani","F. Bonetto, P. Falco, A. Giuliani","Analyticity of the SRB measure of a lattice of coupled Anosov
  diffeomorphisms of the torus","28 pages, 2 figures","Jour. Math. Phys. 45, 3282-3309 (2004)","10.1063/1.1768620",,"math-ph math.MP",,"  We consider the ""thermodynamic limit""of a d-dimensional lattice of hyperbolic
dynamical systems on the 2-torus, interacting via weak and nearest neighbor
coupling. We prove that the SRB measure is analytic in the strength of the
coupling. The proof is based on symbolic dynamics techniques that allow us to
map the SRB measure into a Gibbs measure for a spin system on a
(d+1)-dimensional lattice. This Gibbs measure can be studied by an extension
(decimation) of the usual ""cluster expansion"" techniques.
","[{""version"":""v1"",""created"":""Wed, 10 Dec 2003 20:09:50 GMT""}]","2012-09-19"
"math-ph/0312033","Ilya Shmulevich","Winfried Just, Ilya Shmulevich, John Konvalina","The number and probability of canalizing functions",,,"10.1016/j.physd.2004.07.002",,"math-ph math.MP",,"  Canalizing functions have important applications in physics and biology. For
example, they represent a mechanism capable of stabilizing chaotic behavior in
Boolean network models of discrete dynamical systems. When comparing the class
of canalizing functions to other classes of functions with respect to their
evolutionary plausibility as emergent control rules in genetic regulatory
systems, it is informative to know the number of canalizing functions with a
given number of input variables. This is also important in the context of using
the class of canalizing functions as a constraint during the inference of
genetic networks from gene expression data. To this end, we derive an exact
formula for the number of canalizing Boolean functions of n variables. We also
derive a formula for the probability that a random Boolean function is
canalizing for any given bias p of taking the value 1. In addition, we consider
the number and probability of Boolean functions that are canalizing for exactly
k variables. Finally, we provide an algorithm for randomly generating
canalizing functions with a given bias p and any number of variables, which is
needed for Monte Carlo simulations of Boolean networks.
","[{""version"":""v1"",""created"":""Wed, 10 Dec 2003 20:26:20 GMT""}]","2009-11-10"
"math-ph/0312034","Lucattilio Tenuta","G. F. Dell'Antonio and L. Tenuta","Semiclassical analysis of constrained quantum systems","23 pages, a new section on submanifolds of arbitrary dimension and
  codimension added, references modified and added","Journal of Physics A: Mathematical and General, volume 37,
  5605-5624 (2004)","10.1088/0305-4470/37/21/007",,"math-ph math.MP quant-ph",,"  We study the dynamics of a quantum particle in R^(n+m) constrained by a
strong potential force to stay within a distance of order hbar (in suitable
units) from a smooth n-dimensional submanifold M. We prove that in the
semiclassical limit the evolution of the wave function is approximated in norm,
up to terms of order hbar^(1/2), by the evolution of a semiclassical wave
packet centred on the trajectory of the corresponding classical constrained
system.
","[{""version"":""v1"",""created"":""Thu, 11 Dec 2003 13:01:35 GMT""},{""version"":""v2"",""created"":""Mon, 5 Apr 2004 13:09:36 GMT""}]","2009-11-10"
"math/0312208","Bethany Marsh","Philippe Caldero, Bethany Marsh and Sophie Morier-Genoud","Realisation of Lusztig cones","17 pages, no figures",,,,"math.RT math.QA",,"  The negative part $U^-$ of a quantised enveloping algebra associated to a
simple Lie algebra possesses a canonical basis $\mathcal{B}$ with favourable
properties. Lusztig has associated a cone to a reduced expression $\mathbf{i}$
for the longest element $w_0$ in the Weyl group of $\mathfrak{g}$, with good
properties with respect to monomial elements of $\mathcal{B}$. The first author
has associated a subalgebra $A_{\mathbf{i}}$ of $U^-$, compatible with the dual
basis $\mathcal{B}^*$, to each reduced expression $\mathbf{i}$. We show that,
after a certain twisting, the string parametrisation of the adapted basis of
this subalgebra coincides with the corresponding Lusztig cone. As an
application, we give explicit expressions for the generators of the Lusztig
cones.
","[{""version"":""v1"",""created"":""Wed, 10 Dec 2003 23:20:54 GMT""}]","2020-12-21"
"math/0312211","Alex Kuronya","Thomas Bauer, Alex Kuronya, Tomasz Szemberg","Zariski chambers, volumes, and stable base loci","23 pages, 1 figure",,,,"math.AG",,"  The purpose of this paper is to investigate the behaviour of certain
asymptotic invariants of line bundles on projective surfaces. In particular, we
describe the volume of line bundles and their destabilizing numbers.
","[{""version"":""v1"",""created"":""Wed, 10 Dec 2003 16:03:50 GMT""}]","2007-05-23"
"math/0312212","Douglas M. Slauson","Palle E. T. Jorgensen","A family of measures associated with iterated function systems","14 pages including references. Corrections made on pp.4 and 13",,,,"math.CA",,"  Let $(X,d)$ be a compact metric space, and let an iterated function system
(IFS) be given on $X$, i.e., a finite set of continuous maps $\sigma_{i}$: $
X\to X$, $i=0,1,..., N-1$. The maps $\sigma_{i}$ transform the measures $\mu $
on $X$ into new measures $\mu_{i}$. If the diameter of $ \sigma_{i_{1}}\circ
>... \circ \sigma_{i_{k}}(X)$ tends to zero as $ k\to \infty $, and if
$p_{i}>0$ satisfies $\sum_{i}p_{i}=1$, then it is known that there is a unique
Borel probability measure $\mu $ on $X$ such that $\mu =\sum_{i}p_{i} \mu_{i}
\tag{*}$.
  In this paper, we consider the case when the $p_{i}$s are replaced with a
certain system of sequilinear functionals. This allows us to study the variable
coefficient case of (*), and moreover to understand the analog of (*) which is
needed in the theory of wavelets.
","[{""version"":""v1"",""created"":""Wed, 10 Dec 2003 19:25:34 GMT""},{""version"":""v2"",""created"":""Mon, 1 Mar 2004 19:55:26 GMT""}]","2007-05-23"
"math/0312213","Fermin Dalmagro","F. Dalmagro","Equivariant Unfoldings of G-Stratified Pseudomanifolds","This is a paper on geometric topology which generalizes in the
  stratified context the procedure of Davis for blowing up a smooth manifold
  along a closed submanifold. We also work in the equivariant category,
  generalizing a previous definition of R. Popper for $G$-stratified
  pseudomanifolds. The main applications of this work are intended to the
  cohomological study of torical actions on stratified pseudomanifolds, as a
  particular case of iterated stratified circle actions",,,,"math.AT math.GN",,"  For any abelian compact Lie group $G$, we introduce a family of
$G$-stratified pseudomanifolds, whose main feature is the preservation of the
orbit spaces in the category of stratified pseudomanifolds. Which generalize a
previous definition given by R. Popper. We also find a sufficient condition for
the existence of equivariant unfoldings, so we have Intersection Cohomology
with differential forms, as defined in \cite{S}. Moreover, if $G$ act on a
manifold $M$, we find a equivariant unfolding of $M$ which induces a canonical
unfolding on the $k$-orbits space for every closed subgroup $K$ of $G$.
","[{""version"":""v1"",""created"":""Wed, 10 Dec 2003 16:13:41 GMT""}]","2007-05-23"
"math/0312214","Claude Cibils","Claude Cibils (IMMM), Eduardo N. Marcos","Skew category, Galois covering and smash product of a $k$-category","Final version to appear in Proceedings of the American Mathematical
  Society",,,,"math.RA math.CT math.RT",,"  In this paper we consider categories over a commutative ring provided either
with a free action or with a grading of a not necessarily finite group. We
define the smash product category and the skew category and we show that these
constructions agree with the usual ones for algebras. In case of the smash
product for an infinite group our construction specialized for a ring agrees
with M. Beattie's construction of a ring with local units in \cite{be}. We
recover in a categorical generalized setting the Duality Theorems of M. Cohen
and S. Montgomery in \cite{cm}, and we provide a unification with the results
on coverings of quivers and relations by E. Green in \cite{g}. We obtain a
confirmation in a quiver and relations free categorical setting that both
constructions are mutual inverses, namely the quotient of a free action
category and the smash product of a graded category. Finally we describe
functorial relations between the representation theories of a category and of a
Galois cover of it.
","[{""version"":""v1"",""created"":""Wed, 10 Dec 2003 17:03:06 GMT""},{""version"":""v2"",""created"":""Mon, 22 Dec 2003 18:40:10 GMT""},{""version"":""v3"",""created"":""Fri, 10 Sep 2004 10:27:21 GMT""}]","2007-05-23"
