"hep-th/0304061","Jeroen Wijnhout","Rutger Boels, Jan de Boer, Robert Duivenvoorden and Jeroen Wijnhout","Nonperturbative Superpotentials and Compactification to Three Dimensions","LaTeX, 45 pages, uses AmsMath, minor correction, reference added","JHEP 0403:009,2004","10.1088/1126-6708/2004/03/009","ITFA-2003-16","hep-th",,"  We consider four-dimensional N=2 supersymmetric gauge theories with gauge
group U(N) on R^3 x S^1, in the presence of a classical superpotential. The
low-energy quantum superpotential is obtained by simply replacing the adjoint
scalar superfield in the classical superpotential by the Lax matrix of the
integrable system that underlies the 4d field theory. We verify in a number of
examples that the vacuum structure obtained in this way matches precisely that
in 4d, although the degrees of freedom that appear are quite distinct. Several
features of 4d field theories, such as the possibility of lifting vacua from
U(N) to U(tN), become particularly simple in this framework. It turns out that
supersymmetric vacua give rise to a reduction of the integrable system which
contains information about the field theory but also about the Dijkgraaf-Vafa
matrix model. The relation between the matrix model and the quantum
superpotential on R^3 x S^1 appears to involve a novel kind of mirror symmetry.
","[{""version"":""v1"",""created"":""Mon, 7 Apr 2003 14:50:04 GMT""},{""version"":""v2"",""created"":""Wed, 21 May 2003 13:47:34 GMT""}]","2010-12-03"
"hep-th/0304062","Gautam Mandal","Avinash Dhar, Gautam Mandal and Spenta R. Wadia","String bits in small radius AdS and weakly coupled N=4 Super Yang-Mills
  Theory: I","35 pages; (v2)problems in taking the continuum limit highlighted, the
  section on AdS/CFT matching rewritten in the light of these problems, typos
  corrected and references added; the main conclusion about finiteness of the
  small radius expansion unchanged",,,"TIFR/TH/03-09","hep-th",,"  We study light-cone gauge quantization of IIB strings in AdS_5 \times S^5 for
small radius in Poincare coordinates. A picture of strings made up of
noninteracting bits emerges in the zero radius limit. In this limit, each bit
behaves like a superparticle moving in the AdS_5 \times S^5 background,
carrying appropriate representations of the super conformal group PSU(2,2|4).
The standard Hamiltonian operator which causes evolution in the light-cone time
has continuous eigenvalues and provides a basis of states which is not suitable
for comparing with the dual super Yang-Mills theory. However, there exist
operators in the light-cone gauge which have discrete spectra and can be used
to label the states. We obtain the spectrum of single bit states and construct
multi-bit states in this basis. There are difficulties in the construction of
string states from the multi-bit states, which we discuss. A non-zero value of
the radius introduces interactions between the bits and the spectrum of
multi-bit states gets modified. We compute the leading perturbative corrections
at small radius for a few simple cases. Potential divergences in the
perturbative corrections, arising from strings near the boundary, cancel. This
encourages us to believe that our perturbative treatment could provide a
framework for a rigorous and detailed testing of the AdS/CFT conjecture, once
the difficulties in the construction of string states are resolved.
","[{""version"":""v1"",""created"":""Mon, 7 Apr 2003 15:00:35 GMT""},{""version"":""v2"",""created"":""Tue, 7 Oct 2003 07:21:16 GMT""}]","2007-05-23"
"hep-th/0304063","Bireswar Basu-Mallick","B. Basu-Mallick and Tanaya Bhattacharyya","Jost solutions and quantum conserved quantities of an integrable
  derivative nonlinear Schrodinger model","36 pages, latex, two references added, to be published in Nucl. Phys.
  B","Nucl.Phys. B668 (2003) 415-446","10.1016/S0550-3213(03)00570-4",,"hep-th cond-mat nlin.SI",,"  We study differential and integral relations for the quantum Jost solutions
associated with an integrable derivative nonlinear Schrodinger (DNLS) model. By
using commutation relations between such Jost solutions and the basic field
operators of DNLS model, we explicitly construct first few quantum conserved
quantities of this system including its Hamiltonian. It turns out that this
quantum Hamiltonian has a new kind of coupling constant which is quite
different from the classical one. This modified coupling constant plays a
crucial role in our comparison between the results of algebraic and coordinate
Bethe ansatz for the case of DNLS model. We also find out the range of modified
coupling constant for which the quantum $N$-soliton state of DNLS model has a
positive binding energy.
","[{""version"":""v1"",""created"":""Mon, 7 Apr 2003 15:00:53 GMT""},{""version"":""v2"",""created"":""Wed, 2 Jul 2003 15:19:16 GMT""}]","2009-11-10"
"hep-th/0304064","Jan Gutowski","Jerome P. Gauntlett, Jan B. Gutowski","All supersymmetric solutions of minimal gauged supergravity in five
  dimensions","22 pages, corrections made to comments in the abstract and
  introduction concerning the proportion of supersymmetry preserved in the
  timelike case; timelike solutions are 1/4 not 1/2 supersymmetric. Alterations
  made to the end of section 3.1 to clarify this point","Phys.Rev.D68:105009,2003; Erratum-ibid.D70:089901,2004","10.1103/PhysRevD.68.105009 10.1103/PhysRevD.70.089901","QMUL-PH-03-04","hep-th",,"  All purely bosonic supersymmetric solutions of minimal gauged supergravity in
five dimensions are classified. The solutions fall into two classes depending
on whether the Killing vector constructed from the Killing spinor is time-like
or null. When it is timelike, the solutions are determined by a
four-dimensional Kahler base-manifold, up to an anti-holomorphic function, and
generically preserve 1/4 of the supersymmetry. When it is null we provide a
precise prescription for constructing the solutions and we show that they
generically preserve 1/4 of the supersymmetry. We show that $AdS_5$ is the
unique maximally supersymmetric configuration. The formalism is used to
construct some new solutions, including a non-singular deformation of $AdS_5$,
which can be uplifted to obtain new solutions of type IIB supergravity
","[{""version"":""v1"",""created"":""Mon, 7 Apr 2003 15:35:00 GMT""},{""version"":""v2"",""created"":""Wed, 9 Apr 2003 14:13:47 GMT""},{""version"":""v3"",""created"":""Fri, 14 Nov 2003 15:44:05 GMT""},{""version"":""v4"",""created"":""Wed, 25 Feb 2004 18:03:57 GMT""}]","2014-11-18"
"math/0304082","Kengo Hirachi","A. Rod Gover and Kengo Hirachi","Conformally invariant powers of the Laplacian -- A complete
  non-existence theorem","18 pages; Minor changes and typographical corrections throughout
  article; To appear in Jour. Amer. Math. Soc","J.Am.Math.Soc. 17 (2004) 389-405",,,"math.DG",,"  We show that on conformal manifolds of even dimension $n\geq 4$ there is no
conformally invariant natural differential operator between density bundles
with leading part a power of the Laplacian $\Delta^{k}$ for $k>n/2$. This shows
that a large class of invariant operators on conformally flat manifolds do not
generalise to arbitrarily curved manifolds and that the theorem of Graham,
Jenne, Mason and Sparling, asserting the existence of curved version of
$\Delta^k$ for $1\le k\le n/2$, is sharp.
","[{""version"":""v1"",""created"":""Mon, 7 Apr 2003 13:01:28 GMT""},{""version"":""v2"",""created"":""Wed, 10 Dec 2003 04:42:03 GMT""}]","2007-05-23"
"math/0304083","Nadja Kutz","Nadja Kutz","Tri-hamiltonian Toda lattice and a canonical bracket for closed discrete
  curves",,,,,"math.DG math.SG",,"  Flows on (or variations of) discrete curves in $\R^2$ give rise to flows on a
subalgebra of functions on that curve. For a special choice of flows and a
certain subalgebra this is described by the Toda lattice hierachy. In the paper
it is shown that the canonical symplectic structure on $\R^{2N}$, which can be
interpreted as the phase space of closed discrete curves in $\R^2$ with length
$N,$ induces Poisson commutation relations on the above mentioned subalgebra
which yield the tri-hamiltonian poisson structure of the Toda lattice hierachy.
","[{""version"":""v1"",""created"":""Mon, 7 Apr 2003 02:40:08 GMT""}]","2007-05-23"
"math/0304084","Gadadhar Misra","Ronald G. Douglas and Gadadhar Misra","Quasi-free resolutions of Hilbert modules",,,,,"math.SP",,"  The notion of a quasi-free Hilbert module over a function algebra
$\mathcal{A}$ consisting of holomorphic functions on a bounded domain $\Omega$
in complex $m$ space is introduced. It is shown that quasi-free Hilbert modules
correspond to the completion of the direct sum of a certain number of copies of
the algebra $\mathcal{A}$. A Hilbert module is said to be weakly regular
(respectively, regular) if there exists a module map from a quasi-free module
with dense range (respectively, onto). A Hilbert module $\mathcal{M}$ is said
to be compactly supported if there exists a constant $\beta$ satisfying $\|\phi
f \| \leq \beta \|\phi \|_X \|f\|$ for some compact subset $X$ of $\Omega$ and
$\phi$ in $\mathcal{A}$, $f$ in $\mathcal{M}$. It is shown that if a Hilbert
module is compactly supported then it is weakly regular. The paper identifies
several other classes of Hilbert modules which are weakly regular. In addition,
this result is extended to yield topologically exact resolutions of such
modules by quasi-free ones.
","[{""version"":""v1"",""created"":""Mon, 7 Apr 2003 03:06:07 GMT""}]","2007-05-23"
"math/0304085","Hidekazu Furusho","Hidekazu Furusho","p-adic multiple zeta values I -- p-adic multiple polylogarithms and the
  p-adic KZ equation","28 pages",,,,"math.NT math.QA",,"  Our main aim in this paper is to give a foundation of the theory of $p$-adic
multiple zeta values. We introduce (one variable) $p$-adic multiple
polylogarithms by Coleman's $p$-adic iterated integration theory. We define
$p$-adic multiple zeta values to be special values of $p$-adic multiple
polylogarithms. We consider the (formal) $p$-adic KZ equation and introduce the
$p$-adic Drinfel'd associator by using certain two fundamental solutions of the
$p$-adic KZ equation. We show that our $p$-adic multiple polylogarithms appear
as coefficients of a certain fundamental solution of the $p$-adic KZ equation
and our $p$-adic multiple zeta values appear as coefficients of the $p$-adic
Drinfel'd associator. We show various properties of $p$-adic multiple zeta
values, which are sometimes analogous to the complex case and are sometimes
peculiar to the $p$-adic case, via the $p$-adic KZ equation.
","[{""version"":""v1"",""created"":""Mon, 7 Apr 2003 03:47:49 GMT""},{""version"":""v2"",""created"":""Sun, 28 Sep 2003 07:48:20 GMT""}]","2007-05-23"
"math/0304086","Christopher Tuffley","Christopher Tuffley (UC Davis)","Connectivity of finite subset spaces of cell complexes","4 pages. v2: retitled; main result strengthened for simply-connected
  complexes using math.GT/0311371, and problem of strengthening it for
  m-connected complexes reduced to strengthening it for wedges of (m+1)-spheres","Pacific J. Math. 217(1):175-179 (2004)",,,"math.GT",,"  The kth finite subset space of a topological space X is the space exp_k X of
non-empty subsets of X of size at most k, topologised as a quotient of X^k.
Using results from our earlier paper (math.GT/0210315) on the finite subset
spaces of connected graphs we show that the kth finite subset space of a
connected cell complex is (k-2)-connected, and (k-1)-connected if in addition
the underlying space is simply connected. We expect exp_k X to be
(k+m-2)-connected if X is an m-connected cell complex, and reduce proving this
to the problem of proving it for finite wedges of (m+1)-spheres. Our results
complement a theorem due to Handel that for path-connected Hausdorff X the map
on pi_i induced by the inclusion exp_k X --> exp_{2k+1} X is zero for all k and
i.
","[{""version"":""v1"",""created"":""Mon, 7 Apr 2003 05:06:19 GMT""},{""version"":""v2"",""created"":""Tue, 25 Nov 2003 02:44:51 GMT""}]","2007-05-23"
"math/0304088","Masanori Asakura","M. Asakura and S. Saito","Estimate of dimension of Noether-Lefschetz locus for Beilinson-Hodge
  cycles on open complete intersections",,,,,"math.AG",,"  We study an analogue of the Noether-Lefschetz theorem in the context of
Beilinson's Hodge conjecture. We estimate the dimension of the
Noether-Lefschetz locus by the infinitesimal methods in Hodge theory.
","[{""version"":""v1"",""created"":""Mon, 7 Apr 2003 06:19:52 GMT""}]","2007-05-23"
"math/0304089","Masanori Asakura","M. Asakura and S. Saito","Components of maximal dimension in the Noether-Lefschetz locus for
  Beilinson-Hodge cycles on open surfaces",,,,,"math.AG",,"  The main subject of study in this paper is the Noether-Lefschetz locus for
Beilinson-Hodge cycles on the complement of the union of hyperplane sections in
a surface in $\Bbb P^3$. We give an analogue of the result by M.Green and
C.Voisin on the maximal components in the Noether-Lefschetz locus.
","[{""version"":""v1"",""created"":""Mon, 7 Apr 2003 06:36:43 GMT""}]","2007-05-23"
"math/0304091","Nathanael Enriquez","Omer Adelman, Nathana\""el Enriquez","Random walks in random environment: What a single trajectory tells","10 pages",,,,"math.PR",,"  We present a procedure that determines the law of a random walk in an iid
random environment as a function of a single ""typical"" trajectory. We indicate
when the trajectory characterizes the law of the environment, and we say how
this law can be determined. We then show how independent trajectories having
the distribution of the original walk can be generated as functions of the
single observed trajectory.
","[{""version"":""v1"",""created"":""Mon, 7 Apr 2003 07:41:12 GMT""}]","2007-05-23"
"math/0304092","Heike Pahlisch","Klaus-Dieter Kirchberg (Berlin)","Some integrability conditions for almost K\""ahler manifolds","Latex2e, 13 pages",,"10.1016/S0393-0440(03)00085-8",,"math.DG",,"  Among other results, a compact almost K\""ahler manifold is proved to be
K\""ahler if the Ricci tensor is semi-negative and its length coincides with
that of the star Ricci tensor or if the Ricci tensor is semi-positive and its
first order covariant derivatives are Hermitian. Moreover, it is shown that
there are no compact almost K\""ahler manifolds with harmonic Weyl tensor and
non-parallel semi-positive Ricci tensor. Stronger results are obtained in
dimension 4.
","[{""version"":""v1"",""created"":""Mon, 7 Apr 2003 09:51:39 GMT""}]","2015-06-26"
"nlin/0304007","Teo","Lee-Peng Teo","On dispersionless coupled modified KP hierarchy","29 pages",,,,"nlin.SI hep-th",,"  We define and study dispersionless coupled modified KP hierarchy, which
incorporates two different versions of dispersionless modified KP hierarchies.
","[{""version"":""v1"",""created"":""Mon, 7 Apr 2003 04:39:39 GMT""}]","2007-05-23"
"nucl-th/0304020","A. Thomas","U.T. Yakhshiev (National University of Uzbekistan), A.W. Thomas (CSSM,
  Adelaide) and F.C. Khanna (University of Alberta and TRIUMF)","Meson-Nucleon Vertex Form Factors at Finite Temperature Using a Soft
  Pion Form Factor","5 pages, uses revtex4","Phys.Rev.C68:048201,2003","10.1103/PhysRevC.68.048201","ADP-03-117/T555","nucl-th",,"  The temperature and density dependence of the meson-nucleon vertex form
factors is studied in the framework of thermofield dynamics. Results are
obtained for two rather different nucleon-nucleon potentials: the usual Bonn
potential and the variation with a softer $\pi NN$ form factor, due to Holinde
and Thomas. In general, the results show only a modest degree of sensitivity to
the choice of interaction.
","[{""version"":""v1"",""created"":""Mon, 7 Apr 2003 01:42:09 GMT""}]","2010-02-17"
"nucl-th/0304021","Hitoshi Nakada","H. Nakada (Chiba U.)","Hartree-Fock approach to nuclear matter and finite nuclei with M3Y-type
  nucleon-nucleon interactions","30 pages, including 7 figures, to be published in P.R.C","Phys.Rev. C68 (2003) 014316","10.1103/PhysRevC.68.014316",,"nucl-th",,"  By introducing a density-dependent contact term, M3Y-type interactions
applicable to the Hartree-Fock calculations are developed. In order to view
basic characters of the interactions, we carry out calculations on the uniform
nuclear matter as well as on several doubly magic nuclei. It is shown that a
parameter-set called M3Y-P2 describes various properties similarly well to the
Skyrme SLy5 and/or the Gogny D1S interactions. A remarkable difference from the
SLy5 and the D1S interactions is found in the spin-isospin properties in the
nuclear matter, to which the one-pion-exchange potential gives a significant
contribution. Affecting the single-particle energies, this difference may play
a certain role in the new magic numbers in unstable nuclei.
","[{""version"":""v1"",""created"":""Mon, 7 Apr 2003 10:29:34 GMT""},{""version"":""v2"",""created"":""Fri, 23 May 2003 09:49:26 GMT""}]","2009-11-10"
"nucl-th/0304022","Helmut Hofmann","H.Hofmann and A.G. Magner","Mean first passage time for fission potentials having structure","7 pages, LaTex, 7 postscript figures; Keywords: Decay rate, mean
  first passage time","Phys.Rev. C68 (2003) 014606","10.1103/PhysRevC.68.014606",,"nucl-th nucl-ex",,"  A schematic model of over-damped motion is presented which permits one to
calculate the mean first passage time for nuclear fission. Its asymptotic value
may exceed considerably the lifetime suggested by Kramers rate formula, which
applies only to very special, favorable potentials and temperatures. The
additional time obtained in the more general case is seen to allow for a
considerable increment in the emission of light particles.
","[{""version"":""v1"",""created"":""Mon, 7 Apr 2003 14:55:43 GMT""}]","2009-11-10"
"physics/0304017","Igor Lozovitski","S.L. Arsenjev, I.B. Lozovitski, Y.P. Sirik","The boundary and continual transfer phenomena in fluids and flows","5 pages",,,,"physics.flu-dyn physics.ao-ph",,"  The clearing up of a wave nature of the energy and mass transfer phenomena in
classical expressions of the molecular-kinetic theory has allowed to find a
quantitative measure of intensity of processes of a thermal conductivity,
viscosity and diffusion in conditions of a thermally nonequilibrium and
heterogeneous composition continuum. It is rotined that the appearance of a
temperature drop in fluid stipulates the appearance of the continuum
stratification and formation of the flowing bodies interacting among
themselves. It is rotined that the known expressions for a thermal
conductivity, viscosity, diffusion and heat convection had been obtained for a
thermally equilibrium and homogeneous continuum and produce a maximum quantity
of intensity of the transfer processes. The introduced expression is usable for
a quantitative estimation of intensity of the transfer processes in fluid and
its streams in conditions of the non-stationary heat exchange in natural
conditions and technical problems.
","[{""version"":""v1"",""created"":""Mon, 7 Apr 2003 04:42:10 GMT""}]","2007-05-23"
"physics/0304018","Robert C. Bishop","Robert C. Bishop","Brussels-Austin Nonequilibrium Statistical Mechanics in the Early Years:
  Similarity Transformations between Deterministic and Probabilistic
  Descriptions","22 pages, Part I of two parts; updated institutional affiliation",,,,"physics.class-ph physics.gen-ph",,"  The fundamental problem on which Ilya Prigogine and the Brussels-Austin Group
have focused can be stated briefly as follows. Our observations indicate that
there is an arrow of time in our experience of the world (e.g., decay of
unstable radioactive atoms like Uranium, or the mixing of cream in coffee).
Most of the fundamental equations of physics are time reversible, however,
presenting an apparent conflict between our theoretical descriptions and
experimental observations. Many have thought that the observed arrow of time
was either an artifact of our observations or due to very special initial
conditions. An alternative approach, followed by the Brussels-Austin Group, is
to consider the observed direction of time to be a basics physical phenomenon
and to develop a mathematical formalism that can describe this direction as
being due to the dynamics of physical systems. In part I of this essay, I
review and assess an attempt to carry out an approach that received much of
their attention from the early 1970s to the mid 1980s. In part II, I will
discuss their more recent approach using rigged Hilbert spaces.
","[{""version"":""v1"",""created"":""Mon, 7 Apr 2003 14:29:20 GMT""},{""version"":""v2"",""created"":""Tue, 8 Apr 2003 15:12:12 GMT""},{""version"":""v3"",""created"":""Mon, 5 May 2003 11:33:57 GMT""}]","2007-05-23"
"physics/0304019","Alessandra Retico","U. Bottigli, P.G. Cerello, P. Delogu, M.E. Fantacci, F. Fauci, B.
  Golosio, A. Lauria, E. Lopez Torres, R. Magro, G.L. Masala, P. Oliva, R.
  Palmiero, G. Raso, A. Retico, S. Stumbo, S. Tangaro","GPCALMA, a mammographic CAD in a GRID connection","6 pages, 4 figures, to appear in CARS 2003 Proceedings, Computer
  Assisted Radiology and Surgery 17th International Congress and Exhibition,
  London, June 25-28, 2003","International Congress Series 1256 (2003) 944-949",,,"physics.med-ph",,"  Purpose of this work is the development of an automatic system which could be
useful for radiologists in the investigation of breast cancer. A breast
neoplasia is often marked by the presence of microcalcifications and massive
lesions in the mammogram: hence the need for tools able to recognize such
lesions at an early stage. GPCALMA (Grid Platform Computer Assisted Library for
MAmmography), a collaboration among italian physicists and radiologists, has
built a large distributed database of digitized mammographic images (at this
moment about 5500 images corresponding to 1650 patients). This collaboration
has developed a CAD (Computer Aided Detection) system which, installed in an
integrated station, can also be used for digitization, as archive and to
perform statistical analysis. With a GRID configuration it would be possible
for the clinicians tele- and co-working in new and innovative groupings
('virtual organisations') and, using the whole database, by the GPCALMA tools
several analysis can be performed. Furthermore the GPCALMA system allows to be
abreast of the CAD technical progressing into several hospital locations always
with remote working by GRID connection. We report in this work the results
obtained by the GPCALMA CAD software implemented with a GRID connection.
","[{""version"":""v1"",""created"":""Mon, 7 Apr 2003 11:21:12 GMT""}]","2007-05-23"
"physics/0304020","Robert C. Bishop","Robert C. Bishop","Brussels-Austin Nonequilibrium Statistical Mechanics in the Later Years:
  Large Poincare Systems and Rigged Hilbert Space","23 pages, Part II of two parts; updated institutional affiliation",,,,"physics.class-ph physics.gen-ph",,"  This second part of a two-part essay discusses recent developments in the
Brussels-Austin Group after the mid 1980s. The fundamental concerns are the
same as in their similarity transformation approach (see Part I), but the
contemporary approach utilizes rigged Hilbert space (whereas the older approach
used Hilbert space). While the emphasis on nonequilibrium statistical mechanics
remains the same, the use of similarity transformations shifts to the
background. In its place arose an interest in the physical features of large
Poincar\U{e9} systems, nonlinear dynamics and the mathematical tools necessary
to analyze them.
","[{""version"":""v1"",""created"":""Mon, 7 Apr 2003 14:32:16 GMT""},{""version"":""v2"",""created"":""Tue, 8 Apr 2003 15:26:47 GMT""},{""version"":""v3"",""created"":""Mon, 5 May 2003 11:36:47 GMT""}]","2007-05-23"
"quant-ph/0304047","Mario Encinosa","M. Encinosa and F. Sales-Mayor","Bohmian trajectories on a toroidal surface","10 pages, 7 figures, submitted to Phys. Lett. A",,,,"quant-ph",,"  Bohmian trajectories on the toroidal surface T^2 are determined from
eigenfunctions of the Schrodinger equation. An expression for the monodromy
matrix M(t) on a curved surface is developed and eigenvalues of M(t) on T^2
calculated. Lyapunov exponents for trajectories on T^2 are found for some
trajectories to be of order unity.
","[{""version"":""v1"",""created"":""Sun, 6 Apr 2003 16:49:18 GMT""}]","2007-05-23"
"quant-ph/0304048","Cord Axel Mueller","C. A. Mueller and C. Miniatura","Weak localisation of light by atoms with quantum internal structure","14 pages, to appear in ""Wave Scattering in Complex Media: From Theory
  to Applications"" ed. by B.A. van Tiggelen and S.E. Skipetrov",,,,"quant-ph cond-mat.dis-nn physics.atom-ph",,"  The interference contrast observed in coherent backscattering by cold atoms
is drastically reduced with respect to classical disordered media. We study the
impact of the degeneracy of the resonant atomic dipole transition on multiple
scattering of polarised photons. An analytical treatment allows to derive the
diffusion coefficient and depolarisation times for the average light intensity,
and dephasing times for the weak localisation corrections. The calculated CBS
signals reproduce the experimental results.
","[{""version"":""v1"",""created"":""Sun, 6 Apr 2003 17:19:09 GMT""}]","2007-05-23"
