"astro-ph/0304106","Arnon Dar","Shlomo Dado, Arnon Dar, Alvaro De Rujula","The Supernova associated with GRB 030329",,"Astrophys.J. 594 (2003) L89-L92","10.1086/378624",,"astro-ph",,"  The relative proximity of the recent gamma ray burst (GRB) 030329 resulted in
a large gamma-ray fluence and in the brightest-ever afterglow (AG), hours after
the burst, in the radio, optical and X-ray bands, permitting precise AG
measurements, sensitive tests of models and an excellent occasion to
investigate the association of GRBs with supernovae (SNe). The Cannonball (CB)
model provides a good, simple and universal description of all AGs of GRBs of
known redshift, so that it is straightforward to use it to predict what the
expected SN signatures are. In the case of GRB 030329, 10 days after burst the
AG should begin to reveal the lightcurve, spectrum and polarization of an
underlying SN --akin to SN1998bw-- which will peak in the NIR/optical band
around day 15. These effects will be easily observable if indeed SN1998bw is a
good ``standard candle'' for GRB-associated SNe and if the so far unknown
extinction in the host galaxy is not too large.
","[{""version"":""v1"",""created"":""Sun, 6 Apr 2003 19:52:40 GMT""}]","2009-11-07"
"astro-ph/0304107","Carl H. Gibson","Carl H. Gibson (UCSD) and Rudolph E. Schild (Harvard)","Interpretation of the Stephan Quintet Galaxy Cluster using
  Hydro-Gravitational Theory","21 pages, 3 figures, for Astronomical Journal",,,,"astro-ph",,"  Stephan's Quintet (SQ) is a compact group of galaxies that has been well
studied since its discovery in 1877 but is mysterious using cold dark matter
hierarchical clustering cosmology (CDMHCC). Anomalous red shifts z =
(0.0027,0.019, 0.022, 0.022, 0.022) among galaxies in SQ either; reduce it to a
Trio with two highly improbable intruders from CDMHCC, or support the Arp
(1973) hypothesis that its red shifts may be intrinsic. An alternative is
provided by the Gibson 1996-2000 hydro-gravitational-theory (HGT) where
superclusters, clusters and galaxies all originate by universe expansion and
gravitational fragmentation in the super-viscous plasma epoch (after which the
gas condenses as 10^{24} kg fog-particles in metastable 10^{36} kg
dark-matter-clumps). By this fluid mechanical cosmology, the SQ galaxies gently
separated recently and remain precisely along a line of sight because of
perspective and the small transverse velocities permitted by their sticky,
viscous-gravitational, beginnings. Star and gas bridges and
young-globular-star-cluster (YGC) trails observed by the HST are triggered as
SQ galaxies separate through each other's frozen baryonic-dark-matter halos of
dark proto-globular-cluster (PGC) clumps of planetary-mass
primordial-fog-particles (PFPs). Discordant red shifts (from CDMHCC) between
angularly clustered quasars and bright galaxies are similarly explained by HGT.
","[{""version"":""v1"",""created"":""Sun, 6 Apr 2003 21:06:57 GMT""}]","2007-05-23"
"astro-ph/0304108","Pilar Ruiz-Lapuente","P. Ruiz-Lapuente","Cosmology with Supernovae","20 pages, 10 Postscript figures. Invited review presented at the
  JENAM 2002 (Porto, Portugal). To appear in ""3K, SNs, Clusters: Hunting the
  Cosmological Parameters"", ed. D. Barbosa et al. (Kluwer Acad. Publ.)","Astrophys.Space Sci. 290 (2004) 43-59","10.1023/B:ASTR.0000022163.94973.76",,"astro-ph",,"  This review gives an update of the cosmological use of SNe Ia and the
progress made in testing their properties from the local universe to high-z.
The cosmological road from high-z supernovae down to Galactic SNe Ia is
followed in search of the answer to standing questions on their nature and
their validity as cosmological indicators.
","[{""version"":""v1"",""created"":""Mon, 7 Apr 2003 01:10:08 GMT""}]","2009-11-07"
"astro-ph/0304109","Pilar Ruiz-Lapuente","P. Ruiz-Lapuente, F. Comeron, S. Smartt, R. Kurucz, J. Mendez, R.
  Canal, A. Filippenko & R. Chornock","Search for the companions of Galactic SNe Ia","8 pages, 2 Postscript figures. Appeared in ""From Twilight to
  Highlight: the Physics of Supernovae"", ed. W. Hillebrandt & B. Leibundgut
  (Springer), pp. 140-147",,"10.1007/10828549_19",,"astro-ph",,"  The central regions of the remnants of Galactic SNe Ia have been examined for
the presence of companion stars of the exploded supernovae. We present the
results of this survey for the historical SN 1572 and SN 1006. The spectra of
the stars are modeled to obtain Teff, log g and the metallicity. Radial
velocities are obtained with an accuracy of 5--10 km s$^{-1}$. Implications for
the nature of the companion star in SNeIa follow.
","[{""version"":""v1"",""created"":""Mon, 7 Apr 2003 01:57:19 GMT""}]","2009-11-07"
"astro-ph/0304110","Wu Xuefeng","X. F. Wu, Z. G. Dai, Y. F. Huang, and T. Lu (Nanjing University)","Optical Flashes and Very Early Afterglows in Wind Environments","21 pages, 6 figures, accepted by MNRAS on March 7, 2003","Mon.Not.Roy.Astron.Soc. 342 (2003) 1131-1138","10.1046/j.1365-8711.2003.06602.x",,"astro-ph",,"  The interaction of a relativistic fireball with its ambient medium is
described through two shocks: a reverse shock that propagates into the
fireball, and a forward shock that propagates into the medium. The observed
optical flash of GRB 990123 has been considered to be the emission from such a
reverse shock. The observational properties of afterglows suggest that the
progenitors of some GRBs may be massive stars and their surrounding media may
be stellar winds. We here study very early afterglows from the reverse and
forward shocks in winds. An optical flash mainly arises from the relativistic
reverse shock while a radio flare is produced by the forward shock. The peak
flux densities of optical flashes are larger than 1 Jy for typical parameters,
if we do not take into account some appropriate dust obscuration along the line
of sight. The radio flare always has a long lasting constant flux, which will
not be covered up by interstellar scintillation. The non-detections of optical
flashes brighter than about 9th magnitude may constrain the GRBs isotropic
energies to be no more than a few $10^{52}$ ergs and wind intensities to be
relatively weak.
","[{""version"":""v1"",""created"":""Mon, 7 Apr 2003 03:02:18 GMT""}]","2009-11-07"
"astro-ph/0304111","Carraro Giovanni","Giovanni Carraro (Padova), Gustavo Baume (Padova), and Sandro
  Villanova (Padova)","NGC 1883: a neglected intermediate-age open cluster located in the
  outskirts of the Galactic disk","5 pages, 6 eps figures, in press in MNRAS","Mon.Not.Roy.Astron.Soc. 343 (2003) 547","10.1046/j.1365-8711.2003.06693.x",,"astro-ph",,"  We report on $BVI$ CCD photometry of a field centered in the region of the
open cluster NGC 1883 down to V=21. This cluster has never been studied
insofar, and we provide for the first time estimates of its fundamental
parameters, namely radial extent, age, distance and reddening. We find that the
cluster has a radius of about 2.5 arcmin, and shows signatures of dynamical
relaxation. NGC 1883 is located in the anti-center direction, and exhibits a
reddening in the range E$(B-V)= 0.23-0.35$, depending on the metal abundance.
It turns out to be of intermediate-age (1 billion years old), and quite distant
for an open cluster. In fact it is located 4.8 kpc from the Sun, and more than
13 kpc from the Galactic center. This results makes NGC 1883 one of the most
peripheral old open clusters, with important consequences for the trend of the
metallicity with distance in the outer Galactic disk.
","[{""version"":""v1"",""created"":""Mon, 7 Apr 2003 07:35:49 GMT""}]","2009-11-07"
"astro-ph/0304112","Bruno Leibundgut","Bruno Leibundgut and Nicholas B.Suntzeff","Optical Light Curves of Supernovae","To be published in:""Supernovae and Gamma Ray Bursters"", Lecture Notes
  in Physics (http://link.springer.de/series/lnpp)",,"10.1007/3-540-45863-8_6",,"astro-ph",,"  Photometry is the most easily acquired information about supernovae. The
light curves constructed from regular imaging provide signatures not only for
the energy input, the radiation escape, the local environment and the
progenitor stars, but also for the intervening dust. They are the main tool for
the use of supernovae as distance indicators through the determination of the
luminosity. The light curve of SN 1987A still is the richest and longest
observed example for a core-collapse supernova. Despite the peculiar nature of
this object, as explosion of a blue supergiant, it displayed all the
characteristics of Type II supernovae. The light curves of Type Ib/c supernovae
are more homogeneous, but still display the signatures of explosions in massive
stars, among them early interaction with their circumstellar material. Wrinkles
in the near-uniform appearance of thermonuclear (Type Ia) supernovae have
emerged during the past decade. Subtle differences have been observed
especially at near-infrared wavelengths. Interestingly, the light curve shapes
appear to correlate with a variety of other characteristics of these
supernovae. The construction of bolometric light curves provides the most
direct link to theoretical predictions and can yield sorely needed constraints
for the models. First steps in this direction have been already made.
","[{""version"":""v1"",""created"":""Mon, 7 Apr 2003 08:41:04 GMT""}]","2016-04-13"
"astro-ph/0304113","James E. Lidsey","James E. Lidsey and Reza Tavakol","Running of the Scalar Spectral Index and Observational Signatures of
  Inflation","12 pages. Extended discussion and bibliography","Phys.Lett. B575 (2003) 157-164","10.1016/j.physletb.2003.07.091",,"astro-ph",,"  Some of the consequences for inflationary cosmology of a scale dependence
(running) in the tilt of the scalar perturbation spectrum are considered. In
the limit where the running is itself approximately scale-invariant, a
relationship is found between the scalar and tensor perturbation amplitudes,
the scalar spectral index and its running. This relationship is independent of
the functional form of the inflaton potential. More general settings, including
that of braneworld cosmological models, are also considered. It is found that
for the Randall-Sundrum single braneworld scenario, the corresponding relation
between the observables takes precisely the same form as that arising in the
standard cosmology. Some implications of the observations failing to satisfy
such a relationship are discussed.
","[{""version"":""v1"",""created"":""Mon, 7 Apr 2003 10:35:14 GMT""},{""version"":""v2"",""created"":""Fri, 4 Jul 2003 15:35:11 GMT""},{""version"":""v3"",""created"":""Mon, 7 Jul 2003 09:54:19 GMT""}]","2015-06-24"
"astro-ph/0304114","Masaaki Namiki","Masaaki Namiki, Nobuyuki Kawai, Taro Kotani, Kazuo Makishima","Evidence for Jet Collimation in SS 433 with the Chandra HETGS","20 pages, 8 figure","Publications of the Astronomical Society of Japan, 2003, Vol. 55,
  No.1","10.1093/pasj/55.1.281",,"astro-ph",,"  High-resolution X-ray spectra of SS 433 obtained after a binary egress with
the Chandra High Energy Transmission Grating Spectrometer (HETGS) were studied.
Many Doppler-shifted X-ray emission lines from highly ionized elements were
detected. The initial temperature of the jets is estimated to be 20 keV. The
lines are found to generally be broader than the instrumented resolution. The
widths of the Fe XXV K-alpha and Si XIII K-alpha lines correspond to velocity
dispersions of 2100 (+600/-340) km/s and 840 (+180/-150) km/s respectively, in
terms of Gaussian sigma. Neither the measured line widths nor their dependence
on the atomic number can be explained by thermal broadening alone. Alternative
explanations of the observed line widths are discussed, including in particular
a progressive jet collimation along its axis.
","[{""version"":""v1"",""created"":""Mon, 7 Apr 2003 10:42:20 GMT""}]","2015-06-24"
"astro-ph/0304115","Moncef Derouich","M. Derouich (1), S. Sahal-Brechot (1), P. S. Barklem (2), B. J. O'Mara
  (3) ((1) Observatoire de Paris-Meudon; (2)Uppsala University; (3)University
  of Queensland)","Semi-classical theory of collisional depolarization of spectral lines by
  atomic hydrogen. I: application to p states of neutral atoms","12 pages, 4 tables, 7 figures. Accepted 4 April 2003 in A&A","Astron.Astrophys. 404 (2003) 763-774","10.1051/0004-6361:20030568",,"astro-ph",,"  The present paper extends the method of Anstee, Barklem and O'Mara (Anstee
1992; Anstee & O'Mara 1991, 1995; Anstee, O'Mara & Ross 1997; Barklem 1998;
Barklem & O'Mara 1997; Barklem, O'Mara & Ross 1998), developed during the
1990's for collisional line broadening by atomic hydrogen, to the
depolarization of spectral lines of neutral atoms by collisions with atomic
hydrogen. In the present paper, we will limit the calculations to p (l=1)
atomic levels. The depolarization cross sections and depolarization rates are
computed. In Table 2 cross sections as functions of the relative velocity and
effective quantum number are given, allowing for the computation for any p
atomic level. Our results are compared to quantum chemistry calculations where
possible. The sensitivity of depolarization cross sections to regions of the
potential is examined. We conclude that the accuracy obtained with our method
(< 20 % for the depolarization rates) is promising for its extension to higher
l-values for the interpretation of the ``second solar spectrum''. This will be
the object of further papers.
","[{""version"":""v1"",""created"":""Mon, 7 Apr 2003 10:58:55 GMT""},{""version"":""v2"",""created"":""Tue, 8 Apr 2003 10:17:29 GMT""},{""version"":""v3"",""created"":""Wed, 9 Apr 2003 08:56:02 GMT""},{""version"":""v4"",""created"":""Fri, 11 Apr 2003 12:42:07 GMT""},{""version"":""v5"",""created"":""Thu, 1 May 2003 16:01:08 GMT""}]","2009-11-07"
"astro-ph/0304116","Gael Chauvin","G. Chauvin, M. Thomson, C. Dumas, J-L. Beuzit, P. Lowrance, T. Fusco,
  A-M. Lagrange, B. Zuckerman and D. Mouillet","Adaptive optics imaging survey of the Tucana-Horologium association","7 pages, 4 figures postscript. A&A accepted","Astron.Astrophys. 404 (2003) 157-162","10.1051/0004-6361:20030352",,"astro-ph",,"  We present the results of an adaptive optics (AO) imaging survey of the
common associations of Tucana and Horologium, carried out at the ESO 3.6m
telescope with the ADONIS/SHARPII system. Based on our observations of two
dozen probable association members, HIP 1910 and HIP 108422 appear to have
low-mass stellar companions, while HIP 6856 and GSC 8047-0232 have possible
sub-stellar candidate companions. Astrometric measurements, performed in
November 2000 and October 2001, indicate that HIP 1910 B likely is bound to its
primary, but are inconclusive in the case of the candidate companion to HIP
6856. Additional observations are needed to confirm the HIP 6856 companionship
as well as for HIP 108422 and GSC 8047-0232.
","[{""version"":""v1"",""created"":""Mon, 7 Apr 2003 11:49:31 GMT""}]","2009-11-07"
"astro-ph/0304117","Silvano Desidera","S. Desidera, R.G. Gratton, M. Endl, M. Barbieri, R.U. Claudi,
  R.Cosentino, S. Lucatello, F. Marzari, S. Scuderi","A search for planets in the metal-enriched binary HD 219542","15 pages, 16 figures, A&A, in press","Astron.Astrophys. 405 (2003) 207","10.1051/0004-6361:20030531",,"astro-ph",,"  The components of the wide binary HD 219542 were recently found to differ in
metallicity by about 0.1 dex (Gratton et al. A&A 377, 123). In this paper, we
present the results of 2 years of high precision radial velocity monitoring of
these stars performed at the Telecopio Nazionale Galileo (TNG) using the high
resolution spectrograph SARG. No indication for radial velocity variations
above the measurement errors (5 m/s) was found for the metal richer component
A. This allows us to place upper mass-limits for planets around this star. HD
219542B instead shows a low amplitude variation with a 112 day period at a
confidence level of about 96-97%. This might suggest the presence of a
Saturn-mass planet, although it is still possible that these variations are due
to moderate activity of the star. Tests based on variations of bisectors,
stellar magnitude and line equivalent widths were inconclusive so far.
","[{""version"":""v1"",""created"":""Mon, 7 Apr 2003 12:47:47 GMT""}]","2009-11-07"
"astro-ph/0304118","Makoto Kishimoto","Makoto Kishimoto (Univ of Edinburgh), Robert Antonucci, Omer Blaes
  (UCSB)","A First Close Look at the Balmer Edge Behavior of the Quasar Big Blue
  Bump","Minor revisions and additions. Accepted for publication in MNRAS",,,,"astro-ph",,"  We have found for the first time a Balmer edge feature in the polarized flux
spectrum of a quasar (Ton 202). The edge feature is seen as a discontinuity in
the slope, rather than as a discontinuity in the absolute flux. Since the
polarized flux contains essentially no broad emission lines, it is considered
to arise interior to the broad emission line region, showing the spectrum with
all the emissions outside the nucleus scraped off and removed. Therefore, the
polarized flux spectrum is likely to reveal features intrinsic to the Big Blue
Bump emission. In this case, the existence of the Balmer edge feature, seen in
absorption in the shorter wavelength side, indicates that the Big Blue Bump is
indeed thermal and optically thick.
","[{""version"":""v1"",""created"":""Mon, 7 Apr 2003 13:39:18 GMT""},{""version"":""v2"",""created"":""Fri, 20 Jun 2003 17:52:54 GMT""}]","2007-05-23"
"astro-ph/0304119","Amancio Friaca","Gustavo A. Lanfranchi (IAG-USP, Brazil), Amancio Friaca (IAG-USP,
  Brazil)","Clues to the nature of damped Lyman alpha systems from chemical
  evolution models","23 pages, 19 figures. Accepted for publication in MNRAS","Mon.Not.Roy.Astron.Soc. 343 (2003) 481","10.1046/j.1365-8711.2003.06682.x",,"astro-ph",,"  The evolution of the metallicity of damped Lyman alpha systems (DLAs) is
investigated in order to understand the nature of these systems. The
observational data on chemical abundances of DLAs are analysed with robust
statistical methods, and the abundances are corrected for dust depletion. The
results of this analysis are compared to predictions of several classes of
chemical evolution models: one-zone dwarf galaxy models, multizone disk models,
and chemodynamical models representing dwarf galaxies. We compare the
observational data on the [alpha/Fe] and [N/alpha] ratios to the predictions
from the models. In DLAs, these ratios are only partially reproduced by the
dwarf galaxy one-zone model and by the disk model. On the other hand, the
chemodynamical model for dwarf galaxies reproduces the properties of nearly all
DLAs. We derive the formation epoch of dwarf galaxies, and we find that dwarf
galaxies make a significant contribution to the total neutral gas density in
DLAs, and that this contribution is more important at high redshifts (z > 2-3).
We propose a scenario in which the DLA population is dominated by dwarf
galaxies at high redshifts and by disks at lower redshifts. We also find that
Lyman Break Galaxies (LBGs) may constitute a sequence rather than present a
sharp dichotomy between the two populations. We also arise the possibility that
we could be missing a whole population of high HI density column objects, with
metallicities intermediate between those of DLAs and LBGs. Finally, we discuss
the possibility that relying only on the observations of DLAs could lead to an
underestimate of the metal content of the high redshift Universe.
","[{""version"":""v1"",""created"":""Mon, 7 Apr 2003 13:45:25 GMT""}]","2009-11-07"
"astro-ph/0304120","Alice K. Harding","Alice K. Harding (NASA Goddard Space Flight Center)","Physical Processes in Strong Magnetic Fields of Neutron Stars","11 pages, invited talk at Pulsars, AXPs and SGRs Observed with
  BeppoSAX and Other Observatories, Marsala, Sicily, Sept. 2002",,,,"astro-ph",,"  Neutron stars have inferred surface magnetic fields of up to 10^{14} Gauss,
in the case of radio pulsars, and up to possibly 10^{15} Gauss, in the case of
Soft Gamma-Ray Repeaters and Anomalous X-ray Pulsars. In fields this high, QED
effects will profoundly change the characteristics of continuum radiation
processes such as synchrotron emission and Compton scattering and will also
allow the possibility of additional physical processes such as one-photon pair
production, vacuum polarization and photon splitting. Atomic line processes
will also be significantly affected by the presence of strong fields. I will
review some of the properties of radiation processes in strong magnetic fields
that are most relevant to pulsars, SGRs and AXPs and the role they play in
models for these sources.
","[{""version"":""v1"",""created"":""Mon, 7 Apr 2003 15:00:47 GMT""}]","2007-05-23"
"astro-ph/0304121","Alice K. Harding","Alice K. Harding & Alexander G. Muslimov","High Energy Emission from the Polar Cap: The Slot Gap Revisited","6 pages, to appear in proceedings of Pulsars, AXPs and SGRs Observed
  by BeppoSAX and Other Observatories, Marsala, Sicily, Sept. 2002",,,,"astro-ph",,"  The characteristics of the high-energy emission from polar cap accelerators
will be discussed. Particles accelerated in the ""slot gap"" near the polar cap
rim will reach altitudes of several stellar radii before initiating pair
cascades, producing a wide hollow cone of emission in young pulsars and some
millisecond pulsars. Model X-ray and gamma-ray spectra and pulse profiles,
based on Monte-Carlo simulations of polar cap pair cascades, will be presented.
","[{""version"":""v1"",""created"":""Mon, 7 Apr 2003 15:32:32 GMT""}]","2007-05-23"
"cond-mat/0304137","Subir Sachdev","Subir Sachdev (Yale)","Field theories of paramagnetic Mott insulators","12 pages, 4 figures, Proceedings of the International Conference on
  Theoretical Physics, Paris, UNESCO, July 2002","Annales Henri Poincare 4, 559 (2003)","10.1007/s00023-003-0948-4",,"cond-mat.str-el",,"  This is a summary of a central argument in recent review articles by the
author (cond-mat/0109419, cond-mat/0211005, and cond-mat/0211027). An effective
field theory is derived for the low energy spin singlet excitations in a
paramagnetic Mott insulator with collinear spin correlations.
","[{""version"":""v1"",""created"":""Sun, 6 Apr 2003 16:24:43 GMT""},{""version"":""v2"",""created"":""Wed, 9 Apr 2003 12:42:43 GMT""}]","2009-11-10"
"cond-mat/0304138","Florian Marquardt","Florian Marquardt and C. Bruder","Influence of dephasing on shot noise in a Mach-Zehnder interferometer:
  Dephasing terminal model","This paper has been withdrawn",,,,"cond-mat.mes-hall",,"  This paper has been retracted. The authors have discovered a possible problem
in applications of the dephasing terminal approach to shot noise calculations
in interference situations: Eq. (7) correctly re-introduces the
anticorrelations between the currents in the two arms, but due to its
semiclassical nature probably fails to describe the consequential diminishing
of exchange effects at the second beamsplitter.
","[{""version"":""v1"",""created"":""Sun, 6 Apr 2003 16:26:42 GMT""},{""version"":""v2"",""created"":""Wed, 16 Apr 2003 12:38:36 GMT""}]","2007-05-23"
"cond-mat/0304139","Dr. Mario Rabinowitz","Mario Rabinowitz","Microwave Residual Surface Resistance of Superconductors","4 pages","Physical Review B vol. 7 (1973) pp. 3402-3403",,,"cond-mat.supr-con cond-mat.mtrl-sci",,"  Two distinct models account for the microwave residual surface resistance of
superconducting cavities with equally good agreement with the measured
temperature and frequency dependence. In presenting his phonon-generation
model, Passow claimed that Rabinowitz' fluxoid power-loss model of residual
resistance does not fit the experimental data, whereas his does. In fact, the
two models have essentially the same temperature and frequency dependence.
Furthermore, Passow's phonon-generation model cannot explain the observed
sensitivity to details of sample preparation and history, while the fluxoid
model can.
","[{""version"":""v1"",""created"":""Sun, 6 Apr 2003 16:56:55 GMT""}]","2007-05-23"
"cond-mat/0304140","K. I. Skau","Theo Odijk and Flodder Slok","Nonuniform Donnan Equilibrium within Bacteriophages Packed with Dna","11 pages, 2 figures, submitted to J. Phys. Chem. B (special
  Polyelectrolytes issue)",,,,"cond-mat.soft q-bio",,"  The curvature stress of DNA packed inside a phage is balanced against its
electrostatic self-interaction. The DNA density is supposed nonuniform and as a
result the Donnan effect is also inhomogeneous. The coarse-grained DNA density
is a nonlinear function of the DNA radius of curvature at a given position
inside the bacteriophage. It turns out that a region (or regions) exists
totally free from DNA. The size of such holes is computed.
","[{""version"":""v1"",""created"":""Sun, 6 Apr 2003 17:36:01 GMT""}]","2007-05-23"
"cond-mat/0304141","Luis Santos","P. Pedri and L. Santos","Three-dimensional quasi-Tonks gas in a harmonic trap","4 pages, 3 figures, misprints corrected",,"10.1103/PhysRevLett.91.110401",,"cond-mat",,"  We analyze the macroscopic dynamics of a Bose gas in a harmonic trap with a
superimposed two-dimensional optical lattice, assuming a weak coupling between
different lattice sites. We consider the situation in which the local chemical
potential at each lattice site can be considered as that provided by the
Lieb-Liniger solution. Due to the weak coupling between sites and the form of
the chemical potential, the three-dimensional ground-state density profile and
the excitation spectrum acquire remarkable properties different from both 1D
and 3D gases. We call this system a quasi-Tonks gas. We discuss the range of
applicability of this regime, as well as realistic experimental situations
where it can be observed.
","[{""version"":""v1"",""created"":""Mon, 7 Apr 2003 09:04:44 GMT""},{""version"":""v2"",""created"":""Mon, 23 Jun 2003 15:40:10 GMT""}]","2009-11-10"
