"hep-ex/0304011","Jean-Luc Vuilleumier","Z. Daraktchieva, J. Lamblin, O. Link, C. Amsler, M.Avenier, C.
  Broggini, J. Busto, C. Cerna, G. Gervasio, P.Jeanneret, G.Jonkmans, D.H.
  Koang, D. Lebrun, F. Ould-Saada, G. Puglierin, A. Stutz, A. Tadsen,
  J.-L.Vuilleumier","Limits on the neutrino magnetic moment from the MUNU experiment","9 pages, 7 figures Added reference: p.3, 1st col., TEXONO Added
  sentence: p.4, 1st col., electron attachement Modified sentence: p.5, 1st
  col., readout sequence Added sentence: p.5, 1st col., fast rise time cut","Phys.Lett.B564:190-198,2003","10.1016/S0370-2693(03)00707-X",,"hep-ex",,"  The MUNU experiment was carried out at the Bugey nuclear power reactor. The
aim was the study of electron antineutrino-electron elastic scattering at low
energy. The recoil electrons were recorded in a gas time projection chamber,
immersed in a tank filled with liquid scintillator serving as veto detector,
suppressing in particular Compton electrons. The measured electron recoil
spectrum is presented. Upper limits on the neutrino magnetic moment were
derived and are discussed.
","[{""version"":""v1"",""created"":""Mon, 7 Apr 2003 08:47:40 GMT""},{""version"":""v2"",""created"":""Fri, 9 May 2003 09:06:42 GMT""}]","2008-11-26"
"hep-ex/0304012","Changzheng Yuan","BES Collaboration: J. Z. Bai, et al","First Evidence of Lambda Lambda-bar in \chi_cJ Decays","18 pages, 8 figures, submitted to Phys. Rev. D","Phys.Rev.D67:112001,2003","10.1103/PhysRevD.67.112001",,"hep-ex",,"  The first observation of \chi_cJ (J=0,1,2) decays to Lambda Lambda-bar is
reported using \psi(2S) data collected with the BESII detector at the BEPC. The
branching ratios are determined to be BR(\chi_c0 \to Lambda Lambda-bar) =
(4.7^{+1.3}_{-1.2} \pm 1.0)\times 10^{-4}, BR(\chi_c1 \to Lambda Lambda-bar) =
(2.6^{+1.0}_{-0.9} \pm 0.6)\times 10^{-4} and BR(\chi_c2 \to Lambda Lambda-bar)
= (3.3^{+1.5}_{-1.3} \pm 0.7)\times 10^{-4}. Results are compared with model
predictions.
","[{""version"":""v1"",""created"":""Mon, 7 Apr 2003 14:19:10 GMT""}]","2008-11-26"
"hep-lat/0304003","Anthony G. Williams","Anthony G. Williams","Nonperturbative QCD, gauge-fixing, Gribov copies, and the lattice","9 pages, 2 figures, to appear in Prog. Theor. Phys. Suppl. in the
  proceedings of the Tokyo-Adelaide Joint Workshop on Quarks, Astrophysics and
  Space Physics","Prog.Theor.Phys.Suppl.151:154-160,2003","10.1143/PTPS.151.154","ADP-3-118/T556","hep-lat",,"  Perturbative QCD uses the Faddeev-Popov gauge-fixing procedure, which leads
to ghosts and the local BRST invariance of the gauge-fixed perturbative QCD
action. In the asymptotic regime, where perturbative QCD is relevant, Gribov
copies can be neglected. In the nonperturbative regime, one must adopt either a
nonlocal Gribov-copy free gauge (e.g., Laplacian gauge) or attempt to maintain
local BRST invariance at the expense of admitting Gribov copies. These issues
are explored. In addition, we discuss the relationship between recent
Dyson-Schwinger based model calculations of the infrared behavior of QCD
Green's functions and the lattice calculation of these quantities.
","[{""version"":""v1"",""created"":""Mon, 7 Apr 2003 04:02:32 GMT""}]","2010-03-04"
"hep-ph/0304059","Igor Shovkovy","V. P. Gusynin, V. A. Miransky and I. A. Shovkovy","Large N dynamics in QED in a magnetic field","4 pages, REVTeX","Phys.Rev. D67 (2003) 107703","10.1103/PhysRevD.67.107703",,"hep-ph",,"  The expression for the dynamical mass of fermions in QED in a magnetic field
is obtained for a large number of the fermion flavor N in the framework of 1/N
expansion. The existence of a threshold value N_{thr}, dividing the theories
with essentially different dynamics, is established. For the number of flavors
N << N_{thr}, the dynamical mass is very sensitive to the value of the coupling
constant \alpha_b, related to the magnetic scale \mu = |eB|. For N of order
N_{thr} or larger, a dynamics similar to that in the Nambu-Jona-Lasinio model
with cutoff of order |eB| and the dimensional coupling constant G \sim
1/(N|eB|) takes place. In this case, the value of the dynamical mass is
essentially \alpha_b independent (the dynamics with an infrared stable fixed
point). The value of N_{thr} separates a weak coupling dynamics (with
\tilde{\alpha}_b \equiv N\alpha_b << 1) from a strong coupling one (with
\tilde{\alpha}_b \gtrsim 1) and is of order 1/\alpha_b.
","[{""version"":""v1"",""created"":""Sun, 6 Apr 2003 16:30:55 GMT""}]","2009-11-10"
"hep-ph/0304060","R. Sekhar Chivukula","R. Sekhar Chivukula, Hong-Jian He, Joseph Howard, and Elizabeth H.
  Simmons","Precision Electroweak Constraints on Hidden Local Symmetries","7 pages, talk given at SCGT02",,,"BUHEP-03-08","hep-ph",,"  In this talk we discuss the phenomenology of models with replicated
electroweak gauge symmetries, based on a framework with the gauge structure
[SU(2) or U(1)] x U(1) x SU(2) x SU(2).
","[{""version"":""v1"",""created"":""Mon, 7 Apr 2003 15:23:04 GMT""}]","2007-05-23"
"hep-ph/0304061","Balasubramanian Ananthanarayan","B. Ananthanarayan","Review of chiral perturbation theory","7 pages in revtex, Invited talk at the workshop, QCD2002, Indian
  Institute of Technology, Kanpur, November 18-22, 2002, to appear in the
  proceedings","Pramana61:911-920,2003","10.1007/BF02704459","IISc-CTS-02/03","hep-ph",,"  A review of chiral perturbation theory and that of recent developments on the
comparison of its predictions with experiment is presented. Some interesting
topics with scope for further elaboration are touched upon.
","[{""version"":""v1"",""created"":""Mon, 7 Apr 2003 04:45:42 GMT""}]","2008-11-26"
"hep-ph/0304062","Valery V. Kiselev","V.V.Kiselev","Strong CP theta-problem in QCD and local gluon condensate","3 pages, ReVTeX4,1 eps-figure, short explanations added",,,,"hep-ph",,"  We calculate the contribution of local gluon condensate into the quadratic
theta-term of vacuum energy and discuss its application to the study of axion
mass.
","[{""version"":""v1"",""created"":""Mon, 7 Apr 2003 05:35:04 GMT""},{""version"":""v2"",""created"":""Thu, 12 Jun 2003 09:05:50 GMT""}]","2007-05-23"
"hep-ph/0304063","Andrej Arbuzov","A.B. Arbuzov (JINR, Dubna)","Tables of convolution integrals","13 pages",,,,"hep-ph",,"  An analytical approach to convolution of functions, which appear in
perturbative calculations, is discussed. An extended list of integrals is
presented.
","[{""version"":""v1"",""created"":""Mon, 7 Apr 2003 07:48:30 GMT""}]","2007-05-23"
"hep-ph/0304064","Kotikov Anatoly","A. V. Kotikov and G. Parente","Small x behavior of parton distributions with flat initial conditions. A
  study of higher-twist effects","6 pages, 2 figures, latex. Talk presented at the XVI International
  Baldin Seminar on High Energy Physics Problems ``Relativistic Nuclear Physics
  and Quantum Chromodynamics'', Dubna, Russia, June 2002",,,,"hep-ph",,"  We study the Q^2 evolution of parton distributions at small x values,
obtained in the case of flat initial conditions. The contributions of twist-two
and (renormalon-type) higher-twist operators of the Wilson operator product
expansion are taken into account. The results are in good agreement with deep
inelastic scattering experimental data from HERA.
","[{""version"":""v1"",""created"":""Mon, 7 Apr 2003 07:56:33 GMT""}]","2007-05-23"
"hep-ph/0304065","Ferenc Sikler","Ferenc Sikler","Centrality control of hadron-nucleus interactions by detection of slow
  nucleons","32 pages, 30 figures",,,,"hep-ph",,"  Slow nucleons emitted during a hadron-nucleus interaction can give
information on the centrality, impact parameter of the collision. The aim of
this note is to provide the reader with the important characteristics of the
slow nucleons, focusing on their spectra, correlations. This study tries to
build on evidences, hence more weight is put on experimental results than on
models.
","[{""version"":""v1"",""created"":""Mon, 7 Apr 2003 09:35:58 GMT""}]","2007-05-23"
"hep-ph/0304066","Hee-Jung Lee","Hee-Jung Lee, Byung-Yoon Park, Mannque Rho, Vicente Vento","Sliding Vacua in Dense Skyrmion Matter","23 pages, 8 figures","Nucl.Phys. A726 (2003) 69-92","10.1016/S0375-9474(03)01626-9","KIAS-P03026","hep-ph nucl-th",,"  In continuation of our systematic effort to understand hadronic matter at
high density, we study dense skyrmion matter and its chiral phase structure in
an effective field theory implemented with the trace anomaly of QCD applicable
in the large $N_c$ limit. By incorporating a dilaton field $\chi$ associated
with broken conformal symmetry of QCD into the simplest form of skyrmion
Lagrangian, we simulate the effect of ""sliding vacua"" influenced by the
presence of matter and obtain what could correspond to the ``intrinsic
dependence"" on the background of the system, i.e., matter density or
temperature, that results when a generic chiral effective field theory of
strong interactions is matched to QCD at a matching scale near the chiral scale
$\Lambda_\chi \sim 4\pi f_\pi\sim 1$ GeV. The properties of the Goldstone pions
and the dilaton scalar near the chiral phase transition are studied by looking
at the pertinent excitations of given quantum numbers on top of a skyrmion
matter and their behavior in the vicinity of the phase transition from
Goldstone mode to Wigner mode characterized by the changeover from the FCC
crystal to the half-skyrmion CC crystal. We recover from the model certain
features that are connected to Brown-Rho scaling and that suggest how to give a
precise meaning to the latter in the framework of an effective field theory
that is matched to QCD .
","[{""version"":""v1"",""created"":""Mon, 7 Apr 2003 10:45:38 GMT""}]","2009-11-10"
"hep-ph/0304067","Fjy","J. R. Pelaez and F. J. Yndurain","On the precision of chiral-dispersive calculations of $\pi\pi$
  scattering","Version to appear in Phys. Rev. D. Graphs and sum rule added. Plain
  TeX file","Phys.Rev. D68 (2003) 074005","10.1103/PhysRevD.68.074005","FTUAM 03-1","hep-ph",,"  We calculate the combination $2a_0^{(0)}-5a_0^{(2)}$ (the Olsson sum rule)
and the scattering lengths and effective ranges $a_1$, $a_2^{(I)}$ and $b_1$,
$b_2^{(I)}$ dispersively (with the Froissart--Gribov representation) using, at
low energy, the phase shifts for $\pi\pi$ scattering obtained by Colangelo,
Gasser and Leutwyler (CGL) from the Roy equations and chiral perturbation
theory, plus experiment and Regge behaviour at high energy, or directly, using
the CGL parameters for $a$s and $b$s. We find mismatch, both among the CGL
phases themselves and with the results obtained from the pion form factor. This
reaches the level of several (2 to 5) standard deviations, and is essentially
independent of the details of the intermediate energy region ($0.82\leq E\leq
1.42$ GeV) and, in some cases, of the high energy behaviour assumed. We discuss
possible reasons for this mismatch, in particular in connection with an
alternate set of phase shifts.
","[{""version"":""v1"",""created"":""Mon, 7 Apr 2003 11:11:53 GMT""},{""version"":""v2"",""created"":""Wed, 7 May 2003 13:48:22 GMT""},{""version"":""v3"",""created"":""Thu, 10 Jul 2003 10:36:50 GMT""}]","2009-11-10"
"hep-ph/0304068","Elena Gonzalez Ferreiro","J. Dias de Deus, E. G. Ferreiro, C. Pajares and R. Ugoccioni","Universality of the transverse momentum distributions in the framework
  of percolation of strings","45 pages, latex, 11 postscript figures. Final version, accepted in
  EJPC","Eur.Phys.J. C40 (2005) 229-241","10.1140/epjc/s2005-02127-y",,"hep-ph",,"  In the framework of percolation of color sources, the transverse momentum
distribution in heavy ion and $p+p$ collisions at all centralities and energies
are shown to follow a universal behaviour. The width of the distribution
depends on the fluctuations of the number of color sources per cluster. At low
densities, there are only independent single color sources, no fluctuations
occurs and the distribution is described by a single exponential. At very high
densities, only one cluster of many color sources appears and therefore there
are not fluctuations either and the hardness of the distribution is suppressed.
The Cronin effect in this framework is due to a maximum of the fluctuations
which decreases as the density increases. We obtain a good agreement with
experimental data including the low $p_T$ behaviour and the spectra for
different particles. We show that the transverse momentum and multiplicity
distributions are related to each other in a defined way. This point is
satisfied by the experimental data on $p+p$ collisions at different energies.
","[{""version"":""v1"",""created"":""Mon, 7 Apr 2003 11:54:17 GMT""},{""version"":""v2"",""created"":""Tue, 6 Jul 2004 17:07:18 GMT""},{""version"":""v3"",""created"":""Wed, 19 Jan 2005 22:21:59 GMT""}]","2009-11-10"
"hep-ph/0304069","Eung Jin Chun","Eung Jin Chun, Kang Young Lee and Seong Chan Park","Testing Higgs Triplet Model and Neutrino Mass Patterns","13 pages, revtex","Phys.Lett. B566 (2003) 142-151","10.1016/S0370-2693(03)00770-6","KIAS-P03023","hep-ph",,"  The observed neutrino oscillation data might be explained by new physics at a
TeV scale, which is testable in the future experiments. Among various
possibilities, the low-energy Higgs triplet model is a prime candidate of such
new physics since it predicts clean signatures of lepton flavor violating
processes directly related to the neutrino masses and mixing. It is discussed
how various neutrino mass patterns can be discriminated by examining the lepton
flavor violating decays of charged leptons as well as the collider signatures
of a doubly charged Higgs boson in the model.
","[{""version"":""v1"",""created"":""Mon, 7 Apr 2003 12:17:21 GMT""}]","2010-04-05"
"hep-ph/0304070","Alejandro Szynkman","L.N. Epele, D. Gomez Dumm, A. Szynkman","Annihilation amplitudes and factorization in B to phi Kstar","9 pages, 1 table","Eur.Phys.J.C29:207-213,2003","10.1140/epjc/s2003-01217-2",,"hep-ph",,"  We study the decay $B^\pm\to \phi K^{\ast\pm}$, followed by the decay of the
outgoing vector mesons into two pseudoscalars. The analysis of angular
distributions of the decay products is shown to provide useful information
about the annihilation contributions and possible tests of factorization.
","[{""version"":""v1"",""created"":""Mon, 7 Apr 2003 14:58:19 GMT""}]","2009-01-07"
"hep-th/0304046","Banin Alexander","A.T. Banin, I.L. Buchbinder, N.G. Pletnev","One-loop effective action for ${\cal N}=4$ SYM theory in the
  hypermultiplet sector - leading low-energy approximation and beyond","LaTeX, 26 pages; corrected typos; references added","Phys.Rev. D68 (2003) 065024","10.1103/PhysRevD.68.065024",,"hep-th",,"  We develop the derivative expansion of the one-loop ${\cal N}=4$ SYM
effective action depending both on ${\cal N}=2$ vector multiplet and on
hypermultiplet background fields. We get a new derivation of the complete
${\cal N}=4$ supersymmetric low-energy effective action obtained in
hep-th/0111062 and find subleading corrections to it. A problem of ${\cal N}=4$
supersymmetry of the results is discussed. Using the formalism of ${\cal N}=2$
harmonic superspace and exploring on-shell hidden ${\cal N}=2$ supersymmetry of
${\cal N}=4$ SYM theory we construct the appropriate hypermultiplet-depending
contributions. The hidden ${\cal N}=2$ supersymmetry requirements allow to get
a leading, in hypermultiplet derivatives, part of the correct ${\cal N}=4$
supersymmetric functional containing $F^{8}$ among the component fields.
","[{""version"":""v1"",""created"":""Mon, 7 Apr 2003 05:14:30 GMT""},{""version"":""v2"",""created"":""Thu, 10 Apr 2003 07:40:33 GMT""},{""version"":""v3"",""created"":""Mon, 14 Apr 2003 01:36:06 GMT""}]","2009-11-10"
"hep-th/0304049","Misha Vasiliev","M.A.Vasiliev","Nonlinear Equations for Symmetric Massless Higher Spin Fields in
  $(A)dS_d$","19 pages, latex, no figures, v2 minor corrections","Phys.Lett. B567 (2003) 139-151","10.1016/S0370-2693(03)00872-4","FIAN/TD/07/03","hep-th",,"  Nonlinear field equations for totally symmetric bosonic massless fields of
all spins in any dimension are presented.
","[{""version"":""v1"",""created"":""Sun, 6 Apr 2003 21:46:24 GMT""},{""version"":""v2"",""created"":""Thu, 15 May 2003 17:37:54 GMT""}]","2009-11-10"
"hep-th/0304050","Andrew K. Waldron","S. Deser and A. Waldron","Acausality of Massive Charged Spin 2 Fields",,,,,"hep-th",,"  The recent claim in hep-th/0302225 that, contrary to all previous work,
massive charged s=2 fields propagate causally is false.
","[{""version"":""v1"",""created"":""Mon, 7 Apr 2003 04:16:43 GMT""}]","2007-05-23"
"hep-th/0304051","Kazuo Ghoroku","Kazuo Ghoroku, Motoi Tachibana and Nobuhiro Uekusa","Dilaton coupled brane-world and field trapping","15 pages, 1 figures","Phys.Rev. D68 (2003) 125002","10.1103/PhysRevD.68.125002","FIT HE - 03-02,KYUSHU-HET 65","hep-th",,"  We address solutions of brane-world with cosmological constant $\lambda$ by
introducing the dilaton in 5d bulk, and we examine the localization of
graviton, gauge bosons and dilaton. For those solutions, we find that both
graviton and gauge bosons can be trapped for either sign, positive or negative,
and wide range of $\lambda$ due to the non-trivial dilaton. While the dilaton
can not be trapped on the brane.
","[{""version"":""v1"",""created"":""Mon, 7 Apr 2003 09:24:40 GMT""},{""version"":""v2"",""created"":""Thu, 10 Apr 2003 00:31:48 GMT""},{""version"":""v3"",""created"":""Sat, 26 Jul 2003 06:44:14 GMT""}]","2009-11-10"
"hep-th/0304052","Olivier Babelon","O. Babelon","On the Quantum Inverse Problem for the Closed Toda Chain","16 pages","J.Phys.A37:303-316,2004","10.1088/0305-4470/37/2/002","LPTHE-P03-07","hep-th",,"  We reconstruct the canonical operators $p_i,q_i$ of the quantum closed Toda
chain in terms of Sklyanin's separated variables.
","[{""version"":""v1"",""created"":""Mon, 7 Apr 2003 08:24:31 GMT""}]","2008-11-26"
"hep-th/0304053","Galliano Valent","C. Klimcik and G. Valent","One-loop renormalizability of all 2d dimensional Poisson-Lie
  sigma-models","10 pages, latex, no figure","Phys.Lett. B565 (2003) 237-245","10.1016/S0370-2693(03)00764-0","CPT 03-4530, IML 03-03, LPTHE 03-11","hep-th",,"  We perform a systematic study of the one-loop renormalizability of all
Poisson-Lie T-dualizable $\si$-models with two-dimensional targets. We show
that whatever Drinfeld double and whatever matrix of coupling constants we
consider the corresponding $\si$-model is always one-loop renormalizable in the
strict field theoretical sense. Moreover, in all cases, the RG flow in the
space of the coupling constants is compatible with the Poisson-Lie T-duality.
","[{""version"":""v1"",""created"":""Mon, 7 Apr 2003 10:28:55 GMT""},{""version"":""v2"",""created"":""Fri, 11 Apr 2003 11:54:19 GMT""}]","2010-04-05"
"hep-th/0304054","Thomas Philbin","T. G. Philbin","Supergravity and IOSp(3,1|4) gauge theory","17 pages. Expanded version. To appear in Class. Quantum Grav","Class.Quant.Grav. 20 (2003) 4739","10.1088/0264-9381/20/22/002",,"hep-th gr-qc",,"  A new formulation of simple D=4 supergravity in terms of the geometry of
superspace is presented. The formulation is derived from the gauge theory of
the inhomogeneous orthosymplectic group IOSp(3,1|4) on a (4,4)-dimensional base
supermanifold by imposing constraints and taking a limit. Both the constraints
and the limiting procedure have a clear {\it a priori} physical motivation,
arising from the relationship between IOSp(3,1|4) and the super Poincar\'{e}
group. The construction has similarities with the space-time formulation of
Newtonian gravity.
","[{""version"":""v1"",""created"":""Mon, 7 Apr 2003 11:05:24 GMT""},{""version"":""v2"",""created"":""Tue, 2 Sep 2003 12:06:24 GMT""}]","2009-11-10"
"hep-th/0304055","Riccardo Giachetti","A. Barducci, R.Giachetti","Scalar and spinning particles in a plane wave field","13 pages","J.Phys.A36:8129-8140,2003","10.1088/0305-4470/36/29/317","FIRENZE - DFF - 401/03/2003","hep-th",,"  We study the quantization problem of relativistic scalar and spinning
particles interacting with a radiation electromagnetic field by using the path
integral and the external source method. The spin degrees of freedom are
described in terms of Grassmann variables and the Feynman kernel is obtained
through functional integration on both Bose and Fermi variables. We provide
rigourous proof that the Feynman amplitudes are only determined by the
classical contribution and we explicitly evaluate the propagators.
","[{""version"":""v1"",""created"":""Mon, 7 Apr 2003 11:36:43 GMT""}]","2008-11-26"
"hep-th/0304056","DaeKil Park","D. K. Park","Newton Law in Brane-World Scenario with 4d Induced Gravity: Singular
  Quantum Mechanical Approach","11 pages, no figure, v2: Newton law is improved, will appear in PLB","Phys.Lett. B562 (2003) 316-322","10.1016/S0370-2693(03)00602-6",,"hep-th",,"  From the viewpoint of the singular quantum mechanics the effect of the
energy-dependent coupling constant for $\delta$-function potential is examined.
The energy-dependence of the coupling constant naturally generates the
time-derivative in the boundary condition of the Euclidean propagator. This is
explicitly confirmed by making use of the simple 1d model. The result is
applied to the linearized gravity fluctuation equation for the brane-world
scenario with 4d induced gravity. Our approach generates $5d$ Newton potential
at a certain intermediate range of distance between two test massive sources.
For other range of distance 4d Newton potential is recovered.
","[{""version"":""v1"",""created"":""Mon, 7 Apr 2003 13:19:35 GMT""},{""version"":""v2"",""created"":""Wed, 23 Apr 2003 07:03:38 GMT""}]","2009-11-10"
"hep-th/0304057","Ellwanger","U. Ellwanger","Blown-up p-Branes and the Cosmological Constant","21 pages, no figures","JCAP 0311 (2003) 013","10.1088/1475-7516/2003/11/013","LPT Orsay 03-11","hep-th",,"  We consider a blown-up 3-brane, with the resulting geometry R^(3,1) \times
S^(N-1), in an infinite-volume bulk with N > 2 extra dimensions. The action on
the brane includes both an Einstein term and a cosmological constant. Similar
setups have been proposed both to reproduce 4-d gravity on the brane, and to
solve the cosmological constant problem. Here we obtain a singularity-free
solution to Einstein's equations everywhere in the bulk and on the brane, which
allows us to address these question explicitely. One finds, however, that the
proper volume of S^(N-1) and the cosmological constant on the brane have to be
fine-tuned relatively to each other, thus the cosmological constant problem is
not solved. Moreover the scalar propagator on the brane behaves 4-dimensionally
over a phenomenologically acceptable range only if the warp factor on the brane
is huge, which aggravates the Weak Scale - Planck Scale hierarchy problem.
","[{""version"":""v1"",""created"":""Mon, 7 Apr 2003 13:27:29 GMT""}]","2009-11-10"
"hep-th/0304058","Elisabetta Di Grezia","E. Di Grezia and S. Esposito","Minimal coupling of the Kalb-Ramond field to a scalar field","7 pages, revtex, no figures","Int.J.Theor.Phys. 43 (2004) 445-456","10.1023/B:IJTP.0000028877.38700.c5",,"hep-th astro-ph hep-ph",,"  We study the direct interaction of an antisymmetric Kalb-Ramond field with a
scalar particle derived from a gauge principle. The method outlined in this
paper to define a covariant derivative is applied to a simple model leading to
a linear coupling between the fields. Although no conserved Noether charge
exists, a conserved topological current comes out from the antisymmetry
properties of the Kalb-Ramond field. Some interesting features of this current
are pointed out.
","[{""version"":""v1"",""created"":""Mon, 7 Apr 2003 13:40:43 GMT""}]","2009-11-10"
"hep-th/0304060","Elias C. Vagenas","Mohammad R. Setare, Elias C. Vagenas","Cardy-Verlinde Formula and Achucarro-Ortiz Black Hole","10 pages, LaTeX, v2: minor changes, references added, to appear in
  Phys. Rev. D","Phys.Rev. D68 (2003) 064014","10.1103/PhysRevD.68.064014","UB-ECM-PF-03/10","hep-th astro-ph gr-qc",,"  In this paper it is shown that the entropy of the black hole horizon in the
Achucarro-Ortiz spacetime, which is the most general two-dimensional black hole
derived from the three-dimensional rotating BTZ black hole, can be described by
the Cardy-Verlinde formula. The latter is supposed to be an entropy formula of
conformal field theory in any dimension.
","[{""version"":""v1"",""created"":""Mon, 7 Apr 2003 14:48:44 GMT""},{""version"":""v2"",""created"":""Sat, 19 Jul 2003 09:45:35 GMT""}]","2009-11-10"
