"cond-mat/0304142","Joseph Horvat","D. Marinaro, J. Horvat, S. X. Dou, R. Weinstein and A. Gandini","Effects of Fission-Fragment Damage on Vortex Dimensionality in
  Silver-sheathed Bi2Sr2Ca2Cu3Ox Tapes",,"Phys. Rev. B 68, 064518 (2003)","10.1103/PhysRevB.68.064518",,"cond-mat.supr-con",,"  We report on the vortex dimensionality of uranium-doped Ag/Bi2223 tapes,
before and after irradiation to a thermal-neutron fluence. The effective
activation energies as a function of current density and applied field were
calculated from dynamic magnetisation relaxation measurements. A dimensional
crossover from a 3D elastic creep regime to 2D plastic creep was observed in
the nonirradiated tape at an applied magnetic field Hcr = 0.37 T, with an
associated change in the flux hop velocity and temperature dependence of the
activation energy. After introduction of the fission-fragment damage by
irradiation, a shift in the crossover to Hcr = 0.65 T was observed. These
results indicate an enhancement of the c-axis vortex coherence by the
introduced splayed columnar defects, explaining the greater pinning efficiency
of the uranium-fission method in Bi2223 rather than the less anisotropic Y123.
Conflicting results obtained for the irradiated tape in the absence of any
temperature scaling of the activation energies demonstrate the importance of
the inclusion of scaling in the magnetisation relaxation analysis.
","[{""version"":""v1"",""created"":""Mon, 7 Apr 2003 04:01:34 GMT""}]","2009-11-10"
"cond-mat/0304143","Kyungsik Kim","Kyungsik Kim, Seong-Min Yoon and Yup Kim","Herd Behavior of Returns in the Futures Exchange Market","7 pages, 7 figures, Latex",,,,"cond-mat.stat-mech q-fin.ST",,"  The herd behavior of returns is investigated in Korean futures exchange
market. It is obtained that the probability distribution of returns for three
types of herding parameter scales as a power law $R^{-\beta}$ with the
exponents $ \beta=3.6$(KTB203) and 2.9(KTB209) in two kinds of Korean treasury
bond. For our case since the active state of transaction exists to decrease
lesser than the herding parameter $h=2.33$, the crash regime appears to
increase in the probability with high returns values. Especially, we find that
it shows a crossover toward a Gaussian probability function near the time step
$\Delta t=360$ from the distribution of normalized returns. Our result will be
also compared with other well-known results.
","[{""version"":""v1"",""created"":""Mon, 7 Apr 2003 05:22:14 GMT""},{""version"":""v2"",""created"":""Wed, 9 Apr 2003 01:50:03 GMT""}]","2008-12-02"
"cond-mat/0304144","Roland Hayn","R.O. Kuzian, R. Hayn, J. Richter","Recursion method and one-hole spectral function of the Majumdar-Ghosh
  model","12 pages, 7 figures","Eur. Phys. J. B 35, 21 (2003)","10.1140/epjb/e2003-00252-x",,"cond-mat.str-el",,"  We consider the application of the recursion method to the calculation of
one-particle Green's functions for strongly correlated systems and propose a
new way how to extract the information about the infinite system from the exact
diagonalisation of small clusters. Comparing the results for several cluster
sizes allows us to establish those Lanczos coefficients that are not affected
by the finite size effects and provide the information about the Green's
function of the macroscopic system. The analysis of this 'bulk-related' subset
of coefficients supplemented by alternative analytic approaches allows to infer
their asymptotic behaviour and to propose an approximate analytical form for
the 'terminator' of the Green's function continued fraction expansion for the
infinite system. As a result, the Green's function acquires the branch cut
singularity corresponding to the incoherent part of the spectrum. The method is
applied to the spectral function of one-hole in the Majumdar-Ghosh model (the
one-dimensional $ t-J-J^{\prime}$ model at $J^{\prime}/J=1/2$). For this model,
the branch cut starts at finite energy $\omega_0$, but there is no upper bound
of the spectrum, corresponding to a linear increase of the recursion
coefficients. Further characteristics of the spectral function are band gaps in
the middle of the band and bound states below $\omega_0$ or within the gaps.
The band gaps arise due to the period doubling of the unit cell and show up as
characteristic oscillations of the recursion coefficients on top of the linear
increase.
","[{""version"":""v1"",""created"":""Mon, 7 Apr 2003 07:56:57 GMT""}]","2007-05-23"
"cond-mat/0304145","Roland Hayn","R.O. Kuzian, R. Hayn, A.F. Barabanov","Dispersion of the dielectric function of a charge-transfer insulator","22 pages, 5 figures","Phys. Rev. B 68, 195106 (2003)","10.1103/PhysRevB.68.195106",,"cond-mat.str-el",,"  We study the problem of dielectric response in the strong coupling regime of
a charge transfer insulator. The frequency and wave number dependence of the
dielectric function $\epsilon ({\bf q},\omega)$ and its inverse $\epsilon
^{-1}({\bf q},\omega)$ is the main object of consideration. We show that the
problem, in general, cannot be reduced to a calculation within the Hubbard
model, which takes into account only a restricted number of electronic states
near the Fermi energy. The contribution of the rest of the system to the
longitudinal response (i.e. to $\epsilon ^{-1}({\bf q},\omega)$) is essential
for the whole frequency range. With the use of the spectral representation of
the two-particle Green's function we show that the problem may be divided into
two parts: into the contributions of the weakly correlated and the Hubbard
subsystems. For the latter we propose an approach that starts from the
correlated paramagnetic ground state with strong antiferromagnetic
fluctuations. We obtain a set of coupled equations of motion for the
two-particle Green's function that may be solved by means of the projection
technique. The solution is expressed by a two particle basis that includes the
excitonic states with electron and hole separated at various distances. We
apply our method to the multiband Hubbard (Emery) model that describes layered
cuprates. We show that strongly dispersive branches exist in the excitonic
spectrum of the 'minimal' Emery model ($1/U_d=U_p=t_{pp}=0$) and consider the
dependence of the spectrum on finite oxygen hopping $t_{pp}$ and on-site
repulsion $U_p$. The relationship of our calculations to electron energy loss
spectroscopy is discussed.
","[{""version"":""v1"",""created"":""Mon, 7 Apr 2003 08:20:40 GMT""}]","2007-05-23"
"cond-mat/0304146","Qiuping A. Wang","Qiuping A. Wang","Power law distribution of R\'enyi entropy for equilibrium systems having
  nonadditive energy","11 pages, TeX, 2 aps figure",,,,"cond-mat.stat-mech",,"  Using R\'enyi entropy, a possible thermostatistics for nonextensive systems
is discussed. We show that it is possible to get the $q$-exponential
distribution function for nonextensive systems having nonadditive energy but
additive entropy. It is also shown that additive energy, as a approximation
within nonextensive statistics, is not suitable for discussing fundamental
problems for interacting systems.
","[{""version"":""v1"",""created"":""Mon, 7 Apr 2003 15:48:32 GMT""},{""version"":""v2"",""created"":""Tue, 8 Apr 2003 12:59:10 GMT""},{""version"":""v3"",""created"":""Thu, 24 Apr 2003 14:28:00 GMT""},{""version"":""v4"",""created"":""Tue, 6 May 2003 12:21:55 GMT""},{""version"":""v5"",""created"":""Sat, 10 May 2003 10:56:57 GMT""},{""version"":""v6"",""created"":""Wed, 25 Jun 2003 09:27:15 GMT""}]","2007-05-23"
"cond-mat/0304147","Mikhail Korshunov","Maxim M. Korshunov, Sergei G. Ovchinnikov, Alexei V. Sherman","Spin fluctuations influence on quasiparticle spectrum of realistic p-d
  model","Submitted to ICM 2003 Conference 3 pages, 2 figures","Journal of Magnetism and Magnetic Materials, Volumes 272-276,
  Supplement 1, May 2004, Pages E575-E577","10.1016/j.jmmm.2003.12.645",,"cond-mat.str-el cond-mat.supr-con",,"  In the present work the multiband p-d model for $CuO_2$-layer is treated. It
was shown that for the realistic set of parameters besides Zhang-Rice
two-particle singlet there is non-negligible contribution of two-particle
triplet state to the top of the valence band. Also shown, that to gain
quantitative agreement with experimental data the minimal approximation should
include the spin fluctuations beyond the Hubbard-I scheme. Quasiparticle
spectrum, obtained in this approximation, is in fairly good agreement with
ARPES data on Bi2212 High-$T_c$ compound.
","[{""version"":""v1"",""created"":""Mon, 7 Apr 2003 08:46:28 GMT""}]","2009-09-29"
"cond-mat/0304148","Nicholas G. Parker","N.G.Parker, N.P.Proukakis, M. Leadbeater, and C.S. Adams","Deformation of dark solitons in inhomogeneous Bose-Einstein condensates","22 pages, 11 figures, J. Phys. B accepted",,"10.1088/0953-4075/36/13/318",,"cond-mat",,"  A dark soliton becomes unstable when it is incident on a background density
gradient, and the induced instability results in the emission of sound.
Detailed quantitative studies of sound emission are performed for various
potentials, such as steps, linear ramps and gaussian traps. The amount of sound
emission is found to be a significant fraction of the soliton energy for
typical potentials. Continuous emission of sound is found to lead to an
apparent deformation of the soliton profile. The power emitted by the soliton
is shown to be parametrised by the square of the displacement of the centre of
mass of the soliton from its density minimum, thus highlighting the
significance of the inhomogeneity-induced soliton deformation.
","[{""version"":""v1"",""created"":""Mon, 7 Apr 2003 08:54:58 GMT""},{""version"":""v2"",""created"":""Tue, 3 Jun 2003 14:52:00 GMT""}]","2009-11-10"
"cond-mat/0304149","Hisao Hayakawa","Hisao Hayakawa","Hydrodynamics of driven granular gases","5 pages, 3 figures",,"10.1103/PhysRevE.68.031304",,"cond-mat.stat-mech cond-mat.soft",,"  Hydrodynamic equations for granular gases driven by the Fokker-Planck
operator are derived. Transport coefficients appeared in Navier-Stokes order
change from the values of a free cooling state to those of a steady state.
","[{""version"":""v1"",""created"":""Mon, 7 Apr 2003 09:09:25 GMT""}]","2009-11-10"
"cond-mat/0304150","Ruben Serral Gracia","R. Serral Gracia, Th.M. Nieuwenhuizen","Quantum spherical spin models","22 pages",,"10.1103/PhysRevE.69.056119",,"cond-mat",,"  A recently introduced class of quantum spherical spin models is considered in
detail. Since the spherical constraint already contains a kinetic part, the
Hamiltonian need not have kinetic term. As a consequence, situations with or
without momenta in the Hamiltonian can be described, which may lead to
different symmetry classes. Two models that show this difference are analyzed.
Both models are exactly solvable and their phase diagram is analyzed. A
transversal external field leads to a phase transition line that ends in a
quantum critical point. The two considered symmetries of the Hamiltonian
considered give different critical phenomena in the quantum critical region.
The model with momenta is argued to be analog to the large-N limit of an SU(N)
Heisenberg ferromagnet, and the model without momenta shares the critical
phenomena of an SU(N) Heisenberg antiferromagnet.
","[{""version"":""v1"",""created"":""Mon, 7 Apr 2003 10:27:25 GMT""},{""version"":""v2"",""created"":""Fri, 27 Jun 2003 10:18:42 GMT""},{""version"":""v3"",""created"":""Fri, 16 Jan 2004 17:26:32 GMT""}]","2009-11-10"
"cond-mat/0304151","Trinh van Khoa","Trinh Van Khoa","q-Plastic deformation","LaTeX, 9 pages, no figures",,,"Moscow State University, thesis 2003g","cond-mat",,"  It is known that the appearance of the order state in continuous medium is
the result of the spontaneous breaking of the symmetry. The collective fashion
was used in the role of carrier maintaining the order state, may be considered
as plastic fashion. In other world, the order state exists because of the
concentration of strength in the medium. In this case the symmetry regulates
the character of this concentration. At general in the process of plastic
deformation may exist as such situation :
  Formation of order state = Spontaneous breaking symmetry = Reconstruction of
symmetry.
  However, in this situation the reconstruction of symmetry turns to no
reduction of symmetry but to the q-symmetry. Here we, in secret sense, identity
the process of reconstruction of symmetry with the process of ""quantization"" of
group Lie in the deformation bundle . The parameters $q$ plays the role of the
parameter of regulation.
  In this paper we used the formalism BRST to carry out the procedure of
""secondary calculus"".
","[{""version"":""v1"",""created"":""Mon, 7 Apr 2003 11:16:49 GMT""}]","2016-08-31"
"cond-mat/0304152","A. S. Alexandrov","A. S. Alexandrov, V. N. Zavaritsky, and S. Dzhumanov","Hall effect and resistivity in underdoped cuprates","4 pages, 2 figures, the model and fits were refined","Physical Review B v.69, 2004, p. 052505","10.1103/PhysRevB.69.052505",,"cond-mat.supr-con cond-mat.str-el",,"  The behaviour of the Hall ratio $R_{H}(T)$ as a function of temperature is
one of the most intriguing normal state properties of cuprate superconductors.
One feature of all the data is a maximum of $R_{H}(T)$ in the normal state that
broadens and shifts to temperatures well above $T_c$ with decreasing doping. We
show that a model of preformed pairs-bipolarons provides a selfconsistent
quantitative description of $R_{H}(T)$ together with in-plane resistivity and
uniform magnetic susceptibility for a wide range of doping.
","[{""version"":""v1"",""created"":""Mon, 7 Apr 2003 15:33:59 GMT""},{""version"":""v2"",""created"":""Thu, 12 Jun 2003 11:24:43 GMT""}]","2009-11-10"
"cond-mat/0304153","W. Zwerger","W. Zwerger","Anomalous fluctuations in phases with a broken continuous symmetry","final version, minor changes","Physical Review Letters 92, 027203 (2004)","10.1103/PhysRevLett.92.027203",,"cond-mat.stat-mech cond-mat.str-el",,"  It is shown that the Goldstone modes associated with a broken continuous
symmetry lead to anomalously large fluctuations of the zero field order
parameter at any temperature below T_c. In dimensions 2<d<4, the variance of
the extensive spontaneous magnetization scales as L^4 with the system size L,
independent of the order parameter dynamics. The anomalous scaling is a
consequence of the 1/q^{4-d} divergence of the longitudinal susceptibility. For
ground states in two dimensions with Goldstone modes vanishing linearly with
momentum, the dynamical susceptibility contains a singular contribution
(q^2-\omega^2/c^2)^{-1/2}. The dynamic structure factor thus exhibits a
critical continuum above the undamped spin wave pole, which may be detected by
neutron scattering in the N\'eel-phase of 2D quantum antiferromagnets.
","[{""version"":""v1"",""created"":""Mon, 7 Apr 2003 13:55:05 GMT""},{""version"":""v2"",""created"":""Tue, 25 Nov 2003 07:34:58 GMT""},{""version"":""v3"",""created"":""Mon, 26 Jan 2004 12:34:34 GMT""}]","2009-11-10"
"cond-mat/0304154","Parruccini Pietro","P. Calabrese, P. Parruccini, A. I. Sokolov","Critical thermodynamics of three-dimensional chiral model for N > 3","12 pages, 3 figures","Phys.Rev. B68 (2003) 094415","10.1103/PhysRevB.68.094415",,"cond-mat.stat-mech hep-lat",,"  The critical behavior of the three-dimensional $N$-vector chiral model is
studied for arbitrary $N$. The known six-loop renormalization-group (RG)
expansions are resummed using the Borel transformation combined with the
conformal mapping and Pad\'e approximant techniques. Analyzing the fixed point
location and the structure of RG flows, it is found that two marginal values of
$N$ exist which separate domains of continuous chiral phase transitions $N >
N_{c1}$ and $N < N_{c2}$ from the region $N_{c1} > N > N_{c2}$ where such
transitions are first-order. Our calculations yield $N_{c1} = 6.4(4)$ and
$N_{c2} = 5.7(3)$. For $N > N_{c1}$ the structure of RG flows is identical to
that given by the $\epsilon$ and 1/N expansions with the chiral fixed point
being a stable node. For $N < N_{c2}$ the chiral fixed point turns out to be a
focus having no generic relation to the stable fixed point seen at small
$\epsilon$ and large $N$. In this domain, containing the physical values $N =
2$ and $N = 3$, phase trajectories approach the fixed point in a spiral-like
manner giving rise to unusual crossover regimes which may imitate varying
(scattered) critical exponents seen in numerous physical and computer
experiments.
","[{""version"":""v1"",""created"":""Mon, 7 Apr 2003 15:06:33 GMT""}]","2009-11-10"
"cond-mat/0304155","Vladimir N. Krivoruchko","V. N. Krivoruchko, E. A. Koshina (Donetsk Physics and Technology
  Institute, Donetsk, Ukraine)","Critical current of a S/F-I-N/S tunnel structure in a parallel magnetic
  field","13 pages, 8 figures",,,"DFI-24-04","cond-mat.supr-con",,"  We study the critical current of a S/F-I-N/S tunnel structure - a proximity
coupled superconductor (S) with thin ferromagnetic (F) and nonmagnetic (N)
metals separated by an insulating (I) barrier - in an external magnetic field.
The dependence of the current on exchange and external magnetic fields, and
their mutual orientation is analyzed within the microscopic theory of the
proximity effect. We find that the S/F-I-N/S contact with strong magnetism of
the F layer is in a ground state with superconducting phase difference on the
electrodes about pi/2. Low external magnetic field reverses the critical
current sign of such a contact (a \pi-state of the junction) for parallel field
orientation. For antiparallel alignment the dc Josephson current behavior is
essentially nonmonotonic: by increasing an external magnetic field the current
passes though a maximum, while the 0-phase state is held, and then the junction
gets into the \pi-phase state with an opposite current direction. We
demonstrate that the hybrid S/F-I-N/S metal structures possess new effects of
the superconductivity in the presence of spin splitting, while an experimental
set-up seems to be feasible and it may lead to further understanding of
superconducting proximity effects in ferromagnetic materials.
","[{""version"":""v1"",""created"":""Mon, 7 Apr 2003 14:29:01 GMT""}]","2007-05-23"
"cond-mat/0304156","Yuri Gaididei","H. Buettner, Yu. Gaididei","Comment on the paper 'Thermodynamics of two-dimensional magneto
  nanoparticles' by P. Vargas, D. Altbir, M. Knobel and D. Laroze","3 pages, 2 figures",,,,"cond-mat.stat-mech",,"  It is shown that there is no bi-stability in the system of two-dimensional
nanoparticles considered by P. Vargas et al.
","[{""version"":""v1"",""created"":""Mon, 7 Apr 2003 15:43:15 GMT""}]","2007-05-23"
"cond-mat/0304157","Christoph Adelmann","C. Adelmann, J. Brault, G. Mula, B. Daudin, L. Lymperakis, J.
  Neugebauer","Gallium adsorption on (0001) GaN surfaces","9 pages, 10 figures",,"10.1103/PhysRevB.67.165419",,"cond-mat.mtrl-sci",,"  We study the adsorption behavior of Ga on (0001) GaN surfaces combining
experimental specular reflection high-energy electron diffraction with
theoretical investigations in the framework of a kinetic model for adsorption
and ab initio calculations of energy parameters. The measurement of a Ga/GaN
adsorption isotherm allows the quantification of the equilibrium Ga surface
coverage as a function of the impinging Ga flux. The temperature dependence is
discussed within an {\em ab initio} based growth model for adsorption taking
into account the nucleation of Ga clusters.
","[{""version"":""v1"",""created"":""Mon, 7 Apr 2003 15:45:29 GMT""}]","2009-11-10"
"cond-mat/0304158","Huegle","S. Huegle and R. Egger","Resonant tunneling in a Luttinger liquid for arbitrary barrier
  transmission","4 pages, 4 figures","Europhys. Lett. 66, 565-571 (2004)","10.1209/epl/i2003-10229-5",,"cond-mat.str-el",,"  A numerically exact dynamical quantum Monte Carlo approach has been developed
and applied to transport through a double barrier in a Luttinger liquid with
arbitrary transmission. For strong transmission, we find broad Fabry-Perot
Coulomb blockade peaks, with a lineshape parametrized by a single parameter,
but at sufficiently low temperatures, non-Lorentzian universal lineshapes
characteristic of coherent resonant tunneling emerge, even for strong
interactions. For weak transmission, our data supports the recently proposed
correlated sequential tunneling picture and is consistent with experimental
results on intrinsic nanotube dots.
","[{""version"":""v1"",""created"":""Mon, 7 Apr 2003 15:54:45 GMT""},{""version"":""v2"",""created"":""Thu, 4 Mar 2004 08:56:47 GMT""}]","2009-11-10"
"gr-qc/0304028","Dmitri Vassiliev","Dmitri Vassiliev","Quadratic metric-affine gravity","25 pages, LaTeX2e","Annalen Phys. 14 (2005) 231-252","10.1002/andp.200410118",,"gr-qc math.DG",,"  We consider spacetime to be a connected real 4-manifold equipped with a
Lorentzian metric and an affine connection. The 10 independent components of
the (symmetric) metric tensor and the 64 connection coefficients are the
unknowns of our theory. We introduce an action which is quadratic in curvature
and study the resulting system of Euler-Lagrange equations. In the first part
of the paper we look for Riemannian solutions, i.e. solutions whose connection
is Levi-Civita. We find two classes of Riemannian solutions: 1) Einstein
spaces, and 2) spacetimes with metric of a pp-wave and parallel Ricci
curvature. We prove that for a generic quadratic action these are the only
Riemannian solutions. In the second part of the paper we look for
non-Riemannian solutions. We define the notion of a ""Weyl pseudoinstanton""
(metric compatible spacetime whose curvature is purely Weyl) and prove that a
Weyl pseudoinstanton is a solution of our field equations. Using the
pseudoinstanton approach we construct explicitly a non-Riemannian solution
which is a wave of torsion in Minkowski space. We discuss the possibility of
using this non-Riemannian solution as a mathematical model for the graviton or
the neutrino.
","[{""version"":""v1"",""created"":""Sun, 6 Apr 2003 23:22:36 GMT""}]","2007-05-23"
"gr-qc/0304029","S. Mignemi","S. Mignemi","Transformations of coordinates and Hamiltonian formalism in deformed
  Special Relativity","11 pages, plain LaTeX","Phys.Rev. D68 (2003) 065029","10.1103/PhysRevD.68.065029",,"gr-qc",,"  We investigate the transformation laws of coordinates in generalizations of
special relativity with two observer-independent scales. The request of
covariance leads to simple formulas if one assumes noncanonical Poisson
brackets, corresponding to noncommuting spacetime coordinates.
","[{""version"":""v1"",""created"":""Mon, 7 Apr 2003 09:06:01 GMT""}]","2009-11-10"
"gr-qc/0304030","Nils Andersson","K. Glampedakis and N. Andersson","Quick and dirty methods for studying black-hole resonances","18 pages, RevTeX, 7 ps figs","Class.Quant.Grav. 20 (2003) 3441-3464","10.1088/0264-9381/20/15/312",,"gr-qc",,"  We discuss simple integration methods for the calculation of rotating black
hole scattering resonances both in the complex frequency plane (quasinormal
modes) and the complex angular momentum plane (Regge poles). Our numerical
schemes are based on variations of ""phase-amplitude"" methods. In particular, we
discuss the Pruefer transformation, where the original (frequency domain)
Teukolsky wave equation is replaced by a pair of first-order non-linear
equations governing the introduced phase functions. Numerical integration of
these equations, performed along the real coordinate axis, or along rotated
contours in the complex coordinate plane, provides the required S-matrix
element (the ratio of amplitudes of the outgoing and ingoing waves at
infinity). Mueller's algorithm is then employed to conduct searches in the
complex plane for the poles of this quantity (which are, by definition, the
desired resonances). We have tested this method by verifying known results for
Schwarzschild quasinormal modes and Regge poles, and provide new results for
the Kerr black hole problem. We also describe a new method for estimating the
""excitation coefficients"" for quasinormal modes. The method is applied to
scalar waves moving in the Kerr geometry, and the obtained results shed light
on the long-lived quasinormal modes that exist for black holes rotating near
the extreme Kerr limit.
","[{""version"":""v1"",""created"":""Mon, 7 Apr 2003 09:49:09 GMT""}]","2009-11-10"
"gr-qc/0304031","Huguet Eric","T. Garidi, E. Huguet, J. Renaud","De Sitter Waves and the Zero Curvature Limit","9 pages, latex no figure, to appear in Phys. Rev. D","Phys.Rev. D67 (2003) 124028","10.1103/PhysRevD.67.124028",,"gr-qc",,"  We show that a particular set of global modes for the massive de Sitter
scalar field (the de Sitter waves) allows to manage the group representations
and the Fourier transform in the flat (Minkowskian) limit. This is in
opposition to the usual acceptance based on a previous result, suggesting the
appearance of negative energy in the limit process. This method also confirms
that the Euclidean vacuum, in de Sitter spacetime, has to be preferred as far
as one wishes to recover ordinary QFT in the flat limit.
","[{""version"":""v1"",""created"":""Mon, 7 Apr 2003 10:51:08 GMT""}]","2009-11-10"
