"astro-ph/0304219","John A. Tomsick","John A. Tomsick (CASS/UCSD), Emrah Kalemci (SSL/UCB), Stephane Corbel
  (Universite Paris VII and CEA Saclay), Philip Kaaret (Harvard-Smithsonian
  CfA)","X-Ray Flares and Oscillations from the Black Hole Candidate X-Ray
  Transient XTE J1650-500 at Low Luminosity","9 pages, accepted by ApJ","Astrophys.J.592:1100-1109,2003","10.1086/375811",,"astro-ph",,"  We report on X-ray observations made with the Rossi X-ray Timing Explorer of
the black hole candidate (BHC) transient XTE J1650-500 at the end of its first,
and currently only, outburst. By monitoring the source at low luminosities over
several months, we found 6 bright ~100 second X-ray flares and long time scale
oscillations of the X-ray flux. The oscillations are aperiodic with a
characteristic time scale of 14.2 days and an order of magnitude variation in
the 2.8-20 keV flux. The oscillations may be related to optical
""mini-outbursts"" that have been observed at the ends of outbursts for other
short orbital period BHC transients. The X-ray flares have durations between 62
and 215 seconds and peak fluxes that are 5-24 times higher than the persistent
flux. The flares have non-thermal energy spectra and occur when the persistent
luminosity is near 3E34 (d/4 kpc)^2 erg/s (2.8-20 keV). The rise time for the
brightest flare demonstrates that physical models for BHC systems must be able
to account for the situation where the X-ray flux increases by a factor of up
to 24 on a time scale of seconds. We discuss the flares in the context of
observations and theory of Galactic BHCs and compare the flares to those
detected from Sgr A*, the super-massive black hole at the Galactic center. We
also compare the flares to X-ray bursts that are seen in neutron star systems.
While some of the flare light curves are similar to those of neutron star
bursts, the flares have non-thermal energy spectra in contrast to the blackbody
spectra exhibited in bursts. This indicates that X-ray bursts should not be
taken as evidence that a given system contains a neutron star unless the
presence of a blackbody component in the burst spectrum can be demonstrated.
","[{""version"":""v1"",""created"":""Fri, 11 Apr 2003 16:46:44 GMT""}]","2008-11-26"
"astro-ph/0304220","Mauron","N. Mauron, P. de Laverny, B. Lopez","The envelope of IRC+10216 reflecting the galactic light: UBV surface
  brightness photometry and interpretation","accepted by AA","Astron.Astrophys. 401 (2003) 985-996","10.1051/0004-6361:20030127",,"astro-ph",,"  We present and analyse new optical images of the dust envelope surrounding
the high mass-loss carbon star IRC+10216. This envelope is seen due to external
illumination by galactic light. Intensity profiles and colors of the nebula
were obtained in the UBV bandpasses. The data are compared with the results of
a radiative transfer model calculating multiple scattering of interstellar
field photons by dust grains with a single radius. The data show that the
observed radial shape of the nebula, especially its half maximum radius, does
not depend on wavelength (within experimental errors), suggesting that grains
scatter in the grey regime, etc, etc (this abstract has been shortened)
","[{""version"":""v1"",""created"":""Fri, 11 Apr 2003 17:00:04 GMT""}]","2009-11-07"
"astro-ph/0304221","Bruno Femenia Castella","B. Femenia and N. Devaney (GTC Project - Instituto de Astrofisica de
  Canarias)","Optimization with numerical simulations of the conjugate altitudes of
  deformable mirrors in an MCAO system","Accepted for publication in A&A; 12 pages, 7 figures, 3 tables","Astron.Astrophys. 404 (2003) 1165","10.1051/0004-6361:20030538","PP15/2003","astro-ph",,"  This article reports on the results of simulations conducted to assess the
performance of a modal Multi-Conjugate Adaptive Optics (MCAO) system on a 10m
telescope with one Deformable Mirror (DM) conjugated to the telescope pupil and
a second DM conjugated at a certain altitude above the pupil. The main goal of
these simulations is to study the dependence of MCAO performance upon the
altitude of the high-altitude conjugated DM and thereby determine its optimal
conjugation. The performance is also studied with respect to the geometry of
the Guide Star constellation when using constellations of Natural Guide Stars
(NGS), which are rare, or constellations of Laser Guide Stars (LGS) which would
allow large sky coverage.
","[{""version"":""v1"",""created"":""Fri, 11 Apr 2003 17:23:09 GMT""}]","2009-11-07"
"astro-ph/0304222","Andrew Ptak","A. Ptak (1), T. Heckman (1), N. A. Levenson (2), K. Weaver (1 and 3),
  D. Strickland (1) ((1) Johns Hopkins University, (2) University of Kentucky,
  (3) NASA/GSFC)","A Chandra Survey of the Nearest ULIRGs: Obscured AGN or
  Super-Starbursts?","22 pages, 8 figures, formatted with emulateapj.sty, accepted for
  publication in August 2003 ApJ","Astrophys.J. 592 (2003) 782-803","10.1086/375766",,"astro-ph",,"  We present initial results from a Chandra survey of a complete sample of the
8 nearest (z <= 0.04) ultraluminous IR galaxies (ULIRGs), and also include the
IR-luminous galaxy NGC 6240 for comparison. In this paper we use the hard
X-rays (2-8 kev) to search for the possible presence of an obscured AGN. In
every case, a hard X-ray source is detected in the nuclear region. If we divide
the sample according to the optical/IR spectroscopic classification (starburst
vs. AGN), we find that the 5 ``starburst'' ULIRGs have hard X-ray luminosities
about an order-of-magnitude smaller than the 3 ``AGN'' ULIRGs. NGC 6240 has an
anomalously high hard X-ray luminosity compared to the ``starburst'' ULIRGs.
The Fe Kalpha line is convincingly detected in only two ULIRGs. The weakness of
the Fe-K emission in these ULIRGs generally suggests that the hard X-ray
spectrum is not dominated by reflection from high N_H neutral material. The
hard X-ray continuum flux ranges from a few X 10^3 to a few X 10^-5 of the
far-IR flux, similar to values in pure starbursts, and several
orders-of-magnitude smaller than in Compton-thin AGN. The upper limits on the
ratio of the Fe Kalpha to far-IR flux are below the values measured in
Compton-thick type 2 Seyfert galaxies. While very large column densities of
molecular gas are observed in the nuclei of these galaxies, we find no evidence
that the observed X-ray sources are obscured by Compton-thick material. Thus,
our new hard X-ray data do not provide direct evidence that powerful ``buried
quasars'' dominate the overall energetics of most ultraluminous infrared
galaxies.
","[{""version"":""v1"",""created"":""Fri, 11 Apr 2003 18:08:15 GMT""}]","2009-11-07"
"astro-ph/0304223","Siu A. Chin","Siu A. Chin and C. R. Chen","Forward Symplectic Integrators for Solving Gravitational Few-Body
  Problems","21 pages, 10 figures, use aastex; submitted to The Astronomical
  Journal",,,,"astro-ph physics.comp-ph",,"  We introduce a class of fourth order symplectic algorithms that are ideal for
doing long time integration of gravitational few-body problems. These
algorithms have only positive time steps, but require computing the force
gradient in additional to the force. We demonstrate the efficiency of these
Forward Symplectic Integrators by solving the circularly restricted three-body
problem in the space-fixed frame where the force on the third body is
explicitly time-dependent. These algorithms can achieve accuracy of
Runge-Kutta, backward time step and corrector symplectic algorithms at step
sizes five to ten times as large.
","[{""version"":""v1"",""created"":""Fri, 11 Apr 2003 18:39:20 GMT""}]","2007-05-23"
"astro-ph/0304224","Giovanni Lapenta","P. Ricci, J.U. Brackbill, W. Daughton, G. Lapenta","Kinetic simulations of collisionless magnetic reconnection in presence
  of a guide field","submitted to J. Geophys. Res. (2003)","Phys.Plasmas 11:4102-4114,2004","10.1063/1.17685=",,"astro-ph physics.plasm-ph physics.space-ph",,"  The results of kinetic simulations of magnetic reconnection in Harris current
sheets are analyzed. A range of guide fields is considered to study
reconnection in plasmas characterized by different $\beta$ values, $\beta >
m_e/m_i$. Both an implicit Particle-in-Cell (PIC) simulation method and a
parallel explicit PIC code are used. Simulations with mass ratios up to the
physical value are performed. The simulations show that the reconnection rate
decreases with the guide field and depends weakly on the mass ratio. The
off-diagonal components of the electron pressure tensor break the frozen-in
condition, even in low $\beta$ plasmas. In high $\beta$ plasmas, evidence is
presented that whistler waves play a key role in the enhanced reconnection,
while in low $\beta$ plasmas the kinetic Alfv\'en waves are important. The
in-plane and the out-of-plane ion and electron motion are also considered,
showing that they are influenced by the mass ratio and the plasma $\beta$.
","[{""version"":""v1"",""created"":""Fri, 11 Apr 2003 19:03:50 GMT""},{""version"":""v2"",""created"":""Fri, 5 Dec 2003 20:10:53 GMT""}]","2009-04-28"
"astro-ph/0304225","Manoj Kaplinghat","M. Kaplinghat, N. Kaloper and L. Knox","Proceedings of the Davis Meeting on Cosmic Inflation","1 HTML page. The meeting webpage is http://inflation03.ucdavis.edu
  (with links to slides of talks given at the meeting)",,,,"astro-ph",,"  The Davis Meeting on Cosmic Inflation marked an exciting milestone on the
road to precision cosmology. This is the index page for the proceedings of the
conference. Individual proceedings contributions, when they appear on this
archive, are linked from this page.
","[{""version"":""v1"",""created"":""Fri, 11 Apr 2003 21:43:49 GMT""},{""version"":""v2"",""created"":""Fri, 18 Jul 2003 22:01:21 GMT""}]","2007-05-23"
"astro-ph/0304226","Adam Burrows","Adam Burrows, David Sudarsky, and Jonathan Lunine","Beyond the T Dwarfs: Theoretical Spectra, Colors, and Detectability of
  the Coolest Brown Dwarfs","Includes 14 figures, most in color; accepted to the Astrophysical
  Journal","Astrophys.J.596:587-596,2003","10.1086/377709",,"astro-ph",,"  We explore the spectral and atmospheric properties of brown dwarfs cooler
than the latest known T dwarfs. Our focus is on the yet-to-be-discovered
free-floating brown dwarfs in the \teff range from $\sim$800 K to $\sim$130 K
and with masses from 25 to 1 \mj. This study is in anticipation of the new
characterization capabilities enabled by the launch of SIRTF and the eventual
launch of JWST. We provide spectra from $\sim$0.4 \mic to 30 \mic, highlight
the evolution and mass dependence of the dominant H$_2$O, CH$_4$, and NH$_3$
molecular bands, consider the formation and effects of water-ice clouds, and
compare our theoretical flux densities with the sensitivities of the
instruments on board SIRTF and JWST. The latter can be used to determine the
detection ranges from space of cool brown dwarfs. In the process, we determine
the reversal point of the blueward trend in the near-infrared colors with
decreasing \teff, the \teffs at which water and ammonia clouds appear, the
strengths of gas-phase ammonia and methane bands, the masses and ages of the
objects for which the neutral alkali metal lines are muted, and the increasing
role as \teff decreases of the mid-infrared fluxes longward of 4 \mic. These
changes suggest physical reasons to expect the emergence of at least one new
stellar class beyond the T dwarfs. Our spectral models populate, with cooler
brown dwarfs having progressively more planet-like features, the theoretical
gap between the known T dwarfs and the known giant planets. Such objects likely
inhabit the galaxy, but their numbers are as yet unknown.
","[{""version"":""v1"",""created"":""Fri, 11 Apr 2003 21:20:00 GMT""},{""version"":""v2"",""created"":""Mon, 23 Jun 2003 17:43:39 GMT""}]","2008-11-26"
"astro-ph/0304228","Patrick J. Sutton","Lee Samuel Finn, Badri Krishnan, and Patrick J. Sutton","Swift Pointing and the Association Between Gamma-Ray Bursts and
  Gravitational-Wave Bursts","aastex, 14 pages, 2 figures","Astrophys.J.607:384-390,2004","10.1086/383257",,"astro-ph gr-qc",,"  The currently accepted model for gamma-ray burst phenomena involves the
violent formation of a rapidly rotating solar mass black hole. Gravitational
waves should be associated with the black-hole formation, and their detection
would permit this model to be tested, the black hole progenitor (e.g.,
coalescing binary or collapsing stellar core) identified, and the origin of the
gamma rays (within the expanding relativistic fireball or at the point of
impact on the interstellar medium) located. Even upper limits on the
gravitational-wave strength associated with gamma-ray bursts could constrain
the gamma-ray burst model. To do any of these requires joint observations of
gamma-ray burst events with gravitational and gamma-ray detectors. Here we
examine how the quality of an upper limit on the gravitational-wave strength
associated with gamma-ray burst observations depends on the relative
orientation of the gamma-ray-burst and gravitational-wave detectors, and apply
our results to the particular case of the Swift Burst-Alert Telescope (BAT) and
the LIGO gravitational-wave detectors. A result of this investigation is a
science-based ``figure of merit'' that can be used, together with other mission
constraints, to optimize the pointing of the Swift telescope for the detection
of gravitational waves associated with gamma-ray bursts.
","[{""version"":""v1"",""created"":""Fri, 11 Apr 2003 23:40:38 GMT""}]","2010-11-19"
"astro-ph/0304229","Joel Omar Yam Gamboa","Esperanza Carrasco, Alberto Carraminana, Jose Luis Aviles and Omar Yam","Optical Seeing at Sierra Negra","Accepted for publication in the July 2003 issue of the PASP",,"10.1086/376396",,"astro-ph",,"  Optical seeing measurements carried out at Sierra Negra, the site of the
Large Millimeter Telescope, are reported. The site, one of the highest peaks of
Central Mexico, offers good coverage of Northern and Southern hemispheres and
we have undertaken several campaigns to investigate the astronomical potential
of the site in the optical. Here we report on our campaign aimed at
establishing the seeing quality of the site. We present data of the first three
campaigns of optical seeing monitoring covering from February 2000 to May 2002,
carried out with a Differential Image Motion Monitor. The results clearly
indicate a sub-arcsec seeing, better statistics during the dry season and no
dependence with the time of night. We find no dependence of our results with
the integration time used.
","[{""version"":""v1"",""created"":""Sat, 12 Apr 2003 02:12:41 GMT""},{""version"":""v2"",""created"":""Thu, 8 May 2003 00:44:41 GMT""}]","2009-11-07"
"astro-ph/0304230","S. K. Saha","Swapan K. Saha","High resolution imaging by employing passive and active approaches","20 pages LaTeX file including 13 figures","Perspective of Engineering Optics, 2003, 70-89, ed. Kehar Singh
  and V K Rastogi, Anita Publications, New Delhi, India",,,"astro-ph",,"  This article begins with the discussions on the formation of speckles in the
case of non-coherent quasi monochromatic source and of ways to detect them.
Prior to this, a brief introduction on the behavior of the atmosphere and its
effect on the plane wavefront from a stellar source is presented. The benefit
of short-exposure images over long exposure is highlighted with emphasis set on
their comparison as well. The data processing methods that are implemented in
our institute in order to decipher both Fourier modulus and Fourier phase are
described. The salient features of the adaptive optics system that compensates
the atmospheric effects on the image in real time are discussed. The article
concludes after a brief discussion on certain astrophysical problems that can
be targeted using moderate sized telescopes available in India, such as 2.34
meter Vainu Bappu Telescope (VBT), Kavalur, 2 meter Himalayan Chandra Telescope
(HCT), Hanley.
","[{""version"":""v1"",""created"":""Sat, 12 Apr 2003 07:26:09 GMT""}]","2007-05-23"
"astro-ph/0304231","Yohko Tsuboi","Yohko Tsuboi, Yoshitomo Maeda, Eric D. Feigelson, Gordon P. Garmire,
  George Chartas, Koji Mori, Steven H. Pravdo","Coronal X-ray emission from an intermediate-age brown dwarf",,"Astrophys.J. 587 (2003) L51","10.1086/375017",,"astro-ph",,"  We report the X-ray detection of the brown dwarf (BD) companion TWA 5B in a
$\simeq 12$ Myr old pre-main sequence binary system. We clearly resolve the
faint companion (35 photons) separated from the X-ray luminous primary by 2
arcsec in a {\it Chandra} ACIS image. TWA 5B shows a soft X-ray spectrum with a
low plasma temperature of only 0.3 keV and a constant flux during the 3 hour
observation, of which the characteristics are commonly seen in the solar
corona. The X-ray luminosity is 4$\times10^{27}$ erg s$^{-1}$ (0.1--10 keV
band) or $\log L_X/L_{bol} = -3.4$.
  Comparing these properties to both younger and older BDs, we discuss the
evolution of the X-ray emission in BDs. During their first few Myr, they
exhibit high levels of X-ray activity as seen in higher mass pre-main sequence
stars. The level in TWA 5B is still high at $t \simeq 12$ Myr in $\log
L_X/L_{bol}$ while $kT$ has already substantially cooled.
","[{""version"":""v1"",""created"":""Sat, 12 Apr 2003 08:18:00 GMT""}]","2009-11-07"
"astro-ph/0304232","Igor Rogachevskii","N. Kleeorin, K. Kuzanyan, D. Moss, I. Rogachevskii, D. Sokoloff and H.
  Zhang","Magnetic Helicity Evolution During the Solar Activity Cycle:
  Observations and Dynamo Theory","10 pages, 3 Postscript figures, uses aa.cls","Astron.Astrophys. 409 (2003) 1097-1105","10.1051/0004-6361:20031126",,"astro-ph",,"  We study a simple model for the solar dynamo in the framework of the Parker
migratory dynamo, with a nonlinear dynamo saturation mechanism based on
magnetic helicity conservation arguments. We find a parameter range in which
the model demonstrates a cyclic behaviour with properties similar to that of
Parker dynamo with the simplest form of algebraic alpha-quenching. We compare
the nonlinear current helicity evolution in this model with data for the
current helicity evolution obtained during 10 years of observations at the
Huairou Solar Station of China. On one hand, our simulated data demonstrate
behaviour comparable with the observed phenomenology, provided that a suitable
set of governing dynamo parameters is chosen. On the other hand, the
observational data are shown to be rich enough to reject some other sets of
governing parameters. We conclude that, in spite of the very preliminary state
of the observations and the crude nature of the model, the idea of using
observational data to constrain our ideas concerning magnetic field generation
in the framework of the solar dynamo appears promising.
","[{""version"":""v1"",""created"":""Sat, 12 Apr 2003 10:32:11 GMT""}]","2009-11-07"
"cond-mat/0304281","Simon","Silvana Mercone, Alexandre Wahl, Alain Pautrat, Michael Pollet and
  Charles Simon","Anomaly in the dielectric response at the charge orbital ordering
  transition of crystalline Pr0.67Ca0.33MnO3","pdf file",,"10.1103/PhysRevB.69.174433",,"cond-mat.str-el",,"  The complex impedance of a Pr0.67Ca0.33MnO3 crystal has been measured. The
frequency dependence is studied for a wide range of temperatures (50K-403K) and
is found to be characteristic of relaxation process with a single Debye time
relaxation constant, which is interpreted as a dielectric constant of the
material. A strong peak is observed in this dielectric constant (up to two
millions) at the charge ordering transition suggesting an interpretation in
terms of ordering of electric dipoles at TCO or in term of phase separation.
Comparison with Pr0.63Ca0.37MnO3 - in which the phase separation is much
smaller and the peak in the dielectric constant is absent - suggests an
interpretation in term of phase separation between insulating and metallic
states.
","[{""version"":""v1"",""created"":""Fri, 11 Apr 2003 16:15:39 GMT""},{""version"":""v2"",""created"":""Mon, 9 Feb 2004 18:29:33 GMT""}]","2009-11-10"
"cond-mat/0304282","Bastian Wemmenhove","B. Wemmenhove and A. C. C. Coolen","Finite Connectivity Attractor Neural Networks","17 pages, 4 figures","J. Phys. A: Math. Gen. 36 (2003) 9617","10.1088/0305-4470/36/37/302",,"cond-mat.dis-nn cond-mat.stat-mech",,"  We study a family of diluted attractor neural networks with a finite average
number of (symmetric) connections per neuron. As in finite connectivity spin
glasses, their equilibrium properties are described by order parameter
functions, for which we derive an integral equation in replica symmetric (RS)
approximation. A bifurcation analysis of this equation reveals the locations of
the paramagnetic to recall and paramagnetic to spin-glass transition lines in
the phase diagram. The line separating the retrieval phase from the spin-glass
phase is calculated at zero temperature. All phase transitions are found to be
continuous.
","[{""version"":""v1"",""created"":""Fri, 11 Apr 2003 16:28:18 GMT""}]","2009-11-10"
"cond-mat/0304283","Ralph Claessen","M. Sing, U. Schwingenschl\""ogl, R. Claessen, P. Blaha, J.M.P. Carmelo,
  L.M. Martelo, P.D. Sacramento, M. Dressel, and C.S. Jacobsen","Electronic structure of the quasi-one-dimensional organic conductor
  TTF-TCNQ","18 pages, 9 figures",,"10.1103/PhysRevB.68.125111",,"cond-mat.str-el",,"  We study the electronic structure of the quasi-one-dimensional organic
conductor TTF-TCNQ by means of density-functional band theory, Hubbard model
calculations, and angle-resolved photoelectron spectroscopy (ARPES). The
experimental spectra reveal significant quantitative and qualitative
discrepancies to band theory. We demonstrate that the dispersive behavior as
well as the temperature-dependence of the spectra can be consistently explained
by the finite-energy physics of the one-dimensional Hubbard model at metallic
doping. The model description can even be made quantitative, if one accounts
for an enhanced hopping integral at the surface, most likely caused by a
relaxation of the topmost molecular layer. Within this interpretation the ARPES
data provide spectroscopic evidence for the existence of spin-charge separation
on an energy scale of the conduction band width. The failure of the
one-dimensional Hubbard model for the {\it low-energy} spectral behavior is
attributed to interchain coupling and the additional effect of electron-phonon
interaction.
","[{""version"":""v1"",""created"":""Fri, 11 Apr 2003 18:43:21 GMT""}]","2009-11-10"
"cond-mat/0304284","Stephen Lyon","A.M. Tyryshkin, S.A. Lyon, W. Jantsch, and F. Schaeffler","Spin Manipulation of Free 2-Dimensional Electrons in Si/SiGe Quantum
  Wells","14 pages, 3 figures",,,,"cond-mat.mes-hall",,"  An important requirement for a physical embodiment of a quantum computer is
that arbitrary single-qubit operations can be performed. In the case of
spin-qubits, this means that arbitrary spin rotations must be possible. Here we
demonstrate spin rotations of an ensemble of free 2-dimensional electrons
confined to a silicon quantum well embedded in a silicon-germanium alloy host.
The spins are manipulated by resonant microwave pulses and an applied magnetic
field in a pulsed electron paramagnetic resonance spectrometer. From the pulsed
measurements we deduce a spin coherence time in this system of about 3
microsec, allowing at least 100 elementary operations before decoherence
destroys the spin state. These measurements represent an important step towards
the realization of quantum computation using electron spins in semiconductors,
but at the same time establish some constraints on the design of such a system.
","[{""version"":""v1"",""created"":""Fri, 11 Apr 2003 18:31:42 GMT""}]","2007-05-23"
"cond-mat/0304285","Ismael Victor de Lucena Costa","Ismael V. L. Costa, Rafael Morgado, Marcos V. B. T. Lima and Fernando
  A. Oliveira","Violation of the fluctuation-dissipation theorem for fast superdiffusion","5 pages and 2 figures",,"10.1209/epl/i2003-00514-3",,"cond-mat.stat-mech",,"  We study anomalous diffusion for one-dimensional systems described by a
generalized Langevin equation. We show that superdiffusion can be classified in
normal superdiffusion and fast superdiffusion. For fast superdiffusion, we
prove that the Fluctuation-Dissipation Theorem does not hold, which induces an
effective temperature in the system. This effective temperature is a signature
of metastability found in many complex system such as Spin-Glass and granular
material.
","[{""version"":""v1"",""created"":""Fri, 11 Apr 2003 19:01:49 GMT""}]","2009-11-10"
"cond-mat/0304286","Miguel A. Solis","J.J. Valencia, M. de Llano and M.A. Solis","Bose-Einstein condensation in real space","Ten pages including 2 figures","Rev. Mex. de Fis. 50, 84-87 (2004)",,,"cond-mat.stat-mech cond-mat.soft",,"  We illustrate how Bose-Einstein condensation occurs not only in momentum
space but also in coordinate (or real) space. Analogies between the isotherms
of a van der Waals gas of extended (or finite-diameter) identical atoms and the
point (or zero-diameter) particles of an ideal Bose gas allow one to conclude
that, in contrast to the van der Waals case, the volume per particle can go to
zero in the pure Bose condensate phase precisely because the particle diameter
is zero.
","[{""version"":""v1"",""created"":""Fri, 11 Apr 2003 19:29:44 GMT""}]","2007-05-23"
