"hep-ph/0304121","Patrizia Bucci","Patrizia Bucci, Bohdan Grzadkowski","The Effective Potential and Vacuum Stability within Universal Extra
  Dimensions","29 pages, 5 figures. Revised version to be published in Phys. Rev. D.
  Several minor changes made. New references added","Phys.Rev. D68 (2003) 124002","10.1103/PhysRevD.68.124002","IFT-03-09","hep-ph",,"  The one-loop effective potential calculated for a generic model that
originates from 5-dimensional theory reduced down to 4 dimensions is
considered. The cut-off and dimensional regularization schemes are discussed
and compared. It is demonstrated that the prescriptions are consistent with
each other and lead to the same physical consequences. Stability of the ground
state is discussed for a U(1) model that is supposed to mimic the Standard
Model extended to 5 dimensions. It has been shown that fermionic Kaluza-Klein
modes can dramatically influence the shape of the effective potential shifting
the instability scale even by several orders of magnitude.
","[{""version"":""v1"",""created"":""Sat, 12 Apr 2003 15:07:17 GMT""},{""version"":""v2"",""created"":""Tue, 23 Sep 2003 13:32:44 GMT""}]","2009-11-10"
"hep-ph/0304122","John Collins","John C. Collins","What exactly is a parton density?","18 pages, 3 figs. To appear in the special issue of Acta Physica
  Polonica to celebrate the 65th Birthday of Professor Jan Kwiecinski. Minor
  corrections made in proof for published version","Acta Phys.Polon. B34 (2003) 3103",,,"hep-ph",,"  I give an account of the definitions of parton densities, both the
conventional ones, integrated over parton transverse momentum, and unintegrated
transverse-momentum-dependent densities. The aim is to get a precise and
correct definition of a parton density as the target expectation value of a
suitable quantum mechanical operator, so that a clear connection to
non-perturbative QCD is provided. Starting from the intuitive ideas in the
parton model that predate QCD, we will see how the simplest operator
definitions suffer from divergences. Corrections to the definition are needed
to eliminate the divergences. An improved definition of unintegrated parton
densities is proposed.
","[{""version"":""v1"",""created"":""Sat, 12 Apr 2003 15:32:46 GMT""},{""version"":""v2"",""created"":""Wed, 23 Apr 2003 21:04:38 GMT""},{""version"":""v3"",""created"":""Mon, 28 Apr 2003 16:34:07 GMT""}]","2007-05-23"
"hep-th/0304113","Daniel B. Grunberg","Daniel B. Grunberg","N=4 Characters in Gepner Models, Orbits and Elliptic Genera","39 pages; errors corrected in section 6, section 7 added (mixed
  Gepner models), ref added","J.Math.Phys. 44 (2003) 5751-5792","10.1063/1.1624470",,"hep-th",,"  We review the properties of characters of the N=4 SCA in the context of a
non-linear sigma model on $K3$, how they are used to span the orbits, and how
the orbits produce topological invariants like the elliptic genus. We derive
the same expression for the $K3$ elliptic genus using three different Gepner
models ($1^6$, $2^4$ and $4^3$ theories), detailing the orbits and verifying
that their coefficients $F_i$ are given by elementary modular functions. We
also reveal the orbits for the $1^3 2^2$, $1^4 4$ and $1^2 4^2$ theories. We
derive relations for cubes of theta functions and study the function $
{1\over\eta} \sum_{n\in \Z} (-1)^n (6n+1)^k q^{(6n+1)^2 /24} $ for $k=1,2,3,4$.
","[{""version"":""v1"",""created"":""Fri, 11 Apr 2003 17:13:29 GMT""},{""version"":""v2"",""created"":""Thu, 1 May 2003 12:00:28 GMT""}]","2015-06-26"
"hep-th/0304114","B. Stefanski jr.","B. Stefanski Jr","Open String Plane-Wave Light-Cone Superstring Field Theory",,,"10.1016/S0550-3213(03)00499-1",,"hep-th",,"  We construct the cubic interaction vertex and dynamically generated
supercharges in light-cone superstring field theory for a large class
half-supersymmetric D-branes in the plane-wave background. We show that these
satisfy the plane-wave superalgebra at first order in string coupling. The
cubic interaction vertex and dynamical supercharges presented here are given
explicitly in terms of oscilators and can be used to compute three-point
functions of open strings with endpoints on half-supersymmetric D-branes.
","[{""version"":""v1"",""created"":""Fri, 11 Apr 2003 17:29:53 GMT""}]","2010-04-05"
"hep-th/0304115","Chris E. Beasley","Chris Beasley and Edward Witten","Residues and World-Sheet Instantons","47 pages","JHEP 0310:065,2003","10.1088/1126-6708/2003/10/065","PUPT-2081","hep-th",,"  We reconsider the question of which Calabi-Yau compactifications of the
heterotic string are stable under world-sheet instanton corrections to the
effective space-time superpotential. For instance, compactifications described
by (0,2) linear sigma models are believed to be stable, suggesting a remarkable
cancellation among the instanton effects in these theories. Here, we show that
this cancellation follows directly from a residue theorem, whose proof relies
only upon the right-moving world-sheet supersymmetries and suitable compactness
properties of the (0,2) linear sigma model. Our residue theorem also extends to
a new class of ""half-linear"" sigma models. Using these half-linear models, we
show that heterotic compactifications on the quintic hypersurface in CP^4 for
which the gauge bundle pulls back from a bundle on CP^4 are stable. Finally, we
apply similar ideas to compute the superpotential contributions from families
of membrane instantons in M-theory compactifications on manifolds of G_2
holonomy.
","[{""version"":""v1"",""created"":""Fri, 11 Apr 2003 20:22:36 GMT""}]","2010-04-07"
"hep-th/0304116","J. Gamboa","J. Gamboa, M. Loewe and F. Mendez","Quantum Theory of Tensionless Noncommutative p-Branes","7 pages, Revtex4, title changed and an was appendix added. To be
  published in PRD","Phys.Rev.D70:106006,2004","10.1103/PhysRevD.70.106006","USACH-FM-06-03","hep-th astro-ph gr-qc",,"  The quantum theory involving noncommutative tensionless p-branes is studied
following path integral methods. Our procedure allow a simple treatment for
generally covariant noncommutative extended systems and it contains, as a
particular case, the thermodynamics and the quantum tensionless string theory.
The effect induced by noncommutativity in the field space is to produce a
confinement among pairing of null p-branes.
","[{""version"":""v1"",""created"":""Fri, 11 Apr 2003 21:15:44 GMT""},{""version"":""v2"",""created"":""Wed, 21 Apr 2004 22:06:54 GMT""},{""version"":""v3"",""created"":""Thu, 28 Oct 2004 19:26:33 GMT""}]","2011-07-19"
"hep-th/0304117","Max Niedermaier","M. Niedermaier","Dimensionally reduced gravity theories are asymptotically safe","47 pages, Latex, 1 figure","Nucl.Phys. B673 (2003) 131-169","10.1016/j.nuclphysb.2003.09.015",,"hep-th gr-qc",,"  4D Einstein gravity coupled to scalars and abelian gauge fields in its
2-Killing vector reduction is shown to be quasi-renormalizable to all loop
orders at the expense of introducing infinitely many essential couplings. The
latter can be combined into one or two functions of the `area radius'
associated with the two Killing vectors. The renormalization flow of these
couplings is governed by beta functionals expressible in closed form in terms
of the (one coupling) beta function of a symmetric space sigma-model.
Generically the matter coupled systems are asymptotically safe, that is the
flow possesses a non-trivial UV stable fixed point at which the trace anomaly
vanishes. The main exception is a minimal coupling of 4D Einstein gravity to
massless free scalars, in which case the scalars decouple from gravity at the
fixed point.
","[{""version"":""v1"",""created"":""Fri, 11 Apr 2003 22:27:48 GMT""}]","2015-06-26"
"hep-th/0304120","Pascal Baseilhac","P. Baseilhac and K. Koizumi","N=2 boundary supersymmetry in integrable models and perturbed boundary
  conformal field theory","14 pages, LaTeX file with amssymb; v2: typos corrected, references
  added, to appear in Nucl. Phys. B","Nucl.Phys. B669 (2003) 417-434","10.1016/j.nuclphysb.2003.08.002","YITP-03-14","hep-th cond-mat math-ph math.MP",,"  Boundary integrable models with N=2 supersymmetry are considered. For the
simplest boundary N=2 superconformal minimal model with a Chebyshev bulk
perturbation we show explicitly how fermionic boundary degrees of freedom arise
naturally in the boundary perturbation in order to maintain integrability and
N=2 supersymmetry. A new boundary reflection matrix is obtained for this model
and N=2 boundary superalgebra is studied. A factorized scattering theory is
proposed for a N=2 supersymmetric extension of the boundary sine-Gordon model
with either (i) fermionic or (ii) bosonic and fermionic boundary degrees of
freedom. Exact results are obtained for some quantum impurity problems: the
boundary scaling Lee-Yang model, a massive deformation of the anisotropic Kondo
model at the filling values g=2/(2n+3) and the boundary Ashkin-Teller model.
","[{""version"":""v1"",""created"":""Sat, 12 Apr 2003 07:10:24 GMT""},{""version"":""v2"",""created"":""Fri, 1 Aug 2003 03:15:14 GMT""}]","2009-11-10"
"hep-th/0304121","Solange Odile Saliu","S. O. Saliu","Consistent interactions in a three-dimensional theory with tensor gauge
  fields of degrees two and three","21 pages, accepted for publication in Int. J. Mod. Phys. A","Int.J.Mod.Phys. A18 (2003) 4451-4468","10.1142/S0217751X03015350",,"hep-th",,"  All consistent interactions in a three-dimensional theory with tensor gauge
fields of degrees two and three are obtained by means of the deformation of the
solution to the master equation combined with cohomological techniques. The
local BRST cohomology of this model allows the deformation of the Lagrangian
action, accompanying gauge symmetries and gauge algebra. The relationship with
the Chern--Simons theory is discussed.
","[{""version"":""v1"",""created"":""Sat, 12 Apr 2003 09:48:44 GMT""}]","2009-11-10"
"math-ph/0304019","Thomas Chen","Jean-Marie Barbaroux, Thomas Chen and Semjon Vugalter","Binding conditions for atomic N-electron systems in non-relativistic QED","LaTeX, uses AMS package","Ann. H. Poinc. 4 (6), 1101 - 1136 (2003).","10.1007/s00023-003-0157-1",,"math-ph math.MP",,"  We examine the binding conditions for atoms in non-relativistic QED, and
prove that removing one electron from an atom requires a positive energy. As an
application, we establish the existence of a ground state for the Helium atom.
","[{""version"":""v1"",""created"":""Sat, 12 Apr 2003 08:03:14 GMT""}]","2015-06-26"
"math/0304152","James McKernan","James McKernan and Yuri Prokhorov","Threefold Thresholds","33 pages, Amstex",,,,"math.AG",,"  We prove that the set of accumulation points of thresholds in dimension three
is equal to the set of thresholds in dimension two, excluding one.
","[{""version"":""v1"",""created"":""Fri, 11 Apr 2003 16:41:05 GMT""},{""version"":""v2"",""created"":""Mon, 14 Apr 2003 16:18:37 GMT""}]","2007-05-23"
"math/0304153","Alexander Arbieto","Alexander Arbieto, Carlos Matheus","Immersions with fractal set of points of zero Gauss-Kronecker curvature","13 pages, 3 figures",,,,"math.DG",,"  We construct, for any ``good'' Cantor set $F$ of $S^{n-1}$, an immersion of
the sphere $S^n$ with set of points of zero Gauss-Kronecker curvature equal to
$F\times D^{1}$, where $D^{1}$ is the 1-dimensional disk. In particular these
examples show that the theorem of Matheus-Oliveira strictly extends two results
by do Carmo-Elbert and Barbosa-Fukuoka-Mercuri.
","[{""version"":""v1"",""created"":""Fri, 11 Apr 2003 20:38:19 GMT""}]","2007-05-23"
"math/0304154","Yuri Berest","Yuri Berest","A Remark on Letzter-Makar-Limanov Invariants","7 pages, to appear in the Proceedings of the Workshop ``Commutative
  Algebra, Algebraic Geometry and Representation Theory'' (Fields Institute,
  Toronto, August 2002)",,,,"math.AG math.KT math.QA math.RA",,"  We give a natural cohomological interpretation of Letzter-Makar-Limanov
invariants for rings of differential operators on algebraic curves.
","[{""version"":""v1"",""created"":""Fri, 11 Apr 2003 23:07:56 GMT""}]","2007-05-23"
"math/0304156","Siu-Hung Ng","Siu-Hung Ng","Hopf Algebras of Dimension $pq$","minor change of version 1; manuscript of the talk at the special
  session of AMS meeting (#986) at New York, April, 2003","Journal of Algebra, 276 (2004), no. 1, 399--406.","10.1016/j.jalgebra.2003.11.008",,"math.QA math.RA",,"  Let $H$ be a non-semisimple Hopf algebra with antipode $S$ of dimension $pq$
over an algebraically closed field of characteristic 0 where $p \le q$ are odd
primes. We prove that $\Tr(S^{2p})=p^2d$ where $d \equiv pq \pmod{4}$. As a
consequence, if $p,q$ are twin primes, then any Hopf algebra of dimension $pq$
is semisimple.
","[{""version"":""v1"",""created"":""Sat, 12 Apr 2003 02:16:15 GMT""},{""version"":""v2"",""created"":""Wed, 7 May 2003 17:04:34 GMT""}]","2007-05-23"
"math/0304157","Bozhidar Zakhariev Iliev","Bozhidar Z. Iliev (Institute for Nuclear Research and Nuclear Energy,
  Bulgarian Academy of Sciences, Sofia, Bulgaria)","Special bases for derivations of tensor algebras. II. The case along
  paths","10 LaTeX pages. This paper is a continuation of the e-Print No.
  math.DG/0303373 and preliminary version of the e-Print gr-qc/9709053. For
  related papers, visit the ""publication"" pages at
  http://theo.inrne.bas.bg/~bozho/","Communication JINR, E5-92-508, Dubna, 1992",,,"math.DG gr-qc math-ph math.MP",,"  The existence of local bases in which the components of derivations of tensor
algebras over a differentiable manifold vanish along paths is proved. The
holonomicity of these bases is investigated. The obtained results are applied
to the case of linear connections. Some relations with the equivalence
principle are shown.
","[{""version"":""v1"",""created"":""Sat, 12 Apr 2003 06:15:20 GMT""}]","2007-05-23"
"nlin/0304019","Svozil Karl","Cristian S. Calude, Ludwig Staiger and Karl Svozil","Randomness Relative to Cantor Expansions","several small changes","Communications in Nonlinear Science and Numerical Simulation
  10(8), 921-930 (2005)","10.1016/j.cnsns.2004.05.003",,"nlin.CD",,"  Imagine a sequence in which the first letter comes from a binary alphabet,
the second letter can be chosen on an alphabet with 10 elements, the third
letter can be chosen on an alphabet with 3 elements and so on. When such a
sequence can be called random? In this paper we offer a solution to the above
question using the approach to randomness proposed by Algorithmic Information
Theory.
","[{""version"":""v1"",""created"":""Fri, 11 Apr 2003 20:46:27 GMT""},{""version"":""v2"",""created"":""Mon, 4 Apr 2005 09:32:53 GMT""}]","2007-05-23"
"nlin/0304020","Hidetsugu Sakaguchi","Hidetsugu Sakaguchi and Boris Malomed","Solitary pulses and periodic waves in the parametrically driven complex
  Ginzburg-Landau equation","13pages, 8 figures. J. Phys. Soc. Japan, in press",,"10.1143/JPSJ.72.1360",,"nlin.PS",,"  A one-dimensional model of a dispersive medium with intrinsic loss,
compensated by a parametric drive, is proposed. It is a combination of the
well-known parametrically driven nonlinear Schr\""{o}dinger (NLS) and complex
cubic Ginzburg-Landau equations, and has various physical applications (in
particular, to optical systems). For the case when the zero background is
stable, we elaborate an analytical approximation for solitary-pulse (SP)
states. The analytical results are found to be in good agreement with numerical
findings. Unlike the driven NLS equation, in the present model SPs feature a
nontrivial phase structure. Combining the analytical and numerical methods, we
identify a stability region for the SP solutions in the model's parameter
space. Generally, the increase of the diffusion and nonlinear-loss parameters,
which differ the present model from its driven-NLS counterpart, lead to
shrinkage of the stability domain. At one border of the stability region, the
SP is destabilized by the Hopf bifurcation, which converts it into a localized
breather. Subsequent period doublings make internal vibrations of the breather
chaotic. In the case when the zero background is unstable, hence SPs are
irrelevant, we construct stationary periodic solutions, for which a very
accurate analytical approximation is developed too. Stability of the periodic
waves is tested by direct simulations.
","[{""version"":""v1"",""created"":""Sat, 12 Apr 2003 06:53:09 GMT""}]","2009-11-10"
"nucl-ex/0304013","Michael Kohl","M. Kohl, M. Ases Antelo, C. Ayerbe, D. Baumann, R. Boehm, D. Bosnar,
  M. Ding, M.O. Distler, J. Friedrich, J. Garcia Llongo, P. Jennewein, G. Jover
  Manas, H. Merkel, P. Merle, U. Mueller, R. Neuhausen, L. Nungesser, R. Perez
  Benito, J. Pochodzalla, M. Potokar, C. Rangacharyulu, A. Richter, G.
  Schrieder, M. Seimetz, Th. Walcher and M. Weis","Search for Narrow Nucleon Resonances below Pion Threshold in the
  H(e,e'pi^+)X and D(e,e'p)X Reactions","5 pages and 4 figures","Phys.Rev.C67:065204,2003","10.1103/PhysRevC.67.065204",,"nucl-ex",,"  In two series of high-resolution coincidence experiments at the
three-spectrometer facility at MAMI, the H(e,e'pi^+)X and D(e,e'p)X reactions
were studied to search for narrow nucleon resonances below pion threshold. The
missing-mass resolution was 0.6 to 1.6 MeV/c^2 (FWHM) in the proton experiment
and 0.9 to 1.3 MeV/c^2 in the deuteron experiment. The experiments covered the
missing-mass region from the neutron mass up to about 1050 and 1100 MeV/c^2,
respectively. None of our measurements showed a signal for narrow resonances to
a level of down to 10^-4 with respect to the neutron peak in the missing-mass
spectra.
","[{""version"":""v1"",""created"":""Fri, 11 Apr 2003 20:19:33 GMT""}]","2008-11-26"
"nucl-th/0304033","Roelof Bijker","R. Bijker, J. Barea and A. Frank (ICN-UNAM, Mexico)","Everything you always wanted to know about SUSY, but were afraid to ask","8 pages, 2 figures, proceedings of `Symmetries in Nuclear Structure',
  March 23-29, 2003, Erice, Italy","Symmetries in Nuclear Structure, 117 (2004)","10.1142/9789812702760_0013",,"nucl-th",,"  New experimental tests of nuclear supersymmetry are suggested. They involve
the measurement of one- and two-nucleon transfer reactions between nuclei that
belong to the same supermultiplet. These reactions provide a direct test of the
`fermionic' sector, i.e. of the operators that change a boson into a fermion or
vice versa. We present some theoretical predictions for the supersymmetric
quartet of nuclei: 194Pt, 195Pt, 195Au and 196Au.
","[{""version"":""v1"",""created"":""Sat, 12 Apr 2003 00:01:01 GMT""}]","2017-11-03"
"nucl-th/0304034","Yasuhiko Tsue","A.Kuriyama (Kansai Univ. Japan), C.Providencia (Univ. de Coimbra,
  Portugal), J.da Providencia (Univ. de Coimbra, Portugal), Y.Tsue (Kochi Univ.
  Japan), M.Yamamura (Kansai Univ. Japan)","A Possible Form of the Orthogonal Set in Six Kinds of Boson Operators
  --In Relation to the su(2)- and its Relevant Algebras--","19 pages, no figure, using PTPTeX style",,"10.1143/PTP.109.943",,"nucl-th",,"  With the aim of constructing coherent states for many-body systems consisting
of six kinds of boson operators, a possible form of the orthogonal set is
presented in terms of monomial with respect to state generating operators. In
connection with the su(3)-, the su(2)-, the su(2,1)- and the su(1,1)-algebras,
four types of the orthogonal set are discussed.
","[{""version"":""v1"",""created"":""Sat, 12 Apr 2003 07:44:07 GMT""}]","2009-11-10"
"nucl-th/0304035","Yasuhiko Tsue","A.Kuriyama (Kansai Univ. Japan), C.Providencia (Univ. de Coimbra,
  Portugal), J.da Providencia (Univ. de Coimbra, Portugal), Y.Tsue (Kochi Univ.
  Japan), M.Yamamura (Kansai Univ. Japan)","Note on the Orthogonal Set in Six Kinds of Boson Operators --In Relation
  to the su(1,1)- and its Relevant Algebras--","11 pages, no figure, using PTPTeX style",,"10.1143/PTP.109.959",,"nucl-th",,"  Following the basic idea proposed by the present authors in recent paper, a
possible form of the orthogonal set for many-body system consisting of six
kinds of boson operators is developed. In contrast to the recent paper, in
which the su(2)-algebra plays a central role, in this paper, the
su(1,1)-algebra is in a central position. The orthogonal set obtained in this
paper is expressed in terms of monomial with respect to the state generating
operators.
","[{""version"":""v1"",""created"":""Sat, 12 Apr 2003 07:55:40 GMT""}]","2009-11-10"
"physics/0304048","Alexander K. Motovilov","E.A.Kolganova, Y.K.Ho, A.K.Motovilov, W. Sandhas","The ^3He^4He_2$ trimer within the hard-core Faddeev approach",,"Czech. J. Phys. 53 (2003), B301--B304.",,,"physics.atm-clus physics.chem-ph",,"  We apply a hard-core version of the Faddeev differential equations to the
^3He^4He_2 three-atomic system. Employing the TTY interatomic potential by
Tang, Toennies and Yiu we calculate the binding energy of the ^3He^4He_2 trimer
and the scattering length of a ^3He atom off a ^4He dimer.
","[{""version"":""v1"",""created"":""Fri, 11 Apr 2003 17:56:11 GMT""}]","2007-05-23"
"physics/0304049","Alvaro L.","R. P. Mart\'inez-y-Romero, H. N. N\'u\~nez-Y\'epez, A. L. Salas-Brito","New recursion relations of matrix elements of $r^\lambda$ and $\beta
  r^\lambda$ between relativistic hydrogenic eigenstates","16 pages, no figures",,,,"physics.atom-ph physics.chem-ph",,"  We determine exact recurrence relations which help in the evaluation of
matrix elements of powers of the radial coordinate between Dirac relativistic
hydrogenic eigenstates. The power $\lambda$ can be any complex number as long
as the corresponding term vanishes faster than $r^{-1}$ as $r \to \infty$.
These formulas allow determining recursively any matrix element of radial
powers --$r^\lambda$ or $\beta r^\lambda$, $\beta$ is a Dirac matrix-- in terms
of the two previous consecutive elements. The results are useful in
relativistic atomic calculations.
","[{""version"":""v1"",""created"":""Sat, 12 Apr 2003 00:43:57 GMT""}]","2016-08-16"
"quant-ph/0304083","Carlton M. Caves","Carlton M. Caves (1), Ivan H. Deutsch (1), Robin Blume-Kohout (2) ((1)
  University of New Mexico, (2) Los Alamos National Laboratory)","Physical-resource demands for scalable quantum computation","This paper will be published in the proceedings of the SPIE
  Conference on Fluctuations and Noise in Photonics and Quantum Optics, Santa
  Fe, New Mexico, June 1--4, 2003",,"10.1117/12.504760",,"quant-ph",,"  The primary resource for quantum computation is Hilbert-space dimension.
Whereas Hilbert space itself is an abstract construction, the number of
dimensions available to a system is a physical quantity that requires physical
resources. Avoiding a demand for an exponential amount of these resources
places a fundamental constraint on the systems that are suitable for scalable
quantum computation. To be scalable, the number of degrees of freedom in the
computer must grow nearly linearly with the number of qubits in an equivalent
qubit-based quantum computer.
","[{""version"":""v1"",""created"":""Fri, 11 Apr 2003 16:37:06 GMT""}]","2009-11-10"
"quant-ph/0304084","Samuel J. Lomonaco Jr.","Samuel J. Lomonaco Jr and Louis H. Kauffman","Countinuous Quantum Hidden Subgroup Algorithms","9 pages, no figures, table of contents included",,"10.1117/12.487763",,"quant-ph",,"  In this paper we show how to construct two continuous variable and one
continuous functional quantum hidden subgroup (QHS) algorithms. These are
respectively quantum algorithms on the additive group of reals R, the additive
group R/Z of the reals R mod 1, i.e., the circle, and the additive group Paths
of L^2 paths x:[0,1]-->R^n in real n-space R^n. Also included is a curious
discrete QHS algorithm which is dual to Shor's algorithm.
","[{""version"":""v1"",""created"":""Fri, 11 Apr 2003 18:35:10 GMT""},{""version"":""v2"",""created"":""Fri, 11 Apr 2003 20:45:57 GMT""}]","2009-11-10"
"quant-ph/0304085","Reinaldo O. Vianna","Reinaldo O. Vianna, Wilson R. M. Rabelo, C. H. Monken","The Semi-Quantum Computer","5 pages, 4 figures, 2 tables; final version: International Journal of
  Quantum Information, 1,2(2003)279-288","International Journal of Quantum Information, Volume 1, Number 2,
  june 2003, pp 279-288",,,"quant-ph",,"  We discuss the performance of the Search and Fourier Transform algorithms on
a hybrid computer constituted of classical and quantum processors working
together. We show that this semi-quantum computer would be an improvement over
a pure classical architecture, no matter how few qubits are available and,
therefore, it suggests an easier implementable technology than a pure quantum
computer with arbitrary number of qubits.
","[{""version"":""v1"",""created"":""Fri, 11 Apr 2003 20:47:25 GMT""},{""version"":""v2"",""created"":""Thu, 13 May 2004 16:01:51 GMT""}]","2007-05-23"
"quant-ph/0304086","Yoon-Ho Kim","Yoon-Ho Kim and Warren P. Grice","Quantum interference with distinguishable photons through
  indistinguishable pathways","6 pages, major revision",,,,"quant-ph",,"  We report a two-photon interference experiment in which the detected photons
have very different properties. The interference is observed even when no
effort is made to mask the distinguishing features before the photons are
detected. The results can only be explained in terms of indistinguishable
two-photon amplitudes.
","[{""version"":""v1"",""created"":""Fri, 11 Apr 2003 21:11:25 GMT""},{""version"":""v2"",""created"":""Thu, 20 Nov 2003 21:23:19 GMT""}]","2007-05-23"
