"cond-mat/0304287","Robert Joynt","M.S. Rzchowski and Robert Joynt","Electronic inhomogeneity at magnetic domain walls in strongly-correlated
  systems","Version submitted to Physical Review Letters, except for minor
  revisions to references",,"10.1209/epl/i2004-10050-8",,"cond-mat.str-el",,"  We show that nano-scale variations of the order parameter in
strongly-correlated systems can induce local spatial regions such as domain
walls that exhibit electronic properties representative of a different, but
nearby, part of the phase diagram. This is done by means of a Landau-Ginzburg
analysis of a metallic ferromagnetic system near an antiferromagnetic phase
boundary. The strong spin gradients at a wall between domains of different spin
orientation drive the formation of a new type of domain wall, where the central
core is an insulating antiferromagnet, and connects two metallic ferromagnetic
domains. We calculate the charge transport properties of this wall, and find
that its resistance is large enough to account for recent experimental results
in colossal magnetoresistance materials. The technological implications of this
finding for switchable magnetic media are discussed.
","[{""version"":""v1"",""created"":""Fri, 11 Apr 2003 20:47:47 GMT""}]","2009-11-10"
"cond-mat/0304288","Ronald Dickman","Guilherme J. M. Garcia and Ronald Dickman","On singular probability densities generated by extremal dynamics","16 pages, 11 figures","Physica A 332, 318 (2004)","10.1016/j.physa.2003.09.047",,"cond-mat.stat-mech",,"  Extremal dynamics is the mechanism that drives the Bak-Sneppen model into a
(self-organized) critical state, marked by a singular stationary probability
density $p(x)$. With the aim of understanding this phenomenon, we study the BS
model and several variants via mean-field theory and simulation. In all cases,
we find that $p(x)$ is singular at one or more points, as a consequence of
extremal dynamics. Furthermore we show that the extremal barrier $x_i$ always
belongs to the `prohibited' interval, in which $p(x)=0$. Our simulations
indicate that the Bak-Sneppen universality class is robust with regard to
changes in the updating rule: we find the same value for the exponent $\pi$ for
all variants. Mean-field theory, which furnishes an exact description for the
model on a complete graph, reproduces the character of the probability
distribution found in simulations. For the modified processes mean-field theory
takes the form of a functional equation for $p(x)$.
","[{""version"":""v1"",""created"":""Fri, 11 Apr 2003 21:01:30 GMT""},{""version"":""v2"",""created"":""Mon, 1 Mar 2004 13:53:25 GMT""}]","2015-06-24"
"cond-mat/0304289","Peter M. Gehring","P.M. Gehring, W. Chen, Z.-G. Ye, and G. Shirane","A Universal Phase Diagram for PMN-xPT and PZN-xPT","Replaced Fig. 3 with better version","J. Phys.: Condens. Matter 16 (2004) 7113-7121.","10.1088/0953-8984/16/39/042",,"cond-mat.mtrl-sci",,"  The phase diagram of the Pb(Mg1/3Nb2/3)O3 and PbTiO3 solid solution (PMN-xPT)
indicates a rhombohedral ground state for x < 0.32. X-ray powder measurements
by Dkhil et al. show a rhombohedrally split (222) Bragg peak for PMN-10%PT at
80 K. Remarkably, neutron data taken on a single crystal of the same compound
with comparable q-resolution reveal a single resolution-limited (111) peak down
to 50 K, and thus no rhombohedral distortion. Our results suggest that the
structure of the outer layer of these relaxors differs from that of the bulk,
which is nearly cubic, as observed in PZN by Xu et al.
","[{""version"":""v1"",""created"":""Fri, 11 Apr 2003 22:39:13 GMT""}]","2009-11-10"
"cond-mat/0304291","Valeri Petkov","V. Petkov (1) and T. Vogt (2) ((1) Department of Physics, Central
  Michigan University, Mt. Pleasant, MI, (2) Physics Department, Brookhaven
  National Laboratory, Upton, NY)","Positional disorder of Ba in the thermoelectric germanium clathrate
  Ba6Ge25","5 pages and 4 figures, submitted to Solid State Communications",,"10.1016/S0038-1098(03)00372-7",,"cond-mat.mtrl-sci",,"  The local structure of Ba6Ge25 has been studied by x-ray diffraction and the
atomic pair distribution function technique at 40 K and room temperature.
Unambiguous evidence has been found that two out of three types of Ba atoms in
Ba6Ge25 move off their positions and become locked in split sites at low
temperatures.
","[{""version"":""v1"",""created"":""Fri, 11 Apr 2003 21:57:58 GMT""}]","2009-11-10"
"cond-mat/0304292","Ronald Dickman","Ronald Dickman, Francisco Fontenele Araujo Jr and Daniel ben-Avraham","Variable survival exponents in history-dependent random walks: hard
  movable reflector","15 pages, 3 figures",,"10.1590/S0103-97332003000300006",,"cond-mat.stat-mech",,"  We review recent studies demonstrating a nonuniversal (continuously variable)
survival exponent for history-dependent random walks, and analyze a new
example, the hard movable partial reflector. These processes serve as a
simplified models of infection in a medium with a history-dependent
susceptibility, and for spreading in systems with an infinite number of
absorbing configurations. The memory may take the form of a history-dependent
step length, or be the result of a partial reflector whose position marks the
maximum distance the walker has ventured from the origin. In each case, a
process with memory is rendered Markovian by a suitable expansion of the state
space. Asymptotic analysis of the probability generating function shows that,
for large t, the survival probability decays as S(t) \sim t^{-delta}, where
\delta varies with the parameters of the model. We report new results for a
hard partial reflector, i.e., one that moves forward only when the walker does.
When the walker tries to jump to the site R occupied by the reflector, it is
reflected back with probability r, and stays at R with probability 1-r; only in
the latter case does the reflector move (R \to R+1). For this model, delta =
1/2(1-r), and becomes arbitrarily large as r approaches 1. This prediction is
confirmed via iteration of the transfer matrix, which also reveals
slowly-decaying corrections to scaling.
","[{""version"":""v1"",""created"":""Fri, 11 Apr 2003 22:13:03 GMT""}]","2015-06-24"
"cond-mat/0304293","Sung-Ho Suck Salk","Sung- Sik Lee and Sung-Ho Suck Salk","Holon-pair boson theory based on the U(1) and SU(2) slave-boson
  approaches to the t-J Hamiltonian",,,,,"cond-mat.supr-con cond-mat.str-el",,"  To supplement our recent brief report on the theory of holon-pair boson
approach to the t-J Hamiltonian [S.-S. Lee and Sung-Ho Suck Salk, Phys. Rev. B
{\bf 64}, 052501(2001)], in this paper we present a full exposure to the
theory, detailed physical implications and predicted various physical
properties of high $T_c$ cuprates. We discuss the significance of coupling
(interplay) between the spin and charge degrees of freedom in the Heisenberg
interaction term of the t-J Hamiltonian. We discuss its importance in causing
the arch-shaped superconducting transition temperature $T_c$ and the pseudogap
(spin gap) temperature $T^*$ tangential to $T_c$ in the overdoped region in the
observed phase diagram of high $T_c$ cuprates. A universal parabolic scaling
behavior of $T^*/T_c$ (or $T_c/T^*$) with hole doping concentration is
predicted in agreement with observations, indicating that there exists
correlation between the pseudogap (spin gap) phase and the superconducting
phase through antiferromagnetic fluctuations. Our proposed holon-pair boson
theory is shown to be self-consistent in that it not only yields the arch
(dome) shape structure of $T_c$ but also reproduces various other physical
properties such as superfluid weight, bose condensation energy, spectral
function, optical conductivity and spin susceptibility, including their
temperature and doping dependence.
","[{""version"":""v1"",""created"":""Sat, 12 Apr 2003 00:31:27 GMT""},{""version"":""v2"",""created"":""Fri, 18 Apr 2003 11:16:09 GMT""}]","2007-05-23"
"cond-mat/0304294","Bernardo Barbiellini","I. G. Kaplan, B. Barbiellini, A. Bansil","Compton scattering beyond the impulse approximation","7 pages, 1 figure","Phys. Rev. B 68, 235104 (2003)","10.1103/PhysRevB.68.235104",,"cond-mat.str-el cond-mat.mtrl-sci",,"  We treat the non-relativistic Compton scattering process in which an incoming
photon scatters from an N-electron many-body state to yield an outgoing photon
and a recoil electron, without invoking the commonly used frameworks of either
the impulse approximation (IA) or the independent particle model (IPM). An
expression for the associated triple differential scattering cross section is
obtained in terms of Dyson orbitals, which give the overlap amplitudes between
the N-electron initial state and the (N-1) electron singly ionized quantum
states of the target. We show how in the high energy transfer regime, one can
recover from our general formalism the standard IA based formula for the cross
section which involves the ground state electron momentum density (EMD) of the
initial state. Our formalism will permit the analysis and interpretation of
electronic transitions in correlated electron systems via inelastic x-ray
scattering (IXS) spectroscopy beyond the constraints of the IA and the IPM.
","[{""version"":""v1"",""created"":""Sat, 12 Apr 2003 02:47:21 GMT""}]","2007-10-11"
"cond-mat/0304295","Teppei Sekizawa","Teppei Sekizawa","An extension of Tasaki's flat-band Hubbard model","10 pages,3figures",,"10.1088/0305-4470/36/42/003",,"cond-mat.str-el",,"  We present a new class of flat-band Hubbard models which have saturated
ferromagnetic ground states at two distinct electron numbers for different
values of parameters. The models are extensions of Tasaki's flat-band models.
","[{""version"":""v1"",""created"":""Sat, 12 Apr 2003 08:52:05 GMT""},{""version"":""v2"",""created"":""Wed, 30 Jul 2003 06:30:19 GMT""},{""version"":""v3"",""created"":""Thu, 31 Jul 2003 15:44:14 GMT""},{""version"":""v4"",""created"":""Tue, 26 Aug 2003 17:17:28 GMT""}]","2009-11-10"
"cond-mat/0304296","Florian Meier","Florian Meier, Jeremy Levy, Daniel Loss","Quantum computing with antiferromagnetic spin clusters","15 pages, 7 figures; minor changes","Phys. Rev. B 68, 134417 (2003)","10.1103/PhysRevB.68.134417",,"cond-mat.mes-hall quant-ph",,"  We show that a wide range of spin clusters with antiferromagnetic
intracluster exchange interaction allows one to define a qubit. For these spin
cluster qubits, initialization, quantum gate operation, and readout are
possible using the same techniques as for single spins. Quantum gate operation
for the spin cluster qubit does not require control over the intracluster
exchange interaction. Electric and magnetic fields necessary to effect quantum
gates need only be controlled on the length scale of the spin cluster rather
than the scale for a single spin. Here, we calculate the energy gap separating
the logical qubit states from the next excited state and the matrix elements
which determine quantum gate operation times. We discuss spin cluster qubits
formed by one- and two-dimensional arrays of s=1/2 spins as well as clusters
formed by spins s>1/2. We illustrate the advantages of spin cluster qubits for
various suggested implementations of spin qubits and analyze the scaling of
decoherence time with spin cluster size.
","[{""version"":""v1"",""created"":""Sat, 12 Apr 2003 09:13:23 GMT""},{""version"":""v2"",""created"":""Sat, 18 Oct 2003 14:54:35 GMT""}]","2009-11-10"
"cond-mat/0304297","Sergio Caracciolo","Sergio Caracciolo, Andrea Gambassi, Massimiliano Gubinelli, Andrea
  Pelissetto","Shape dependence of the finite-size scaling limit in a strongly
  anisotropic $O(\infty)$ model","21 pages, 4 figures","Eur.Phys.J. B34 (2003) 205-217","10.1140/epjb/e2003-00213-5",,"cond-mat.stat-mech hep-lat",,"  We discuss the shape dependence of the finite-size scaling limit in a
strongly anisotropic O(N) model in the large-N limit. We show that scaling is
observed even if an incorrect value for the anisotropy exponent is considered.
However, the related exponents may only be effective ones, differing from the
correct critical exponents of the model. We discuss the implications of our
results for numerical finite-size scaling studies of strongly anisotropic
systems.
","[{""version"":""v1"",""created"":""Sat, 12 Apr 2003 10:28:35 GMT""}]","2007-05-23"
"cond-mat/0304298","Golibjon Berdiyorov","Nizam A.Taylanov","Termomagnetic shock waves in the vortex state of type-II superconductors","25 Pages, LaTEX file, 4 Figures, PS file",,,,"cond-mat.supr-con",,"  The nonlinear dynamics of thermal and electromagnetic perturbations in the
vortex state of type II superconductors is analyzed with account of dissipation
and dispersion effects. A theoretical analysis shows that nonlinear thermal and
electromagnetic dissipative waves (structures) may be formed under certain
conditions on the sample surface. The structures possess a finite-amplitude and
propagate at a constant velocity. The possibility of experimental observation
of thermomagnetic shock waves is briefly discussed.
","[{""version"":""v1"",""created"":""Sat, 12 Apr 2003 13:31:47 GMT""}]","2007-05-23"
"cond-mat/0304299","Sergei Urazhdin","S. Urazhdin, W. P. Pratt Jr, J. Bass","Effect of Interlayer Coupling on Current-Assisted Magnetization
  Switching in Nanopillars","2 pages, 2 figures",,,,"cond-mat.mtrl-sci",,"  We show that dipole-field induced antiferromagnetic coupling, or RKKY
ferromagnetic coupling, between Co layers can strongly affect the low magnetic
field switching behavior of Co/Cu/Co nanopillars. Whereas current-assisted
switching at low fields in uncoupled nanopillars is always hysteretic, strong
coupling of either kind can change the switching to non-hysteretic
(reversible). These differences can be understood with a simple picture of
current-assisted thermal activation over a barrier.
","[{""version"":""v1"",""created"":""Sat, 12 Apr 2003 13:53:10 GMT""}]","2007-05-23"
"cond-mat/0304300","Ihor Lubashevsky","Ihor Lubashevsky, Morteza Hajimahmoodzadeh, Albert Katsnelson, and
  Peter Wagner","Noised induced phase transition in an oscillatory system with dynamical
  traps","RevTeX 4, 4 pages, 4 figures",,"10.1140/epjb/e2003-00323-0",,"cond-mat.soft cond-mat.stat-mech",,"  A new type of noised induced phase transitions is proposed. It occurs in
noisy systems with dynamical traps. Dynamical traps are regions in the phase
space where the regular forces are depressed substantially. By way of an
example, a simple oscillatory system {x,v} with additive white noise is
considered and its dynamics is analyzed numerically. The dynamical trap region
is assumed to be located near the x-axis where the velocity v of the system
becomes sufficiently low. The meaning of this assumption is discussed. The
observed phase transition is caused by the asymmetry in the residence time
distribution in the vicinity of zero value velocity. This asymmetry is due to a
cooperative effect of the random Langevin force in the trap region and the
regular force not changing the direction of action when crossing the trap
region.
","[{""version"":""v1"",""created"":""Sat, 12 Apr 2003 14:25:21 GMT""}]","2009-11-10"
"cs/0304020","Pranab Sen","Rahul Jain, Jaikumar Radhakrishnan, Pranab Sen","A direct sum theorem in communication complexity via message compression","21 pages. Full version of a paper to appear at ICALP 2003",,,,"cs.CC",,"  We prove lower bounds for the direct sum problem for two-party bounded error
randomised multiple-round communication protocols. Our proofs use the notion of
information cost of a protocol, as defined by Chakrabarti, Shi, Wirth and Yao
and refined further by Bar-Yossef, Jayram, Kumar and Sivakumar. Our main
technical result is a `compression' theorem saying that, for any probability
distribution $\mu$ over the inputs, a $k$-round private coin bounded error
protocol for a function $f$ with information cost $c$ can be converted into a
$k$-round deterministic protocol for $f$ with bounded distributional error and
communication cost $O(kc)$. We prove this result using a substate theorem about
relative entropy and a rejection sampling argument. Our direct sum result
follows from this `compression' result via elementary information theoretic
arguments.
  We also consider the direct sum problem in quantum communication. Using a
probabilistic argument, we show that messages cannot be compressed in this
manner even if they carry small information. Hence, new techniques may be
necessary to tackle the direct sum problem in quantum communication.
","[{""version"":""v1"",""created"":""Sat, 12 Apr 2003 02:26:26 GMT""},{""version"":""v2"",""created"":""Mon, 14 Apr 2003 20:21:56 GMT""}]","2007-05-23"
"gr-qc/0304048","Carlos Kozameh","Reinaldo J. Gleiser, Carlos N. Kozameh and Florencia Parisi","On low energy quantum gravity induced effects on the propagation of
  light","12 pages","Class.Quant.Grav. 20 (2003) 4375-4386","10.1088/0264-9381/20/20/303",,"gr-qc",,"  Present models describing the interaction of quantum Maxwell and
gravitational fields predict a breakdown of Lorentz invariance and a non
standard dispersion relation in the semiclassical approximation. Comparison
with observational data however, does not support their predictions. In this
work we introduce a different set of ab initio assumptions in the canonical
approach, namely that the homogeneous Maxwell equations are valid in the
semiclassical approximation, and find that the resulting field equations are
Lorentz invariant in the semiclassical limit. We also include a
phenomenological analysis of possible effects on the propagation of light, and
their dependence on energy, in a cosmological context.
","[{""version"":""v1"",""created"":""Fri, 11 Apr 2003 20:07:29 GMT""}]","2016-08-31"
"hep-ex/0304020","Steven H. Robertson","B. Aubert, et al (the BABAR Collaboration)","A Search for the Decay $B^{-}\to K^{-} \nu \bar{\nu}$","Presented at XXXVIII Rencontres de Moriond on Electroweak
  Interactions and Unified Theories",,,"SLAC-PUB-9710","hep-ex",,"  We present a search for the rare flavour-changing neutral-current decay
$B^{-}\to K^{-} \nu \bar{\nu}$ based on a sample of $(86.9 \pm 1.0) \times
10^{6}$ $\Upsilon (4S) \to $B\bar{B}$ events collected by the BABAR experiment
at the SLAC B-factory. Signal candidate events are selected by fully
reconstructing a $B^+ \to \bar{D}^{0} X^+$ decay, where $X^+$ represents a
combination of up to three charged pions or kaons and up to two $\pi^0$
candidates. The charged tracks and calorimeter clusters not used in the $B^+$
reconstruction are required to be compatible with a $B^{-}\to K^{-} \nu
\bar{\nu}$ decay. We observe a total of three signal candidate events with an
expected background of $2.7 \pm 0.8$, resulting in a preliminary limit of
$\mathcal{B}(B^{-}\to K^{-} \nu \bar{\nu}) < 1.05 \times 10^{-4}$ at the 90%
confidence level. This search is combined with the results of a previous and
statistically independent preliminary BABAR search for $B^{-}\to K^{-} \nu
\bar{\nu}$ to give a limit of $\mathcal{B}(B^{-}\to K^{-} \nu \bar{\nu}) < 7.0
\times 10^{-5}$ at the 90% confidence level.
","[{""version"":""v1"",""created"":""Fri, 11 Apr 2003 18:42:16 GMT""},{""version"":""v2"",""created"":""Tue, 29 Apr 2003 21:06:38 GMT""}]","2007-05-23"
"hep-ex/0304021","Antimo Palano","the BABAR Collaboration: B. Aubert, et al","Observation of a Narrow Meson Decaying to Ds+pi0 at a Mass of 2.32
  GeV/c^2","7 pages, 3 figures, submitted to Phys. Rev. Lett","Phys.Rev.Lett.90:242001,2003","10.1103/PhysRevLett.90.242001","SLAC-PUB-9711","hep-ex",,"  We have observed a narrow state near 2.32 GeV/c^2 in the inclusive Ds+ pi0
invariant mass distributionfrom e+e- annihilation data at energies near 10.6
GeV. The observed width is consistent with the experimental resolution. The
small intrinsic width and the quantum numbers of the final state indicate that
the decay violates isospin conservation. The state has natural spin-parity and
the low mass suggests a JP=0+ assignment. The data sample corresponds to an
integrated luminosity of 91 fb-1 recorded by the BABAR detector at the PEP2
asymmetric-energy e+e- storage ring.
","[{""version"":""v1"",""created"":""Sat, 12 Apr 2003 08:18:06 GMT""}]","2008-11-26"
"hep-ph/0304107","Xiangdong Ji","Xiangdong Ji, Jian-Ping Ma, and Feng Yuan","Classification and Asymptotic Scaling of Hadron Light-Cone Wave-Function
  Amplitudes","28 pages, no figure","Eur.Phys.J. C33 (2004) 75-90","10.1140/epjc/s2003-01563-y",,"hep-ph",,"  We classify the hadron light-cone wave-function amplitudes in terms of parton
helicity, orbital angular momentum, and quark flavor and color symmetries. We
show in detail how this is done for the pion, $\rho$ meson, nucleon, and delta
resonance up to and including three partons. For the pion and nucleon, we also
consider four-parton amplitudes. Using the scaling law derived recently, we
show how these amplitudes scale in the limit that all parton transverse momenta
become large.
","[{""version"":""v1"",""created"":""Fri, 11 Apr 2003 19:09:04 GMT""}]","2009-11-10"
"hep-ph/0304116","Jorge C. Romao","Cyril Hugonie, Jorge C. Romao, Ana M. Teixeira","Spontaneous CP Violation in Non-Minimal Supersymmetric Models","21 pages, 7 Figures in Encapsulated Postscript","JHEP 0306 (2003) 020","10.1088/1126-6708/2003/06/020","FTUAM 03/06, IFT-UAM/CSIC-03-12, IFIC/03-08","hep-ph",,"  We study the possibilities of spontaneous CP violation in the Next-to-Minimal
Supersymmetric Standard Model with an extra singlet tadpole term in the scalar
potential. We calculate the Higgs boson masses and couplings with radiative
corrections including dominant two loop terms. We show that it is possible to
satisfy the LEP constraints on the Higgs boson spectrum with non-trivial
spontaneous CP violating phases. We also show that these phases could account
for the observed value of epsilonK.
","[{""version"":""v1"",""created"":""Fri, 11 Apr 2003 17:32:13 GMT""}]","2009-11-10"
"hep-ph/0304117","M. V. Libanov","J.-M. Frere, M.V. Libanov, E.Ya. Nugaev, S.V. Troitsky","Fermions in the vortex background on a sphere","13 pages, 1 eps figure, JHEP3 style required, references added","JHEP0306:009,2003","10.1088/1126-6708/2003/06/009",,"hep-ph",,"  In 5+1 dimensions, we construct a vortex-like solution on a two-dimensional
sphere. We study fermionic zero modes in the background of this solution and
relate them to the replication of fermion families in the Standard Model. In
particular, using a compactified space removes the need for the difficult
localisation of gauge fields, while the present procedure (rather than naive
compactification on a disk) also removes spurious fermionic modes.
","[{""version"":""v1"",""created"":""Fri, 11 Apr 2003 18:30:07 GMT""},{""version"":""v2"",""created"":""Tue, 22 Apr 2003 17:34:06 GMT""}]","2009-11-10"
"hep-ph/0304118","Yukihiro Mimura","Ilia Gogoladze, Yukihiro Mimura and S. Nandi","Unity of elementary particles and forces in higher dimensions","14 pages","Phys.Rev.Lett.91:141801,2003","10.1103/PhysRevLett.91.141801","OSU-HEP-03-5","hep-ph",,"  We present a model in which elementary particles and forces are unified in
the framework of quantum field theory in higher dimensions. The particles
include gauge bosons, quarks and leptons, as well as the Higgs bosons and the
forces include strong, weak, hypercharge as well as Yukawa interactions. The
model is based on a simple group SO(16) in six dimensions with N=2
supersymmetry. The gauge symmetry, as well as supersymmetry is broken to SU(4)
x SU(2)_L x SU(2)_R x U(1)^3 with N=1 supersymmetry upon compactification in
four dimension on a T^2/Z_6 orbifold.
","[{""version"":""v1"",""created"":""Fri, 11 Apr 2003 19:30:48 GMT""}]","2010-11-19"
"hep-ph/0304119","Nestor Armesto Perez","N. Armesto, A. Capella, A. B. Kaidalov, J. Lopez-Albacete and C. A.
  Salgado","Nuclear Structure Functions at Small x from Inelastic Shadowing and
  Diffraction","LaTeX, 32 pages, 14 eps figures included using epsfig; 1 reference
  updated","Eur.Phys.J.C29:531-540,2003","10.1140/epjc/s2003-01243-0","CERN-TH/2003-066, LPT Orsay 03-21, UCOFIS 2/03","hep-ph nucl-th",,"  Nuclear structure functions at small x and small or moderate $Q^2$ are
studied using the relation with diffraction on nucleons which arises from
Gribov's Reggeon Calculus. A reasonable description of experimental data is
obtained with no fitted parameters. A comparison with other models and
predictions for future lepton-ion colliders are provided. Consequences for the
reduction of multiplicities in nucleus-nucleus collisions at energies of RHIC
and LHC are examined.
","[{""version"":""v1"",""created"":""Fri, 11 Apr 2003 20:54:56 GMT""},{""version"":""v2"",""created"":""Thu, 17 Apr 2003 08:20:51 GMT""}]","2011-09-13"
"hep-ph/0304120","Sacha Davidson","Sacha Davidson","Weak-scale implications of thermal leptogenesis in SUSY","v1 = 5 pages, proceedings for Moriond 2003. v2 = 7 pages, proceedings
  for SUSY 2003, Tucson, AZ",,,,"hep-ph",,"  Thermal leptogenesis is an attractive mechanism for generating the baryon
asymmetry of the Universe. However, in supersymmetric models, the parameter
space is severely restricted by the gravitino bound on the reheat temperature
$T_{RH}$. Using a parametrisation of the seesaw in terms of weak-scale inputs,
the low-energy footprints of thermal leptogenesis are discussed.
","[{""version"":""v1"",""created"":""Sat, 12 Apr 2003 10:03:53 GMT""},{""version"":""v2"",""created"":""Sat, 14 Feb 2004 13:02:34 GMT""}]","2007-05-23"
