"quant-ph/0304087","Olivier Brodier","O. Brodier and A. M. Ozorio de Almeida","Symplectic evolution of Wigner functions in markovian open systems","this new version treats the dissipative case","Phys. Rev. E 69, 016204 (2004)","10.1103/PhysRevE.69.016204",,"quant-ph",,"  The Wigner function is known to evolve classically under the exclusive action
of a quadratic hamiltonian. If the system does interact with the environment
through Lindblad operators that are linear functions of position and momentum,
we show that the general evolution is the convolution of the classically
evolving Wigner function with a phase space gaussian that broadens in time. We
analyze the three generic cases of elliptic, hyperbolic and parabolic
Hamiltonians. The Wigner function always becomes positive in a definite time,
which is shortest in the hyperbolic case. We also derive an exact formula for
the evolving linear entropy as the average of a narrowing gaussian taken over a
probability distribution that depends only on the initial state. This leads to
a long time asymptotic formula for the growth of linear entropy.
","[{""version"":""v1"",""created"":""Fri, 11 Apr 2003 21:14:43 GMT""},{""version"":""v2"",""created"":""Tue, 27 Apr 2004 16:50:42 GMT""}]","2009-11-10"
"quant-ph/0304089","Juhi-Lian Julian Ting","Julian Juhi-Lian Ting","Alternative Method for Quantum Feedback-Control","10 pages, 2 figures",,,,"quant-ph cond-mat.mtrl-sci",,"  A new method for doing feedback control of single quantum systems was
proposed. Instead of feeding back precisely the process output, a cloning
machine served to obtain the feedback signal and the output. A simple example
was given to demonstrate the method.
","[{""version"":""v1"",""created"":""Sat, 12 Apr 2003 02:22:38 GMT""}]","2007-05-23"
"quant-ph/0304090","Ralf Schutzhold","R. Sch\""utzhold and W. G. Unruh","Hidden symmetry detection on a quantum computer","8 pages",,,,"quant-ph",,"  The fastest quantum algorithms (for the solution of classical computational
tasks) known so far are basically variations of the hidden subgroup problem
with {$f(U[x])=f(x)$}. Following a discussion regarding which tasks might be
solved efficiently by quantum computers, it will be demonstrated by means of a
simple example, that the detection of more general hidden (two-point)
symmetries {$V\{f(x),f(U[x])\}=0$} by a quantum algorithm can also admit an
exponential speed-up. E.g., one member of this class of symmetries
{$V\{f(x),f(U[x])\}=0$} is discrete self-similarity (or discrete scale
invariance). PACS: 03.67.Lx, 89.70.+c.
","[{""version"":""v1"",""created"":""Sat, 12 Apr 2003 03:01:39 GMT""},{""version"":""v2"",""created"":""Thu, 14 Aug 2003 23:51:02 GMT""},{""version"":""v3"",""created"":""Thu, 11 Mar 2004 11:52:16 GMT""},{""version"":""v4"",""created"":""Mon, 19 Jun 2006 16:52:40 GMT""}]","2007-05-23"
"quant-ph/0304091","Louis H. Kauffman","Louis H. Kauffman and Samuel J. Lomonaco Jr","Entanglement Criteria - Quantum and Topological","8 pages, LaTeX, to appear in proceedings of Spie Conference, Orlando,
  Fla, April 2003",,"10.1117/12.487835",,"quant-ph",,"  This paper gives a criterion for detecting the entanglement of a quantum
state, and uses it to study the relationship between topological and quantum
entanglement. It is fundamental to view topological entanglements such as
braids as entanglement operators and to associate to them unitary operators
that are capable of creating quantum entanglement. The entanglement criterion
is used to explore this connection. The paper discusses non-locality in the
light of this criterion.
","[{""version"":""v1"",""created"":""Sat, 12 Apr 2003 08:18:28 GMT""}]","2009-11-10"
