"astro-ph/0304409","Kevin Luhman","K. L. Luhman (CfA), John R. Stauffer, A. A. Muench (SIRTF Science
  Center), G. H. Rieke (Arizona), E. A. Lada (Florida), J. Bouvier (Grenoble),
  C. J. Lada (CfA)","A Census of the Young Cluster IC 348","47 pages, 14 figures, 3rd para of 4.5.3 has been added, this is final
  version in press at ApJ, also found at
  http://cfa-www.harvard.edu/sfgroup/preprints.html","Astrophys.J. 593 (2003) 1093-1115","10.1086/376594",,"astro-ph",,"  We present a new census of the stellar and substellar members of the young
cluster IC 348. We have obtained images at I and Z for a 42'x28' field
encompassing the cluster and have combined these measurements with previous
optical and near-infrared photometry. From spectroscopy of candidate cluster
members appearing in these data, we have identified 122 new members, 15 of
which have spectral types of M6.5-M9, corresponding to masses of 0.08-0.015
M_sun by recent evolutionary models. The latest census for IC 348 now contains
a total of 288 members, 23 of which are later than M6 and thus are likely to be
brown dwarfs. From an extinction-limited sample of members (A_V<=4) for a
16'x14' field centered on the cluster, we construct an IMF that is unbiased in
mass and nearly complete for M/M_sun>=0.03 (<=M8). In logarithmic units where
the Salpeter slope is 1.35, the mass function for IC 348 rises from high masses
down to a solar mass, rises more slowly down to a maximum at 0.1-0.2 M_sun, and
then declines into the substellar regime. In comparison, the similarly-derived
IMF for Taurus from Briceno et al. and Luhman et al. rises quickly to a peak
near 0.8 M_sun and steadily declines to lower masses. The distinctive shapes of
the IMFs in IC 348 and Taurus are reflected in the distributions of spectral
types, which peak at M5 and K7, respectively. These data provide compelling,
model-independent evidence for a significant variation of the IMF with
star-forming conditions.
","[{""version"":""v1"",""created"":""Wed, 23 Apr 2003 18:12:15 GMT""},{""version"":""v2"",""created"":""Wed, 30 Apr 2003 19:31:27 GMT""}]","2009-11-07"
"astro-ph/0304414","Kevin Luhman","K. L. Luhman (CfA), Cesar Briceno (CIDA), John R. Stauffer (SIRTF
  Science Center), Lee Hartmann (CfA), D. Barrado y Navascues (LAEFF-INTA), and
  Nelson Caldwell (CfA)","New Low-Mass Members of the Taurus Star-Forming Region","to be published in The Astrophysical Journal, 13 pages, 6 figures,
  also found at http://cfa-www.harvard.edu/sfgroup/preprints.html","Astrophys.J.590:348-356,2003","10.1086/374983",,"astro-ph",,"  Briceno et al. recently used optical imaging, data from the Two-Micron
All-Sky Survey (2MASS), and follow-up spectroscopy to search for young low-mass
stars and brown dwarfs in 8 square degrees of the Taurus star-forming region.
By the end of that study, there remained candidate members of Taurus that
lacked the spectroscopic observations needed to measure spectral types and
determine membership. In this work, we have obtained spectroscopy of the 22
candidates that have A_V<=8, from which we find six new Taurus members with
spectral types of M2.75 through M9. The new M9 source has the second latest
spectral type of the known members of Taurus (~0.02 M_sun). Its spectrum
contains extremely strong emission in H_alpha (W~950 A) as well as emission in
He I 6678 A and the Ca II IR triplet. This is the least massive object known to
exhibit emission in He I and Ca II, which together with the strong H_alpha are
suggestive of intense accretion.
","[{""version"":""v1"",""created"":""Wed, 23 Apr 2003 18:05:24 GMT""}]","2008-11-26"
"astro-ph/0304415","Piercarlo Bonifacio","Piercarlo Bonifacio (1), Marco Limongi (2), Alessandro Chieffi (3)((1)
  INAF- Osservatorio Astronomico di Trieste, (2) INAF - Osservatorio
  Astronomico di Roma, (3) Istituto di Astrofisica Spaziale, CNR)","How did the metals in a giant star originate?","to appear in Nature Brief Communications issue 24 April 2003",,"10.1038/422834a",,"astro-ph",,"  The chemical composition of stars with extremely low metal contents (taking
``metals'' to mean all elements other than hydrogen and helium) provides us
with information on the masses of the stars that produced the first metals.
Such a direct connection is not possible, however, if the surface of the star
has been polluted by enriched material, either dredged from the star's interior
or transferred from a companion star. Here we argue that, in the case of
HE0107-5240 (ref. 1), the most iron poor star known, the oxygen abundance could
be a discriminant: a ratio of [O/Fe] exceeding +3.5 would favour a pristine
origin of metals, whereas an [O/Fe] ratio of less than +3 would favour the
pollution hypothesis. Using this criterion, we suggest how the required
information on oxygen abundance might be obtained.
","[{""version"":""v1"",""created"":""Wed, 23 Apr 2003 19:38:15 GMT""}]","2015-06-24"
"astro-ph/0304416","Daniel Baumann","Daniel Baumann (Cambridge), Asantha Cooray (Caltech)","CMB-induced Cluster Polarization as a Cosmological Probe","7 pages, 3 figures; to appear in proceedings of the CMBnet meeting,
  Oxford, February 2003; submitted to New Astronomy","New Astron.Rev. 47 (2003) 839-843","10.1016/j.newar.2003.07.013",,"astro-ph",,"  Scattering of the temperature anisotropy quadrupole by free electrons in
galaxy clusters leads to a secondary polarization signal in the cosmic
microwave background (CMB) fluctuations. At low redshifts, the temperature
quadrupole contains a significant contribution from the integrated Sachs-Wolfe
(ISW) effect associated with the growth of density fluctuations. Using
polarization data from a sample of clusters over a wide range in redshift, one
can statistically establish the presence of the ISW effect and determine its
redshift evolution. Given the strong dependence of the ISW effect on the
background cosmology, cluster polarization can eventually be used as a powerful
probe of dark energy. As a further application, we also discuss how it might be
used to understand the potential lack of power on large scales.
","[{""version"":""v1"",""created"":""Wed, 23 Apr 2003 20:01:07 GMT""}]","2015-06-24"
"astro-ph/0304417","Jason Rhodes","Jason Rhodes, Alexandre Refregier, Richard Massey, and the SNAP
  Collaboration","Weak Lensing from Space I: Instrumentation and Survey Strategy","25 pages, 8 figures, 1 table, replaced with Published Version","Astropart.Phys. 20 (2004) 377","10.1016/j.astropartphys.2003.10.002",,"astro-ph",,"  A wide field space-based imaging telescope is necessary to fully exploit the
technique of observing dark matter via weak gravitational lensing. This first
paper in a three part series outlines the survey strategies and relevant
instrumental parameters for such a mission. As a concrete example of hardware
design, we consider the proposed Supernova/Acceleration Probe (SNAP). Using
SNAP engineering models, we quantify the major contributions to this
telescope's Point Spread Function (PSF). These PSF contributions are relevant
to any similar wide field space telescope. We further show that the PSF of SNAP
or a similar telescope will be smaller than current ground-based PSFs, and more
isotropic and stable over time than the PSF of the Hubble Space Telescope. We
outline survey strategies for two different regimes - a ``wide'' 300 square
degree survey and a ``deep'' 15 square degree survey that will accomplish
various weak lensing goals including statistical studies and dark matter
mapping.
","[{""version"":""v1"",""created"":""Wed, 23 Apr 2003 20:13:47 GMT""},{""version"":""v2"",""created"":""Thu, 11 Mar 2004 21:41:06 GMT""}]","2015-06-24"
"astro-ph/0304418","Jason Rhodes","Richard Massey, Jason Rhodes, Alexandre Refregier, Justin Albert,
  David Bacon, Gary Bernstein, Richard Ellis, Bhuvnesh Jain, Tim McKay, Saul
  Perlmutter, and Andy Taylor","Weak Lensing from Space II: Dark Matter Mapping","20 pages, 12 figures. Accepted version: includes one extra figure and
  analysis concerning the optimal pixel size","Astron.J. 127 (2004) 3089","10.1086/420985",,"astro-ph",,"  We study the accuracy with which weak lensing measurements could be made from
a future space-based survey, predicting the subsequent precisions of
3-dimensional dark matter maps, projected 2-dimensional dark matter maps, and
mass-selected cluster catalogues. As a baseline, we use the instrumental
specifications of the Supernova/Acceleration Probe (SNAP) satellite. We first
compute its sensitivity to weak lensing shear as a function of survey depth.
Our predictions are based on detailed image simulations created using
`shapelets', a complete and orthogonal parameterization of galaxy morphologies.
We incorporate a realistic redshift distribution of source galaxies, and
calculate the average precision of photometric redshift recovery using the SNAP
filter set to be Delta z=0.034. The high density of background galaxies
resolved in a wide space-based survey allows projected dark matter maps with a
rms sensitivity of 3% shear in 1 square arcminute cells. This will be further
improved using a proposed deep space-based survey, which will be able to detect
isolated clusters using a 3D lensing inversion techniques with a 1 sigma mass
sensitivity of approximately 10^13 solar masses at z~0.25. Weak lensing
measurements from space will thus be able to capture non-Gaussian features
arising from gravitational instability and map out dark matter in the universe
with unprecedented resolution.
","[{""version"":""v1"",""created"":""Wed, 23 Apr 2003 20:16:48 GMT""},{""version"":""v2"",""created"":""Fri, 12 Mar 2004 00:56:27 GMT""}]","2009-11-07"
"astro-ph/0304419","Jason Rhodes","Alexandre Refregier, Richard Massey, Jason Rhodes, Richard Ellis,
  Justin Albert, David Bacon, Gary Bernstein, Tim McKay, and Saul Perlmutter","Weak Lensing from Space III: Cosmological Parameters","12 pages, 11 figures. Accepted version","Astron.J. 127 (2004) 3102","10.1086/420986",,"astro-ph",,"  Weak gravitational lensing provides a unique method to directly map the dark
matter in the universe and measure cosmological parameters. Current weak
lensing surveys are limited by the atmospheric seeing from the ground and by
the small field of view of existing space telescopes. We study how a future
wide-field space telescope can measure the lensing power spectrum and skewness,
and set constraints on cosmological parameters. The lensing sensitivity was
calculated using detailed image simulations and instrumental specifications
studied in earlier papers in this series. For instance, the planned
SuperNova/Acceleration Probe (SNAP) mission will be able to measure the matter
density parameter Omega_m and the dark energy equation of state parameter w
with precisions comparable and nearly orthogonal to those derived with SNAP
from supernovae. The constraints degrade by a factor of about 2 if redshift
tomography is not used, but are little affected if the skewness only is
dropped. We also study how the constraints on these parameters depend upon the
survey geometry and define an optimal observing strategy.
","[{""version"":""v1"",""created"":""Wed, 23 Apr 2003 20:18:42 GMT""},{""version"":""v2"",""created"":""Fri, 12 Mar 2004 00:56:37 GMT""}]","2009-11-07"
"astro-ph/0304420","Ronald F. Webbink","Ronald F. Webbink","Contact Binaries","12 pages, 5 figures, to appear in 3D Stellar Evolution, ed. P.P.
  Eggleton and D.S.P. Dearborn (ASP Conf. Ser.)",,,,"astro-ph",,"  Despite being the most abundant (by space density) of interacting binary
stars, W Ursae Majoris (W UMa) stars are not understood structurally. Their
stellar components are in physical contact, and share a common convective
envelope. Observations demand large-scale energy exchange between components,
as do considerations of hydrostatic and thermal equilibrium. Yet solutions in
complete equilibrium can account for only a few of the bluest W UMa binaries.
Models which permit departures from thermal equilibrium can reproduce the
observable properties of later-type W UMa binaries, but they develop relaxation
oscillations, during a substantial portion of which the binary components break
thermal contact and develop very different effective temperatures, contrary to
observational statistics. Massive, early-type contact binaries are also known
to exist, but the nature of energy and mass exchange in common radiative
envelopes remains virtually unexplored.
","[{""version"":""v1"",""created"":""Wed, 23 Apr 2003 21:02:54 GMT""}]","2007-05-23"
"astro-ph/0304421","Kristen Menou","Kristen Menou (UVa)","Black Hole Accretion Disks On The Edge","17 pages, 4 figures, accepted for publication in ApJ","Astrophys.J.596:414-420,2003","10.1086/377690",,"astro-ph gr-qc",,"  The local axisymmetric stability of hydrodynamical and magnetized,
nearly-Keplerian gaseous accretion disks around non-rotating black holes is
examined in the vicinity of the classical marginally-stable orbit (at radii ~
R_ms). An approximate Paczynski-Wiita pseudo-Newtonian potential is used.
Hydrodynamical disks are linearly unstable inside a radius which differs
slightly from the classical R_ms value because of finite pressure and radial
stratification effects. Linear stresses associated with unstable hydrodynamical
modes vanish exactly at the radius of marginal stability and are generally
positive inside of that radius. When a magnetic field is introduced, however,
the concept of radius of marginal stability becomes largely irrelevant because
there are linearly unstable magneto-rotational modes everywhere. Associated
linear stresses are positive and continuous across the region of hydrodynamical
marginal stability, even for large-scale ""hydro-like"" modes subject only to
weak magnetic tension. This conclusion is valid for arbitrarily thin disks (in
ideal MHD) and it does not require a large-scale ""radially-connecting"" magnetic
field. Results on hydrodynamical diskoseismic modes trapped in deep
relativistic potential wells should be revised to account for the
short-wavelength Alfven-like behavior of inertio-gravity waves in magnetized
disks.
","[{""version"":""v1"",""created"":""Wed, 23 Apr 2003 20:56:02 GMT""},{""version"":""v2"",""created"":""Fri, 20 Jun 2003 16:21:41 GMT""}]","2011-05-10"
"astro-ph/0304422","Ennio Poretti","E. Poretti, R. Garrido, P.J. Amado, K. Uytterhoeven, G. Handler, R.
  Alonso, S. Martin, C.Aerts, C. Catala, M.J. Goupil, E. Michel, L. Mantegazza,
  P. Mathias, M.L. Pretorius, J.A. Belmonte, A. Claret, E. Rodriguez, J.C.
  Suarez, F.F. Vuthela, W.W.Weiss, D. Ballereau, J.C. Bouret, S. Charpinet, T.
  Hua, T. Luftinger, N. Nesvacil, C. Van't Veer-Menneret","Preparing the COROT space mission: incidence and characterisation of
  pulsation in the Lower Instability Strip","9 pages, 9 figures Accepted for publication in Astronomy &
  Astrophysics, Main Journal","Astron.Astrophys. 406 (2003) 203-212","10.1051/0004-6361:20030711",,"astro-ph",,"  By pursuing the goal to find new variables in the COROT field-of-view we
characterised a sample of stars located in the lower part of the instability
strip. Our sample is composed of stars belonging to the disk population in the
solar neighbourhood. We found that 23% of the stars display multiperiodic light
variability up to few mmag of amplitude. uvbyBeta photometry fixed most of the
variables in the middle of the instability strip and high-resolution
spectroscopy established that they have vsin i>100 km/s. The comparison with
delta Sct stars in the whole Galaxy shows slightly different features, i.e.,
most delta Sct stars have a 0.05-mag redder (b-y)_0 index and lower vsin i
values. Additional investigation in the open cluster NGC 6633 confirms the same
incidence of variability, i.e., around 20%. The wide variety of pulsational
behaviours of delta Sct stars (including unusual objects such as a variable
beyond the blue edge or a rapidly rotating high-amplitude pulsator) makes them
very powerful asteroseismic tools to be used by COROT. Being quite common among
bright stars, delta Sct stars are suitable targets for optical observations
from space.
","[{""version"":""v1"",""created"":""Wed, 23 Apr 2003 21:29:16 GMT""}]","2009-11-07"
"astro-ph/0304423","Ivan K. Baldry","I. K. Baldry and K. Glazebrook","Constraints on a Universal IMF from UV to Near-IR Galaxy Luminosity
  Densities","16 pages, accepted by ApJ","Astrophys.J.593:258-271,2003","10.1086/376502",,"astro-ph",,"  We obtain constraints on the slope of a universal stellar initial mass
function (IMF) over a range of cosmic star-formation histories (SFH) using
z=0.1 luminosity densities in the range from 0.2 to 2.2 microns. The age-IMF
degeneracy of integrated spectra of stellar populations can be broken for the
Universe as a whole by using direct measurements of (relative) cosmic SFH from
high-redshift observations. These have only marginal dependence on
uncertainties in the IMF, whereas, fitting to local luminosity densities
depends strongly on both cosmic SFH and the IMF. We fit to these measurements
using population synthesis and find the best-fit IMF power-law slope to be
Gamma=1.15+-0.2 (0.5 < M/M_solar < 120). This slope is in good agreement with
the Salpeter IMF slope (Gamma=1.35). A strong upper limit of Gamma<1.7 is
obtained which effectively rules out the Scalo IMF due to its too low fraction
of high-mass stars. This upper limit is at the 99.7% confidence level if we
assume a closed-box chemical evolution scenario and 95% if we assume constant
solar metallicity. Fitting to the H-alpha line luminosity density, we obtain a
best-fit IMF slope in good agreement with that derived from broadband
measurements. Marginalizing over cosmic SFH and IMF slope, we obtain (95% conf.
ranges, h=1): omega_stars = 1.1-2.0 E-3 for the stellar mass density; rho_sfr =
0.7-4.1 E-2 M_solar/yr/Mpc^3 for the star-formation rate density, and; rho_L =
1.2-1.7 E+35 W/Mpc^3 for the bolometric, attenuated, stellar, luminosity
density (0.09-5 microns). Comparing this total stellar emission with an
estimate of the total dust emission implies a relatively modest average
attenuation in the UV (<=1 magnitude at 0.2 microns).
","[{""version"":""v1"",""created"":""Wed, 23 Apr 2003 21:23:12 GMT""}]","2011-05-05"
"astro-ph/0304424","Sylvain Turcotte","S. Turcotte","Diffusion and Settling in Ap/Bp Stars","7 pages, invited talk to International Conference on Magnetic Feilds
  in O, B and A Stars",,,,"astro-ph",,"  Ap/Bp stars are magnetic chemically peculiar early A and late B type stars of
the main sequence. They exhibit peculiar surface abundance anomalies that are
thought to be the result of gravitational settling and radiative levitation.
The physics of diffusion in these stars are reviewed briefly and some model
predictions are discussed. While models reproduce some observations reasonably
well, more work is needed before the behavior of diffusing elements in a
complex magnetic field is fully understood.
","[{""version"":""v1"",""created"":""Wed, 23 Apr 2003 21:43:39 GMT""}]","2007-05-23"
"astro-ph/0304425","Stephen Murray","Stephen D. Murray, Shawfeng Dong, Douglas N. C. Lin","Roche Lobe Overflow from Dwarf Stellar Systems","28 pages, LaTeX, AASTex macros","Astrophys.J. 593 (2003) 301","10.1086/376361","UCRL-JC-152026","astro-ph",,"  We use both analytical analyses and numerical simulations to examine the
evolution of residual gas within tidally-limited dwarf galaxies and globular
clusters. If the gas sound speed exceeds about 10% of the central velocity
dispersion, as is the case for ionized gas within small stellar systems, the
gas shall have significant density at the tidal radius, and the gas may be lost
on timescales as short as a few times the sound crossing time of the system. In
colder systems, the density at the tidal radius is much lower, greatly reducing
the mass loss rate, and the system may retain its gas for a Hubble time. The
tidally removed gas shall follow an orbit close to that of the original host
system, forming an extended stream of ionized, gaseous debris. Tidal mass loss
severely limits the ability of dwarf systems to continuously form stars. The
ordinary gas content in many dwarf galaxies is fully ionized during high
red-shift epochs, possibly preventing star formation in some systems, leading
to the formation of starless, dark-matter concentrations. In either the field
or in the center of galaxy clusters, ionized gas may be retained by dwarf
galaxies, even though its sound speed may be comparable to or even exceed the
velocity dispersion. These processes may help to explain some observed
differences among dwarf galaxy types, as well as observations of the haloes of
massive galaxies.
","[{""version"":""v1"",""created"":""Wed, 23 Apr 2003 22:21:44 GMT""}]","2009-11-07"
"astro-ph/0304426","Marilia J. Sartori","Marilia J. Sartori (1 and 2), Jacques R. D. Lepine (2), Wilton S. Dias
  (2) ((1) Laboratorio Nacional de Astrofisica, Brazil, (2) Instituto de
  Astronomia, Geofisica e Ciencias Atmosfericas, USP, Brazil)","Formation scenarios for the young stellar associations between galactic
  longitudes l = 280-360 deg","14 pages, 14 postscript figures, accepted for publication in A&A","Astron.Astrophys. 404 (2003) 913-926","10.1051/0004-6361:20030581",,"astro-ph",,"  We investigate the spatial distribution, the space velocities and age
distribution of the pre-main sequence (PMS) stars belonging to Ophiuchus, Lupus
and Chamaeleon star-forming regions (SFRs), and of the young early-type star
members of the Scorpius-Centaurus OB association. These young stellar
associations extend over the galactic longitude range from 280 deg. to 360
deg., and are at a distance interval of around 100 and 200 pc. This study is
based on a compilation of distances, proper motions and radial velocities from
the literature for the kinematic properties, and of basic stellar data for the
construction of Hertzsprung-Russel diagrams. Although there was no well-known
OB association in Chamaeleon, the distances and the proper motions of a group
of 21 B- and A-type stars, taken from the Hipparcos Catalogue, lead us to
propose that they form a young association. We show that the young early-type
stars of the OB associations and the PMS stars of the SFRs follow a similar
spatial distribution, i.e., there is no separation between the low and the
high-mass young stars. We find no difference in the kinematics nor in the ages
of these two populations studied. We analyze the different scenarios for the
triggering of large-scale star-formation that have been proposed up to now, and
argue that most probably we are observing a spiral arm that passes close to the
Sun. The alignment of young stars and molecular clouds and the average velocity
of the stars in the opposite direction to the Galactic rotation agree with the
expected behavior of star formation in nearby spiral arms.
","[{""version"":""v1"",""created"":""Wed, 23 Apr 2003 23:26:04 GMT""},{""version"":""v2"",""created"":""Thu, 24 Apr 2003 20:17:19 GMT""}]","2009-11-07"
"astro-ph/0304427","Joseph B. Jensen","Joseph B. Jensen (Gemini), John L. Tonry (Hawaii), John P. Blakeslee
  (JHU)","The Extragalactic Distance Scale","18 pages, 1 figure; contribution to Measuring and Modeling the
  Universe, Carnegie Observatories Astrophysics Series Vol. 2, ed. W. L.
  Freedman",,,"Gemini preprint #95","astro-ph",,"  Significant progress has been made during the last 10 years toward resolving
the debate over the expansion rate of the Universe. The current value of the
Hubble parameter, Ho, is now arguably known with an accuracy of 10%, largely
due to the tremendous increase in the number of galaxies in which Cepheid
variable stars have been discovered. Increasingly accurate secondary distance
indicators, many calibrated using Cepheids, now provide largely concordant
measurements of Ho well out into the Hubble flow, and deviations from the
smooth Hubble flow allow us to better measure the dynamical structure of the
local Universe. The change in the Hubble parameter with redshift provided the
first direct evidence for acceleration and ""dark energy"" in the Universe.
Extragalactic distance measurements are central to determining the size, age,
composition, and fate of the Universe. We discuss remaining systematic
uncertainties, particularly related to the Cepheid calibration, and identify
where improvements are likely to be made in the next few years.
","[{""version"":""v1"",""created"":""Wed, 23 Apr 2003 23:52:07 GMT""}]","2007-05-23"
"astro-ph/0304428","Yasuko S. Honda","Mitsuru Honda and Yasuko. S. Honda","On Exact Polytropic Equilibria of Self-Gravitating Gaseous and Radiative
  Systems: Their Application to Molecular Cloud Condensation","5 pages, 3 figures, 1 table. Accepted for publication in MNRAS","Mon.Not.Roy.Astron.Soc. 341 (2003) 164","10.1046/j.1365-8711.2003.06399.x",,"astro-ph",,"  We propose a novel mathematical method to construct an exact polytropic
sphere in self-gravitating hydrostatic equilibrium, improving the non-linear
Poisson equation. The central boundary condition for the present equation
requires a ratio of gas pressure to total one at the centre, which is uniquely
identified by the whole mass and molecular weight of the system. The special
solution derived from the Lane-Emden equation can be reproduced. This scheme is
now available for modelling the molecular cloud cores in interstellar media.
The mass-radius relation of the first core is found to be consistent with the
recent results of radiation hydrodynamic simulations.
","[{""version"":""v1"",""created"":""Thu, 24 Apr 2003 00:18:12 GMT""}]","2009-11-07"
