"hep-ph/0304209","Gouranga C. Nayak","Michael C. Birse, Chung-Wen Kao (U. Manchester) and Gouranga C. Nayak
  (LANL)","Screening and antiscreening in anisotropic QED and QCD plasmas","14 pages latex","Phys.Lett. B570 (2003) 171-179","10.1016/j.physletb.2003.08.007",,"hep-ph cond-mat hep-lat hep-th nucl-th",,"  We use a transport-theory approach to construct the static propagator of a
gauge boson in a plasma with a general axially- and reflection-symmetric
momentum distribution. Non-zero magnetic screening is found if the distribution
is anisotropic, confirming the results of a closed-time-path-integral approach.
We find that the electric and magnetic screening effects depend on both the
orientation of the momentum carried by the boson and the orientation of its
polarization. In some orientations there can be antiscreening, reflecting the
instabilities of such a medium. We present some fairly general conditions on
the dependence of these effects on the anisotropy.
","[{""version"":""v1"",""created"":""Wed, 23 Apr 2003 17:40:04 GMT""},{""version"":""v2"",""created"":""Thu, 3 Jul 2003 13:21:38 GMT""},{""version"":""v3"",""created"":""Thu, 7 Aug 2003 16:26:59 GMT""}]","2009-11-10"
"hep-ph/0304226","A. J. Barr","Alan Barr, Christopher Lester, Phil Stephens","m_T2 : the truth behind the glamour",,"J.Phys.G29:2343-2363,2003","10.1088/0954-3899/29/10/304","Cavendish HEP-2002-02/14","hep-ph",,"  We present the kinematic variable, m_T2, which is in some ways similar to the
more familiar `transverse-mass', but which can be used in events where two or
more particles have escaped detection. We define this variable and describe the
event topologies to which it applies, then present some of its mathematical
properties. We then briefly discuss two case studies which show how m_T2 is
vital when reconstructing the masses of supersymmetric particles in mSUGRA-like
and AMSB-like scenarios at the Large Hadron Collider.
","[{""version"":""v1"",""created"":""Wed, 23 Apr 2003 16:04:00 GMT""}]","2008-11-26"
"hep-ph/0304227","Vladimir Galkin","D. Ebert, R. N. Faustov, V. O. Galkin","Hyperfine splitting and leptonic decay rates in heavy quarkonia","4 pages, misprint in Table 2 corrected","Mod.Phys.Lett. A18 (2003) 1597-1600","10.1142/S0217732303011307","HU-EP-03/15","hep-ph",,"  The hyperfine splitting in heavy quarkonia is considered in its relation to
the leptonic decay rates with the account of relativistic and radiative
corrections. The calculated decay rates agree well with the available
experimental data, while the predicted \eta_c(2S) mass is significantly smaller
than the value measured recently by the Belle Collaboration.
","[{""version"":""v1"",""created"":""Wed, 23 Apr 2003 16:33:27 GMT""},{""version"":""v2"",""created"":""Wed, 4 Jun 2003 08:15:43 GMT""}]","2009-11-10"
"hep-ph/0304228","Federico Piazza","Federico Piazza and Christian Marinoni","Model for Gravitational Interaction between Dark Matter and Baryons","4 pages, 2 figures, final version","Phys.Rev.Lett. 91 (2003) 141301","10.1103/PhysRevLett.91.141301",,"hep-ph astro-ph gr-qc hep-th",,"  We propose a phenomenological model where the gravitational interaction
between dark matter and baryons is suppressed on small, subgalactic scales. We
describe the gravitational force by adding a Yukawa contribution to the
standard Newtonian potential and show that this interaction scheme is
effectively suggested by the available observations of the inner rotation
curves of small mass galaxies. Besides helping in interpreting the cuspy
profile of dark matter halos observed in N-body simulations, this potential
regulates the quantity of baryons within halos of different masses.
","[{""version"":""v1"",""created"":""Wed, 23 Apr 2003 18:46:35 GMT""},{""version"":""v2"",""created"":""Tue, 7 Oct 2003 08:45:22 GMT""}]","2009-11-10"
"hep-ph/0304229","Christopher D. Carone","Kaustubh Agashe (Johns Hopkins) and Christopher D. Carone (William and
  Mary)","Supersymmetric Flavor Models and the B --> phi K_S Anomaly","18 pages LaTeX, 3 eps figures","Phys.Rev.D68:035017,2003","10.1103/PhysRevD.68.035017","WM-03-103","hep-ph",,"  We consider the flavor structure of supersymmetric theories that can account
for the deviation of the observed time-dependent CP asymmetry in B --> phi K_S
from the standard model prediction. Assuming simple flavor symmetries and
effective field theory, we investigate possible correlations between sizable
supersymmetric contributions to b --> s transitions and to flavor changing
processes that are more tightly constrained. With relatively few assumptions,
we determine the properties of minimal Yukawa and soft mass textures that are
compatible with the desired supersymmetric flavor-changing effect and
constraints. We then present explicit models that are designed (at least
approximately) to realize these textures. In particular, we present an Abelian
model based on a single U(1) factor and a non-trivial extra-dimensional
topography that can explain the CP asymmetry in B --> phi K_S, while
suppressing other supersymmetric flavor changing effects through a high degree
of squark-quark alignment.
","[{""version"":""v1"",""created"":""Wed, 23 Apr 2003 18:46:07 GMT""},{""version"":""v2"",""created"":""Tue, 29 Apr 2003 19:44:54 GMT""},{""version"":""v3"",""created"":""Wed, 6 Aug 2003 20:16:48 GMT""}]","2008-11-26"
"hep-ph/0304230","David London","D. London, N. Sinha and R. Sinha","Probing New Physics via an Angular Analysis of B --> V1 V2 decays","9 pages, plain latex, no figures. Title modified slightly. Paragraph
  added about viability of method. Conclusions unchanged. To be published in
  Europhysics Letters","Europhys.Lett. 67 (2004) 579-585","10.1209/epl/i2004-10092-x","UdeM-GPP-TH-03-109","hep-ph",,"  We show that an angular analysis of B --> V1 V2 decays yields numerous tests
for new physics in the decay amplitudes. Unlike direct CP asymmetries, many of
these new-physics observables are nonzero even if the strong phase differences
vanish. For certain observables, neither time-dependent measurements nor
tagging is necessary. Should a signal for new physics be found, one can place a
lower limit on the size of the new-physics parameters, as well as on their
effect on the measurement of the phase of B0--Bbar0 mixing.
","[{""version"":""v1"",""created"":""Wed, 23 Apr 2003 19:17:05 GMT""},{""version"":""v2"",""created"":""Sat, 12 Jun 2004 11:49:31 GMT""}]","2009-11-10"
"hep-ph/0304231","Philip R. Page","Philip R. Page and Simon Capstick","Using pi_2(1670) -> b_1(1235) pi to Constrain Hadronic Models","11 pages, LaTeX, 3 encapsulated Postscript figures, small changes","Phys.Lett.B566:108-114,2003","10.1016/S0370-2693(03)00804-9","LA-UR-03-2566","hep-ph",,"  We show that current analyses of experimental data indicate that the strong
decay mode pi_2 -> b_1 pi is anomalously small. Non-relativistic quark models
with spin-1 quark pair creation, such as ^3P_0, ^3S_1 and ^3D_1 models, as well
as instanton and lowest order one-boson (in this case pi) emission models, can
accommodate the analyses of experimental data, because of a quark-spin
selection rule. Models and effects that violate this selection rule, such as
higher order one-boson emission models, as well as mixing with other Fock
states, may be constrained by the small pi_2 -> b_1 pi decay. This can provide
a viability check on newly proposed decay mechanisms. We show that for mesons
made up of a heavy quark and anti-quark, the selection rule is exact to all
orders of Quantum Chromodynamics (QCD) perturbation theory.
","[{""version"":""v1"",""created"":""Wed, 23 Apr 2003 20:58:16 GMT""},{""version"":""v2"",""created"":""Tue, 1 Jul 2003 18:58:48 GMT""}]","2008-11-26"
"hep-ph/0304233","Fischer","Christian S. Fischer","Non-perturbative Propagators, Running Coupling and Dynamical Mass
  Generation in Ghost-Antighost Symmetric Gauges in QCD","163 pages, 36 figures, PhD-thesis, Univ. of Tuebingen. Nov 2002",,,,"hep-ph",,"  We present approximate non-perturbative solutions for the propagators as well
as the running coupling of QCD from a coupled system of renormalised, truncated
Dyson--Schwinger equations. We employ ansaetze for the dressed vertices such
that the running coupling and the quark mass function are independent of the
renormalisation point. Our solutions are in good agreement with the results of
recent lattice calculations.
  We find a weakly vanishing gluon propagator at small momenta and an infrared
singular ghost propagator in agreement with Zwanziger's horizon condition and
the Kugo-Ojima confinement criterion. The running coupling possesses an
infrared fixed point at alpha(0) = 8.92/N_c. To investigate the influence of
boundary conditions on the propagators we solved the ghost and gluon DSEs also
on a four-torus. Our results show typical finite volume effects but are still
close to the continuum solutions for sufficiently large volumes.
  For the quark propagator we find dynamically generated quark masses that
agree well with phenomenological values. The effects of unquenching the system
are found to be small. In particular the infrared behaviour of the ghost and
gluon dressing functions found in pure Yang-Mills theory is almost unchanged as
long as the number of light flavors is smaller than four.
","[{""version"":""v1"",""created"":""Wed, 23 Apr 2003 20:50:33 GMT""}]","2009-09-29"
"hep-ph/0304234","Xing ZhiZhong","Zhi-zhong Xing and He Zhang","Lepton Mass Matrices with Four Texture Zeros","LaTex 15 pages (2 PS figures). Changes made. To appear in Phys. Lett.
  B","Phys.Lett. B569 (2003) 30-40","10.1016/j.physletb.2003.07.008","BIHEP-TH-2003-20","hep-ph",,"  We propose two ans$\rm\ddot{a}$tze of lepton mass matrices with four texture
zeros, and confront them with current experimental data on neutrino
oscillations. The parameter space of each ansatz is carefully explored. We find
that both ans$\rm\ddot{a}$tze can accommodate the normal hierarchy of neutrino
masses and the bi-large pattern of lepton flavor mixing. Their predictions for
the effective mass of the tritium beta decay and that of the neutrinoless
double beta decay are too small to be detectable, but leptonic CP violation at
the percent level is allowed. Some discussions are also given about the seesaw
invariance of the four-zero texture of Dirac and Majorana neutrino mass
matrices.
","[{""version"":""v1"",""created"":""Thu, 24 Apr 2003 02:36:33 GMT""},{""version"":""v2"",""created"":""Thu, 17 Jul 2003 07:17:13 GMT""}]","2010-04-05"
"hep-ph/0304235","Namit Mahajan","Namit Mahajan (Harish-Chandra Res. Inst.)","$t \to b W$ in NonCommutative Standard Model","11 page Latex file containing 2 eps figures (redrawn). More
  discussion included. To appear in PRD","Phys.Rev.D68:095001,2003","10.1103/PhysRevD.68.095001",,"hep-ph",,"  We study the top quark decay to b quark and W boson in the NonCommutative
Standard Model (NCSM). The lowest contribution to the decay comes from the
terms quadratic in the matrix describing the noncommutative (NC) effects while
the linear term is seen to identically vanish because of symmetry. The NC
effects are found to be significant only for low values of the NC
characteristic scale.
","[{""version"":""v1"",""created"":""Thu, 24 Apr 2003 08:41:32 GMT""},{""version"":""v2"",""created"":""Fri, 17 Oct 2003 06:44:55 GMT""}]","2011-03-23"
"hep-ph/0304236","Zong-Kuan Guo","Zong-Kuan Guo, Yun-Song Piao, Rong-Gen Cai and Yuan-Zhong Zhang","Inflationary Attractor from Tachyonic Matter","4 pages, 2 figures, RevTeX","Phys.Rev. D68 (2003) 043508","10.1103/PhysRevD.68.043508",,"hep-ph",,"  We study the complete evolution of a flat and homogeneous universe dominated
by tachyonic matter. We demonstrate the attractor behaviour of the tachyonic
inflation using the Hamilton-Jacobi formalism. We else obtain analytical
approximations to the trajectories of the tachyon field in different regions.
The numerical calculation shows that an initial non-vanishing momentum does not
prevent the onset of inflation. The slow-rolling solution is an attractor.
","[{""version"":""v1"",""created"":""Thu, 24 Apr 2003 10:43:39 GMT""},{""version"":""v2"",""created"":""Sat, 14 Jun 2003 07:12:20 GMT""}]","2007-05-23"
"hep-ph/0304237","Bourge","A. Stocchi (LAL, Orsay)","Final Results on Heavy Quarks at LEP and SLD","Talk given at the XXX SLAC Summer Institute, ssi2002, August
  5-16,2002","ECONF C020805:TTH04,2002",,"LAL03-22","hep-ph",,"  In the last decade, the LEP and SLD experiments played a central role in the
study of B hadrons (hadrons containing a b quark).
  New B hadrons have been observed ($B^0_s$, \Lambda_b$, $\Xi_b$ and $B^{**}$)
and their production and decay properties have been measured. In this paper we
will focus on measurements of the CKM matrix elements: $|V_{cb}|$, $|V_{ub}|$,
$|V_{td}|$ and $|V_{ts}|$. We will show how all these measurements, together
with theoretical developments, have significantly improved our knowledge on the
flavour sector of the Standard Model.
","[{""version"":""v1"",""created"":""Thu, 24 Apr 2003 13:45:55 GMT""},{""version"":""v2"",""created"":""Tue, 6 May 2003 19:09:15 GMT""}]","2010-11-23"
"hep-ph/0304238","Ling-Fong Li","Ling-Fong Li and Feng Wu","Coupling Constant Unification in Extensions of Standard Model","13 pages, equations, additional references added","Int.J.Mod.Phys. A19 (2004) 3217-3224","10.1142/S0217751X04019391","CMU-HEP-03-03","hep-ph",,"  Unification of electromagnetic, weak, and strong coupling constants is
studied in the extension of standard model with additional fermions and
scalars. It is remarkable that this unification in the supersymmetric extension
of standard model yields a value of Weinberg angle which agrees very well with
experiments. We discuss the other possibilities which can also give same
result.
","[{""version"":""v1"",""created"":""Thu, 24 Apr 2003 15:06:58 GMT""},{""version"":""v2"",""created"":""Tue, 3 Jun 2003 21:37:47 GMT""}]","2009-11-10"
"hep-th/0304192","Leonardo Rastelli","Davide Gaiotto, Nissan Itzhaki and Leonardo Rastelli","Closed Strings as Imaginary D-branes","40 pages, 4 eps figures. Minor typos fixed","Nucl.Phys.B688:70-100,2004","10.1016/j.nuclphysb.2004.03.017","PUPT-2082","hep-th",,"  Sen has recently drawn attention to an exact time-dependent Boundary
Conformal Field Theory with the space-time interpretation of brane creation and
annihilation. An interesting limit of this BCFT is formally equivalent to an
array of D-branes located in imaginary time. This raises the question: what is
the meaning of D-branes in imaginary time? The answer we propose is that
D-branes in imaginary time define purely closed string backgrounds. In
particular we prove that the disk scattering amplitude of m closed strings off
an arbitrary configuration of imaginary branes is equivalent to a sphere
amplitude with m+1 closed string insertions. The extra puncture is a specific
closed string state, generically normalizable, that depends on the details of
the brane configuration. We study in some detail the special case of the array
of imaginary D-branes related to Sen's BCFT and comment on its space-time
interpretation. We point out that a certain limit of our set-up allows to study
classical black hole creation and suggests a relation between Choptuik's
critical behavior and a phase-transition a` la Gregory-Laflamme. We speculate
that open string field theory on imaginary D-branes is dual to string theory on
the corresponding closed string background.
","[{""version"":""v1"",""created"":""Wed, 23 Apr 2003 19:56:05 GMT""},{""version"":""v2"",""created"":""Mon, 26 Jan 2004 20:13:25 GMT""}]","2008-11-26"
"hep-th/0304197","Daniele Steer","Ph.Brax, J.Mourad, D.A.Steer","Tachyon kinks on non BPS D-branes","16 pages, 2 figures","Phys.Lett. B575 (2003) 115-125","10.1016/j.physletb.2003.09.039","LPT-ORSAY 03/31","hep-th",,"  We consider solitonic solutions of the DBI tachyon effective action for a
non-BPS brane. When wrapped on a circle, these solutions are regular and have a
finite energy. We show that in the decompactified limit, these solitons give
Sen's infinitely thin finite energy kink -- interpreted as a BPS brane --
provided that some conditions on the potential hold. In particular, if for
large $T$ the potential is exponential, $V = e^{-T^a}$, then Sen's solution is
only found for $a<1$. For power-law potentials $V = 1/T^b$, one must have
$b>1$. If these conditions are not satisfied, we show that the lowest energy
configuration is the unstable tachyon vacuum with no kinks. We examine the
stability of the solitons and the spectrum of small perturbations.
","[{""version"":""v1"",""created"":""Wed, 23 Apr 2003 16:25:11 GMT""}]","2015-06-26"
"hep-th/0304198","Matthias Blau","Matthias Blau, Martin O'Loughlin, George Papadopoulos, Arkady A.
  Tseytlin","Solvable models of strings in homogeneous plane wave backgrounds","48 pages, LaTeX2e, v2: additional reference and cosmetic corrections","Nucl.Phys.B673:57-97,2003","10.1016/j.nuclphysb.2003.09.018",,"hep-th",,"  We solve closed string theory in all regular homogeneous plane-wave
backgrounds with homogeneous NS three-form field strength and a dilaton. The
parameters of the model are constant symmetric and anti-symmetric matrices
k_{ij} and f_{ij} associated with the metric, and a constant anti-symmetric
matrix h_{ij} associated with the NS field strength. In the light-cone gauge
the rotation parameters f_{ij} have a natural interpretation as a constant
magnetic field. This is a generalisation of the standard Landau problem with
oscillator energies now being non-trivial functions of the parameters f_{ij}
and k_{ij}. We develop a general procedure for solving linear but non-diagonal
equations for string coordinates, and determine the corresponding oscillator
frequencies, the light-cone Hamiltonian and level matching condition. We
investigate the resulting string spectrum in detail in the four-dimensional
case and compare the results with previously studied examples. Throughout we
will find that the presence of the rotation parameter f_{ij} can lead to
certain unusual and unexpected features of the string spectrum like new
massless states at non-zero string levels, stabilisation of otherwise unstable
(tachyonic) modes, and discrete but not positive definite string oscillator
spectra.
","[{""version"":""v1"",""created"":""Wed, 23 Apr 2003 17:37:54 GMT""},{""version"":""v2"",""created"":""Tue, 10 Jun 2003 12:08:21 GMT""}]","2009-09-17"
"hep-th/0304199","Gary T. Horowitz","Thomas Hertog, Gary T. Horowitz, and Kengo Maeda","Negative Energy Density in Calabi-Yau Compactifications","25 pages, v2: few clarifying comments and reference added","JHEP 0305:060,2003","10.1088/1126-6708/2003/05/060",,"hep-th gr-qc",,"  We show that a large class of supersymmetric compactifications, including all
simply connected Calabi-Yau and G_2 manifolds, have classical configurations
with negative energy density as seen from four dimensions. In fact, the energy
density can be arbitrarily negative -- it is unbounded from below.
Nevertheless, positive energy theorems show that the total ADM energy remains
positive. Physical consequences of the negative energy density include new
thermal instabilities, and possible violations of cosmic censorship.
","[{""version"":""v1"",""created"":""Wed, 23 Apr 2003 17:54:08 GMT""},{""version"":""v2"",""created"":""Tue, 6 May 2003 17:25:21 GMT""}]","2010-11-19"
"hep-th/0304200","Tatsuo Kobayashi","Tetsutaro Higaki and Tatsuo Kobayashi","Twisted Moduli Stabilization in Type I String Models","18 pages, latex, 3 figures","Phys.Rev.D68:046006,2003","10.1103/PhysRevD.68.046006",,"hep-th hep-ph",,"  We consider the model with the dilaton and twisted moduli fields, which is
inspired by type I string models. Stabilization of their vacuum expectation
values is studied. We find the stabilization of the twisted moduli field has
different aspects from the dilaton stabilization.
","[{""version"":""v1"",""created"":""Thu, 24 Apr 2003 03:04:55 GMT""},{""version"":""v2"",""created"":""Fri, 2 May 2003 06:39:03 GMT""}]","2010-12-03"
"hep-th/0304201","Yunseok Seo","Soonkeon Nam, Heeyong Park, Yunseok Seo","Casimir Effect in $\kappa$-deformed Theory","LaTeX file, 9 pages, no figure","J.Korean Phys.Soc.42:467-470,2003",,,"hep-th",,"  Quantum mechanical fluctuations in an interval give rise to the Casimir
effect, which destabilizes the size of the interval. This can be problematic in
constructing Kaluza-Klein theories. We consider the possibility that a
breakdown of the Poincar\'e symmetry in an extra dimension can solve this
instability problem. As a specific example, we consider the space-time with a
$\kappa$-deformed Poincar\'e algebra, calculate the Casimir force between two
plates, and find that we can have an interval with a stable size.
","[{""version"":""v1"",""created"":""Thu, 24 Apr 2003 04:42:32 GMT""}]","2010-02-05"
"hep-th/0304202","Satchitananda naik","Satchidananda Naik","The Gravity dual of the Non-Perturbative $ N = 2 $ SUSY Yang-Mills
  Theory","4 pages, LaTeX. Talk given at the IXth International Symposium on
  Particles, Strings and Cosmology PASCOS '03, Mumbai-India, January 3-8 2003.
  v2:some reference added","Pramana62:717-720,2004","10.1007/BF02705354",,"hep-th",,"  The anomalous Ward identity is derived for $N = 2$ SUSY Yang-Mills theories,
which is resulted out of Wrapping of $D_5$ branes on Supersymmetric two cycles.
  From the Ward identity One obtains the Witten-Dijkgraaf-Verlinde-Verlinde
equation and hence can solve for the pre-potential. This way one avoids the
problem of enhancon which maligns the non-perturbative behaviour of the
Yang-Mills theory resulted out of Wrapped branes.
","[{""version"":""v1"",""created"":""Thu, 24 Apr 2003 07:25:07 GMT""},{""version"":""v2"",""created"":""Mon, 28 Apr 2003 07:22:57 GMT""}]","2008-11-26"
"hep-th/0304203","Miao Li","Qing Guo Huang and Miao Li","CMB Power Spectrum from Noncommutative Spacetime","8 pages, 2 figures; v2: refs. added and minor corrections; v3:
  further minor correction","JHEP 0306 (2003) 014","10.1088/1126-6708/2003/06/014",,"hep-th astro-ph hep-ph",,"  Very recent CMB data of WMAP offers an opportunity to test inflation models,
in particular, the running of spectral index is quite new and can be used to
rule out some models. We show that an noncommutative spacetime inflation model
gives a good explanation of these new results. In fitting the data, we also
obtain a relationship between the noncommutative parameter (string scale) and
the ending time of inflation.
","[{""version"":""v1"",""created"":""Thu, 24 Apr 2003 11:04:56 GMT""},{""version"":""v2"",""created"":""Thu, 15 May 2003 19:40:32 GMT""},{""version"":""v3"",""created"":""Fri, 30 May 2003 06:07:24 GMT""}]","2009-11-10"
"hep-th/0304204","Khaled Saaidi","Khaled Saaidi and Mohammad Khorrami","Large-N limit of the non-local 2D Yang-Mills and generalized Yang-Mills
  theories on a cylinder","10 page, no figures, latex","Eur.Phys.J.C23:757-760,2002","10.1007/s100520200906",,"hep-th",,"  The large-group behavior of the nonlocal YM$_2$'s and gYM$_2$'s on a cylinder
or a disk is investigated. It is shown that this behavior is similar to that of
the corresponding local theory, but with the area of the cylinder replaced by
an effective area depending on the dominant representation. The critical areas
for nonlocal YM$_2$'s on a cylinder with some special bounary conditions are
also obtained.
","[{""version"":""v1"",""created"":""Thu, 24 Apr 2003 11:44:47 GMT""}]","2011-09-13"
"hep-th/0304205","Takeshi Oota","Takeshi Oota","Quantum Projectors and Local Operators in Lattice Integrable Models","LaTeX file, 15 pages, no figure","J.Phys.A37:441-452,2004","10.1088/0305-4470/37/2/013",,"hep-th",,"  In the framework of the quantum inverse scattering method, we consider a
problem of constructing local operators for two-dimensional quantum integrable
models, especially for the lattice versions of the nonlinear Schrodinger and
sine-Gordon models. We show that a certain class of local operators can be
constructed from the matrix elements of the monodromy matrix in a simple way.
They are closely related to the quantum projectors and have nice commutation
relations with the half of the matrix elements of the elementary monodromy
matrix. The form factors of these operators can be calculated by using the
standard algebraic Bethe ansatz techniques.
","[{""version"":""v1"",""created"":""Thu, 24 Apr 2003 11:53:01 GMT""}]","2008-11-26"
"hep-th/0304206","Francois Englert","F. Englert, L. Houart, A. Taormina and P. West","The Symmetry of M-Theories","Latex 41 pages, 2 figures. Introduction modified (and references
  renumbered) for better focusing. Minor changes in the bulk. Two references
  added","JHEP 0309:020,2003","10.1088/1126-6708/2003/09/020","ULB-TH/03-14, DCPT-03/21, KCL-MTH-03-04","hep-th gr-qc",,"  We consider the Cartan subalgebra of any very extended algebra G+++ where G
is a simple Lie algebra and let the parameters be space-time fields. These are
identified with diagonal metrics and dilatons. Using the properties of the
algebra, we find that for all very extensions G+++ of simple Lie algebras there
are theories of gravity and matter, which admit classical solutions carrying
representations of the Weyl group of G+++. We also identify the T and
S-dualities of superstrings and of the bosonic string with Weyl reflections and
outer automorphisms of well-chosen very extended algebras and we exhibit
specific features of the very extensions. We take these results as indication
that very extended algebras underlie symmetries of any consistent theory of
gravity and matter, and might encode basic information for the construction of
such theory.
","[{""version"":""v1"",""created"":""Thu, 24 Apr 2003 14:28:48 GMT""},{""version"":""v2"",""created"":""Tue, 9 Sep 2003 10:34:56 GMT""}]","2010-02-03"
