"math/0304354","Dan Abramovich","Dan Abramovich and Jiun C. Chen","Flops, flips and perverse point sheaves on threefold stacks","16 pages",,,,"math.AG",,"  We consider two cases of birational transformations of Q-Gorenstein
threefolds: the case of a terminal flop and the case of a Francia flip.
  In the first case we show that, if one replaces the threefolds by their
canonical covering stacks, the the flop coincides with the moduli stack of
perverse point sheaves. This adds to a result of Kawamata showing the derived
equivalence. Our construction has the drawback that the moduli space is defined
using a presentation of the stack.
  In the second case we show that, if one takes a Francia flip $X \to Y$ and
replaces $X$ by its canonical covering stack, then the flip coincides with a
version of Bridgelan'd moduli space of pewrverse point sheaves involving a new
perversity. This adds to another result of Kawamata. Again there is a drawback
- the proof of the result relies on the existence of the flip, in contrast with
the results of Bridgeland and of Chen where the relevant flop appears as an
outcome of the construction.
","[{""version"":""v1"",""created"":""Wed, 23 Apr 2003 16:14:24 GMT""}]","2007-05-23"
"math/0304355","Alan L. T. Paterson","Alan L. T. Paterson","Graph inverse semigroups, groupoids and their C*-algebras","17 pages","J. Operator Theory 48(2002), 645-662",,,"math.OA",,"  We develop a theory of graph C*-algebras using path groupoids and inverse
semigroups. Row finiteness is not assumed so that the theory applies to graphs
for which there are vertices emitting a countably infinite set of edges. We
show that the path groupoid is amenable, and give a groupoid proof of a recent
theorem of Szymanski characterizing when a graph C*-algebra is simple.
","[{""version"":""v1"",""created"":""Wed, 23 Apr 2003 16:27:44 GMT""}]","2007-05-23"
"math/0304356","Boris Rubinstein","Boris Y. Rubinstein and Leonid G. Fel","Restricted Partition Functions as Bernoulli and Euler Polynomials of
  Higher Order","15 pages, 2 figures, references added, submitted to The Ramanujan
  Journal",,,,"math.NT",,"  Explicit expressions for restricted partition function $W(s,{\bf d}^m)$ and
its quasiperiodic components $W_j(s,{\bf d}^m)$ (called {\em Sylvester waves})
for a set of positive integers ${\bf d}^m = \{d_1, d_2, ..., d_m\}$ are
derived. The formulas are represented in a form of a finite sum over Bernoulli
and Euler polynomials of higher order with periodic coefficients. A novel
recursive relation for the Sylvester waves is established. Application to
counting algebraically independent homogeneous polynomial invariants of the
finite groups is discussed.
","[{""version"":""v1"",""created"":""Wed, 23 Apr 2003 17:16:02 GMT""},{""version"":""v2"",""created"":""Fri, 16 May 2003 22:12:07 GMT""}]","2007-05-23"
"math/0304357","Gestur Olafsson","Mark Davidson and Gestur Olafsson","Differential Recursion Relations for Laguerre Functions on Hermitian
  Matrices",,,,,"math.RT math.FA",,"  In our previous papers \cite{doz1,doz2} we studied Laguerre functions and
polynomials on symmetric cones $\Omega=H/L$. The Laguerre functions
$\ell^{\nu}_{\mathbf{n}}$, $\mathbf{n}\in\mathbf{\Lambda}$, form an orthogonal
basis in $L^{2}(\Omega,d\mu_{\nu})^{L}$ and are related via the Laplace
transform to an orthogonal set in the representation space of a highest weight
representations $(\pi_{\nu}, \mathcal{H}_{\nu})$ of the automorphism group $G$
corresponding to a tube domain $T(\Omega)$. In this article we consider the
case where $\Omega$ is the space of positive definite Hermitian matrices and
$G=\mathrm{SU}(n,n)$. We describe the Lie algebraic realization of $\pi_{\nu}$
acting in $L^{2}(\Omega,d\mu_{\nu})$ and use that to determine explicit
differential equations and recurrence relations for the Laguerre functions.
","[{""version"":""v1"",""created"":""Wed, 23 Apr 2003 17:34:46 GMT""}]","2007-05-23"
"math/0304358","Gestur Olafsson","R. Fabec, G. Olafsson and A. Sengupta","Fock spaces corresponding to positive definite linear transformations",,,,,"math.FA",,"  Suppose $A$ is a positive real linear transformation on a finite dimensional
complex inner product space $V$. The reproducing kernel for the Fock space of
square integrable holomorphic functions on $V$ relative to the Gaussian measure
$d\mu_A(z)=\frac {\sqrt {\det A}} {\pi^n}e^{-{\rm Re}< Az,z>} dz$ is described
in terms of the holomorphic--antiholomorphic decomposition of the linear
operator $A$. Moreover, if $A$ commutes with a conjugation on $V$, then a
restriction mapping to the real vectors in $V$ is polarized to obtain a
Segal--Bargmann transform, which we also study in the Gaussian-measure setting.
","[{""version"":""v1"",""created"":""Wed, 23 Apr 2003 17:40:25 GMT""}]","2007-05-23"
"math/0304359","T. Kyle Petersen","N. Anzalone, J. Baldwin, I. Bronshtein, T. K. Petersen","A Reciprocity Theorem for Monomer-Dimer Coverings","13 pages, 12 figures, to appear in the proceedings of the Discrete
  Models for Complex Systems (DMCS) 2003 conference. (v2 - some minor changes)",,,,"math.CO",,"  The problem of counting monomer-dimer coverings of a lattice is a
longstanding problem in statistical mechanics. It has only been exactly solved
for the special case of dimer coverings in two dimensions. In earlier work,
Stanley proved a reciprocity principle governing the number $N(m,n)$ of dimer
coverings of an $m$ by $n$ rectangular grid (also known as perfect matchings),
where $m$ is fixed and $n$ is allowed to vary. As reinterpreted by Propp,
Stanley's result concerns the unique way of extending $N(m,n)$ to $n < 0$ so
that the resulting bi-infinite sequence, $N(m,n)$ for $n \in {Z}$, satisfies a
linear recurrence relation with constant coefficients. In particular, Stanley
shows that $N(m,n)$ is always an integer satisfying the relation $N(m,-2-n) =
\epsilon_{m,n}N(m,n)$ where $\epsilon_{m,n} = 1$ unless $m\equiv$ 2(mod 4) and
$n$ is odd, in which case $\epsilon_{m,n} = -1$. Furthermore, Propp's method is
applicable to higher-dimensional cases. This paper discusses similar
investigations of the numbers $M(m,n)$, of monomer-dimer coverings, or
equivalently (not necessarily perfect) matchings of an $m$ by $n$ rectangular
grid. We show that for each fixed $m$ there is a unique way of extending
$M(m,n)$ to $n < 0$ so that the resulting bi-infinite sequence, $M(m,n)$ for $n
\in {Z}$, satisfies a linear recurrence relation with constant coefficients. We
show that $M(m,n)$, a priori a rational number, is always an integer, using a
generalization of the combinatorial model offered by Propp. Lastly, we give a
new statement of reciprocity in terms of multivariate generating functions from
which Stanley's result follows.
","[{""version"":""v1"",""created"":""Wed, 23 Apr 2003 18:18:02 GMT""},{""version"":""v2"",""created"":""Tue, 20 May 2003 19:20:31 GMT""}]","2007-05-23"
"math/0304360","Gestur Olafsson","Gestur Olafsson","Continuous action of Lie groups on $\mathbb{R}^n$ and Frames",,,,,"math.FA",,"  Wavelet and frames have become a widely used tool in mathematics, physics,
and applied science during the last decade. In this article we discuss the
construction of frames for $L^2(\R^n)$ using the action of closed subgroups
$H\subset \mathrm{GL}(n,\mathbb{R})$ such that $H$ has an open orbit $\cO$ in
$\R^n$ under the action $(h,\omega)\mapsto (h^{-1})^T(\omega)$. If $H$ has the
form $ANR$, where $A$ is simply connected and abelian, $N$ contains a
co-compact discrete subgroup and $R$ is compact containing the stabilizer group
of $\omega\in\cO$ then we construct a frame for the space $L^2_{\cO}(\R^n)$ of
$L^2$-functions whose Fourier transform is supported in $\cO$. We apply this to
the case where $H^T=H$ and the stabilizer is a symmetric subgroup, a case
discussed for the continuous wavelet transform in a paper by Fabec and
Olafsson.
","[{""version"":""v1"",""created"":""Wed, 23 Apr 2003 18:52:20 GMT""}]","2007-05-23"
"math/0304361","Gestur Olafsson","Gestur Olafsson and Angela Pasquale","A Paley-Wiener theorem for the $\Theta$-spherical transform: the even
  multiplicity case",,,,,"math.FA",,"  The $\Theta$-spherical functions generalize the spherical functions on
Riemannian symmetric spaces and the spherical functions on non-compactly causal
symmetric spaces. In this article we consider the case of even multiplicity
functions. We construct a differential shift operator $D_m$ with smooth
coefficients which generates the $\Theta$-spherical functions from finite sums
of exponential functions. We then use this fact to prove a Paley-Wiener theorem
for the $\Theta$-spherical transfrom.
","[{""version"":""v1"",""created"":""Wed, 23 Apr 2003 18:58:19 GMT""}]","2007-05-23"
"math/0304362","Andrew Ranicki","Markus Banagl (Cincinnati) and Andrew Ranicki (Edinburgh)","Generalized Arf invariants in algebraic L-theory","90 pages, LATEX",,,,"math.AT",,"  The difference between the quadratic L-groups L_*(A) and the symmetric
L-groups L^*(A) of a ring with involution A is detected by generalized Arf
invariants. The special case A=Z[x] gives a complete set of invariants for the
Cappell UNil-groups UNil_*(Z;Z,Z) for the infinite dihedral group
D_{\infty}=Z_2*Z_2, extending the results of Connolly and Ranicki
(math.AT/0304016) and Connolly and Davis.
","[{""version"":""v1"",""created"":""Wed, 23 Apr 2003 19:46:38 GMT""}]","2007-05-23"
"math/0304363","Pramod N. Achar","Pramod N. Achar and Anne-Marie Aubert","Supports unipotents de faisceaux caracteres","24 pages",,,,"math.RT",,"  Soit G un groupe algebrique reductif sur la cloture algebrique d'un corps
fini F_q et defini sur ce dernier. L'existence du support unipotent d'un
caractere irreductible du groupe fini G(F_q), ou d'un faisceau caractere de G,
a ete etablie dans differents cas par Lusztig, Geck et Malle, et le second
auteur. Dans cet article, nous demontrons que toute classe unipotente sur
laquelle la restriction du faisceau caractere ou du caractere donne est non
nulle est contenue dans l'adherence de Zariski de son support unipotent. Pour
etablir ce resultat, nous etudions certaines representations des groupes de
Weyl, dites ""bien supportees"".
  Let G be a reductive algebraic group over the algebraic closure of a finite
field F_q that is defined over F_q. Under various conditions, Lusztig, Geck and
Malle, and the second author have shown that an irreducible character of the
finite group G(F_q), or a character sheaf on G, has a unipotent support. In
this paper, we show that every unipotent class on which a given character or
character sheaf has nonzero restriction is contained in the Zariski closure of
its unipotent support. This result is obtained by studying the class of
so-called ""well-supported"" representations of Weyl groups.
","[{""version"":""v1"",""created"":""Wed, 23 Apr 2003 21:34:22 GMT""}]","2009-09-29"
"math/0304364","G\'erard Ben Arous","G\'erard Ben-Arous","Aging and spin-glass dynamics",,"Proceedings of the ICM, Beijing 2002, vol. 3, 3--14",,,"math.PR",,"  We survey the recent mathematical results about aging in certain simple
disordered models. We start by the Bouchaud trap model. We then survey the
results obtained for simple models of spin-glass dynamics, like the REM (the
Random Energy Model, which is well approximated by the Bouchaud model on the
complete graph), then the spherical Sherrington-Kirkpatrick model. We will
insist on the differences in phenomenology for different types of aging in
different time scales and different models. This talk is based on joint works
with A.Bovier, J.Cerny, A.Dembo, V.Gayrard, A.Guionnet, as well as works by
C.Newman, R.Fontes, M.Isopi, D.Stein.
","[{""version"":""v1"",""created"":""Thu, 24 Apr 2003 02:59:02 GMT""}]","2007-05-23"
"math/0304365","Jean Bertoin","Jean Bertoin","Some aspects of additive coalescents",,"Proceedings of the ICM, Beijing 2002, vol. 3, 15--24",,,"math.PR",,"  We present some aspects of the so-called additive coalescence, with a focus
on its connections with random trees, Brownian excursion, certain bridges with
exchangeable increments, L\'evy processes, and sticky particle systems.
","[{""version"":""v1"",""created"":""Thu, 24 Apr 2003 02:59:30 GMT""}]","2007-05-23"
"math/0304366","Erwin Bolthausen","Erwin Bolthausen","Localization-delocalization phenomena for random interfaces",,"Proceedings of the ICM, Beijing 2002, vol. 3, 25--40",,,"math.PR",,"  We consider d-dimensional random surface models which for d=1 are the
standard (tied-down) random walks (considered as a random ``string''). In
higher dimensions, the one-dimensional (discrete) time parameter of the random
walk is replaced by the d-dimensional lattice \Z^d, or a finite subset of it.
The random surface is represented by real-valued random variables \phi_i, where
i is in \Z^d. A class of natural generalizations of the standard random walk
are gradient models whose laws are (formally) expressed as
  P(d\phi) = 1/Z \exp[-\sum_{|i-j|=1}V(\phi_i-\phi_j)] \prod_i d\phi_i,
  V:\R -> R^+ convex, and with some growth conditions. Such surfaces have been
  introduced in theoretical physics as (simplified) models for random
interfaces separating different phases. Of particular interest are
localization-delocalization phenomena, for instance for a surface interacting
with a wall by attracting or repulsive interactions, or both together. Another
example are so-called heteropolymers which have a noise-induced interaction.
Recently, there had been developments of new probabilistic tools for such
problems. Among them are: o Random walk representations of Helffer-Sj\""ostrand
type, o Multiscale analysis, o Connections with random trapping problems and
large deviations We give a survey of some of these developments.
","[{""version"":""v1"",""created"":""Thu, 24 Apr 2003 03:00:26 GMT""}]","2016-09-07"
"math/0304367","Mu-Fa Chen","Mu-Fa Chen","Ergodic convergence rates of Markov processes--eigenvalues, inequalities
  and ergodic theory",,"Proceedings of the ICM, Beijing 2002, vol. 3, 41--53",,,"math.PR",,"  This paper consists of four parts. In the first part, we explain what
eigenvalues we are interested in and show the difficulties of the study on the
first (non-trivial) eigenvalue through examples. In the second part, we present
some (dual) variational formulas and explicit bounds for the first eigenvalue
of Laplacian on Riemannian manifolds or Jacobi matrices (Markov chains). Here,
a probabilistic approach--the coupling methods is adopted. In the third part,
we introduce recent lower bounds of several basic inequalities; these are based
on a generalization of Cheeger's approach which comes from Riemannian geometry.
In the last part, a diagram of nine different types of ergodicity and a table
of explicit criteria for them are presented. These criteria are motivated by
the weighted Hardy inequality which comes from Harmonic analysis.
","[{""version"":""v1"",""created"":""Thu, 24 Apr 2003 03:00:46 GMT""}]","2007-05-23"
"math/0304368","Kurt Johansson","Kurt Johansson","Toeplitz determinants, random growth and determinantal processes",,"Proceedings of the ICM, Beijing 2002, vol. 3, 53--62",,,"math.PR",,"  We summarize some of the recent developments which link certain problems in
combinatorial theory related to random growth to random matrix theory.
","[{""version"":""v1"",""created"":""Thu, 24 Apr 2003 03:01:32 GMT""}]","2007-05-23"
"math/0304369","Gregory Lawler","Gregory Lawler","Conformal invariance, universality, and the dimension of the Brownian
  frontier",,"Proceedings of the ICM, Beijing 2002, vol. 3, 63--72",,,"math.PR",,"  This paper describes joint work with Oded Schramm and Wendelin Werner
establishing the values of the planar Brownian intersection exponents from
which one derives the Hausdorff dimension of certain exceptional sets of planar
Brownian motion. In particular, we proof a conjecture of Mandelbrot that the
dimension of the frontier is 4/3. The proof uses a universality principle for
conformally invariant measures and a new process, the stochastic Loewner
evolution ($SLE$), introduced by Schramm. These ideas can be used to study
other planar lattice models from statistical physics at criticality. I discuss
applications to critical percolation on the triangular lattice, loop-erased
random walk, and self-avoiding walk.
","[{""version"":""v1"",""created"":""Thu, 24 Apr 2003 03:02:00 GMT""}]","2007-05-23"
"math/0304370","Yuval Peres","Yuval Peres","Brownian intersections, cover times and thick points via trees",,"Proceedings of the ICM, Beijing 2002, vol. 3, 73--78",,,"math.PR",,"  There is a close connection between intersections of Brownian motion paths
and percolation on trees. Recently, ideas from probability on trees were an
important component of the multifractal analysis of Brownian occupation
measure, in joint work with A. Dembo, J. Rosen and O. Zeitouni. As a
consequence, we proved two conjectures about simple random walk in two
dimensions: The first, due to Erd\H{o}s and Taylor (1960), involves the number
of visits to the most visited lattice site in the first $n$ steps of the walk.
The second, due to Aldous (1989), concerns the number of steps it takes a
simple random walk to cover all points of the $n$ by $n$ lattice torus. The
goal of the lecture is to relate how methods from probability on trees can be
applied to random walks and Brownian motion in Euclidean space.
","[{""version"":""v1"",""created"":""Thu, 24 Apr 2003 03:02:22 GMT""}]","2007-05-23"
"math/0304371","Agoston Pisztora","\'Agoston Pisztora","Renormalization, large deviations and phase separation in Ising and
  percolation models",,"Proceedings of the ICM, Beijing 2002, vol. 3, 79--96",,,"math.PR",,"  Phase separation is a fairly common physical phenomenon with examples
including the formation of water droplets from humid air (fog, rain), the
separation of a crystalline structure from an isotropic material such as a
liquid or even the formation of the sizzling gas bubbles when a soda can is
opened. It was recognized long ago (at least on a phenomenological level) that
systems exhibiting several phases in equilibrium can be described with an
appropriate variational principle: the phases arrange themselves in such a way
that the energy associated with the phase boundaries is minimal. Typically this
leads to an almost deterministic behavior and the phase boundaries are fairly
regular. However, when looked at from a microscopic point of view, the system
consists of a bunch of erratically moving molecules with relatively strong
short-range interaction and the simplicity of the above macroscopic description
looks more than miraculous. Indeed, when starting from the molecular level,
there are many more questions to be asked and understood: which are the phases
which we will see? why do only those occur? why are the phase boundaries sharp?
how should we find (define) the energy associated with the interfaces? Only
then can we ask the question: why does the system minimize this energy? It is
only in the last decade that a mathematically satisfactory understanding of
this phenomenon has been achieved. The main goal of the talk is to present the
current state of affairs focusing thereby on results obtained in joint works
with Raphael Cerf. The connection to fields of mathematics other than
probability theory or statistical mechanics will be highlighted; namely, to
geometric measure theory and to the calculus of variations.
","[{""version"":""v1"",""created"":""Thu, 24 Apr 2003 03:03:06 GMT""}]","2007-05-23"
"math/0304372","T. P. Speed","T. P. Speed","Biological sequence analysis",,"Proceedings of the ICM, Beijing 2002, vol. 3, 97--106",,,"math.PR q-bio",,"  This talk will review a little over a decade's research on applying certain
stochastic models to biological sequence analysis. The models themselves have a
longer history, going back over 30 years, although many novel variants have
arisen since that time. The function of the models in biological sequence
analysis is to summarize the information concerning what is known as a motif or
a domain in bioinformatics, and to provide a tool for discovering instances of
that motif or domain in a separate sequence segment. We will introduce the
motif models in stages, beginning from very simple, non-stochastic versions,
progressively becoming more complex, until we reach modern profile HMMs for
motifs. A second example will come from gene finding using sequence data from
one or two species, where generalized HMMs or generalized pair HMMs have proved
to be very effective.
","[{""version"":""v1"",""created"":""Thu, 24 Apr 2003 03:04:21 GMT""}]","2007-05-23"
"math/0304373","A. Yu. Zaitsev","A. Yu. Zaitsev","Estimates for the strong approximation in multidimensional central limit
  theorem",,"Proceedings of the ICM, Beijing 2002, vol. 3, 107--116",,,"math.PR",,"  In a recent paper the author obtained optimal bounds for the strong Gaussian
approximation of sums of independent $\R^d$-valued random vectors with finite
exponential moments. The results may be considered as generalizations of
well-known results of Koml\'os--Major--Tusn\'ady and Sakhanenko. The dependence
of constants on the dimension $d$ and on distributions of summands is given
explicitly. Some related problems are discussed.
","[{""version"":""v1"",""created"":""Thu, 24 Apr 2003 03:04:49 GMT""}]","2007-05-23"
"math/0304374","Ofer Zeitouni","Ofer Zeitouni","Random walks in random environments",,"Proceedings of the ICM, Beijing 2002, vol. 3, 117--130",,,"math.PR",,"  Random walks in random environments (RWRE's) have been a source of surprising
phenomena and challenging problems since they began to be studied in the 70's.
Hitting times and, more recently, certain regeneration structures, have played
a major role in our understanding of RWRE's. We review these and provide some
hints on current research directions and challenges.
","[{""version"":""v1"",""created"":""Thu, 24 Apr 2003 03:05:16 GMT""}]","2007-05-23"
"math/0304375","Mikhail Khovanov","Mikhail Khovanov","sl(3) link homology","Published by Algebraic and Geometric Topology at
  http://www.maths.warwick.ac.uk/agt/AGTVol4/agt-4-45.abs.html","Algebr. Geom. Topol. 4 (2004) 1045-1081","10.2140/agt.2004.4.1045",,"math.QA math.RT",,"  We define a bigraded homology theory whose Euler characteristic is the
quantum sl(3) link invariant.
","[{""version"":""v1"",""created"":""Thu, 24 Apr 2003 03:46:07 GMT""},{""version"":""v2"",""created"":""Sat, 27 Nov 2004 19:33:03 GMT""}]","2014-10-01"
"math/0304376","Helmut Voelklein","K. Magaard, S. Shpectorov and Helmut Voelklein","A GAP package for braid orbit computation, and applications",,,,,"math.GR math.AG",,"  Let G be a finite group. By Riemann's Existence Theorem, braid orbits of
generating systems of G with product 1 correspond to irreducible families of
covers of the Riemann sphere with monodromy group G. Thus many problems on
algebraic curves require the computation of braid orbits. In this paper we
describe an implementation of this computation. We discuss several
applications, including the classification of irreducible families of
indecomposable rational functions with exceptional monodromy group.
","[{""version"":""v1"",""created"":""Thu, 24 Apr 2003 06:37:40 GMT""}]","2007-05-23"
"math/0304377","Yoshihiro Onishi","Yoshihiro \^Onishi","Theory of Generalized Bernoulli-Hurwitz Numbers in the Algebraic
  Functions of Cyclotomic Type",,,,,"math.NT",,"  In this paper we announce some results obtained for certain algebraic
functions, which we call of cyclotomic type. The main results properly resemble
von Staudt-Clausen's theorem and Kummer's congruence for the Bernoulli numbers,
and such theorems for the Hurwitz numbers.
","[{""version"":""v1"",""created"":""Thu, 24 Apr 2003 08:12:44 GMT""},{""version"":""v2"",""created"":""Wed, 30 Apr 2003 03:20:02 GMT""}]","2007-05-23"
"math/0304378","Joerg Schuermann","Joerg Schuermann","On the dimension formula for the hyperfunction solutions of some
  holonomic D-modules","8 pages, no figures, final version, to appear in Publ. RIMS",,,,"math.CV math.AP",,"  In this short note we improve a dimension formula of Takeuchi for the
dimension of the hyperfunction solutions of some holonomic D-modules. Besides
the constructibility result and local index formula of Kashiwara for the
holomorphic solution complex, we only use a vanishing theorem of Lebeau
together with a simple calculation in terms of constructible functions.
","[{""version"":""v1"",""created"":""Thu, 24 Apr 2003 09:00:32 GMT""},{""version"":""v2"",""created"":""Wed, 9 Jul 2003 12:17:14 GMT""},{""version"":""v3"",""created"":""Wed, 15 Dec 2004 09:28:43 GMT""}]","2007-05-23"
"math/0304379","Bhupinder Singh Anand","Bhupinder Singh Anand","Can Turing machines capture everything we can compute?","v2; introduced standardised ACI compliant notation for citations; 13
  pages; an HTML version is available at
  http://alixcomsi.com/Can_Turing_machines.htm",,,,"math.GM",,"  If we define classical foundational concepts constructively, and introduce
non-algorithmic effective methods into classical mathematics, then we can
bridge the chasm between truth and provability, and define computational
methods that are not Turing-computable.
","[{""version"":""v1"",""created"":""Thu, 24 Apr 2003 10:17:43 GMT""},{""version"":""v2"",""created"":""Sat, 17 May 2003 11:16:43 GMT""}]","2007-05-23"
