"astro-ph/0303215","William T. Reach","Jeonghee Rho, Stephen P. Reynolds, William T. Reach, Tom H. Jarrett,
  and Glenn E. Allen","Near-Infrared Synchrotron Emission from Cas A","accepted by ApJ","Astrophys.J. 592 (2003) 299-310","10.1086/375564",,"astro-ph",,"  High energy observations of Cas A suggested the presence of synchrotron
radiation, implying acceleration of cosmic rays by young supernova remnants. We
detect synchrotron emission from Cas A in the near-infrared using Two Micron
All Sky Survey (2MASS) and Palomar 200 inch PFIRCAM observations. The remnant
is detected in J, H, and Ks bands, with Ks band brightest and J faint. In the J
and H bands, bright [Fe II] lines (1.24um and 1.64um) are detected
spectroscopically. The Palomar observations include Ks continuum, narrow-band
1.64um (centered on [Fe II]) and 2.12um (centered on H2(1-0)) images. While the
narrow-band 1.64um image shows filamentary and knotty structures, similar to
the optical image, the Ks image shows a relatively smooth, diffuse shell,
remarkably similar to the radio image. The broad-band near-infrared fluxes of
Cas A are generally consistent with, but a few tens of percent higher than, an
extrapolation of the radio fluxes. The hardening to higher frequencies is
possibly due to nonlinear shock acceleration and/or spectral index variation
across the remnant. We show evidence of spectral index variation. The presence
of near-infrared synchrotron radiation requires the roll-off frequency to be
higher than 1.5e14 Hz, implying that electrons are accelerated to energies of
at least 0.2 TeV. The morphological similarity in diffuse emission between the
radio and Ks band images implies that synchrotron losses are not dominant. Our
observations show unambiguous evidence that the near-infrared Ks band emission
of Cas A is from synchrotron emission by accelerated cosmic-ray electrons.
","[{""version"":""v1"",""created"":""Tue, 11 Mar 2003 16:51:36 GMT""}]","2009-11-07"
"astro-ph/0303228","Claudia Quercellini","Luca Amendola & Claudia Quercellini (INAF-Osservatorio Astronomico di
  Roma and Universita' di Roma Tor Vergata)","Tracking and coupled dark energy as seen by WMAP","14 pages; to be submitted to Phys. Rev. D","Phys.Rev.D68:023514,2003","10.1103/PhysRevD.68.023514",,"astro-ph",,"  The satellite experiment WMAP has produced for the first time a
high-coverage, high resolution survey of the microwave sky, releasing publicly
available data that are likely to remain unrivalled for years to come. Here we
compare the WMAP temperature power spectrum, along with an exhautive
compilation of previous experiments, to models of dark energy that allow for a
tracking epoch at the present, deriving updated bounds on the dark energy
equation of state and the other cosmological parameters. Moreover, we
complement the analysis by including a coupling of the dark energy to dark
matter. The main results are: a) the WMAP data alone constrains the equation of
state of tracking dark energy to be w_\phi<-0.67(-0.49) to 68%(95%) (confining
the analysis to w_\phi>-1), which implies for an inverse power law potential an
exponent \alpha<0.99(2.08); b) the dimensionless coupling to dark matter is
|\beta|<0.07(0.13). Including the results from the supernovae Ia further
constrains the dark energy equation of state.
","[{""version"":""v1"",""created"":""Tue, 11 Mar 2003 18:30:30 GMT""},{""version"":""v2"",""created"":""Tue, 11 Mar 2003 23:45:46 GMT""}]","2011-05-05"
"astro-ph/0303229","Patrick Cote","Patrick Cote (Rutgers), Dean E. McLaughlin (STScI), Judith G. Cohen
  (CalTech), John P. Blakeslee (Johns Hopkins)","Dynamics of the Globular Cluster System Associated with M49 (NGC4472):
  Cluster Orbital Properties and the Distribution of Dark Matter","63 pages, 21 postscript figures. Accepted for publication in the
  Astrophysical Journal","Astrophys.J. 591 (2003) 850-877","10.1086/375488",,"astro-ph",,"  We have measured radial velocities for 196 globular clusters (GCs) around
M49, the brightest member of the Virgo Cluster. Combined with published data,
they bring the total number of GCs with measured radial velocities in this
galaxy to 263. Using this sample, we extract the projected kinematics of the
full sample of GCs, and of the separate metal-poor and metal-rich subsamples.
In agreement with previous results for the global GC kinematics based on
smaller datasets, we find that the GC system as a whole exhibits a slow overall
rotation that is due almost entirely to a net rotation of the metal-poor GC
subsystem alone. In a spatial average, the metal-rich GCs shows essentially no
rotation. We note, however, the presence of a well defined grouping of 10
metal-rich GCs that are located at opposite poles along the galaxy's major axis
and which appear to be rotating at nearly 300 km/s about the minor axis. This
grouping may be the relic of a past merger or accretion event. Using a
Jeans-equation analysis, we show that the GC radial velocities alone point
unequivocally (and independently of X-ray observations) to the need for a
massive dark halo associated with M49 and the Virgo B subcluster around it. We
also show that the GC system as a whole is consistent with an almost perfectly
isotropic velocity ellipsoid. M49 is now the second elliptical galaxy (after
M87) for which we have been able to demonstrate velocity isotropy in the
globular cluster system overall, when no division based on GC color or
metallicity is attempted. Thus, the data for these two galaxies lend support
the general assumption of isotropy when using GC kinematics to study the
dark-matter distribution in early-type galaxies. (ABRIDGED)
","[{""version"":""v1"",""created"":""Tue, 11 Mar 2003 17:00:20 GMT""}]","2009-11-07"
"astro-ph/0303230","Luigi Bedin","L. R. Bedin (1), G. Piotto (1), I. R. King (2), J. Anderson (2) ((1)
  Universita` di Padova, (2) UC Berkeley.)","HST astrometry: the Galactic constant Theta_0/R_0","2 pages, 1 figure, SAIt Padova, 10-12 aprile 2002","Mem.Soc.Ast.It. 74 (2002) 10-12",,,"astro-ph",,"  From multi-epoch WFPC2/HST observations we present astrometric measurements
of the absolute motion of the bulge stars. The presence of an extragalactic
point-source candidate allows us to measure the difference between the Oort
constants, A-B = Theta_0/R_0. We find: Theta_0/R_0 = 27.4 +/- 1.8 km/s/kpc.
","[{""version"":""v1"",""created"":""Tue, 11 Mar 2003 17:43:57 GMT""}]","2007-05-23"
"astro-ph/0303231","Hong-Guang Wang","G.J. Qiao, K.J. Lee, H.G. Wang, R.X. Xu (Peking University, Beijing,
  China)","A Joint model for radio and gamma-ray emission from pulsars","5 pages, 2 figure, IAU Symposium No.214 on ""High Energy Processes and
  Phenomena in Astrophysics"", August, 2002, Suzhou, China, in press",,,,"astro-ph",,"  Although pulsars can radiate electromagnetic wave from radio to gamma ray
bands, we still have no a united model to understand the multi-band emission.
In this paper the effort for a joint model is presented. The inverse Compton
scattering (ICS) and a second acceleration process near the null charge surface
are involved to account for the radio and the gama-ray emission, respectively.
Various kind of pulse profiles and other observational properties can be
reproduced.
","[{""version"":""v1"",""created"":""Tue, 11 Mar 2003 17:58:46 GMT""}]","2007-05-23"
"astro-ph/0303232","Hong-Guang Wang","G.J. Qiao, K.J. Lee, H.G. Wang, R.X. Xu","Radio and gamma-ray emission from pulsars","4 pages, 1 figure, in the meeting on ""Radio Pulsars"", Crete 2002, in
  press",,,,"astro-ph",,"  The radiation of pulsars have been observed for many years. A few pulsars are
discovered to have both radio and gamma-ray emission. Many models on pulsar
radiation have been developed, but so far we are still lacking an elaborate
model which can explain the emission from radio to gamma-rays in detail. In
this paper we present a joint model for radio and gamma-ray emission, in which
both the dominate emission mechanisms are inverse Compton scattering. The pulse
profiles at radio and gamma-ray bands are reproduced for the Crab-like,
Vela-like and Geminga-like pulsars, in good agreement with observations.
","[{""version"":""v1"",""created"":""Tue, 11 Mar 2003 18:12:29 GMT""}]","2009-09-29"
"astro-ph/0303233","Daniele Fargion","D. Fargion, M.Khlopov, R.Konoplich, P.G. De Sanctis Lucentini, M. De
  Santis, B. Mele","Ultra High Energy Particle Astronomy, Neutrino Masses and Tau Airshowers","54 pages, 33 figures, 5 Tables; Updated curves and detailed threshold
  for EUSO","Recent Res.Devel.Astrophys., 1(2003): 395-454: ISBN: 81-271-0004-8",,,"astro-ph",,"  Ultra High Energy (UHE) neutrino Astronomy and relic Neutrino masses may play
a key role in solving the Ultra High Energy Cosmic Ray (UHECR) puzzle within
the Z-Showering model. Tau air-shower originated by UHE neutrino in matter may
probe and amplify this expected UHE neutrino Astronomy. The discover of
upcoming and horizontal tau air-showers (UPTAUs, HORTAUs), born by UHE, nu_tau
interacting inside mount chains or along Earth Crust crown masses at the
Horizons edges, will greatly amplify the single UHE nu_tau track. Observing
UPTAUs and HORTAUs along their line of showering, from higher balloons or
satellites, at Greisen-Zatsepin-Kuzmin (GZK) energies above 10^19 eV, may test
a calorimeter mass exceeding 150 km^3 (water equivalent). Observing Horizontal
Shower by EUSO will probe even larger ring areas generated in huge terrestrial
volumes larger than 2360 km^3. These highest GZK energies nu_tau astronomy are
well tuned to test the needed abundant nu fluence in GZK Z-Showering model
where ZeV (above 10^21 eV) Ultra High Energy neutrinos hit on relic light (near
0.1-3 eV masses) anti-neutrinos, in hot dark matter halos, creating boosted UHE
Z bosons. Their nucleon decay in flight may born secondaries observed on Earth
atmosphere as UHECR. The wide EUSO acceptance may test easily Z-showering
fluxes as well as GZK neutrinos at their minimal granted fluence. The rare (78)
observed upcoming terrestrial gamma flashes observed by BATSE satellite during
last decade may be also be traces of such UPTAUs and HORTAUs.
","[{""version"":""v1"",""created"":""Tue, 11 Mar 2003 18:23:39 GMT""},{""version"":""v2"",""created"":""Tue, 19 Aug 2003 18:12:48 GMT""}]","2009-09-29"
"astro-ph/0303234","Bacham E. reddy","Bruce J. Hrivnak (Valparaiso Univerisity), Bacham E. Reddy (Univ. of
  Texas)","An Abundance Analysis of the New Carbon-Rich Proto-Planetary Nebula IRAS
  06530$-$0213","Scheduled for publication in ApJ,590, 20 June 2003 issue","Astrophys.J. 590 (2003) 20","10.1086/375191",,"astro-ph",,"  In this paper, we present a study of the proto-planetary nebula (PPN) IRAS
06530$-$0213 based on low- and high-resolution spectra. The low-resolution
spectrum shows that star is an F5 supergiant with molecular C$_{2}$ and C$_{3}$
and enhanced s-process lines. From the high-resolution spectra, the following
atmospheric parameters were determined: $T_{\rm eff}$ = 6900 K, log$g$ = 1.0
and $\xi_{\rm t}$ = 4.5. Abundance analysis shows that IRAS 06530$-$0213 is
metal-poor ([Fe/H]=$-$0.9) and overabundant in carbon ([C/Fe]=1.3), nitrogen
([N/Fe]=1.0), and s-process elements ([s-process/Fe]=1.9), indicating AGB
nucleosynthesis and deep convective mixing. From the analysis of circumstellar
C$_{2}$ and CN molecular bands in the spectrum of IRAS 06530$-$0213, an
envelope expansion velocity of V$_{\rm exp}$=~14$\pm1$ km s$^{-1}$ was
determined, a typical value for post-AGB stars. Also typical of PPNs is the
double-peaked spectral energy distribution. The properties of both the
photosphere and circumstellar envelope suggest that IRAS 06530$-$0213 is
unambiguously a low-mass, carbon-rich PPN. For comparison purposes, new,
high-resolution spectra of the well-known PPN HD 56126 (IRAS 07134+1005) was
also analyzed and compared with previous results.
","[{""version"":""v1"",""created"":""Tue, 11 Mar 2003 19:24:13 GMT""}]","2009-11-07"
"astro-ph/0303235","Sergey Silich","S. Silich, G. Tenorio-Tagle and C. Munoz-Tunon","On the rapidly cooling interior of supergalactic winds","7 pages, 6 figures, Accepted for publication in The Astrophysical
  Journal","Astrophys.J. 590 (2003) 791-796","10.1086/375133",,"astro-ph",,"  The steady state numerical solution and two dimensional hydrodynamic
calculations of supergalactic winds generated by super star clusters are
presented. Two possible regimes: quasi-adiabatic and strongly radiative are
thoroughly discussed.
  It is shown that superwinds driven by compact and powerful starbursts undergo
catastrophic cooling close to their sources, and establish a temperature
distribution radically different from those obtained in the adiabatic solution.
At the same time, both velocity and density radial distributions remain almost
unchanged given the speed of the rapidly diverging flow.
  The rapid fall in temperature as a function of radius reduces the size of the
zone radiating in X-rays and decreases the superwind X-ray luminosity. At the
same time, cooling brings the 10$^4$ K boundary closer to the wind center, and
promotes the establishment of an extended ionized fast moving envelope. This
should show up as a weak and broad ($\sim 1000$ km s$^{-1}$) line emission
component at the base of the much narrower line caused by the central HII
region.
","[{""version"":""v1"",""created"":""Tue, 11 Mar 2003 19:45:27 GMT""}]","2009-11-07"
"astro-ph/0303236","Renyue Cen","Renyue Cen (Princeton University Observatory)","Implications of WMAP Observations On the Population III Star Formation
  Processes","a numerical error corrected, conclusions strengthened, submitted to
  ApJ Letters, 13 pages","Astrophys.J. 591 (2003) L5-L8","10.1086/377068",,"astro-ph",,"  In an earlier paper (Cen 2003) we pointed out the strong likelihood for the
universal reionization to occur twice, giving rise to a larger Thomson optical
depth. Here we perform a more focused analysis of the Thomson optical depth in
light of the WMAP observations. While the current uncertainties on the observed
Thomson optical depth are still relatively large, with tau_e=0.17+-0.04 (68%)
(Kogut et al 2003), important implications on Pop III star formation processes
at high redshift can already be inferred. We are able to draw four conclusions:
(1) in the absence of a top-heavy initial stellar mass function (IMF) for Pop
III metal-free stars and without a dramatic upturn in the star formation
efficiency and ionizing photon escape fraction at high redshift (z>6), we find
tau_e =< 0.09; (2) with a top-heavy IMF for the Pop III metal-free stars and
plausible star formation efficiency and ionizing photon escape fraction, it is
expected that tau_e =< 0.12; (3) it is possible to reach tau_e = 0.15, if the
metal enrichment efficiency of the intergalactic medium by Pop III stars is
very low thus Pop III era is prolonged; (4) to reach tau_e >= 0.17 requires
either of the following two conditions: the cosmological model power index n is
positively tilted to n >= 1.03, Pop III star formation in minihalos with
molecular hydrogen cooling has an efficiency c_*(H_2,III)>0.01 (with ionizing
photon escape fraction greater than 30%). If the current observed value of
Thomson optical depth withstands future data, we will have strong observational
evidence that Pop III stars are massive and their formation efficiency may be
much higher than current theoretical works suggest. Alternatively, there may be
unknown, non-stellar ionizing sources at very high redshift.
","[{""version"":""v1"",""created"":""Tue, 11 Mar 2003 20:26:43 GMT""},{""version"":""v2"",""created"":""Thu, 13 Mar 2003 17:03:57 GMT""}]","2009-11-07"
"astro-ph/0303237","Dieter Breitschwerdt","Dieter Breitschwerdt","Self-consistent Modelling of the interstellar medium","11 pages, 11 figures, Invited Talk on the JENAM 2002 Workshop ""From
  Observations to Self-Consistent Modelling of the ISM in Galaxies"", Kluwer
  Academic Publishers (in press); Figure 1 (right) replaced","Astrophys.Space Sci. 289 (2004) 489-498","10.1023/B:ASTR.0000014982.31688.bf",,"astro-ph",,"  The dynamical evolution of hot optically thin plasmas in the ISM crucially
depends on the heating and cooling processes. It is essential to realize that
all physical processes that contribute operate on different time scales. In
particular detailed balancing is often violated since the statistically inverse
process of e.g. collisional ionization is recombination of an ion with two
electrons, which as a three-body collision is usually dominated by radiative
recombination, causing a departure from collisional ionization equilibrium. On
top of these differences in atomic time scales, hot plasmas are often in a
dynamical state, thereby introducing another time scale, which can be the
shortest one. The non-equilibrium effects will be illustrated and discussed in
the case of galactic outflows. It will be shown, that spectral analyses of
X-ray data of edge-on galaxies show a clear signature in the form of
""multi-temperature"" halos, which can most naturally be explained by the
""freezing-in"" of highly ionized species in the outflow, which contribute to the
overall spectrum by DELAYED RECOMBINATION. This naturally leads to a
non-equilibrium cooling function, which modifies the dynamics, which in turn
changes the plasma densities and thermal energy budget, thus feeding back on
the ionization structure. Therefore SELF-CONSISTENT modelling is needed.
","[{""version"":""v1"",""created"":""Tue, 11 Mar 2003 20:29:39 GMT""},{""version"":""v2"",""created"":""Wed, 12 Mar 2003 21:08:16 GMT""}]","2009-11-07"
"astro-ph/0303238","Dr. Mario Rabinowitz","Mario Rabinowitz","Dark matter candidates: black holes and gravitationally bound black hole
  atoms in n-space","PACS numbers: 04.70.s, 04.30,-w, 04.60.-m, 04.50.th 19 pages, 0
  figures 22 pages",,,,"astro-ph",,"  A comparison is made of a range of proposals to include free and bound black
holes as either a small component or the dominant constituent of dark matter.
The hypothesis that dark matter consists of atomic gravitationally bound
primordial black holes is closely examined in 3-space, as well as in n-space.
It is demonstrated that for dimensions greater than 3, stable gravitational or
electrostatic atoms cannot be bound by energy constraints. The total number of
degrees of freedom of a d-dimensional body in n-space is derived so that
equipartition of energy may be applied in the early universe. Blackbody and
Hawking radiation are generalized to n-space. A promising new approach to black
hole entropy is presented.
","[{""version"":""v1"",""created"":""Tue, 11 Mar 2003 20:55:02 GMT""},{""version"":""v2"",""created"":""Mon, 7 Mar 2005 21:59:42 GMT""}]","2007-05-23"
"astro-ph/0303239","Lucio Mayer","Lucio Mayer (University of Zurich), James Wadsley (McMaster
  University)","The formation and evolution of bars in low surface brightness galaxies
  with cold dark matter halos","16 pages, 14 Figures, submitted to MNRAS","Mon.Not.Roy.Astron.Soc. 347 (2004) 277","10.1111/j.1365-2966.2004.07202.x",,"astro-ph",,"  We perform several high resolution N-Body/SPH simulations of low surface
brightness galaxies (LSBs) embedded in cold dark matter halos to study how
likely is bar formation in such systems. The behavior of various collisionless
galaxy models is studied both in isolation and in the presence of a large
perturbing satellite. We also consider models with a dominant gaseous component
in the disk. We find that in general bar formation requires disk masses at
least a factor of 2 higher than those inferred for LSBs under the assumption of
a normal stellar mass-to-light ratio. Low surface density stellar disks
contributing less than 10% of the total virial mass are stable within NFW halos
spanning a range of concentrations. However, a purely gaseous disk can form a
bar even for quite low masses and for realistic temperatures provided that
cooling is very efficient (we adopt an isothermal equation of state) and that
the halo has a very low concentration, c < 5. The bars that form in these LSB
models are shorter than the typical halo scale radius - their overall angular
momentum content might be too low to affect significantly the inner dark halo
structure. Once formed, all the bars evolve into bulge-like structures in a few
Gyr and can excite spiral patterns in the surrounding disk component. The
recently discovered red LSBs show significant non-axisymmetric structure and
bulge-like components and share many of their structural properties with the
final states of our LSB models with massive disks. Our results imply that a
bulge-like component must be present in any low surface brightness galaxy that
ever went bar unstable in the past.
","[{""version"":""v1"",""created"":""Tue, 11 Mar 2003 22:03:14 GMT""}]","2009-11-07"
"astro-ph/0303240","Andrey Kravtsov","Andrey V. Kravtsov (CfCP, U.Chicago)","On the Origin of the Global Schmidt Law of Star Formation","submitted to ApJL, 5 pages, 3 figures, LaTeX (uses emulateapj5.sty)","Astrophys.J.590:L1-L4,2003","10.1086/376674",,"astro-ph",,"  One of the most puzzling properties of observed galaxies is the universality
of the empirical correlation between the star formation rate and average gas
surface density on kiloparsec scales (the Schmidt law). In this study I present
results of self-consistent cosmological simulations of high-redshift galaxy
formation that reproduce the Schmidt law naturally, without assuming it, and
provide some clues to this puzzle. The simulations incorporate the main
physical processes critical to various aspects of galaxy formation and have a
dynamic range high enough to identify individual star forming regions. The
results indicate that the global Schmidt law is a manifestation of the overall
density distribution of the interstellar medium (ISM). In particular, the
density probability distribution function (PDF) in the simulated disks is
similar to that observed in recent state-of-the-art modeling of the turbulent
ISM and has a well-defined generic shape. The shape of the PDF in a given
region of the disk depends on the local average surface density Sigma_g. The
dependence is such that the fraction of gas mass in the high-density tail of
the distribution scales as Sigma_g^{n-1} with n~1.4, which gives rise to the
Schmidt-like correlation. The high-density tail of the PDF is remarkably
insensitive to the inclusion of feedback and details of the cooling and heating
processes. This indicates that the global star formation rate is determined by
the supersonic turbulence driven by gravitational instabilities on large
scales, rather than stellar feedback or thermal instabilities on small scales.
","[{""version"":""v1"",""created"":""Tue, 11 Mar 2003 23:08:16 GMT""}]","2011-05-12"
"astro-ph/0303241","Jean-Pierre De Villiers","Jean-Pierre De Villiers and John F. Hawley","Global General Relativistic Magnetohydrodynamic Simulations of Accretion
  Tori","Submitted to ApJ. 30 pages, 21 figures. Animations and
  high-resolution version of figures available at
  http://www.astro.virginia.edu/~jd5v","Astrophys.J. 592 (2003) 1060-1077","10.1086/375866",,"astro-ph",,"  This paper presents an initial survey of the properties of accretion flows in
the Kerr metric from three-dimensional, general relativistic
magnetohydrodynamic simulations of accretion tori. We consider three fiducial
models of tori around rotating, both prograde and retrograde, and nonrotating
black holes; these three fiducial models are also contrasted with axisymmetric
simulations and a pseudo-Newtonian simulation with equivalent initial
conditions to delineate the limitations of these approximations.
","[{""version"":""v1"",""created"":""Tue, 11 Mar 2003 21:11:25 GMT""}]","2009-11-07"
"astro-ph/0303242","Andrei Gruzinov","Andrei Gruzinov (NYU)","Self-similarity of the Third Type in the Strong Explosion Problem","4 pages, 3 figures",,,,"astro-ph",,"  Propagation of a blast wave due to strong explosion in the center of a
power-law-density ($\rho \propto r^{-\alpha}$) spherically symmetric atmosphere
is studied. For adiabatic index of 5/3, the solution was known to be
self-similar, (of type I) for $\alpha <3$, self-similar (of type II) for
$\alpha >3.26$, and unknown in between. We find a self-similar solution for
$3<\alpha <3.26$, and give a (tentative) numerical proof that this solution is
indeed an asymptotic of the strong explosion. This self-similar solution is
neither of type I (dimensional analysis does not work), nor of type II (the
index of the solution is known without solving an eigenvalue problem).
","[{""version"":""v1"",""created"":""Tue, 11 Mar 2003 22:38:53 GMT""}]","2007-05-23"
"astro-ph/0303243","James Schombert","K. Rakos (UVienna), J. Schombert (UOregon), A. Odell (Northern Arizona
  Univ)","Global Metallicities From Globulars Through To Elliptical Galaxies","4 pages AAS LaTeX, 1 figures, poster paper for Clusters of Galaxies:
  Probes of Cosmological Structure and Galaxy Evolution, Carnegie Observatories
  Symposium",,,,"astro-ph",,"  We present narrow band data on dwarf ellipticals in nearby (Virgo, Fornax)
and intermediate redshift clusters (A2125, A2218) in order to study their mean
age and metallicities. In all four clusters, nucleated dwarf ellipticals
display colors that place them on the high metallicity end of the Milky Way
globular cluster sequence. Normal dwarf ellipticals display colors, and
resulting metallicities and ages, that align them with bright ellipticals. This
suggests that dE,N's may be the ancestors to the red GC population found around
many elliptical galaxies.
","[{""version"":""v1"",""created"":""Tue, 11 Mar 2003 22:46:51 GMT""}]","2007-05-23"
