"astro-ph/0303261","Liliya L. R. Williams","Prasenjit Saha (QMW London), Liliya L.R. Williams (U Minnesota)","Qualitative Theory for Lensed QSOs","26 pages, incl. 15 figs; accepted to AJ; java applet available at
  http://ankh-morpork.maths.qmw.ac.uk/~saha/astron/lens/",,"10.1086/375204",,"astro-ph",,"  We show that some characteristics of multiply-imaged QSO systems are very
model-independent and can be deduced accurately by simply scrutinizing the
relative positions of images and galaxy-lens center. These include the
time-ordering of the images, the orientation of the lens potential, and the
rough morphology of any ring. Other features can differ considerably between
specific models; H_0 is an example. Surprisingly, properties inherited from a
circularly symmetric lens system are model-dependent, whereas features that
arise from the breaking of circular symmetry are model-independent. We first
develop these results from some abstract geometrical ideas, then illustrate
them for some well-known systems (the quads Q2237+030, H1413+117,
HST14113+5211, PG1115+080, MG0414+0534, B1608+656, B1422+231, and RXJ0911+0551,
and the ten-image system B1933+507), and finally remark on two systems
(B1359+154 and PMN J0134-0931) where the lens properties are more complex. We
also introduce a Java applet which produces simple lens systems, and helps
further illustrate the concepts.
","[{""version"":""v1"",""created"":""Wed, 12 Mar 2003 15:46:34 GMT""}]","2009-11-07"
"cond-mat/0303182","Sidney Redner","P. L. Krapivsky and S. Redner","Dynamics of Majority Rule","4 pages, 3 figures, 2-column revtex4 format; annoying typo fixed in
  Eq.(1); a similar typo fixed in Eq.(6) and some references updates","Phys. Rev. Lett. 90, 238701 (2003)","10.1103/PhysRevLett.90.238701",,"cond-mat.stat-mech math.PR",,"  We introduce a 2-state opinion dynamics model where agents evolve by majority
rule. In each update, a group of agents is specified whose members then all
adopt the local majority state. In the mean-field limit, where a group consists
of randomly-selected agents, consensus is reached in a time that scales ln N,
where N is the number of agents. On finite-dimensional lattices, where a group
is a contiguous cluster, the consensus time fluctuates strongly between
realizations and grows as a dimension-dependent power of N. The upper critical
dimension appears to be larger than 4. The final opinion always equals that of
the initial majority except in one dimension.
","[{""version"":""v1"",""created"":""Tue, 11 Mar 2003 17:47:12 GMT""},{""version"":""v2"",""created"":""Fri, 28 Mar 2003 03:33:44 GMT""},{""version"":""v3"",""created"":""Mon, 9 Jun 2003 20:03:02 GMT""}]","2009-11-10"
"cond-mat/0303199","Yuri Sushko","Yuri V. Sushko, Bruno DeHarak, Gang Cao, G. Shaw, D. K. Powell, and J.
  W. Brill","Effects of hydrostatic pressure on the magnetic susceptibility of
  ruthenium oxide Sr3Ru2O7: Evidence for pressure-enhanced antiferromagnetic
  instability","11 pages, 4 figures",,"10.1016/j.ssc.2004.02.010",,"cond-mat.mtrl-sci cond-mat.str-el",,"  Hydrostatic pressure effects on the temperature- and magnetic field
dependencies of the in-plane and out-of-plane magnetization of the bi-layered
perovskite Sr3Ru2O7 have been studied by SQUID magnetometer measurements under
a hydrostatic helium-gas pressure. The anomalously enhanced low-temperature
value of the paramagnetic susceptibility has been found to systematically
decrease with increasing pressure. The effect is accompanied by an increase of
the temperature Tmax of a pronounced peak of susceptibility. Thus,
magnetization measurements under hydrostatic pressure reveal that the lattice
contraction in the structure of Sr3Ru2O7 promotes antiferromagnetism and not
ferromagnetism, contrary to the previous beliefs. The effects can be explained
by the enhancement of the inter-bi-layer antiferromagnetic spin coupling,
driven by the shortening of the superexchange path, and suppression, due to the
band-broadening effect, of competing itinerant ferromagnetic correlations.
","[{""version"":""v1"",""created"":""Tue, 11 Mar 2003 16:51:22 GMT""}]","2009-11-10"
"cond-mat/0303201","Eddy Yusuf","Eddy Yusuf and Kun Yang","Random Antiferromagnetic Spin-1/2 Chains with Competing Interactions","11 pages, 7 figures","Phys. Rev. B 68, 024425 (2003)","10.1103/PhysRevB.68.024425",,"cond-mat.dis-nn",,"  We study disordered antiferromagnetic spin-1/2 chains with nearest- and
further-neighbor interactions using the real-space renormalization-group
method. We find that the system supports two different phases, depending on the
ratio of the strength between nearest-neighbor and further-neighbor
interactions as well the bond randomness strength. For weak further neighbor
coupling the system is in the familiar random singlet phase, while stronger
further neighbor coupling drives the system to a large spin phase similar to
that found in the study of random antiferromagnetic-ferromagnetic spin chains.
The appearance of the large spin phase in the absence of ferromagnetic coupling
is due to the frustration introduced by further neighboring couplings, and is
unique to the disordered chains.
","[{""version"":""v1"",""created"":""Tue, 11 Mar 2003 16:51:25 GMT""},{""version"":""v2"",""created"":""Tue, 5 Aug 2003 13:42:54 GMT""}]","2009-11-10"
"cond-mat/0303202","Giacomo Rotoli","Giacomo Rotoli","Induced paramagnetic states by localized $\pi $-loops in grain
  boundaries","4 pages, 4 figures, submitted to Phys. Rev. Lett",,"10.1103/PhysRevB.68.052505",,"cond-mat.supr-con",,"  Recent experiments on high-temperature superconductors show paramagnetic
behavior localized at grain boundaries (GB). This paramagnetism can be
attributed to the presence unconventional d-wave induced $\pi$-junctions. By
modeling the GB as an array of $\pi$ and conventional Josephson junction we
determine the conditions of the occurrence of the paramagnetic behavior.
","[{""version"":""v1"",""created"":""Tue, 11 Mar 2003 16:59:55 GMT""}]","2016-08-31"
"cond-mat/0303203","J. A. Mendez-Bermudez","J. A. M\'endez-Berm\'udez, G. A. Luna-Acosta, P. \v{S}eba, and K. N.
  Pichugin","Chaotic Waveguide-Based Resonators for Microlasers","5 pages, 5 figures","Phys. Rev. B 67, 161104(R) (2003).","10.1103/PhysRevB.67.161104",,"cond-mat.mes-hall physics.optics",,"  We propose the construction of highly directional emission microlasers using
two-dimensional high-index semiconductor waveguides as {\it open} resonators.
The prototype waveguide is formed by two collinear leads connected to a cavity
of certain shape. The proposed lasing mechanism requires that the shape of the
cavity yield mixed chaotic ray dynamics so as to have the appropiate (phase
space) resonance islands. These islands allow, via Heisenberg's uncertainty
principle, the appearance of quasi bound states (QBS) which, in turn,
propitiate the lasing mechanism. The energy values of the QBS are found through
the solution of the Helmholtz equation. We use classical ray dynamics to
predict the direction and intensity of the lasing produced by such open
resonators for typical values of the index of refraction.
","[{""version"":""v1"",""created"":""Tue, 11 Mar 2003 17:36:33 GMT""}]","2009-11-10"
"cond-mat/0303204","Nils Bluemer","N. Bl\""umer, P. G. J. van Dongen","Transport properties of correlated electrons in high dimensions","8 pages, 4 figures. Proceedings of the NATO workshop on ""Concepts in
  Electron Correlation"", Hvar, Croatia (2002). For more details, see thesis at
  http://komet337.physik.uni-mainz.de/Bluemer/publications.en.shtml#thesis","""Concepts in Electron Correlation"", Eds.: Alex C. Hewson, Veljko
  Zlatic, NATO Science Series, ISBN 1-4020-1419-8, Kluwer (2003)",,,"cond-mat.str-el",,"  We develop a new general algorithm for finding a regular tight-binding
lattice Hamiltonian in infinite dimensions for an arbitrary given shape of the
density of states (DOS). The availability of such an algorithm is essential for
the investigation of broken-symmetry phases of interacting electron systems and
for the computation of transport properties within the dynamical mean-field
theory (DMFT). The algorithm enables us to calculate the optical conductivity
fully consistently on a regular lattice, e.g., for the semi-elliptical (Bethe)
DOS. We discuss the relevant f-sum rule and present numerical results obtained
using quantum Monte Carlo techniques.
","[{""version"":""v1"",""created"":""Tue, 11 Mar 2003 17:27:56 GMT""}]","2007-05-23"
"cond-mat/0303205","Peter Mueller","Peter M\""uller","Critical behaviour of the Rouse model for gelling polymers","9 pages, slightly extended version, to appear in J. Phys. A","J. Phys. A 36, 10443-10450 (2003)","10.1088/0305-4470/36/42/002",,"cond-mat.stat-mech cond-mat.soft",,"  It is shown that the traditionally accepted ""Rouse values"" for the critical
exponents at the gelation transition do not arise from the Rouse model for
gelling polymers. The true critical behaviour of the Rouse model for gelling
polymers is obtained from spectral properties of the connectivity matrix of the
fractal clusters that are formed by the molecules. The required spectral
properties are related to the return probability of a ""blind ant""-random walk
on the critical percolating cluster. The resulting scaling relations express
the critical exponents of the shear-stress-relaxation function, and hence those
of the shear viscosity and of the first normal stress coefficient, in terms of
the spectral dimension $d_{s}$ of the critical percolating cluster and the
exponents $\sigma$ and $\tau$ of the cluster-size distribution.
","[{""version"":""v1"",""created"":""Tue, 11 Mar 2003 19:04:56 GMT""},{""version"":""v2"",""created"":""Thu, 28 Aug 2003 17:13:42 GMT""}]","2007-05-23"
"cond-mat/0303206","Dalfovo Franco","Cesare Tozzo and Franco Dalfovo","Bogoliubov spectrum and Bragg spectroscopy of elongated Bose-Einstein
  condensates","8 pages, 7 figures, minor changes, typos corrected",,"10.1088/1367-2630/5/1/354",,"cond-mat.soft",,"  The behavior of the momentum transferred to a trapped Bose-Einstein
condensate by a two-photon Bragg pulse reflects the structure of the underlying
Bogoliubov spectrum. In elongated condensates, axial phonons with different
number of radial nodes give rise to a multibranch spectrum which can be
resolved in Bragg spectroscopy, as shown by Steinhauer {\it et al.} [Phys. Rev.
Lett. {\bf 90}, 060404 (2003)]. Here we present a detailed theoretical analysis
of this process. We calculate the momentum transferred by numerically solving
the time dependent Gross-Pitaevskii equation. In the case of a cylindrical
condensate, we compare the results with those obtained by linearizing the
Gross-Pitaevskii equation and using a quasiparticle projection method. This
analysis shows how the axial-phonon branches affect the momentum transfer, in
agreement with our previous interpretation of the observed data. We also
discuss the applicability of this type of spectroscopy to typical available
condensates, as well as the role of nonlinear effects.
","[{""version"":""v1"",""created"":""Tue, 11 Mar 2003 18:57:27 GMT""},{""version"":""v2"",""created"":""Mon, 28 Apr 2003 16:57:00 GMT""}]","2009-11-10"
"cond-mat/0303207","Jacobus Verbaarschot","N.C. Snaith, P.J. Forrester and J.J.M. Verbaarschot","Developments in Random Matrix Theory","22 pages, Latex","J.Phys. A36 (2003) R1",,"SUNY-NTG-03/03","cond-mat.dis-nn hep-th math-ph math.MP",,"  In this preface to the Journal of Physics A, Special Edition on Random Matrix
Theory, we give a review of the main historical developments of random matrix
theory. A short summary of the papers that appear in this special edition is
also given.
","[{""version"":""v1"",""created"":""Tue, 11 Mar 2003 19:35:47 GMT""}]","2007-05-23"
"cond-mat/0303208","Akihisa Koga","Akihisa Koga, Takuma Ohashi, Yoshiki Imai, Sei-ichiro Suga and Norio
  Kawakami","Effects of degenerate orbitals on the Hubbard model","3 pages, To appear in JPSJ Vol. 72, No. 5 2003",,"10.1143/JPSJ.72.1306",,"cond-mat.str-el",,"  Stability of a metallic state in the two-orbital Hubbard model at
half-filling is investigated. We clarify how spin and orbital fluctuations are
enhanced to stabilize the formation of quasi-particles by combining dynamical
mean field theory with the quantum Monte Carlo simulations. These analyses shed
some light on the reason why the metallic phase is particularly stable when the
intra- and inter-band Coulomb interactions are nearly equal.
","[{""version"":""v1"",""created"":""Tue, 11 Mar 2003 21:00:51 GMT""}]","2009-11-10"
"cond-mat/0303209","Guido Burkard","Guido Burkard and Daniel Loss","Lower bound for electron spin entanglement from beamsplitter current
  correlations","4 pages, 3 figures","Phys. Rev. Lett. 91, 087903 (2003).","10.1103/PhysRevLett.91.087903",,"cond-mat.mes-hall quant-ph",,"  We determine a lower bound for the entanglement of pairs of electron spins
injected into a mesoscopic conductor. The bound can be expressed in terms of
experimentally accessible quantities, the zero-frequency current correlators
(shot noise power or cross-correlators) after transmission through an
electronic beam splitter. The effect of spin relaxation (T_1 processes) and
decoherence (T_2 processes) during the ballistic coherent transmission of the
carriers in the wires is taken into account within Bloch theory. The presence
of a variable inhomogeneous magnetic field allows the determination of a useful
lower bound for the entanglement of arbitrary entangled states. The decrease in
entanglement due to thermally mixed states is studied. Both the entanglement of
the output of a source (entangler) and the relaxation (T_1) and decoherence
(T_2) times can be determined.
","[{""version"":""v1"",""created"":""Tue, 11 Mar 2003 22:29:37 GMT""}]","2007-05-23"
"cond-mat/0303210","Roderich Moessner","R. Moessner, S. L. Sondhi","Theory of the [111] magnetization plateau in spin ice","13 pages, 7 figures autmatically included","Phys. Rev. B 68, 064411 (2003)","10.1103/PhysRevB.68.064411","LPTENS 03/08","cond-mat.stat-mech cond-mat.dis-nn cond-mat.str-el",,"  The application of a magnetic field along the [111] direction in the spin ice
compounds leads to two magnetization plateaux, in the first of which the ground
state entropy is reduced but still remains extensive. We observe that under
reasonable assumptions, the remaining degrees of freedom in the low field
plateau live on decoupled kagome planes, and can be mapped to hard core dimers
on a honeycomb lattice. The resulting two dimensional state is critical, and we
have obtained its residual entropy -- in good agreement with a recent
experiments -- the equal time spin correlations as well as a theory for the
dynamical spin correlations. Small tilts of the field are predicted to lead a
vanishing of the entropy and the termination of the critical phase by a
Kasteleyn transition characterized by highly anisotropic scaling. We discuss
the thermally excited defects that terminate the plateau either end, among them
an exotic string defect which restores three dimensionality.
","[{""version"":""v1"",""created"":""Tue, 11 Mar 2003 21:50:37 GMT""}]","2007-05-23"
"cond-mat/0303211","Josh Milstein","J. N. Milstein, C. Menotti, and M. J. Holland","Feshbach resonances and collapsing Bose-Einstein condensates",,,"10.1088/1367-2630/5/1/352",,"cond-mat.soft",,"  We investigate the quantum state of burst atoms seen in the recent Rb-85
experiments at JILA. We show that the presence of a resonance scattering state
can lead to a pairing instability generating an outflow of atoms with energy
comparable to that observed. A resonance effective field theory is used to
study this dynamical process in an inhomogeneous system with spherical
symmetry.
","[{""version"":""v1"",""created"":""Tue, 11 Mar 2003 23:34:27 GMT""}]","2009-11-10"
"cond-mat/0303212","Tomasz Wojtowicz","T. Wojtowicz, G. Cywinski, W.L. Lim, X. Liu, M. Dobrowolska, J. K.
  Furdyna, K. M. Yu, W. Walukiewicz, G.B. Kim, M. Cheon, X. Chen, S.M. Wang,
  and H. Luo","In(1-x)Mn(x)Sb - a new narrow gap ferromagnetic semiconductor","12 pages, 3 figures",,"10.1063/1.1583142",,"cond-mat.mtrl-sci",,"  A narrow-gap ferromagnetic In(1-x)Mn(x)Sb semiconductor alloy was
successfully grown by low-temperature molecular beam epitaxy on CdTe/GaAs
hybrid substrates. Ferromagnetic order in In(1-x)Mn(x)Sb was unambiguously
established by the observation of clear hysteresis loops both in direct
magnetization measurements and in the anomalous Hall effect, with Curie
temperatures T_C ranging up to 8.5 K. The observed values of T_C agree well
with the existing models of carrier-induced ferromagnetism.
","[{""version"":""v1"",""created"":""Tue, 11 Mar 2003 23:19:58 GMT""}]","2009-11-10"
"cond-mat/0303213","Eugene M. Chudnovsky","E. M. Chudnovsky and A. B. Kuklov","Inertial mass of a superconducting vortex","4 pages, no figures",,,,"cond-mat.supr-con",,"  We show that a large contribution to the inertial mass of a moving
superconducting vortex comes from transversal displacements of the crystal
lattice. The corresponding part of the mass per unit length of the vortex line
is $M_{l} = ({\rm
m}_e^2c^{2}/64{\pi}{\alpha}^{2}{\mu}{\lambda}_{L}^{4})\ln({\lambda}_{L}/{\xi})$
, where ${\rm m}_{e}$ is the the bare electron mass, $c$ is the speed of light,
${\alpha}=e^{2}/{\hbar}c {\approx} 1/137$ is the fine structure constant,
${\mu}$ is the shear modulus of the solid, ${\lambda}_{L}$ is the London
penetration length and ${\xi}$ is the coherence length. In conventional
superconductors, this mass can be comparable to or even greater than the vortex
core mass computed by Suhl.
","[{""version"":""v1"",""created"":""Tue, 11 Mar 2003 23:27:10 GMT""}]","2007-05-23"
"cond-mat/0303214","Magdalena Constantin","M. Constantin, S. Das Sarma, C. Dasgupta, O. Bondarchuk, D. B.
  Dougherty and E. D. Williams","Infinite family of persistence exponents for interface fluctuations","LaTeX, 4 pages, 2 figures","Phys. Rev. Lett. 91, 086103 (2003)","10.1103/PhysRevLett.91.086103",,"cond-mat.stat-mech",,"  We show experimentally and theoretically that the persistence of large
deviations in equilibrium step fluctuations is characterized by an infinite
family of independent exponents. These exponents are obtained by carefully
analyzing dynamical experimental images of Al/Si(111) and Ag(111) equilibrium
steps fluctuating at high (970K) and low (320K) temperatures respectively, and
by quantitatively interpreting our observations on the basis of the
corresponding coarse-grained discrete and continuum theoretical models for
thermal surface step fluctuations under attachment/detachment
(``high-temperature'') and edge-diffusion limited kinetics
(``low-temperature'') respectively.
","[{""version"":""v1"",""created"":""Tue, 11 Mar 2003 23:42:34 GMT""},{""version"":""v2"",""created"":""Fri, 27 Feb 2004 21:01:22 GMT""}]","2007-05-23"
"cond-mat/0303215","OiOnO","Zhen-Gang Zhu, Gang Su, Biao Jin, and Qing-Rong Zheng","Spin-Flip Scattering Effect on the Current-Induced Spin Torque in
  Ferromagnet-Insulator-Ferromagnet Tunnel Junctions","Revtex, 11 papes, 4 figures, appendix","Phys. Lett. A306, 249 (2003)","10.1016/S0375-9601(02)01597-9",,"cond-mat.mes-hall",,"  We have investigated the current-induced spin transfer torque of a
ferromagnet-insulator-ferromagnet tunnel junction by taking the spin-flip
scatterings into account. It is found that the spin-flip scattering can induce
an additional spin torque, enhancing the maximum of the spin torque and giving
rise to an angular shift compared to the case when the spin-flip scatterings
are neglected. The effects of the molecular fields of the left and right
ferromagnets on the spin torque are also studied. It is found that $\tau
^{Rx}/I_{e}$ ($\tau ^{Rx}$ is the spin-transfer torque acting on the right
ferromagnet and $I_{e}$ is the tunneling elcetrical current) does vary with the
molecular fields. At two certain angles, $\tau ^{Rx}/I_{e}$ is independent of
the molecular field of the right ferromagnet, resulting in two crossing points
in the curve of $\tau ^{Rx}/I_{e}$ versus the relevant orientation for
different molecular fields.
","[{""version"":""v1"",""created"":""Wed, 12 Mar 2003 05:59:28 GMT""}]","2009-11-10"
"cond-mat/0303216","Tomoyuki Maruyama","T. Maruyama, H. Yabu and T. Suzuki","Time-Dependent Dynamics of the Bose-Fermi Mixed Condensed System","5pages, 2 figures",,"10.1142/9789812703972_0034",,"cond-mat.soft",,"  We study the monopole oscillation in the bose-fermi mixed condensed system by
performing the time-dependent Gross-Pitaevsky (GP) and Vlasov equations. We
find that the big damping exists for the fermion oscillation in the mixed
system even at zero temperature
","[{""version"":""v1"",""created"":""Wed, 12 Mar 2003 06:02:20 GMT""}]","2017-08-23"
"cond-mat/0303218","Weizhu Bao","Weizhu Bao and Weijun Tang","Ground state solution of Bose-Einstein condensate by directly minimizing
  the energy functional","33 pages, 22 figures","J. Comput. Phys., Vol. 187, No. 1, pp. 230 - 254, 2003.","10.1016/S0021-9991(03)00097-4",,"cond-mat",,"  In this paper, we propose a new numerical method to compute the ground state
solution of trapped interacting Bose-Einstein condensation (BEC) at zero or
very low temperature by directly minimizing the energy functional via finite
element approximation. As preparatory steps we begin with the 3d
Gross-Pitaevskii equation (GPE), scale it to get a three-parameter model and
show how to reduce it to 2d and 1d GPEs. The ground state solution is
formulated by minimizing the energy functional under a constraint, which is
discretized by the finite element method. The finite element approximation for
1d, 2d with radial symmetry and 3d with spherical symmetry and cylindrical
symmetry are presented in detail and approximate ground state solutions, which
are used as initial guess in our practical numerical computation of the
minimization problem, of the GPE in two extreme regimes: very weak interactions
and strong repulsive interactions are provided. Numerical results in 1d, 2d
with radial symmetry and 3d with spherical symmetry and cylindrical symmetry
for atoms ranging up to millions in the condensation are reported to
demonstrate the novel numerical method. Furthermore, comparisons between the
ground state solutions and their Thomas-Fermi approximations are also reported.
Extension of the numerical method to compute the excited states of GPE is also
presented.
","[{""version"":""v1"",""created"":""Wed, 12 Mar 2003 07:55:35 GMT""}]","2009-11-10"
"cond-mat/0303219","Taner","A. B. Harris, Taner Yildirim, Amnon Aharony, Ora Entin-Wohlman, and I.
  Ya. Korenblit","Unusual Symmetries in the Kugel-Khomskii Hamiltonian","4 pages (two column format with 2 figures), to appear in Phys. Rev.
  Lett. (submitted on Dec. 2002)",,"10.1103/PhysRevLett.91.087206",,"cond-mat.str-el",,"  The Kugel-Khomskii Hamiltonian for cubic titanates describes spin and orbital
superexchange interactions between $d^1$ ions having three-fold degenerate
$t_{2g}$ orbitals. Since orbitals do not couple along ""inactive"" axes,
perpendicular to the orbital planes, the total number of electrons in $|\alpha
>$ orbitals in any such plane and the corresponding total spin are both
conserved. A Mermin-Wagner construction shows that there is no long-range spin
ordering at nonzero temperatures. Inclusion of spin-orbit coupling allows such
ordering, but even then the excitation spectrum is gapless due to a continuous
symmetry. Thus, the observed order and gap require more symmetry breaking
terms.
","[{""version"":""v1"",""created"":""Wed, 12 Mar 2003 09:09:03 GMT""}]","2009-11-10"
"cond-mat/0303220","Jacques Tempere","M. Wouters, J. Tempere, J. T. Devreese","Resonant dynamics in boson-fermion mixtures","11 pages and 4 figures","Phys. Rev. A 67, 063609 (2003).","10.1103/PhysRevA.67.063609",,"cond-mat",,"  The time evolution of a dilute atomic boson-fermion mixture is studied at
zero temperature, when the external magnetic field is brought close to a
interspecies Feshbach resonance. On short time scales we find that before a
collapse or phase separation of the mixture can occur, oscillations between
fermionic atoms and heteronuclear molecules dominate the dynamics. Applying the
model presented here to a trapped mixture of $^{40}$K-$^{87}$Rb atoms, we find
that the predicted oscillations can be revealed in degenerate mixtures of these
atoms.
","[{""version"":""v1"",""created"":""Wed, 12 Mar 2003 13:51:31 GMT""}]","2009-11-10"
"cond-mat/0303221","Anirban Chakraborti","Marko Sysi-Aho, Anirban Chakraborti and Kimmo Kaski","Biology helps you to win a game","4 pages including 6 figures. Uses REVTeX4. Submitted for Conference
  Proceedings of the ""Unconventional Applications of Statistical Physics"",
  Kolkata","Physica Scripta T106, 32 (2003)","10.1238/Physica.Topical.106a00032",,"cond-mat.stat-mech q-bio",,"  We present a game of interacting agents which mimics the complex dynamics
found in many natural and social systems. These agents modify their strategies
periodically, depending on their performances using genetic crossover
mechanisms, inspired by biology. We study the performances of the agents under
different conditions, and how they adapt themselves. In addition the dynamics
of the game is investigated.
","[{""version"":""v1"",""created"":""Wed, 12 Mar 2003 11:22:11 GMT""}]","2009-11-10"
