"quant-ph/0311101","Daniel Collins","Daniel Collins, Nicolas Gisin and Hugues de Riedmatten","Quantum Relays for Long Distance Quantum Cryptography","14 pages, 9 figures","J. Mod. Opt. 52, 735 (2005)","10.1080/09500340412331283633",,"quant-ph",,"  Quantum Cryptography is on the verge of commercial application. One of its
greatest limitations is over long distance - secret key rates are low and the
longest fibre over which any key has been exchanged is currently 100 km. We
investigate the quantum relay, which can increase the maximum distance at which
quantum cryptography is possible. The relay splits the channel into sections,
and sends a different photon across each section, increasing the signal to
noise ratio. The photons are linked as in teleportation, with entangled photon
pairs and Bell measurements. We show that such a scheme could allow
cryptography over hundreds of kilometers with today's detectors. It could not,
however, improve the rate of key exchange over distances where the standard
single section scheme already works. We also show that reverse key
reconciliation, previously used in continuous variable quantum cryptography,
gives a secure key over longer distances than forward key reconciliation.
","[{""version"":""v1"",""created"":""Fri, 14 Nov 2003 18:35:22 GMT""}]","2023-03-23"
"quant-ph/0311102","Kazuyuki Fujii","Kazuyuki Fujii (Yokohama City University)","A Modern Introduction to Cardano and Ferrari Formulas in the Algebraic
  Equations","Latex File, 14 pages. Appendix (: Euler Formula) added. This note is
  based on my lecture given at Yokohama City University and is recommended as a
  (thin) textbook in some undergraduate course","Far East Journal of Mathematical Education, 10(2013), 175-189",,,"quant-ph math-ph math.MP",,"  We give a modern approach to the famous Cardano and Ferrari formulas in the
algebraic equations with three and four degrees. Namely, we reconstruct these
formulas from the point of view of superposition principle in quantum
computation based on three and four level systems which are being developed by
the author. We also present a problem on some relation between Galois theory
and Qudit theory.
","[{""version"":""v1"",""created"":""Sat, 15 Nov 2003 01:30:27 GMT""},{""version"":""v2"",""created"":""Wed, 26 Nov 2003 00:41:11 GMT""}]","2014-04-01"
