"hep-th/0311125","J. Mourad","C. Deffayet, J. Mourad","Solutions of multigravity theories and discretized brane worlds","19 pages","Class.Quant.Grav.21:1833-1848,2004","10.1088/0264-9381/21/7/008",,"hep-th gr-qc",,"  We determine solutions to 5D Einstein gravity with a discrete fifth
dimension. The properties of the solutions depend on the discretization scheme
we use and some of them have no continuum counterpart. In particular, we find
that the neglect of the lapse field (along the discretized direction) gives
rise to Randall-Sundrum type metric with a negative tension brane. However, no
brane source is required. We show that this result is robust under changes in
the discretization scheme. The inclusion of the lapse field gives rise to
solutions whose continuum limit is gauge fixed by the discretization scheme. We
find however one particular scheme which leads to an undetermined lapse
reflecting the reparametrization invariance of the continuum theory. We also
find other solutions, with no continuum counterpart with changes in the metric
signature or avoidance of singularity. We show that the models allow a
continuous mass spectrum for the gravitons with an effective 4D interaction at
small scales. We also discuss some cosmological solutions.
","[{""version"":""v1"",""created"":""Fri, 14 Nov 2003 16:58:34 GMT""},{""version"":""v2"",""created"":""Wed, 17 Mar 2004 13:28:47 GMT""}]","2009-10-07"
"hep-th/0311126","W. Machin","W Machin","Supersymmetric sigma models, gauge theories and vortices","Phd thesis, University of London, latex, 130pp",,,,"hep-th",,"  This thesis considers one and two dimensional supersymmetric nonlinear sigma
models. First there is a discussion of the geometries of one and two
dimensional sigma models, with rigid supersymmetry.
  For the one-dimensional case, the supersymmetry is promoted to a local one
and the required gauge fields are introduced. The most general Lagrangian,
including these gauge fields, is found. The constraints of the system are
analysed, and its Dirac quantisation is investigated.
  In the next chapter we introduce equivariant cohomology which is used later
in the thesis.
  Then actions are constructed for (p,0)- and (p,1)- supersymmetric, $1 \leq p
\leq 4$, two-dimensional gauge theories coupled to non-linear sigma model
matter with a Wess-Zumino term.
  The scalar potential for a large class of these models is derived. It is then
shown that the Euclidean actions of the (2,0) and (4,0)-supersymmetric models
without Wess-Zumino terms are bounded by topological charges which involve the
equivariant extensions of the Kahler forms of the sigma model target spaces
evaluated on the two-dimensional spacetime.
  Similar bounds for Euclidean actions of appropriate gauge theories coupled to
non-linear sigma model matter in higher spacetime dimensions are given which
now involve the equivariant extensions of the Kahler forms of the sigma model
target spaces and the second Chern character of gauge fields. It is found that
the BPS configurations are generalisations of abelian and non-abelian vortices.
","[{""version"":""v1"",""created"":""Fri, 14 Nov 2003 18:41:50 GMT""}]","2007-05-23"
"hep-th/0311127","Alejandro Jenkins","Alejandro Jenkins","Spontaneous Breaking of Lorentz Invariance","revtex4, 11 pages, 5 figures; v2:references added; v3:more references
  added, typos fixed, some points in sect. IV clarified; v4:even more
  references added, discussion in sect. V extended; v5:replaced to match
  published version (minor corrections of form)","Phys.Rev. D69 (2004) 105007","10.1103/PhysRevD.69.105007","CALT-68-2461","hep-th hep-ph",,"  We describe how a stable effective theory in which particles of the same
fermion number attract may spontaneously break Lorentz invariance by giving
non-zero fermion number density to the vacuum (and therefore dynamically
generating a chemical potential term). This mecanism yields a finite vacuum
expectation value $<\bar\psi\gamma^\mu\psi>$ which we consider in the context
of proposed models that require such a breaking of Lorentz invariance in order
to yield composite degrees of freedom that act approximately like gauge bosons.
We also make general remarks about how the background source provided by
$<\bar\psi\gamma^\mu\psi>$ could relate to work on signals of Lorentz violation
in electrodynamics.
","[{""version"":""v1"",""created"":""Fri, 14 Nov 2003 23:09:25 GMT""},{""version"":""v2"",""created"":""Fri, 5 Dec 2003 19:45:55 GMT""},{""version"":""v3"",""created"":""Thu, 15 Jan 2004 21:22:22 GMT""},{""version"":""v4"",""created"":""Fri, 27 Feb 2004 21:13:02 GMT""},{""version"":""v5"",""created"":""Mon, 17 May 2004 19:27:35 GMT""}]","2007-05-23"
"hep-th/0311128","Anibal Iucci","An\'ibal Iucci, Carlos Na\'on","A non covariant fermionic determinant and its connection to Luttinger
  systems","revtex4, 14 pages, no figures","J.Phys. A38 (2005) 749-758","10.1088/0305-4470/38/3/011",,"hep-th cond-mat",,"  We consider a fermionic determinant associated to a non covariant Quantum
Field Theory used to describe a non relativistic system in (1+1) dimensions. By
exploiting the freedom that arises when Lorentz invariance is not mandatory, we
determine the heat-kernel regulating operator so as to reproduce the correct
dispersion relations of the bosonic excitations. We also derive the Hamiltonian
of the functionally bosonized model and the corresponding currents. In this way
we were able to establish the precise heat-kernel regularization that yields
complete agreement between the path-integral and operational approaches to the
bosonization of the Tomonaga-Luttinger model.
","[{""version"":""v1"",""created"":""Fri, 14 Nov 2003 21:24:00 GMT""}]","2016-08-16"
"hep-th/0311131","Monemzadeh","A. Shirzad and M. Monemzadeh","The BFT Method With Chain Structure","To appear in Phys. Lett. B","Phys.Lett. B584 (2004) 220-224","10.1016/j.physletb.2004.01.047",,"hep-th",,"  We have constructed a modified BFT method that preserves the chain structure
of constraints. This method has two advantages: first, it leads to less number
of primary constraints such that the remaining constraints emerge
automatically; and second, it gives less number of independent gauge
parameters. We have applied the method for bosonized chiral Schwiger model. We
have constructed a gauge invariant embedded Lagrangian for this model.
","[{""version"":""v1"",""created"":""Sat, 15 Nov 2003 12:22:57 GMT""},{""version"":""v2"",""created"":""Sat, 24 Jan 2004 09:58:45 GMT""}]","2009-11-10"
"math-ph/0311024","Edward Saff","D.P. Hardin and E.B. Saff","Minimal Riesz Energy Point Configurations for Rectifiable d-Dimensional
  Manifolds","paper: 29 pages and addendum: 4 pages",,,,"math-ph math.GM math.MG math.MP",,"  For a compact set A in Euclidean space we consider the asymptotic behavior of
optimal (and near optimal) N-point configurations that minimize the Riesz
s-energy (corresponding to the potential 1/t^s) over all N-point subsets of A,
where s>0. For a large class of manifolds A having finite, positive
d-dimensional Hausdorff measure, we show that such minimizing configurations
have asymptotic limit distribution (as N tends to infinity with s fixed) equal
to d-dimensional Hausdorff measure whenever s>d or s=d. In the latter case we
obtain an explicit formula for the dominant term in the minimum energy. Our
results are new even for the case of the d-dimensional sphere.
","[{""version"":""v1"",""created"":""Fri, 14 Nov 2003 21:53:17 GMT""},{""version"":""v2"",""created"":""Sat, 21 Aug 2004 21:59:23 GMT""},{""version"":""v3"",""created"":""Wed, 15 Dec 2004 21:41:23 GMT""}]","2007-05-23"
"math/0311245","Goncharov","V.V. Fock, A.B. Goncharov","Cluster ensembles, quantization and the dilogarithm","Version 7: Final version. To appear in Ann. Sci. Ecole Normale. Sup.
  New material in Section 5. 58 pages, 11 pictures",,,,"math.AG math.QA","http://arxiv.org/licenses/nonexclusive-distrib/1.0/","  Cluster ensemble is a pair of positive spaces (X, A) related by a map p: A ->
X. It generalizes cluster algebras of Fomin and Zelevinsky, which are related
to the A-space. We develope general properties of cluster ensembles, including
its group of symmetries - the cluster modular group, and a relation with the
motivic dilogarithm. We define a q-deformation of the X-space. Formulate
general duality conjectures regarding canonical bases in the cluster ensemble
context. We support them by constructing the canonical pairing in the finite
type case.
  Interesting examples of cluster ensembles are provided the higher Teichmuller
theory, that is by the pair of moduli spaces corresponding to a split reductive
group G and a surface S defined in math.AG/0311149.
  We suggest that cluster ensembles provide a natural framework for higher
quantum Teichmuller theory.
","[{""version"":""v1"",""created"":""Fri, 14 Nov 2003 20:49:44 GMT""},{""version"":""v2"",""created"":""Wed, 29 Sep 2004 17:28:30 GMT""},{""version"":""v3"",""created"":""Wed, 14 Feb 2007 00:23:10 GMT""},{""version"":""v4"",""created"":""Sat, 9 Jun 2007 16:42:19 GMT""},{""version"":""v5"",""created"":""Sun, 29 Mar 2009 16:07:58 GMT""},{""version"":""v6"",""created"":""Mon, 27 Jul 2009 09:19:29 GMT""},{""version"":""v7"",""created"":""Tue, 4 Aug 2009 16:53:33 GMT""}]","2009-08-04"
"math/0311246","Gestur Olafsson","G. Olafsson and A. Pasquale","Paley-Wiener theorems for the $\Theta$-spherical transform: an overview",,,,,"math.RT math.FA",,"  The aim of this article is to give an overview of several types of
Paley-Wiener theorems occuring in harmonic analysis related to symmetric
spaces. This will serve as a motivation for the introduction of the
$\Theta$-spherical functions, the correspondint $\Theta$-spherical Fourier
transform, and the Paley-Wiener theorem for this transform. Up to now such a
theorem has only been proven in very special cases, and still, its formulation
and proof are very technical. In this paper we do not go into details of the
proofs, but present an overview which explains the different examples which
have inspired and motivated the theory of $\Theta$-spherical functions.
","[{""version"":""v1"",""created"":""Fri, 14 Nov 2003 18:34:39 GMT""}]","2007-05-23"
"math/0311247","Ken Dykema","Kenneth J. Dykema and Roger R. Smith","The completely bounded approximation property for extended Cuntz-Pimsner
  algebras","9 pages",,,,"math.OA",,"  The extended Cuntz-Pimsner algebra E(H), introduced by Pimsner, is
constructed from a Hilbert B,B-bimodule H over a C*-algebra B. In this paper we
investigate the Haagerup invariant \Lambda(.) for these algebras, the main
result being that \Lambda(E(H))=\Lambda(B) when H is full over B. In
particular, E(H) has the completely bounded approximation property if and only
if the same is true for B.
","[{""version"":""v1"",""created"":""Fri, 14 Nov 2003 19:55:28 GMT""}]","2007-05-23"
"math/0311248","Bogdan Alexandrov","Bogdan Alexandrov","Sp(n)U(1)-connections with parallel totally skew-symmetric torsion","24 pages; some inessential changes",,,,"math.DG",,"  We consider the unique Hermitian connection with totally skew-symmetric
torsion on a Hermitian manifold. We prove that if the torsion is parallel and
the holonomy is Sp(n)U(1), considered as a subgroup of U(2n) x U(1), then the
manifold is locally isomorphic to the twistor space of a quaternionic Kaehler
manifold with positive scalar curvature. If the manifold is complete, then it
is globally isomorphic to such a twistor space.
","[{""version"":""v1"",""created"":""Fri, 14 Nov 2003 20:08:30 GMT""},{""version"":""v2"",""created"":""Thu, 8 Jul 2004 17:51:42 GMT""}]","2007-05-23"
"math/0311249","Jeffrey McGowan","Jeffrey McGowan","Bounds on Accumulation Rates of Eigenvalues on Manifolds with
  Degenerating Metrics","10 pages",,,,"math.DG math.SP",,"  We consider a family of manifolds with a class of degenerating warped product
metrics $g_\epsilon=\rho(\epsilon,t)^{2a}dt^2 +\rho(\epsilon,t)^{2b}ds_M^2$,
with $M$ compact, $\rho$ homogeneous degree one, $a \le -1$ and $b > 0$. We
study the Laplace operator acting on $L^{2}$ differential $p$-forms and give
sharp accumulation rates for eigenvalues near the bottom of the essential
spectrum of the limit manifold with metric $g_{0}$.
","[{""version"":""v1"",""created"":""Fri, 14 Nov 2003 20:52:40 GMT""},{""version"":""v2"",""created"":""Tue, 18 Nov 2003 22:44:21 GMT""},{""version"":""v3"",""created"":""Fri, 9 Jan 2004 13:36:06 GMT""}]","2007-05-23"
"math/0311250","John D. McCarthy","John D. McCarthy, William R. Vautaw","Automorphisms of Torelli groups",,,,,"math.GT math.GR",,"  In this paper, we prove that each automorphism of the Torelli group of a
surface is induced by a diffeomorphism of the surface, provided that the
surface is a closed, connected, orientable surface of genus at least 3. This
result was previously announced by Benson Farb for genus at least 4 and has
recently been announced by Benson Farb and Nikolai Ivanov for subgroups of
finite index in the Torelli group for surfaces of genus at least 5. This result
is also directly analogous to previous results established for classical braid
groups, mapping class groups, and surface braid groups.
","[{""version"":""v1"",""created"":""Fri, 14 Nov 2003 22:34:21 GMT""}]","2007-05-23"
"math/0311251","Jonathan Kujawa","Jonathan Kujawa","Crystal structures arising from representations of $GL(m|n)$","36 Pages, reference added",,,,"math.RT",,"  This paper provides results on the modular representation theory of the
supergroup $GL(m|n).$ Working over a field of arbitrary characteristic, we
prove that the explicit combinatorics of certain crystal graphs describe the
representation theory of a modular analogue of the Bernstein-Gelfand-Gelfand
category $\mathcal{O}$. In particular, we obtain a linkage principle and
describe the effect of certain translation functors on irreducible
supermodules. Furthermore, our approach accounts for the fact that $GL(m|n)$
has non-conjugate Borel subgroups and we show how Serganova's odd reflections
give rise to canonical crystal isomorphisms.
","[{""version"":""v1"",""created"":""Fri, 14 Nov 2003 22:40:24 GMT""},{""version"":""v2"",""created"":""Fri, 21 Nov 2003 19:57:41 GMT""}]","2007-05-23"
"math/0311252","Anca Mustata","Anca Mustata (University of British Columbia)","Degree 1 Curves in the Dwork Pencil and the Mirror Quintic","43 pages",,,,"math.AG",,"  We give a description of the relative Hilbert scheme of lines in the Dwork
pencil of quintic threefolds. We describe the corresponding relative Hilbert
scheme associated to the mirror family of quintic threefolds.
","[{""version"":""v1"",""created"":""Sat, 15 Nov 2003 01:05:57 GMT""}]","2007-05-23"
"nlin/0311026","Florian Merkt","Florian S. Merkt (1 and 2), Robert D. Deegan (1), Daniel I. Goldman
  (1), Erin C. Rericha (1) and Harry L. Swinney (1) ((1) University of Texas at
  Austin,(2) Fritz-Haber-Insitut der MPG)","Persistent holes in a fluid","4 pages, 6 figures",,"10.1103/PhysRevLett.92.184501",,"nlin.PS",,"  We observe stable holes in a vertically oscillated 0.5 cm deep aqueous
suspension of cornstarch for accelerations a above 10g. Holes appear only if a
finite perturbation is applied to the layer. Holes are circular and
approximately 0.5 cm wide, and can persist for more than 10^5 cycles. Above a =
17g the rim of the hole becomes unstable producing finger-like protrusions or
hole division. At higher acceleration, the hole delocalizes, growing to cover
the entire surface with erratic undulations. We find similar behavior in an
aqueous suspension of glass microspheres.
","[{""version"":""v1"",""created"":""Fri, 14 Nov 2003 16:40:23 GMT""}]","2009-11-10"
"nlin/0311027","S. Yu. Sakovich","S. Yu. Sakovich","Cyclic bases of zero-curvature representations: further examples","11 pages",,,,"nlin.SI math-ph math.AP math.MP",,"  The paper continues nlin.SI/0212019 by giving three more examples of using
cyclic bases of zero-curvature representations in studies of relation between
strong Lax pairs and recursion operators.
","[{""version"":""v1"",""created"":""Sat, 15 Nov 2003 12:27:40 GMT""}]","2007-05-23"
"physics/0311069","Jan M. L. Martin","A. Daniel Boese and Jan M.L. Martin","Vibrational Spectra of the Azabenzenes Revisited: Anharmonic Force
  Fields","J. Phys. Chem. A, in press (jp0369589); supplementary material
  (quartic force fields in machine-readable format) available at
  http://theochem.weizmann.ac.il/web/papers/azabenzenes.html","Journal of Physical Chemistry A 108, 3085-3096 (2004)","10.1021/jp0369589",,"physics.chem-ph physics.comp-ph",,"  Anharmonic force fields and vibrational spectra of the azabenzene series
(pyridine, pyridazine, pyrimidine, pyrazine, s-triazine, 1,2,3-triazine,
1,2,4-triazine and s-tetrazine) and benzene are obtained using density
functional theory (DFT) with the B97-1 exchange-correlation functional and a
triple-zeta plus double polarization (TZ2P) basis set. Overall, the fundamental
frequencies computed by second-order rovibrational perturbation theory are in
excellent agreement with experiment. The resolution of the presently calculated
anharmonic spectra is such that they represent an extremely useful tool for the
assignment and interpretation of the experimental spectra, especially where
resonances are involved.
","[{""version"":""v1"",""created"":""Fri, 14 Nov 2003 16:55:53 GMT""}]","2007-05-23"
"physics/0311070","Mark Saffman","M. Saffman, Glen McCarthy, and Wieslaw Kr\'olikowski","Two dimensional modulational instability in photorefractive media","8 figures","J. Opt. B: Quantum Semiclass. Opt. 6, S397-S403 (2004)","10.1088/1464-4266/6/5/030",,"physics.optics",,"  We study theoretically and experimentally the modulational instability of
broad optical beams in photorefractive nonlinear media. We demonstrate the
impact of the anisotropy of the nonlinearity on the growth rate of periodic
perturbations. Our findings are confirmed by experimental measurements in a
strontium barium niobate photorefractive crystal.
","[{""version"":""v1"",""created"":""Fri, 14 Nov 2003 20:37:05 GMT""}]","2011-07-19"
"physics/0311071","Claudio Vinegoni dr","D.L. Marks (1) and S. A. Boppart (1,2 and 3) ((1) Beckman Institute,
  University of Illinois at Urbana-Champaign, (2) Dept. of Electrical and
  Computer Engineering, (3) College of Medicine)","Nonlinear interferometric vibrational imaging","5 pages, Latex, 3 Postscript figures, uses revtex4 and epsfig,
  submitted Version 2: rescaled the figures to fit columns",,"10.1103/PhysRevLett.92.123905",,"physics.optics",,"  Coherent Anti-Stokes Raman Scattering (CARS) processes are ``coherent,'' but
the phase of the anti-Stokes radiation is usually lost by most incoherent
spectroscopic CARS measurements. We propose a novel Raman microscopy imaging
method called Nonlinear Interferometric Vibrational Imaging, which measures
Raman spectra by obtaining the temporal anti-Stokes signal through nonlinear
interferometry. With a more complete knowledge of the anti-Stokes signal, we
show through simulations that a high-resolution Raman spectrum can be obtained
of a molecule in a single pulse using broadband radiation. This could be useful
for identifying the three-dimensional spatial distribution of molecular species
in tissue.
","[{""version"":""v1"",""created"":""Fri, 14 Nov 2003 20:59:54 GMT""},{""version"":""v2"",""created"":""Mon, 17 Nov 2003 15:15:25 GMT""}]","2009-11-10"
"physics/0311072","Paolo Di Trapani","Audrius Dubietis, Eugenijus Gaizauskas, Gintaras Tamosauskas, and
  Paolo Di Trapani","Light Filaments Without Self Guiding","Submitted to Phys. Rev. Lett. on July 7th, 2003",,"10.1103/PhysRevLett.92.253903",,"physics.optics",,"  An examination of the propagation of intense 200 fs pulses in water reveals
light filaments not sustained by the balance between Kerr-induced self-focusing
and plasma-induced defocusing. Their appearance is interpreted as the
consequence of a spontaneous reshaping of the wave packet form a gaussian into
a conical wave, driven by the requirement of maximum localization, minimum
losses and stationarity in the presence of non-linear absorption.
","[{""version"":""v1"",""created"":""Sat, 15 Nov 2003 15:20:45 GMT""}]","2009-11-10"
"physics/0311073","Afsar Abbas","Afsar Abbas","Multi - nucleon forces and the equivalence of different multi - cluster
  structures","Four pages, no figures",,,"IP/BBSR/2003-38 (November 2003)","physics.gen-ph",,"  At present it is believed that different multi-cluster structures for light
nuclei may represent equivalent states of these nuclei. Here it is proven that
once we take account of Three Body and Four Body Forces then this equivalence
is lost.
","[{""version"":""v1"",""created"":""Sat, 15 Nov 2003 10:34:06 GMT""}]","2007-05-23"
"q-bio/0311021","M. J. Gagen","Larry J. Croft, Martin J. Lercher, Michael J. Gagen, John S. Mattick","Is prokaryotic complexity limited by accelerated growth in regulatory
  overhead?","10 pages, 1 figure",,,,"q-bio.MN q-bio.GN",,"  Increased biological complexity is generally associated with the addition of
new genetic information, which must be integrated into the existing regulatory
network that operates within the cell. General arguments on network control, as
well as several recent genomic observations, indicate that regulatory gene
number grows disproportionally fast with increasing genome size. We present two
models for the growth of regulatory networks. Both predict that the number of
transcriptional regulators will scale quadratically with total gene number.
This appears to be in good quantitative agreement with genomic data from 89
fully sequenced prokaryotes. Moreover, the empirical curve predicts that any
new non-regulatory gene will be accompanied by more than one additional
regulator beyond a genome size of about 20,000 genes, within a factor of two of
the observed ceiling. Our analysis places transcriptional regulatory networks
in the class of accelerating networks. We suggest that prokaryotic complexity
may have been limited throughout evolution by regulatory overhead, and
conversely that complex eukaryotes must have bypassed this constraint by novel
strategies.
","[{""version"":""v1"",""created"":""Sat, 15 Nov 2003 09:15:54 GMT""}]","2007-05-23"
"quant-ph/0311096","Paul M. Alsing","Paul M. Alsing, David McMahon and G.J. Milburn","Teleportation in a non-inertial frame","Recalculates quant-ph/0302179 in the more physical dual rail basis,
  utilizing cavities and extends the results to include accelerated spin 1/2
  particles. Submitted to J. Opt. B: Q.& Semi. Class. Opt, Special Issue on
  Fluctuations & Noise in Photonics & Quantum Optics, in memory of Herman Haus",,"10.1088/1464-4266/6/8/033",,"quant-ph gr-qc hep-th",,"  In this work, we describe the process of teleportation between Alice in an
inertial frame, and Rob who is in uniform acceleration with respect to Alice.
The fidelity of the teleportation is reduced due to Davies-Unruh radiation in
Rob's frame. In so far as teleportation is a measure of entanglement, our
results suggest that quantum entanglement is degraded in non-inertial frames.
We discuss this reduction in fidelity for both bosonic and fermionic resources.
","[{""version"":""v1"",""created"":""Fri, 14 Nov 2003 17:57:44 GMT""}]","2009-11-10"
"quant-ph/0311099","Michael Ware","Stefania Castelletto, I.P. Degiovanni, Michael Ware, Alan Migdall","Coupling Efficiencies in Single Photon On-Demand Sources","9 pages, 5 figures",,"10.1117/12.504773",,"quant-ph",,"  Many quantum computation and communication schemes require, or would
significantly benefit from, true sources of single photon on-demand (SPOD).
Unfortunately, such sources do not exist. It is becoming increasingly clear
that coupling photons out of a SPOD source will be a limiting factor in many
SPOD implementations. In particular, coupling these source outputs into optical
fibers (usually single mode fibers) is often the preferred method for handling
this light. We investigate the practical limits to this coupling as relates to
parametric downconversion, an important starting point for many SPOD schemes.
We also explored whether it is possible to optimize the engineering of the
downconversion sources to improve on this coupling. We present our latest
results in this area.
","[{""version"":""v1"",""created"":""Fri, 14 Nov 2003 16:21:36 GMT""},{""version"":""v2"",""created"":""Mon, 17 Nov 2003 19:47:25 GMT""}]","2009-11-10"
"quant-ph/0311100","Dong Yang","Dong Yang and Yi-Xin Chen","Distinguishing maximally entangled states locally","1.3 pages, revtex4",,,,"quant-ph",,"  We demonstrate that one maximally entangled state is sufficient and necessary
to distinguish a complete basis of maximally entangled states by local
operation and classical communication.
","[{""version"":""v1"",""created"":""Fri, 14 Nov 2003 16:50:33 GMT""}]","2007-05-23"
