"cond-mat/0311357","Ramses van Zon","R. van Zon, E.G.D. Cohen","Extended Heat-Fluctuation Theorems for a System with Deterministic and
  Stochastic Forces","23 pages, 6 figures. Figures are now in color, Eq. (67) was corrected
  and a footnote was added on the d-dimensional case","Phys. Rev. E 69, 056121 (2004)","10.1103/PhysRevE.69.056121",,"cond-mat.stat-mech",,"  Heat fluctuations over a time \tau in a non-equilibrium stationary state and
in a transient state are studied for a simple system with deterministic and
stochastic components: a Brownian particle dragged through a fluid by a
harmonic potential which is moved with constant velocity. Using a Langevin
equation, we find the exact Fourier transform of the distribution of these
fluctuations for all \tau. By a saddle-point method we obtain analytical
results for the inverse Fourier transform, which, for not too small \tau, agree
very well with numerical results from a sampling method as well as from the
fast Fourier transform algorithm. Due to the interaction of the deterministic
part of the motion of the particle in the mechanical potential with the
stochastic part of the motion caused by the fluid, the conventional heat
fluctuation theorem is, for infinite and for finite \tau, replaced by an
extended fluctuation theorem that differs noticeably and measurably from it. In
particular, for large fluctuations, the ratio of the probability for absorption
of heat (by the particle from the fluid) to the probability to supply heat (by
the particle to the fluid) is much larger here than in the conventional
fluctuation theorem.
","[{""version"":""v1"",""created"":""Fri, 14 Nov 2003 22:57:10 GMT""},{""version"":""v2"",""created"":""Wed, 26 Nov 2003 17:08:09 GMT""}]","2007-05-23"
"cond-mat/0311358","Roland Faller","Roland Faller","Automatic Coarse Graining of Polymers","17 pages, 5 figures","POLYMER 45(11), 3869-3876 (2004)","10.1016/j.polymer.2003.11.053",,"cond-mat.soft cond-mat.mtrl-sci",,"  Several recently proposed semi--automatic and fully--automatic
coarse--graining schemes for polymer simulations are discussed. All these
techniques derive effective potentials for multi--atom units or super--atoms
from atomistic simulations. These include techniques relying on single chain
simulations in vacuum and self--consistent optimizations from the melt like the
simplex method and the inverted Boltzmann method. The focus is on matching the
polymer structure on different scales. Several ways to obtain a time-scale for
dynamic mapping are discussed additionally. Finally, similarities to other
simulation areas where automatic optimization are applied as well are pointed
out.
","[{""version"":""v1"",""created"":""Fri, 14 Nov 2003 23:16:38 GMT""}]","2007-05-23"
"cond-mat/0311360","Zhengfan Zhang","Zhengfan Zhang, Venkat Chandrasekhar, Dmitriy A. Dikin, and Rodney S.
  Ruoff","Conduction in Carbon Nanotubes Through Metastable Resonant States","4 pages, 4 figures","Europhys. Lett., 68 (5), p. 713 (2004)","10.1209/epl/i2004-10266-6",,"cond-mat.mes-hall",,"  We report here on electrical measurements on individual multi-walled carbon
nanotubes (MWNTs) that show that the presence or movement of impurities or
defects in the carbon nanotube can radically change its low temperature
transport characteristics. The low temperature conductance can either decrease
monotonically with decreasing temperature, or show a sudden increase at very
low temperatures, sometimes in the same sample at different times. This unusual
behavior of the temperature dependence of the conductance is correlated with
large variations in the differential conductance as a function of the dc
voltage across the wire. The effect is well described as arising from quantum
interference of conduction channels corresponding to direct transmission
through the nanotube and resonant transmission through a discrete electron
state, the so-called Fano resonance.
","[{""version"":""v1"",""created"":""Sat, 15 Nov 2003 00:47:15 GMT""}]","2007-05-23"
"cond-mat/0311362","John Singleton","N. Harrison, J. Singleton, A. Bangura, A. Ardavan, P.A. Goddard, R.D.
  McDonald and L.K. Montgomery","A new quantum fluid at high magnetic fields in the marginal
  charge-density-wave system $\alpha$-(BEDT-TTF)$_2M$Hg(SCN)$_4$ (where $M=$~K
  and Rb)","13 pages, 11 figures",,"10.1103/PhysRevB.69.165103",,"cond-mat.str-el cond-mat.soft",,"  Single crystals of the organic charge-transfer salts
$\alpha$-(BEDT-TTF)$_2M$Hg(SCN)$_4$ have been studied using Hall-potential
measurements ($M=$K) and magnetization experiments ($M$ = K, Rb). The data show
that two types of screening currents occur within the high-field,
low-temperature CDW$_x$ phases of these salts in response to time-dependent
magnetic fields. The first, which gives rise to the induced Hall potential, is
a free current (${\bf j}_{\rm free}$), present at the surface of the sample.
The time constant for the decay of these currents is much longer than that
expected from the sample resistivity. The second component of the current
appears to be magnetic (${\bf j}_{\rm mag}$), in that it is a microscopic,
quasi-orbital effect; it is evenly distributed within the bulk of the sample
upon saturation. To explain these data, we propose a simple model invoking a
new type of quantum fluid comprising a CDW coexisting with a two-dimensional
Fermi-surface pocket which describes the two types of current. The model and
data are able to account for the body of previous experimental data which had
generated apparently contradictory interpretations in terms of the quantum Hall
effect or superconductivity.
","[{""version"":""v1"",""created"":""Sat, 15 Nov 2003 05:10:02 GMT""}]","2009-11-10"
"cond-mat/0311363","Zhi-Yong Jiao","Zhao-xian Yu, Zhi-yong Jiao","Tunneling effect of the spin-2 Bose condensate driven by external
  magnetic fields","11 pages, 6 figures, accpeted by Physics Letter A",,"10.1016/j.physleta.2003.11.031",,"cond-mat",,"  In this paper, we have studied tunneling effect of the spin-2 Bose condensate
driven by external magnetic field. We find that the population transfers among
spin-0 and spin-$\pm1$, spin-0 and spin-$\pm2$ exhibit the step structure under
the external cosinusoidal magnetic field respectively, but there do not exist
step structure among spin-$\pm1$ and spin-$\pm2$. The tunneling current among
spin-$\pm1$ and spin-$\pm2$ may exhibit periodically oscillation behavior, but
among spin-0 and spin-$\pm1$, spin-0 and spin-$\pm2$, the tunneling currents
exhibit irregular oscillation behavior.
","[{""version"":""v1"",""created"":""Sat, 15 Nov 2003 08:20:39 GMT""}]","2015-06-24"
"cs/0311017","Mema Roussopoulos","Mema Roussopoulos (Harvard University), Mary Baker (HP Labs), David S.
  H. Rosenthal (Stanford University Libraries), TJ Giuli (Stanford University),
  Petros Maniatis (Intel Research), Jeff Mogul (HP Labs)","2 P2P or Not 2 P2P?","6 pages, 1 figure",,,,"cs.NI cs.AR",,"  In the hope of stimulating discussion, we present a heuristic decision tree
that designers can use to judge the likely suitability of a P2P architecture
for their applications. It is based on the characteristics of a wide range of
P2P systems from the literature, both proposed and deployed.
","[{""version"":""v1"",""created"":""Fri, 14 Nov 2003 22:36:39 GMT""}]","2007-05-23"
"gr-qc/0311049","Slava G. Turyshev","Slava G. Turyshev, Michael Shao and Kenneth Nordtvedt Jr","New Concept for Testing General Relativity: The Laser Astrometric Test
  of Relativity (LATOR) Mission","11 pages, 4 figures, invited talk presented at AIAA Meeting ""Space
  2003"", 23 September 2003, Long Beach, CA","Astron.Nachr. 325 (2004) 267-277","10.1002/asna.200310205",,"gr-qc",,"  This paper discusses new Fundamental physics experiment that will test
relativistic gravity at the accuracy better than the effects of the second
order in the gravitational field strength, ~G^2. The Laser Astrometric Test Of
Relativity (LATOR) mission uses laser interferometry between two
micro-spacecraft whose lines of sight pass close by the Sun to accurately
measure deflection of light in the solar gravity. The key element of the
experimental design is a redundant geometry optical truss provided by a
long-baseline (100 m) multi-channel stellar optical interferometer placed on
the International Space Station (ISS). The spatial interferometer is used for
measuring the angles between the two spacecraft and for orbit determination
purposes. LATOR will not only improve the value of the parameterized
post-Newtonian (PPN) $\gamma$ to unprecedented levels of accuracy of 1 part in
10e8, it will also reach ability to measure effects of the next post-Newtonian
order (1/c^4) of light deflection resulting from gravity's intrinsic
non-linearity. The solar quadrupole moment parameter, J2, will be measured with
high precision, as well as a variety of other relativistic effects including
Lense-Thirring precession. LATOR will lead to very robust advances in the tests
of Fundamental physics: this mission could discover a violation or extension of
general relativity, or reveal the presence of an additional long range
interaction in the physical law. There are no analogs to the LATOR experiment;
it is unique and is a natural culmination of solar system gravity experiments.
","[{""version"":""v1"",""created"":""Sat, 15 Nov 2003 04:11:19 GMT""}]","2007-05-23"
"gr-qc/0311050","Tiberiu Harko","M. K. Mak, T. Harko","Full causal dissipative cosmologies with stiff matter","6 pages, 6 figures, to appear in Int. J. Mod. Phys. D","Int.J.Mod.Phys.D13:273-280,2004","10.1142/S0218271804004645",,"gr-qc",,"  The general solution of the gravitational field equations for a full causal
bulk viscous stiff cosmological fluid, with bulk viscosity coefficient
proportional to the energy density to the power 1/4, is obtained in the flat
Friedmann-Robertson-Walker geometry. The solution describes a non-inflationary
Universe, which starts its evolution from a singular state. The time variation
of the scale factor, deceleration parameter, viscous pressure, viscous
pressure-thermodynamic pressure ratio, comoving entropy and Ricci and
Kretschmann invariants is considered in detail.
","[{""version"":""v1"",""created"":""Sat, 15 Nov 2003 02:15:09 GMT""}]","2008-11-26"
"hep-ex/0311034","Marie-Helene Genest","The PICASSO Collaboration: M. Barnabe-Heider, E. Behnke, J. Behnke, M.
  Di Marco, P. Doane, W. Feighery, M-H. Genest, R. Gornea, S. Kanagalingam, C.
  Leroy, L. Lessard, I. Levine, J. P. Martin, C. Mathusi, J. Neurenberg, A.J.
  Noble, R. Noulty, R. Nymberg, S.N. Shore, U. Wichoski, V. Zacek","Characterization of the Response of Superheated Droplet (Bubble)
  Detectors","10 pages, 7 figures, to appear in the ""Proceedings of the 8th ICATPP
  Conference on Astroparticle, Particle, Space Physics, Detectors and Medical
  Physics Applications"", 6-10 October 2003, Villa Erba, Como, Italy",,,,"hep-ex",,"  The PICASSO project is a cold dark matter (CDM) search experiment relying on
the superheated droplet technique. The detectors use superheated freon liquid
droplets (active material) dispersed and trapped in a polymerized gel. This
detection technique is based on the phase transition of superheated droplets at
room or moderate temperatures. The phase transitions are induced by nuclear
recoils when undergoing interactions with particles, including CDM candidates
such as the neutralinos predicted by supersymmetric models. The suitability of
the technique for this purpose has been demonstrated by R&D studies performed
over several years on detectors of various composition and volume. Simulations
performed to understand the detector response to neutrons and alpha particles
are presented along with corresponding data obtained at the Montreal
Laboratory.
","[{""version"":""v1"",""created"":""Fri, 14 Nov 2003 16:20:42 GMT""}]","2007-05-23"
"hep-ex/0311035","Stefan Soldner-Rembold","Stefan Soldner-Rembold","Recent D0 Results at Run II","12 pages, 11 figures, ubmitted to the proceedings of the 4th
  International Conference on Physics Beyond the Standard Model, Beyond the
  Desert '03, Schloss Ringberg, Tegernsee, Germany, 9-14 June 2003",,,,"hep-ex",,"  The DO experiment is taking data with an upgraded detector since March 2001.
The integrated luminosity taken in Run II has now exceeded that taken in Run I.
Selected physics results obtained with this data set are presented.
","[{""version"":""v1"",""created"":""Fri, 14 Nov 2003 17:57:41 GMT""}]","2007-05-23"
"hep-ex/0311036","Alexis Pompili","Alexis Pompili","Observation of two narrow mesons in the D+_s pi^0 and D+_s pi^0 gamma
  final states. Results from BaBar, Belle and CLEO","Contribution to the Proceedings of the International Workshop on QCD:
  QCD@Work 2003 - Conversano (Italy) 14-18 June 2003 (eConf C030614)","ECONF C030614:027,2003",,,"hep-ex",,"  The BaBar experiment has discovered a narrow state, denoted as
D*_{sJ}(2317)+, near 2.32 GeV/c^2 in the D+s pi^0 invariant mass distribution
from inclusive $e^{+}e^{-}$ interactions at center-of-mass energies near 10.6
GeV. The same experiment has hinted the presence of a second new state near
2.46 GeV/c^2 in the D+_s pi^0 gamma mass spectrum. These discoveries have
triggered CLEO and Belle experiments in their own search for new states coupled
to D+_s meson. They have confirmed the existence of the D*_{sJ}(2317)^+ state
and established the evidence for the second state denoted as D*_{sJ}(2458)^+.
Belle has reported evidence for both states not only in continuum e+e-
annihilations but also in B decays. These two new narrow resonances are
characterized by masses significantly lower than predicted by potential models
and enough to close off the most natural decay modes, thus forcing
isospin-violating transitions. Their discovery has been a surprise because it
contradicts the expectations of apparently established theory. This
circumstance has led to a great effort on theoretical side as well.
","[{""version"":""v1"",""created"":""Sat, 15 Nov 2003 13:23:00 GMT""}]","2014-11-17"
"hep-ph/0311190","Ilya Lvovich Shapiro","Eduard V. Gorbar and Ilya L. Shapiro","Renormalization Group and Decoupling in Curved Space: III. The Case of
  Spontaneous Symmetry Breaking","22 pages, LaTeX","JHEP 0402 (2004) 060","10.1088/1126-6708/2004/02/060","DF/UFJF-03/09","hep-ph gr-qc hep-th",,"  We continue investigation of the renormalization group and decoupling of the
quantized massive fields in curved space. In the present work we analyze a
theory, where fields gain their masses due to the Spontaneous Symmetry Breaking
(SSB), that is the case providing a remarkable exception from the
Appelquist-Carazzone theorem in the matter fields sector. In the vacuum sector,
already at the classical level, the theory with SSB includes, in the general
case an infinite number of the non-local terms in the induced vacuum action.
Despite this surprising property, we show that the theory is renormalizable and
moreover the low-energy decoupling in the higher-derivative gravitational
sector performs similar to the AC theorem.
","[{""version"":""v1"",""created"":""Fri, 14 Nov 2003 16:04:53 GMT""},{""version"":""v2"",""created"":""Sat, 15 Nov 2003 19:23:06 GMT""}]","2009-11-10"
"hep-ph/0311197","Sergio Scopetta","Sergio Scopetta, Vicente Vento","Generalized Parton Distributions and the structure of the constituent
  quark","7 pages, 3 figures, to appear in the Proceedings of ""2nd Int. Conf.
  on Nuclear and Particle Physics with CEBAF at Jefferson Lab"", Dubrovnik,
  26-31 May 2003, to be published in Fyzika B","Fizika B13 (2004) 397-404",,,"hep-ph nucl-th",,"  In a scenario where the constituent quarks are composite systems, Generalized
Parton Distributions (GPDs) are built from wave functions to be evaluated in a
Constituent Quark Model (CQM), convoluted with the GPDs of the constituent
quarks themselves. The approach permits to access the kinematical range
corresponding to the DGLAP and ERBL regions, so that cross sections for deeply
virtual Compton scattering could be estimated.
","[{""version"":""v1"",""created"":""Fri, 14 Nov 2003 16:03:23 GMT""}]","2007-05-23"
"hep-ph/0311198","P. Q. Hung","P. Q. Hung, M. Seco, A. Soddu (Dept. of Physics, University of
  Virginia)","Phenomenology of a Quark Mass Matrix from Six Dimensions and its
  implication for the Strong CP problem","RevTeX, 21 pages and 14 figures","Nucl.Phys.B692:83,2004","10.1016/j.nuclphysb.2004.05.007",,"hep-ph",,"  A model of quark mass matrices from six dimensions, which is nearly democatic
in nature and which is previously constructed by two of us (PQH and MS), is
studied in detail in this manuscript. We found that not only it fits all the
six quark masses as well as the CKM matrix but also that there exists a region
in the allowed parameter space of the model where the constraint on the
parameter \bar{\theta} of the Strong CP problem is satisfied. This region
itself puts a constraint on the CKM parameters \bar{\rho} and \bar{\eta}. As
such, through our analysis, there appears to be a deep connection between
Strong and Weak CP in this model
","[{""version"":""v1"",""created"":""Fri, 14 Nov 2003 20:14:08 GMT""}]","2014-11-17"
"hep-ph/0311199","Bryan J. Field","B. Field (Stony Brook, BNL), S. Dawson (BNL), J. Smith (Stony Brook)","Scalar and Pseudoscalar Higgs Boson Plus One Jet Production at the LHC
  and Tevatron","14 pages, REVTeX4, 14 eps figures v2: Version accepted for
  publication in PRD","Phys.Rev.D69:074013,2004","10.1103/PhysRevD.69.074013","YITP-SB-03-57, BNL-HET-03/27","hep-ph",,"  The production of the Standard Model (SM) Higgs boson (H) in association with
a jet is compared with that of the lightest scalar Higgs boson (h^0) and the
pseudoscalar Higgs boson (A^0) of the Minimal Supersymmetric Model (MSSM) at
both the CERN Large Hadron Collider (LHC) and the Fermilab Tevatron. We include
both top and bottom quark loops to lowest order in QCD and investigate the
limits of zero quark mass and infinite quark mass.
","[{""version"":""v1"",""created"":""Fri, 14 Nov 2003 20:11:12 GMT""},{""version"":""v2"",""created"":""Fri, 6 Feb 2004 18:29:45 GMT""}]","2008-11-26"
"hep-ph/0311200","Anton Rebhan","A. Ipp, A. Rebhan, A. Vuorinen","Perturbative QCD at non-zero chemical potential: Comparison with the
  large-Nf limit and apparent convergence","REVTEX4, 4 pages, 3 color figures. v2: fig. 3 now includes also
  lattice data for two-flavor QCD at nonzero chemical potential","Phys.Rev. D69 (2004) 077901","10.1103/PhysRevD.69.077901","HIP-2003-56/TH, TUW-03-35","hep-ph hep-lat",,"  The perturbative three-loop result for the thermodynamic potential of QCD at
finite temperature and chemical potential as obtained in the framework of
dimensional reduction is compared with the exact result in the limit of large
flavor number. The apparent convergence of the former as well as possibilities
for optimization are investigated. Corresponding optimized results for full QCD
are given for the case of two massless quark flavors.
","[{""version"":""v1"",""created"":""Fri, 14 Nov 2003 20:15:20 GMT""},{""version"":""v2"",""created"":""Tue, 10 Feb 2004 16:37:47 GMT""}]","2009-11-10"
"hep-ph/0311201","Rodolfo A. Diaz","Rodolfo A. Diaz, R. Martinez, Carlos E. Sandoval","Constraints on lepton flavor violation in the two Higgs doublet model","8 pages, LaTeX2e",,,,"hep-ph",,"  Constraints on the whole spectrum of lepton flavor violating vertices are
shown in the context of the standard two Higgs doublet model. The vertex
involving the $e-\tau$ mixing is much more constrained than the others, and the
decays proportional to such vertex are usually very suppressed.
","[{""version"":""v1"",""created"":""Fri, 14 Nov 2003 20:28:46 GMT""}]","2007-05-23"
"hep-ph/0311202","Gorazd Cvetic","C. Contreras, G. Cvetic, and P. Gaete (UTFSM, Valparaiso)","Calculations of binding energies and masses of heavy quarkonia using
  renormalon cancellation","23 pages, 8 double figures, revtex4; the version to appear in
  Phys.Rev.D; extended discussion between Eqs.(25) and (26); the paragraph
  between Eqs.(32) and (33) is new and explains the numerical dependence of the
  residue parameter on the factorization scale; several new references were
  added; acknowledgments were modified; the numerical results are unchanged","Phys.Rev. D70 (2004) 034008","10.1103/PhysRevD.70.034008","USM-TH-148","hep-ph",,"  We use various methods of Borel integration to calculate the binding ground
energies and masses of b-bbar and t-tbar quarkonia. The methods take into
account the leading infrared renormalon structure of the hard+soft part of the
binding energies E(s), and of the corresponding quark pole masses m_q, where
the contributions of these singularities in M(s) = 2 m_q + E(s) cancel.
Beforehand, we carry out the separation of the binding energy into its
hard+soft and ultrasoft parts. The resummation formalisms are applied to
expansions of m_q and E(s) in terms of quantities which do not involve
renormalon ambiguity, such as MSbar quark mass, and alpha_s. The
renormalization scales are different in calculations of m_q, E(s) and E(us).
The MSbar mass of b quark is extracted, and the binding energies of t-tbar and
the peak (resonance) energies for (t+tbar) production are obtained.
","[{""version"":""v1"",""created"":""Fri, 14 Nov 2003 20:39:42 GMT""},{""version"":""v2"",""created"":""Tue, 27 Apr 2004 18:53:39 GMT""}]","2009-11-10"
"hep-ph/0311203","S. Chaturvedi","S. Chaturvedi, Virendra Gupta","Is the quark- mixing matrix moduli symmetric?","7 pages, Latex, 1 figure","Mod.Phys.Lett. A19 (2004) 159","10.1142/S0217732304013039",,"hep-ph",,"  If the unitary quark- mixing matrix, $V$, is moduli symmetric then it depends
on three real parameters. This means that there is a relation between the four
parameters needed to parametrize a general $V$. It is shown that there exists a
very simple relation involving $|V_{11}|^2, |V_{33}|^2,\orh $ and $\oet$. This
relation is compared with the present experimental data. It is concluded that a
moduli symmetric $V$ is not ruled out.
","[{""version"":""v1"",""created"":""Sat, 15 Nov 2003 05:38:46 GMT""}]","2009-11-10"
"hep-th/0311119","Klaus Behrndt","Klaus Behrndt and Claus Jeschek","Fluxes in M-theory on 7-manifolds: G-structures and Superpotential","32 pages, 1 figure, major changes in superpotential + typos
  corrected, refs. added","Nucl.Phys. B694 (2004) 99-114","10.1016/j.nuclphysb.2004.06.028",,"hep-th",,"  We consider compactifications of M-theory on 7-manifolds in the presence of
4-form fluxes, which leave at least four supercharges unbroken. We focus
especially on the case, where the 7-manifold supports two spinors which are
SU(3) singlets and the fluxes appear as specific SU(3) structures. We derive
the constraints on the fluxes imposed by supersymmetry and calculate the
resulting 4-dimensional superpotential.
","[{""version"":""v1"",""created"":""Fri, 14 Nov 2003 16:27:14 GMT""},{""version"":""v2"",""created"":""Fri, 28 Nov 2003 12:33:45 GMT""},{""version"":""v3"",""created"":""Mon, 5 Jan 2004 19:58:52 GMT""}]","2010-04-05"
"hep-th/0311123","Hyun Min Lee","Hyun Min Lee (Bonn University)","Localized tadpoles and anomalies in 6D orbifolds","6 pages, no figure, Proceeding of talk given at International
  Conference on Flavor Physics, KIAS, Seoul, 6-11 Oct 2003","J.Korean Phys.Soc. 45 (2004) S318-S322",,,"hep-th",,"  In this talk, we review the instability due to radiatively induced FI
tadpoles in ${\cal N}=2$ supersymmetric gauge theories on orbifolds in six
dimensions. Even with the localized FI tadpoles, we have the unbroken
supersymmetry at the expense of having the spontaneous localization of bulk
zero mode. We find the non-decoupling of massive modes unlike the 5D case. We
also comment on the local anomaly cancellation.
","[{""version"":""v1"",""created"":""Fri, 14 Nov 2003 16:12:41 GMT""}]","2007-05-23"
"hep-th/0311124","J. Mourad","C. Deffayet, J. Mourad","Multigravity from a discrete extra dimension","14 pages, v.2 reference added, footnote removed","Phys.Lett.B589:48-58,2004","10.1016/j.physletb.2004.03.053",,"hep-th gr-qc",,"  Multigravity theories are constructed from the discretization of the extra
dimension of five dimensional gravity. Using an ADM decomposition, the
discretization is performed while maintaining the four dimensional
diffeomorphism invariance on each site. We relate the Goldstone bosons used to
realize nonlinearly general covariance in discretized gravity to the shift
fields of the higher dimensional metric. We investigate the scalar excitations
of the resulting theory and show the absence of ghosts and massive modes; this
is due to a local symmetry inherited from the reparametrization invariance
along the fifth dimension.
","[{""version"":""v1"",""created"":""Fri, 14 Nov 2003 16:42:55 GMT""},{""version"":""v2"",""created"":""Thu, 20 Nov 2003 11:36:18 GMT""}]","2009-10-07"
