"cond-mat/0311378","Zsolt Gulacsi","Zsolt Gulacsi","Exact multi-electronic electron-concentration dependent ground-states
  for disordered two-dimensional two-band systems in presence of disordered
  hoppings and finite on-site random interactions","Accepted for publication in Phys. Rev. B","Phys. Rev. B69, 054204 (2004).","10.1103/PhysRevB.69.054204",,"cond-mat.dis-nn cond-mat.str-el",,"  We report exact multielectronic ground-states dependent on electron
concentration for quantum mechanical two-dimensional disordered two-band type
many body models in the presence of disordered hoppings and disordered
repulsive finite Hubbard interactions, in fixed lattice topology considered
provided by Bravais lattices. The obtained ground-states loose their
eigenfunction character for independent electron approximation, perturbatively
are not connected to the non-interacting but disordered case, and describe a
localization-delocalization transition driven by the electron concentration,
being highly degenerated and paramagnetic.
","[{""version"":""v1"",""created"":""Mon, 17 Nov 2003 11:22:44 GMT""}]","2009-11-10"
"cond-mat/0311379","Juergen Schmiegel","Juergen Schmiegel, Jochen Cleve, Hans C. Eggers, Bruce R. Pearson,
  Martin Greiner","Stochastic energy-cascade model for 1+1 dimensional fully developed
  turbulence",,,"10.1016/j.physleta.2003.11.025",,"cond-mat",,"  Geometrical random multiplicative cascade processes are often used to model
positive-valued multifractal fields such as the energy dissipation in fully
developed turbulence. We propose a dynamical generalization describing the
energy dissipation in terms of a continuous and homogeneous stochastic field in
one space and one time dimension. In the model, correlations originate in the
overlap of the respective spacetime histories of field amplitudes. The
theoretical two- and three-point correlation functions are found to be in good
agreement with their equal-time counterparts extracted from wind tunnel
turbulent shear flow data.
","[{""version"":""v1"",""created"":""Mon, 17 Nov 2003 11:26:13 GMT""}]","2015-06-24"
"cond-mat/0311380","Akio Tsukada","A. Tsukada, Y.Krockenberger, H. Yamamoto, M. Naito","New superconducting T'-(La3+)2-x(RE3+)xCuO4 with isovalent doping (RE =
  Sm, Eu, Tb, Lu, and Y)","13 pages, 6 figures",,,,"cond-mat.supr-con",,"  We report the synthesis of new superconducting cuprates T'-La2-xRExCuO4 (RE =
Sm, Eu, Tb, Lu, and Y) using molecular beam epitaxy. The new superconductors
have no effective dopant, at least nominally. The substitution of isovalent RE
for La was essentially performed to stabilize the T' phase of La2CuO4 instead
of the T phase. The maximum Tconset is ~ 25 K and Tczero is ~ 21 K. The keys to
our discovery are (1) the preparation of high-crystalline-quality La-based T'
films by low-temperature (~650C) thin film processes, and (2) more thorough
removal of impurity oxygen at the apical site, which is achieved by the larger
in-plane lattice constant (a0) of T'-La2-xRExCuO4 than other T'-Ln2CuO4 (Ln =
Pr, Nd, Sm, Eu, Gd) with the aid of large surface-to-volume ratio of thin
films. The photoemission spectra suggest that the end member compounds of the
T' system may not be a Mott insulator.
","[{""version"":""v1"",""created"":""Mon, 17 Nov 2003 12:17:14 GMT""}]","2007-05-23"
"cond-mat/0311381","Zeljana Agic","Zeljana Agic, Pasko Zupanovic and Aleksa Bjelis","Effects of transverse electron dispersion on photo-emission spectra of
  quasi-one-dimensional systems","2 pages, 2 figures, ISCOM'03",,"10.1051/jp4:2004114018",,"cond-mat.soft",,"  The random phase approximation (RPA) spectral function of the one-dimensional
electron band with the three-dimensional long range Coulomb interaction shows a
broad feature which is spread on the scale of the plasmon energy and vanishes
at the chemical potential. The fact that there are no quasi-particle
$\delta$-peaks is the direct consequence of the acoustic nature of the
collective plasmon mode. This behaviour of the spectral function is in the
qualitative agreement with the angle resolved photo-emission spectra of some
Bechgaard salts. In the present work we consider the modifications in the
spectral function due to finite transverse electron dispersion. The transverse
bandwidth is responsible for the appearance of an optical gap in the long
wavelength plasmon mode. The plasmon dispersion of such kind introduces the
quasi-particle $\delta$-peak into the spectral function at the chemical
potential. The cross-over from the Fermi liquid to the non-Fermi liquid regime
by decreasing the transverse bandwidth takes place through the decrease of the
quasi-particle weight as the optical gap in the long wavelength plasmon mode is
closing.
","[{""version"":""v1"",""created"":""Mon, 17 Nov 2003 12:54:02 GMT""}]","2009-11-10"
"cond-mat/0311382","Jani-Petri Martikainen","J.-P. Martikainen and H. T. C. Stoof","Spontaneous squeezing of a vortex in an optical lattice","8 pages, 3 figures, more details added, some new citations","Phys.Rev.A70:013604,2004","10.1103/PhysRevA.70.013604","ITP-UU-03/59","cond-mat.stat-mech",,"  We study the equilibrium states of a vortex in a Bose-Einstein condensate in
a one-dimensional optical lattice. We find that quantum effects can be
important and that it is even possible for the vortex to be strongly squeezed,
which reflects itself in a different quantum mechanical uncertainty of the
vortex position in two orthogonal directions. The latter is observable by
measuring the atomic density after an expansion of the Bose-Einstein condensate
in the lattice.
","[{""version"":""v1"",""created"":""Mon, 17 Nov 2003 13:37:02 GMT""},{""version"":""v2"",""created"":""Tue, 3 Aug 2004 09:42:56 GMT""}]","2014-10-13"
"cond-mat/0311383","Konstantin Arutyunov","M. Savolainen, V. Touboltsev, P. Koppinen, K.-P. Riikonen, and K.
  Arutyunov","Ion beam sputtering method for progressive reduction of nanostructures
  dimensions",,"Appl. Phys. A 79, 1769--1773 (2004)","10.1007/s00339-004-2709-8",,"cond-mat.supr-con cond-mat.mes-hall",,"  An ion beam based dry etching method has been developed for progressive
reduction of dimensions of prefabricated nanostructures. The method has been
successfully applied to aluminum nanowires and aluminum single electron
transistors (SET). The method is based on removal of material from the
structures when exposed to energetic argon ions and it was shown to be
applicable multiple times to the same sample. The electrical measurements and
samples imaging in between the sputtering sessions clearly indicated that the
dimensions, i.e. cross-section of the nanowires and area of the tunnel
junctions in SET, were progressively reduced without noticeable degradation of
the sample structure. We were able to reduce the effective diameter of aluminum
nanowires from ~65 nm down to ~30 nm, whereas the tunnel junction area has been
reduced by 40 %.
","[{""version"":""v1"",""created"":""Mon, 17 Nov 2003 13:44:58 GMT""},{""version"":""v2"",""created"":""Fri, 21 Nov 2003 12:17:02 GMT""}]","2009-04-07"
"cond-mat/0311384","Francesco Giazotto","F. Giazotto, T. T. Heikkila, F. Taddei, Rosario Fazio, J. P. Pekola,
  and F. Beltram","Tailoring Josephson coupling through superconductivity-induced
  nonequilibrium","4 pages, 4 figures","Phys. Rev. Lett. 92, 137001 (2004)","10.1103/PhysRevLett.92.137001",,"cond-mat.mes-hall cond-mat.supr-con",,"  The distinctive quasiparticle distribution existing under nonequilibrium in a
superconductor-insulator-normal metal-insulator-superconductor (SINIS)
mesoscopic line is proposed as a novel tool to control the supercurrent
intensity in a long Josephson weak link. We present a description of this
system in the framework of the diffusive-limit quasiclassical Green-function
theory and take into account the effects of inelastic scattering with arbitrary
strength. Supercurrent enhancement and suppression, including a marked
transition to a $\pi$-junction are striking features leading to a fully tunable
structure.
","[{""version"":""v1"",""created"":""Mon, 17 Nov 2003 14:26:51 GMT""}]","2008-07-12"
"cond-mat/0311385","Norikazu Todoroki","Yasusada Yamada, Norikazu Todoroki and Seiji Miyashita","A Theory of Ferroelectric Phase Transition in SrTiO$_3$ induced by
  Isotope Replacement","26 pages, 8 figures","Phys. Rev. B 69, 024103 (2004)","10.1103/PhysRevB.69.024103",,"cond-mat.stat-mech",,"  A theory to describe the dielectric anomalies and the ferroelectric phase
transition induced by oxygen isotope replacement in SrTiO$_3$ is developed. The
proposed model gives consistent explanation between apparently contradictory
experimental results on macroscopic dielectric measurements versus microscopic
lattice dynamical measurements by neutron scattering studies. The essential
feature is described by a 3-state quantum order-disorder system characterizing
the degenerated excited states in addition to the ground state of TiO$_6$
cluster. The effect of isotope replacement is taken into account through the
tunneling frequency between the excited states. The dielectric properties are
analyzed by the mean field approximation (MFA), which gives qualitative
agreements with experimental results throughout full range of the isotope
concentration.The phase diagram in the temperature-tunneling
frequencycoordinate is studied by a QMC method to confirm the qualitative
validity of the MFA analysis.
","[{""version"":""v1"",""created"":""Mon, 17 Nov 2003 14:48:33 GMT""}]","2009-11-10"
"cs/0311018","Carla Piazza","Carla Piazza (1) and Alberto Policriti (2) ((1) Universita' Ca'
  Foscari di Venezia (2) Universita' degli Studi di Udine)","Ackermann Encoding, Bisimulations, and OBDDs","To appear on 'Theory and Practice of Logic Programming'",,,,"cs.LO cs.DS",,"  We propose an alternative way to represent graphs via OBDDs based on the
observation that a partition of the graph nodes allows sharing among the
employed OBDDs. In the second part of the paper we present a method to compute
at the same time the quotient w.r.t. the maximum bisimulation and the OBDD
representation of a given graph. The proposed computation is based on an
OBDD-rewriting of the notion of Ackermann encoding of hereditarily finite sets
into natural numbers.
","[{""version"":""v1"",""created"":""Sun, 16 Nov 2003 19:30:28 GMT""}]","2009-09-29"
"cs/0311020","Hsueh-I. Lu","Kai-min Chung and Hsueh-I Lu","An Optimal Algorithm for the Maximum-Density Segment Problem","15 pages, 12 figures, an early version of this paper was presented at
  11th Annual European Symposium on Algorithms (ESA 2003), Budapest, Hungary,
  September 15-20, 2003","SIAM Journal on Computing, 34(2):373-387, 2004","10.1137/S0097539704440430",,"cs.DS cs.DM",,"  We address a fundamental problem arising from analysis of biomolecular
sequences. The input consists of two numbers $w_{\min}$ and $w_{\max}$ and a
sequence $S$ of $n$ number pairs $(a_i,w_i)$ with $w_i>0$. Let {\em segment}
$S(i,j)$ of $S$ be the consecutive subsequence of $S$ between indices $i$ and
$j$. The {\em density} of $S(i,j)$ is
$d(i,j)=(a_i+a_{i+1}+...+a_j)/(w_i+w_{i+1}+...+w_j)$. The {\em maximum-density
segment problem} is to find a maximum-density segment over all segments
$S(i,j)$ with $w_{\min}\leq w_i+w_{i+1}+...+w_j \leq w_{\max}$. The best
previously known algorithm for the problem, due to Goldwasser, Kao, and Lu,
runs in $O(n\log(w_{\max}-w_{\min}+1))$ time. In the present paper, we solve
the problem in O(n) time. Our approach bypasses the complicated {\em right-skew
decomposition}, introduced by Lin, Jiang, and Chao. As a result, our algorithm
has the capability to process the input sequence in an online manner, which is
an important feature for dealing with genome-scale sequences. Moreover, for a
type of input sequences $S$ representable in $O(m)$ space, we show how to
exploit the sparsity of $S$ and solve the maximum-density segment problem for
$S$ in $O(m)$ time.
","[{""version"":""v1"",""created"":""Mon, 17 Nov 2003 09:37:57 GMT""}]","2007-05-23"
"cs/0311021","Lev Shamardin","L. Shamardin (Skobektsyn Institute of Nuclear Physics Moscow State
  University, Moscow, Russia)","LCG-1 Deployment and usage experience","To be published in the proceedings of the XIX International Symposium
  on Nuclear Electronics and Computing (NEC'2003), Bulgaria, Varna, 15-20
  September, 2003",,,,"cs.DC",,"  LCG-1 is the second release of the software framework for the LHC Computing
Grid project. In our work we describe the installation process, arising
problems and their solutions, and configuration tuning details of the complete
LCG-1 site, including all LCG elements required for the self-sufficient site.
","[{""version"":""v1"",""created"":""Mon, 17 Nov 2003 13:19:31 GMT""}]","2007-05-23"
"cs/0311022","Massimo Franceschet","M. Franceschet and A. Montanari","Temporalized logics and automata for time granularity","Journal: Theory and Practice of Logic Programming Journal Acronym:
  TPLP Category: Paper for Special Issue (Verification and Computational Logic)
  Submitted: 18 March 2002, revised: 14 Januari 2003, accepted: 5 September
  2003",,,,"cs.LO",,"  Suitable extensions of the monadic second-order theory of k successors have
been proposed in the literature to capture the notion of time granularity. In
this paper, we provide the monadic second-order theories of downward unbounded
layered structures, which are infinitely refinable structures consisting of a
coarsest domain and an infinite number of finer and finer domains, and of
upward unbounded layered structures, which consist of a finest domain and an
infinite number of coarser and coarser domains, with expressively complete and
elementarily decidable temporal logic counterparts.
  We obtain such a result in two steps. First, we define a new class of
combined automata, called temporalized automata, which can be proved to be the
automata-theoretic counterpart of temporalized logics, and show that relevant
properties, such as closure under Boolean operations, decidability, and
expressive equivalence with respect to temporal logics, transfer from component
automata to temporalized ones. Then, we exploit the correspondence between
temporalized logics and automata to reduce the task of finding the temporal
logic counterparts of the given theories of time granularity to the easier one
of finding temporalized automata counterparts of them.
","[{""version"":""v1"",""created"":""Mon, 17 Nov 2003 14:11:20 GMT""}]","2007-05-23"
"hep-lat/0311022","E. T. Tomboulis","E. T. Tomboulis","Connecting short to long scales in the confining vacuum","10 pages, 2 figures, Latex, Invited talk at Confinement 2003, Tokyo,
  Japan, July 21-24, 2003, to appear in the proceedings",,"10.1142/9789812702845_0005",,"hep-lat",,"  We study approximate decimations in SU(N) LGT that connect the short to long
distance regimes. Simple `bond-moving' decimations turn out to provide both
upper and lower bounds on the exact partition function. This leads to a
representation of the exact partition function in terms of successive
decimations whose effective couplings flows are related to those of the easily
computable bond-moving decimations. The implications for a derivation of
confinement from first principles are discussed.
","[{""version"":""v1"",""created"":""Mon, 17 Nov 2003 02:56:32 GMT""}]","2017-08-23"
"hep-lat/0311023","Stephan Durr","Gilberto Colangelo, Stephan D\""urr","The pion mass in finite volume","16 pages, 7 figures, 3 tables","Eur.Phys.J.C33:543-553,2004","10.1140/epjc/s2004-01593-y","DESY 03-177","hep-lat hep-ph",,"  We determine the relative pion mass shift $M_\pi(L)/M_\pi-1$ due to the
finite spatial extent $L$ of the box by means of two-flavor chiral perturbation
theory and the one-particle L\""uscher formula. We use as input the expression
for the infinite volume $\pi\pi$ forward scattering amplitude up to
next-to-next-to-leading order and can therefore control the convergence of the
chiral series. A comparison to the full leading order chiral expression for the
pion mass in finite volume allows us to check the size of subleading terms in
the large-$L$ expansion.
","[{""version"":""v1"",""created"":""Mon, 17 Nov 2003 10:28:55 GMT""}]","2011-05-05"
"hep-ph/0311205","Evgeni Kolomeitsev","E.E. Kolomeitsev (NBI, Copenhagen) and M.F.M. Lutz (GSI, TU,
  Darmstadt)","Charmed meson resonances from chiral coupled-channel dynamics","Presented at Hadron 03: 10th International Conference on Hadron
  Spectroscopy, Aschaffenburg, Germany, 31 Aug - 6 Sep 2003","AIP Conf.Proc.717:665-669,2004","10.1063/1.1799776",,"hep-ph",,"  Charmed meson resonances with quantum numbers J^P=0^+ and J^P=1^+ are
generated in terms of chiral coupled-channel dynamics. At leading order in the
chiral expansion a parameter-free prediction is obtained for the scattering of
Goldstone bosons off charmed pseudo-scalar and vector mesons. The recently
announced narrow open charm states observed by the BABAR and CLEO
collaborations are reproduced. We suggest the existence of states that form an
anti-triplet and a sextet representation of the SU(3) group. In particular, so
far unobserved narrow isospin-singlet states with negative strangeness are
predicted.
","[{""version"":""v1"",""created"":""Mon, 17 Nov 2003 08:21:13 GMT""}]","2010-12-16"
"hep-ph/0311206","Koichi Yoshioka","Motoi Endo, Masahiro Yamaguchi and Koichi Yoshioka","Radiative CP Phases in Supergravity Theories","14 pages, 5 figures, references added","Phys.Lett. B586 (2004) 382-389","10.1016/j.physletb.2004.02.035","TU-702, KYUSHU-HET-69","hep-ph",,"  In this letter, we point out that possible sources of CP violation originate
from radiative corrections to soft terms which are ubiquitous in supergravity
theories and also in other high-energy frameworks of supersymmetry breaking.
With these radiative phases of gaugino masses and scalar couplings, a complex
phase of Higgs holomorphic mass parameter is generated via
renormalization-group running down to low energy. It is found that its phase
value is mainly controlled by wino as well as gluino, which generally receive
different radiative corrections to their complex phases, even if the leading
part of mass parameters follow from the universality hypothesis. The
radiatively generated phases are constrained by the existing experimental
bounds on electric dipole moments, and may be detectable in future
measurements. They are also found to be available for the cancellation
mechanism to be worked.
","[{""version"":""v1"",""created"":""Mon, 17 Nov 2003 09:50:55 GMT""},{""version"":""v2"",""created"":""Fri, 23 Jan 2004 10:01:42 GMT""}]","2010-04-05"
"hep-ph/0311207","D. P. Roy","D. P. Roy","History of exotic Meson (4-quark) and Baryon (5-quark) States","14 pages Latex including 4 eps figures, final version to appear as a
  topical review in J. Phys. G","J.Phys. G30 (2004) R113","10.1088/0954-3899/30/3/R02","TIFR/TH/03-22","hep-ph",,"  I briefly review the history of exotic meson (4-quark) and baryon (5-quark)
states, which is rooted in the formalism of Regge pole and duality. There are
robust model-independent predictions for the exchange of 4-quark (Baryonium)
Regge trajectories in several processes, which are strongly supported by
experiment. On the other hand the predictions for the spectroscopy of 4-quark
resonances are based on specific QCD inspired models, with some experimental
support. The corresponding predictions for the recently discovered exotic
baryon (Pentaquark) state are briefly discussed.
","[{""version"":""v1"",""created"":""Mon, 17 Nov 2003 10:35:43 GMT""},{""version"":""v2"",""created"":""Tue, 9 Dec 2003 06:17:05 GMT""},{""version"":""v3"",""created"":""Wed, 24 Dec 2003 12:11:52 GMT""}]","2009-11-10"
"hep-ph/0311208","Bryan Webber","Stefan Gieseke, Alberto Ribon, Michael H Seymour, Philip Stephens,
  Bryan Webber","Herwig++ 1.0: An Event Generator for e+e- Annihilation","39 pages, 15 figures, 3 tables, program details available at
  http://pcaf.hep.phy.cam.ac.uk/theory/Herwig++/; replaced 20/11/03 with 1
  reference added, minor typos corrected","JHEP 0402 (2004) 005","10.1088/1126-6708/2004/02/005","Cavendish-HEP-03/19, CERN-TH/2003-265","hep-ph",,"  Results from the new Monte Carlo event generator Herwig++ are presented. This
first version simulates Hadron Emission Reactions With Interfering Gluons in
electron-positron annihilation. The parton shower evolution is carried out
using new evolution variables suited to describing radiation from heavy quarks
as well as light partons. The partonic final state is fragmented into hadrons
by means of an improved cluster hadronization model. The results are compared
with a wide variety of data from LEP and SLC.
","[{""version"":""v1"",""created"":""Mon, 17 Nov 2003 14:09:45 GMT""},{""version"":""v2"",""created"":""Thu, 20 Nov 2003 14:51:58 GMT""}]","2009-11-10"
"hep-ph/0311209","Alexander Lanyov","A.A. Belkov, G.Bohm, A.V. Lanyov","What we have learned from direct CP violation studies in kaon decays","Reference added","Czech.J.Phys. 55 (2004) B193-B206",,,"hep-ph",,"  A self-consistent analysis of K --> 2pi and K --> 3pi decays within a unique
framework of chiral dynamics applied to the QCD-corrected weak nonleptonic
quark lagrangian has been performed. The results on K --> 2pi amplitudes at
O(p^6), including the value for epsilon'/epsilon, are compared with experiment
to fix phenomenological B-factors for mesonic matrix elements of nonpenguin and
penguin four-quark operators. The dependence of these B-factors on different
theoretical uncertainties and experimental errors of various input parameters
is investigated. Finally, we present our estimates at O(p^6) for the CP
asymmetry of linear slope parameters in the K+- --> 3pi Dalitz plot.
","[{""version"":""v1"",""created"":""Mon, 17 Nov 2003 12:55:37 GMT""},{""version"":""v2"",""created"":""Fri, 12 Dec 2003 13:38:40 GMT""}]","2007-05-23"
"hep-ph/0311210","Robert Appleby","R.B. Appleby","Rapidity gap physics at contemporary colliders","PhD Thesis (Supervisor: M.H. Seymour), 173 pages",,,,"hep-ph",,"  This thesis is concerned with the theory and the phenomenology of rapidity
gap processes. We perform perturbative calculations of energy flow observables
in jet-gap-jet processes, which consist of resummed primary emission
calculations specific to the soft gluon geometry at HERA and an estimate of
non-global (secondary emission) effects in clustered energy flow observables.
The resulting predictions agree well with H1 data. We also study hard
diffraction and use a factorised model, with a Monte Carlo event generator, to
make detailed predictions for gap-jet-gap events at the Tevatron. We find that
we can describe the data in a natural way by using HERA parton densities and a
gap surivial factor consistent with theoretical estimates.
","[{""version"":""v1"",""created"":""Mon, 17 Nov 2003 14:44:03 GMT""}]","2007-05-23"
"hep-ph/0311211","Rohini M. Godbole","R.M. Godbole, A. Grau, G. Pancheri and Y.N. Srivastava","Photon Total Cross-sections","7 pages, 10 figures, LaTeX, requires espcrc2.sty, Talk presented by
  G. Pancheri at PHOTON-2003, International Meeting on Structure and
  Interactions of the Photon, Frascati, Italy, April 7-11, 2003",,"10.1016/S0920-5632(03)02313-2","IISc-CTS/10/03, LNF-03/20 (P), 17 Novembre 2003","hep-ph",,"  We discuss present predictions for the total $\gamma \gamma$ and $\gamma p $
cross-sections, highlighting why predictions differ. We present results from
the Eikonal Minijet Model and improved predictions based on soft gluon
resummation.
","[{""version"":""v1"",""created"":""Mon, 17 Nov 2003 14:45:05 GMT""}]","2009-11-10"
"hep-th/0311129","Clifford V. Johnson","Clifford V. Johnson","Non-Perturbative String Equations for Type 0A","29 pages LaTeX","JHEP 0403 (2004) 041","10.1088/1126-6708/2004/03/041","USC-03-06, NSF-KITP-03-99, DCPT-03/51","hep-th",,"  Well-defined non-perturbative formulations of the physics of string theories,
sometimes with D-branes present, were identified over a decade ago, from a
careful study of double scaled matrix models. Following recent work which
recasts some of those old results in the context of type 0 string theory, a
study is made of a much larger family of models, which are proposed as type 0A
models of the entire superconformal minimal series coupled to gravity. This
gives many further examples of important physical phenomena, including
non-perturbative descriptions of transitions between D-branes and fluxes,
tachyon condensation, and holography. In particular, features of a large family
of non-perturbatively stable string equations are studied, and results are
extracted which pertain to type 0A string theory, with D-branes and fluxes, in
this large class of backgrounds. For the entire construction to work, large
parts of the spectrum of the supergravitationally dressed superconformal
minimal models and that of the gravitationally dressed bosonic conformal
minimal models must coincide, and it is shown how this happens. The example of
the super-dressed tricritical Ising model is studied in some detail.
","[{""version"":""v1"",""created"":""Mon, 17 Nov 2003 10:48:02 GMT""}]","2009-11-10"
"hep-th/0311137","Ali Imaanpur","Ali Imaanpur","Comments on Gluino Condensates in N=1/2 SYM Theory","11 pages, 4 figures, small changes, added a reference","JHEP 0312 (2003) 009","10.1088/1126-6708/2003/12/009","IPM/P-2003/075","hep-th",,"  Using Ward identities of N=1/2 supersymmetric Yang-Mills theory, we show that
while the partition function and antichiral gluino condensates remain invariant
under the $C$ deformation, chiral gluino correlators can get contributions from
all gauge fields with instanton numbers $k\leq 1$. In particular, a Ward
identity of the $U(1)_R$ symmetry allows us to determine the explicit
dependence of chiral gluino correlators on the deformation parameter.
","[{""version"":""v1"",""created"":""Mon, 17 Nov 2003 14:25:03 GMT""},{""version"":""v2"",""created"":""Mon, 22 Dec 2003 12:22:34 GMT""}]","2009-11-10"
