"astro-ph/0311366","Jennifer Grimes","Jennifer A. Grimes, Steve Rawlings, Chris J. Willott","Implications for unified schemes from the quasar fraction and
  emission-line luminosities in radio-selected samples","17 pages, 16 figures, accepted for publication in MNRAS","Mon.Not.Roy.Astron.Soc. 349 (2004) 503","10.1111/j.1365-2966.2004.07510.x",,"astro-ph",,"  We use a principal components analysis of radio-selected (3CRR, 6CE and 7CRS)
AGN datasets to define two parameters related to low-frequency (151 MHz) radio
luminosity L_151 and [OIII] luminosity L_[OIII]: a parameter alpha encoding the
L_151 - L_[OIII] correlation and a parameter beta encoding scatter about this
correlation. We describe methods for constructing generalized luminosity
functions (GLFs) based on alpha, beta, redshift and schemes for unifying
quasars and radio galaxies.
  Luminosity-dependent unified schemes (e.g. a receding-torus scheme) have been
invoked to explain the low quasar to radio galaxy fraction at low alpha and the
differences in emission-line luminosities of radio quasars and radio galaxies.
With the constraints of the 3CRR, 6CE and 7CRS datasets and radio source
counts, our GLF approach was used to determine whether a receding-torus-like
scheme is required if there are two populations of radio sources: one at low
alpha, consisting of 'starved AGN'; the other at high alpha consisting of
'Eddington-tuned AGN'. Because of the overlap between these two populations and
the effects of the beta parameter, schemes with or without a receding torus can
produce a low quasar fraction at low alpha and differences in [OIII] luminosity
between radio galaxies and quasars. The receding torus may be a physical
process important in one or more populations of radio sources, but this is not
yet proved either by the quasar fraction or the emission-line properties of
radio-selected samples.
","[{""version"":""v1"",""created"":""Sun, 16 Nov 2003 17:01:13 GMT""}]","2009-11-10"
"astro-ph/0311367","Jorge Sanz-Forcada","J. Sanz-Forcada, F. Favata, G. Micela","Coronal versus photospheric abundances of stars with different activity
  levels","10 pages, Online material: 8 pages (online material is included in
  the file). Accepted by A&A","Astron.Astrophys. 416 (2004) 281-290","10.1051/0004-6361:20034466",,"astro-ph",,"  We report a detailed analysis of the coronal abundance of 4 stars with
varying levels of activity and with accurately known photospheric abundances.
The coronal abundance is determined here using a line flux analysis and a full
determination of the differential emission measure. Photospheric abundance
values are taken from literature works. Previous coronal abundance
determinations have generally been compared to solar photospheric abundances;
from this a number of general properties have been inferred, such as the
presence of a coronal metal depletion with an inverse First Ionization
Potential correlated with activity level. Here we show that, when coronal
abundances are compared with real photospheric values for the individual stars,
the resulting pattern can be very different. Also, we present evidence that, in
some cases, the coronal metal abundance may not be uniform in the corona; in
particular it can vary with the temperature of the emitting plasma.
","[{""version"":""v1"",""created"":""Sun, 16 Nov 2003 17:45:53 GMT""}]","2009-11-10"
"astro-ph/0311368","Gao Weihong","W.H.Gao and D.M.Wei (purple mountain observatory)","Can the Bump be Observed in the Early Afterglow of GRBS with X-Ray Line
  Emission Features?","13 pags, 2 tables, appear in v603 n1 pt1 ApJ March 1, 2004 issue","Astrophys.J. 604 (2004) 312-316","10.1086/381427",,"astro-ph",,"  Extremely powerful emission lines are observed in the X-ray afterglow of
several GRBs. The energy contained in the illuminating continuum which is
responsible for the line production exceeds 10$^{51}$ erg, much higher than
that of the collimated GRBs. It constrains the models which explain the
production of X-ray emission lines. In this paper, We argue that this energy
can come from a continuous postburst outflow. Focusing on a central engine of
highly magnetized millisecond pulsar or magnetar we find that afterglow can be
affected by the illuminating continuum, and therefore a distinct achromatic
bump may be observed in the early afterglow lightcurves. With the luminosity of
the continuous outflow which produces the line emission, we define the upper
limit of the time when the bump feature appears. We argue that the reason why
the achromatic bumps have not been detected so far is that the bumps should
appear at the time too early to be observed.
","[{""version"":""v1"",""created"":""Mon, 17 Nov 2003 03:17:33 GMT""},{""version"":""v2"",""created"":""Tue, 18 Nov 2003 05:22:16 GMT""}]","2009-11-10"
"astro-ph/0311369","Alex Lazarian","Huirong Yan and A. Lazarian","Cosmic Ray Scattering by Compressible Magnetohydrodynamic Turbulence","27 papes, 4 figures, submitted to ApJ",,,,"astro-ph",,"  Recent advances in understanding of magnetohydrodynamic (MHD) turbulence call
for substantial revisions in the picture of cosmic ray transport. In this paper
we use recently obtained scaling laws for MHD modes to calculate the scattering
frequency for cosmic rays in the ISM. We consider gyroresonance with MHD modes
(Alfvenic, slow and fast) and transit-time damping (TTD) by fast modes. We
provide calculations of cosmic ray scattering for various phases of
interstellar medium with realistic interstellar turbulence driving that is
consistent with the velocity dispersions observed in diffuse gas. We account
for the turbulence cutoff arising from both collisional and collisionless
damping. We obtain analytical expressions for diffusion coefficients that enter
Fokker-Planck equation describing cosmic ray evolution. We calculate the
scattering rate and parallel spatial diffusion coefficients of cosmic rays for
both Alfvenic and fast modes. We conclude that fast modes provides the dominant
contribution to cosmic ray scattering for the typical interstellar conditions
in spite of the fact that fast modes are subjected to damping. We show that the
efficiency of the scattering depends on the plasma beta since it determines the
damping of the fast modes. We also show that the streaming instability is
modified in the presence of turbulence.
","[{""version"":""v1"",""created"":""Mon, 17 Nov 2003 03:21:56 GMT""}]","2007-05-23"
"astro-ph/0311371","Alex Lazarian","A. Lazarian","Grain Alignment in Molecular Clouds","8 papes, 1 figures, to appear in Zermatt proceedings",,"10.1007/978-3-642-18902-9_67",,"astro-ph",,"  One of the most informative techniques of studying magnetic fields in
molecular clouds is based on the use of starlight polarization and polarized
emission arising from aligned dust. How reliable the interpretation of the
polarization maps in terms of magnetic fields is the issue that the grain
alignment theory addresses.
  I briefly review basic physical processes involved in grain alignment.
","[{""version"":""v1"",""created"":""Mon, 17 Nov 2003 04:06:39 GMT""}]","2017-01-18"
"astro-ph/0311373","Louise M. Griffiths Ord","Louise M. Griffiths and Charles H. Lineweaver","Testing the CMB Data for Systematic Effects","33 pages, 11 figures, 4 tables, ApJ accepted, extends the analysis of
  astro-ph/0301490 to include the WMAP data, uses aastex.cls","Astrophys.J. 603 (2004) 371-382","10.1086/381493","UNSW-5470","astro-ph",,"  Under the assumption that the concordance Lambda-cold dark matter (CDM) model
is the correct model, we test the cosmic microwave background (CMB) anisotropy
data for systematic effects by examining the band pass temperature residuals
with respect to this model. Residuals are analysed as a function of angular
scale l, galactic latitude, frequency, calibration source, instrument type and
several other variables that may be associated with potential systematic
effects. Our main result is that we find no significant systematic errors
associated with these variables. However, we do find marginal evidence for a
trend associated with galactic latitude indicative of galactic contamination.
","[{""version"":""v1"",""created"":""Mon, 17 Nov 2003 04:36:51 GMT""}]","2009-11-10"
"astro-ph/0311374","Albert Kong","R. Di Stefano and A.K.H. Kong (CfA)","Selecting Very Soft X-Ray Sources in External Galaxies: Luminous
  Supersoft X-ray Sources and Quasisoft Sources","15 pages, 4 figures, ApJ, submitted",,,,"astro-ph",,"  We introduce a procedure to identify very soft X-ray sources (VSSs) in
external galaxies. Our immediate goal was to formulate a systematic procedure
to identify luminous supersoft X-ray sources (SSSs), so as to allow comparisons
among galaxies and to study environmental effects. The focus of this paper is
on the design of the selection algorithm and on its application to simulated
data. In the companion paper we test it by applying it to sources discovered
through Chandra observations of 4 galaxies. We find that, in its application to
both simulated and real data, our procedure also selects somewhat harder
sources, which we call quasisoft. Whereas values of kT for SSSs are typically
tens of eV, some quasisoft sources (QSSs) may have kT as high as ~250-300 eV.
The dominant spectral component of other QSSs may be as soft as SSS spectra,
but the spectra may also include a low-luminosity harder component. We sketch
physical models for both supersoft and quasisoft sources. Some SSSs are likely
to be accreting white dwarfs; some of these may be progenitors of Type Ia
supernovae. Most QSSs may be too hot to be white dwarfs. They, together with a
subset of SSSs, may be neutron stars or, perhaps most likely, accreting
intermediate-mass black holes.
","[{""version"":""v1"",""created"":""Mon, 17 Nov 2003 05:19:24 GMT""}]","2007-05-23"
"astro-ph/0311375","Albert Kong","R. Di Stefano and A.K.H. Kong (CfA)","The Discovery of Quasisoft and Supersoft Sources in External Galaxies","20 pages, 6 figures. Accepted for publication in ApJ","Astrophys.J. 609 (2004) 710-727","10.1086/421318",,"astro-ph",,"  We apply a uniform procedure to select very soft sources from point sources
observed by Chandra in 4 galaxies. This sample includes one elliptical galaxy
(NGC 4967), 2 face-on spirals (M101 and M83), and an interacting galaxy (M51).
We have found very soft X-ray sources (VSSs) in every galaxy. Some of these fit
the criteria for canonical supersoft sources (SSSs), while others are somewhat
harder. These latter have characteristic values of kT < 300 eV; we refer to
them as quasisoft sources (QSSs). We found a combined total of 149 VSSs in the
4 galaxies we considered; 77 were SSSs and 72 were QSSs. (See the paper for the
original long abstract)
","[{""version"":""v1"",""created"":""Mon, 17 Nov 2003 05:39:06 GMT""},{""version"":""v2"",""created"":""Mon, 29 Mar 2004 19:11:12 GMT""}]","2009-11-10"
"astro-ph/0311376","Anthony Allen","A. Allen, F. H. Shu, Z. Y. Li","Collapse of Magnetized Singular Isothermal Toroids: I. Non-Rotating Case","26 pages, 8 figures. To appear in v599 n1 ApJ December 10, 2003 issue","Astrophys.J. 599 (2003) 351-362","10.1086/379242",,"astro-ph",,"  We study numerically the collapse of non-rotating, self-gravitating,
magnetized, singular isothermal toroids characterized by sound speed, $a$, and
level of magnetic to thermal support, $H_0$. In qualitative agreement with
previous treatments by Galli & Shu and other workers, we find that the
infalling material is deflected by the field lines towards the equatorial
plane, creating a high-density, flattened structure -- a pseudodisk. The
pseudodisk contracts dynamically in the radial direction, dragging the field
lines threading it into a highly pinched configuration that resembles a split
monopole. The oppositely directed field lines across the midplane and the large
implied stresses may play a role in how magnetic flux is lost in the actual
situation in the presence of finite resistivity or ambipolar diffusion. The
infall rate into the central regions is given to 5% uncertainty by the formula,
$\dot M = (1+H_0)a^3/G$, where $G$ is the universal gravitational constant,
anticipated by semi-analytical studies of the self-similar gravitational
collapses of the singular isothermal sphere and isopedically magnetized disks.
The introduction of finite initial rotation results in a complex interplay
between pseudodisk and true (Keplerian) disk formation that is examined in a
companion paper.
","[{""version"":""v1"",""created"":""Mon, 17 Nov 2003 07:28:26 GMT""}]","2009-11-10"
"astro-ph/0311377","Anthony Allen","A. Allen, Z. Y. Li, F. H. Shu","Collapse of Magnetized Singular Isothermal Toroids: II. Rotation and
  Magnetic Braking","38 pages, 9 figures. To appear in v599 n1 ApJ December 10, 2003 issue","Astrophys.J. 599 (2003) 363-379","10.1086/379243",,"astro-ph",,"  We study numerically the collapse of rotating, magnetized molecular cloud
cores, focusing on rotation and magnetic braking during the main accretion
phase of isolated star formation. Motivated by previous numerical work and
analytic considerations, we idealize the pre-collapse core as a magnetized
singular isothermal toroid, with a constant rotational speed everywhere. The
collapse starts from the center, and propagates outwards in an inside-out
fashion, satisfying exact self-similarity in space and time. For rotation rates
and field strengths typical of dense low-mass cores, the main feature remains
the flattening of the mass distribution along field lines -- the formation of a
pseudodisk, as in the nonrotating cases. The density distribution of the
pseudodisk is little affected by rotation. On the other hand, the rotation rate
is strongly modified by pseudodisk formation. Most of the centrally accreted
material reaches the vicinity of the protostar through the pseudodisk. The
specific angular momentum can be greatly reduced on the way, by an order of
magnitude or more, even when the pre-collapse field strength is substantially
below the critical value for dominant cloud support. The efficient magnetic
braking is due to the pinched geometry of the magnetic field in the pseudodisk,
which strengthens the magnetic field and lengthens the level arm for braking.
Both effects enhance the magnetic transport of angular momentum from inside to
outside. The excess angular momentum is carried away in a low-speed outflow
that has, despite claims made by other workers, little in common with observed
bipolar molecular outflows. We discuss the implications of our calculations for
the formation of true disks that are supported against gravity by rotation.
","[{""version"":""v1"",""created"":""Mon, 17 Nov 2003 07:58:07 GMT""}]","2009-11-10"
"astro-ph/0311378","Qing-Guo Huang","Qing-Guo Huang and Miao Li","Power Spectra in Spacetime Noncommutative Inflation","19 pages, 6 figures, harvmac; 2 references added; only references
  added; Accepted for publication in Nucl. Phys. B","Nucl.Phys.B713:219-234,2005","10.1016/j.nuclphysb.2005.02.002",,"astro-ph hep-ph hep-th",,"  String/M theory inspires an uncertainty relation between space and time which
deviates from general relativity. It is possible to explore this deviation from
cosmological observations, in particular from the CMB fluctuation spectrum.
This paper extends some previous observations to more general inflation
schemes, we find that the noncommutative spacetime effects always suppress the
power spectrum, of both the scalar and tensor perturbations, and may provide a
large enough running of the spectral index to fit the WMAP data in the
inflation model.
","[{""version"":""v1"",""created"":""Mon, 17 Nov 2003 10:48:15 GMT""},{""version"":""v2"",""created"":""Mon, 1 Dec 2003 08:00:44 GMT""},{""version"":""v3"",""created"":""Fri, 12 Dec 2003 02:56:23 GMT""},{""version"":""v4"",""created"":""Tue, 1 Mar 2005 10:41:08 GMT""}]","2008-11-26"
"astro-ph/0311379","Michael L. Balogh","Michael Balogh, Vince Eke, Chris Miller, Ian Lewis, Richard Bower,
  Warrick Couch, Robert Nichol, Joss Bland-Hawthorn, Ivan K. Baldry, Carlton
  Baugh, Terry Bridges, Russell Cannon, Shaun Cole, Matthew Colless, Chris
  Collins, Nicholas Cross, Gavin Dalton, Roberto De Propris, Simon P. Driver,
  George Efstathiou, Richard S. Ellis, Carlos S. Frenk, Karl Glazebrook, Percy
  Gomez, Alex Gray, Edward Hawkins, Carole Jackson, Ofer Lahav, Stuart Lumsden,
  Steve Maddox, Darren Madgwick, Peder Norberg, John A. Peacock, Will Percival,
  Bruce A. Peterson, Will Sutherland, Keith Taylor","Galaxy ecology: groups and low-density environments in the SDSS and
  2dFGRS","Final version","Mon.Not.Roy.Astron.Soc.348:1355,2004","10.1111/j.1365-2966.2004.07453.x",,"astro-ph",,"  We analyse the observed correlation between galaxy environment and H-alpha
emission line strength, using volume-limited samples and group catalogues of
24968 galaxies drawn from the 2dF Galaxy Redshift Survey (Mb<-19.5) and the
Sloan Digital Sky Survey (Mr<-20.6). We characterise the environment by 1)
Sigma_5, the surface number density of galaxies determined by the projected
distance to the 5th nearest neighbour; and 2) rho1.1 and rho5.5,
three-dimensional density estimates obtained by convolving the galaxy
distribution with Gaussian kernels of dispersion 1.1 Mpc and 5.5 Mpc,
respectively. We find that star-forming and quiescent galaxies form two
distinct populations, as characterised by their H-alpha equivalent width,
EW(Ha). The relative numbers of star-forming and quiescent galaxies varies
strongly and continuously with local density. However, the distribution of
EW(Ha) amongst the star-forming population is independent of environment. The
fraction of star-forming galaxies shows strong sensitivity to the density on
large scales, rho5.5, which is likely independent of the trend with local
density, rho1.1. We use two differently-selected group catalogues to
demonstrate that the correlation with galaxy density is approximately
independent of group velocity dispersion, for sigma=200-1000 km/s. Even in the
lowest density environments, no more than ~70 per cent of galaxies show
significant H-alpha emission. Based on these results, we conclude that the
present-day correlation between star formation rate and environment is a result
of short-timescale mechanisms that take place preferentially at high redshift,
such as starbursts induced by galaxy-galaxy interactions.
","[{""version"":""v1"",""created"":""Mon, 17 Nov 2003 11:16:42 GMT""},{""version"":""v2"",""created"":""Tue, 18 Nov 2003 07:59:27 GMT""},{""version"":""v3"",""created"":""Mon, 5 Jan 2004 17:05:14 GMT""}]","2011-03-10"
"astro-ph/0311380","Christofer Gunnarsson","Christofer Gunnarsson","Q-LET - Quick Lensing Estimation Tool - An application to SN2003es","16 pages, 5 figures. Submitted to JCAP. Software available at
  http://www.physto.se/~cg/qlet/qlet.htm","JCAP 0403 (2004) 002","10.1088/1475-7516/2004/03/002",,"astro-ph",,"  Q-LET is a FORTRAN 77 code that enables a quick estimate of the gravitational
lensing effects on a point- or an extended source. The user provided input
consists of the redshifts, angular positions relative to the source, mass or
velocity dispersion estimate and halo type for the lens galaxies. The
considered halo types are the Navarro-Frenk-White and the Singular Isothermal
Sphere. The code uses the so-called multiple lens-plane method to find the
magnification and intrinsic shape of the source. This method takes into account
the multiple deflections that may arise when several mass accumulations are
situated at different redshifts close to the line-of-sight.
  The Q-LET code is applied to the recently discovered supernova, SN2003es,
which is likely to be of Type Ia as its host galaxy is classified as an
elliptical. We find that SN2003es is likely to have been significantly
magnified by gravitational lensing and that this should be considered in high-z
studies if this SN is to be used to determine the cosmological parameters.
  Q-LET was motivated by the supernova searches, where lensing can be a
problem, but it can also be applied to any simple lens system where a quick
estimate is wanted, e.g. the single lens case.
","[{""version"":""v1"",""created"":""Mon, 17 Nov 2003 12:54:18 GMT""}]","2009-11-10"
"astro-ph/0311381","Sebastien Vauclair C.","S. C. Vauclair, A. Blanchard, R. Sadat, J.G. Bartlett, J.-P. Bernard,
  M. Boer, M. Giard, D. H. Lumb, P. Marty, J. Nevalainen","The XMM--NEWTON Omega Project: II.Cosmological implications from the
  high redshift L-T relation of X-ray clusters","5 pages, 7 figures, A&A Letters, accepted","Astron.Astrophys. 412 (2003) L37-L41","10.1051/0004-6361:20034603",,"astro-ph",,"  The evolution with redshift of the temperature-luminosity relation of X-ray
galaxy clusters is a key ingredient to break degeneracies in the interpretation
of X-ray clusters redshift number counts. We therefore take advantage of the
recent measurements of the temperature-luminosity relation of distant clusters
observed with XMM-Newton and Chandra satellites to examine theoretical number
counts expected for different available X-rays cluster samples, namely the
RDCS, EMSS, SHARC, 160deg^2 and the MACS at redshift greater than 0.3. We
derive these counts without any adjustment, using models previously normalized
to the local temperature distribution function and to the high-z (z = 0.33)
TDF. We find that these models having Omega_M in the range [0.85-1.] predict
counts in remarkable agreement with the observed counts in the different
samples. We illustrate that this conclusion is weakly sensitive to the various
ingredients of the modeling. Therefore number counts provide a robust evidence
of an evolving population. A realistic flat low density model (Omega_M = 0.3),
normalized to the local abundance of clusters is found to overproduce cluster
abundance at high redshift (above z = 0.5) by nearly an order of magnitude.
This result is in conflict with the popular concordance model. The conflict
could indicate a deviation from the expected scaling of the M-T relation with
redshift.
","[{""version"":""v1"",""created"":""Mon, 17 Nov 2003 13:52:09 GMT""}]","2009-09-29"
"astro-ph/0311382","Patrizia Santolamazza","P. Santolamazza (1), F. Fiore (2), L. Burderi (2), T. Di Salvo (3)
  ((1) ASI Science Data Center, (2) Rome Observatory, (3) Astronomical
  Institute University of Amsterdam)","Six Years of ScoX-1 Monitoring with BeppoSAX Wide Field Cameras","4 Pages, 4 figures. To appear in Proc. of the BeppoSAX Symposium:
  ""The Restless High-Energy Universe"", E.P.J. van den Heuvel, J.J.M. in 't
  Zand, and R.A.M.J. Wijers (Eds)",,"10.1016/j.nuclphysbps.2004.04.113",,"astro-ph",,"  We performed a systematic analysis of 54 Wide Field Camera (WFC) observations
of ScoX-1 available in the BeppoSAX public archive. Observations span over the
six years of BeppoSAX mission lifetime and include 690 hr of data. We searched
for shifts and shape changes of the Z pattern in the color-color diagrams. We
find that the Z pattern occupies most of the time the same locus in the
color-color diagram. There are however a few exceptions, which are discussed in
detail.
","[{""version"":""v1"",""created"":""Mon, 17 Nov 2003 14:22:27 GMT""}]","2009-11-10"
"astro-ph/0311383","Ignacio Trujillo","I. Trujillo, A. Burkert and Eric. F. Bell","The Tilt of the Fundamental Plane: Three-quarters Structural
  Nonhomology, One-quarter Stellar Population","8 pages, 3 figures, ApJL, 600, 39, minor changes made to match the
  published version",,"10.1086/381528",,"astro-ph",,"  The variation of the mass-to-light ratios M/L of early type galaxies as
function of their luminosities L is investigated. It is shown that the tilt
beta=0.27 (in the B--band) of the fundamental plane relation M/L ~ L^{beta} can
be understood as a combination of two effects: about one-quarter (i.e. dbeta
=0.07) is a result of systematic variations of the stellar population
properties with increasing luminosity. The remaining three-quarters (i.e. dbeta
=0.2) can be completely attributed to nonhomology effects that lead to a
systematic change of the surface brightness profiles with increasing
luminosity. Consequently, the observed tilt in the K-band (beta=0.17) where
stellar population effects are negligible, is explained by nonhomology effects
alone. After correcting for nonhomology, the mean value of the mass-to-light
ratio of elliptical galaxies (M/L_B) is 7.1+-2.8 (1 sigma scatter).
","[{""version"":""v1"",""created"":""Mon, 17 Nov 2003 14:24:24 GMT""},{""version"":""v2"",""created"":""Fri, 9 Jan 2004 13:10:27 GMT""}]","2009-11-10"
