"astro-ph/0311384","Alessandro Caccianiga","A. Caccianiga, M.J.M. Marcha","The CLASS blazar survey: testing the blazar sequence","20 pages, accepted for publication in MNRAS","Mon.Not.Roy.Astron.Soc. 348 (2004) 937","10.1111/j.1365-2966.2004.07415.x",,"astro-ph",,"  We discuss the properties of the sources in the CLASS Blazar survey which
aims at the selection of low radio power (P(5GHz)<10^25 W Hz^-1) blazars. We
use VLA data from available catalogues and from our own observations to
constrain the radio core-dominance of the sample which, together with the flat
radio spectral index, is a signature of the blazar activity. X-ray data from
the ROSAT All Sky Survey were also collected in order to constrain the
radio-to-X-ray luminosity ratio (alpha_RX) of the sources. The data analysis
shows that more than 30% of sources at low radio power (P(5 GHz)<10^25 W Hz^-1)
have an alpha_RX steeper than that expected in the framework of the ``blazar
sequence'' recently put forward to unify the high and low power blazars. The
possibility that this result is influenced by contaminating sources in the
current sample is discussed. The conclusion is that, even if a number of
non-blazars (typically CSO/GPS sources) are expected in the survey, it is
unlikely that this constitutes the sole reason for the observed deviation. In
particular, we show 2 examples for which the blazar nature is confirmed from
VLBI data and for which the steep alpha_RX (suggesting a synchrotron peak
frequency below 10^15.5 Hz) and the low radio power (0.6-2x10^24 W Hz^-1) put
these sources outside the ``blazar sequence''. The results presented here show
the importance of a correct and unbiased sampling of the low-power regime of
the blazar population.
","[{""version"":""v1"",""created"":""Mon, 17 Nov 2003 14:29:06 GMT""}]","2009-11-10"
"astro-ph/0311385","Federica Govoni","Federica Govoni, Matteo Murgia","Magnetic Fields in Galaxy Clusters","5 pages, 2 Postscript figures. To be published by the Astronomical
  Society of the Pacific in Highlights of Astronomy, Vol 13, as part of the
  Proceedings of IAU JD10, Evolution in Galaxy Clusters: A Multiwavelength
  Approach",,,,"astro-ph",,"  Magnetic fields in galaxy clusters can be investigated using a variety of
techniques. Recent studies including radio halos, Inverse Compton hard X-ray
emissions and Faraday rotation measure, are briefly outlined. A numerical
approach for investigating cluster magnetic fields strength and structure is
presented. It consists of producing simulated rotation measure, radio halo
images, and radio halo polarization, obtained from 3-dimensional multi-scale
cluster magnetic field models, and comparing with observations.
","[{""version"":""v1"",""created"":""Mon, 17 Nov 2003 14:37:13 GMT""}]","2007-05-23"
"astro-ph/0311386","Felix J. Lockman","Felix J. Lockman (National Radio Astronomy Observatory)","Peering Through the Muck: Notes on the Influence of the Galactic
  Interstellar Medium on Extragalactic Observations","11 pages includes 4 figures. To appear in ""Soft X-ray Emission from
  Clusters of Galaxies and Related Phonomena"", ed. R. Lieu, Klewer",,"10.1007/978-1-4020-2564-8_13",,"astro-ph",,"  This paper considers some effects of foreground Galactic gas on radiation
received from extragalactic objects, with an emphasis on the use of the 21cm
line to determine the total N(HI). In general, the opacity of the 21cm line
makes it impossible to derive an accurate value of N(HI) by simply applying a
formula to the observed emission, except in directions where there is very
little interstellar matter. The 21cm line can be used to estimate the
likelihood that there is significant molecular hydrogen in a particular
direction, but carries little or no information on the amount of ionized gas,
which can be a major source of foreground effects. Considerable discussion is
devoted to the importance of small-scale angular structure in HI, with the
conclusion that it will rarely contribute significantly to the total error
compared to other factors (such as the effects of ionized gas) for
extragalactic sight lines at high Galactic latitude. The direction of the
Hubble/Chandra Deep Field North is used as an example of the complexities that
might occur even in the absence of opacity or molecular gas.
","[{""version"":""v1"",""created"":""Mon, 17 Nov 2003 14:52:03 GMT""}]","2016-01-27"
"astro-ph/0311387","Yannick Copin","Y. Copin, N. Cretton, E. Emsellem","Axisymmetric dynamical models for SAURON and OASIS observations of NGC
  3377","15 pages, 14 figures. Accepted for publication in A&A (original fig.
  layout, letterpaper)","Astron.Astrophys. 415 (2004) 889-903","10.1051/0004-6361:20034076",,"astro-ph",,"  We present a unique set of nested stellar kinematical maps of NGC 3377
obtained with the integral-field spectrographs OASIS and SAURON. We then
construct general axisymmetric dynamical models for this galaxy, based on the
Schwarzschild numerical orbit superposition technique applied to these
complementary measurements. We show how these two datasets constrain the mass
of the central massive object and the overall mass-to-light ratio of the galaxy
by probing the inner and outer regions respectively. The simultaneous use of
both datasets leads us to confirm the presence of a massive black hole with a
mass of $M_{BH} = 7_{-5}^{+4} 10^{7} M_\sun$ (99.7% confidence level), with a
best-fit stellar mass-to-light ratio $\Upsilon_I = 2.1 \pm 0.2$ (for an assumed
edge-on inclination).
","[{""version"":""v1"",""created"":""Mon, 17 Nov 2003 15:50:23 GMT""},{""version"":""v2"",""created"":""Tue, 18 Nov 2003 09:37:06 GMT""}]","2007-05-23"
"astro-ph/0311388","Eric van der Swaluw","E. van der Swaluw, T. P. Downes, R. Keegan","An evolutionary model for pulsar-driven supernova remnants","8 pages, 8 figures, submitted to A&A","Astron.Astrophys.420:937-944,2004","10.1051/0004-6361:20035700",,"astro-ph",,"  We present a model of a pulsar wind nebula evolving inside its associated
supernova remnant. The model uses a hydrodynamics code to simulate the
evolution of this system when the pulsar has a high velocity. The simulation
distinguishes four different stages of pulsar wind nebula evolution: the
supersonic expansion stage, the reverse shock interaction stage, the subsonic
expansion stage and ultimately the bow shock stage. The simulation bears out
that, due to the high velocity of the pulsar, the position of the pulsar is
off-centered with respect to its pulsar wind nebula, after the passage of the
reverse shock. Subsequently the pulsar wind nebula expands subsonically untill
the event of the bow shock formation, when the motion of the pulsar becomes
supersonic. The bow shock formation event occurs at roughly half the crossing
time, when the pulsar is positioned at 0.677 times the radius of the supernova
remnant blastwave, in complete agreement with analytical predictions. The
crossing time is defined by the age of the supernova remnant, when the pulsar
overtakes the blastwave bounding the supernova remnant.
  The results of the model are applied to three supernova remnants: N157B,
G327.1-1.1 and W44. We argue that the head of the pulsar wind nebula,
containing the active pulsar, inside the first two systems are not bounded by a
bow shock. However, in the case of W44 we argue for a scenario in which the
pulsar wind nebula is bounded by a bow shock, due to the supersonic motion of
the pulsar.
","[{""version"":""v1"",""created"":""Mon, 17 Nov 2003 14:53:20 GMT""}]","2011-05-23"
"astro-ph/0311390","David R. Ballantyne","D.R. Ballantyne (CITA, Toronto), N.J. Turner (UCSB), O.M. Blaes (UCSB)","X-ray Reflection from Inhomogeneous Accretion Disks: I. Toy Models and
  Photon Bubbles","17 pages, 6 figures, Fig. 3 in colour, accepted by ApJ","Astrophys.J. 603 (2004) 436-448","10.1086/381495",,"astro-ph",,"  Numerical simulations of the interiors of radiation dominated accretion disks
show that significant density inhomogeneities can be generated in the gas.
Here, we present the first results of our study on X-ray reflection spectra
from such heterogeneous density structures. We consider two cases: first, we
produce a number of toy models where a sharp increase or decrease in density of
variable width is placed at different depths in a uniform slab. Comparing the
resulting reflection spectra to those from an unaltered slab shows that the
inhomogeneity can affect the emission features, in particular the Fe K and O
VIII Lyalpha lines. The magnitude of any differences depends on both the
parameters of the density change and the ionizing power of the illuminating
radiation, but the inhomogeneity is required to be within ~2 Thomson depths of
the surface to cause an effect. However, only relatively small variations in
density (on the order of a few) are necessary for significant changes in the
reflection features to be possible. Our second test was to compute reflection
spectra from the density structure predicted by a simulation of the non-linear
outcome of the photon bubble instability. The resulting spectra also exhibited
differences from the constant density models, caused primarily by a strong 6.7
keV iron line. Nevertheless, constant density models can provide a good fit to
simulated spectra, albeit with a low reflection fraction, between 2 and 10 keV.
Below 2 keV, differences in the predicted soft X-ray line emission result in
very poor fits with a constant density ionized disk model. The results indicate
that density inhomogeneities may further complicate the relationship between
the Fe K equivalent width and the X-ray continuum.
","[{""version"":""v1"",""created"":""Mon, 17 Nov 2003 15:34:24 GMT""}]","2009-11-10"
"astro-ph/0311391","Erik-Jan Rijkhorst","Erik-Jan Rijkhorst, Vincent Icke, Garrelt Mellema","3D AMR Simulations of Point-Symmetric Nebulae","10 pages, 2 figures, to appear in ""Adaptive Mesh Refinement - Theory
  and Applications"", eds. T. Plewa, T. Linde and V.G. Weirs. Movies are
  available at http://www.strw.leidenuniv.nl/AstroHydro3D/movies/index.html",,,,"astro-ph",,"  At the end of their lives low mass stars such as our Sun lose most of their
mass. The resulting planetary nebulae show a wide variety of shapes, from
spherical to highly bipolar. According to the generalized interacting stellar
winds model, these shapes are due to an interaction between a very fast tenuous
outflow, and a denser environment left over from an earlier slow phase of mass
loss. Previous analytical and numerical work shows that this mechanism can
explain cylindrically symmetric nebulae very well. However, many circumstellar
nebulae have a multipolar or point-symmetric shape. With two-dimensional
calculations, Icke showed that these seemingly enigmatic forms can be easily
reproduced by a two-wind model in which the confining disk is warped, as is
expected to occur in irradiated disks. Here, we present the extension to fully
three-dimensional adaptive mesh refinement simulations of such an interaction.
","[{""version"":""v1"",""created"":""Mon, 17 Nov 2003 15:51:08 GMT""}]","2007-05-23"
"cond-mat/0311359","Yakov V. Fominov","Yakov Fominov","Proximity and Josephson effects in superconducting hybrid structures","PhD thesis. 142 pages, 37 figures, LaTeX. Hardcopies are available
  upon request to fominov@landau.ac.ru",,,,"cond-mat.supr-con cond-mat.mes-hall",,"  Chapter 1: Superconductivity in thin SN bilayers.
  Chapter 2: Proximity effect in SF systems.
  Chapter 3: Josephson effect in SFS junctions.
  Chapter 4: Decoherence due to nodal quasiparticles in d-wave Josephson
junctions.
","[{""version"":""v1"",""created"":""Mon, 17 Nov 2003 09:29:17 GMT""}]","2007-05-23"
"cond-mat/0311361","Nicholas Peter Robins","N.P. Robins, C. M. Savage, J. J. Hope, J. E. Lye, C. S. Fletcher, S.
  A. Haine, J. D. Close","Classical noise and flux: the limits of multi-state atom lasers","4 pages, 3 figures",,"10.1103/PhysRevA.69.051602",,"cond-mat.soft",,"  By direct comparison between experiment and theory, we show how the classical
noise on a multi-state atom laser beam increases with increasing flux. The
trade off between classical noise and flux is an important consideration in
precision interferometric measurement. We use periodic 10 microsecond
radio-frequency pulses to couple atoms out of an F=2 87Rb Bose-Einstein
condensate. The resulting atom laser beam has suprising structure which is
explained using three dimensional simulations of the five state
Gross-Pitaevskii equations.
","[{""version"":""v1"",""created"":""Mon, 17 Nov 2003 12:03:38 GMT""}]","2009-11-10"
"cond-mat/0311368","Valery Shchesnovich","Valery S. Shchesnovich, Solange B. Cavalcanti and Roberto A. Kraenkel","Solitons in tunnel-coupled repulsive and attractive condensates","LaTex, 23 pages, 6 figures; revised version; to appear in Physical
  Review A","Phys. Rev. A 69, 033609 (2004)","10.1103/PhysRevA.69.033609",,"cond-mat.soft nlin.PS",,"  We study solitons in the condensate trapped in a double-well potential with
far-separated wells, when the s-wave scattering length has different signs in
the two parts of the condensate. By employing the coupled-mode approximation it
is shown that there are unusual stable bright solitons in the condensate, with
the larger share of atoms being gathered in the repulsive part. Such unusual
solitons derive their stability from the quantum tunneling and correspond to
the strong coupling between the parts of the condensate. The ground state of
the system, however, corresponds to weak coupling between the condensate parts,
with the larger share of atoms being gathered in the attractive part of the
condensate.
","[{""version"":""v1"",""created"":""Sun, 16 Nov 2003 19:59:26 GMT""},{""version"":""v2"",""created"":""Fri, 16 Jan 2004 13:03:26 GMT""}]","2009-11-10"
"cond-mat/0311369","Sei Suzuki","Sei Suzuki and Tatsuya Nakajima","Formulation and Application of Quantum Monte Carlo Method to Fractional
  Quantum Hall Systems","Proceedings of The 15th International Conference on Electronic
  Properties of Two-Dimensional Systems (EP2DS-15)",,"10.1016/j.physe.2003.11.240",,"cond-mat.mes-hall",,"  Quantum Monte Carlo method is applied to fractional quantum Hall systems. The
use of the linear programming method enables us to avoid the negative-sign
problem in the Quantum Monte Carlo calculations. The formulation of this method
and the technique for avoiding the sign problem are described. Some numerical
results on static physical quantities are also reported.
","[{""version"":""v1"",""created"":""Mon, 17 Nov 2003 02:46:13 GMT""}]","2009-11-10"
"cond-mat/0311370","Felix Ritort","F. Ritort","Stimulated and spontaneous relaxation in glassy systems","16 pages, 3 figures (Latex)",,,,"cond-mat.dis-nn",,"  Recent numerical simulations of a disordered system (Preprint
arXiv:condmat/0307554) have shown the existence of two different relaxational
processes (called stimulated and spontaneous) characterizing the relaxation
observed in structural glasses. The existence of these two processes has been
claimed to be at the roots of the intermittency phenomenon observed in recent
experiments. Here we consider a generic system put in contact with a bath at
temperature T and characterized by an adiabatic slow relaxation (i.e. by a
negligible net heat flow from the system to the bath) in the aging state. We
focus on a simplified scenario (termed as partial equilibration) characterized
by the fact that $=0 (where only the spontaneous process is observable) and
whose microscopic stochastic dynamics is ergodic when constrained to the
constant energy surface. Three different effective temperatures can be defined:
a) from the fluctuation-dissipation theorem (FDT), b) from a fluctuation
theorem describing the statistical distribution of heat exchange events between
system and bath and c) from a set of observable-dependent microcanonical
relations in the aging state. In a partial equilibration scenario we show how
all three temperatures coincide reinforcing the idea that a statistical (rather
than thermometric) definition of a non-equilibrium temperature is physically
meaningful in aging systems. These results are explicitly checked in a simple
model system
","[{""version"":""v1"",""created"":""Mon, 17 Nov 2003 04:15:39 GMT""}]","2007-05-23"
"cond-mat/0311371","John F. Dobson","John F. Dobson","Quasi-local-density approximation for a van der Waals energy functional","19 pp., 1 embedded figure. This is a reprinting of a chapter that
  apeared in a festschrift volume for Jay Mahanty, now out of print and
  unavailable. For an implementation of schemes simliar to the ones proposed
  here, See Phys. Rev. Lett. 82, 2123 (1999) and Phys. Rev. B 62, 10038 (2000)","p. 121 in ""Topics in Condensed Matter Physics"" ed. M. P. Das (Nova
  Science Publishers, Commack, New York 1994, ISBN 1-56072-180-4)",,,"cond-mat.soft cond-mat.mtrl-sci",,"  We discuss a possible form for a theory akin to local density functional
theory, but able to produce van der Waals energies in a natural fashion. The
usual Local Density Approximation (LDA) for the exchange and correlation energy
$E_{xc}$ of an inhomogeneous electronic system can be derived by making a
quasilocal approximation for the {\it interacting} density-density response
function $\chi (\vec{r},\vec{r} ^{\prime},\omega)$, then using the
fluctuation-dissipation theorem and a Feynman coupling-constant integration to
generate $E_{xc}$. The first new idea proposed here is to use the same approach
except that one makes a quasilocal approximation for the {\it bare} response
$\chi ^{0}$, rather than for $\chi $. The interacting response is then obtained
by solving a nonlocal screening integral equation in real space. If the
nonlocal screening is done at the time-dependent Hartree level, then the
resulting energy is an approximation to the full inhomogeneous RPA energy: we
show here that the inhomogeneous RPA correlation energy contains a van der
Waals term for the case of widely-separated neutral subsystems. The second new
idea is to use a particularly simple way of introducing LDA-like local field
corrrections into the screening equations, giving a theory which should remain
reasonable for all separations of a pair of subsystems, encompassing both the
van der Waals limit much as in RPA and the bonding limit much as in LDA theory.
","[{""version"":""v1"",""created"":""Mon, 17 Nov 2003 04:58:10 GMT""}]","2007-05-23"
"cond-mat/0311372","Marco Bartolozzi","M. Bartolozzi and A. W. Thomas","Stochastic Cellular Automata Model for Stock Market Dynamics","17 pages and 7 figures",,"10.1103/PhysRevE.69.046112","ADP-03-138/T573","cond-mat.dis-nn cond-mat.stat-mech physics.soc-ph q-fin.ST",,"  In the present work we introduce a stochastic cellular automata model in
order to simulate the dynamics of the stock market. A direct percolation method
is used to create a hierarchy of clusters of active traders on a two
dimensional grid. Active traders are characterised by the decision to buy,
(+1), or sell, (-1), a stock at a certain discrete time step. The remaining
cells are inactive,(0). The trading dynamics is then determined by the
stochastic interaction between traders belonging to the same cluster. Most of
the stylized aspects of the financial market time series are reproduced by the
model.
","[{""version"":""v1"",""created"":""Mon, 17 Nov 2003 06:54:44 GMT""},{""version"":""v2"",""created"":""Thu, 24 Nov 2005 01:19:29 GMT""}]","2009-11-10"
"cond-mat/0311374","Nicolas Dupuis","N. Dupuis","Berezinskii-Kosterlitz-Thouless transition and BCS-Bose crossover in the
  two-dimensional attractive Hubbard model","31 pages, 12 figures, RevTex4; (v2) changes following referees'
  comments, references added","Phys. Rev. B 70, 134502 (2004)","10.1103/PhysRevB.70.134502",,"cond-mat.str-el",,"  We study the two-dimensional attractive Hubbard model using the mapping onto
the half-filled repulsive Hubbard model in a uniform magnetic field coupled to
the fermion spins. The low-energy effective action for charge and pairing
fluctuations is obtained in the hydrodynamic regime. We recover the action of a
Bose superfluid where half the fermion density is identified as the conjugate
variable of the phase of the superconducting order parameter. By integrating
out charge fluctuations, we obtain a phase-only action. In the zero-temperature
superconducting state, this action describes a collective phase mode smoothly
evolving from the Anderson-Bogoliubov mode at weak coupling to the Bogoliubov
mode of a Bose superfluid at strong coupling. At finite temperature, the
phase-only action can be used to extract an effective XY model and thus obtain
the Berezinskii-Kosterlitz-Thouless (BKT) phase transition temperature. We also
identify a renormalized classical regime of superconducting fluctuations above
the BKT phase transition, and a regime of incoherent pairs at higher
temperature. Special care is devoted to the nearly half-filled case where the
symmetry of the order parameter is enlarged to SO(3) due to strong ${\bf
q}=(\pi,\pi)$ charge fluctuations. The low-energy effective action is then an
SO(3) non-linear sigma model with a (symmetry breaking) magnetic field
proportional to the doping. In the strong-coupling limit, the attractive
Hubbard model can be mapped onto the Heisenberg model, from which we recover
the Gross-Pitaevskii equation in the low-density limit.
","[{""version"":""v1"",""created"":""Mon, 17 Nov 2003 09:39:21 GMT""},{""version"":""v2"",""created"":""Mon, 7 Jun 2004 14:03:18 GMT""}]","2007-05-23"
"cond-mat/0311375","Tobias Brandes","T. Brandes, L. Lue","Fluctuation induced effects in confined electrolyte solutions","10 pages, 6 figures",,,,"cond-mat.soft",,"  We examine electrolyte systems confined between two parallel, grounded metal
plates using a field-theoretic approach truncated at one-loop order. For
symmetric electrolytes, the density distribution of the ions is non-uniform,
with a maximum value at the center of the system. For asymmetric electrolytes,
the system is no longer locally neutral, and there is a non-zero static
electric potential. In addition, the surface of the metal plates becomes
charged. When the plate separation becomes greater than the screening length,
the charge distribution possesses two peaks with a local minimum at the center
of the system. When the plates are immersed in a bulk electrolyte solution, an
attractive fluctation induced force develops between them that is analogous to
the Casimir force. Unlike the Casimir force, however, this attractive
interaction has a finite limit in the zero separation limit and decays
inversely with the separation at large separations.
","[{""version"":""v1"",""created"":""Mon, 17 Nov 2003 10:31:57 GMT""}]","2007-05-23"
"cond-mat/0311376","Natalia Pavlenko","Natalia Pavlenko","Modulation of Superconducting Properties by Ferroelectric Polarization
  in Confined FE-S-FE Films","5 pages RevTex4, 6 figures","Phys. Rev. B 70, 094519(2004)","10.1103/PhysRevB.70.094519",,"cond-mat.supr-con cond-mat.mtrl-sci",,"  We show that the electric polarization at the interface with ultrathin
superconducting (S) films sandwiched between ferroelectric (FE) layers allows
achievement of substantially stronger modulation of inner carrier density and
superconducting transition temperature as compared to FE-S bilayers typically
used in superconducting FETs. We find that not only the larger penetration
depths but also the pairing symmetry should be responsible for the fact that
the electric field effect in high temperature superconductors is much stronger
than in conventional systems. Discussing the advantages of multilayers, we
propose a novel design concept for superconducting electric field-effect
transistors based on ferroelectric films.
","[{""version"":""v1"",""created"":""Mon, 17 Nov 2003 10:49:06 GMT""},{""version"":""v2"",""created"":""Tue, 3 Aug 2004 09:01:45 GMT""},{""version"":""v3"",""created"":""Wed, 29 Sep 2004 16:14:17 GMT""},{""version"":""v4"",""created"":""Thu, 30 Sep 2004 10:03:35 GMT""}]","2007-05-23"
"cond-mat/0311377","Krzysztof Pomorski","K. Dietrich, M. Garny, and K. Pomorski","On electronic shells surrounding charged insulated metallic clusters","39 pages and 12 figures",,,,"cond-mat.mes-hall",,"  We determine the wavefunctions of electrons bound to a positively charged
mesoscopic metallic cluster covered by an insulating surface layer. The radius
of the metal core and the thickness of the insulating surface layer are of the
order of a couple of angstroems. We study in particular the electromagnetic
decay of externally located electrons into unoccupied internally located states
which exhibits a resonance behaviour. This resonance structure has the
consequence that the lifetime of the `mesoscopic atoms' may vary by up to 6
orders of magnitude depending on the values of the parameters (from sec to
years).
","[{""version"":""v1"",""created"":""Mon, 17 Nov 2003 11:05:06 GMT""}]","2007-05-23"
