"cond-mat/0309162","Richard G. Hennig","R. G. Hennig (1), D. R. Trinkle (1), J. Bouchet (2), S. G. Srinivasan
  (2), R. C. Albers (2), J. W. Wilkins (1) ((1) Ohio State University, (2) Los
  Alamos National Laboratory)","Impurities block the alpha to omega martensitic transformation in
  titanium","4 pages, 2 figures, 2 tables","Nature Materials 4, 129 (2005)","10.1038/nmat1292",,"cond-mat.mtrl-sci",,"  The onset and kinetics of martensitic transformations are controlled by
impurities trapped during the transformation. For the alpha to omega
transformation in Ti, ab initio methods yield the changes in both the relative
stability of and energy barrier between the phases. Using the recently
discovered transformation pathway, we study interstitial O, N, C;
substitutional Al and V; and Ti interstitials and vacancies. The resulting
microscopic picture explains the observations, specifically the suppression of
the transformation in A-70 and Ti-6Al-4V titanium alloys.
","[{""version"":""v1"",""created"":""Sat, 6 Sep 2003 00:12:58 GMT""}]","2014-04-23"
"cond-mat/0309163","Nobuki Maeda","K. Ishikawa, T. Aoyama, Y. Ishizuka, and N. Maeda","Field Theory of Anisotropic Quantum Hall Gas: Metrology and a Novel
  Quantum Hall Regime","38 pages, 32 figures (one not included), review article","Int.J.Mod.Phys. B17 (2003) 4765-4818","10.1142/S0217979203023112","EPHOU-03-004","cond-mat.mes-hall hep-th",,"  The von Neumann lattice representation is a convenient representation for
studying several intriguing physics of quantum Hall systems. In this formalism,
electrons are mapped to lattice fermions. A topological invariant expression of
the Hall conductance is derived and is used for the proof of the integer
quantum Hall effect in the realistic situation. Anisotropic quantum Hall gas is
investigated based on the Hartree-Fock approximation in the same formalism.
Thermodynamic properties, transport properties, and unusual response under
external modulations are found. Implications for the integer quantum Hall
effect in the finite systems are also studied and a new quantum Hall regime
with non-zero longitudinal resistance is shown to exist.
","[{""version"":""v1"",""created"":""Sat, 6 Sep 2003 01:20:06 GMT""}]","2009-11-10"
"cond-mat/0309164","Ming-Shien Chang","M.-S. Chang, C. D. Hamley, M. D. Barrett, J. A. Sauer, K. M. Fortier,
  W. Zhang, L. You, M. S. Chapman","Observation of spinor dynamics in optically trapped 87Rb Bose-Einstein
  Condensates","4 pages, 6 figures",,"10.1103/PhysRevLett.92.140403",,"cond-mat.soft",,"  We measure spin mixing of F=1 and F=2 spinor condensates of 87Rb atoms
confined in an optical trap. We determine the spin mixing time to be typically
less than 600 ms and observe spin population oscillations. The equilibrium spin
configuration in the F=1 manifold is measured for different magnetic fields and
found to show ferromagnetic behavior for low field gradients. An F=2 condensate
is created by microwave excitation from F=1 manifold, and this spin-2
condensate is observed to decay exponentially with time constant 250 ms.
Despite the short lifetime in the F=2 manifold, spin mixing of the condensate
is observed within 50 ms.
","[{""version"":""v1"",""created"":""Sat, 6 Sep 2003 05:19:20 GMT""},{""version"":""v2"",""created"":""Thu, 4 Dec 2003 03:06:31 GMT""}]","2009-11-10"
"cond-mat/0309165","Sven Lubeck","S. Lubeck, P. C. Heger","Universal finite-size scaling behavior and universal dynamical scaling
  behavior of absorbing phase transitions with a conserved field","12 pages, 14 figures, accepted for publication in Phys. Rev. E","Physical Review E 68, 056102 (2003)","10.1103/PhysRevE.68.056102",,"cond-mat.stat-mech",,"  We analyze numerically three different models exhibiting an absorbing phase
transition. We focus on the finite-size scaling as well as the dynamical
scaling behavior. An accurate determination of several critical exponents
allows to validate certain hyperscaling relations. Using this hyperscaling
relations it is possible to express the avalanche exponents of a self-organized
critical system in terms of the ordinary exponents of a continuous absorbing
phase transition.
","[{""version"":""v1"",""created"":""Sat, 6 Sep 2003 10:38:12 GMT""}]","2009-11-10"
"cond-mat/0309166","Alejandro Cabo Montes de Oca","Alejandro Cabo, Francisco Claro and Norman N. March","Melting curves and other phase transitions in a two dimensional electron
  assembly in a transverse magnetic field as a function of the Landau level
  filling factor","3 pages, 2 figures",,,,"cond-mat",,"  Besides Laughlin/composite Fermion liquid, and Wigner solid, there have been
proposals for Hall crystals and condensed phases of skyrmions for inclusion in
the QHE systems phase diagram. Some results on Hall crystals are reported,
which suggest that at \nu =1/3 such crystals can be the ground state of the
2DEG in a magnetic field. At \nu=1 and 2, Chen et al. experimentally
established that the Wigner solid is the ground state. An explanation is also
given here for the coexistence in their experiments of an integral QHE plateau
and the presence of the Wigner crystal phase near \nu=1. Further, Mandal et al.
showed that at \nu =1/7, and most probably at \nu =1/9, an incompressible
liquid state should be the ground state. Thus, at least three non-entrant solid
phases appear to exist: 0 < nu \leq 1/9, 1/9 < nu \leq 1/7 and,less certainly,
1/7 < \nu \leq 1/5. In addition, points of solid nature are present at \nu =1
and 2 (Wigner solid) and possibly at \nu =1/3 (Hall crystal).
","[{""version"":""v1"",""created"":""Sat, 6 Sep 2003 12:57:26 GMT""}]","2007-05-23"
"cs/0309005","Aleksandar Stojmirovic","Aleksandar Stojmirovic and Vladimir Pestov","Indexing Schemes for Similarity Search In Datasets of Short Protein
  Fragments","34 pages, 12 figures, 4 tables - Timings for experiments added upon
  referees' request, and a number of less substantial modifications made","Information Systems 32 (2007), 1145-1165",,,"cs.DS q-bio.BM",,"  We propose a family of very efficient hierarchical indexing schemes for
ungapped, score matrix-based similarity search in large datasets of short (4-12
amino acid) protein fragments. This type of similarity search has importance in
both providing a building block to more complex algorithms and for possible use
in direct biological investigations where datasets are of the order of 60
million objects. Our scheme is based on the internal geometry of the amino acid
alphabet and performs exceptionally well, for example outputting 100 nearest
neighbours to any possible fragment of length 10 after scanning on average less
than one per cent of the entire dataset.
","[{""version"":""v1"",""created"":""Fri, 5 Sep 2003 22:59:40 GMT""},{""version"":""v2"",""created"":""Sat, 14 Jan 2006 00:45:57 GMT""},{""version"":""v3"",""created"":""Tue, 11 Jul 2006 17:30:29 GMT""},{""version"":""v4"",""created"":""Fri, 9 Feb 2007 02:33:56 GMT""}]","2007-09-04"
"cs/0309006","Rajgopal Kannan","Rajgopal Kannan","The KR-Benes Network: A Control-Optimal Rearrangeable Permutation
  Network","18 pages, 11 figures, website http://www.csc.lsu.edu/~rkannan V3:
  Proved the (previous) Conjecture on Optimality of K-Benes","IEEE Transactions on Computers, Vol. 54, No. 5, pp. 534-544, May
  2005.",,"LSU Computer Science Tech Report LSU-CSC-TR03-01","cs.NI cs.CC",,"  The Benes network has been used as a rearrangeable network for over 40 years,
yet the uniform $N(2 \log N-1)$ control complexity of the $N \times N$ Benes is
not optimal for many permutations. In this paper, we present a novel $O(\log
N)$ depth rearrangeable network called KR-Benes that is {\it
permutation-specific control-optimal}. The KR-Benes routes {\it every}
permutation with the minimal control complexity {\it specific} to that
permutation and its worst-case complexity for arbitrary permutations is bounded
by the Benes; thus it replaces the Benes when considering control
complexity/latency. We design the KR-Benes by first constructing a restricted
$2 \log K +2$ depth rearrangeable network called $K$-Benes for routing
$K$-bounded permutations with control $2N \log K$, $0 \leq K \leq N/4$. We then
show that the $N \times N$ Benes network itself (with one additional stage)
contains every $K$-Benes network as a subgraph and use this property to
construct the KR-Benes network. With regard to the control-optimality of the
KR-Benes, we show that any optimal network for rearrangeably routing
$K$-bounded permutations must have depth $2 \log K + 2$, and therefore the
$K$-Benes (and hence the KR-Benes) is optimal.
","[{""version"":""v1"",""created"":""Sat, 6 Sep 2003 06:19:30 GMT""},{""version"":""v2"",""created"":""Sat, 1 Nov 2003 02:14:22 GMT""},{""version"":""v3"",""created"":""Fri, 7 Nov 2003 02:15:07 GMT""},{""version"":""v4"",""created"":""Mon, 21 Jun 2004 22:25:18 GMT""}]","2007-05-23"
"gr-qc/0309035","Seth A. Major","Franz Hinterleitner and Seth Major","Isotropic Loop Quantum Cosmology with Matter II: The Lorentzian
  Constraint","19 pages, 4 figures","Phys.Rev. D68 (2003) 124023","10.1103/PhysRevD.68.124023",,"gr-qc",,"  The Lorentzian Hamiltonian constraint is solved for isotropic loop quantum
cosmology coupled to a massless scalar field. As in the Euclidean case, the
discreteness of quantum geometry removes the classical singularity from the
quantum Friedmann models. In spite of the absence of the classical singularity,
a modified DeWitt initial condition is incompatible with a late-time smooth
behavior. Further, the smooth behavior is recovered only for positive or
negatives times but not both. An important feature, which is shared with the
Euclidean case, is a minimal initial energy of the order of the Planck energy
required for the system to evolve dynamically. By forming wave packets of the
matter field an explicit evolution in terms of an internal time is obtained.
","[{""version"":""v1"",""created"":""Fri, 5 Sep 2003 20:29:04 GMT""}]","2009-11-10"
"gr-qc/0309036","Gregory V. Vereshchagin","G.V. Vereshchagin","On the problem of cosmological singularity within gauge theories of
  gravitation","3 pages",,,,"gr-qc",,"  In this note I discuss the problem of cosmological singularities within gauge
theories of gravitation. Solutions of cosmological equations with the scalar
field are considered.
","[{""version"":""v1"",""created"":""Sat, 6 Sep 2003 13:04:31 GMT""},{""version"":""v2"",""created"":""Fri, 19 Dec 2003 09:20:39 GMT""},{""version"":""v3"",""created"":""Thu, 17 Jun 2004 16:51:44 GMT""}]","2007-05-23"
"gr-qc/0309037","Vyacheslav Rychkov","Vyacheslav S. Rychkov","Correct Quantization Modes of Free Fields in Schwarzschild Spacetime","This paper has been withdrawn",,,,"gr-qc hep-th",,"  This paper has been withdrawn, because the result turned out to be well
known.
","[{""version"":""v1"",""created"":""Sat, 6 Sep 2003 14:59:24 GMT""},{""version"":""v2"",""created"":""Sat, 18 Sep 2004 16:52:15 GMT""}]","2007-05-23"
"hep-ex/0309024","Arie Bodek","A. Bodek, H. Budd and J. Arrington","Modeling Neutrino Quasielastic Cross Sections on Nucleons and Nuclei","5 pages, 4 figures, Presented by Arie Bodek at CIPANP2003, New York
  City, NY 2003 - to be published in proceedings","AIP Conf.Proc.698:148-152,2004","10.1063/1.1664214",,"hep-ex hep-ph nucl-ex nucl-th",,"  We calculate the total and differential quasielastic cross sections for
neutrino and antineutrino scattering on nucleons using up to date fits to the
nucleon elastic electromagnetic form factors $G_E^p$, $G_E^n$, $G_M^p$,
$G_M^n$, and $F_A$ and pseudoscalar form factors. We compare predictions of the
cross sections for nucelons and nuclei to experimental data.
","[{""version"":""v1"",""created"":""Fri, 5 Sep 2003 18:13:54 GMT""},{""version"":""v2"",""created"":""Sun, 7 Sep 2003 22:33:13 GMT""}]","2009-06-02"
"hep-ex/0309025","A. V. Telnov","The BABAR Collaboration, B. Aubert, et al","Measurements of branching fractions in B -> phi K and B -> phi pi and
  search for direct CP violation in B+/- -> phi K+/-","6 pages, 3 postscript figures, submitted to Phys. Rev. D (Rapid
  Communications)","Phys.Rev.D69:011102,2004","10.1103/PhysRevD.69.011102","BABAR-PUB-03/17, SLAC-PUB-10086","hep-ex",,"  We present measurements of branching fractions in the b -> s s-bar s
penguin-dominated decays B+ --> phi K+ and B0 --> phi K0 in a sample of
approximately 89 million BBbar pairs collected by the BaBar detector at the
PEP-II asymmetric-energy B-meson factory at SLAC. We determine B(B+ --> phi K+)
= (10.0 +0.9 -0.8 +/- 0.5) x 10^{-6} and B(B0 --> phi K0) = (8.4 +1.5 -1.3 +/-
0.5) x 10^{-6}. Additionally, we measure the CP-violating charge asymmetry ACP
(B+/- --> phi K+/-) = 0.04 +/- 0.09 +/- 0.01, with a 90% confidence interval of
[-0.10, 0.18], and set an upper limit B(B+ --> phi pi+) < 0.41 x 10^{-6} (at
the 90% confidence level).
","[{""version"":""v1"",""created"":""Sat, 6 Sep 2003 02:36:47 GMT""},{""version"":""v2"",""created"":""Fri, 6 Feb 2004 22:00:37 GMT""}]","2008-11-26"
"hep-lat/0309020","Thomas Hemmert","M. Procura (1 and 2), T.R. Hemmert (1) and W. Weise (1 and 2) ((1) TU
  Muenchen, (2) ECT Trento)","Nucleon mass, sigma term and lattice QCD","12 pages, 4 figures, revised journal version","Phys.Rev. D69 (2004) 034505","10.1103/PhysRevD.69.034505","TUM-T39-03-17","hep-lat",,"  We investigate the quark mass dependence of the nucleon mass M_N. An
interpolation of this observable, between a selected set of fully dynamical
two-flavor lattice QCD data and its physical value, is studied using
relativistic baryon chiral perturbation theory up to order p^4. In order to
minimize uncertainties due to lattice discretization and finite volume effects
our numerical analysis takes into account only simulations performed with
lattice spacings a<0.15 fm and m_pi L>5. We have also restricted ourselves to
data with m_pi<600 MeV and m_sea=m_val. A good interpolation function is found
already at one-loop level and chiral order p^3. We show that the
next-to-leading one-loop corrections are small. From the p^4 numerical analysis
we deduce the nucleon mass in the chiral limit, M_0 approx 0.88 GeV, and the
pion-nucleon sigma term sigma_N= (49 +/- 3) MeV at the physical value of the
pion mass.
","[{""version"":""v1"",""created"":""Fri, 5 Sep 2003 20:35:38 GMT""},{""version"":""v2"",""created"":""Mon, 5 Apr 2004 15:57:46 GMT""}]","2009-11-10"
"hep-ph/0309053","Dan Pirjol","Dan Pirjol and Iain W. Stewart","The phenomenology of rare and semileptonic B decays","10 pages, 2 figures, invited talk given by D.P. at the 2nd Conference
  on Flavor Physics and CP Violation (FPCP 2003), 3-6 June 2003, Paris, France","ECONF C030603:MEC04,2003",,"MIT-CTP 3411","hep-ph",,"  We summarize recent progress in the theory of exclusive rare and semileptonic
B decays, focusing on model-independent results. The heavy-to-light form
factors parameterizing these decays admit a model-independent description in
two distinct kinematical regions. In the large-energy limit of an energetic
light meson, the Soft-Collinear Effective Theory can be used to prove
factorization formulas for the form factors. We present factorization formulas
for all B-> P,V form factors at leading order in Lambda/m_b. Near the
zero-recoil point, Heavy Quark Effective Theory gives useful relations among
the form factors of different currents.
","[{""version"":""v1"",""created"":""Fri, 5 Sep 2003 19:50:56 GMT""}]","2011-01-27"
"hep-ph/0309057","Scott Dodelson","Scott Dodelson","Coherent Phase Argument for Inflation","16 pages, 13 figures, Invited Talk at Fourth Tropical Workshop,
  Cairns, Australia, June 2003","AIP Conf.Proc.689:184-196,2003","10.1063/1.1627736",,"hep-ph astro-ph",,"  Cosmologists have developed a phenomenally successful picture of structure in
the universe based on the idea that the universe expanded exponentially in its
earliest moments. There are three pieces of evidence for this exponential
expansion -- {\it inflation} -- from observations of anisotropies in the cosmic
microwave background. First, the shape of the primordial spectrum is very
similar to that predicted by generic inflation models. Second, the angular
scale at which the first acoustic peak appears is consistent with the flat
universe predicted by inflation. Here I describe the third piece of evidence,
perhaps the most convincing of all: the phase coherence needed to account for
the clear peak/trough structure observed by the WMAP satellite and its
predecessors. I also discuss alternatives to inflation that have been proposed
recently and explain how they produce coherent phases.
","[{""version"":""v1"",""created"":""Fri, 5 Sep 2003 20:02:04 GMT""}]","2014-11-17"
"hep-ph/0309058","Paulo Sergio Rodrigues da Silva","Alex G. Dias, C. A. de S. Pires and P. S. Rodrigues da Silva","Discrete symmetries, invisible axion and lepton number symmetry in an
  economic 3-3-1 model","17 pages, Revtex4","Phys.Rev.D68:115009,2003","10.1103/PhysRevD.68.115009",,"hep-ph",,"  We show that Peccei-Quinn and lepton number symmetries can be a natural
outcome in a 3-3-1 model with right-handed neutrinos after imposing a Z_11 x
Z_2 symmetry. This symmetry is suitably accommodated in this model when we
augmented its spectrum by including merely one singlet scalar field. We work
out the breaking of the Peccei-Quinn symmetry, yielding the axion, and study
the phenomenological consequences. The main result of this work is that the
solution to the strong CP problem can be implemented in a natural way, implying
an invisible axion phenomenologically unconstrained, free of domain wall
formation and constituting a good candidate for the cold dark matter.
","[{""version"":""v1"",""created"":""Fri, 5 Sep 2003 21:17:28 GMT""}]","2008-11-26"
"hep-ph/0309059","Kenji Fukushima","Kenji Fukushima","Relation between color-deconfinement and chiral restoration","Contributed to the XXI International Symposium on Lattice Field
  Theory (Lattice2003(nonzero)), Tsukuba, July 15-19, 2003",,"10.1016/S0920-5632(03)02640-9",,"hep-ph",,"  We discuss the relation between the Polyakov loop and the chiral order
parameter at finite temperature by using an effective model. We clarify why and
how the pseudo-critical temperature associated with the Polyakov loop should
coincide with that of the chiral condensate.
","[{""version"":""v1"",""created"":""Fri, 5 Sep 2003 23:56:54 GMT""}]","2009-11-10"
"hep-ph/0309060","Shin'ichiro Ando","Shin'ichiro Ando and Katsuhiko Sato","A comprehensive study of neutrino spin-flavour conversion in supernovae
  and the neutrino mass hierarchy","23 pages, 11 figures, corrected minor typos, added references. Final
  version to appear in Journal of Cosmology and Astroparticle Physics","JCAP 0310 (2003) 001","10.1088/1475-7516/2003/10/001","UTAP-457","hep-ph astro-ph",,"  Resonant spin-flavour (RSF) conversions of supernova neutrinos, which is
induced by the interaction between the nonzero neutrino magnetic moment and
supernova magnetic fields, are studied for both normal and inverted mass
hierarchy. As the case for the pure matter-induced neutrino oscillation
(Mikheyev--Smirnov--Wolfenstein (MSW) effect), we find that the RSF transitions
are strongly dependent on the neutrino mass hierarchy as well as the value of
$\theta_{13}$. Flavour conversions are solved numerically for various neutrino
parameter sets, with presupernova profile calculated by Woosley and Weaver. In
particular, it is very interesting that the RSF-induced
$\nu_\rme\to\bar\nu_\rme$ transition occurs, if the following conditions are
all satisfied: the value of $\mu_\nu B$ ($\mu_\nu$ is the neutrino magnetic
moment, and $B$ is the magnetic field strength) is sufficiently strong, the
neutrino mass hierarchy is inverted, and the value of $\theta_{13}$ is large
enough to induce adiabatic MSW resonance. In this case, the strong peak due to
original $\nu_\rme$ emitted from neutronization burst would exist in time
profile of the neutrino events detected at the Super-Kamiokande detector. If
this peak were observed in reality, it would provide fruitful information on
the neutrino properties. On the other hand, characters of the neutrino spectra
are also different between the neutrino models, but we find that there remains
degeneracy among several models. Dependence on presupernova models is also
discussed.
","[{""version"":""v1"",""created"":""Sat, 6 Sep 2003 12:29:07 GMT""},{""version"":""v2"",""created"":""Mon, 29 Sep 2003 12:51:25 GMT""}]","2009-11-10"
"hep-th/0309067","Pierre Mathieu","Patrick Desrosiers, Luc Lapointe, Pierre Mathieu","Explicit formulas for the generalized Hermite polynomials in superspace","19 pages. This is a recasting of the second part of the first version
  of hep-th/0305038 which has been splitted in two articles. In this revised
  version, the introduction has been rewritten and a new appendix has been
  added. To appear in JPA","J.Phys.A37:1251-1268,2004","10.1088/0305-4470/37/4/013",,"hep-th math.CO math.QA nlin.SI",,"  We provide explicit formulas for the orthogonal eigenfunctions of the
supersymmetric extension of the rational Calogero-Moser-Sutherland model with
harmonic confinement, i.e., the generalized Hermite (or Hi-Jack) polynomials in
superspace. The construction relies on the triangular action of the Hamiltonian
on the supermonomial basis. This translates into determinantal expressions for
the Hamiltonian's eigenfunctions.
","[{""version"":""v1"",""created"":""Fri, 5 Sep 2003 19:57:15 GMT""},{""version"":""v2"",""created"":""Fri, 31 Oct 2003 20:25:56 GMT""}]","2008-11-26"
"hep-th/0309068","Roger E. Behrend","Roger E. Behrend and David E. Evans","Integrable Lattice Models for Conjugate $A^{(1)}_n$","18 pages. v2: minor changes, such as page 11 footnote","J.Phys.A37:2937-2948,2004","10.1088/0305-4470/37/8/006",,"hep-th cond-mat.stat-mech math-ph math.MP nlin.SI",,"  A new class of $A^{(1)}_n$ integrable lattice models is presented. These are
interaction-round-a-face models based on fundamental nimrep graphs associated
with the $A^{(1)}_n$ conjugate modular invariants, there being a model for each
value of the rank and level. The Boltzmann weights are parameterized by
elliptic theta functions and satisfy the Yang-Baxter equation for any fixed
value of the elliptic nome q. At q=0, the models provide representations of the
Hecke algebra and are expected to lead in the continuum limit to coset
conformal field theories related to the $A^{(1)}_n$ conjugate modular
invariants.
","[{""version"":""v1"",""created"":""Sat, 6 Sep 2003 00:07:04 GMT""},{""version"":""v2"",""created"":""Sat, 27 Mar 2004 23:13:21 GMT""}]","2008-11-26"
"hep-th/0309069","Martin Puchwein","Martin Puchwein, Zoltan Kunszt (ETH Zurich)","Radiative Corrections with 5D Mixed Position-/Momentum-space Propagators","24 pages, 3 figures","Annals Phys. 311 (2004) 288-313","10.1016/j.aop.2003.12.010",,"hep-th",,"  In higher dimensional field theories with compactified dimensions there are
three standard ways to do perturbative calculations: i) by the summation over
Kaluza-Klein towers; ii) by the summation over winding numbers making use of
the Poisson-resummation formula and iii) by using mixed propagators, where the
coordinates of the four infinite dimensions are Fourier-transformed to momentum
space while those of the compactified dimensions are kept in configuration
space. The third method is broadly used in finite temperature field theory
calculations. One of its advantage is that one can easily separate the
ultraviolet divergent terms of the uncompactified theory from the non-local
finite corrections arising from windings around the compact dimensions. In this
note we demonstrate the use of this formalism by calculating one-loop
self-energy corrections in a 5D theory formulated on the manifold M_4 \otimes
S_1 and on the orbifold M_4 \otimes S_1/Z_2.
","[{""version"":""v1"",""created"":""Sat, 6 Sep 2003 15:10:58 GMT""}]","2007-05-23"
"math-ph/0309019","Alexander Soshnikov","Alexander Soshnikov","Janossy Densities of Coupled Random Matrices","We revised the introduction and added a couple of new references",,"10.1007/s00220-004-1177-5",,"math-ph math.MP math.PR",,"  We explicitly calculate Janossy densities for a special class of finite
determinantal point processes with several types of particles introduced by
Pr\""ahofer and Spohn and, in the full generality, by Johansson in connection
with the analysis of polynuclear growth models. The results of our paper
generalize the theorem we proved earlier with Borodin about the Janossy
densities in biorthogonal ensembles. In particular, our results can be applied
to coupled random matrices.
","[{""version"":""v1"",""created"":""Fri, 5 Sep 2003 23:03:36 GMT""},{""version"":""v2"",""created"":""Thu, 11 Sep 2003 03:19:59 GMT""},{""version"":""v3"",""created"":""Tue, 23 Mar 2004 01:12:16 GMT""},{""version"":""v4"",""created"":""Fri, 26 Mar 2004 21:38:42 GMT""}]","2009-11-10"
"math/0309099","Jorge Solomin","Jorge E. Solomin, Marcela Zuccalli","Noncentral extensions as anomalies in classical dynamical systems","arxiv version is already official","J. Nonlinear Math. Phys., volume 10, no.1 (2003) 1-9","10.2991/jnmp.2003.10.1.1",,"math.SG",,"  A two cocycle is associated to any action of a Lie group on a symplectic
manifold. This allows to enlarge the concept of anomaly in classical dynamical
systems considered by F. Toppan [in J. Nonlinear Math. Phys. 8, no.3 (2001)
518-533] so as to encompass some extensions of Lie algebras related to
noncanonical actions.
","[{""version"":""v1"",""created"":""Fri, 5 Sep 2003 16:05:53 GMT""}]","2015-06-26"
