"astro-ph/0309196","Jordanka Borissova","J. Borissova, P. Pessev, V.D. Ivanov, I. Saviane, R. Kurtev, and G.R.
  Ivanov","Discovery of New Milky Way Star Cluster Candidates in the 2MASS Point
  Source Catalog II. Physical Properties of the Star Cluster CC01","8 pages, 9 figures, accepted in A&A","Astron.Astrophys.411:83-90,2003","10.1051/0004-6361:20034009",,"astro-ph",,"  Three new obscured Milky Way clusters were detected as surface density peaks
in the 2MASS point source catalog during our on-going search for hidden
globular clusters and massive Arches-like star clusters. One more cluster was
discovered serendipitously during a visual inspection of the candidates.
  The first deep J, H, and Ks imaging of the cluster [IBP2002] CC01 is
presented. We estimated a cluster age of ~1-3 Myr, distance modulus of
(m-M)0=12.56+-0.08 mag (D=3.5 Kpc), and extinction of AV~7.7 mag. We also
derived the initial mass function slope for the cluster: Gamma=-2.23+-0.16. The
integration over the initial mass function yielded a total cluster mass
M_{total}<=1800+-200Msol. CC01 appears to be a regular, not very massive star
cluster, whose formation has probably been induced by the shock front from the
nearby HII region Sh2-228.
","[{""version"":""v1"",""created"":""Fri, 5 Sep 2003 23:28:48 GMT""}]","2009-11-10"
"astro-ph/0309198","Daisuke Kawata","Michael A. Beasley (1), Daisuke Kawata (1), Frazer. R. Pearce (2),
  Duncan A. Forbes (1), Brad K. Gibson (1) ((1) Swinburne, (2) Nottingham)","The Metallicity of Pre-Galactic Globular Clusters: Observational
  consequences of the first stars","5 pages, 2 figures, accepted for publication in ApJ Letter","Astrophys.J.596:L187-L190,2003","10.1086/379531",,"astro-ph",,"  We explore a scenario where metal-poor globular clusters (GCs) are enriched
by the first supernovae in the Universe. If the first stars in a 10^7 Msun dark
halo were very massive (>180 Msun), then a pair instability supernova from a
single massive star can produce sufficient iron to enrich 10^6 Msun of
pristine, primordial gas to [Fe/H] ~ -2. In such a scenario, where a single
massive star acts as a seed for halo GCs, the accurate abundance analysis of GC
stars would allow a direct measurement of the Population III initial mass.
Using the latest theoretical yields for zero metallicity stars in the mass
range 140-260 Msun, we find that the metals expelled from a ~230 Msun star are
consistent with [Si/Fe] and [Ca/Fe] observed in GC stars. However, no single
star in this mass range can simultaneously explain all halo GC heavy-element
abundance ratios, such as [V/Fe], [Ti/Fe] and [Ni/Fe]. These require a
combination masses for the Population III stellar progenitors. The various
observational consequences of this scenario are discussed.
","[{""version"":""v1"",""created"":""Sat, 6 Sep 2003 05:55:25 GMT""}]","2009-11-10"
"astro-ph/0309199","Liang Gang Liu","De-hua Wen, Wei Chen, Xian-ju Wang, Bao-quan Ai, Guo-tao Liu,
  Dong-qiao Dong, Liang-gang Liu","Structures of Rotating Traditional Neutron Stars and Hyperon Stars in
  the Relativistic $\sigma-\omega$ Model","10 pages, 10 figures","Eur.Phys.J.A21:349-354,2004","10.1140/epja/i2003-10183-2",,"astro-ph",,"  The influence of the rotation on the total masses and radii of the neutron
stars are calculated by the Hartle's slow rotation formalism, while the
equation of state is considered in a relativistic $\sigma-\omega$ model.
Comparing with the observation, the calculating result shows that the double
neutron star binaries are more like hyperon stars and the neutron stars of
X-ray binaries are more like traditional neutron stars. As the changes of the
mass and radius to a real neutron star caused by the rotation are very small
comparing with the total mass and radius, one can see that Hartle's approximate
method is rational to deal with the rotating neutron stars. If three property
values: mass, radius and period are observed to the same neutron star, then the
EOS of this neutron star could be decided entirely.
","[{""version"":""v1"",""created"":""Sat, 6 Sep 2003 06:30:42 GMT""}]","2009-11-10"
"astro-ph/0309200","Kunihito Ioka","Kunihito Ioka","Cosmic Dispersion Measure from Gamma-Ray Burst Afterglows: Probing the
  Reionization History and the Burst Environment","4 pages, 3 figures, emulateapj.cls used, accepted for publication in
  ApJL","Astrophys.J.598:L79-L82,2003","10.1086/380598",,"astro-ph",,"  We show a possible way to measure the column density of free electrons along
the light path, the so-called Dispersion Measure (DM), from the early $[\sim
415 (\nu/1 {\rm GHz})^{-2} ({\rm DM}/10^{5} {\rm pc} {\rm cm}^{-3}) {\rm s}]$
radio afterglows of the gamma-ray bursts. We find that the proposed Square
Kilometer Array can detect bright radio afterglows around the time $\sim
10^{3}(\nu/160 {\rm MHz})^{-2}$ s to measure the intergalactic DM ($\simg 6000$
pc cm$^{-3}$ at redshift $z>6$) up to $z\sim 30$, from which we can determine
the reionization history of the universe and identify the missing warm-hot
baryons. At low $z$, DM in the host galaxy may reach $\sim 10^{5}$ pc cm$^{-3}$
depending on the burst environment, which may be probed by the current
detectors. Free-free absorption and diffractive scattering may also affect the
radio emission in a high density.
","[{""version"":""v1"",""created"":""Sat, 6 Sep 2003 10:04:00 GMT""},{""version"":""v2"",""created"":""Tue, 14 Oct 2003 01:28:01 GMT""}]","2009-11-10"
"astro-ph/0309201","Stephan Rosswog","Stephan Rosswog and Enrico Ramirez-Ruiz","On the Central Engine of short Gamma-ray Bursts","5 pages, 3 figures",,,,"astro-ph",,"  We assess two mechanisms to produce a short GRB from a neutron star
coalescence: the annihilation of neutrino and anti-neutrino pairs and magnetic
processes within the remnant. We find that the neutrino-driven wind from the
remnant can collimate the jets produced via neutrino annihilation into a small
solid angle. This mechanism satisfies the observational constraints on the
apparent luminosity and on the merger event rate. Moreover, the supermassive
neutron star that is formed in the center of the remnant is expected to act as
a convective dynamo reaching equipartition field strengths within fractions of
a second. The associated spin-down time scale is similar to the typical
duration of short GRBs.
","[{""version"":""v1"",""created"":""Sat, 6 Sep 2003 13:34:41 GMT""},{""version"":""v2"",""created"":""Tue, 16 Sep 2003 21:08:16 GMT""}]","2007-05-23"
"cond-mat/0309140","Sergey Kravchenko","S. V. Kravchenko and M. P. Sarachik","Metal-insulator transition in two-dimensional electron systems","As published","Rep. Prog. Phys. 67, 1 (2004)","10.1088/0034-4885/67/1/R01",,"cond-mat.str-el",,"  The interplay between strong Coulomb interactions and randomness has been a
long-standing problem in condensed matter physics. According to the scaling
theory of localization, in two-dimensional systems of noninteracting or weakly
interacting electrons, the ever-present randomness causes the resistance to
rise as the temperature is decreased, leading to an insulating ground state.
However, new evidence has emerged within the past decade indicating a
transition from insulating to metallic phase in two-dimensional systems of
strongly interacting electrons. We review earlier experiments that demonstrate
the unexpected presence of a metallic phase in two dimensions, and present an
overview of recent experiments with emphasis on the anomalous magnetic
properties that have been observed in the vicinity of the transition.
","[{""version"":""v1"",""created"":""Fri, 5 Sep 2003 19:19:33 GMT""},{""version"":""v2"",""created"":""Thu, 13 Nov 2003 19:57:34 GMT""},{""version"":""v3"",""created"":""Wed, 3 Dec 2003 13:58:35 GMT""}]","2007-05-23"
"cond-mat/0309144","Patrick Fournier","P. Fournier, M.-E. Gosselin, S. Savard, J. Renaud, I. Hetel, P.
  Richard and G. Riou","Fourfold oscillations and anomalous magnetic irreversibility of
  magnetoresistance in the non-metallic regime of Pr1.85Ce0.15CuO4","11 pages, 5 figures",,"10.1103/PhysRevB.69.220501",,"cond-mat.supr-con cond-mat.str-el",,"  Using magnetoresistance measurements as a function of applied magnetic field
and its direction of application, we present sharp angular-dependent
magnetoresistance oscillations for the electron-doped cuprates in their
low-temperature non-metallic regime. The presence of irreversibility in the
magnetoresistance measurements and the related strong anisotropy of the field
dependence for different in-plane magnetic field orientations indicate that
magnetic domains play an important role for the determination of electronic
properties. These domains are likely related to the stripe phase reported
previously in hole-doped cuprates.
","[{""version"":""v1"",""created"":""Fri, 5 Sep 2003 19:19:44 GMT""}]","2009-11-10"
"cond-mat/0309147","Mark Dykman","B. Golding and M.I. Dykman","Acceptor-based silicon quantum computing",,,,,"cond-mat.mes-hall cond-mat.mtrl-sci quant-ph",,"  A solid-state quantum computer with dipolar coupling between qubits is
proposed. The qubits are formed by the low-lying states of an isolated acceptor
in silicon. The system has the scalability inherent to spin-based solid state
systems, but the spatial separation between the qubits is an order of magnitude
larger. Despite strong dipolar inter-qubit coupling, the decoherence rate, as
measured by electric dipolar echoes at an energy splitting of 1.5 GHz, is less
than 1 kHz at low temperatures. For inter-acceptor distances of 100 nm and for
modest microwave field amplitudes (50 V/cm) the clock frequency of the quantum
computer is 0.1 GHz, which yields a quality factor of 105. This paper describes
ideas for detection and operation of the quantum computer, and examines
limitations imposed by noise sources.
","[{""version"":""v1"",""created"":""Fri, 5 Sep 2003 16:43:25 GMT""}]","2007-05-23"
"cond-mat/0309148","Katja Lindenberg","J. Buceta and Katja Lindenberg","Comprehensive study of phase transitions in relaxational systems with
  field-dependent coefficients",,,"10.1103/PhysRevE.69.011102",,"cond-mat.stat-mech cond-mat.soft",,"  We present a comprehensive study of phase transitions in single-field systems
that relax to a non-equilibrium global steady state. The mechanism we focus on
is not the so-called Stratonovich drift combined with collective effects, but
is instead similar to the one associated with noise-induced transitions a la
Horsthemke-Lefever in zero-dimensional systems. As a consequence, the noise
interpretation (e.g., Ito vs Stratonvich) merely shifts the phase boundaries.
With the help of a mean-field approximation, we present a broad qualitative
picture of the various phase diagrams that can be found in these systems. To
complement the theoretical analysis we present numerical simulations that
confirm the findings of the mean-field theory.
","[{""version"":""v1"",""created"":""Fri, 5 Sep 2003 17:27:14 GMT""}]","2009-11-10"
"cond-mat/0309149","Yuko Okamoto","Giovanni La Penna, Ayori Mitsutake, Masato Masuya, Yuko Okamoto","Molecular dynamics of C-peptide of ribonuclease A studied by
  replica-exchange Monte Carlo method and diffusion theory","17 pages, 5 figures, (LaTeX); Chemical Physics Letters, in press",,"10.1016/j.cplett.2003.07.031",,"cond-mat.stat-mech q-bio.BM",,"  Generalized-ensemble algorithm and diffusion theory have been combined in
order to compute the dynamical properties monitored by nuclear magnetic
resonance experiments from efficient and reliable evaluation of statistical
averages. Replica-exchange Monte Carlo simulations have been performed with a
C-peptide analogue of ribonuclease A, and Smoluchowski diffusion equations have
been applied. A fairly good agreement between the calculated and measured
$^1$H-NOESY NMR cross peaks has been obtained. The combination of these
advanced and continuously improving statistical tools allows the calculation of
a wide variety of dynamical properties routinely obtained by experiments.
","[{""version"":""v1"",""created"":""Fri, 5 Sep 2003 17:52:38 GMT""}]","2009-11-10"
"cond-mat/0309150","Sung Yong Park","Sung Yong Park and David Stroud","Theory of the Optical Properties of a DNA-Modified Gold Nanoparticle
  System","4 pages, 3 figures. To be published in Physica B",,"10.1016/j.physb.2003.08.019",,"cond-mat",,"  We describe a simple model for the melting and optical properties of a
DNA/gold nanoparticle aggregate. The aggregate is modeled as a cluster of gold
nanoparticles on a periodic lattice connected by DNA bonds, and the extinction
coefficient is computed using the discrete dipole approximation. The optical
properties at fixed wavelength change dramatically at the melting transition,
which is found to be higher and narrower in temperature for larger particles,
and much sharper than that of an isolated DNA link. All these features are in
agreement with available experiments.
","[{""version"":""v1"",""created"":""Fri, 5 Sep 2003 18:00:53 GMT""}]","2015-06-24"
"cond-mat/0309151","Studart","Yu. P. Monarkha, S. S. Sokolov, G. Q. Hai and Nelson Studart","Magnetoresistance of nondegenerate quantum electron channels formed on
  the surface of superfluid helium","8 pages, 7 figures",,"10.1103/PhysRevB.69.104525",,"cond-mat.str-el",,"  Transport properties of quasi-one-dimensional nondegenerate quantum wires
formed on the surface of liquid helium in the presence of a normal magnetic
field are studied using the momentum balance equation method and the memory
function formalism. The interaction with both kinds of scatterers available
(vapor atoms and capillary wave quanta) is considered. We show that unlike
classical wires, quantum nondegenerate channels exhibit strong
magnetoresistance which increases with lowering the temperature.
","[{""version"":""v1"",""created"":""Fri, 5 Sep 2003 18:23:56 GMT""}]","2009-11-10"
"cond-mat/0309152","Studart","F. Comas and Nelson Studart","Electron-phonon interaction in quantum-dot/quantum-well semiconductor
  heterostructures","8 pages, 5 figures",,"10.1103/PhysRevB.69.235321",,"cond-mat.mes-hall",,"  Polar optical phonons are studied in the framework of the dielectric
continuum approach for a prototypical quantum-dot/quantum-well (QD/QW)
heterostructure, including the derivation of the electron-phonon interaction
Hamiltonian and a discussion of the effects of this interaction on the
electronic energy levels. The particular example of the CdS/HgS QD/QW is
addressed and the system is modelled according to the spherical geometry,
considering a core sphere of material ""1"" surrounded by a spherically
concentric layer of material ""2"", while the whole structure is embedded in a
host matrix assumed as an infinite dielectric medium. The strength of the
electron-LO phonon coupling is discussed in details and the polaronic
corrections to both ground state and excited state electron energy levels are
calculated. Interesting results concerning the dependence of polaronic
corrections with the QD/QW structure size are analyzed.
","[{""version"":""v1"",""created"":""Fri, 5 Sep 2003 18:36:35 GMT""}]","2009-11-10"
"cond-mat/0309153","Michael Vogel","Michael Vogel, Burkhard Doliwa, Andreas Heuer, Sharon C. Glotzer","Particle rearrangements during transitions between local minima of the
  potential energy landscape of a supercooled Lennard-Jones liquid","13 pages, 10 figures",,"10.1063/1.1644538",,"cond-mat",,"  The potential energy landscape (PEL) of supercooled binary Lennard-Jones
(BLJ) mixtures exhibits local minima, or inherent structures (IS), which are
organized into meta-basins (MB). We study the particle rearrangements related
to transitions between both successive IS and successive MB for a small 80:20
BLJ system near the mode-coupling temperature T_MCT. The analysis includes the
displacements of individual particles, the localization of the rearrangements
and the relevance of string-like motion. We find that the particle
rearrangements during IS and MB transitions do not change significantly at
T_MCT. Further, it is demonstrated that IS and MB dynamics are spatially
heterogeneous and facilitated by string-like motion. To investigate the
mechanism of string-like motion, we follow the particle rearrangements during
suitable sequences of IS transitions. We find that most strings observed after
a series of transitions do not move coherently during a single transition, but
subunits of different sizes are active at different times. Several findings
suggest that the occurrence of a successful string enables the system to exit a
MB. Moreover, we show that the particle rearrangements during two consecutive
MB transitions are basically uncorrelated. Specifically, different groups of
particles are highly mobile during subsequent MB transitions. Finally, the
relation between the features of the PEL and the relaxation processes in
supercooled liquids is discussed.
","[{""version"":""v1"",""created"":""Fri, 5 Sep 2003 19:27:35 GMT""}]","2009-11-10"
"cond-mat/0309154","Herbert A. Fertig","H.A. Fertig","Spinning Holes in Semiconductors","5 pages, 1 figure. A Perspective on ""Dissipationless Quantum Spin
  Current at Room Temperature"" by Shuichi Murakami, Naoto Nagaosa, and
  Shou-Cheng Zhang, Science 301, 1348 (2003)","Science 301, 1335 (2003) (with minor differences)",,,"cond-mat.mes-hall cond-mat.mtrl-sci",,"  The electron spin is emerging as a new powerful tool in the electronics and
optics industries. Many proposed applications involve the creation of spin
currents, which so far have proven to be difficult to produce in semiconductor
environments. A new theoretical analysis shows this might be achieved using
holes rather than electrons in semiconductors with significant spin-orbit
coupling.
","[{""version"":""v1"",""created"":""Fri, 5 Sep 2003 19:38:33 GMT""}]","2007-05-23"
"cond-mat/0309155","William Putikka","W. O. Putikka and R. Joynt","Theory of Optical Orientation in n-Type Semiconductors","4 pages, 2 figures; revised version has a more complete discussion of
  the Elliott-Yafet and spin-phonon decay mechanisms",,"10.1103/PhysRevB.70.113201",,"cond-mat.mtrl-sci cond-mat.mes-hall",,"  Time resolved measurements of magnetization in n-GaAs have revealed a rich
array of spin decoherence processes, and have shown that fairly long lifetimes
(\sim 100 ns) can be achieved under certain circumstances. In time-resolved
Faraday rotation and time-resolved Kerr rotation the evolution of the
magnetization can be followed as a function of temperature, applied field,
doping level and excitation level. We present a theory for the spin relaxation
in n-GaAs based on a set of rate equations for two interacting thermalized
subsystems of spins: localized states on donor sites and itinerant states in
the conduction band. The conduction band spins relax by scattering from defects
or phonons through the D'yakonov-Perel' mechanism, while the localized spins
relax by interacting with phonons (when in an applied field) or through the
Dzyaloshinskii-Moriya interaction. In this model, numerous features of the
data, including puzzling temperature and doping dependences of the relaxation
time, find an explanation.
","[{""version"":""v1"",""created"":""Fri, 5 Sep 2003 19:55:14 GMT""},{""version"":""v2"",""created"":""Tue, 14 Oct 2003 22:31:45 GMT""},{""version"":""v3"",""created"":""Thu, 13 May 2004 02:22:29 GMT""}]","2009-11-10"
"cond-mat/0309156","Hae-Young Kee","Hae-Young Kee, Yong Baek Kim, and K. Maki","Critical Current of the Spin-Triplet Superconducting Phase in
  Sr$_2$RuO$_4$","4 pages, 1 figure","Phys. Rev. B 70, 052505 (2004).","10.1103/PhysRevB.70.052505",,"cond-mat.supr-con cond-mat.str-el",,"  There have been two different proposals for the spin-triplet order parameter
of the superconducting phase in Sr$_2$RuO$_4$; an $f$-wave order parameter and
the multigap model where some of the bands have the line node. In an effort to
propose an experiment that can distinguish two cases, we study the behavior of
the supercurrent and compute the critical current for these order parameters
when the sample is a thin film with the thickness $d \ll \xi$ where $\xi$ is
the coherence length. It is found that the supercurrent behaves very
differently in two models. This will serve as a sharp test for the
identification of the correct order parameter.
","[{""version"":""v1"",""created"":""Fri, 5 Sep 2003 21:01:51 GMT""}]","2009-11-10"
"cond-mat/0309157","Kim Rasmussen","G. Kalosakas, K. {\O}. Rasmussen, A. R. Bishop, C. H. Choi, and A.
  Usheva","Structurally specific thermal fluctuations identify functional sites for
  DNA transcription",,"EUROPHYSICS LETTERS 68, 127-133 (2004)","10.1209/epl/i2004-10167-8",,"cond-mat.soft physics.bio-ph q-bio.GN",,"  We report results showing that thermally-induced openings of double stranded
DNA coincide with the location of functionally relevant sites for
transcription. Investigating both viral and bacterial DNA gene promoter
segments, we found that the most probable opening occurs at the transcription
start site. Minor openings appear to be related to other regulatory sites. Our
results suggest that coherent thermal fluctuations play an important role in
the initiation of transcription. Essential elements of the dynamics, in
addition to sequence specificity, are nonlinearity and entropy, provided by
local base-pair constraints.
","[{""version"":""v1"",""created"":""Fri, 5 Sep 2003 21:28:59 GMT""},{""version"":""v2"",""created"":""Tue, 9 Sep 2003 03:20:56 GMT""}]","2007-05-23"
"cond-mat/0309158","Gennady Berman","G.P. Berman, V.N. Gorshkov, and V.I. Tsifrinovich","Reduction of Magnetic Noise in Magnetic Resonance Force Microscopy",,,"10.1103/PhysRevB.69.212408",,"cond-mat",,"  We study the opportunity to reduce a magnetic noise produced by a uniform
cantilever with a ferromagnetic particle in magnetic resonance force microscopy
(MRFM) applications. We demonstrate theoretically a significant reduction of
magnetic noise and the corresponding increase of the MRFM relaxation time using
a nonuniform cantilever.
","[{""version"":""v1"",""created"":""Fri, 5 Sep 2003 21:52:38 GMT""}]","2009-11-10"
"cond-mat/0309159","Stephen Hill","D. Zipse, J. M. North, N. S. Dalal, S. Hill and R. S. Edwards","Characterization of the S = 9 excited state in Fe8Br8 by Electron
  Paramagnetic Resonance","7 pages, Figs included in text, submitted to PRB",,"10.1103/PhysRevB.68.184408",,"cond-mat.str-el",,"  High Frequency electron paramagnetic resonance has been used to observe the
magnetic dipole, $\Delta$ M$_s$ = $\pm$ 1, transitions in the $S = 9$ excited
state of the single molecule magnet Fe$_8$Br$_8$. A Boltzmann analysis of the
measured intensities locates it at 24 $\pm$ 2 K above the $S = 10$ ground
state, while the line positions yield its magnetic parameters D = -0.27 K, E =
$\pm$0.05 K, and B$_4^0$ = -1.3$\times$ 10$^{-6}$ K. D is thus smaller by 8%
and E larger by 7% than for $S = 10$. The anisotropy barrier for $S = 9$ is
estimated as 22 K,which is 25% smaller than that for $S = 10$ (29 K). These
data also help assign the spin exchange constants(J's) and thus provide a basis
for improved electronic structure calculations of Fe$_8$Br$_8$.
","[{""version"":""v1"",""created"":""Fri, 5 Sep 2003 21:54:40 GMT""}]","2009-11-10"
"cond-mat/0309160","Sangam Chatterjee","S. Chatterjee, C. Ell, S. Mosor, G. Khitrova, H.M. Gibbs, W. Hoyer, M.
  Kira, S.W. Koch, J.P. Prineas, H. Stolz","Excitonic Photoluminescence in Semiconductor Quantum Wells: Plasma
  versus Excitons","9 pages, 4 figures","Phys. Rev. Lett. 92, 067402 (2004)","10.1103/PhysRevLett.92.067402",,"cond-mat",,"  Time-resolved photoluminescence spectra after nonresonant excitation show a
distinct 1s resonance, independent of the existence of bound excitons. A
microscopic analysis identifies excitonic and electron-hole plasma
contributions. For low temperatures and low densities the excitonic emission is
extremely sensitive to even minute optically active exciton populations making
it possible to extract a phase diagram for incoherent excitonic populations.
","[{""version"":""v1"",""created"":""Fri, 5 Sep 2003 23:42:07 GMT""}]","2009-11-10"
"cond-mat/0309161","Douglas J. Durian","K.A. Newhall and D.J. Durian","Projectile-shape dependence of impact craters in loose granular media","3 pages, 3 figures; experiment","Phys. Rev. E 68, 060301(R) (2003)","10.1103/PhysRevE.68.060301",,"cond-mat.soft",,"  We report on the penetration of cylindrical projectiles dropped from rest
into a dry, noncohesive granular medium. The cylinder length, diameter,
density, and tip shape are all explicitly varied. For deep penetrations, as
compared to the cylinder diameter, the data collapse onto a single scaling law
that varies as the 1/3 power of the total drop distance, the 1/2 power of
cylinder length, and the 1/6 power of cylinder diameter. For shallow
penetrations, the projectile shape plays a crucial role with sharper objects
penetrating deeper.
","[{""version"":""v1"",""created"":""Sat, 6 Sep 2003 00:03:49 GMT""}]","2007-05-23"
