"hep-ph/0309273","Bingsong Zou","B.S.Zou, H.C.Chiang","One-pion-exchange final-state-interaction and the pbar p near threshold
  enhancement in J/psi -> gamma pbar p decays","8 pages, 1 figure","Phys.Rev.D69:034004,2004","10.1103/PhysRevD.69.034004",,"hep-ph",,"  For the Nbar N system, the one-pion-exchange (OPE) interaction gives the
largest attractive force for Nbar N with isospin I=0 and spin S=0, while a near
threshold enhancement was observed for pbar p with I=0 and S=0 in J/psi ->
gamma pbar p decays. With a K-matrix approach, we find that the OPE
final-state-interaction (FSI) makes an important contribution to the
near-threshold enhancement in the pbar p mass spectrum in J/psi -> gamma pbar p
decays.
","[{""version"":""v1"",""created"":""Wed, 24 Sep 2003 09:50:19 GMT""}]","2008-11-26"
"hep-ph/0309274","Ansgar Denner","A. Denner, S. Dittmaier, M. Roth, M.M. Weber","Radiative corrections to Higgs-boson production in association with
  top-quark pairs at e+ e- colliders","32 pages, LaTeX, 12 postscript figures","Nucl.Phys.B680:85-116,2004","10.1016/j.nuclphysb.2003.12.028","KA-TP-09-2003, MPP-2003-73, PSI-PR-03-15","hep-ph",,"  We have calculated the complete O(alpha) and O(alpha_s) radiative corrections
to the Higgs-production process e+ e- -> t anti-t H in the Standard Model. This
process is particularly interesting for the measurement of the top-quark Yukawa
coupling at a future e+ e- collider. The calculation of the O(alpha)
corrections is described in some detail including, in particular, the treatment
of the soft and collinear singularities. The discussion of numerical results
focuses on the total cross section as well as on angular and energy
distributions of the outgoing particles. The electroweak corrections turn out
to be sizable and can reach the order of +/-10%. They result from cancellations
between electromagnetic, fermionic, and weak bosonic corrections, each of which
are of the order of +/-10%.
","[{""version"":""v1"",""created"":""Wed, 24 Sep 2003 14:06:30 GMT""}]","2008-11-26"
"hep-ph/0309275","Paul Frampton","Paul H. Frampton","AdS/CFT-Inspired Unification at About 4 TeV","Talk at the Second International Conference on String Phenomenology.
  Durham, UK. July 2003",,,,"hep-ph",,"  The use of the AdS/CFT correspondence to arrive at quiver gauge field
theories is discussed, focussing on the orbifolded case without supersymmetry.
An abelian orbifold with the finite group Z(12) can accommodate unification at
about 4 TeV.
","[{""version"":""v1"",""created"":""Wed, 24 Sep 2003 14:05:45 GMT""}]","2007-05-23"
"hep-ph/0309276","Edmond Iancu","Edmond Iancu and A.H. Mueller","Rare fluctuations and the high-energy limit of the S-matrix in QCD","28 pages, 5 figures","Nucl.Phys.A730:494-513,2004","10.1016/j.nuclphysa.2003.10.019","SACLAY-T03/138, CU-TP-1096","hep-ph",,"  We argue that one cannot correctly calculate the elastic scattering S-matrix
for high-energy dipole-dipole scattering, in the region where S is small,
without taking fluctuations into account. The relevant fluctuations are rare
and unimportant for general properties of inelastic collisions. We find that
the Kovchegov equation, while giving the form of the S-matrix correctly, gives
the exponential factor twice as large as the result which emerges when
fluctuations are taken into account.
","[{""version"":""v1"",""created"":""Wed, 24 Sep 2003 15:26:54 GMT""}]","2011-01-25"
"hep-th/0309213","Andrei Starinets","Pavel Kovtun, Dam T. Son and Andrei O. Starinets","Holography and hydrodynamics: diffusion on stretched horizons","27 pages","JHEP 0310:064,2003","10.1088/1126-6708/2003/10/064","UW/PT 03-21, INT-PUB 03-17","hep-th gr-qc hep-ph",,"  We show that long-time, long-distance fluctuations of plane-symmetric
horizons exhibit universal hydrodynamic behavior. By considering classical
fluctuations around black-brane backgrounds, we find both diffusive and shear
modes. The diffusion constant and the shear viscosity are given by simple
formulas, in terms of metric components. For a given metric, the answers can be
interpreted as corresponding kinetic coefficients in the holographically dual
theory. For the near-extremal Dp, M2 and M5 branes, the computed kinetic
coefficients coincide with the results of independent AdS/CFT calculations. In
all the examples, the ratio of shear viscosity to entropy density is equal to
\hbar/(4\pi k_B), suggesting a special meaning of this value.
","[{""version"":""v1"",""created"":""Tue, 23 Sep 2003 19:51:32 GMT""}]","2011-05-05"
"hep-th/0309218","Don Marolf","Donald Marolf and Rafael Sorkin","On the Status of Highly Entropic Objects","6 pages, RevTex, a few editorial changes","Phys.Rev. D69 (2004) 024014","10.1103/PhysRevD.69.024014",,"hep-th gr-qc",,"  It has been proposed that the entropy of any object must satisfy fundamental
(holographic or Bekenstein) bounds set by the object's size and perhaps its
energy. However, most discussions of these bounds have ignored the possibility
that objects violating the putative bounds could themselves become important
components of Hawking radiation. We show that this possibility cannot a priori
be neglected in existing derivations of the bounds. Thus this effect could
potentially invalidate these derivations; but it might also lead to
observational evidence for the bounds themselves.
","[{""version"":""v1"",""created"":""Tue, 23 Sep 2003 17:08:57 GMT""},{""version"":""v2"",""created"":""Wed, 24 Sep 2003 17:12:17 GMT""},{""version"":""v3"",""created"":""Mon, 10 Nov 2003 17:55:12 GMT""}]","2009-11-10"
"hep-th/0309219","Washington Chagas-Filho","W. F. Chagas-Filho","Symmetries in particle and string theories","Latex, no figures, corrected typos",,,,"hep-th",,"  We study the space-time invariances of the bosonic relativistic particle and
bosonic relativistic string using general formulations obtained by
incorporating the Hamiltonian constraints into the formalism. We point out that
massless particles and tensionless strings have a larger set of space-time
invariances than their massive and tensionful partners, respectively. We also
show that it is possible to use the reparametrization invariance of the string
formulation we present to reach the classical conformal equations of motion
without the use of two-dimensional Weyl scalings of the string world sheet.
Finally, we show that it is possible to fix a gauge with an enlarged number of
space-time invariances in which every point of the free tensionless string
moves as if it were an almost-free massless particle. The existence of such a
string motion agrees with what is expected from gauge theory-string duality.
","[{""version"":""v1"",""created"":""Tue, 23 Sep 2003 17:36:43 GMT""},{""version"":""v2"",""created"":""Wed, 24 Sep 2003 19:45:47 GMT""},{""version"":""v3"",""created"":""Thu, 25 Sep 2003 11:57:43 GMT""}]","2007-05-23"
"hep-th/0309220","Stefan Vandoren","M. Davidse, M. de Vroome, U. Theis and S. Vandoren","Instanton Solutions for the Universal Hypermultiplet","Minor changes, clarification added. Contribution to the proceedings
  of the 36th International Symposium Ahrenshoop, August 2003","Fortsch.Phys. 52 (2004) 696-701","10.1002/prop.200310166",,"hep-th",,"  We expand our previous analysis on fivebrane and membrane instanton solutions
in the universal hypermultiplet, including near-extremal multi-centered
solutions and mixed fivebrane-membrane charged instantons. The results are most
conveniently described in terms of a double-tensor multiplet.
","[{""version"":""v1"",""created"":""Tue, 23 Sep 2003 17:46:29 GMT""},{""version"":""v2"",""created"":""Wed, 24 Sep 2003 19:12:23 GMT""},{""version"":""v3"",""created"":""Fri, 5 Mar 2004 13:51:31 GMT""}]","2009-11-10"
"hep-th/0309221","Guido Cognola","Guido Cognola and Sergio Zerbini","Effective action for scalar fields and generalised zeta-function
  regularisation","Latex, 16 pages, no figures; Latex mistakes corrected; accepted for
  publication in Physical Review D","Phys.Rev. D69 (2004) 024004","10.1103/PhysRevD.69.024004",,"hep-th",,"  Motivated by the study of quantum fields in a Friedman-Robertson-Walker (FRW)
spacetime, the one-loop effective action for a scalar field defined in the
ultrastatic manifold $R\times H^3/\Gamma$, $H^3/\Gamma$ being the finite
volume, non-compact, hyperbolic spatial section, is investigated by a
generalisation of zeta-function regularisation. It is shown that additional
divergences may appear at one-loop level. The one-loop renormalisability of the
model is discussed and making use of a generalisation of zeta-function
regularisation, the one-loop renormalisation group equations are derived.
","[{""version"":""v1"",""created"":""Wed, 24 Sep 2003 07:12:10 GMT""},{""version"":""v2"",""created"":""Fri, 3 Oct 2003 11:59:24 GMT""}]","2009-11-10"
"hep-th/0309222","Giulio Bonelli","G. Bonelli","On the covariant quantization of tensionless bosonic strings in AdS
  spacetime","1+16 pages; v4 two clarifications added","JHEP 0311 (2003) 028","10.1088/1126-6708/2003/11/028","ULB-TH/03-35","hep-th",,"  The covariant quantization of the tensionless free bosonic (open and closed)
strings in AdS spaces is obtained. This is done by representing the AdS space
as an hyperboloid in a flat auxiliary space and by studying the resulting
string constrained hamiltonian system in the tensionless limit. It turns out
that the constraint algebra simplifies in the tensionless case in such a way
that the closed BRST quantization can be formulated and the theory admits then
an explicit covariant quantization scheme. This holds for any value of the
dimension of the AdS space.
","[{""version"":""v1"",""created"":""Wed, 24 Sep 2003 08:59:02 GMT""},{""version"":""v2"",""created"":""Wed, 1 Oct 2003 09:19:29 GMT""},{""version"":""v3"",""created"":""Wed, 8 Oct 2003 13:28:20 GMT""},{""version"":""v4"",""created"":""Mon, 13 Oct 2003 10:15:20 GMT""}]","2009-11-10"
"hep-th/0309223","Ilarion Melnikov","Ilarion V. Melnikov, M. Ronen Plesser and Sven Rinke","Supersymmetric Boundary Conditions for the N=2 Sigma Model","23 pages, no figures. minor changes in text, a reference added",,"10.1142/9789812702340_0029","DUKE-CGTP-0304","hep-th",,"  We clarify the discussion of N=2 supersymmetric boundary conditions for the
classical d=2, N=(2,2) Non-Linear Sigma Model on an infinite strip. Our
conclusions about the supersymmetric cycles match the results found in the
literature. However, we find a constraint on the boundary action that is not
satisfied by many boundary actions used in the literature.
","[{""version"":""v1"",""created"":""Wed, 24 Sep 2003 13:55:13 GMT""},{""version"":""v2"",""created"":""Wed, 22 Oct 2003 14:16:02 GMT""}]","2017-08-23"
"hep-th/0309224","Antonio Bassetto","Antonio Bassetto and Federica Vian","Planarity in Noncommutative Gauge Theories","LaTeX, 8 pages, no figures. Talk presented by A. Bassetto at the
  Light-Cone Workshop LC03 ""Hadrons and beyond"", Durham (U.K.), August 2003",,,"DFPD 03/TH/37","hep-th",,"  Planarity was introduced by 't Hooft in his topological classification of
diagrams in the large-N limit of U(N) gauge theories. Planarity also occurs in
noncommutative field theories where amplitudes possess invariance only under
cyclic permutations, a feature inherited from the parent string theory. In
noncommutative gauge theories both kinds of planarity merge in a context which
turns out to be particularly intriguing in the two-dimensional case where gauge
invariant correlators can be explicitly computed.
","[{""version"":""v1"",""created"":""Wed, 24 Sep 2003 14:04:30 GMT""}]","2007-05-23"
"math-ph/0309053","Lars Jonsson","J. Frohlich, S. Gustafson, B. L. G. Jonsson, I. M. Sigal","Solitary Wave Dynamics in an External Potential","latex2e, 41 pages, 1 figure","Comm. Math. Phys. 250(3) pp.613--642, 2004","10.1007/s00220-004-1128-1",,"math-ph math.AP math.MP",,"  We study the behavior of solitary-wave solutions of some generalized
nonlinear Schr\""odinger equations with an external potential. The equations
have the feature that in the absence of the external potential, they have
solutions describing inertial motions of stable solitary waves.
  We construct solutions of the equations with a non-vanishing external
potential corresponding to initial conditions close to one of these solitary
wave solutions and show that, over a large interval of time, they describe a
solitary wave whose center of mass motion is a solution of Newton's equations
of motion for a point particle in the given external potential, up to small
corrections corresponding to radiation damping.
","[{""version"":""v1"",""created"":""Tue, 23 Sep 2003 17:16:58 GMT""}]","2007-05-23"
"math-ph/0309054","Miroslav Andrle","Miroslav Andrle, Cestmir Burdik, and Jean-Pierre Gazeau","Bernuau spline wavelets and Sturmian sequences","41 pages,10 figures",,,,"math-ph math.MP",,"  A spline wavelets construction of class C^n(R) supported by sequences of
aperiodic discretizations of R is presented. The construction is based on
multiresolution analysis recently elaborated by G. Bernuau. At a given scale,
we consider discretizations that are sets of left-hand ends of tiles in a
self-similar tiling of the real line with finite local complexity.
Corresponding tilings are determined by two-letter Sturmian substitution
sequences. We illustrate the construction with examples having quadratic
Pisot-Vijayaraghavan units (like tau = (1 + sqrt{5})/2 or tau^2 = (3 +
sqrt{5})/2) as scaling factor. In particular, we present a comprehensive
analysis of the Fibonacci chain and give the analytic form of related scaling
functions and wavelets as splines of second order. We also give some hints for
the construction of multidimensional spline wavelets based on stone-inflation
tilings in arbitrary dimension.
","[{""version"":""v1"",""created"":""Wed, 24 Sep 2003 13:36:26 GMT""}]","2007-05-23"
"math/0309387","Veit Elser","Veit Elser","Bit retrieval: intractability and application to digital watermarking","27 pages, 4 figures",,,,"math.NT math.RA",,"  Bit retrieval, the problem of determining a binary sequence from its cyclic
autocorrelation, is a special case of the phase retrieval problem. Algorithms
for phase retrieval are extensively used in several scientific disciplines, and
yet, very little is known about the complexity of these algorithms or phase
retrieval in general. Here we show that bit retrieval, in particular, is
closely related to computations that arise in algebraic number theory and can
also be formulated as an integer program. We find that general purpose
algorithms from these fields, when applied to bit retrieval, are outperformed
by a particular iterative phase retrieval algorithm. This algorithm still has
exponential complexity and motivates us to propose a new public key signature
scheme based on the intractability of bit retrieval, and image watermarking as
a possible application.
","[{""version"":""v1"",""created"":""Tue, 23 Sep 2003 17:46:26 GMT""}]","2007-05-23"
"math/0309388","Michael Jackson","Michael A. Jackson","The strong symmetric genus of the hyperoctahedral groups","11 pages, 3 figures; fixed typo in Theorem 1","J. Group Theory 7 (2004) 495-505",,,"math.GR math.GT",,"  The strong symmetric genus of a group is the smallest genus of a surface on
which the group acts faithfully as a group of orientation preserving
automorphisms. In this paper we announce and prove the strong symmetric genus
for the hyperoctahedral groups. This parameter is already known for the
alternating and symmetric groups as well as the sporadic finite simple groups.
","[{""version"":""v1"",""created"":""Tue, 23 Sep 2003 18:08:56 GMT""},{""version"":""v2"",""created"":""Sat, 20 Nov 2004 02:05:51 GMT""}]","2007-05-23"
"math/0309389","N. J. A. Sloane","J. C. Lagarias, N. J. A. Sloane","Approximate Squaring","22 pages. Revised Nov 9, 2003: new theorems, including probabilistic
  interpretation of results, also analogs for floor function (24 pages)","Experimental Math. 13 (2004), 113--128.",,,"math.NT cs.IT math.IT",,"  We study the ``approximate squaring'' map f(x) := x ceiling(x) and its
behavior when iterated. We conjecture that if f is repeatedly applied to a
rational number r = l/d > 1 then eventually an integer will be reached. We
prove this when d=2, and provide evidence that it is true in general by giving
an upper bound on the density of the ``exceptional set'' of numbers which fail
to reach an integer. We give similar results for a p-adic analogue of f, when
the exceptional set is nonempty, and for iterating the ``approximate
multiplication'' map f_r(x) := r ceiling(x) where r is a fixed rational number.
","[{""version"":""v1"",""created"":""Tue, 23 Sep 2003 19:49:45 GMT""},{""version"":""v2"",""created"":""Thu, 11 Dec 2003 00:08:49 GMT""}]","2007-07-16"
"math/0309390","David Kribs","David W. Kribs","Quantum Channels, Wavelets, Dilations and Representations of $O_n$","15 pages, preprint version","Proc. Edinburgh Math. Soc. 46 (2003), 421-433",,,"math.OA quant-ph",,"  We show that the representations of the Cuntz C$^\ast$-algebras $O_n$ which
arise in wavelet analysis and dilation theory can be classified through a
simple analysis of completely positive maps on finite-dimensional space. Based
on this analysis, an application in quantum information theory is obtained;
namely, a structure theorem for the fixed point set of a unital quantum
channel. We also include some open problems motivated by this work.
","[{""version"":""v1"",""created"":""Tue, 23 Sep 2003 20:03:15 GMT""}]","2007-05-23"
"math/0309391","James Allen Fill","James Allen Fill (Johns Hopkins Univ.) and Fred Torcaso (Johns Hopkins
  Univ.)","Asymptotic analysis via Mellin transforms for small deviations in
  $L^2$-norm of integrated Brownian sheets","29 pages. See also http://www.mts.jhu.edu/~fill/ and
  http://www.mts.jhu.edu/~torcaso/ . Submitted for publication in September,
  2003",,,,"math.PR",,"  We use Mellin transforms to compute a full asymptotic expansion for the tail
of the Laplace transform of the squared $L^2$-norm of any multiply-integrated
Brownian sheet. Through reversion we obtain corresponding strong
small-deviation estimates.
","[{""version"":""v1"",""created"":""Tue, 23 Sep 2003 22:25:57 GMT""}]","2007-05-23"
"math/0309392","Gregory Lupton","Gregory Lupton","The Rational Toomer Invariant and Certain Elliptic Spaces",,"Contemporary Mathematics, Vol. 316 (2002), 135--146",,,"math.AT",,"  We give an explicit formula for the rational category of an elliptic space
whose minimal model has a homogeneous-length differential. We also show that
for such a space, there are no gaps in the sequence of integers realized as the
rational Toomer invariant of some cohomology class. With an additional
hypothesis, we show a result from which we deduce the relation dim(H^*(X;Q)) >=
2 cat_0(X).
","[{""version"":""v1"",""created"":""Wed, 24 Sep 2003 01:16:10 GMT""}]","2007-05-23"
"math/0309393","David Kribs","David W. Kribs and Stephen C. Power","Partly Free Algebras from Directed Graphs","12 pages, Proc. Intl. Workshop on Operator Theory and its
  Applications 2002, to appear","Operator Theory: Advances and Applications, Birkhauser-Verlag
  Basel/Switzerland, 149 (2004), 381-393.",,,"math.OA",,"  We say that a nonselfadjoint operator algebra is partly free if it contains a
free semigroup algebra. Motivation for such algebras occurs in the setting of
what we call free semigroupoid algebras. These are the weak operator topology
closed algebras generated by the left regular representations of semigroupoids
associated with finite or countable directed graphs. We expand our analysis of
partly free algebras from previous work and obtain a graph-theoretic
characterization of when a free semigroupoid algebra with countable graph is
partly free. This analysis carries over to norm closed quiver algebras. We also
discuss new examples for the countable graph case.
","[{""version"":""v1"",""created"":""Wed, 24 Sep 2003 01:59:24 GMT""}]","2007-05-23"
"math/0309394","David Kribs","David W. Kribs and Stephen C. Power","Free Semigroupoid Algebras","45 pages, J. Ramanujan Math. Soc., to appear","J. Ramanujan Math. Soc., 19 (2004), 75-117.",,,"math.OA",,"  Every countable directed graph generates a Fock space Hilbert space and a
family of partial isometries. These operators also arise from the left regular
representations of free semigroupoids derived from directed graphs. We develop
a structure theory for the weak operator topology closed algebras generated by
these representations, which we call free semigroupoid algebras. We
characterize semisimplicity in terms of the graph and show explicitly in the
case of finite graphs how the Jacobson radical is determined. We provide a
diverse collection of examples including; algebras with free behaviour, and
examples which can be represented as matrix function algebras. We show how
these algebras can be presented and decomposed in terms of amalgamated free
products. We determine the commutant, consider invariant subspaces, obtain a
Beurling theorem for them, conduct an eigenvalue analysis, give an elementary
proof of reflexivity, and discuss hyper-reflexivity. Our main theorem shows the
graph to be a complete unitary invariant for the algebra. This classification
theorem makes use of an analysis of unitarily implemented automorphisms. We
give a graph-theoretic description of when these algebras are partly free, in
the sense that they contain a copy of a free semigroup algebra.
","[{""version"":""v1"",""created"":""Wed, 24 Sep 2003 02:30:06 GMT""},{""version"":""v2"",""created"":""Sun, 6 Jun 2004 03:24:44 GMT""}]","2007-05-23"
"math/0309395","Alberto Elduque","G. Benkart, A. Elduque, C. Martinez","A(n,n)-graded Lie superalgebras","LaTeX, 18 pages",,,,"math.RT math.RA",,"  We determine the Lie superalgebras over fields of characteristic zero that
are graded by the root system A(n,n) of the special linear Lie superalgebra
psl(n+1,n+1).
","[{""version"":""v1"",""created"":""Wed, 24 Sep 2003 06:54:00 GMT""}]","2007-05-23"
"math/0309396","Astrid an Huef","Astrid an Huef (University of New South Wales), Iain Raeburn
  (University of Newcastle)","Twisted actions and the obstruction to extending unitary representations
  of subgroups",,,,,"math.OA math.RT",,"  Suppose that $G$ is a locally compact group and $\pi$ is a (not necessarily
irreducible) unitary representation of a closed normal subgroup $N$ of $G$ on a
Hilbert space $H$. We extend results of Clifford and Mackey to determine when
$\pi$ extends to a unitary representation of $G$ on the same space $H$ in terms
of a cohomological obstruction.
","[{""version"":""v1"",""created"":""Wed, 24 Sep 2003 07:17:05 GMT""}]","2007-05-23"
"math/0309397","David Kribs","Michael T. Jury and David W. Kribs","Ideal Structure in Free Semigroupoid Algebras from Directed Graphs","32 pages, J. Operator Theory, to appear","J. Operator Theory, 53 (2005), 273-302.",,,"math.OA",,"  A free semigroupoid algebra is the weak operator topology closed algebra
generated by the left regular representation of a directed graph. We establish
lattice isomorphisms between ideals and invariant subspaces, and this leads to
a complete description of the weak operator topology closed ideal structure for
these algebras. We prove a distance formula to ideals, and this gives an
appropriate version of the Caratheodory interpolation theorem. Our analysis
rests on an investigation of predual properties, specifically the $A_n$
properties for linear functionals, together with a general Wold Decomposition
for $n$-tuples of partial isometries. A number of our proofs unify proofs for
subclasses appearing in the literature.
","[{""version"":""v1"",""created"":""Wed, 24 Sep 2003 11:12:49 GMT""}]","2007-05-23"
"math/0309398","David Kribs","Michael T. Jury and David W. Kribs","Partially Isometric Dilations of Noncommuting $N$-tuples of Operators","12 pages, preprint","Proc. Amer. Math. Soc., 133 (2005), 213-222.",,,"math.FA math.OA",,"  Given a row contraction of operators on Hilbert space and a family of
projections on the space which stabilize the operators, we show there is a
unique minimal joint dilation to a row contraction of partial isometries which
satisfy natural relations. For a fixed row contraction the set of all dilations
forms a partially ordered set with a largest and smallest element. A key
technical device in our analysis is a connection with directed graphs. We use a
Wold Decomposition for partial isometries to describe the models for these
dilations, and discuss how the basic properties of a dilation depend on the row
contraction.
","[{""version"":""v1"",""created"":""Wed, 24 Sep 2003 11:29:41 GMT""}]","2007-05-23"
"math/0309399","Alessandro Gimigliano","M. V. Catalisano, A. V. Geramita, A. Gimigliano","Higher secant varieties of Segre-Veronese varieties","12 pages, plain TEX",,,,"math.AG",,"  We study the dimension of the higher secant varieties $X^s$ of ${\Bbb X} =
{\Bbb P}^{n_1}\times ...\times {\Bbb P}^{n_t}$ embedded the morphism given by
${\cal O}_{\Bbb X}({a_1,...,a_t})$. We call it a {\it Segre-Veronese variety}
and the embedding a {\it Segre-Veronese embedding}. In several cases (e.g. for
3 factors {\Bbb P}^{1}, or when $s$ is small) we show that $X^s$ has the
expected dimension except for a few cases. A list of examples of defective
$X^s$'s is given.
","[{""version"":""v1"",""created"":""Wed, 24 Sep 2003 12:06:56 GMT""}]","2007-05-23"
