"astro-ph/0305080","Carl L. Gardner","Carl L. Gardner","Cosmological Variation of the Fine Structure Constant from an
  Ultra-Light Scalar Field: The Effects of Mass","22 pages, 15 figures Version 2: The Oklo event is now considered as
  localized in time. The initial conditions for the scalar field have been
  refined. The numbers in the Table have been recomputed. Added Refs","Phys.Rev. D68 (2003) 043513","10.1103/PhysRevD.68.043513",,"astro-ph hep-ph",,"  Cosmological variation of the fine structure constant $\alpha$ due to the
evolution of a spatially homogeneous ultra-light scalar field ($m \sim H_0$)
during the matter and $\Lambda$ dominated eras is analyzed. Agreement of
$\Delta \alpha/\alpha$ with the value suggested by recent observations of
quasar absorption lines is obtained by adjusting a single parameter, the
coupling of the scalar field to matter.
  Asymptotically $\alpha(t)$ in this model goes to a constant value
$\bar{\alpha} \approx \alpha_0$ in the early radiation and the late $\Lambda$
dominated eras. The coupling of the scalar field to (nonrelativistic) matter
drives $\alpha$ slightly away from $\bar{\alpha}$ in the epochs when the
density of matter is important.
  Simultaneous agreement with the more restrictive bounds on the variation
$|\Delta \alpha/\alpha|$ from the Oklo natural fission reactor and from
meteorite samples can be achieved if the mass of the scalar field is on the
order of 0.5--0.6 $H_\Lambda$, where $H_\Lambda = \Omega_\Lambda^{1/2} H_0$.
  Depending on the scalar field mass, $\alpha$ may be slightly smaller or
larger than $\alpha_0$ at the times of big bang nucleosynthesis, the emission
of the cosmic microwave background, the formation of early solar system
meteorites, and the Oklo reactor. The effects on the evolution of $\alpha$ due
to nonzero mass for the scalar field are emphasized.
  An order of magnitude improvement in the laboratory technique could lead to a
detection of $(\dot{\alpha}/\alpha)_0$.
","[{""version"":""v1"",""created"":""Tue, 6 May 2003 17:13:44 GMT""},{""version"":""v2"",""created"":""Fri, 11 Jul 2003 18:31:15 GMT""}]","2009-11-07"
"astro-ph/0305081","Giovanni Lapenta","Paolo Ricci, Giovanni Lapenta and J.U. Brackbill","Electron acceleration and heating in collisionless magnetic reconnection",,"Phys.Plasmas 10 (2003) 3554-3560","10.1063/1.1598207",,"astro-ph physics.plasm-ph physics.space-ph",,"  We discuss electron acceleration and heating during collisionless magnetic
reconnection by using the results of implicit kinetic simulations of Harris
current sheets. We consider and compare electron dynamics in plasmas with
different \beta values and perform simulations up to the physical mass ratio.
We analyze the typical trajectory of electrons passing through the reconnection
region, we study the electron velocity, focusing on the out-of-plane velocity,
and we discuss the electron heating along the in-plane and out-of-plane
directions.
","[{""version"":""v1"",""created"":""Tue, 6 May 2003 17:59:59 GMT""}]","2009-11-07"
"astro-ph/0305082","Stephen Vine","Ian A. Bonnell, Matthew R. Bate, Stephen G. Vine","The hierarchical formation of a stellar cluster","6 pages, 4 figures, accepted for publication in MNRAS. Version
  including hi-res colour postscript figure available at
  http://star-www.st-and.ac.uk/~sgv/ps/clufhier.ps.gz","Mon.Not.Roy.Astron.Soc. 343 (2003) 413","10.1046/j.1365-8711.2003.06687.x",,"astro-ph",,"  Recent surveys of star forming regions have shown that most stars, and
probably all massive stars, are born in dense stellar clusters. The mechanism
by which a molecular cloud fragments to form several hundred to thousands of
individual stars has remained elusive. Here, we use a numerical simulation to
follow the fragmentation of a turbulent molecular cloud and the subsequent
formation and early evolution of a stellar cluster containing more than 400
stars. We show that the stellar cluster forms through the hierarchical
fragmentation of a turbulent molecular cloud. This leads to the formation of
many small subclusters which interact and merge to form the final stellar
cluster. The hierarchical nature of the cluster formation has serious
implications in terms of the properties of the new-born stars. The higher
number-density of stars in subclusters, compared to a more uniform distribution
arising from a monolithic formation, results in closer and more frequent
dynamical interactions. Such close interactions can truncate circumstellar
discs, harden existing binaries, and potentially liberate a population of
planets. We estimate that at least one-third of all stars, and most massive
stars, suffer such disruptive interactions.
","[{""version"":""v1"",""created"":""Tue, 6 May 2003 19:11:39 GMT""},{""version"":""v2"",""created"":""Thu, 8 May 2003 11:03:35 GMT""}]","2009-11-07"
"astro-ph/0305083","Jeremy S. Heyl","Yefei Yuan (Center for Astrophysics, University of Science and
  Technology of China and Harvard-Smithsonian CfA) and Jeremy S. Heyl
  (Harvard-Smithsonian CfA)","Rotational Evolution of Protoneutron Stars","28 pages, 12 figures",,,,"astro-ph",,"  We study the rotational evolution of a protoneutron star with hyperons and
nucleons or solely nucleons in its core due to the escape of the trapped
neutrinos. It is found that at the early stage of its evolution, the stellar
crust contracts significantly, consequently the star spins up. At the late
stage, a the protoneutron star with hyperons, it keeps shrinking and spinning
up till all the trapped neutrinos escape. Consequently, the distribution of the
stellar initial spin periods is skewed toward shorter periods. For a
protoneutron star with only nucleons, the expansion of its core dominates, and
the stellar rotation slows down. After the neutrinos escape, the range of the
spin periods is narrower than the initial one, but the distribution is still
nearly uniform. If the hyperonic star is metastable, its rotational frequency
accelerates distinguishedly before it collapses to a black hole.
","[{""version"":""v1"",""created"":""Tue, 6 May 2003 19:47:20 GMT""}]","2007-05-23"
"astro-ph/0305084","Miville-Deschenes M.-A.","M.-A. Miville-Deschenes","Depletion of small dust grains in the early stages of molecule formation","5 pages, 4 figures, ""Chemistry as a Diagnostic of Star Formation"",
  2003, Waterloo, Canada. Paper with full-resolution figures at
  http://www.cita.utoronto.ca/~mamd/miville_waterloo.ps",,,,"astro-ph",,"  ISOCAM allowed the observation of diffuse interstellar regions where the
transition from atomic to molecular gas takes place. In this contribution we
report on spectacular variations of small dust grains abundance in such regions
observed with ISOCAM. In the four cirrus-like clouds observed, we note a
systematic disappearance of small dust grains in regions where CO emission
starts to appear. We suggest that the variations of the small dust grain
abundance observed here are related to the damping of the gas turbulent motions
that favors the coagulation of dust through grain-grain collisions.
","[{""version"":""v1"",""created"":""Tue, 6 May 2003 19:50:15 GMT""}]","2007-05-23"
"astro-ph/0305085","Tomohiko Narita","T. Narita (Holy Cross), J.E. Grindlay (CfA), P.F. Bloser (GSFC), Y.
  Chou (Tsinghua University, Taiwan)","X-ray Dip Monitoring of XB 1916-053","Accepted for publication in ApJ, 15 pages","Astrophys.J. 593 (2003) 1007-1012","10.1086/376693",,"astro-ph",,"  We report on the long term monitoring of X-ray dips from the ultracompact
low-mass X-ray binary (LMXB) XB 1916-053. Roughly one-month interval
observations were carried out with the Rossi X-ray Timing Explorer (RXTE)
during 1996, during which the source varied between dim, hard states and more
luminous, soft states. The dip spectra and dip lightcurves were compared
against both the broadband luminosity and the derived mass accretion rate Mdot.
The dips spectra could be fitted by an absorbed blackbody plus cut-off power
law non-dip spectral model, with additional absorption ranging from 0 to >100 x
10^22 cm^-2. The amount of additional blackbody absorption was found to vary
with the source luminosity. Our results are consistent with an obscuration of
the inner disk region by a partially ionized outer disk. The size of the
corona, derived from the dip ingress times, was found to be ~10^9 cm. The
corona size did not correlate with the coronal temperature, but seemed to
increase when \Mdot also increased. We discuss our findings in the context of
an evaporated accretion disk corona model and an ADAF-type model.
","[{""version"":""v1"",""created"":""Tue, 6 May 2003 19:44:31 GMT""}]","2009-11-07"
"astro-ph/0305086","Ann E. Hornschemeier","A.E. Hornschemeier, F.E. Bauer, D.M. Alexander, W.N. Brandt, W.L.W.
  Sargent, M.W. Bautz, C. Conselice, G.P. Garmire, D.P. Schneider, G. Wilson","The Chandra Deep Field-North Survey. XV. Optically Bright, X-ray Faint
  Sources","Accepted for publication in the Astronomical Journal Paper with
  full-resolution figures available at
  http://www.astro.psu.edu/users/niel/hdf/hdf-chandra.html","Astron.J. 126 (2003) 575","10.1086/376737",,"astro-ph",,"  We have analyzed optically bright, X-ray faint [OBXF; i.e., log(fX/fR) < -2]
sources identified in an 178.9 square arcminute area within the Chandra Deep
Field-North (CDF-N) 2 Ms survey. We find 43 OBXF sources in this area,
comprising ~15% of the X-ray sources above a 0.5--2 keV flux of 2.3e-17 erg
cm^-2 s^-1. We present spectroscopic identifications for 42 of the OBXF sources
and optical spectra for 25, including 5 previously unpublished redshifts. Deep
optical imaging data (either HST or ground-based) are presented for all the
OBXF sources. The OBXF population consists mainly of normal and starburst
galaxies detected out to cosmologically significant distances (i.e., to a
median redshift of z=0.297 and a full redshift range z=0.06-0.845). This is
notable since these distances equate to look-back times of up to ~8 Gyr; we are
thus provided with a window on the X-ray emission from galaxies at redshifts
much closer to the cosmic star formation peak than was possible prior to
Chandra.
  The X-ray luminosity distribution of OBXF sources extends to higher
luminosity than does that of ""normal"" galaxies indicating that a significant
fraction are likely dominated by low-luminosity AGN (LLAGN) or vigorous star
formation. By combining the detected X-ray counts, we find the average OBXF
X-ray spectrum to be consistent with a Gamma=2.0 power law. The 0.5--2 keV log
N-log S for the OBXF galaxies is much steeper (alpha=-1.7) than for the general
X-ray source population. Indeed, the number of OBXF sources has doubled between
the 1~Ms and 2~Ms survey, rising sharply in numbers at faint fluxes. The
extragalactic OBXF sources are found to contribute ~1-2% of the soft
extragalactic X-ray background.
","[{""version"":""v1"",""created"":""Wed, 7 May 2003 13:54:36 GMT""}]","2009-11-07"
"astro-ph/0305087","Albert Kong","A.K.H. Kong (CfA), L.O. Sjouwerman (NRAO), B.F. Williams, M.R. Garcia
  (CfA), and J.R. Dickel (UIUC)","Discovery of Radio/X-ray/Optical Resolved Supernova Remnants in the
  Center of the Andromeda Galaxy","5 pages, 3 figures, accepted for publication in ApJL","Astrophys.J. 590 (2003) L21-L24","10.1086/376687",,"astro-ph",,"  We have detected a spatially resolved supernova remnant (SNR) in the center
of the Andromeda Galaxy, in radio, X-ray, and optical wavelengths. These
observations provide the highest spatial resolution imaging of a
radio/X-ray/optical SNR in that galaxy to date. The multi-wavelength
morphology, radio spectral index, X-ray colors, and narrow-band optical imaging
are consistent with a shell-type SNR. A second SNR is also seen resolved in
both radio and X-ray. By comparing the morphological sturcture of the SNRs in
different wavelengths and with that in our own Galaxy, we can study the shock
morphologies of SNRs in the Andromeda Galaxy. The proximity of the SNRs to the
core suggests high interstellar medium density in the vicinity of the SNRs in
the center of the Andromeda Galaxy.
","[{""version"":""v1"",""created"":""Tue, 6 May 2003 20:07:08 GMT""}]","2009-11-07"
"astro-ph/0305088","Ue-Li Pen","Ue-Li Pen, Phil Arras, ShingKwong Wong","A Free, Fast, Simple and Efficient TVD MHD Code","17 pages, 6 figures, submitted to the astrophysical journal",,"10.1086/378771",,"astro-ph",,"  We describe a numerical method to solve the magnetohydrodynamic (MHD)
equations. The fluid variables are updated along each direction using the flux
conservative, 2nd order, total variation diminishing (TVD), upwind scheme of
Jin and Xin. The magnetic field is updated separately in two-dimensional
advection-constraint steps. The electromotive force (EMF) is computed in the
advection step using the TVD scheme, and this same EMF is used immediately in
the constraint step in order to preserve \grad.B=0 without the need to store
intermediate fluxes. Operator splitting is used to extend the code to three
dimensions, and Runge-Kutta is used to get second order accuracy in time. The
advantages of this code are high resolution per grid cell, second order
accuracy in space and time, enforcement of the \grad.B=0 constraint to machine
precision, no memory overhead, speed, and simplicity. A 3-D Fortran
implementation less than 400 lines long is made freely available. We also
implemented a fully scalable message-passing parallel MPI version. We present
tests of the code on MHD waves and shocks.
","[{""version"":""v1"",""created"":""Tue, 6 May 2003 20:32:27 GMT""}]","2015-06-24"
"astro-ph/0305089","Ludovic Van Waerbeke","L. Van Waerbeke (IAP), Y. Mellier (IAP, Obs de Paris)","Gravitational Lensing by Large Scale Structures: A Review","48 pages, Lecture given at the Aussois winter school, january 2003",,,,"astro-ph",,"  We review all the cosmic shear results obtained so far, with a critical
discussion of the present strengths and weaknesses. We discuss the future
prospects and the role cosmic shear could play in a precision cosmology era.
","[{""version"":""v1"",""created"":""Tue, 6 May 2003 21:04:38 GMT""},{""version"":""v2"",""created"":""Mon, 12 May 2003 12:47:44 GMT""}]","2007-05-23"
"astro-ph/0305090","Jeremy Kepner","Jeremy Kepner (MIT Lincoln Laboratory) and Stan Ahalt (Ohio State
  University)","MatlabMPI","Download software from http://www.ll.mit.edu/MatlabMPI, 12 pages
  including 7 color figures; submitted to the Journal of Parallel and
  Distributed Computing","Journal of parallel and distributed computing, ISSN: 0743-7315
  v.64: no.8, 2004, p.997","10.1016/j.jpdc.2004.03.018",,"astro-ph",,"  The true costs of high performance computing are currently dominated by
software. Addressing these costs requires shifting to high productivity
languages such as Matlab. MatlabMPI is a Matlab implementation of the Message
Passing Interface (MPI) standard and allows any Matlab program to exploit
multiple processors. MatlabMPI currently implements the basic six functions
that are the core of the MPI point-to-point communications standard. The key
technical innovation of MatlabMPI is that it implements the widely used MPI
``look and feel'' on top of standard Matlab file I/O, resulting in an extremely
compact (~250 lines of code) and ``pure'' implementation which runs anywhere
Matlab runs, and on any heterogeneous combination of computers. The performance
has been tested on both shared and distributed memory parallel computers (e.g.
Sun, SGI, HP, IBM, Linux and MacOSX). MatlabMPI can match the bandwidth of C
based MPI at large message sizes. A test image filtering application using
MatlabMPI achieved a speedup of ~300 using 304 CPUs and ~15% of the theoretical
peak (450 Gigaflops) on an IBM SP2 at the Maui High Performance Computing
Center. In addition, this entire parallel benchmark application was implemented
in 70 software-lines-of-code, illustrating the high productivity of this
approach. MatlabMPI is available for download on the web
(www.ll.mit.edu/MatlabMPI).
","[{""version"":""v1"",""created"":""Tue, 6 May 2003 21:28:55 GMT""}]","2015-05-26"
"astro-ph/0305092","Janos Zsargo","J. Zsargo (Univ. of Pittsburgh), A. W. Fullerton (Johns Hopkins
  Univ.), N. Lehner (Univ. of Wisconsin), D. Massa (NASA GSFC)","A Search for O VI in the Winds of B-Type Stars","Accepted for publication in the A&A","Astron.Astrophys. 405 (2003) 1043-1056","10.1051/0004-6361:20030601",,"astro-ph",,"  We have conducted a survey of FUSE spectra of 235 Galactic B-type stars in
order to determine the boundaries in the H-R diagram for the production of the
superion O VI in their winds. By comparing the locations and morphology of
otherwise unidentified absorption features in the vicinity of the O VI
resonance doublet with the bona fide wind profiles seen in archival IUE spectra
of the resonance lines of N V, Si IV and C IV, we were able to detect
blueshifted O VI lines in the spectra of giant and supergiant stars with
temperature classes as late as B1. No features attributable to O VI were
detected in dwarfs later than B0, or in stars of any luminosity class later
than B1, although our ability to recognize weak absorption features in these
stars is severely restricted by blending with photospheric and interstellar
features. We discuss evidence that the ratio of the ion fractions of O VI and N
V is substantially different in the winds of early B-type stars than O-type
stars.
","[{""version"":""v1"",""created"":""Tue, 6 May 2003 22:30:01 GMT""}]","2009-11-07"
"astro-ph/0305094","Bian Weihao","Bian Weihao & Zhao Yongheng","Black Hole -- Bulge Relation for Narrow-Line Objects","7 pages,3 figures, 3 tables","Publ.Astron.Soc.Jap. 55 (2003) 143",,,"astro-ph",,"  It has been thought that narrow-line Seyfert 1 galaxies are likely to be in
the early stages of the evolution of active galaxies. To test this suggestion,
the ratios of the central massive black hole (MBH) mass to the bulge mass
($M_{\rm bh}/M_{\rm bulge}$) were estimated for 22 Narrow Line AGNs (NL AGNs).
It is found that NL AGNs appear to have genuinely lower MBH/Bulge mass ratio
($M_{\rm bh}/M_{\rm bulge}$). The mean $ log(M_{\rm bh}/M_{\rm bulge})$ for 22
NL AGNs is $-3.9\pm 0.07$, which is an order of magnitude lower than that for
Broad Line AGNs and quiescent galaxies. We suggest a nonlinear MBH/Bulge
relation and find there exists a relation between the $M_{\rm bh}/M_{\rm
bulge}$ and the velocity dispersion, $\sigma$, derived from the [O ${\rm \small
III}$] width. A scenario of MBH growth for NL AGNs is one of our
interpretations of the nonlinear MBH/Bulge relation. The MBH growth timescales
for 22 NL AGNs were calculated, with a mean value $(1.29\pm0.24)\times 10^{8}$
yr. Another plausible interpretation is also possible: that NL AGNs occur in
low-$M_{\rm bulge}$ galaxies and that in such galaxies $M_{\rm bh}/M_{\rm
bulge}$ is lower than that in galaxies with a higher $M_{\rm bulge}$, if we
consider that NL AGNs already have their ``final'' $M_{\rm bh}/M_{\rm bulge}$.
More information of the bulge in NL AGNs is needed to clarify the black hole --
bulge relation.
","[{""version"":""v1"",""created"":""Wed, 7 May 2003 02:34:34 GMT""}]","2007-05-23"
"astro-ph/0305095","Bian Weihao","Bian Weihao & Zhao Yongheng","Accretion rates and accretion efficiency in AGNs","Accepted by PASJ, 5 pages, 1 figure, 1 table",,"10.1093/pasj/55.3.599",,"astro-ph",,"  We used the standard geometrical thin accretion theory to obtain the
accretion rates in Seyfert 1 galaxies and quasars. Combining accretion rates
with the bolometric luminosity, we obtained the accretion efficiency. We found
most of Seyfert 1 galaxies and radio quiet quasars have lower accretion
efficiencies while most of the radio loud quasars possess higher accretion
efficiencies. This finding further implies most of radio loud quasars possess
Kerr black holes while Seyfert 1 galaxies and radio quiet quasars may not
possess Kerr black holes. Considering the difference of the accretion
efficiency we found there is a strong correlation between the accretion rate in
units of the Eddington accretion rate and the width of the H$\beta$ emission
line and most of AGNs are not accreting at Super-Eddington rates.
","[{""version"":""v1"",""created"":""Wed, 7 May 2003 02:43:36 GMT""}]","2019-04-03"
"astro-ph/0305097","Michael Nolta","M. R. Nolta, E. L. Wright, L. Page, C. L. Bennett, M. Halpern, G.
  Hinshaw, N. Jarosik, A. Kogut, M. Limon, S. S. Meyer, D. N. Spergel, G. S.
  Tucker, E. Wollack","First Year Wilkinson Microwave Anisotropy Probe (WMAP) Observations:
  Dark Energy Induced Correlation with Radio Sources","13 pages, 4 figures, submitted to ApJ","Astrophys.J.608:10-15,2004","10.1086/386536",,"astro-ph",,"  The first-year WMAP data, in combination with any one of a number of other
cosmic probes, show that we live in a flat \Lambda-dominated CDM universe with
\Omega_m ~ 0.27 and \Omega_\Lambda ~ 0.73. In this model the late-time action
of the dark energy, through the integrated Sachs-Wolfe effect, should produce
CMB anisotropies correlated with matter density fluctuations at z<2 (Crittenden
& Turok 1996). The measurement of such a signal is an important independent
check of the model. We cross-correlate the NRAO VLA Sky Survey radio source
catalog (Condon et al. 1998) with the WMAP data in search of this signal, and
see indications of the expected correlation. Assuming a flat \Lambda-CDM
cosmology, we find \Omega_\Lambda>0 (95% CL, statistical errors only) with the
peak of the likelihood at \Omega_\Lambda=0.68, consistent with the preferred
WMAP value. A closed model with \Omega_m=1.28, h=0.33, and no dark energy
component (\Omega_\Lambda=0), marginally consistent with the WMAP CMB TT
angular power spectrum, would produce an anti-correlation between the matter
distribution and the CMB. Our analysis of the cross-correlation of the WMAP
data with the NVSS catalog rejects this cosmology at the 3\sigma level.
","[{""version"":""v1"",""created"":""Wed, 7 May 2003 05:33:36 GMT""}]","2011-05-12"
"astro-ph/0305098","Paul S. Smith","Paul S. Smith (1), Gary D. Schmidt (1), Dean C. Hines (1), and Craig
  B. Foltz (2) ((1) Steward Observatory, The University of Arizona, (2)
  Multiple Mirror Telescope Observatory)","Optical Spectropolarimetry of Quasi-Stellar Objects Discovered by the
  Two-Micron All Sky Survey","27 pages; 3 tables; 8 figures; Accepted for publication in The
  Astrophysical Journal (Part 1)","Astrophys.J. 593 (2003) 676-699","10.1086/376681",,"astro-ph",,"  Highly polarized QSOs discovered in the Two-Micron All Sky Survey (2MASS)
have been observed to determine the source(s) of optical polarization in this
near-infrared color-selected sample. Broad emission lines are observed in the
polarized flux spectra of most objects, and the polarization of the lines is at
about the same level and position angle as the continuum. Generally, the
continuum is bluer and the broad-line Balmer decrement is smaller in polarized
light than for the spectrum of total flux. Narrow emission lines are much less
polarized than the broad lines and continuum for all polarized objects. These
properties favor scattering by material close to a partially obscured and
reddened active nucleus, but exterior to the regions producing the broad-line
emission, as the source of polarized flux in 2MASS QSOs. The largely
unpolarized narrow-line features require that the electrons or dust polarizing
the light be located at distances from the nucleus not much greater than the
extent of the narrow emission-line region. In addition to known
high-polarization objects, four 2MASS QSOs with AGN spectral types of 1.9 and 2
were observed to search for hidden broad emission-line regions. Broad lines
were detected in polarized light for two of these objects, and the polarizing
mechanism appears to be the same for these objects as for the highly polarized
QSOs in the sample that readily show broad emission lines in their spectra. The
observations also show that starlight from the host galaxy contributes a
significant amount of optical flux, especially for the narrow-line objects, and
support the suggestion that many 2MASS QSOs are measured to have low
polarization simply because of dilution of the polarized AGN light by the host
galaxy.
","[{""version"":""v1"",""created"":""Wed, 7 May 2003 07:33:53 GMT""}]","2009-11-07"
"astro-ph/0305099","Stephen Serjeant","Glenn J. White and Stephen B.G. Serjeant (University of Kent)","GENIE observations of small scale astrophysical processes in star
  forming regions and quasars","Proceedings of the Genie-Darwin Workshop - Hunting for Planets","ESO SP-522 March 2003, ISBN 92-9092-832-8, paper 014",,,"astro-ph",,"  The VLTI/GENIE configuration will operate using at least 4 of the VLTI
telescopes (and possibly with one or more of the AT telescopes in the future if
adaptive optics become available on them). GENIE effectively can be thought of
as a 'smart' coronagraph, enabling high dynamic range imaging to be achieved at
moderate spatial resolution, with high rejection of the emission of a central
bright point source. However, but this bright source rejection may only provide
a rather moderate image quality (due to the few baselines and transfer function
on the sky). Operated in this way, only limited image reconstruction is
possible since classical radio and millimeter wavelength interferometry
techniques are not directly applicable to the outputs of optical
interferometers because the absolute phases are generally not measured.
However, measurements of visibility and closure phase could lead to situations
where image reconstruction becomes possible. This paper addresses the issue of
whether there are areas outside of the exoplanet search where it might be able
to make a useful impact on astronomy.
","[{""version"":""v1"",""created"":""Wed, 7 May 2003 08:52:31 GMT""}]","2007-05-23"
