"astro-ph/0305100","Juha Reunanen","J.Reunanen (Tuorla Observatory), J.Kotilainen (Tuorla), M.A.Prieto
  (ESO, Garching; MPIA)","Near-infrared spectroscopy of nearby Seyfert galaxies - II. Molecular
  content and coronal emission","19 pages, accepted for publication in MNRAS","Mon.Not.Roy.Astron.Soc. 343 (2003) 192","10.1046/j.1365-8711.2003.06771.x",,"astro-ph",,"  We present sub-arcsec near-infrared 1.5 - 2.5 micron moderate resolution
long-slit spectra of eight nearby Seyfert galaxies (z<0.01), both parallel to
the ionization cone and perpendicular to it. These spectra complement similar
data on six Seyferts, presented in Reunanen, Kotilainen & Prieto (2002). Large
concentrations of molecular gas (H2) are present in the nucleus regardless of
the Seyfert type. The spatial extent of the H2 emission is larger perpendicular
to the cone than parallel to it in 6/8 (75 %) galaxies, in agreement with the
unified models of Active Galactic Nuclei. Broad BrGamma was detected in nearly
half of the optically classified Seyfert 2 galaxies, including two objects with
no evidence for hidden polarized Broad Line Region. Nuclear [FeII] emission is
generally blueshifted which together with high BrGamma/[FeII] ratios suggests
shocks as the dominant excitation mechanism in Seyfert galaxies. Bright coronal
emission lines [SiVI] and [SiVII] are common in Seyferts, as they are detected
in ~60 % of the galaxies. In three galaxies the coronal lines are extended only
in the direction parallel to the cone. This could be explained by shock
excitation due to the jet or superwind interacting with the interstellar
medium.
","[{""version"":""v1"",""created"":""Wed, 7 May 2003 10:14:42 GMT""}]","2009-11-07"
"astro-ph/0305101","Marieke Postma","Marieke Postma","Constraining the curvaton scenario","6 pages, 2 figures. Talk presented at the XXXVIIIth Rencontres de
  Moriond on ElectroWeak Interactions and Unified Theories, Les Arcs, France,
  March 15th-22nd 2003",,,,"astro-ph",,"  We analyse the curvaton scenario in the context of supersymmetry.
Supersymmetric theories contain many scalars, and therefore many curvaton
candidates. To obtain a scale invariant perturbation spectrum, the curvaton
mass should be small during inflation $m \ll H$. This can be achieved by
invoking symmetries, which suppress the soft masses and non-renormalizable
terms in the potential. Other model-independent constraints on the curvaton
model come from nucleosynthesis, gravitino overproduction, and thermal damping.
The curvaton can work for masses $m \gtrsim 10^4 \GeV$, and very small
couplings (e.g. $h \lesssim 10^{-6}$ for $m \lesssim 10^8 \GeV$).
","[{""version"":""v1"",""created"":""Wed, 7 May 2003 12:29:01 GMT""},{""version"":""v2"",""created"":""Mon, 12 May 2003 15:11:34 GMT""}]","2007-05-23"
"astro-ph/0305102","Marco Castellani","Giuseppe Bono (INAF - Rome Astronomical Observatory)","RR Lyrae Distance Scale: Theory and Observations","(Invited Review, 21 pages, 7 figures) To be published in ""Stellar
  Candles"", ed. W. Gieren & D. Alloin, Lecture Notes in Physics","Lect.Notes Phys. 635 (2003) 85-104","10.1007/978-3-540-39882-0_5",,"astro-ph",,"  The RR Lyrae distance scale is reviewed. In particular, we discuss
theoretical and empirical methods currently adopted in the literature.
Moreover, we also outline pros and cons of optical and near-infrared mean
magnitudes to overcome some of the problems currently affecting RR Lyrae
distances. The importance of the K-band Period-Luminosity-Metallicity (PLZ_K)
relation for RR Lyrae is also discussed, together with the absolute calibration
of the zero-point. We also mention some preliminary results based on NIR (J,K)
time series data of the LMC cluster Reticulum. This cluster hosts a sizable
sample of RR Lyrae and its distance is found to be 18.45 +/- 0.04 mag using the
predicted PLZ_K relation and 18.51 +/- 0.06 using the PLZ_J relation. We
briefly discuss the evolutionary status of Anomalous Cepheids and their
possible use as distance indicators. Finally, we point out some possible
improvements to improve the intrinsic accuracy of theory and observations.
","[{""version"":""v1"",""created"":""Wed, 7 May 2003 13:07:15 GMT""}]","2015-06-24"
"astro-ph/0305103","Kurt van der Heyden","K. J. van der Heyden, J. A. M. Bleeker, J. S. Kaastra, J. Vink","High resolution spectroscopy and emission line imaging of DEM L 71 with
  XMM-Newton","8 pages, 8 figures, 2 tables, accepted by A&A","Astron.Astrophys. 406 (2003) 141-148","10.1051/0004-6361:20030658",,"astro-ph",,"  The X-ray emission from the supernova remnant DEM L 71 is measured and
analysed using the high-resolution cameras and spectrometers on board
XMM-Newton. The spectrum from the outer shell is reproduced very well by two
plasma components of kT = 0.3 and 0.8 keV. The abundance value from this shell
is consistent with the average LMC values. More extreme temperature variations
are possibly indicated by spatial variations in the O VII forbidden/resonance
line ratio, which could imply that in some regions the plasma is cooling
dramatically and recombining. However, an alternative and equally interesting
possibility is that the variation in forbidden/resonance ratios is due to
resonant scattering, which would reduce resonance line emission along lines of
sight with a high O VII column density. The inner region is hotter (kT = 1.1
keV) and shows enhanced Fe and Si abundances. We estimate the Fe and Si ejecta
mass to be 0.7-1.1 M_sun and 0.1--0.15 M_sun, respectively. The morphology,
mass estimates and abundances strongly suggest that DEM L 71 is the result of a
type Ia explosion, as indicated by previous measurements.
","[{""version"":""v1"",""created"":""Wed, 7 May 2003 13:44:45 GMT""}]","2009-11-07"
"astro-ph/0305104","Christian Kaiser","Christian R. Kaiser (University of Southampton)","Hot and cold bubbles in M87","Accepted for publication by MNRAS, 8 pages, 6 postscript figures","Mon.Not.Roy.Astron.Soc. 343 (2003) 1319","10.1046/j.1365-8711.2003.06774.x",,"astro-ph",,"  The X-ray data obtained with XMM-Newton is used to investigate the complex
structure of the gas in the atmosphere of the Virgo cluster around M87. We
construct a simple model for the temperature and density distribution. This
model implies that the cumulative mass of the cluster gas is a power-law of its
entropy index, $kT n^{-2/3}$, similar to the Hydra cluster. This supports the
idea that such power-laws are a direct consequence of gas cooling in a
gravitational potential. In the cluster atmosphere hot bubbles of gas injected
by the AGN are rising buoyantly. We estimate the age of these structures from
the synchrotron radio data and find that this `radiative age' is consistent
with the estimated dynamical timescale. However, this requires a spatial
separation of the relativistic particles from the magnetic field. The age
estimates suggest an activity cycle of the AGN in M87 of roughly $10^8$ years.
We show that the largest radio structures are consistent with being the
remnants of buoyant bubbles injected by the AGN during an even earlier activity
cycle. The wakes behind the currently rising hot bubbles uplift cold gas from
the cluster centre. Using a simple model for the trajectory of the cold gas, we
demonstrate that the observations by XMM-Newton of a mix of hot and cold gas in
the cluster atmosphere in the vicinity of the radio structure can be explained
in this scenario. This may also explain the ridges of enhanced X-ray emission
from cold gas observed with CHANDRA.
","[{""version"":""v1"",""created"":""Wed, 7 May 2003 13:45:52 GMT""}]","2009-11-07"
"astro-ph/0305105","Laura Magrini","L. Magrini (1), R.L.M. Corradi (2), R. Greimel (2), P. Leisy (2,3),
  D.J. Lennon (2), A. Mampaso (3), M. Perinotto (1), D.L. Pollacco (4), J.R.
  Walsh (5), N.A. Walton (6) and A.A. Zijlstra (7) ((1)Dipartimento di
  Astronomia e Scienza dello Spazio, Universita' di Firenze, Italy (2)Isaac
  Newton Group of Telescopes, Santa Cruz de La Palma, Canarias, Spain
  (3)Instituto de Astrofisica de Canarias, Tenerife, Canarias, Spain (4)School
  of Pure and Applied Physics, Queen's University Belfast, Northern Ireland, UK
  (5)ST-ECF, E.S.O., Garching, Germany (6)Institute of Astronomy, University of
  Cambridge, UK (7)Physics Department, UMIST, UK)","The Local Group Census: planetary nebulae in IC 10, Leo A and Sextans A","10 pages, 4 figures, A&A accepted","Astron.Astrophys. 407 (2003) 51-60","10.1051/0004-6361:20030732",,"astro-ph",,"  In the framework of our narrow-band survey of the Local Group galaxies, we
present the results of the search for planetary nebulae (PNe) in the dwarf
irregular galaxies IC10, LeoA and SextansA. Using the standard on-band/off-band
technique, sixteen new candidate PNe have been discovered in the closest
starburst galaxy, IC10. The optical size of this galaxy is estimated to be much
larger than previously thought, considering the location of the new PNe in an
area of 3.6 kpc X 2.7 kpc. We also confirm the results of previous studies for
the other two dwarf irregular galaxies, with the detection of one candidate PN
in LeoA and another one in SextansA. We review the number of planetary nebulae
discovered in the Local Group to date and their behaviour with metallicity. We
suggest a possible fall in the observed number of PNe when [Fe/H]$<<$-1.0,
which might indicate that below this point the formation rate of PNe is much
lower than for stellar populations of near Solar abundances. We also find
non-negligible metallicity effects on the [OIII] luminosity of the brightest PN
of a galaxy.
","[{""version"":""v1"",""created"":""Wed, 7 May 2003 14:19:54 GMT""}]","2009-11-07"
"astro-ph/0305106","Arne Rau","A. Rau, J. Greiner, M. L. McCollough","The 590 days long term periodicity of the microquasar GRS 1915+105","6 pages, 4 figuers, accepted for publication as ApJ Letter","Astrophys.J. 590 (2003) L37-L40","10.1086/376683",,"astro-ph",,"  We report on the discovery of a 590 days long term periodicity in the hard
X-ray component of the microquasar \grs found from a comprehensive study of
more than four years of {\it RXTE} observations. The periodicity is also
observed in the hard X-ray flux observed by BATSE, and in the radio flux as
seen with the {\it Green Bank Interferometer} and the {\it Ryle Telescope}. We
discuss various possible explanations, including the precession of a radiation
induced warped accretion disk.
","[{""version"":""v1"",""created"":""Wed, 7 May 2003 14:58:29 GMT""}]","2009-11-07"
"astro-ph/0305107","Lorenzo Monaco","L. Monaco (1,2), F. R. Ferraro (2), M. Bellazzini (1), E. Pancino
  (1)((1) INAF-Osservatorio Astronomico Bologna,(2) Dipartimento di Astronomia,
  Universit\`a di Bologna)","Building up the Galactic Halo: The Sagittarius dSph and the globular
  cluster M22","4 pages, 4 figures. LaTeX. To be published in the proceedings of the
  IV National Workshop on Stellar Astrophysics ""Stars in Galaxies"", A. Buzzoni,
  S. Cassisi and M. Bellazzini Eds., Memorie della Societ\`a Astronomica
  Italiana (Mem.S.A.It.)",,,,"astro-ph",,"  The Sagittarius dwarf spheroidal (Sgr) and a few paculiar Galactic Globular
Clusters (GGC) can be considered as building blocks of theGalactic Halo. We
present a series of results based on a wide field photometry of the Sgr system
and the GGC M22. In particular for Sgr we present: (1) the detection of the
RGB-bump, a feature that together with the shape of the RGB can be used to
constrain the allowed range of age and metallicity and (2) the detection of a
clear blue horizontal branch which probes the existance of a metal poor
population. In the case of M22 we present clear evidence that differential
reddening is the primary cause for the observed spread of the evolutionary
sequences.
","[{""version"":""v1"",""created"":""Wed, 7 May 2003 14:59:42 GMT""}]","2007-05-23"
"cond-mat/0305116","Philip W. Adams","D.P. Young, R.G. Goodrich, J.F. DiTusa, S. Guo, J. Chan, D. Hall, and
  P.W. Adams","High Magnetic Field Sensor Using LaSb2","In press, APL",,"10.1063/1.1577390",,"cond-mat.mtrl-sci cond-mat.str-el",,"  The magnetotransport properties of single crystals of the highly anisotropic
layered metal LaSb2 are reported in magnetic fields up to 45 T with fields
oriented both parallel and perpendicular to the layers. Below 10 K the
perpendicular magnetoresistance of LaSb2} becomes temperature independent and
is characterized by a 100-fold linear increase in resistance between 0 and 45 T
with no evidence of quantum oscillations down to 50 mK. The Hall resistivity is
hole-like and gives a high field carrier density of n ~ 3x10^20 cm^-3. The
feasibility of using LaSb2 for magnetic field sensors is discussed.
","[{""version"":""v1"",""created"":""Tue, 6 May 2003 16:14:25 GMT""}]","2009-11-10"
"cond-mat/0305117","Philip W. Adams","D.P. Young, M. Moldovan, D.D. Craig, J.Y. Chan and P.W. Adams","Superconducting Properties of MgCNi3 Films","submitted to PRB",,"10.1103/PhysRevB.68.020501",,"cond-mat.supr-con cond-mat.str-el",,"  We report the magnetotransport properties of thin polycrystalline films of
the recently discovered non-oxide perovskite superconductor MgCNi3. CNi3
precursor films were deposited onto sapphire substrates and subsequently
exposed to Mg vapor at 700 C. We report transition temperatures (Tc) and
critical field values (Hc2) of MgCNi3 films ranging in thickness from 7.5 nm to
100 nm. Films thicker than ~40 nm have a Tc ~ 8 K, and an upper critical field
Hc2 ~ 14 T, which are both comparable to that of polycrystalline powders. Hall
measurements in the normal state give a carrier density, n =-4.2 x 10^22 cm^-3,
that is approximately 4 times that reported for bulk samples.
","[{""version"":""v1"",""created"":""Tue, 6 May 2003 16:28:35 GMT""}]","2009-11-10"
"cond-mat/0305118","Jian-Ming Tang","Jian-Ming Tang and Michael E. Flatte'","Multiband tight-binding model of local magnetism in GaMnAs","5 pages, 4 figures","Phys. Rev. Lett. 92, 047201 (2004)","10.1103/PhysRevLett.92.047201",,"cond-mat.mtrl-sci",,"  We present the spin and orbitally resolved local density of states (LDOS) for
a single Mn impurity and for two nearby Mn impurities in GaAs. The GaAs host is
described by a sp^3 tight-binding Hamiltonian, and the Mn impurity is described
by a local p-d hybridization and on-site potential. Local spin-polarized
resonances within the valence bands significantly enhance the LDOS near the
band edge. For two nearby parallel Mn moments the acceptor states hybridize and
split in energy. Thus scanning tunneling spectroscopy can directly measure the
Mn-Mn interaction as a function of distance.
","[{""version"":""v1"",""created"":""Tue, 6 May 2003 18:59:39 GMT""},{""version"":""v2"",""created"":""Thu, 6 Nov 2003 02:42:24 GMT""},{""version"":""v3"",""created"":""Tue, 27 Jan 2004 17:03:09 GMT""}]","2007-05-23"
"cond-mat/0305119","Franz J. Giessibl","Franz J. Giessibl","Advances in atomic force microscopy","In press (Reviews of Modern Physics, scheduled for July 2003), 86
  pages, 44 figures","Reviews of Modern Physics 75 (3), 949-983 2003","10.1103/RevModPhys.75.949",,"cond-mat.mtrl-sci",,"  This article reviews the progress of atomic force microscopy (AFM) in
ultra-high vacuum, starting with its invention and covering most of the recent
developments. Today, dynamic force microscopy allows to image surfaces of
conductors \emph{and} insulators in vacuum with atomic resolution. The mostly
used technique for atomic resolution AFM in vacuum is frequency modulation AFM
(FM-AFM). This technique, as well as other dynamic AFM methods, are explained
in detail in this article. In the last few years many groups have expanded the
empirical knowledge and deepened the theoretical understanding of FM-AFM.
Consequently, the spatial resolution and ease of use have been increased
dramatically. Vacuum AFM opens up new classes of experiments, ranging from
imaging of insulators with true atomic resolution to the measurement of forces
between individual atoms.
","[{""version"":""v1"",""created"":""Tue, 6 May 2003 20:57:19 GMT""}]","2009-11-10"
"cond-mat/0305120","Stefan Ludwig","S. Ludwig, D. D. Osheroff","Field-induced structural aging in glasses at ultra low temperatures","4 pages, 4 figures, accepted at PRL, corrected typos in version 2",,"10.1103/PhysRevLett.91.105501",,"cond-mat.dis-nn",,"  In non-equilibrium experiments on the glasses Mylar and BK7, we measured the
excess dielectric response after the temporary application of a strong electric
bias field at mK--temperatures. A model recently developed describes the
observed long time decays qualitatively for Mylar [PRL 90, 105501, S. Ludwig,
P. Nalbach, D. Rosenberg, D. Osheroff], but fails for BK7. In contrast, our
results on both samples can be described by including an additional mechanism
to the mentioned model with temperature independent decay times of the excess
dielectric response. As the origin of this novel process beyond the ""tunneling
model"" we suggest bias field induced structural rearrangements of ""tunneling
states"" that decay by quantum mechanical tunneling.
","[{""version"":""v1"",""created"":""Tue, 6 May 2003 23:12:04 GMT""},{""version"":""v2"",""created"":""Fri, 18 Jul 2003 01:19:18 GMT""}]","2009-11-10"
"cond-mat/0305121","Claudio Chamon","Claudio Chamon, Masaki Oshikawa, Ian Affleck","Junctions of three quantum wires and the dissipative Hofstadter model","4 pages, 1 figure","Phys.Rev.Lett. 91 (2003) 206403","10.1103/PhysRevLett.91.206403",,"cond-mat.str-el cond-mat.mes-hall hep-th",,"  We study a junction of three quantum wires enclosing a magnetic flux. This is
the simplest problem of a quantum junction between Tomonaga-Luttinger liquids
in which Fermi statistics enter in a non-trivial way. We present a direct
connection between this problem and the dissipative Hofstadter problem, or
quantum Brownian motion in two dimensions in a periodic potential and an
external magnetic field, which in turn is connected to open string theory in a
background electromagnetic field. We find non-trivial fixed points
corresponding to a chiral conductance tensor leading to an asymmetric flow of
the current.
","[{""version"":""v1"",""created"":""Wed, 7 May 2003 04:53:38 GMT""}]","2009-11-10"
"cond-mat/0305122","Ruslan Sokolovskii","R. O. Sokolovskii, M. E. Cates, and T. G. Sokolovska","Model fluid in a porous medium: results for a Bethe lattice","13 pages, 12 figures",,"10.1103/PhysRevE.68.026124",,"cond-mat.soft cond-mat.dis-nn",,"  We consider a lattice gas with quenched impurities or `quenched-annealed
binary mixture' on the Bethe lattice. The quenched part represents a porous
matrix in which the (annealed) lattice gas resides. This model features the 3
main factors of fluids in random porous media: wetting, randomness and
confinement. The recursive character of the Bethe lattice enables an exact
treatment, whose key ingredient is an integral equation yielding the
one-particle effective field distribution. Our analysis shows that this
distribution consists of two essentially different parts. The first one is a
continuous spectrum and corresponds to the macroscopic volume accessible to the
fluid, the second is discrete and comes from finite closed cavities in the
porous medium. Those closed cavities are in equilibrium with the bulk fluid
within the grand canonical ensemble we use, but are inaccessible in real
experimental situations. Fortunately, we are able to isolate their
contributions. Separation of the discrete spectrum facilitates also the
numerical solution of the main equation. The numerical calculations show that
the continuous spectrum becomes more and more rough as the temperature
decreases, and this limits the accuracy of the solution at low temperatures.
","[{""version"":""v1"",""created"":""Wed, 7 May 2003 02:17:57 GMT""}]","2009-11-10"
"cond-mat/0305123","Vladimir V. Khovailo","T. Takagi, V. Khovailo, T. Nagatomo, M. Matsumoto, M. Ohtsuka, T. Abe
  and H. Miki","Two-way shape memory effect and mechanical properties of Pulse Discharge
  Sintered Ni2.18Mn0.82Ga","4 pages, 5 figures, REVTEX-4","International Journal of Applied Electromagnetics and Mechanics,
  16 (2002), p.173",,,"cond-mat.mtrl-sci",,"  Mechanical and shape memory properties of a polycrystalline Ni2.18Mn0.82Ga
alloy prepared by a PDS (Pulse Discharge Sintering) method were investigated.
It was found that the material demonstrates the two-way shape memory effect
after a loading - unloading cycle performed in the martensitic state, i. e.
essentially without special training. The samples exhibiting the two-way shape
memory effect show a significant enhancement in the magnitude of
magnetic-field-induced strain.
","[{""version"":""v1"",""created"":""Wed, 7 May 2003 05:20:56 GMT""}]","2007-05-23"
"cond-mat/0305124","Laurens Molenkamp","A. Slobodskyy, C. Gould, T. Slobodskyy, C.R. Becker, G. Schmidt, and
  L.W. Molenkamp","Voltage-Controlled Spin Selection in a Magnetic Resonant Tunnelling
  Diode","To be published in Phys. Rev. Lett",,"10.1103/PhysRevLett.90.246601",,"cond-mat.mes-hall cond-mat.mtrl-sci",,"  We have fabricated all II-VI semiconductor resonant tunneling diodes based on
the (Zn,Mn,Be)Se material system, containing dilute magnetic material in the
quantum well, and studied their current-voltage characteristics. When subjected
to an external magnetic field the resulting spin splitting of the levels in the
quantum well leads to a splitting of the transmission resonance into two
separate peaks. This is interpreted as evidence of tunneling transport through
spin polarized levels, and could be the first step towards a voltage controlled
spin filter.
","[{""version"":""v1"",""created"":""Wed, 7 May 2003 07:50:47 GMT""}]","2009-11-10"
"cond-mat/0305125","Dietrich Stauffer","Johannes Bonnekoh","Monte Carlo simulations of the Ising and the Sznajd model on growing
  Barabasi - Albert networks","6 pages including 3 figures, for IJMPC",,"10.1142/S0129183103005364",,"cond-mat.stat-mech",,"  The Ising model shows on growing Barabasi - Albert networks the same
ferromagnetic behavior as on static Barabasi - Albert networks. Sznajd models
on growing Barabasi - Albert networks show an hysteresis like behavior. Nearly
a full consensus builds up and the winning opinion depends on history. On slow
growing Barabasi - Albert networks a full consensus builds up. At five opinions
in the Sznajd model with limited persuasion on growing Barabasi - Albert
networks, all odd opinions win and all even opinions loose supporters.
","[{""version"":""v1"",""created"":""Wed, 7 May 2003 07:57:43 GMT""}]","2009-11-10"
"cond-mat/0305126","Stephane Dorbolo","S. Dorbolo and N. Vandewalle","Antibubbles: evidences of a critical pressure","4 pages, 8 figures",,,,"cond-mat.soft cond-mat.stat-mech",,"  We present experimental investigations of antibubbles. Such an unusual fluid
object is a thin spherical air shell surrounding a liquid globule. We explain
how to produce them and we study their stability. By overweighting antibubbles
with a small amount of salt, they sink and pop at a definite depth. A critical
depth related to a critical pressure has been found. A modified Laplace law
describes the air shell thickness evolution with respect to pressure. This law
combined with surfactant layers interaction allows to explain the critical
depth for antibubble stability.
","[{""version"":""v1"",""created"":""Wed, 7 May 2003 08:22:58 GMT""}]","2007-05-23"
"cond-mat/0305127","Mun Dae Kim","Mun Dae Kim and Jongbae Hong","Coupling of Josephson current qubits using a connecting loop","5 pages with updates, version to appear in Phys. Rev. B","Phys. Rev. B 70, 184525 (2004)","10.1103/PhysRevB.70.184525",,"cond-mat.mes-hall cond-mat.supr-con",,"  We propose a coupling scheme for the three-Josephson junction qubits which
uses a connecting loop, but not mutual inductance. Present scheme offers the
advantages of a large and tunable level splitting in implementing the
controlled-NOT (CNOT) operation. We calculate the switching probabilities of
the coupled qubits in the CNOT operations and demonstrate that present CNOT
gate can meet the criteria for the fault-tolerant quantum computing. We obtain
the coupling strength as a function of the coupling energy of the Josephson
junction and the length of the connecting loop which varies with selecting two
qubits from the scalable design.
","[{""version"":""v1"",""created"":""Wed, 7 May 2003 08:34:14 GMT""},{""version"":""v2"",""created"":""Mon, 17 Nov 2003 06:35:53 GMT""},{""version"":""v3"",""created"":""Fri, 24 Sep 2004 06:29:02 GMT""}]","2009-11-10"
"cond-mat/0305128","Antonio Siber","Antonio Siber","Quantum virial expansion approach to thermodynamics of $^4$He adsorbates
  in carbon nanotube materials: Interacting Bose gas in one dimension","5 PS figures","Phys. Rev. B 67, 165426 (2003)","10.1103/PhysRevB.67.165426",,"cond-mat.stat-mech cond-mat.mtrl-sci cond-mat.soft",,"  I demonstrate that $^4$He adsorbates in carbon nanotube materials can be
treated as one-dimensional interacting gas of spinless bosons for temperatures
below 8 K and for coverages such that all the adsorbates are in the groove
positions of the carbon nanotube bundles. The effects of adsorbate-adsorbate
interactions are studied within the scheme of virial expansion approach. The
theoretical predictions for the specific heat of the interacting adsorbed gas
are given.
","[{""version"":""v1"",""created"":""Wed, 7 May 2003 08:56:51 GMT""}]","2009-11-10"
