"cond-mat/0305129","A. F. Morozov","L.S.Metlov","Evolution of Metal Structure at Intense Plastic Strains: Molecular
  Dynamics Simulation","10 pages, 5 figures, RevTEX4",,,,"cond-mat.mtrl-sci",,"  The kinetics of dislocations is studied with computer simulation at loadings
of different intensity. It is established that the dislocations have a few
different structural states. The dislocations ""with the micropore"" play
important role in the formation of large curved boundaries, and, as a
consequence, in the formation of fine grains. Alternation of elastic and
inelastic strain stages is established too. At shear loading, in view of
special kinetics, the system would have to accumulate the whole set of
dislocations leading to the formation of new boundaries and fine grains.
","[{""version"":""v1"",""created"":""Wed, 7 May 2003 10:32:13 GMT""}]","2007-05-23"
"cond-mat/0305130","Jorge Berger","Jorge Berger","Noise rectification by a superconducting loop with two weak links","version accepted by PRB","Phys. Rev. B 70, 024524 (2004)","10.1103/PhysRevB.70.024524",,"cond-mat.supr-con cond-mat.stat-mech",,"  We consider a superconducting loop with two weak links that encloses a
magnetic flux. The weak links are unequal and are treated as Josephson
junctions with non-sinusoidal phase dependence. We devise a model that takes
into account the fluctuation of the critical currents, due to the fluctuations
of the order parameter in the weak links. These fluctuations are important near
the onset of superconductivity; in this regime they may significantly weaken
and eventually disconnect the superconducting loop. As a consequence of these
fluctuations and of the resistive noise in the junctions, the average dc
voltage does not vanish. Our model can be easily extended to provide a
qualitative description of a recent experiment.
","[{""version"":""v1"",""created"":""Wed, 7 May 2003 10:36:59 GMT""},{""version"":""v2"",""created"":""Thu, 7 Aug 2003 06:29:31 GMT""},{""version"":""v3"",""created"":""Wed, 26 Nov 2003 13:35:59 GMT""},{""version"":""v4"",""created"":""Wed, 14 Jul 2004 13:55:45 GMT""}]","2007-05-23"
"cond-mat/0305131","H. W. Diehl","H. W. Diehl and M. Shpot","Comment on ``Renormalization-group picture of the Lifshitz critical
  behavior''","A comment on M. Leite, Phys Rev B 67, 104415 (2003) revtex4, 2 pages","Phys.Rev. BD68 (2003) 066401; Phys.Rev. B67 (2003) 104415","10.1103/PhysRevB.68.066401",,"cond-mat.stat-mech cond-mat.soft hep-th",,"  We show that the recent renormalization-group analysis of Lifshitz critical
behavior presented by Leite [Phys. Rev. B {\bf 67}, 104415 (2003)] suffers from
a number of severe deficiencies. In particular, we show that his approach does
not give an ultraviolet finite renormalized theory, is plagued by
inconsistencies, misses the existence of a nontrivial anisotropy exponent
$\theta\ne 1/2$, and therefore yields incorrect hyperscaling relations. His
$\epsilon$-expansion results to order $\epsilon^2$ for the critical exponents
of $m$-axial Lifshitz points are incorrect both in the anisotropic ($0<m<d$)
and the isotropic cases ($m=d$). The inherent inconsistencies and the lack of a
sound basis of the approach makes its results unacceptable even if they are
interpreted in the sense of approximations.
","[{""version"":""v1"",""created"":""Wed, 7 May 2003 12:05:10 GMT""}]","2007-05-23"
"cond-mat/0305132","Zoran Konkoli","Zoran Konkoli","Application of the Bogolyubov's theory of weakly non-ideal Bose gas on
  the A+A, A+B, B+B reaction-diffusion system","20 pages, 3 figures, REVTEX",,"10.1103/PhysRevE.69.011106",,"cond-mat.stat-mech cond-mat.soft",,"  Theoretical methods for dealing with diffusion-controlled reactions
inevitably rely on some kind of approximation and to find the one that works on
a particular problem is not always easy. In here the approximation used by
Bogolyubov to study weakly non-ideal Bose gas, to be refereed to as weakly
non-ideal Bose gas approximation (WBGA), is applied in the analysis of of the
three reaction-diffusion models (i) A+A->0, (ii) A+B->0 and (iii)
A+A,B+B,A+B->0 (the ABBA model). The two types of WBGA are considered, the
simpler WBGA-I and more complicated WBGA-II. All models are defined on the
lattice to facilitate comparison with computer experiment (simulation). It is
found that the WBGA describes A+B reaction well, it reproduces correct d/4
density decay exponent. However, it fails in the case of the A+A reaction and
the ABBA model. (To cure deficiency of WBGA in dealing with A+A model the
hybrid of WBGA and Kirkwood superposition approximation is suggested.) It is
shown that the WBGA-I is identical to the dressed tree calculation suggested by
Lee in J. Phys. A 27, 2633 (1994), and that the dressed tree calculation does
not lead to the d/2 density decay exponent when applied to the A+A reaction, as
normally believed, but it predicts d/4 decay exponent. Last, the usage of the
small n_0 approximation suggested by Mattis and Glasser in Rev. Mod. Phys. 70,
979 (1998) is questioned if used beyond A+B reaction-diffusion model.
","[{""version"":""v1"",""created"":""Wed, 7 May 2003 12:27:08 GMT""}]","2009-11-10"
"cond-mat/0305133","Gyorgy Szabo","Gyorgy Szabo, Attila Szolnoki and Rudolf Izsak","Rock-scissors-paper game on regular small-world networks","6 pages, 6 figures","J. Phys. A : Math. Gen. vol. 37 (2004) p. 2599-2609","10.1088/0305-4470/37/7/006",,"cond-mat.stat-mech",,"  The spatial rock-scissors-paper game (or cyclic Lotka-Volterra system) is
extended to study how the spatiotemporal patterns are affected by the
constructed backgrounds providing uniform number of neighbors (degree) at each
site. On the square lattice this system exhibits a self-organizing pattern with
equal concentration of the competing strategies (species). If the quenched
background is constructed by substituting random links for the nearest neighbor
bonds of a square lattice then a limit cycle occurs when the portion of random
links exceeds a threshold value. This transition can also be observed if the
standard link is replaced temporarily by a random one with a probability $P$ at
each step of iteration. Above a second threshold value of $P$ the amplitude of
global oscillation increases with time and finally the system reaches one of
the homogeneous (absorbing) states. In this case the results of Monte Carlo
simulations are compared with the predictions of the dynamical cluster
technique evaluating all the configuration probabilities on one-, two-, four-,
and six-site clusters.
","[{""version"":""v1"",""created"":""Wed, 7 May 2003 13:20:58 GMT""},{""version"":""v2"",""created"":""Tue, 20 Jan 2004 13:32:15 GMT""}]","2009-11-10"
"cond-mat/0305135","Evandro V. L. de Mello","J.L. Gonz\'alez and E.V.L. de Mello","Theory of the Diamagnetism Above the Critical Temperature for Cuprates","published version","Phys. Rev. B69, 134510 (2004)","10.1103/PhysRevB.69.134510",,"cond-mat.supr-con",,"  Recently experiments on high critical temperature superconductors has shown
that the doping levels and the superconducting gap are usually not uniform
properties but strongly dependent on their positions inside a given sample.
Local superconducting regions develop at the pseudogap temperature ($T^*$) and
upon cooling, grow continuously. As one of the consequences a large diamagnetic
signal above the critical temperature ($T_c$) has been measured by different
groups. Here we apply a critical-state model for the magnetic response to the
local superconducting domains between $T^*$ and $T_c$ and show that the
resulting diamagnetic signal is in agreement with the experimental results.
","[{""version"":""v1"",""created"":""Wed, 7 May 2003 13:26:59 GMT""},{""version"":""v2"",""created"":""Mon, 19 Apr 2004 17:15:27 GMT""}]","2009-11-10"
"cond-mat/0305136","Matthias Paessens","A. Rakos, M. Paessens, G.M. Schuetz","Hysteresis in one-dimensional reaction-diffusion systems","4 Pages, 5 figures","Phys. Rev. Lett. 91, 238302 (2003)","10.1103/PhysRevLett.91.238302",,"cond-mat.stat-mech",,"  We introduce a simple nonequilibrium model for a driven diffusive system with
nonconservative reaction kinetics which exhibits ergodicity breaking and
hysteresis in one dimension. These phenomena can be understood through a
description of the dominant stochastic many-body dynamics in terms of an
equilibrium single-particle problem, viz. the random motion of a shock in an
effective potential. This picture also leads to the exact phase diagram of the
system and suggests a new generic mechanism for ""freezing by heating"".
","[{""version"":""v1"",""created"":""Wed, 7 May 2003 13:42:54 GMT""}]","2009-11-10"
"cond-mat/0305137","Vladimir A. Baulin","Vladimir A. Baulin","Self-assembled aggregates in the gravitational field: growth and nematic
  order",,"J. Chem. Phys., 119(5), 2874-2885 (2003)","10.1063/1.1587123",,"cond-mat.soft physics.bio-ph physics.space-ph",,"  The influence of the gravitational field on the reversible process of
assembly and disassembly of linear aggregates is focus of this paper. Even the
earth gravitational field can affect the equilibrium properties of heavy
biological aggregates such as microtubules or actin filaments. The gravity
gives rise to the concentration gradient which results in the distribution of
aggregates of different lengths with height. Strong enough gravitational field
induces the overall growth of the aggregates. The gravitational field
facilitates the isotropic to nematic phase transition reflecting in a broader
transition region. Coexisting phases have notedly different length
distributions and the phase transition represent the interplay between the
growth in the isotropic phase and the precipitation into nematic phase. The
fields in an ultracentrifuge can only reinforce the effect of gravity, so the
present description can be applied to a wider range of systems.
","[{""version"":""v1"",""created"":""Wed, 7 May 2003 15:04:23 GMT""},{""version"":""v2"",""created"":""Tue, 9 Sep 2003 13:24:27 GMT""}]","2007-05-23"
"cond-mat/0305139","Volodymyr Turkowski","V. Turkowski, V.R. Vieira and P.D. Sacramento","Non-equilibrium properties of the S=1/2 Heisenberg model in a
  time-dependent magnetic field","To be published in Physica A",,"10.1016/S0378-4371(03)00478-3",,"cond-mat.stat-mech",,"  The time-dependent behavior of the Heisenberg model in contact with a phonon
heat bath and in an external time-dependent magnetic field is studied by means
of a path integral approach. The action of the phonon heat bath is taken into
account up to the second order in the coupling to the heath bath. It is shown
that there is a minimal value of the magnetic field below which the average
magnetization of the system does not relax to equilibrium when the external
magnetic field is flipped. This result is in qualitative agreement with the
mean field results obtained within $\phi^{4}$-theory.
","[{""version"":""v1"",""created"":""Wed, 7 May 2003 15:51:19 GMT""}]","2009-11-10"
"cond-mat/0305140","Thomas Devereaux","T. P. Devereaux, G. E. D. McCormack, & J. K. Freericks","Inelastic x-ray scattering as a probe of electronic correlations","11 pages, 10 figures","Phys. Rev. B 68, 075105 (2003)","10.1103/PhysRevB.68.075105",,"cond-mat.str-el cond-mat.mtrl-sci",,"  We construct an exact dynamical mean field theory for nonresonant inelastic
light scattering in the infinite-dimensional Falicov-Kimball model, which can
be tuned through a quantum critical metal-insulator transition. Due to the
projection of the polarization orientations onto different regions of the
Brillouin zone and due to the transfer of energy and momentum from the light to
the strongly correlated charge excitations, the nature of the dynamics can be
naturally interpreted as strongly temperature-dependent low-energy
particle-hole excitations and weakly temperature-dependent high-energy charge
transfer excitations which depend delicately on the electronic correlations.
These results can be used to give important information concerning the
evolution of charge dynamics in different regions of the Brillouin zone.
","[{""version"":""v1"",""created"":""Wed, 7 May 2003 15:56:35 GMT""}]","2009-11-10"
"gr-qc/0305027","Mark A. Scheel","Mark A. Scheel (1), Adrienne L. Erickcek (2), Lior M. Burko (3),
  Lawrence E. Kidder (4), Harald P. Pfeiffer (4), and Saul A. Teukolsky (4)
  ((1) California Institute of Technology, (2) Princeton University, (3)
  University of Utah, (4) Cornell University)","3D simulations of linearized scalar fields in Kerr spacetime","12 pages, 9 figures, revtex4. Major revision: added figures, added
  subsection on convergence, clarified discussion. To appear in Phys Rev D","Phys.Rev. D69 (2004) 104006","10.1103/PhysRevD.69.104006",,"gr-qc",,"  We investigate the behavior of a dynamical scalar field on a fixed Kerr
background in Kerr-Schild coordinates using a 3+1 dimensional spectral
evolution code, and we measure the power-law tail decay that occurs at late
times. We compare evolutions of initial data proportional to f(r)
Y_lm(theta,phi) where Y_lm is a spherical harmonic and (r,theta,phi) are
Kerr-Schild coordinates, to that of initial data proportional to f(r_BL)
Y_lm(theta_BL,phi), where (r_BL,theta_BL) are Boyer-Lindquist coordinates. We
find that although these two cases are initially almost identical, the
evolution can be quite different at intermediate times; however, at late times
the power-law decay rates are equal.
","[{""version"":""v1"",""created"":""Tue, 6 May 2003 23:43:55 GMT""},{""version"":""v2"",""created"":""Fri, 30 Jan 2004 20:47:41 GMT""}]","2009-11-10"
"gr-qc/0305028","Sawa Manoff","Sawa Manoff","Null vector fields in spaces with affine connections and metrics.
  Doppler's effect, Hubble's effect, and aberration's effect","33 pages, LaTeX",,,,"gr-qc",,"  The notion of null (isotropic) vector field is considered in spaces with
affine connections and metrics as models of space or space-time. On its basis
the propagation of signals in space-time is considered. The Doppler effect is
generalized for these types of spaces. The notions of standard (longitudinal)
Doppler effect and transversal Doppler effect are introduced. On their grounds,
the Hubble effect and the aberration effect appear as Doppler effects with
explicit forms of the centrifugal (centripetal) and Coriolis velocity vector
fields in spaces with affine connections and metrics. The upper limit of the
value of the general observed shift parameter z, generated by both the effects,
based on the Doppler effects, is found to be z = 1.41. Doppler's effects,
Hubble's effect, and aberration's effect could be used in mechanics of
continuous media and in other classical field theories in the same way as the
standard Doppler effect is used in classical and relativistic mechanics. PACS
numbers: 04.20.Cv; 04.50.+h; 04.40.b; 04.90.+e; 83.10.Bb
","[{""version"":""v1"",""created"":""Wed, 7 May 2003 15:54:54 GMT""}]","2007-05-23"
"hep-ex/0305008","Jerzy Kowalczynski","J.K. Kowalczynski","Can We Detect Tachyons Now?","12 pages, LaTeX 2e, no figures. The purpose of my presenting this
  paper here, long after its publication, is to call attention of a large
  community of experimenters to the facts (1) that there exists a sound
  theoretical prediction that the light barrier may be overcome in relatively
  simple experiments, (2) that the latter prediction and the theoretical
  prediction that gravitational waves exist belong to the same family, and (3)
  that massive and very expensive experiments to search for these waves are
  performed and planned","Acta Phys.Polon. B31 (2000) 523-531",,,"hep-ex astro-ph.HE nucl-ex",,"  An exact solution of the Einstein-Maxwell equations enables us to construct a
hypothesis on the production of tachyons. The hypothesis determines the
kinematical relations for the produced tachyon. It also makes possible to
estimate the empiric conditions necessary for the production. These conditions
can occur when nonpositive subatomic particles of high energy strike atomic
nuclei other than the proton. This suggests how experiments to search for
tachyons can be performed. According to the hypothesis properly designed
experiments with air showers or with the use of the strongest colliders may be
successful. Failure of the air shower experiments performed hitherto is
explained on the grounds of the hypothesis.
","[{""version"":""v1"",""created"":""Wed, 7 May 2003 11:39:44 GMT""}]","2009-10-24"
"hep-lat/0305004","Tetsuya Onogi","Hidenori Fukaya and Tetsuya Onogi (YITP, Kyoto U)","Lattice Study of the Massive Schwinger Model with $\theta$ Term under
  L\""{u}scher's ""Admissibility"" Condition","16 pages, REVTeX4, 21 figures","Phys.Rev. D68 (2003) 074503","10.1103/PhysRevD.68.074503","YITP-03-22","hep-lat",,"  L\""uscher's ``admissibility'' condition on the gauge field space plays an
essential role in constructing lattice gauge theories which has exact chiral
symmetries. We apply the gauge action proposed by L\""uscher with the
domain-wall fermion action to the numerical simulation of the massive Schwinger
model. We find this action can generate configurations in each topological
sector separately without any topology changes. By developing a new method to
sum over different topological sectors, we calculate meson masses in
nonzero-$\theta$ vacuum.
","[{""version"":""v1"",""created"":""Tue, 6 May 2003 16:44:55 GMT""},{""version"":""v2"",""created"":""Thu, 29 May 2003 01:08:44 GMT""}]","2009-11-10"
"hep-lat/0305005","Victor Laliena","V. Azcoiti, G. Di Carlo, A. Galante, V. Laliena","Theta-vacuum systems via real action simulations","14 pages, 6 figures; To appear in Phys. Lett. B","Phys.Lett. B563 (2003) 117-122","10.1016/S0370-2693(03)00601-4",,"hep-lat",,"  Inspired by the results of the Ising model within an imaginary external
magnetic field, we introduce a transformation in quantum systems with a
theta-vacuum term that amounts to a rescaling of z=cos(theta/2). Making use of
this transformation we are able to determine the order parameter as a function
of theta. The approach is successfully tested in models with both broken and
unbroken CP symmetry at theta=pi.
","[{""version"":""v1"",""created"":""Wed, 7 May 2003 11:19:21 GMT""}]","2009-11-10"
"hep-ph/0305058","Bennie F. L. Ward","B.F.L. Ward (Department of Physics, University of Tennessee,
  Knoxville, TN, USA)","Are Massive Elementary Particles Black Holes?","9 pages, 1 figure; improved text","Mod.Phys.Lett. A19 (2004) 143-150","10.1142/S0217732304012885","UTHEP-03-0301","hep-ph",,"  We use exact results in a new approach to quantum gravity to study the effect
of quantum loop corrections on the behavior of the metric of space-time near
the Schwarzschild radius of a massive point particle in the Standard Model. We
show that the classical conclusion that such a system is a black hole is
obviated. Phenomenological implications are discussed.
","[{""version"":""v1"",""created"":""Tue, 6 May 2003 18:48:41 GMT""},{""version"":""v2"",""created"":""Thu, 17 Jul 2003 19:28:06 GMT""}]","2009-11-10"
"hep-ph/0305059","Bhaskar Dutta","B. Dutta (University of Regina) and R.N. Mohapatra (University of
  Maryland)","Lepton Flavor Violation and Neutrino Mixings in a 3X2 Seesaw Model","22 pages, Revtex, 6 figures","Phys.Rev. D68 (2003) 056006","10.1103/PhysRevD.68.056006",,"hep-ph",,"  We study the predictions for BR(mu-> e+gamma) and BR(tau-> e,mu+gamma) in a
class of recently proposed horizontal SU(2) model that leads to a 3 X 2 seesaw
model for neutrino masses. We consider two such models and obtain the correct
bi-large mixing pattern for neutrinos. In these models, the effective low
energy theory below the SU(2)_H scale is the MSSM. Assuming a supersymmetry
breaking pattern as in the minimal SUGRA models, we find that consistent with
present g-2, b->s+gamma and WMAP dark matter constraints on the parameters of
the model, the BR(mu-> e+gamma) prediction is accessible to the proposed MEG
experiment at PSI making this class of models testable in the near future.
","[{""version"":""v1"",""created"":""Tue, 6 May 2003 19:37:36 GMT""}]","2009-11-10"
"hep-ph/0305060","Adam Szczepaniak","Adam P. Szczepaniak","Description of the $D^*_s(2320)$ resonance as the $D\pi$ atom","3 pages, 1 figure","Phys.Lett.B567:23-26,2003","10.1016/S0370-2693(03)00865-7",,"hep-ph",,"  We discuss the possibility that the recently reported resonance in the $D_s
\pi^0$ spectrum can be described in terms of residual $D\pi$ interactions.
","[{""version"":""v1"",""created"":""Tue, 6 May 2003 22:17:53 GMT""}]","2008-11-26"
"hep-ph/0305061","Cai-Dian Lu","C.D. Lu (IHEP, Beijing)","Prediction of Pure Annihilation Type B Decays","4 pages, latex, talk given at 38th Rencontres de Moriond on QCD and
  High-Energy Hadronic Interactions, Les Arcs, France, 22-29 Mar. 2003",,,"BIHEP-TH-2003-17","hep-ph hep-ex",,"  The rare decays $B^+ \to D_s^{+} \phi$, $B^0 \to D_s^{(*)-} K^+$ and $B^+ \to
D_s^{(*)+} \bar{K}^0$ can occur only via annihilation type diagrams in the
standard model. We calculate these decays in perturbative QCD approach. We
found that the calculated branching ratio of $B^0 \to D_s^- K^+$ agree with the
data which had been observed in the KEK and SLAC B factories. The decay $B^+
\to D_s^{(*)+} \bar K^0$ has a very small branching ratio at O ($10^{-8}$), due
to the suppression from CKM matrix elements. The branching ratio of $B^+ \to
D_s^+ \phi$ is of order $10^{-7}$ which may be measured in the near future by
KEK and SLAC B factories. The small branching ratios predicted in the standard
model make these channel sensitive to new physics contributions.
","[{""version"":""v1"",""created"":""Wed, 7 May 2003 02:24:33 GMT""}]","2007-05-23"
"hep-ph/0305062","Hiroyuki Hagura","Hirotaka Sugawara (Univ. of Hawaii), Hiroyuki Hagura (KEK) and Toshiya
  Sanami (KEK)","Destruction of Nuclear Bombs Using Ultra-High Energy Neutrino Beam","18 pages, 8 figures, LaTeX2e; Typos corrected, some Figs. modified
  and Refs. added",,,"KEK-TH-882","hep-ph hep-ex",,"  We discuss the possibility of utilizing the ultra-high energy neutrino beam
(about 1000 TeV) to detect and destroy the nuclear bombs wherever they are and
whoever possess them.
","[{""version"":""v1"",""created"":""Wed, 7 May 2003 05:03:19 GMT""},{""version"":""v2"",""created"":""Sun, 29 Jun 2003 15:41:33 GMT""}]","2007-05-23"
"hep-ph/0305063","Youichi Yamada","Francesca Borzumati, Christoph Greub, Youichi Yamada","Towards an exact evaluation of the supersymmetric O(alpha_s tan beta)
  corrections to \bar{B} -> X_s gamma","1+10 pages, Based on talks given by Y. Yamada at ``KEK Theory Meeting
  on Collider Physics'', KEK, Tsukuba, Japan, February 20-22, 2003, and ``The
  8th Accelerator and Particle Physics Institute (APPI2003)'', Appi, Iwate,
  Japan, February 25-28, 2003",,,"UAB-FT-544, YNU-HEPTh-03-101, BUTP-2003/8, TU-687","hep-ph",,"  The charged-Higgs contributions to the decay \bar{B} -> X_s gamma are
discussed in the minimal supersymmetric standard model at large tan beta. These
contributions receive two-loop O(alpha_s tan beta) corrections by squark-gluino
subloops, which are nondecoupling in the limit of heavy superpartners and
possibly large. Their leading parts are already known and were evaluated by
using an effective two-Higgs-doublet Lagrangian. Subleading corrections coming
from higher-dimension operators in the effective Lagrangian were ignored,
although this is not, a priori, justified when m_{H^\pm} is not much smaller
than the typical supersymmetric mass M_{SUSY}. Here, we calculate all
subleading terms of the O(alpha_s tan beta) corrections up to
O((m_t^2,m_{H^\pm}^2/M_{SUSY}^2)^2), as well as all the exact two-loop diagrams
with squark-gluino subloops, beyond the effective-Lagrangian approximation.
Comments are made on the size of these corrections.
","[{""version"":""v1"",""created"":""Wed, 7 May 2003 05:27:24 GMT""}]","2007-05-23"
"hep-ph/0305064","Tommy Ohlsson","Magnus Jacobson, Tommy Ohlsson","Extrinsic CPT Violation in Neutrino Oscillations in Matter","47 pages, 7 figures, RevTeX4. Final version to be published in Phys.
  Rev. D","Phys.Rev.D69:013003,2004","10.1103/PhysRevD.69.013003",,"hep-ph",,"  We investigate matter-induced (or extrinsic) CPT violation effects in
neutrino oscillations in matter. Especially, we present approximate analytical
formulas for the CPT-violating probability differences for three flavor
neutrino oscillations in matter with an arbitrary matter density profile. Note
that we assume that the CPT invariance theorem holds, which means that the CPT
violation effects arise entirely because of the presence of matter. As special
cases of matter density profiles, we consider constant and step-function matter
density profiles, which are relevant for neutrino oscillation physics in
accelerator and reactor long baseline experiments as well as neutrino
factories. Finally, the implications of extrinsic CPT violation on neutrino
oscillations in matter for several past, present, and future long baseline
experiments are estimated.
","[{""version"":""v1"",""created"":""Wed, 7 May 2003 14:36:23 GMT""},{""version"":""v2"",""created"":""Tue, 13 May 2003 15:57:49 GMT""},{""version"":""v3"",""created"":""Wed, 22 Oct 2003 21:09:10 GMT""}]","2009-05-20"
