"cond-mat/0305491","Bernhard Mehlig","M. Wilkinson and B. Mehlig","The path-coalescence transition and its applications","4 pages, 3 figures; revised version, as published","Phys. Rev. E 68, 040101 (2003)","10.1103/PhysRevE.68.040101",,"cond-mat.dis-nn nlin.CD",,"  We analyse the motion of a system of particles subjected a random force
fluctuating in both space and time, and experiencing viscous damping. When the
damping exceeds a certain threshold, the system undergoes a phase transition:
the particle trajectories coalesce. We analyse this transition by mapping it to
a Kramers problem which we solve exactly. In the limit of weak random force we
characterise the dynamics by computing the rate at which caustics are crossed,
and the statistics of the particle density in the coalescing phase. Last but
not least we describe possible realisations of the effect, ranging from
trajectories of raindrops on glass surfaces to animal migration patterns.
","[{""version"":""v1"",""created"":""Wed, 21 May 2003 10:00:25 GMT""},{""version"":""v2"",""created"":""Sat, 25 Oct 2003 15:30:35 GMT""}]","2009-11-10"
"cond-mat/0305492","Rochus Klesse","Rochus Klesse and Florian Merz","Residual resistance in two-dimensional, microwave driven Hall systems","5 pages, 3 figures",,,,"cond-mat.mes-hall cond-mat.stat-mech",,"  We address the origin of the residual resistance observed in microwave
irradiated two-dimensional electron gases in a weak magnetic field. We study
charge modulations arising from negative photo-conductivity and show that
dissipative currents are exponentially suppressed. Relating the exponent to the
temperature dependence of microscopic parameters taken from experiment, we find
pseudo activated behaviour. In order to obtain these results it is essential to
take into account the finite range of the Coulomb interaction.
","[{""version"":""v1"",""created"":""Wed, 21 May 2003 10:30:54 GMT""}]","2007-05-23"
"cond-mat/0305493","Kamil Walczak","Kamil Walczak","Sequential toy model for electron transfer in donor-bridge-acceptor
  systems","7 pages, 4 figures",,,,"cond-mat.mes-hall",,"  Sequential tunneling model is used to study electron transport in molecular
rectifiers based on structures of donor-bridge-acceptor type. The device is
made of two metallic electrodes connected by a molecule, which contains
acceptor and donor subunits, separated by insulating bridge. Both subunits are
modeled as quantum dots with discrete energy levels, isolated from each other
by potential barrier and weakly coupled to both electrodes through tunnel
junctions. Intervalence donor-acceptor tunneling process is treated as a
superexchange mechanism or equivalently through the use of Marcus theory.
Analytic formula for the current is found in the case of the Aviram-Ratner
ansatz of rectification and current-voltage characteristic is obtained at an
arbitrary strength of the potential drop over the tunneling region. It is shown
that rectification current depends on the position of the acceptor's LUMO and
donor's HOMO levels with respect to the Fermi energy of the electrodes before
bias is applied, and their shift due to the bias voltage.
","[{""version"":""v1"",""created"":""Wed, 21 May 2003 11:17:12 GMT""},{""version"":""v2"",""created"":""Mon, 9 Feb 2004 09:44:49 GMT""}]","2007-05-23"
"cond-mat/0305494","Ulrich Hohenester","Claudia Sifel and Ulrich Hohenester","A turnstile electron-spin entangler in semiconductors","3 pages, 1 figure; to appear in Appl. Phys. Lett",,"10.1063/1.1590425",,"cond-mat.mes-hall quant-ph",,"  We propose a single-electron doped quantum dot in a field-effect structure as
an optically triggered turnstile for spin-entangled electrons. A short laser
pulse excites a charged exciton, whose quantum properties are transferred
through tunneling and relaxation to the spin entanglement between electrons in
the dot and contact. We identify the pertinent disentanglement mechanisms, and
discuss experimental detection and possible application schemes.
","[{""version"":""v1"",""created"":""Wed, 21 May 2003 11:29:05 GMT""}]","2009-11-10"
"cond-mat/0305495","Slava Yukalov","V. I. Yukalov, E.P. Yukalova, and V.S. Bagnato","Resonant Bose Condensate: Analog of Resonant Atom","20 pages, Latex, no figures","Laser Phys. 13 (2003) 551-561",,,"cond-mat",,"  The resonant formation of nonlinear coherent modes in trapped Bose-Einstein
condensates is studied. These modes represent nonground-state Bose condensates.
The methods of describing the spectrum of the nonlinear modes are discussed.
The latter can be created by modulating the trapping potential with a frequency
tuned close to the transition frequency between the two chosen modes. The
requirement that the transition amplitudes be smaller than the transition
frequency implies a constraint on the number of particles that can be
transferred to an excited mode. The resonant Bose condensate serves as a
collective analog of a single resonant atom. Such a condensate, displaying the
coherent resonance, possesses several interesting features, among which are:
mode locking, critical dynamics, interference patterns, interference current,
atomic squeezing, and multiparticle entanglement.
","[{""version"":""v1"",""created"":""Wed, 21 May 2003 11:50:51 GMT""}]","2007-05-23"
"cond-mat/0305496","M. E. Palistrant","M. E. Palistrant","Comment on ""Theory of two-band superconductors""","6 pages, 0 figures",,,,"cond-mat.supr-con",,"  The main stages of development of the theory of superconductivity in systems
with overlapping energy bands are formulated. The main references on the
classical papers of the author of this theory, Prof. Moskalenko V.A., and his
coworkers are listed. The list also includes papers related to high -
temperature superconductivity. Some peculiarities of the two - band model,
which lead to qualitatively new results in comparison to the usual one - band
model, are enumerated. We also list our own publications on thermodynamics and
collective oscillations in the two - band systems which are based on a
generalization of Moskalenko model of systems with overlapping energy bands for
the case of a reduced density of charge carriers.
  Application of the two-band model to the description of thermodynamic
properties of the compound $MgB_{2}$ is also discussed.
","[{""version"":""v1"",""created"":""Wed, 21 May 2003 13:33:18 GMT""},{""version"":""v2"",""created"":""Mon, 2 Jun 2003 13:10:37 GMT""},{""version"":""v3"",""created"":""Thu, 26 Jun 2003 12:39:45 GMT""}]","2007-05-23"
"cond-mat/0305497","Harri Makela","H. M\""akel\""a, Y. Zhang, K.-A. Suominen","Topological defects in spinor condensates","10 pages, 1 figure. Published version","J. Phys. A: Math. Gen. 36, 8555 (2003)","10.1088/0305-4470/36/32/302",,"cond-mat.soft",,"  We investigate the structure of topological defects in the ground states of
spinor Bose-Einstein condensates with spin F=1 or F=2. The type and number of
defects are determined by calculating the first and second homotopy groups of
the order-parameter space. The order-parameter space is identified with a set
of degenerate ground state spinors. Because the structure of the ground state
depends on whether or not there is an external magnetic field applied to the
system, defects are sensitive to the magnetic field. We study both cases and
find that the defects in zero and non-zero field are different.
","[{""version"":""v1"",""created"":""Wed, 21 May 2003 14:52:20 GMT""},{""version"":""v2"",""created"":""Thu, 7 Aug 2003 10:21:39 GMT""}]","2016-08-16"
"cond-mat/0305498","Serguei Brazovskii","S.I. Matveenko and S. Brazovskii","Theory of pseudogaps in charge density waves in application to photo
  electron or tunneling spectroscopy","International Workshop on Electronic Crystals, September 2002","J. Phys. France IV, \textbf{12}, 73 (2002)",,,"cond-mat.str-el",,"  For a one-dimensional electron-phonon system we consider the photon
absorption involving electronic excitations within the pseudogap energy range.
In the framework of the adiabatic approximation for the electron - phonon
interactions these processes are described by nonlinear configurations of an
instanton type. We calculate the subgap absorption as it can be observed by
means of photo electron or tunneling spectroscopies. In details we consider
systems with gapless modes: 1D semiconductors with acoustic phonons and
incommensurate charge density waves. We find that below the free particle edge
the pseudogap starts with the exponential decrease of transition rates changing
to a power law deeply within the pseudogap, near the absolute edge.
","[{""version"":""v1"",""created"":""Wed, 21 May 2003 13:36:10 GMT""}]","2007-05-23"
"cond-mat/0305499","Igor Rozhkov","Oleg I. Lobkis, Igor S. Rozhkov and Richard L. Weaver","Non-exponential Dissipation in a Lossy Elastodynamic Billiard,
  Comparison with Porter-Thomas and Random Matrix Predictions","4 pages, 8 figures, figures resized, misprints corrected",,"10.1103/PhysRevLett.91.194101",,"cond-mat.mes-hall",,"  We study the dissipation of diffuse ultrasonic energy in a reverberant body
coupled to a waveguide, an analog for a mesoscopic electron in a quantum dot. A
simple model predicts a Porter-Thomas like distribution of level widths and
corresponding nonexponential dissipation, a behavior largely confirmed by
measurements. For the case of fully open channels, however, measurements
deviate from this model to a statistically significant degree. A random matrix
supersymmetric calculation is found to accurately model the observed behaviors
at all coupling strengths.
","[{""version"":""v1"",""created"":""Wed, 21 May 2003 15:46:51 GMT""},{""version"":""v2"",""created"":""Wed, 28 May 2003 16:38:13 GMT""},{""version"":""v3"",""created"":""Thu, 29 May 2003 22:22:42 GMT""},{""version"":""v4"",""created"":""Mon, 11 Aug 2003 21:17:58 GMT""},{""version"":""v5"",""created"":""Sun, 14 Sep 2003 17:03:25 GMT""}]","2009-11-10"
"cs/0305038","Nancy Hartline Bercich","Nancy Hartline Bercich","The Evolution of the Computerized Database","13 pages, including figures and bibliography",,,,"cs.DB",,"  Databases, collections of related data, are as old as the written word. A
database can be anything from a homemaker's metal recipe file to a
sophisticated data warehouse. Yet today, when we think of a database we
invariably think of computerized data and their DBMSs (database management
systems). How did we go from organizing our data in a simple metal filing box
or cabinet to storing our data in a sophisticated computerized database? How
did the computerized database evolve?
  This paper defines what we mean by a database. It traces the evolution of the
database, from its start as a non-computerized set of related data, to the, now
standard, computerized RDBMS (relational database management system). Early
computerized storage methods are reviewed including both the ISAM (Indexed
Sequential Access Method) and VSAM (Virtual Storage Access Method) storage
methods. Early database models are explored including the network and
hierarchical database models. Eventually, the relational, object-relational and
object-oriented databases models are discussed. An appendix of diagrams,
including hierarchical occurrence tree, network schema, ER (entity
relationship) and UML (unified modeling language) diagrams, is included to
support the text.
  This paper concludes with an exploration of current and future trends in DBMS
development. It discusses the factors affecting these trends. It delves into
the relationship between DBMSs and the increasingly popular object-oriented
development methodologies. Finally, it speculates on the future of the DBMS.
","[{""version"":""v1"",""created"":""Wed, 21 May 2003 15:59:56 GMT""}]","2007-05-23"
"gr-qc/0305078","Dr Mayeul Arminjon","Mayeul Arminjon","Testing a theory of gravity in celestial mechanics: a new method and its
  first results for a scalar theory","v2: links to quoted arXiv papers. LaTeX, 28 pages including 2
  figures. This is a revised version of a lecture given at the 8th. Conf.
  ``Physical Interpretations of Relativity Theory'' (London, September 2002),
  organized by the British Society for the Philosophy of Sciences. The initial
  version will appear in the proceedings of that conference (M. C. Duffy, ed.)","RecentRes.Dev.Astron.Astrophys.1:859-879,2003",,,"gr-qc astro-ph",,"  A new method of post-Newtonian approximation (PNA) for weak gravitational
fields is presented together with its application to test an alternative,
scalar theory of gravitation. The new method consists in defining a
one-parameter family of systems, by applying a Newtonian similarity
transformation to the initial data that defines the system of interest. This
method is rigorous. Its difference with the standard PNA is emphasized. In
particular, the new method predicts that the internal structure of the bodies
does have an influence on the motion of the mass centers. The translational
equations of motion obtained with this method in the scalar theory are adjusted
in the solar system, and compared with an ephemeris based on the standard PNA
of GR.
","[{""version"":""v1"",""created"":""Wed, 21 May 2003 15:15:26 GMT""},{""version"":""v2"",""created"":""Fri, 6 Jun 2003 13:38:04 GMT""}]","2008-11-26"
"gr-qc/0305079","Buffenoir","E. Buffenoir, K. Noui","Unfashionable observations about three dimensional gravity","50 pages, written in LaTex, 3 pictures in encapsulated postscript",,,,"gr-qc hep-th",,"  It is commonly accepted that the study of 2+1 dimensional quantum gravity
could teach us something about the 3+1 dimensional case. The non-perturbative
methods developed in this case share, as basic ingredient, a reformulation of
gravity as a gauge field theory. However, these methods suffer many problems.
Firstly, this perspective abandon the non-degeneracy of the metric and
causality as fundamental principles, hoping to recover them in a certain
low-energy limit. Then, it is not clear how these combinatorial techniques
could be used in the case where matter fields are added, which are however the
essential ingredients in order to produce non trivial observables in a
generally covariant approach. Endly, considering the status of the observer in
these approaches, it is not clear at all if they really could produce a
completely covariant description of quantum gravity. We propose to re-analyse
carefully these points. This study leads us to a really covariant description
of a set of self-gravitating point masses in a closed universe. This approach
is based on a set of observables associated to the measurements accessible to a
participant-observer, they manage to capture the whole dynamic in Chern-Simons
gravity as well as in true gravity. The Dirac algebra of these observables can
be explicitely computed, and exhibits interesting algebraic features related to
Poisson-Lie groupoids theory.
","[{""version"":""v1"",""created"":""Wed, 21 May 2003 08:31:51 GMT""},{""version"":""v2"",""created"":""Wed, 11 Jun 2003 08:17:28 GMT""}]","2007-05-23"
"hep-ex/0305059","Rainer Wanke","Rainer Wanke (University of Mainz) (for the NA48 Collaboration)","New Results on Kaon Decays from NA48","6 pages, 9 figures, to appear in the proceedings of the 38th
  Rencontres de Moriond, Electro-Weak Interactions and Unified Theories, Les
  Arcs, France, March 2003",,,,"hep-ex",,"  New measurements of K_L and K_S decays from the NA48 experiment are
presented. From data taken in the year 2001, the value of the K_e3 charge
asymmetry has been determined to delta_L(e) = (3.317 +- 0.070(stat) +- 0.072
(syst)) x 10^-3. From a special high-intensity K_S run period performed in
2000, NA48 has found a limit of 1.4 x 10^-6 on the K_S -> 3 pi0 branching ratio
and measured the parameter eta_000. The same data sample also leads to the
first observation of the rare decay K_S -> pi0 gamma gamma. All results are
still preliminary.
","[{""version"":""v1"",""created"":""Tue, 20 May 2003 17:34:53 GMT""}]","2019-08-14"
"hep-ex/0305060","Minzu Wang","M.Z. Wang","Measurement of Baryonic B Decays","4 pages, 3 figure files, Moriond QCD",,,,"hep-ex",,"  Recent results of baryonic B decays from Belle are reported. This study is
done by a 78 fb$^{-1}$ data sample, consisting of $85.0 \pm 0.5$ million
$B\bar{B}$ pairs, collected by the Belle detector at the KEKB asymmetric energy
$e^+e^-$ (3.5 on 8 GeV) collider. The results reported here include the first
observation of the two-body decay $B^0 \to p\bar\Lambda_c$, the first hyperonic
decay $B^0 \to p\bar{\Lambda}\pi^-$, and first observations of $B^+ \to
p\bar{p}\pi^+$, $B^0 \to p\bar{p}K_S^0$, and $B^+ \to p\bar{p}K^{\star +}$.
","[{""version"":""v1"",""created"":""Wed, 21 May 2003 11:26:19 GMT""}]","2007-05-23"
"hep-ex/0305061","Patrice Perez","Patrice Perez","W mass at LEP2",,,,,"hep-ex",,"  Recent studies to finalize the systematic error estimates on the measurement
of the mass of the W boson at LEP2 are reviewed. Results including a new
preliminary value from Aleph are updated together with the world average which
is now 80.426 +- 0.034GeV/c2. The updated electroweak fit gives a 95% C.L.
upper limit on the mass of the Higgs boson of 211GeV/c2.
","[{""version"":""v1"",""created"":""Wed, 21 May 2003 11:48:30 GMT""}]","2007-05-23"
"hep-ex/0305062","F. Filthaut","F. Filthaut (for the D0 Collaboration)","B Physics at D0","Presented at the XXXVIII Rencontres de Moriond on Electroweak
  Interactions and Unified Theories, 15-22 March 2003",,,,"hep-ex",,"  The DO detector at FNAL has undergone a significant upgrade for its present
Run II data taking period, allowing for a broad B physics programme. This
report focuses on studies performed on a sample of approximately 75 thousand
inclusive J/psi events. Preliminary results on mass and lifetime measurements
and prospects for flavour tagging are presented.
","[{""version"":""v1"",""created"":""Wed, 21 May 2003 11:53:50 GMT""}]","2019-08-14"
"hep-ex/0305063","Marina Giunta","Marina Giunta","Rapidity gaps in gluon jets / color reconnection at LEP","4 pages, 2 figures",,,"OPAL-CR515","hep-ex",,"  Gluon jets with a large gap in the rapidity distribution of particles within
the jet are very sensitive to color reconnection effects. Gluon jets of this
type, selected from hadronic Z0 decay events produced in e+e- annihilations at
LEP, are used to test three QCD models which include a simulation of color
reconnection: one in the Ariadne Monte Carlo, one in the
  Herwig Monte Carlo, and the other by Rathsman in the Pythia Monte Carlo. We
conclude that color reconnection as implemented by the Rathsman and Ariadne
models is disfavored. We don't obtain a definite conclusion concerning the
Herwig color reconnection model.
","[{""version"":""v1"",""created"":""Wed, 21 May 2003 14:55:19 GMT""}]","2016-08-31"
"hep-ph/0305212","Keith Olive","J. Ellis (CERN), K.A. Olive (FTPI, U of Minnesota), Y. Santoso (FTPI,
  U of Minnesota), V.C. Spanos (FTPI, U of Minnesota)","Phenomenological Constraints on Patterns of Supersymmetry Breaking","17 pages LaTeX, 9 eps figures","Phys.Lett.B573:162-172,2003","10.1016/j.physletb.2003.08.056","CERN-TH/2003-107,UMN-TH-2201/03,FTPI-MINN-03/12","hep-ph astro-ph",,"  Specific models of supersymmetry breaking predict relations between the
trilinear and bilinear soft supersymmetry breaking parameters A_0 and B_0 at
the input scale. In such models, the value of tan beta can be calculated as a
function of the scalar masses m_0 and the gaugino masses m_{1/2}, which we
assume to be universal. The experimental constraints on sparticle and Higgs
masses, b to s gamma decay and the cold dark matter density Omega_{CDM} h^2 can
then be used to constrain tan beta in such specific models of supersymmetry
breaking. In the simplest Polonyi model with A_0 = (3 - sqrt{3})m_0 = B_0 +
m_0, we find 11 < tan beta < 20 (tan beta ~ 4.15) for mu > 0 (mu < 0). We also
discuss other models with A_0 = B_0 + m_0, finding that only the range -1.9 <
A_0/m_0 < 2.5 is allowed for mu > 0, and the range 1.25 < A_0/m_0 < 4.8 for mu
< 0. In these models, we find no solutions in the rapid-annihilation `funnels'
or in the `focus-point' region. We also discuss the allowed range of tan beta
in the no-scale model with A_0 = B_0 = 0. In all these models, most of the
allowed regions are in the chi - stau_1 coannihilation `tail'.
","[{""version"":""v1"",""created"":""Tue, 20 May 2003 16:48:50 GMT""}]","2008-11-26"
"hep-ph/0305214","Yasunori Nomura","Yasunori Nomura and David R. Smith","Spectrum of TeV Particles in Warped Supersymmetric Grand Unification","29 pages, 5 figures","Phys.Rev.D68:075003,2003","10.1103/PhysRevD.68.075003","FERMILAB-Pub-03/136-T, MIT-CTP-3375","hep-ph hep-th",,"  In warped supersymmetric grand unification, XY gauge particles appear near
the TeV scale along with Kaluza-Klein towers of the standard model gauge
fields. In spite of this exotic low-energy physics, MSSM gauge coupling
unification is preserved and proton decay is naturally suppressed. In this
paper we study in detail the low-lying mass spectrum of superparticles and GUT
particles in this theory, taking supersymmetry breaking to be localized to the
TeV brane. The masses of the MSSM particles, Kaluza-Klein modes, and XY states
are all determined by two parameters, one which fixes the strength of the
supersymmetry breaking and the other which sets the scale of the infrared
brane. A particularly interesting result is that for relatively strong
supersymmetry breaking, the XY gauginos and the lowest Kaluza-Klein excitations
of the MSSM gauginos may both lie within reach of the LHC, providing the
possibility that the underlying unified gauge symmetry and the enhanced N=2
supersymmetry of the theory will both be revealed.
","[{""version"":""v1"",""created"":""Tue, 20 May 2003 17:09:53 GMT""}]","2008-11-26"
"hep-ph/0305222","Jacques Soffer","Jacques Soffer","Positivity constraints on initial spin observables in inclusive
  reactions","6 pages, version to be published in Phys.Rev.Lett","Phys.Rev.Lett. 91 (2003) 092005","10.1103/PhysRevLett.91.092005","CPT-2003/P.4535, CERN-TH/2003-110","hep-ph",,"  For any inclusive reaction of the type $A_1({spin} 1/2)+ A_2({spin} 1/2) \to
B + X$, we derive new positivity constraints on spin observables and study
their implications for theoretical models in view, in particular, of accounting
for future data from the polarized $pp$ collider at BNL-RHIC. We find that the
single transverse spin asymmetry $A_N$ for several processes, in the central
region for example jet production, direct photon production, lepton-pair
production, must be such that $|A_N| \lappeq 1/2$, rather than the usual bound
$|A_N| \leq 1$.
","[{""version"":""v1"",""created"":""Tue, 20 May 2003 16:35:00 GMT""},{""version"":""v2"",""created"":""Thu, 10 Jul 2003 15:34:47 GMT""}]","2016-09-06"
"hep-ph/0305223","Saurya Das","Marco Cavaglia (1), Saurya Das (2), Roy Maartens (1) ((1) Portsmouth,
  (2) New Brunswick)","Will we observe black holes at LHC?","5 pages, 2 figures. Minor changes to match version to appear in
  Class. Quant. Grav","Class.Quant.Grav.20:L205-L212,2003","10.1088/0264-9381/20/15/101",,"hep-ph gr-qc hep-th",,"  The generalized uncertainty principle, motivated by string theory and
non-commutative quantum mechanics, suggests significant modifications to the
Hawking temperature and evaporation process of black holes. For
extra-dimensional gravity with Planck scale O(TeV), this leads to important
changes in the formation and detection of black holes at the the Large Hadron
Collider. The number of particles produced in Hawking evaporation decreases
substantially. The evaporation ends when the black hole mass is Planck scale,
leaving a remnant and a consequent missing energy of order TeV. Furthermore,
the minimum energy for black hole formation in collisions is increased, and
could even be increased to such an extent that no black holes are formed at LHC
energies.
","[{""version"":""v1"",""created"":""Tue, 20 May 2003 17:37:25 GMT""},{""version"":""v2"",""created"":""Fri, 27 Jun 2003 18:18:50 GMT""}]","2009-11-10"
