"astro-ph/0305400","Bruno Altieri","L. Metcalfe (1), J.-P. Kneib (2), B. McBreen (3), B. Altieri (1), A.
  Biviano (4), M. Delaney (3), D. Elbaz (5), M.F. Kessler (1), K. Leech (1), K.
  Okumura (5), S. Ott (1), R. Perez-Martinez (1), C. Sanchez-Fernandez (1), and
  B. Schulz (6) ((1) ESA, (2) OMP, (3) UC Dublin, (4) O.A. Trieste, (5) CEA,
  (6) IPAC)","An ISOCAM survey through gravitationally lensing galaxy clusters","35 pages, 17 figures, to appear in Astronomy and Astrophysics, full
  paper with high-resolution figures available at
  http://www.iso.vilspa.esa.es/science/pub/2003/","Astron.Astrophys. 407 (2003) 791-822","10.1051/0004-6361:20030621-1",,"astro-ph",,"  ISOCAM was used to perform a deep survey through three gravitationally
lensing clusters of galaxies. Nearly seventy sq. arcmin were covered over the
clusters A370, A2218 and A2390. We present maps and photometry at 6.7 & 14.3
microns, showing a total of 145 mid-IR sources and the associated source
counts. The 15 micron counts reach the faintest level yet recorded. All sources
have counterparts in the optical or near-IR. Models of the clusters were used
to correct for the effects of lensing, which increases the sensitivity of the
survey. Seven of fifteen SCUBA sources were detected at 15 microns. Five have
redshift between 0.23 & 2.8, with a median of 0.9. The field sources were
counted to a lensing-corrected sensitivity of 30 microJy at 15 microns, and 14
microJy at 7 microns. The counts, corrected for completeness, contamination by
cluster sources and lensing, confirm and extend findings of an excess by a
factor of ten in the 15 micron population with respect to source models with no
evolution. Source redshifts are mostly between 0.4 and 1.5. For the counts at 7
microns, integrating from 14 microJy to 460 microJy, we resolve 0.49+/-0.2
nW.m^(-2).sr^(-1) of the infrared background light (IBL) into discrete sources.
At 15 microns we include the counts from other ISOCAM surveys to integrate from
30 microJy to 50 mJy, two to three times deeper than unlensed surveys, to
resolve 2.7+/-0.62 nW.m^(-2).sr^(-1) of the IBL. These values are 10% and 55%,
respectively, of the upper limit to the IBL, derived from photon-photon pair
production of the TeV gamma rays from BL-Lac sources on the IBL photons.
However, recent detections of TeV gamma rays from the z=0.129 BL Lac H1426+428
suggest that the 15 micron background reported implies substantial absorption
of TeV photons from that source.
","[{""version"":""v1"",""created"":""Wed, 21 May 2003 14:51:19 GMT""},{""version"":""v2"",""created"":""Thu, 22 May 2003 16:48:35 GMT""}]","2009-11-07"
"astro-ph/0305401","Jochen Heidt","J. Heidt (1), K. Jaeger (2), K. Nilsson (3), U. Hopp (4), J.W. Fried
  (5), E. Sutorius (6) ((1) LSW Heidelberg, (2) USG Goettingen, (3) Tuorla
  Observatory, Finland, (4) USM Muenchen, (5) MPIA Heidelberg, (6) Royal
  Observatory Edinburgh)","PKS 0537-441: extended [O II] emission and a binary QSO?","13 pages, 9 figures, accepted for publication in A&A","Astron.Astrophys. 406 (2003) 565-578","10.1051/0004-6361:20030804",,"astro-ph",,"  We present high-resolution imaging and low-resolution spectroscopy of the BL
Lac object PKS 0537-441 (z = 0.893) and its environment. The observations were
designed to clarify, whether the properties of PKS 0537-441 are affected by
gravitational microlensing, or whether PKS 0537-441 and its environment act as
a lensing system itself. Our observations show that neither case seems to be
likely. We did not find a galaxy along the line-of-sight to the BL Lac as
claimed previously, our spectroscopy shows that none of the four closest
companion galaxies is at high redshift. Two of the four nearby companion
galaxies to PKS 0537-441 are within 200 km/s of the systemic velocity of the BL
Lac (z = 0.892 and 0.895, respectively). The third companion galaxy is at
higher redshift (z = 0.947). The fourth companion galaxy shows evidence of Mg
II absorption redwards of its systemic velocity and is perhaps a mini low
ionization BAL QSO at z = 0.885. If the latter can be confirmed, PKS 0537-441
is the first BL Lacertae object being a member of a binary Quasar. We also
detected extended [O II] emission in the off-nuclear spectrum of PKS 05371-441,
which is most likely due to photoionization from the active nucleus.
Alternatively, the extended [O II] emission is due to jet-cloud interaction
with the counterjet of PKS 0537-441. Our clustering analysis indicates that PKS
0537-441 is located in a cluster environment as rich as Abell type 0-1. This is
supported by the detection of four galaxies in the field with similar redshifts
as the BL Lac (Delta z < 0.002). We found serendipitously even more galaxies at
somewhat higher redshifts (z = 0.9-1). Thus, PKS0537-441 might be located in
front of a galaxy cluster at somewhat higher redshift or even be part of a
large-scale structure with an extension towards the BL Lac.
","[{""version"":""v1"",""created"":""Wed, 21 May 2003 14:09:37 GMT""}]","2009-11-07"
"astro-ph/0305402","Lynn D. Matthews","L. D. Matthews & Kenneth Wood","High-Latitude HI in the Low Surface Brightness Galaxy UGC7321","to appear in the August 20 Astrophysical Journal; 17 pages; version
  with full resolution figures available at
  http://cfa-www.harvard.edu/~lmatthew/","Astrophys.J. 593 (2003) 721-732","10.1086/376602",,"astro-ph",,"  From the analysis of sensitive HI 21-cm line observations, we find evidence
for vertically extended HI emission (|z|<~2.4 kpc) in the edge-on, low surface
brightness spiral galaxy UGC7321. Three-dimensional modelling suggests that the
HI disk of UGC7321 is both warped and flared, but that neither effect can fully
reproduce the spatial distribution and kinematics of the highest z-height gas.
We are able to model the high-latitude emission as an additional HI component
in the form of a ``thick disk'' or ``halo'' with a FWHM~3.3 kpc. We find
tentative evidence that the vertically extended gas declines in rotational
velocity as a function of z, although we are unable to completely rule out
models with constant V(z). In spite of the low star formation rate of UGC7321,
energy from supernovae may be sufficient to sustain this high-latitude gas.
However, alternative origins for this material, such as slow, sustained infall,
cannot yet be excluded.
","[{""version"":""v1"",""created"":""Wed, 21 May 2003 14:18:37 GMT""}]","2009-11-07"
"astro-ph/0305403","Robert Braun","Robert Braun (1), David Thilker (2), Rene Walterbos (3) ((1) ASTRON,
  (2) Johns Hopkins Univ., (3) NMSU)","The WSRT wide-field HI survey: I. The background galaxy sample","27 pages, 14 figures, accepted for publication in A&A","Astron.Astrophys. 406 (2003) 829-846","10.1051/0004-6361:20030761",,"astro-ph",,"  We have used the Westerbork array to carry out an unbiased wide-field survey
for HI emission features, achieving an RMS sensitivity of about 18 mJy/Beam at
a velocity resolution of 17 km/s over 1800 deg^2 and between -1000 <
V_Hel<+6500 km/s. The primary data consists of auto-correlation spectra with an
effective angular resolution of 49' FWHM. We detect 155 external galaxies in
excess of 8 sigma in integrated HI flux density. Plausible optical associations
are found within a 30' search radius for all but one of our HI detections in
DSS images, although several are not previously cataloged or do not have
published red-shift determinations. Twenty-three of our objects are detected in
HI for the first time. We classify almost half of our detections as
``confused'', since one or more companions is cataloged within a radius of 30'
and a velocity interval of 400 km/s. We identify a handful of instances of
significant positional offsets exceeding 10 kpc of unconfused optical galaxies
with the associated HI centroid, possibly indicative of severe tidal
distortions or uncataloged gas-rich companions. A possible trend is found for
an excess of detected HI flux in unconfused galaxies within our large survey
beam relative to that detected previously in smaller telescope beams, both as
function of increasing distance and increasing gas mass. This may be an
indication for a diffuse gaseous component on 100 kpc scales in the environment
of massive galaxies or a population of uncataloged low mass companions. We use
our galaxy sample to estimate the HI mass function from our survey volume. Good
agreement is found with the HIPASS BGC results, but only after explicit
correction for galaxy density variations with distance.
","[{""version"":""v1"",""created"":""Wed, 21 May 2003 14:38:53 GMT""}]","2016-08-30"
"cond-mat/0305476","Michel Kenzelmann","M. Kenzelmann, Y. Chen, C. Broholm, D. H. Reich, Y. Qiu","Bound spinons in an antiferromagnetic S=1/2 chain with a staggered field","4 pages RevTex4, resubmitted to PRL","Phys. Rev. Lett. 93, 017204 (2004).","10.1103/PhysRevLett.93.017204",,"cond-mat.str-el cond-mat.stat-mech",,"  Inelastic neutron scattering was used to measure the magnetic field
dependence of spin excitations in the antiferromagnetic S=1/2 chain CuCl_2
2(dimethylsulfoxide) (CDC) in the presence of uniform and staggered fields.
Dispersive bound states emerge from a zero-field two-spinon continuum with
different finite energy minima at wave numbers q=pi and q_i approx pi
(1-2<S_z>). The ratios of the field dependent excitation energies are in
excellent agreement with predictions for breather and soliton solutions to the
quantum sine-Gordon model, the proposed low-energy theory for S=1/2 chains in a
staggered field. The data are also consistent with the predicted soliton and
n=1,2 breather polarizations and scattering cross sections.
","[{""version"":""v1"",""created"":""Tue, 20 May 2003 18:08:35 GMT""},{""version"":""v2"",""created"":""Tue, 24 Feb 2004 16:39:26 GMT""}]","2009-11-10"
"cond-mat/0305477","Khasanov Rustem","R. Khasanov, D.G. Eshchenko, H. Luetkens, E. Morenzoni, T. Prokscha,
  A. Suter, N. Garifianov, M. Mali, J. Roos, K. Conder, and H. Keller","Direct observation of the oxygen isotope effect on the in-plane magnetic
  field penetration depth in optimally doped YBa$_2$Cu$_3$O$_{7-\delta}$","4 pages, 2 figures","Phys. Rev. Lett., v. 92, 057602 (2004).","10.1103/PhysRevLett.92.057602",,"cond-mat.supr-con",,"  We report the first direct observation of the oxygen-isotope
($^{16}$O/$^{18}$O) effect on the in-plane penetration depth $\lambda_{ab}$ in
a nearly optimally doped YBa$_2$Cu$_3$O$_{7-\delta}$ film using the novel
low-energy muon-spin rotation technique. Spin polarized low energy muons are
implanted in the film at a known depth $z$ beneath the surface and precess in
the local magnetic field $B(z)$. This feature allows us to measure directly the
profile $B(z)$ of the magnetic field inside the superconducting film in the
Meissner state and to make a model independent determination of $\lambda_{ab}$.
A substantial isotope shift $\Delta\lambda_{ab}/\lambda_{ab}=2.8(7)$% at 4 K is
observed, implying that the in-plane effective supercarrier mass $m_{ab}^\ast$
is oxygen-isotope dependent with $\Delta m_{ab}^\ast/m_{ab}^\ast = 5.5(1.4)%$.
","[{""version"":""v1"",""created"":""Tue, 20 May 2003 19:41:55 GMT""}]","2009-11-10"
"cond-mat/0305478","Igor Aleiner","M.G. Vavilov, I.L. Aleiner","Magnetotransport in two-dimensional electron gas at large filling
  factors","28 pages, 19 figures; The discussion of the role of the effect of the
  microwave field on the distribution function is revised (see also
  cond-mat/0310668). Accepted in Phys. Rev. B","Phys. Rev. B 69, 035303 (2004).","10.1103/PhysRevB.69.035303",,"cond-mat.mes-hall",,"  We derive the quantum Boltzmann equation for the two-dimensional electron gas
in a magnetic field such that the filling factor $\nu \gg 1$. This equation
describes all of the effects of the external fields on the impurity collision
integral including Shubnikov-de Haas oscillations, smooth part of the
magnetoresistance, and non-linear transport. Furthemore, we obtain quantitative
results for the effect of the external microwave radiation on the linear and
non-linear $dc$ transport in the system. Our findings are relevant for the
description of the oscillating resistivity discovered by Zudov {\em et al.},
zero-resistance state discovered by Mani {\em et al.} and Zudov {\em et al.},
and for the microscopic justification of the model of Andreev {\em et al.}. We
also present semiclassical picture for the qualitative consideration of the
effects of the applied field on the collision integral.
","[{""version"":""v1"",""created"":""Tue, 20 May 2003 19:47:32 GMT""},{""version"":""v2"",""created"":""Tue, 20 May 2003 20:33:07 GMT""},{""version"":""v3"",""created"":""Tue, 28 Oct 2003 20:33:22 GMT""}]","2009-11-10"
"cond-mat/0305479","R. Torsten Clay","R.T. Clay and S. Mazumdar","Rung-singlet charge-ordering in alpha'-NaV2O5","5 pages, 3 EPS figures",,,,"cond-mat.str-el",,"  We show that the proposed zig--zag charge--ordering model for alpha'--NaV2O5
is incompatible with a single transition that induces both charge--ordering and
spin gap. We introduce a two--band model for alpha'--NaV2O5 within which the
simultaneous charge--spin order transition is driven principally by
electron-phonon interactions. The spin gap is due to the formation of local
dimers, thus explaining the weak magnetic effect on this transition.
","[{""version"":""v1"",""created"":""Tue, 20 May 2003 19:54:53 GMT""}]","2007-05-23"
"cond-mat/0305480","Mario Renteria","J. M. Ramallo Lopez (1), M. Renteria (1 and 2), E. E. Miro (3), F. G.
  Requejo (1 and 4) and A. Traverse (2) ((1)Departamento de Fisica, FCE,
  Universidad Nacional de La Plata, La Plata, Argentina, (2) Laboratoire pour
  l'Utilisation du Rayonnement Electromagnetique (LURE), Universite Paris-Sud,
  Orsay, France, (3) INCAPE (FIQ, UNL, CONICET), Santa Fe, Argentina, (4)
  Materials Science Division, Lawrence Berkeley National Laboratory, Berkeley
  CA, USA)","Structure of Extremely Nanosized and Confined In-O Species in Ordered
  Porous Materials","4 pages, 5 postscript figures, REVTEX4, published in Physical Review
  Letters","Physical Review Letters 91, 108304 (2003)","10.1103/PhysRevLett.91.108304",,"cond-mat.mtrl-sci cond-mat.soft",,"  Perturbed-angular correlation, x-ray absorption, and small-angle x-ray
scattering spectroscopies were suitably combined to elucidate the local
structure of highly diluted and dispersed InOx species confined in porous of
ZSM5 zeolite. These novel approach allow us to determined the structure of
extremely nanosized In-O species exchanged inside the 10-atom-ring channel of
the zeolite, and to quantify the amount of In2O3 crystallites deposited onto
the external zeolite surface.
","[{""version"":""v1"",""created"":""Tue, 20 May 2003 22:15:06 GMT""},{""version"":""v2"",""created"":""Wed, 18 Apr 2007 06:01:23 GMT""}]","2009-11-10"
"cond-mat/0305481","Shaun Hendy","Shaun C. Hendy, Simon A. Brown and Michael Hyslop","Coalescence of nanoscale metal clusters: Molecular-dynamics study","5 figures","Phys. Rev. B 68, 241403(R) (2003)","10.1103/PhysRevB.68.241403",,"cond-mat",,"  We study the coalescence of nanoscale metal clusters in an inert-gas
atmosphere using constant-energy molecular dynamics. The coalescence proceeds
via atomic diffusion with the release of surface energy raising the
temperature. If the temperature exceeds the melting point of the coalesced
cluster, a molten droplet forms. If the temperature falls between the melting
point of the larger cluster and those of the smaller clusters, a metastable
molten droplet forms and freezes.
","[{""version"":""v1"",""created"":""Tue, 20 May 2003 22:28:34 GMT""},{""version"":""v2"",""created"":""Thu, 8 Jan 2004 20:21:36 GMT""}]","2007-05-23"
"cond-mat/0305482","Michael A. Zudov","M. A. Zudov, C. L. Yang, R. R. Du, T.-C. Shen, J.-Y. Ji, J. S. Kline,
  J. R. Tucker","Weak Localization in an Ultradense 2D Electron Gas in $\delta$-doped
  Silicon",,,,,"cond-mat",,"  An ultradense 2D electron system can be realized by adsorbing PH$_3$
precursor molecules onto an atomically clean Si surface, followed by epitaxial
Si overgrowth. By controlling the PH$_3$ coverage the carrier density of such
system can easily reach $\sim 10^{14}$ cm$^{-2}$, exceeding that typically
found in GaAs/AlGaAs structures by more than two-three orders of magnitude. We
report on a first systematic characterization of such novel system by means of
standard magnetotransport. The main findings include logarithmic temperature
dependence of zero-field conductivity and logarithmic negative
magnetoresistance. We analyzed the results in terms of scaling theory of
localization in two dimensions.
","[{""version"":""v1"",""created"":""Tue, 20 May 2003 23:54:04 GMT""}]","2007-05-23"
"cond-mat/0305483","Guo-meng Zhao","Guo-meng Zhao","Unambiguous evidence for extended s-wave pairing symmetry in hole-doped
  high-temperature superconductors","4 pages, 2 figures","Phil. Mag. B 84, 3861 (2004)",,,"cond-mat.str-el cond-mat.supr-con",,"  We have analyzed data from angle resolved photoemission spectroscopy, Fourier
transform scanning tunnelling spectroscopy, and low-temperature thermal
conductivity for optimally doped Bi_2Sr_2CaCu_2O_8+y in order to discriminate
between d-wave and extended s-wave pairing symmetry. The combined data are
inconsistent with d-wave symmetry, but quantitatively consistent with extended
s-wave symmetry with eight line nodes. We also consistently explain all the
phase-sensitive experiments.
","[{""version"":""v1"",""created"":""Wed, 21 May 2003 02:14:22 GMT""},{""version"":""v2"",""created"":""Mon, 23 Jun 2003 18:53:02 GMT""},{""version"":""v3"",""created"":""Wed, 14 Jan 2004 21:16:16 GMT""},{""version"":""v4"",""created"":""Mon, 15 Mar 2004 23:06:46 GMT""}]","2007-08-15"
"cond-mat/0305484","V. Ryzhii","V.Ryzhii","Thermal Mechanism of Absolute Negative Conductivity in Two-Dimensional
  Electron Systems","5 pages, 2 figures",,,,"cond-mat.mes-hall",,"  We calculate the dissipative dc conductivity of a two-dimensional electron
system in a magnetic field for the situation when its effective temperature
exceeds the temperature of the acoustic phonon system. We demonstrate that at
sufficiently large difference between the electron and lattice temperatures
(sufficiently strong microwave radiation) the dissipative dc conductivity can
become negative. As an illustration, the case of the electron heating by
microwave radiation is considered.
","[{""version"":""v1"",""created"":""Wed, 21 May 2003 02:43:42 GMT""}]","2007-05-23"
"cond-mat/0305485","Sergey Lee","Sergey Lee, Takahiko Masui, Ayako Yamamoto, Hiroshi Uchiyama and
  Setsuko Tajima","Carbon-substituted MgB2 single crystals","15 pages, 5 figures, 1 table; to be published in Physica C",,"10.1016/S0921-4534(03)01296-6",,"cond-mat.supr-con cond-mat.mtrl-sci",,"  Carbon-substituted MgB2 single crystals, Mg(B_1-xC_x)_2 of 0.3-1.0 mm size
were grown for x=0.02-0.15 by a high-pressure technique. The doping dependence
of lattice constants studied in a range of x=0.0-0.2 shows a monotonic decrease
in a, while the c parameter remains almost invariant. Using X-ray diffraction
and Auger electron spectroscopy, the solubility limit of C in MgB2 was
estimated to be about 15(+/-)1%,which is substantially larger than that
reported for the polycrystalline samples synthesized by encapsulation
techniques. Measurements of temperature dependence of magnetization and
resistivity showed a dramatic decrease in Tc with C-substitution, followed by
complete suppression of superconductivity for x>0.125. Resistivity measurements
in magnetic fields parallel and perpendicular to the basal plane of the
crystals showed a nearly isotropic state in the heavily-doped crystals (x>0.1).
","[{""version"":""v1"",""created"":""Wed, 21 May 2003 02:45:26 GMT""}]","2009-11-10"
"cond-mat/0305486","C. Q. Wu","C.Q. Wu, Y. Qiu, K. Nasu","Dynamical study on polaron formation in a metal/polymer/metal structure",,,"10.1103/PhysRevB.68.125416",,"cond-mat.str-el cond-mat.mtrl-sci",,"  By considering a metal/polymer/metal structure within a tight-binding
one-dimensional model, we have investigated the polaron formation in the
presence of an electric field. When a sufficient voltage bias is applied to one
of the metal electrodes, an electron is injected into the polymer chain, then a
self-trapped polaron is formed at a few hundreds of femtoseconds while it moves
slowly under a weak electric field (not larger than $% 1.0\times 10^4$ V/cm).
At an electric field between $1.0\times 10^4$ V/cm and $% 8.0\times 10^4$ V/cm,
the polaron is still formed, since the injected electron is bounded between the
interface barriers for quite a long time. It is shown that the electric field
applied at the polymer chain reduces effectively the potential barrier in the
metal/polymer interface.
","[{""version"":""v1"",""created"":""Wed, 21 May 2003 02:55:31 GMT""}]","2009-11-10"
"cond-mat/0305487","Arman S. Kirakosyan","A.S. Kirakosyan, V. L. Pokrovsky","From Bubble to Skyrmion: Dynamic Transformation Mediated by a Strong
  Magnetic Tip","10 pages, 8 figures, REVTeX4","Journal of Magnetism and Magnetic Materials 305, 413-422 (2006)","10.1016/j.jmmm.2006.01.113",,"cond-mat.mtrl-sci",,"  Skyrmions in thin metallic ferromagnetic films are stable due to competition
between the RKKY interaction and uniaxial magnetic anisotropy. We mimic the
RKKY interaction by the next-nearest-neighbors ferromagnetic and
antiferromagnetic exchange interactions. We demonstrate analytically and
numerically dissipative transformation of a bubble created by a strong
cylindrical magnetic tip into a stable Skyrmion.
","[{""version"":""v1"",""created"":""Wed, 21 May 2003 06:22:11 GMT""}]","2007-05-23"
"cond-mat/0305488","Yukitoshi Motome","Yukitoshi Motome and Nobuo Furukawa","Disorder Effect on Spin Excitation in Double Exchange Systems","17 pages including 7 figures + 8 figures in PNG format",,,,"cond-mat.str-el",,"  Spin excitation spectrum is studied in the double exchange model in the
presence of disorder. Spin wave approximation is applied in the lowest order of
1/S expansion. The disorder causes anomalies in the spin excitation spectrum
such as broadening, branching, anticrossing with gap opening. The origin of the
anomalies is the Friedel oscillation, in which the perfectly polarized
electrons form the charge density wave to screen the disorder effect. Near the
zone center $q = 0$, the linewidth has a $q$ linear component while the
excitation energy scales to $q^2$, which indicates that the magnon excitation
is incoherent. As $q$ increases, there appears a crossover from this incoherent
behavior to the marginally coherent one in which both the linewidth and the
excitation energy are proportional to $q^2$. The results are compared with
experimental results in colossal magnetoresistance manganese oxides.
Quantitative comparison of the linewidth suggests that spatially-correlated or
mesoscopic-scale disorder is more relevant in real compounds than local or
atomic-scale disorder. Comparison with other theoretical proposals is also
discussed. Experimental tests are proposed for the relevance of disorder.
","[{""version"":""v1"",""created"":""Wed, 21 May 2003 07:10:36 GMT""},{""version"":""v2"",""created"":""Thu, 22 May 2003 01:29:44 GMT""}]","2007-05-23"
"cond-mat/0305489","Yunbo Zhang","Yunbo Zhang, Harri M\""akel\""a and Kalle-Antti Suominen","Homotopy Theory of Topological Defects in Spinor Condensates","4 pages, 1 figure",,,,"cond-mat.soft",,"  We investigate the topological defects in atomic spin-1 and spin-2
Bose-Einstein condensates by applying the homotopy group theory. With this
rigorous approach we clarify the previously controversial identification of
symmetry groups and order parameter spaces for the spin-1 case, and show that
the spin-2 case provides a rare example of a physical system with non-Abelian
line defects, and the possibility to have winding numbers of 1/3 and its
multiples.
","[{""version"":""v1"",""created"":""Wed, 21 May 2003 08:58:07 GMT""}]","2016-08-16"
"cond-mat/0305490","Hideo Aoki","Hideo Aoki","Superconductivity from the repulsive electron interaction -- from 1D to
  3D","27 pages, 10 figures, in Tobias Brandes et al.(ed.): The Anderson
  Transition and its Ramifications -- Localisation, Quantum Interference, and
  Interactions",,"10.1007/978-3-540-45202-7_16",,"cond-mat.str-el cond-mat.supr-con",,"  An overview is given on how superconductivity with anisotropic pairing can be
realised from repulsive electron-electron interaction. (i) We start from the
physics in one dimension, where the Tomonaga-Luttinger theory predicts that,
while there is no superconducting phase for the repulsive case for a single
chain, the phase does exists in ladders with the number of legs equal to or
greater than two, as shown both by analytically (renormalisation) and
numerically (quantum Monte Carlo). (ii) We then show how this pairing has a
natural extension to the two-dimensional case, where anisotropic (usually d)
pairing superconductivity arises mediated by spin fluctuations (usually
antiferromagnetic), as shown both by analytically (renormalisation) and
numerically (quantum Monte Carlo). (iii) We finally discuss how the
superconductivity from the electron repulsion can be ""optimised"" (i.e., how
$T_C$ can be raised) in 2D and 3D, where we propose that the anisotropic
pairing is much favoured in systems having {\it disconnected Fermi surfaces}
where $T_C$ can be almost an order of magnitude higher.
","[{""version"":""v1"",""created"":""Wed, 21 May 2003 09:23:46 GMT""},{""version"":""v2"",""created"":""Tue, 24 Jun 2003 06:09:31 GMT""}]","2015-06-24"
