"hep-ph/0305224","Daniel Boyanovsky","D. Boyanovsky and H. J. de Vega","Are direct photons a clean signal of a thermalized quark gluon plasma?","31 pages, 12 eps figures, version to appear in PRD","Phys.Rev. D68 (2003) 065018","10.1103/PhysRevD.68.065018",,"hep-ph hep-ex nucl-ex nucl-th",,"  Direct photon production from a quark gluon plasma (QGP) in thermal
equilibrium is studied directly in real time. In contrast to the usual S-matrix
calculations, the real time approach is valid for a QGP that formed and reached
LTE a short time after a collision and of finite lifetime ($\sim 10-20
\mathrm{fm}/c$ as expected at RHIC or LHC). We point out that during such
finite QGP lifetime the spectrum of emitted photons carries information on the
initial state. There is an inherent ambiguity in separating the virtual from
the observable photons during the transient evolution of the QGP. We propose a
real time formulation to extract the photon yield which includes the initial
stage of formation of the QGP parametrized by an effective time scale of
formation $\Gamma^{-1}$. This formulation coincides with the S-matrix approach
in the infinite lifetime limit. It allows to separate the virtual cloud as well
as the observable photons emitted during the pre- equilibrium stage from the
yield during the QGP lifetime. We find that the lowest order contribution
$\mathcal{O}(\alpha_{em})$ which does \emph{not} contribute to the S-matrix
approach, is of the same order of or larger than the S-matrix contribution
during the lifetime of the QGP for a typical formation time $\sim 1
\mathrm{fm}/c$. The yield for momenta $\gtrsim 3 \mathrm{Gev}/c$ features a
power law fall-off $\sim T^3 \Gamma^2/k^{5}$ and is larger than that obtained
with the S-matrix for momenta $\geq 4 \mathrm{Gev}/c$. We provide a
comprehensive numerical comparison between the real time and S-matrix yields
and study the dynamics of the build-up of the photon cloud and the different
contributions to the radiative energy loss. The reliability of the current
estimates on photon emission is discussed.
","[{""version"":""v1"",""created"":""Tue, 20 May 2003 18:28:54 GMT""},{""version"":""v2"",""created"":""Tue, 29 Jul 2003 22:36:10 GMT""}]","2009-11-10"
"hep-ph/0305225","Herry J. Kwee","Justin M. Conroy, Herry J. Kwee and Vahagn Nazaryan","Phenomenology of Lorentz-Conserving Noncommutative QED","21 pages, revtex4, 4 figures, 2 tables","Phys.Rev. D68 (2003) 054004","10.1103/PhysRevD.68.054004","WM-03-104","hep-ph",,"  Recently a version of Lorentz-conserving noncommutative field theory (NCFT)
has been suggested. The underlying Lie algebra of the theory is the same as
that of Doplicher, Fredenhagen, and Roberts. In Lorentz-conserving NCFT the
matrix parameter {theta}^{mu nu} which characterizes the canonical NCFT's is
promoted to an operator {theta hat}^{mu nu} that transforms as a Lorentz
tensor. In this paper, we calculate phenomenological consequences of the QED
version of this theory by looking at various collider processes. In particular
we calculate modifications to Moller scattering, Bhabha scattering, e^+e^- -->
mu^+ mu^- and e^+e^- --> gamma gamma. We obtain bounds on the noncommutativity
scale from the existing experiments at LEP and make predictions for what may be
seen in future collider experiments.
","[{""version"":""v1"",""created"":""Tue, 20 May 2003 18:55:47 GMT""}]","2009-11-10"
"hep-ph/0305226","M. E. Carrington","P. Aurenche, M.E. Carrington and N. Marchal","Dileptons from hot heavy static photons","14 pages, 2 figures","Phys.Rev. D68 (2003) 056001","10.1103/PhysRevD.68.056001",,"hep-ph",,"  We compute the production rate of lepton pair by static photons at finite
temperature at two-loop order. We treat the infrared region of the gluon phase
space carefully by using a hard thermal loop gluon propagator. The result is
free of infrared and collinear divergences and exhibits an enhancement which
produces a result of order $\sim e^2 g^3$ instead of $\sim e^2 g^4$ as would be
expected from ordinary perturbation theory.
","[{""version"":""v1"",""created"":""Wed, 21 May 2003 15:25:07 GMT""}]","2009-11-10"
"hep-ph/0305227","Gilberto Tavares Velasco","M. A. Perez, G. Tavares-Velasco and J. J. Toscano","New physics effects in rare Z decays","16 pages, 4 figures, submitted to Int. J. Mod. Phys. A","Int.J.Mod.Phys. A19 (2004) 159-178","10.1142/S0217751X04017100",,"hep-ph",,"  Virtual effects induced by new physics in rare Z decays are reviewed. Since
the expected sensitivity of the giga-Z linear collider is of the order of
$10^{-8}$, we emphasize the importance of any new physics effect that gives a
prediction above this limit. It is also pointed out that an improvement on the
known experimental constraints on rare Z decays will provide us with a critical
test of the validity of the standard model at the loop level.
","[{""version"":""v1"",""created"":""Tue, 20 May 2003 23:26:20 GMT""}]","2009-11-10"
"hep-ph/0305228","Wenyu Wang","Y.L. Wu, Y.A. Yan, M. Zhong, Y.B. Zuo, W.Y. Wang","HQEFT as A Large Component QCD and Comments on The Incompleteness of
  HQET","11 pages, revtex, published version","Mod.Phys.Lett. A18 (2003) 1303-1316","10.1142/S0217732303011149",,"hep-ph",,"  The Heavy quark effective field theory (HQEFT) is revisited in a more
intuitive way. It is shown that HQEFT is a consistent large component QCD of
heavy quarks. In the non-relativistic limit, HQEFT recovers the
non-relativistic QCD (NRQCD). The resulting new effects in the HQEFT of QCD are
carefully reexamined. It is then natural to come to the comments on the usual
heavy quark effective theory (HQET). Consistent phenomenological applications
of HQEFT exhibit its interesting features and completeness in comparison with
HQET. It then becomes manifest why we shall base on the HQEFT of QCD rather
than HQET which is an incomplete one for computing 1/m_Q corrections. More
precise extraction for |V_{cb}| and |V_{ub}| in the HQEFT of QCD is emphasized.
","[{""version"":""v1"",""created"":""Wed, 21 May 2003 07:53:54 GMT""}]","2016-09-06"
"hep-ph/0305229","Domenico Falcone","D. Falcone","Inverting the seesaw formula","12 pages, RevTex4. Few corrections and one reference added","Phys.Rev. D68 (2003) 033002","10.1103/PhysRevD.68.033002","DSF-16/2003","hep-ph",,"  By inverting the seesaw formula we determine the heavy neutrino mass matrix.
The impact on the baryogenesis via leptogenesis and the radiative lepton decays
in supersymmetric models is described. Links to neutrinoless double beta decay
are also briefly discussed. The analysis leads to two distinct matrix models.
One has small mixings while the other has one maximal mixing. Both cannot give
a sufficient amount of baryon asymmetry. Then we also comment on a different
form of the Dirac neutrino mass matrix, which does provide sufficient baryon
asymmetry. In a supersymmetric scenario the branching ratios of radiative
lepton decays are enhanced for this model.
","[{""version"":""v1"",""created"":""Wed, 21 May 2003 10:28:36 GMT""},{""version"":""v2"",""created"":""Wed, 28 May 2003 08:48:00 GMT""}]","2009-11-10"
"hep-ph/0305230","Ralf Hofmann","R. Hofmann, F. Paccetti Correia, M. G. Schmidt, Z. Tavartkiladze","Supersymmetric Models For Gauge Inflation","LaTeX, 16 pages, typos corrected and refs. added","Nucl.Phys.B668:151-166,2003","10.1016/S0550-3213(03)00574-1","HD-THEP-03-24","hep-ph astro-ph hep-th",,"  We present possible realizations of gauge inflation arising from a 5D ${\cal
N}=1$ supersymmetric U(1) model, where the extra dimension is compactified on a
circle. A one-loop inflaton effective 4D potential is generated, with the
inflaton being a 'Wilson-line field'. It relies on a SUSY breaking. We first
consider SUSY breaking to occur spontaneously within a 'no-scale' model by a
non zero $F$-term of the radion superfield which transmits SUSY breaking into
the 'visible' sector. As an alternative, we study $D$-term SUSY breaking
originating directly from the 5D gauge supermultiplet. Together with the usual
KK resummation method, we present a calculation with the world-line formalism.
The latter allows one to get the resulting effective potential directly as a
sum over all winding modes. For both presented scenarios, the generated
effective potentials have suitable forms for realizing successful inflation,
i.e. are flat enough and give the needed number of ${\rm e}$-foldings. In
addition, there is a natural way to get strongly suppressed values for the
potentials, which then could be associated with dark energy/quintessence.
","[{""version"":""v1"",""created"":""Wed, 21 May 2003 15:18:46 GMT""},{""version"":""v2"",""created"":""Wed, 28 May 2003 13:09:32 GMT""},{""version"":""v3"",""created"":""Mon, 28 Jul 2003 16:50:36 GMT""}]","2008-11-26"
"hep-ph/0305231","Marc Vanderhaeghen","P.A.M. Guichon, L. Moss\'e, M. Vanderhaeghen","Pion production in deeply virtual Compton scattering","50 pages, 22 figures","Phys.Rev. D68 (2003) 034018","10.1103/PhysRevD.68.034018","preprint DAPNIA-03-98, preprint MKPH-T-03-08","hep-ph",,"  Using a soft pion theorem based on chiral symmetry and a $\Delta(1232)$
resonance model we propose an estimate for the production cross section of low
energy pions in the deeply virtual Compton scattering (DVCS) process. In
particular, we express the $e p \to e \gamma \pi N$ processes in terms of
generalized parton distributions. We provide estimates of the contamination of
the $e p \to e \gamma p$ DVCS observables due to this associated pion
production processes when the experimental data are not fully exclusive, for a
set of kinematical conditions representative of present or planned experiments
at JLab, HERMES and COMPASS.
","[{""version"":""v1"",""created"":""Wed, 21 May 2003 14:51:47 GMT""}]","2016-09-06"
"hep-ph/0305232","Robert Appleby","R.B. Appleby and G.P. Salam","Theory and phenomenology of non-global logarithms","Based on talks presented at the XXXVIIIth Rencontres de Moriond 'QCD
  and high-energy hadronic interactions', 8 pages",,,"MC-TH-2003-5, LPTHE-P03-0","hep-ph",,"  We discuss the theoretical treatment of non-global observables, those
quantities that are sensitive only to radiation in a restricted region of phase
space, and describe how large `non-global' logarithms arise when we veto the
energy flowing into the restricted region. The phenomenological impact of
non-global logarithms is then discussed, drawing on examples from event shapes
in DIS and energy-flow observables in 2-jet systems. We then describe
techniques to reduce the numerical importance of non-global logarithms, looking
at clustering algorithms in energy flow observables and the study of associated
distribution of multiple observables.
","[{""version"":""v1"",""created"":""Wed, 21 May 2003 14:55:24 GMT""}]","2007-05-23"
"hep-th/0305169","Markus A. Luty","I.L. Buchbinder, S. James Gates Jr., Hock-Seng Goh, W.D. Linch III,
  Markus A. Luty, Siew-Phang Ng, J. Phillips","Supergravity loop contributions to brane world supersymmetry breaking","12 pages, LaTeX 2e","Phys.Rev.D70:025008,2004","10.1103/PhysRevD.70.025008","UMD-PP-03-008","hep-th hep-ph",,"  We compute the supergravity loop contributions to the visible sector scalar
masses in the simplest 5D `brane-world' model. Supersymmetry is assumed to be
broken away from the visible brane and the contributions are UV finite due to
5D locality. We perform the calculation with N = 1 supergraphs, using a
formulation of 5D supergravity in terms of N = 1 superfields. We compute
contributions to the 4D effective action that determine the visible scalar
masses, and we find that the mass-squared terms are negative.
","[{""version"":""v1"",""created"":""Tue, 20 May 2003 16:22:24 GMT""}]","2008-11-26"
"hep-th/0305177","Neil Constable","Neil R. Constable and Finn Larsen","The Rolling Tachyon as a Matrix Model","22pages. 3 figures. v2: added reference, fixed minor typos","JHEP 0306 (2003) 017","10.1088/1126-6708/2003/06/017",,"hep-th",,"  We express all correlation functions in timelike boundary Liouville theory as
unitary matrix integrals and develop efficient techniques to evaluate these
integrals. We compute large classes of correlation functions explicitly,
including an infinite number of terms in the boundary state of the rolling
tachyon. The matrix integrals arising here also determine the correlation
functions of gauge invariant operators in two dimensional Yang-Mills theory,
suggesting an equivalence between the rolling tachyon and QCD_2.
","[{""version"":""v1"",""created"":""Tue, 20 May 2003 17:32:00 GMT""},{""version"":""v2"",""created"":""Fri, 13 Jun 2003 19:36:42 GMT""}]","2009-11-10"
"hep-th/0305179","Alex Buchel","Alex Buchel and Leopoldo A. Pando Zayas","Hagedorn vs. Hawking-Page transition in string theory","19 pages, 4 figures; v2: refs added; v3: more refs added","Phys.Rev. D68 (2003) 066012","10.1103/PhysRevD.68.066012","MCTP-03-27","hep-th",,"  We study the supergravity dual to the confinement/deconfinement phase
transition for the N=4 SU(N) SYM on R x S^3 with a chemical potential conjugate
to a U(1)\subset SO(6)_R charge. The appropriate supergravity system is a
single charge black hole in D=5 N=8 gauged supergravity. Application of the
gauge/string theory holographic renormalization approach leads to new
expressions for the black hole ADM mass and its generalized free energy. We
comment on the relation of this phase transition to the Hagedorn transition for
strings in the maximally supersymmetric plane wave background with null RR five
form field strength.
","[{""version"":""v1"",""created"":""Tue, 20 May 2003 18:38:52 GMT""},{""version"":""v2"",""created"":""Tue, 27 May 2003 18:38:55 GMT""},{""version"":""v3"",""created"":""Tue, 22 Jul 2003 16:32:16 GMT""}]","2009-11-10"
"hep-th/0305180","Eduardo Rodriguez S.","Patricio Salgado, Fernando Izaurieta and Eduardo Rodriguez","Higher dimensional gravity invariant under the AdS group","5 pages, no figures; final version to appear in Phys. Lett. B","Phys.Lett.B574:283-288,2003","10.1016/j.physletb.2003.09.021",,"hep-th",,"  A higher dimensional gravity invariant both under local Lorentz rotations and
under local Anti de Sitter boosts is constructed. It is shown that such a
construction is possible both when odd dimensions and when even dimensions are
considered. It is also proved that such actions have the same coefficients as
those obtained by Troncoso and Zanelli.
","[{""version"":""v1"",""created"":""Tue, 20 May 2003 16:13:12 GMT""},{""version"":""v2"",""created"":""Fri, 5 Sep 2003 12:58:05 GMT""}]","2008-11-26"
"hep-th/0305181","Ruth Durrer","Ruth Durrer and Philippe Kocian","Testing braneworlds with the binary pulsar","13 pages no figures Published version. Appendix on gauge invariance
  of the used perturbation varables appended","Class.Quant.Grav. 21 (2004) 2127-2138","10.1088/0264-9381/21/8/015",,"hep-th astro-ph gr-qc",,"  In this letter we calculate the emission of gravity waves by the binary
pulsar in the framework of five dimensional braneworlds. We consider only
spacetimes with one compact extra-dimension. We show that the presence of
additional degrees of freedom, especially the 'gravi-scalar' leads to a
modification of Einstein's quadrupole formula. We compute the induced change
for the binary pulsar PSR 1913+16 where it amounts to about 20% which is by far
excluded by present experimental data.
","[{""version"":""v1"",""created"":""Tue, 20 May 2003 16:35:53 GMT""},{""version"":""v2"",""created"":""Fri, 30 Apr 2004 13:34:58 GMT""}]","2009-11-10"
"hep-th/0305182","Luciano Barosi","Luciano Barosi","Superstring Field Teory Action including Massless Fermions","5 pages. Talk at ""Renormalization Group and Anomalies in Gravity and
  Cosmology"", Ouro Preto, Brazil, March 17-23, 2003",,"10.1016/S0920-5632(03)02412-5",,"hep-th",,"  Using Berkovits' Superstring Filed Theory action including the Ramond sector,
we calculate the contribution to this action coming from the tachyon and
massless fermions from both $GSO$ sectors. Some features of the action are
discussed in the end, settling the ground for a more systematic treatment of
spacetime fermions in superstring field theory.
","[{""version"":""v1"",""created"":""Tue, 20 May 2003 17:28:54 GMT""}]","2009-11-10"
"hep-th/0305183","Marcus Berg","Marcus Berg, Michael Haack and Boris Kors","An Orientifold with Fluxes and Branes via T-duality","61 pages, v2: typos corrected, references added","Nucl.Phys. B669 (2003) 3-56","10.1016/j.nuclphysb.2003.07.008","SPIN-03/08, ITP-UU-03/14, MIT-CTP-3366, ROM2F/2003/06","hep-th",,"  String compactifications with non-abelian gauge fields localized on D-branes,
with background NSNS and RR 3-form fluxes, and with non-trivial warp factors,
can naturally exist within T-dual versions of type I string theory. We develop
a systematic procedure to construct the effective bosonic Lagrangian of type I
T-dualized along a six-torus, including the coupling to gauge multiplets on
D3-branes and the modifications due to 3-form fluxes. Looking for solutions to
the ten-dimensional equations of motion, we find warped products of Minkowski
space and Ricci-flat internal manifolds. Once the warp factor is neglected, the
resulting no-scale scalar potential of the effective four-dimensional theory
combines those known for 3-form fluxes and for internal Yang-Mills fields and
stabilizes many of the moduli. We perform an explicit comparison of our
expressions to those obtained from N=4 gauged supergravity and find agreement.
We also comment on the possibility to include D9-branes with world-volume gauge
fluxes in the background with 3-form fluxes.
","[{""version"":""v1"",""created"":""Tue, 20 May 2003 18:24:55 GMT""},{""version"":""v2"",""created"":""Mon, 11 Aug 2003 13:32:25 GMT""}]","2010-04-05"
"hep-th/0305184","Alessandro Strumia","Riccardo Rattazzi, Claudio A. Scrucca, Alessandro Strumia","Brane to brane gravity mediation of supersymmetry breaking","46 pages, 5 figures","Nucl.Phys.B674:171-216,2003","10.1016/j.nuclphysb.2003.09.034","CERN-TH/2003-079 and IFUP-TH/2003-3","hep-th hep-ph",,"  We extend the results of Mirabelli and Peskin to supergravity. We study the
compactification on S_1/Z_2 of Zucker's off-shell formulation of 5D
supergravity and its coupling to matter at the fixed points. We clarify some
issues related to the off-shell description of supersymmetry breaking a la
Scherk-Schwarz (here employed only as a technical tool) discussing how to deal
with singular gravitino wave functions.
  We then consider `visible' and `hidden' chiral superfields localized at the
two different fixed points and communicating only through 5D supergravity. We
compute the one-loop corrections that mix the two sectors and the radion
superfield. Locality in 5D ensures the calculability of these effects, which
transmit supersymmetry breaking from the hidden to the visible sector. In the
minimal set-up visible-sector scalars get a universal squared mass m_0^2 < 0.
In general (e.g. in presence of a sizable gravitational kinetic term localized
on the hidden brane) the radion-mediated contribution to m_0^2 can be positive
and dominant. Although we did not build a complete satisfactory model,
brane-to-brane effects can cure the tachyonic sleptons predicted by anomaly
mediation by adding a positive m_0^2 which is universal up to subleading
flavour-breaking corrections.
","[{""version"":""v1"",""created"":""Tue, 20 May 2003 19:34:16 GMT""}]","2009-10-09"
"hep-th/0305185","Akihiro Ishibashi","Akihiro Ishibashi (Univ. of Cambridge) and Hideo Kodama (Kyoto Univ.)","Stability of Higher-Dimensional Schwarzschild Black Holes","19 pages, 9 figures, references and comments on the generalised black
  hole case are added, minor changes in text, version to appear in PTP","Prog.Theor.Phys. 110 (2003) 901-919","10.1143/PTP.110.901",,"hep-th gr-qc",,"  We investigate the classical stability of the higher-dimensional
Schwarzschild black holes against linear perturbations, in the framework of a
gauge-invariant formalism for gravitational perturbations of maximally
symmetric black holes, recently developed by the authors. The perturbations are
classified into the tensor, vector, and scalar-type modes according to their
tensorial behaviour on the spherical section of the background metric, where
the last two modes correspond respectively to the axial- and the polar-mode in
the four-dimensional situation. We show that, for each mode of the
perturbations, the spatial derivative part of the master equation is a
positive, self-adjoint operator in the $L^2$-Hilbert space, hence that the
master equation for each tensorial type of perturbations does not admit
normalisable negative-modes which would describe unstable solutions.
  On the same Schwarzschild background, we also analyse the static perturbation
of the scalar mode, and show that there exists no static perturbation which is
regular everywhere outside the event horizon and well-behaved at spatial
infinity. This checks the uniqueness of the higher-dimensional spherically
symmetric, static, vacuum black hole, within the perturbation framework.
  Our strategy for the stability problem is also applicable to the other
higher-dimensional maximally symmetric black holes with non-vanishing
cosmological constant. We show that all possible types of maximally symmetric
black holes (thus, including the higher-dimensional Schwarzschild-de Sitter and
Schwarzschild-anti-de Sitter black holes) are stable against the tensor and the
vector perturbations.
","[{""version"":""v1"",""created"":""Tue, 20 May 2003 20:00:30 GMT""},{""version"":""v2"",""created"":""Tue, 3 Jun 2003 12:15:52 GMT""},{""version"":""v3"",""created"":""Thu, 23 Oct 2003 15:32:58 GMT""}]","2009-11-10"
"hep-th/0305186","Shoko Hayakawa","S. Hayakawa","Boundary Condition and the Cosmological Constant","9 pages, latex",,,"UT-03-17","hep-th hep-ph",,"  We discuss a model in which the boundary condition decides the four
dimensional cosmological constant. It is reviewed in a primitive way that
boundary conditions are required by the action principle.
","[{""version"":""v1"",""created"":""Wed, 21 May 2003 04:44:10 GMT""}]","2007-05-23"
"hep-th/0305187","Vyacheslav Rychkov","Vyacheslav S. Rychkov","Observers and Measurements in Noncommutative Spacetimes","10 pp; v2: equivalence of observers explicitely stated; v3: minor
  changes, references and remarks added, burst spreading with energy emphasized
  as a signature rather than noise","JCAP 0307 (2003) 006","10.1088/1475-7516/2003/07/006",,"hep-th astro-ph gr-qc quant-ph",,"  We propose a ""Copenhagen interpretation"" for spacetime noncommutativity. The
goal is to be able to predict results of simple experiments involving signal
propagation directly from commutation relations. A model predicting an energy
dependence of the speed of photons of the order E/E_Planck is discussed in
detail. Such effects can be detectable by the GLAST telescope, to be launched
in 2006.
","[{""version"":""v1"",""created"":""Wed, 21 May 2003 10:55:08 GMT""},{""version"":""v2"",""created"":""Sun, 25 May 2003 15:33:13 GMT""},{""version"":""v3"",""created"":""Tue, 24 Jun 2003 16:33:00 GMT""}]","2009-11-10"
"hep-th/0305188","Cecilia Albertsson","Cecilia Albertsson","Superconformal D-branes and moduli spaces","PhD thesis, LaTeX, 74 pages, 9 figures",,,,"hep-th",,"  This thesis first gives a background and review of the article
hep-th/0102038, where we substantiated a conjectured duality between two a
priori unrelated gauge theories, N=2 quiver theory and N=2 Seiberg-Witten
theory. These gauge theories have different realisations as the worldvolume
theories on different D-brane configurations. We showed that there is an
identity between the spaces of vacua (moduli spaces) arising in the two
theories, which suggests that the corresponding string theory pictures are
dual. Second, the thesis gives a background and description of the analysis
performed in the three articles hep-th/0111161, hep-th/0202069 and
hep-th/0304013, where we derived the most general, local, superconformal
boundary conditions of the two-dimensional nonlinear sigma model. This model
describes the dynamics of open strings, and the boundary conditions dictate the
geometry of D-branes. In the last article we studied these boundary conditions
for the special case of WZW models.
","[{""version"":""v1"",""created"":""Wed, 21 May 2003 11:54:25 GMT""}]","2007-05-23"
"hep-th/0305189","Rutger H. Boels","Rutger Boels, Jan de Boer, Robert Duivenvoorden and Jeroen Wijnhout","Factorization of Seiberg-Witten Curves and Compactification to Three
  Dimensions","laTeX, 14 pages, uses AMSmath","JHEP 0403 (2004) 010","10.1088/1126-6708/2004/03/010","ITFA-2003-25","hep-th",,"  We continue our study of nonperturbative superpotentials of four-dimensional
N=2 supersymmetric gauge theories with gauge group U(N) on R^3 x S^1, broken to
N=1 due to a classical superpotential. In a previous paper, hep-th/0304061, we
discussed how the low-energy quantum superpotential can be obtained by
substituting the Lax matrix of the underlying integrable system directly into
the classical superpotential. In this paper we prove algebraically that this
recipe yields the correct factorization of the Seiberg-Witten curves, which is
an important check of the conjecture. We will also give an independent proof
using the algebraic-geometrical interpretation of the underlying integrable
system.
","[{""version"":""v1"",""created"":""Wed, 21 May 2003 13:27:06 GMT""}]","2009-11-10"
