"math-ph/0301013","Mark Naber","Kathleen Cotrill-Shepherd and Mark Naber","Fractional Differential Forms","20 pages","J. Math. Phys. 42, 5, 2203, May (2001)","10.1063/1.1364688",,"math-ph math.DG math.MP",,"  A generalization of exterior calculus is considered by allowing the partial
derivatives in the exterior derivative to assume fractional orders. That is, a
fractional exterior derivative is defined. This is found to generate new vector
spaces of finite and infinite dimension, fractional differential form spaces.
The definitions of closed and exact forms are extended to the new fractional
form spaces with closure and integrability conditions worked out for a special
case. Coordinate transformation rules are also computed. The transformation
rules are different from those of the standard exterior calculus due to the
properties of the fractional derivative. The metric for the fractional form
spaces is given, based on the coordinate transformation rules. All results are
found to reduce to those of standard exterior calculus when the order of the
coordinate differentials is set to one.
","[{""version"":""v1"",""created"":""Fri, 10 Jan 2003 19:42:56 GMT""}]","2009-11-10"
"math/0301104","Richard Green","R.M. Green and J. Losonczy","Freely braided elements in Coxeter groups","18 pages, AMSTeX. Results renumbered to agree with published version","Annals of Combinatorics 6 (2002), 337-348",,,"math.CO math.GR",,"  We introduce a notion of ""freely braided element"" for simply laced Coxeter
groups. We show that an arbitrary group element $w$ has at most $2^{N(w)}$
commutation classes of reduced expressions, where $N(w)$ is a certain statistic
defined in terms of the positive roots made negative by $w$. This bound is
achieved if $w$ is freely braided. In the type $A$ setting, we show that the
bound is achieved only for freely braided $w$.
","[{""version"":""v1"",""created"":""Fri, 10 Jan 2003 17:32:41 GMT""},{""version"":""v2"",""created"":""Tue, 17 Jun 2003 10:31:44 GMT""}]","2007-05-23"
"math/0301105","Mironov","Z.Zakirova","Rigid 6-dimensional h-spaces of constant curvature","10 pages, LaTeX",,,,"math.DG",,"  In this paper, we continue studying the 6-dimensional pseudo-Riemannian space
V^6(g_{ij}) with signature [++--], which admits projective motions, i. e.
continuous transformation groups preserving geodesics. In particular, we
determine a necessary and sufficient condition that the 6-dimensional rigid
h-spaces have constant curvature.
","[{""version"":""v1"",""created"":""Fri, 10 Jan 2003 17:47:01 GMT""},{""version"":""v2"",""created"":""Sat, 11 Jan 2003 14:46:31 GMT""}]","2007-05-23"
"math/0301106","Lakhdar Hammoudi","Vesselin Drensky and Lakhdar Hammoudi","Combinatorics of words and semigroup algebras which are sums of locally
  nilpotent subalgebras","10 pages",,,,"math.RA math.CO",,"  We construct new examples of non-nil algebras with any number of generators,
which are direct sums of two locally nilpotent subalgebras. As all previously
known examples, our examples are contracted semigroup algebras and the
underlying semigroups are unions of locally nilpotent subsemigroups. In our
constructions we make more transparent than in the past the close relationship
between the considered problem and combinatorics of words.
","[{""version"":""v1"",""created"":""Fri, 10 Jan 2003 18:42:53 GMT""}]","2007-05-23"
"math/0301107","Vladimir V. Kisil","Dmitry S. Kalyuzhnyi-Verbovetzkii","On the Bessmertnyi Class of Homogeneous Positive Holomorphic Functions
  of Several Variables","LaTeX",,,,"math.FA",,"  The class of operator-valued functions which are homogeneous of degree one,
holomorphic in the open right polyhalfplane, have positive semidefinite real
parts there and take selfadjoint operator values at real points, and its
subclass consisting of functions representable in the form of Schur complement
of a block of a linear pencil of operators with positive semidefinite operator
coefficients, are investigated. The latter subclass is a generalization of the
class of characteristic matrix functions of passive 2n-poles considered as
functions of impedances of its elements, which was introduced by M. F.
Bessmertny\u\i. Several equivalent characterizations of the generalized
Bessmertny\u{\i} class are given, and its intimate connection with the
Agler--Schur class of holomorphic contractive operator-valued functions on the
unit polydisk is established.
","[{""version"":""v1"",""created"":""Fri, 10 Jan 2003 19:31:57 GMT""}]","2016-09-07"
"math/0301108","David Iglesias Ponte","D. Iglesias-Ponte, J.C. Marrero","Locally conformal symplectic groupoids","10 pages",,,,"math.DG math.SG",,"  Locally conformal symplectic (l.c.s.) groupoids are introduced as a
generalization of symplectic groupoids. We obtain some examples and we prove
that l.c.s. groupoids are examples of Jacobi groupoids in the sense of
\cite{IM}. Finally, we describe the Lie algebroid of a l.c.s. groupoid.
","[{""version"":""v1"",""created"":""Fri, 10 Jan 2003 19:44:55 GMT""}]","2007-05-23"
"math/0301109","Judith Beumer","Michael P. Friedlander (1) and Michael A Saunders (2) ((1) Argonne
  National Laboratory, (2) Stanford University)","A Globally Convergent LCL Method for Nonlinear Optimization","34 pages",,,"Preprint ANL/MCS-P1015-1202","math.OC",,"  For optimization problems with nonlinear constraints, linearly constrained
Lagrangian (LCL) methods sequentially minimize a Lagrangian function subject to
linearized constraints. These methods converge rapidly near a solution but may
not be reliable from arbitrary starting points. The well known example \MINOS\
has proven effective on many large problems. Its success motivates us to
propose a globally convergent variant. Our stabilized LCL method possesses two
important properties: the subproblems are always feasible, and they may be
solved inexactly. These features are present in \MINOS only as heuristics.
  The new algorithm has been implemented in \Matlab, with the option to use
either the \MINOS or \SNOPT Fortran codes to solve the linearly constrained
subproblems. Only first derivatives are required. We present numerical results
on a nonlinear subset of the \COPS, \CUTE, and HS test-problem sets, which
include many large examples. The results demonstrate the robustness and
efficiency of the stabilized LCL procedure.
","[{""version"":""v1"",""created"":""Fri, 10 Jan 2003 21:41:44 GMT""}]","2007-05-23"
"math/0301110","Alexander Postnikov","Alexander Postnikov, Boris Shapiro","Trees, parking functions, syzygies, and deformations of monomial ideals","33 pages; v2: appendix on sandpiles added, references added, typos
  corrected; v3: references added",,,,"math.CO math.AC",,"  For a graph G, we construct two algebras, whose dimensions are both equal to
the number of spanning trees of G. One of these algebras is the quotient of the
polynomial ring modulo certain monomial ideal, while the other is the quotient
of the polynomial ring modulo certain powers of linear forms. We describe the
set of monomials that forms a linear basis in each of these two algebras. The
basis elements correspond to G-parking functions that naturally came up in the
abelian sandpile model. These ideals are instances of the general class of
monotone monomial ideals and their deformations. We show that the Hilbert
series of a monotone monomial ideal is always bounded by the Hilbert series of
its deformation. Then we define an even more general class of monomial ideals
associated with posets and construct free resolutions for these ideals. In some
cases these resolutions coincide with Scarf resolutions. We prove several
formulas for Hilbert series of monotone monomial ideals and investigate when
they are equal to Hilbert series of deformations. In the appendix we discuss
the sandpile model.
","[{""version"":""v1"",""created"":""Sat, 11 Jan 2003 01:40:08 GMT""},{""version"":""v2"",""created"":""Sun, 2 Feb 2003 20:45:51 GMT""},{""version"":""v3"",""created"":""Fri, 14 Feb 2003 22:49:23 GMT""}]","2007-05-23"
"math/0301111","J. Maurice Rojas","J. Maurice Rojas","Dedekind Zeta Functions and the Complexity of Hilbert's Nullstellensatz","16 pages, no figures. Paper corresponds to a semi-plenary talk at
  FoCM 2002. This version corrects some minor typos and adds an
  acknowledgements section",,,,"math.NT math.AG",,"  Let HN denote the problem of determining whether a system of multivariate
polynomials with integer coefficients has a complex root. It has long been
known that HN in P implies P=NP and, thanks to recent work of Koiran, it is now
known that the truth of the Generalized Riemann Hypothesis (GRH) yields the
implication that HN not in NP implies P is not equal to NP. We show that the
assumption of GRH in the latter implication can be replaced by either of two
more plausible hypotheses from analytic number theory. The first is an
effective short interval Prime Ideal Theorem with explicit dependence on the
underlying field, while the second can be interpreted as a quantitative
statement on the higher moments of the zeroes of Dedekind zeta functions. In
particular, both assumptions can still hold even if GRH is false. We thus
obtain a new application of Dedekind zero estimates to computational algebraic
geometry. Along the way, we also apply recent explicit algebraic and analytic
estimates, some due to Silberman and Sombra, which may be of independent
interest.
","[{""version"":""v1"",""created"":""Sat, 11 Jan 2003 08:13:12 GMT""},{""version"":""v2"",""created"":""Tue, 14 Jan 2003 00:01:15 GMT""}]","2007-05-23"
"math/0301112","Ken Dykema","Ken Dykema and Uffe Haagerup","Invariant subspaces of the quasinilpotent DT-operator",,,,,"math.OA",,"  We previously introduced the class of DT--operators, which are modeled by
certain upper triangular random matrices, and showed that if the spectrum of a
DT-operator is not reduced to a single point, then it has a nontrivial, closed,
hyperinvariant subspace. In this paper, we prove that also every DT-operator
whose spectrum is concentrated on a single point has a nontrivial, closed,
hyperinvariant subspace. In fact, each such operator has a one-parameter family
of them. It follows that every DT-operator generates the von Neumann algebra
L(F_2) of the free group on two generators.
","[{""version"":""v1"",""created"":""Sat, 11 Jan 2003 11:33:31 GMT""}]","2007-05-23"
"math/0301113","R. A. Vitale","R.A. Vitale","Intrinsic L_p metrics for convex bodies",,,,,"math.MG",,"  Intrinsic $L_p$ metrics are defined and shown to satisfy a dimension--free
bound with respect to the Hausdorff metric.
","[{""version"":""v1"",""created"":""Sat, 11 Jan 2003 14:35:17 GMT""}]","2007-05-23"
"math/0301114","Bruno Martelli","Roberto Frigerio, Bruno Martelli and Carlo Petronio","Dehn filling of cusped hyperbolic 3-manifolds with geodesic boundary","28 pages, 16 figures","J. Differential Geom. 64 (2003) 425-455",,,"math.GT",,"  We define for each g>=2 and k>=0 a set M_{g,k} of orientable hyperbolic
3-manifolds with $k$ toric cusps and a connected totally geodesic boundary of
genus g. Manifolds in M_{g,k} have Matveev complexity g+k and Heegaard genus
g+1, and their homology, volume, and Turaev-Viro invariants depend only on g
and k. In addition, they do not contain closed essential surfaces. The
cardinality of M_{g,k} for a fixed k has growth type g^g. We completely
describe the non-hyperbolic Dehn fillings of each M in M_{g,k}, showing that,
on any cusp of any hyperbolic manifold obtained by partially filling M, there
are precisely 6 non-hyperbolic Dehn fillings: three contain essential discs,
and the other three contain essential annuli. This gives an infinite class of
large hyperbolic manifolds (in the sense of Wu) with boundary-reducible and
annular Dehn fillings having distance 2, and allows us to prove that the
corresponding upper bound found by Wu is sharp. If M has one cusp only, the
three boundary-reducible fillings are handlebodies.
","[{""version"":""v1"",""created"":""Sat, 11 Jan 2003 15:53:07 GMT""}]","2007-05-23"
"math/0301115","Zhengyu Mao","Ehud Moshe Baruch, Zhengyu Mao","Central value of automorphic $L-$functions",,,,,"math.NT math.RT",,"  We prove a generalization to the totally real field case of the Waldspurger's
formula relating the Fourier coefficient of a half integral weight form and the
central value of the L-function of an integral weight form. Our proof is based
on a new interpretation of Waldspurger's formula in terms of equality between
global distributions. As applications we generalize the Kohnen-Zagier formula
for holomorphic forms and prove the equivalence of the Ramanujan conjecture for
half integral weight forms and a case of the Lindelof hypothesis for integral
weight forms. We also study the Kohnen space in the adelic setting.
","[{""version"":""v1"",""created"":""Sat, 11 Jan 2003 15:55:37 GMT""}]","2007-05-23"
"nucl-ex/0301004","David W. Hertzog","David W. Hertzog","The Muon Anomalous Magnetic Moment and the Standard Model","Plenary Talk; PANIC'02 XVI Particles and Nuclear International
  Conference, Osaka, Japan; Sept. 30 - Oct. 4, 2002; Report describes the
  published 0.7 ppm result and updates the theory status","Nucl.Phys. A721 (2003) 161-170","10.1016/S0375-9474(03)01029-7",,"nucl-ex",,"  The muon anomalous magnetic moment measurement, when compared with theory,
can be used to test many extensions to the standard model. The most recent
measurement made by the Brookhaven E821 Collaboration reduces the uncertainty
on the world average of a_mu to 0.7 ppm, comparable in precision to theory.
This paper describes the experiment and the current theoretical efforts to
establish a correct standard model reference value for the muon anomaly.
","[{""version"":""v1"",""created"":""Fri, 10 Jan 2003 21:37:15 GMT""}]","2009-11-10"
"nucl-ex/0301005","Mike Lisa","Mike Lisa (for the STAR Collaboration)","Azimuthally-sensitive pion HBT at RHIC","presented at XXXII International Symposium on Multiparticle Dynamics
  (ISMD2002), Alushta, Ukraine; to appear in the proceedings",,"10.1142/9789812704962_0021",,"nucl-ex",,"  The STAR Collaboration has measured two-pion correlation functions versus
emission angle with respect to the event plane in non-central Au+Au collisions
at \sqrt{s_{NN}}=130, 200 GeV. In the context of a parameterized freezeout
scenario, the data suggest an out-of-plane freezeout geometry, and a rapid
system evolution to freezeout.
","[{""version"":""v1"",""created"":""Sat, 11 Jan 2003 03:46:51 GMT""}]","2019-08-14"
"nucl-th/0301037","Heath O'Connell","M. Benayoun, P. David, L. DelBuono, Ph. Leruste, H.B. O'Connell","The Pion Form Factor Within the Hidden Local Symmetry Model","26 pages, 4 eps figs","Eur.Phys.J.C29:397-411,2003","10.1140/epjc/s2003-01234-1","LPNHE-2002-10,FERMILAB-PUB-02-294","nucl-th hep-ph",,"  We analyze a pion form factor formulation which fulfills the Analyticity
requirement within the Hidden Local Symmetry (HLS) Model. We show that it
implies an $s$--dependent dressing of the $\rho-\gamma$ VMD coupling and an
account of several coupled channels. The corresponding function $F_\pi(s)$
provides nice fits of the pion form factor data from $s=-0.25$ to $s=1$
GeV$^2$. It is shown that the coupling to $K \bar{K}$ has little effects, while
$\omg \pi^0$ improves significantly the fit quality below the $\phi$ mass. All
parameters, except for the subtraction polynomial coefficients are fixed from
the rest of the HLS phenomenology. The fits show consistency with the expected
behaviour of $F_\pi(s)$ at $s=0$ up to ${\cal O} (s^2)$ and with the phase
shift data on $\delta_1^1(s)$ from threshold to somewhat above the $\phi$ mass.
The $\omg$ sector is also examined in relation with recent data from CMD--2.
","[{""version"":""v1"",""created"":""Fri, 10 Jan 2003 19:59:22 GMT""}]","2008-11-26"
"nucl-th/0301038","Frank Froemel","Frank Froemel, Horst Lenske, Ulrich Mosel","Short-Range Correlations in Nuclear Matter at Finite Temperatures and
  High Densities","revised and extended paper, 4 references added, 1 figure added, fixed
  error in Fig. 1; 16 pages, 7 figures; accepted for publication in NPA","Nucl.Phys. A723 (2003) 544-556","10.1016/S0375-9474(03)01364-2",,"nucl-th",,"  The density and temperature dependence of nucleonic single particle spectral
function in symmetric nuclear matter at finite temperatures and densities
beyond normal nuclear matter density is investigated in a model emphasizing
short-range correlations and phase space aspects. A simple but self-consistent
approach based on quantum transport theory is used. In particular we consider
the density and temperature regime occuring e.g. during the core collapse in a
supernova explosion and the subsequent formation of a neutron star. Mean-field
effects are incorporated by a Skyrme type potential.
","[{""version"":""v1"",""created"":""Fri, 10 Jan 2003 18:55:10 GMT""},{""version"":""v2"",""created"":""Wed, 2 Apr 2003 13:47:57 GMT""}]","2009-11-10"
"nucl-th/0301039","Bao-An Li","Bao-An Li","Probing the high-density behavior of nuclear symmetry energy with
  high-energy radioactive beams","Invited talk at the Int. Symposium on Phys. of Unstable Nuclei,
  Halong bay, Vietnam, Nov. 20-25, 2002. 6 pages to appear in the proceedings
  in Nucl. Phys. A (2003)","Nucl.Phys. A722 (2003) 209-214","10.1016/S0375-9474(03)01360-5",,"nucl-th nucl-ex",,"  Central collisions induced by high energy radioactive beams can be used as a
novel means to obtain crucial information about the high density ({\rm HD})
behaviour of nuclear symmetry energy. This information is critical for
understanding several key issues in astrophysics. Within an isospin-dependent
hadronic transport model using phenomenological equations of state ({\rm EOS})
for dense neutron-rich matter, we investigate several experimental probes of
the HD behavior of nuclear symmetry energy, such as, the $\pi^-$ to $\pi^+$
ratio, neutron-proton differential flow and its excitation function.
Measurements of these observables will provide the first terrestrial data to
constrain stringently the HD behaviour of nuclear symmetry energy and thus also
the {\rm EOS} of dense neutron-rich matter.
","[{""version"":""v1"",""created"":""Fri, 10 Jan 2003 21:19:21 GMT""}]","2009-11-10"
"nucl-th/0301040","Peter Tandy","Peter C. Tandy (Kent State University, USA)","Covariant QCD Modeling of Light Meson Physics","Presented at the International School on Nuclear Physics, 24th
  course: Quarks in Nuclei, Erice, Sicily, September 2002; to be published in
  Prog. Part. Nucl. Phys.; 6 pages, 6 figs","Prog.Part.Nucl.Phys. 50 (2003) 305-315","10.1016/S0146-6410(03)00024-3",,"nucl-th hep-ph",,"  We summarize recent progress in soft QCD modeling based on the set of
Dyson--Schwinger equations truncated to ladder-rainbow level. This covariant
approach to hadron physics accommodates quark confinement and implements the
QCD one-loop renormalization group behavior. We compare the dressed quark
propagator, pseudoscalar and vector meson masses as a function of quark mass,
and the rho -> pi pi coupling to recent lattice-QCD data. The error in the
Gell-Mann--Oakes--Renner relation with increasing quark mass is quantified by
comparison to the exact pseudoscalar mass relation as evaluated within the
ladder-rainbow Dyson-Schwinger model.
","[{""version"":""v1"",""created"":""Fri, 10 Jan 2003 22:48:23 GMT""}]","2009-11-10"
"nucl-th/0301041","Gerald A. Miller","Gerald A. Miller","Relativity, chiral symmetry, and the nucleon electromagnetic form
  factors","Text of talk presented at the conference Nuclear Dynamics: From
  Quarks to Nuclei",,,"NT@UW-02-34","nucl-th",,"  A relativistic interpretation for why the proton's $G_E/G_M$ falls and
$QF_2/F_1$ is approximately constant is presented. Reproducing the observed
$G_E^n$ mandates the inclusion of the effects of the pion cloud. The full
relativistic model with a pion cloud provides a good reproduction of all of the
nucleon electromagnetic form factors.
","[{""version"":""v1"",""created"":""Sat, 11 Jan 2003 01:09:15 GMT""}]","2007-05-23"
"physics/0301017","Thomas Bartsch","T. Bartsch","The Kustaanheimo-Stiefel transformation in geometric algebra",,"J. Phys. A 36, 6963 (2003)","10.1088/0305-4470/36/25/305",,"physics.class-ph",,"  The Kustaanheimo-Stiefel (KS) transformation maps the non-linear and singular
equations of motion of the three-dimensional Kepler problem to the linear and
regular equations of a four-dimensional harmonic oscillator. It is used
extensively in studies of the perturbed Kepler problem in celestial mechanics
and atomic physics. In contrast to the conventional matrix-based approach, the
formulation of the KS transformation in the language of geometric Clifford
algebra offers the advantages of a clearer geometrical interpretation and
greater computational simplicity. It is demonstrated that the geometric algebra
formalism can readily be used to derive a Lagrangian and Hamiltonian
description of the KS dynamics in arbitrary static electromagnetic fields. For
orbits starting at the Coulomb centre, initial conditions are derived and a
framework is set up that allows a discussion of the stability of these orbits.
","[{""version"":""v1"",""created"":""Fri, 10 Jan 2003 16:24:33 GMT""}]","2009-11-10"
"physics/0301018","Keang-Po Ho","Keang-Po Ho","Probability Density Function of Kerr Effect Phase Noise","20 pages, 5 figures","JOSA B, vol. 20, pp. 1875-1879, 2003",,,"physics.optics",,"  The probability density function of Kerr effect phase noise, often called the
Gordon-Mollenauer effect, is derived analytically. The Kerr effect phase noise
can be accurately modeled as the summation of a Gaussian random variable and a
noncentral chi-square random variable with two degrees of freedom. Using the
received intensity to correct for the phase noise, the residual Kerr effect
phase noise can be modeled as the summation of a Gaussian random variable and
the difference of two noncentral chi-square random variables with two degrees
of freedom. The residual phase noise can be approximated by Gaussian
distribution better than the Kerr effect phase noise without correction.
","[{""version"":""v1"",""created"":""Fri, 10 Jan 2003 23:15:32 GMT""}]","2007-05-23"
"physics/0301019","Octavio Miramontes","Gabriel Ramos-Fernandez, Jose Luis Mateos, Octavio Miramontes,
  Germinal Cocho, Hernan Larralde and Barbara Ayala-Orozco","Levy walk patterns in the foraging movements of spider monkeys (Ateles
  geoffroyi)","25 pages, 7 figures, original research",,,,"physics.bio-ph physics.data-an q-bio",,"  Scale invariant patterns have been found in different biological systems, in
many cases resembling what physicists have found in other nonbiological
systems. Here we describe the foraging patterns of free-ranging spider monkeys
(Ateles geoffroyi) in the forest of the Yucatan Peninsula, Mexico and find that
these patterns resemble what physicists know as Levy walks. First, the length
of a trajectory s constituent steps, or continuous moves in the same direction,
is best described by a power-law distribution in which the frequency of ever
larger steps decreases as a negative power function of their length. The rate
of this decrease is very close to that predicted by a previous analytical Levy
walk model to be an optimal strategy to search for scarce resources distributed
at random Viswanathan et al 1999). Second, the frequency distribution of the
duration of stops or waiting times also approximates a power-law function.
Finally, the mean square displacement during the monkeys first foraging trip
increases more rapidly than would be expected from a random walk with constant
step length, but within the range predicted for Levy walks. In view of these
results, we analyze the different exponents characterizing the trajectories
described by females and males, and by monkeys on their own or when part of a
subgroup. We discuss the origin of these patterns and their implications for
the foraging ecology of spider monkeys.
","[{""version"":""v1"",""created"":""Fri, 10 Jan 2003 23:58:15 GMT""}]","2007-05-23"
"quant-ph/0301039","Bassano Vacchini","Bassano Vacchini","Master-equations for the study of decoherence","10 pages, latex, no figures, to appear in Int. J. Theor. Phys","Int. J. Theor. Phys. 44 (2005) 1011-1021","10.1007/s10773-005-7077-4",,"quant-ph",,"  Different structures of master-equation used for the description of
decoherence of a microsystem interacting through collisions with a surrounding
environment are considered and compared. These results are connected to the
general expression of the generator of a quantum dynamical semigroup in
presence of translation invariance recently found by Holevo.
","[{""version"":""v1"",""created"":""Fri, 10 Jan 2003 17:43:55 GMT""},{""version"":""v2"",""created"":""Wed, 25 Jun 2003 17:37:19 GMT""},{""version"":""v3"",""created"":""Thu, 24 Jul 2003 12:27:49 GMT""}]","2007-05-23"
"quant-ph/0301043","Arleta Szkola","Igor Bjelakovic, Arleta Szkola","The Data Compression Theorem for Ergodic Quantum Information Sources","14 pages",,,,"quant-ph",,"  We extend the data compression theorem to the case of ergodic quantum
information sources. Moreover, we provide an asymptotically optimal compression
scheme which is based on the concept of high probability subspaces. The rate of
this compression scheme is equal to the von Neumann entropy rate.
","[{""version"":""v1"",""created"":""Fri, 10 Jan 2003 17:30:14 GMT""}]","2007-05-23"
