"cond-mat/0301164","Christian Hess","C. Hess, B. B\""uchner, U. Ammerahl, L. Colonescu, F. Heidrich-Meisner,
  W. Brenig, A. Revcolevschi","Magnon Heat Transport in doped $\rm La_2CuO_4$","4 pages, 3 figures","Phys. Rev. Lett. 90, 197002 (2003)","10.1103/PhysRevLett.90.197002",,"cond-mat.str-el",,"  We present results of the thermal conductivity of $\rm La_2CuO_4$ and $\rm
La_{1.8}Eu_{0.2}CuO_4$ single-crystals which represent model systems for the
two-dimensional spin-1/2 Heisenberg antiferromagnet on a square lattice. We
find large anisotropies of the thermal conductivity, which are explained in
terms of two-dimensional heat conduction by magnons within the CuO$_2$ planes.
Non-magnetic Zn substituted for Cu gradually suppresses this magnon thermal
conductivity $\kappa_{\mathrm{mag}}$. A semiclassical analysis of
$\kappa_{\mathrm{mag}}$ is shown to yield a magnon mean free path which scales
linearly with the reciprocal concentration of Zn-ions.
","[{""version"":""v1"",""created"":""Fri, 10 Jan 2003 23:59:24 GMT""},{""version"":""v2"",""created"":""Wed, 14 May 2003 08:39:49 GMT""}]","2016-08-16"
"cond-mat/0301165","Jun Zhu","J. Zhu, H. L. Stormer, L. N. Pfeiffer, K. W. Baldwin and K. W. West","Spin Susceptibility of an Ultra-Low Density Two Dimensional Electron
  System","5 pages, 2 eps figures, to appear in PRL",,"10.1103/PhysRevLett.90.056805",,"cond-mat.mes-hall",,"  We determine the spin susceptibility in a two dimensional electron system in
GaAs/AlGaAs over a wide range of low densities from 2$\times10^{9}$cm$^{-2}$ to
4$\times10^{10}$cm$^{-2}$. Our data can be fitted to an equation that describes
the density dependence as well as the polarization dependence of the spin
susceptibility. It can account for the anomalous g-factors reported recently in
GaAs electron and hole systems. The paramagnetic spin susceptibility increases
with decreasing density as expected from theoretical calculations.
","[{""version"":""v1"",""created"":""Sat, 11 Jan 2003 01:58:44 GMT""}]","2009-11-10"
"cond-mat/0301166","Premi Chandra","Michal Rokni and Premala Chandra","A Dynamical Study of the Quantum p=2 Spherical Model","13 pages, 4 figures; published version","Phys. Rev. B 69, 094403 (2004)","10.1103/PhysRevB.69.094403",,"cond-mat.dis-nn",,"  We present a dynamical study of the disordered quantum p=2 spherical model at
long times. Its phase behavior as a function of spin-bath coupling, strength of
quantum fluctuations and temperature is characterized, and we identify
different paramagnetic and coarsened regions. A quantum critical point at zero
temperature in the limit of vanishing dissipation is also found. Furthermore we
show analytically that the fluctuation-dissipation theorem is obeyed in the
stationary regime.
","[{""version"":""v1"",""created"":""Sat, 11 Jan 2003 03:39:26 GMT""},{""version"":""v2"",""created"":""Sun, 21 Mar 2004 06:02:04 GMT""}]","2009-11-10"
"cond-mat/0301167","Miguel A. Cazalilla","M. A. Cazalilla","One-dimensional optical lattices and impenetrable bosons","4 pages. Version accepted for publication in Phys. Rev. A; title
  changed","Physical Review A 67, 053606 (2003).","10.1103/PhysRevA.67.053606",,"cond-mat.mes-hall cond-mat.stat-mech",,"  We study the limit of large onsite repulsion of the one-dimensional
Bose-Hubbard model at low densities, and derive a strong-coupling effective
Hamiltonian. By taking the lattice parameter to zero, the Hamiltonian becomes a
continuum model of fermions with attractive interactions. The leading
corrections to the internal energy of a hard-core-boson (Tonks) gas as well as
the (finite temperature) pair correlations of a strongly interacting Bose gas
are calculated. We explore the possibility of realizing, in an optical lattice,
a Luttinger liquid with stronger density correlations than the Tonks gas. A
quantum phase transition to a charge-density-wave Mott insulator is also
discussed.
","[{""version"":""v1"",""created"":""Sat, 11 Jan 2003 13:36:03 GMT""},{""version"":""v2"",""created"":""Mon, 20 Jan 2003 16:18:29 GMT""},{""version"":""v3"",""created"":""Wed, 9 Apr 2003 14:26:50 GMT""}]","2009-11-10"
"gr-qc/0301040","Luca Lusanna","Luca Lusanna (INFN, Firenze) and Massimo Pauri (Univ. Parma)","General Covariance and the Objectivity of Space-Time Point-Events: The
  Physical Role of Gravitational and Gauge Degrees of Freedom in General
  Relativity","87 pages, latex",,,,"gr-qc astro-ph hep-th",,"  (Abridged Abstract) This paper deals with a number of technical achievements
that are instrumental for a dis-solution of the so-called {\it Hole Argument}
in general relativity. The work is carried through in metric gravity for the
class of Christoudoulou-Klainermann space-times, in which the temporal
evolution is ruled by the {\it weak} ADM energy. The main results of the
investigation are the following: 1) A re-interpretation of {\it active}
diffeomorphisms as {\it passive and metric-dependent} dynamical symmetries of
Einstein's equations, a re-interpretation that discloses their (up to now
unknown) connection to gauge transformations on-shell; understanding such
connection also enlightens the real content of the {\it Hole Argument}. 2) The
utilization of Bergmann-Komar {\it intrinsic coordinates} for a peculiar
gauge-fixing to the superhamiltonian and supermomentum constraints which
embodies on shell a {\it physical individuation} of the mathematical points of
$M^4$ as point-events in terms of the non-local intrinsic degrees of freedom of
the gravitational field (Dirac observables). 3) A clarification of the notion
of {\it Bergmann observable} that leads to a main conjecture asserting the
existence of i) special Dirac observables which are also Bergmann observables;
ii) tensorial (scalar) gauge variables.
","[{""version"":""v1"",""created"":""Fri, 10 Jan 2003 16:55:06 GMT""}]","2007-05-23"
"gr-qc/0301041","Muhammed Sharif","M. Sharif and Sehar Aziz","Classification of Spherically Symmetric Static Spacetimes according to
  their Matter Collineations","15 pages, no figure, Latex","Gen.Rel.Grav.35:1093-1106,2003","10.1023/A:1024073002648",,"gr-qc",,"  The spherically symmetric static spacetimes are classified according to their
matter collineations. These are studied when the energy-momentum tensor is
degenerate and also when it is non-degenerate. We have found a case where the
energy-momentum tensor is degenerate but the group of matter collineations is
finite. For the non-degenerate case, we obtain either {\it four}, {\it five},
{\it six} or {\it ten} independent matter collineations in which four are
isometries and the rest are proper. We conclude that the matter collineations
coincide with the Ricci collineations but the constraint equations are
different which on solving can provide physically interesting cosmological
solutions.
","[{""version"":""v1"",""created"":""Fri, 10 Jan 2003 17:29:02 GMT""}]","2008-11-26"
"gr-qc/0301042","Anthony N. Aguirre","Anthony Aguirre, Steven Gratton","Inflation without a beginning: a null boundary proposal","Minor revisions to match published version; 18 pages, 5 postscript
  figures","Phys.Rev. D67 (2003) 083515","10.1103/PhysRevD.67.083515",,"gr-qc astro-ph hep-th",,"  We develop our recent suggestion that inflation may be made past eternal, so
that there is no initial cosmological singularity or ""beginning of time"".
Inflation with multiple vacua generically approaches a steady-state statistical
distribution of regions at these vacua, and our model follows directly from
making this distribution hold at all times. We find that this corresponds (at
the semi-classical level) to particularly simple cosmological boundary
conditions on an infinite null surface near which the spacetime looks de
Sitter. The model admits an interesting arrow of time that is well-defined and
consistent for all physical observers that can communicate, even while the
statistical description of the entire universe admits a symmetry that includes
time-reversal. Our model suggests, but does not require, the identification of
antipodal points on the manifold. The resulting ""elliptic"" de Sitter spacetime
has interesting classical and quantum properties. The proposal may be
generalized to other inflationary potentials, or to boundary conditions that
give semi-eternal but non-singular cosmologies.
","[{""version"":""v1"",""created"":""Fri, 10 Jan 2003 17:42:50 GMT""},{""version"":""v2"",""created"":""Fri, 28 Mar 2003 15:11:43 GMT""}]","2009-11-10"
"hep-lat/0301010","Maxim Chernodub","M.N. Chernodub, E.-M. Ilgenfritz and A. Schiller","Confinement, deconfinement and the photon propagator in 3D cQED on the
  lattice","3 pages, 4 figures, talk presented by A.S. at 5th International
  Conference on Quark Confinement and the Hadron Spectrum, Gargnano, Italy,
  10-14 Sep 2002",,"10.1142/9789812704269_0026","LU-ITP 2003/001, KANAZAWA-03-03, ITEP-LAT/2003-01, HU-EP-02-61","hep-lat",,"  We report on a lattice study of the gauge boson propagator of 3D compact QED
in Landau gauge at zero and finite temperature. Non-perturbative effects are
reflected by the generation of a mass m and by an anomalous dimension alpha.
These effects can be attributed to monopoles and are absent in the propagator
of the regular part of the gauge field.
","[{""version"":""v1"",""created"":""Fri, 10 Jan 2003 21:50:25 GMT""}]","2017-08-23"
"hep-ph/0301066","Olga Voskresenskaya","Alexander Tarasov and Olga Voskresenskaya","A quantum-kinetic treatment for internal dynamics of multilevel atomic
  systems moving through a target matter","Talk given at International Workshop on Hadronic Atoms ""HadAtom03"",
  Trento, Italy, October 13-17, 2003; 7 pages, LaTeX; references and comments
  added",,,"ArXiv:hep-ph/0401204","hep-ph nucl-th","http://arxiv.org/licenses/nonexclusive-distrib/1.0/","  The quantum mechanical consideration of a passage of relativistic elementary
atoms (EA) through a target matter is given. A set of quantum-kinetic equations
for the density matrix elements describing their internal state evolution at EA
rest frame is derived.
","[{""version"":""v1"",""created"":""Fri, 10 Jan 2003 16:08:21 GMT""},{""version"":""v2"",""created"":""Fri, 17 Jan 2003 15:08:35 GMT""},{""version"":""v3"",""created"":""Wed, 5 Mar 2003 18:29:35 GMT""},{""version"":""v4"",""created"":""Thu, 28 Jul 2011 19:23:45 GMT""}]","2011-07-29"
"hep-ph/0301067","Fritz W. Bopp","Fritz W. Bopp and Johannes Ranft","Charge Fluctuation in Heavy Ion Collisions","6 pages, 5 figures, Talk given at the Symposium on Multiparticle
  Dynamics, Alushta, Ukraine, Sept. 2002",,"10.1142/9789812704962_0007","SI-2002-05","hep-ph",,"  Charge fluctuations observed in early fixed-target proton-proton experiments
are consistent with string models. In central heavy ion events the picture can
change in two ways: strings can interact and find new ways to hadronize or they
can be effectively inactivated to lose their dynamical role as ordering
mechanism. Widely different charge fluctuations can be expected. The dispersion
of the charges in a central rapidity box is an advantageous measure. In an
explicit Dual-Parton-Model calculation using the DPMJET code and a randomized
modification to simulated charge equilibrium, various energies and different
nuclear sizes were considered. Local fluctuations were found to be a serious
problem. However, for large enough detection regions charged particle
fluctuations can provide a clear signal reflecting the basic dynamics of
central heavy ion processes.
","[{""version"":""v1"",""created"":""Fri, 10 Jan 2003 17:30:19 GMT""}]","2017-08-23"
"hep-ph/0301068","Michael Trusov","R. B. Nevzorov, K. A. Ter-Martirosyan, and M. A. Trusov","Renormalization of coupling constants in the minimal SUSY models","27 pages, 10 figures, LaTeX 2e. Talk presented by R.B.Nevzorov at the
  International Workshop ""What comes beyond the Standard Model"", Bled,
  Slovenia, July 2000",,,,"hep-ph",,"  The considerable part of the parameter space in the MSSM corresponding to the
infrared quasi fixed point scenario is excluded by LEP II bounds on the
lightest Higgs boson mass. In the NMSSM the mass of the lightest Higgs boson
reaches its maximum value in the strong Yukawa coupling limit when Yukawa
couplings are essentially larger than gauge ones at the Grand Unification
scale. In this case the renormalization group flow of Yukawa couplings and soft
SUSY breaking terms is investigated. The quasi-fixed and invariant lines and
surfaces are briefly discussed. The coordinates of the quasi-fixed points,
where all solutions are concentrated, are given.
","[{""version"":""v1"",""created"":""Fri, 10 Jan 2003 17:42:38 GMT""}]","2007-05-23"
"hep-ph/0301069","David A. Kosower","David A. Kosower","All-Orders Singular Emission in Gauge Theories","5 pages, 1 figure","Phys.Rev.Lett. 91 (2003) 061602","10.1103/PhysRevLett.91.061602","SPhT-T02/183","hep-ph",,"  I present a class of functions unifying all singular limits for the emission
of soft or collinear gluons in gauge-theory amplitudes at any order in
perturbation theory. Each function is a generalization of the antenna functions
of ref. [1]. The helicity-summed interferences these functions are thereby also
generalizations to higher orders of the Catani--Seymour dipole factorization
function.
","[{""version"":""v1"",""created"":""Fri, 10 Jan 2003 17:53:29 GMT""}]","2009-11-10"
"hep-ph/0301070","Rahul Malhotra","Rahul Malhotra and Duane A. Dicus","Z -> b b-bar b b-bar in the light gluino and light sbottom scenario","minor tex error, citation corrected in version2, to appear in Phys.
  Rev. D","Phys.Rev.D67:097703,2003","10.1103/PhysRevD.67.097703","UTEXAS-HEP-156","hep-ph",,"  The light gluino (12 - 16 GeV) and light sbottom (2 - 6 GeV) scenario has
been used to explain the apparent overproduction of b-quarks at the Tevatron.
This scenario also predicts the decay Z -> b b-bar ~g ~g where the gluinos
subsequently decay into b-quarks and sbottoms. We show that this can contribute
to the width Gamma_4b = Gamma(Z -> b b-bar b b-bar) since most of the sbottoms
and b-quarks arising from gluino decay have a small angular separation. We find
that while no excess in Gamma_4b is observable due to large uncertainties in
experimental measurements, the ratio Gamma(Z -> b b-bar ~g ~g)/Gamma(Z -> b
b-bar b b-bar) can be large due to sensitivity to b-quark mass, the sbottom
mixing angle and the gluino mass. We calculate it to be in the range 0.05 -
0.41 inclusive of the entire parameter space.
","[{""version"":""v1"",""created"":""Fri, 10 Jan 2003 19:03:58 GMT""},{""version"":""v2"",""created"":""Wed, 26 Mar 2003 22:33:18 GMT""},{""version"":""v3"",""created"":""Wed, 2 Apr 2003 19:21:14 GMT""}]","2011-01-27"
"hep-ph/0301071","Supratim Sengupta","Supratim Sengupta, F.C. Khanna and Sang Pyo Kim","Nonequilibrium Evolution of Correlation Functions: A Canonical Approach","Revtex, 32 pages; substantial new material dealing with
  non-equilibrium evolution beyond Hartree approx. based on the LvN formalism,
  has been added","Phys.Rev. D68 (2003) 105014","10.1103/PhysRevD.68.105014",,"hep-ph",,"  We study nonequilibrium evolution in a self-interacting quantum field theory
invariant under space translation only by using a canonical approach based on
the recently developed Liouville-von Neumann formalism. The method is first
used to obtain the correlation functions both in and beyond the Hartree
approximation, for the quantum mechanical analog of the $\phi^{4}$ model. The
technique involves representing the Hamiltonian in a Fock basis of annihilation
and creation operators. By separating it into a solvable Gaussian part
involving quadratic terms and a perturbation of quartic terms, it is possible
to find the improved vacuum state to any desired order. The correlation
functions for the field theory are then investigated in the Hartree
approximation and those beyond the Hartree approximation are obtained by
finding the improved vacuum state corrected up to ${\cal O}(\lambda^2)$. These
correlation functions take into account next-to-leading and
next-to-next-to-leading order effects in the coupling constant. We also use the
Heisenberg formalism to obtain the time evolution equations for the equal-time,
connected correlation functions beyond the leading order. These equations are
derived by including the connected 4-point functions in the hierarchy. The
resulting coupled set of equations form a part of infinite hierarchy of coupled
equations relating the various connected n-point functions. The connection with
other approaches based on the path integral formalism is established and the
physical implications of the set of equations are discussed with particular
emphasis on thermalization.
","[{""version"":""v1"",""created"":""Fri, 10 Jan 2003 19:41:12 GMT""},{""version"":""v2"",""created"":""Tue, 14 Jan 2003 19:55:14 GMT""},{""version"":""v3"",""created"":""Wed, 5 Mar 2003 22:09:32 GMT""},{""version"":""v4"",""created"":""Tue, 19 Aug 2003 23:59:17 GMT""}]","2009-11-10"
"hep-ph/0301072","A. B. Balantekin","A.B. Balantekin and H. Yuksel (Wisconsin U., Madison)","Global Analysis of Solar Neutrino and KamLAND Data","17 pages of REVTEX, 6 figures; several typos are corrected","J.Phys.G29:665-682,2003","10.1088/0954-3899/29/4/305",,"hep-ph nucl-th",,"  A global analysis of the data from all the solar neutrino experiments
combined with the recent KamLAND data is presented. A formula frequently used
in the literature gives survival probability for three active solar neutrino
flavors in terms of a suitably-modified two-flavor survival probability.
Corrections to this formula, which depend on $\theta_{13}$ and $\delta
m_{31}^2$, are calculated. For the mass scale suggested by the atmospheric
neutrino experiments the contributions of $\delta m_{31}^2$ to these
corrections is found to be negligible. The role of $\theta_{13}$ in solar
neutrino physics is elaborated. For electron neutrino oscillations into another
active flavor, we find best fit values of $\tan^2 \theta_{12} \sim 0.46$,
$\tan^2 \theta_{13} \sim 0$, and $\delta m_{21}^2 \sim 7.1 \times 10^{-5}$
eV$^2$. It is found that the combined solar neutrino and KamLAND date provide
the limit $\cos^4 \theta_{13} < 0.8$ at the 90 % confidence level.
","[{""version"":""v1"",""created"":""Fri, 10 Jan 2003 20:17:38 GMT""},{""version"":""v2"",""created"":""Mon, 13 Jan 2003 21:58:01 GMT""}]","2008-11-26"
"hep-ph/0301075","Ralf Hofmann","Ralf Hofmann and Maxim Pospelov","Conformal matter in warped backgrounds","9 pages","Phys.Lett. B556 (2003) 203-208","10.1016/S0370-2693(03)00135-7","HD-THEP-02-45, UVIC-TH-02-06","hep-ph",,"  Warped backgrounds in five dimensional models can provide solutions to
various hierarchy problems in particle physics if the standard model matter is
associated with the zero modes of bulk fields with nontrivial profiles along
the extra dimension. We investigate the case of a {\sl conformally} coupled
massless scalar. This field possesses a zero mode whose action density is
exponentially enhanced along the transverse direction in a warped background,
{\em i.e.} near the negative tension brane in the RS setting. At the zero mode
level effective 5D composites of this scalar and its derivatives, which are
suppressed by powers of the fundamental gravitational scale, yield 4D
interactions of electroweak strength. This suggests a certain importance of
conformally coupled scalar fields for extra-dimensional model building.
","[{""version"":""v1"",""created"":""Sat, 11 Jan 2003 15:43:43 GMT""}]","2009-11-10"
"hep-th/0301063","Peter Kaste","Peter Kaste, Ruben Minasian, Michela Petrini, Alessandro Tomasiello","Nontrivial RR two-form field strength and SU(3)-structure","LaTeX, 8 pages, talk given at the 35th Symposium Ahrenshoop, enlarged
  version of the contribution to the proceedings","Fortsch.Phys. 51 (2003) 764-768","10.1002/prop.200310095","CPHT-RR 004.0103","hep-th",,"  We discuss how in the presence of a nontrivial RR two-form field strength and
nontrivial dilaton the conditions of preserving supersymmetry on
six-dimensional manifolds lead to generalized monopole and Killing spinor
equations. We show that the manifold is K\""ahler in the ten-dimensional string
frame if F_0^{(1,1)}=0. We then determine explicitly the intrinsic torsion of
the SU(3)-structure on six-manifolds that result via Kaluza-Klein reduction
from seven-manifolds with G_2-structure of generic intrinsic torsion. Lastly we
give explicitly the intrinsic torsion of the SU(3)-structure for an N=1
supersymmetric background in the presence of nontrivial RR two-form field
strength and nontrivial dilaton.
","[{""version"":""v1"",""created"":""Fri, 10 Jan 2003 16:04:03 GMT""}]","2009-11-10"
"hep-th/0301064","denis Bernard","Michel Bauer and Denis Bernard","SLE martingales and the Virasoro algebra","13 pages, to appear in Phys. Lett. B","Phys.Lett.B557:309-316,2003","10.1016/S0370-2693(03)00189-8",,"hep-th math-ph math.MP math.PR",,"  We present an explicit relation between representations of the Virasoro
algebra and polynomial martingales in stochastic Loewner evolutions (SLE). We
show that the Virasoro algebra is the spectrum generating algebra of SLE
martingales. This is based on a new representation of the Virasoro algebra,
inspired by the Borel-Weil construction, acting on functions depending on
coordinates parametrizing conformal maps.
","[{""version"":""v1"",""created"":""Fri, 10 Jan 2003 17:12:01 GMT""},{""version"":""v2"",""created"":""Thu, 13 Mar 2003 11:06:16 GMT""}]","2008-11-26"
"hep-th/0301065","Dmitri Sorokin","Sudhakar Panda and Dmitri Sorokin","Supersymmetric and Kappa-invariant Coincident D0-Branes","JHEP style, 1+8 pages","JHEP 0302 (2003) 055","10.1088/1126-6708/2003/02/055","MRI-P-030101, DFPD 03/TH/01","hep-th",,"  We propose a generic supersymmetric and kappa-invariant action for describing
coincident D0-branes with non-abelian matter fields on their worldline. The
action is shown to be in agreement with the Matrix Theory limit of the
ND0-brane effective action.
","[{""version"":""v1"",""created"":""Fri, 10 Jan 2003 16:42:05 GMT""},{""version"":""v2"",""created"":""Sun, 12 Jan 2003 11:25:54 GMT""}]","2009-11-10"
"hep-th/0301066","Larisa Jonke","I. Dadic, L. Jonke, S. Meljanac (Rudjer Boskovic Institute)","Harmonic oscillator on noncommutative spaces","12 pages, Eq.(12)and the corresponding comment corrected, typos fixed","Acta Phys.Slov. 55 (2005) 149-164",,,"hep-th",,"  A generalized harmonic oscillator on noncommutative spaces is considered.
Dynamical symmetries and physical equivalence of noncommutative systems with
the same energy spectrum are investigated and discussed. General solutions of
three-dimensional noncommutative harmonic oscillator are found and classified
according to dynamical symmetries. We have found conditions under which
three-dimensional noncommutative harmonic oscillator can be represented by
ordinary, isotropic harmonic oscillator in effective magnetic field.
","[{""version"":""v1"",""created"":""Fri, 10 Jan 2003 18:17:05 GMT""},{""version"":""v2"",""created"":""Tue, 21 Jan 2003 16:06:14 GMT""}]","2007-05-23"
"hep-th/0301067","Dmitri Sorokin","Mikhail Plyushchay, Dmitri Sorokin and Mirian Tsulaia","Higher Spins from Tensorial Charges and OSp(N|2n) Symmetry","LaTeX, 21 page (JHEP style), misprints corrected, added comments on
  the relation of results of hep-th/0106149 with hep-th/9904109 and
  hep-th/9907113, references added","JHEP 0304:013,2003","10.1088/1126-6708/2003/04/013","USACH-FM-03-01, DFPD 03/TH/02","hep-th",,"  It is shown that the quantization of a superparticle propagating in an N=1,
D=4 superspace extended with tensorial coordinates results in an infinite tower
of massless spin states satisfying the Vasiliev unfolded equations for free
higher spin fields in flat and AdS_4 N=1 superspace. The tensorial extension of
the AdS_4 superspace is proved to be a supergroup manifold OSp(1|4). The model
is manifestly invariant under an OSp(N|8) (N=1,2) superconformal symmetry. As a
byproduct, we find that the Cartan forms of arbitrary Sp(2n) and OSp(1|2n)
groups are GL(2n) flat, i.e. they are equivalent to flat Cartan forms up to a
GL(2n) rotation. This property is crucial for carrying out the quantization of
the particle model on OSp(1|4) and getting the higher spin field dynamics in
super AdS_4, which can be performed in a way analogous to the flat case.
","[{""version"":""v1"",""created"":""Fri, 10 Jan 2003 22:01:02 GMT""},{""version"":""v2"",""created"":""Wed, 16 Apr 2003 14:36:38 GMT""}]","2010-02-03"
"hep-th/0301069","Vladimir V. Dyadichev","D.V. Gal'tsov, V.V. Dyadichev","Stabilization of the Yang-Mills chaos in non-Abelian Born-Infeld theory","7 pages, 5 figures","JETP Lett. 77 (2003) 154-157; Pisma Zh.Eksp.Teor.Fiz. 77 (2003)
  184-187","10.1134/1.1571872","DTP-MSU/03-03","hep-th",,"  We investigate dynamics of the homogeneous time-dependent SU(2) Yang-Mills
fields governed by the non-Abelian Born-Infeld lagrangian which arises in
superstring theory as a result of summation of all orders in the string slope
parameter $\alpha'$. It is shown that generically the Born-Infeld dynamics is
less chaotic than that in the ordinary Yang-Mills theory, and at high enough
field strength the Yang-Mills chaos is stabilized. More generally, a smothering
effect of the string non-locality on behavior of classical fields is
conjectured.
","[{""version"":""v1"",""created"":""Sat, 11 Jan 2003 07:35:39 GMT""}]","2009-11-10"
"math-ph/0301012","Ricardo Weder","Ricardo Weder","The $L^{p}-L^{\acute{p}}$ Estimate for the Schr\""{o}dinger Equation on
  the Half-Line","Latex file. 13 pages. To appear in J. Math. Anal. Appl","J. Mathematical Analysis Applications vol 281 (2003) 233-243",,,"math-ph math.MP math.SP",,"  In this paper we prove the $L^{p}-L^{\acute{p}}$ estimate for the
Schr\""{o}dinger equation on the half-line and with homogeneous Dirichlet
boundary condition at the origin.
","[{""version"":""v1"",""created"":""Fri, 10 Jan 2003 17:27:10 GMT""}]","2007-05-23"
