"astro-ph/0301186","David H. Weinberg","David H. Weinberg, Romeel Dav'e, Neal Katz, Juna A. Kollmeier","The Lyman-alpha Forest as a Cosmological Tool","13 pages, to appear in ""The Emergence of Cosmic Structure,""
  Proceedings of the 13th Annual Astrophysics Conference in Maryland, eds. S.
  Holt and C. Reynolds, AIP Press, 2003","AIP Conf.Proc. 666 (2003) 157-169","10.1063/1.1581786",,"astro-ph",,"  We review recent developments in the theory of the Lyman-alpha forest and
their implications for the role of the forest as a test of cosmological models.
Simulations predict a relatively tight correlation between the local Lya
optical depth and the local gas or dark matter density. Statistical properties
of the transmitted flux can constrain the amplitude and shape of the matter
power spectrum at high redshift, test the assumption of Gaussian initial
conditions, and probe the evolution of dark energy by measuring the Hubble
parameter H(z). Simulations predict increased Lya absorption in the vicinity of
galaxies, but observations show a Lya deficit within Delta_r ~ 0.5 Mpc/h
(comoving). We investigate idealized models of ""winds"" and find that they must
eliminate neutral hydrogen out to comoving radii ~1.5 Mpc/h to marginally
explain the data. Winds of this magnitude suppress the flux power spectrum by
\~0.1 dex but have little effect on the distribution function or threshold
crossing frequency. In light of the stringent demands on winds, we consider the
alternative possibility that extended Lya emission from target galaxies
replaces absorbed flux, but we conclude that this explanation is unlikely.
Taking full advantage of the data coming from large telescopes and from the
Sloan Digital Sky Survey will require more complete understanding of the galaxy
proximity effect, careful attention to continuum determination, and more
accurate numerical predictions, with the goal of reaching 5-10% precision on
key cosmological quantities.
","[{""version"":""v1"",""created"":""Fri, 10 Jan 2003 22:39:45 GMT""}]","2009-11-07"
"astro-ph/0301187","Seth Cohen","Seth H. Cohen (1), Rogier A. Windhorst (1), Stephen C. Odewahn (1),
  Claudia A. Chiarenza (1) and Simon P. Driver (2) ((1) Arizona State
  University, (2) Research School of Astronomy and Astrophysics)","The Hubble Space Telescope WFPC2 B-Band Parallel Survey: A Study of
  Galaxy Morphology for 18 < B < 27 mag","Accepted by Astronomical Journal, 29 pages, 7 figs, 2 tables, uses
  emulateapj.sty",,"10.1086/368367",,"astro-ph",,"  [Abridged] We present the results of the HST B-Band Parallel Survey (BBPS).
It covers 0.0370 sq. deg. and consists of 31 shallow (4-6 orbit), randomly
selected high latitude HST WFPC2 parallel fields with images taken in both the
B (F450W) and I (F814W) filters. The goal is to morphologically classify the
galaxies in a homogeneous manner and study galaxy properties as a function of
type and B-band magnitude for 18<b_J<23.5 mag. The B-band selected galaxies are
classified using an artificial neural network (ANN) galaxy classifier on the
higher S/N I-band images. These provide reliable types for I<24 mag (or b_J<26
mag), since these I-band classifications are less subject to the uncertain
redshifted rest-frame UV morphology. The ANN classification depends on the
shape of the surface brightness profile, but not on color. These results are
combined with deeper studies in the HDF-N and the deep WFPC2 field surrounding
the radio galaxy 53W002, for which galaxies have been classified to b_J<27 mag.
The galaxy counts for the combined B-band selected samples show adequate
statistics for a range 19<b_J<27 mag, and are in good agreement with other
studies in the flux range where they overlap, while showing improved statistics
at the bright end. The galaxies are divided into 3 morphological classes: E/S0,
Sabc and Sd/Irr, and the B-band counts are presented for each class, as well as
the total counts. The faint end of the counts is dominated by the Sd/Irr
galaxies. These type dependent counts are compared to models based on local
luminosity functions which include the effects of the Cosmological Constant.
The BBPS sample, along with the two deeper fields, is used to delineate the
general trends of effective radius and (B-I) color as a function of both
morphological type and apparent magnitude 18<b_J<27 mag.
","[{""version"":""v1"",""created"":""Fri, 10 Jan 2003 23:40:06 GMT""}]","2009-11-07"
"astro-ph/0301188","Ivone F. M. Albuquerque","Ivone F. M. Albuquerque, Laura Baudis","Direct Detection Constraints on Superheavy Dark Matter","10 pages, 2 figures, Figure 2 replaced","Phys.Rev.Lett. 90 (2003) 221301; Erratum-ibid. 91 (2003) 229903","10.1103/PhysRevLett.90.221301",,"astro-ph hep-ex hep-ph",,"  The dark matter in the Universe might be composed of superheavy particles
(mass >~ 10^10 GeV). These particles can be detected via nuclear recoils
produced in elastic scatterings from nuclei. We estimate the observable rate of
strongly interacting supermassive particles (simpzillas) in direct dark matter
search experiments. The simpzilla energy loss in the Earth and in the
experimental shields is taken into account. The most natural scenarios for
simpzillas are ruled out based on recent EDELWEISS and CDMS results. The dark
matter can be composed of superheavy particles only if these interact weakly
with normal matter or if their mass is above 10^15 GeV.
","[{""version"":""v1"",""created"":""Sat, 11 Jan 2003 00:54:41 GMT""},{""version"":""v2"",""created"":""Tue, 17 Jun 2003 17:52:25 GMT""},{""version"":""v3"",""created"":""Mon, 26 Jan 2004 19:35:26 GMT""}]","2009-11-07"
"astro-ph/0301189","Tapas Kumar Das","Tapas Kumar Das, Jayant K. Pendharkar, Sanjit Mitra","Multi-transonic Black Hole Accretion Discs with Isothermal Standing
  Shocks","Final version accepted for publication in Astrophysical Journal
  (ApJ). 6 black and white encapsulated post-script figures. For high
  resolution Fig. 5 & Fig. 6, please write to <tapas@astro.ucla.edu>.
  aastex.cls, emulateapj5.sty and apjfonts.sty used","Astrophys.J. 592 (2003) 1078-1088","10.1086/375732",,"astro-ph",,"  In this work we would like to address the issue of shock formation in black
hole accretion discs. We provide a {\it generalized two parameter solution
scheme} for multi-transonic, accretion and wind around Schwarzschild black
holes, by mainly concentrating on accretion solutions which may contain steady,
standing isothermal shocks. Such shocks conserve flow temperature by the
dissipation of energy at the shock location.Unlike previous works in this
field, our calculation is {\it not} restricted to any particular kind of
post-Newtonian gravitational potentials, rather we use {\it all} available
pseudo-Schwarzschild potentials to formulate and solve the equations governing
the accretion and wind only in terms of flow temperature $T$ and specific
angular momentum $\lambda$ of the flow. Our generalized formalism assures that
the shock formation is not just an artifact of a particular type of
gravitational potential, rather inclusion of all available black-hole
potentials demonstrates a substantially extended zone of parameter space
allowing for the possibility of shock formation. We thus arrive at the
conclusion that the standing shocks are essential ingredients in rotating,
advective accretion flows of isothermal fluid around a non-spinning
astrophysical black hole. Types of shocks discussed in this paper may appear to
be `bright' because of the huge amount of energy dissipation at shock, and the
quick removal of such energy to maintain the isothermality may power the strong
X-ray flares recently observed to be emerged from our Galactic centre.
  The results are discussed in connection to other astrophysical phenomena of
related interest, such as the QPO behaviour of galactic black hole candidates.
(Abridged).
","[{""version"":""v1"",""created"":""Sat, 11 Jan 2003 04:53:38 GMT""},{""version"":""v2"",""created"":""Thu, 3 Apr 2003 03:27:17 GMT""}]","2016-08-30"
"astro-ph/0301190","Olivier Guyon","Olivier Guyon (Subaru Telescope)","Phase-Induced Amplitude Apodization of Telescope Pupils for Extrasolar
  Terrestrial Planet Imaging","9 pages, 9 figures, Accepted for publication in A&A. Postscript file
  with full-resolution figures can be found at
  http://www.naoj.org/staff/guyon/publications/PIAA.ps","Astron.Astrophys.404:379,2003","10.1051/0004-6361:20030457",,"astro-ph",,"  In this paper, an alternative to the classical pupil apodization techniques
(use of an amplitude pupil mask) is proposed. It is shown that an apodized
pupil suitable for imaging of Extrasolar planets can be obtained by reflection
of an unapodized flat wavefront on 2 mirrors. By carefully choosing the shape
of these 2 mirrors, it is possible to obtain a contrast better than 10^{9} at a
distance smaller than 2 \lambda/d from the optical axis. Because this technique
preserves both the angular resolution and light gathering capabilities of the
unapodized pupil, it allows efficient detection of terrestrial extrasolar
planets with a 1.5m telescope in the visible.
","[{""version"":""v1"",""created"":""Sat, 11 Jan 2003 07:12:45 GMT""},{""version"":""v2"",""created"":""Tue, 8 Apr 2003 01:14:09 GMT""}]","2011-05-23"
"astro-ph/0301191","Paul C. Hewett","Paul C. Hewett and Craig B. Foltz","The Frequency and Radio Properties of Broad Absorption Line Quasars","Accepted for publication in AJ, April 2003 Issue","Astron.J.125:1784-1794,2003","10.1086/368392",,"astro-ph",,"  A sample of 67 Broad Absorption Line quasars (BALQSOs) from the Large Bright
Quasar Survey (LBQS) is used to estimate the observed and intrinsic fraction of
BAL quasars in optically--selected samples at intermediate (B_J \simeq 18.5)
magnitudes. The observed BALQSO fraction in the redshift range 1.5 < z < 3.0 is
15\pm3%. A well--determined, empirical, k--correction, to allow for the
differences in the spectral energy distributions of non--BALQSOs and BALQSOs
shortward of \simeq 2100A in the restframe, is applied to the sample. The
result is an estimate of the intrinsic fraction of BALQSOs, in the redshift
range 1.5 < z < 3.0, of 22+/-4%. This value is twice that commonly cited for
the occurrence of BALQSOs in optically--selected samples and the figure is in
reasonable agreement with that from a preliminary analysis of the SDSS Early
Data Release. The fraction of BALQSOs predicted to be present in an optical
survey with flux limits equivalent to that of the FIRST Bright Quasar Survey
(FBQS) is shown to be \simeq 20%. The BALQSO fractions derived from the FBQS
and the LBQS suggest that optically--bright BALQSOs are half as likely as
non-BALQSOs to be detectable as S_1.4GHz > 1mJy radio sources.
","[{""version"":""v1"",""created"":""Sat, 11 Jan 2003 10:06:02 GMT""}]","2014-10-13"
"astro-ph/0301192","Amedeo Balbi","A. Balbi, C. Baccigalupi, F. Perrotta, S. Matarrese, N. Vittorio","Probing dark energy with the CMB: projected constraints from WMAP and
  Planck","4 pages, 3 figures. Matches version accepted by ApJL. Figures may
  also be downloaded at http://www.sissa.it/~bacci/de/","Astrophys.J. 588 (2003) L5-L8","10.1086/375360",,"astro-ph hep-ph",,"  We investigate the accuracy attainable by forthcoming space-based
observations of the cosmic microwave background (CMB) temperature and
polarization anisotropy in constraining the dark energy density parameter $\Oq$
and equation of state $\wq=p_{\rm Q}/\rho_{\rm Q}$. Despite degeneracies among
parameters, it is possible for high precision observations such as those from
WMAP and Planck to provide interesting information on the nature of the dark
energy. Furthermore, we show that imposing a flat universe constraint makes it
possible to obtain tight limits in the space of dark energy parameters even
from the CMB alone.
","[{""version"":""v1"",""created"":""Sat, 11 Jan 2003 10:11:36 GMT""},{""version"":""v2"",""created"":""Tue, 1 Apr 2003 10:52:11 GMT""},{""version"":""v3"",""created"":""Wed, 18 Jun 2003 13:27:24 GMT""}]","2009-11-07"
"cond-mat/0301153","Hendry Izaac Elim","H.I. Elim, W. Ji, A.H. Yuwono, J.M. Xue, and J. Wang","Ultrafast Optical Nonlinearity in PMMA-TiO2 Nanocomposites","12 pages, 3 figures. To appear in Appl. Phys. Lett. (2003)","Applied Physics Letters, Vol. 82, (2003), p. 2691; Virtual Journal
  of Ultrafast Science, Volume 2, Issue 5, May 2003","10.1063/1.1568544",,"cond-mat.mtrl-sci physics.atm-clus physics.chem-ph physics.optics",,"  With 780-nm, 250-fs laser pulses, ultrafast optical nonlinearity has been
observed in a series of thin films containing PMMA-TiO2 nanocomposites, which
are synthesized by a simple technique of in-situ sol-gel/polymerization. The
best figures of merit are found in one of the films prepared with a 60% weight
percentage of titanium isopropoxide. TEM shows the presence of the
5-nm-diameter particles in the film. The observed optical nonlinearity has a
recovery time of ~1.5 ps. These findings suggest the strong potential of
PMMA-TiO2 nanocomposites for all-optical switching.
","[{""version"":""v1"",""created"":""Fri, 10 Jan 2003 16:05:00 GMT""},{""version"":""v2"",""created"":""Thu, 27 Feb 2003 11:51:40 GMT""}]","2009-11-10"
"cond-mat/0301154","R. Hanninen","R. H\""anninen and E. V. Thuneberg (LTL, Helsinki University of
  Technology)","Model of Inhomogeneous Impurity Distribution in Fermi Superfluids","14 pages, 9 figures, minor changes","Phys. Rev. B 67, 214507 (2003)","10.1103/PhysRevB.67.214507",,"cond-mat",,"  The standard treatment of impurities in metals assumes a homogeneous
distribution of impurities. In this paper we study distributions that are
inhomogeneous. We discuss in detail the ""isotropic inhomogeneous scattering
model"" which takes into account the spatially varying scattering on the scale
of the superfluid coherence length. On a large scale the model reduces to a
homogeneous medium with renormalized parameter values. We apply the model to
superfluid 3He, where porous aerogel acts as the impurity. We calculate the
transition temperature Tc, the order parameter, and the superfluid density.
Both A- and B-like phases are considered. Two different types of behavior are
identified for the temperature dependence of the order parameter. We compare
the calculations with experiments on 3He in aerogel. We find that most of the
differences between experiments and the homogeneous theory can be explained by
the inhomogeneous model. All our calculations are based on the quasiclassical
theory of Fermi liquids. The parameters of this theory for superfluid 3He in
aerogel are discussed.
","[{""version"":""v1"",""created"":""Fri, 10 Jan 2003 16:34:42 GMT""},{""version"":""v2"",""created"":""Tue, 14 Jan 2003 14:35:35 GMT""},{""version"":""v3"",""created"":""Fri, 29 Aug 2003 08:28:38 GMT""}]","2009-11-10"
"cond-mat/0301155","Daniel ben-Avraham","Dexin Zhong, Roan Dawkins, and Daniel ben-Avraham","Large-Scale Simulations of Diffusion-Limited n-Species Annihilation",,"Phys. Rev. E 64, 040101(R) (2003)","10.1103/PhysRevE.67.040101",,"cond-mat.soft",,"  We present results from computer simulations for diffusion-limited
$n$-species annihilation, $A_i+A_j\to0$ $(i,j=1,2,...,n;i\neq j)$, on the line,
for lattices of up to $2^{28}$ sites, and where the process proceeds to
completion (no further reactions possible), involving up to $10^{15}$ time
steps. These enormous simulations are made possible by the renormalized
reaction-cell method (RRC). Our results suggest that the concentration decay
exponent for $n$ species is $\a(n)=(n-1)/2n$ instead of $(2n-3)/(4n-4)$, as
previously believed, and are in agreement with recent theoretical arguments
\cite{tauber}. We also propose a scaling relation for $\Delta$, the
correction-to-scaling exponent for the concentration decay; $c(t)\sim
t^{-\a}(A+Bt^{-\Delta})$.
","[{""version"":""v1"",""created"":""Fri, 10 Jan 2003 19:07:36 GMT""}]","2016-08-31"
"cond-mat/0301156","Godreche","C. Godreche","Dynamics of condensation in zero-range processes","18 pages, 8 figures 2 figures added, more accurate data at
  criticality","J. Phys. A 36 (2003) 6313",,,"cond-mat.stat-mech",,"  The dynamics of a class of zero-range processes exhibiting a condensation
transition in the stationary state is studied. The system evolves in time
starting from a random disordered initial condition. The analytical study of
the large-time behaviour of the system in its mean-field geometry provides a
guide for the numerical study of the one-dimensional version of the model. Most
qualitative features of the mean-field case are still present in the
one-dimensional system, both in the condensed phase and at criticality. In
particular the scaling analysis, valid for the mean-field system at large time
and for large values of the site occupancy, still holds in one dimension. The
dynamical exponent $z$, characteristic of the growth of the condensate, is
changed from its mean-field value 2 to 3. In presence of a bias, the mean-field
value $z=2$ is recovered. The dynamical exponent $z_c$, characteristic of the
growth of critical fluctuations, is changed from its mean-field value 2 to a
larger value, $z_c\simeq 5$. In presence of a bias, $z_c\simeq 3$.
","[{""version"":""v1"",""created"":""Fri, 10 Jan 2003 17:49:10 GMT""},{""version"":""v2"",""created"":""Wed, 29 Jan 2003 18:39:50 GMT""}]","2016-08-31"
"cond-mat/0301157","Giorgio Parisi","Giorgio Parisi","Glasses, replicas and all that","Lectures given at the les Houches 2002 summer school",,,,"cond-mat.soft cond-mat.stat-mech",,"  In these lectures I will review the approach to glasses based on the replica
formalism. Many of the physical ideas are very similar to those of older
approaches. The replica approach has the advantage of describing in an unified
setting both the behaviour near the dynamic transition (mode coupling
transition) and near the equilibrium transition (Kauzman transition) that is
present in fragile glasses. The replica method may be used to solve simple mean
field models, providing explicit examples of systems that may be studied
analytically in great details and behave similarly to the experiments. Finally,
using the replica formalism, it is possible to do analytic explicit
computations of the properties of realistic models of glasses and the results
are in reasonable agreement with numerical simulations.
","[{""version"":""v1"",""created"":""Fri, 10 Jan 2003 18:23:55 GMT""}]","2007-05-23"
"cond-mat/0301158","Henrik Johannesson","H. Johannesson, N. Andrei, C. J. Bolech","Critical Theory of the Two-Channel Anderson Impurity Model","Revtex, 19 pages, 3 figures. Replaced with published version (Eq. 25
  corrected, minor typographical changes, added references)","Phys. Rev. B 68, 075112 (2003)","10.1103/PhysRevB.68.075112",,"cond-mat.str-el",,"  We construct the boundary conformal field theory that describes the
low-temperature behavior of the two-channel Anderson impurity model. The
presence of an exactly marginal operator is shown to generate a line of stable
fixed points parameterized by the charge valence of the impurity. We calculate
the exact zero-temperature entropy and impurity thermodynamics along the fixed
line. We also derive the critical exponents of the characteristic Fermi edge
singularities caused by time-dependent hybridization between conduction
electrons and impurity. Our results suggest that in the mixed-valent regime the
electrons participate in two competing processes, leading to frustrated
screening of spin and channel degrees of freedom. By combining the boundary
conformal field theory with the Bethe Ansatz solution we obtain a complete
description of the low-energy dynamics of the model.
","[{""version"":""v1"",""created"":""Fri, 10 Jan 2003 18:35:32 GMT""},{""version"":""v2"",""created"":""Thu, 19 Feb 2004 17:21:38 GMT""}]","2007-05-23"
"cond-mat/0301159","Andrea Simoni","A. Simoni, F. Ferlaino, G. Roati, G. Modugno and M. Inguscio","Magnetic control of the interaction in ultracold K-Rb mixtures","5 pages, 3 figures","Phys.Rev.Lett 90,163202 (2003)","10.1103/PhysRevLett.90.163202",,"cond-mat.soft cond-mat.supr-con",,"  We predict the presence of several magnetic Feshbach resonances in selected
Zeeman sublevels of the isotopic pairs K(40)-Rb(87) and K(41)-Rb(87) at
magnetic fields up to 1000 G. Positions and widths are determined combining a
new measurement of the K(40)-Rb(87) inelastic cross section with recent
experimental results on both isotopes. The possibility of driving a K-Rb
mixtures from the weak to the strong interacting regime tuning the applied
field should allow to achieve the optimal conditions for boson-induced Cooper
pairing in a multi component K(40)-Rb(87) atomic gas and for the production of
ultracold polar molecules.
","[{""version"":""v1"",""created"":""Fri, 10 Jan 2003 18:59:49 GMT""}]","2009-11-10"
"cond-mat/0301160","Brian B. Laird","Ruslan L. Davidchack and Brian B. Laird","Direct calculation of the crystal-melt interfacial free energies for
  continuous potentials: Application to the Lennard-Jones system","7 pages, 3 figures, 2 tables",,"10.1063/1.1563248",,"cond-mat.mtrl-sci",,"  Extending to continuous potentials a cleaving wall molecular-dynamics
simulation method recently developed for the hard-sphere system [Phys.Rev.Lett
85, 4751 (2000)], we calculate the crystal-melt interfacial free energies,
$\gamma$, for a Lennard-Jones system as functions of both crystal orientation
and temperature. At the triple point, T* = 0.617, the results are consistent
with an earlier cleaving potential calculation by Broughton and Gilmer [J.
Chem. Phys. {\bf 84}, 5759 (1986)], however, the greater precision of the
current calculation allows us to accurately determine the anisotropy of
$\gamma$. From our data we find that, at all temperatures studied,
$\gamma_{111} < \gamma_{110} < \gamma_{100}$. Comparison is made to the results
from our previous hard-sphere calculation and to recent results for Ni by Asta,
Hoyt and Karma [Phys. Rev. B, 66 100101(R) (2002)].
","[{""version"":""v1"",""created"":""Fri, 10 Jan 2003 20:47:48 GMT""}]","2009-11-10"
"cond-mat/0301161","Mazars","M. Mazars","Lekner summations and Ewald summations for quasi-two dimensional systems","50 pages, 9 figures, 4 tables","Molecular Physics, 103 : 9, 1241-1260 (2005)","10.1080/00268970412331332934",,"cond-mat.stat-mech",,"  Using the specific model of a bilayer of classical charged particles (bilayer
Wigner crystal), we compare the predictions for energies and pair distribution
functions obtained by Monte Carlo simulations using three different methods
available to treat the long range Coulomb interactions in systems periodic in
two directions but bound in the third one. The three methods compared are: the
Ewald method for quasi-two dimensional systems [D.E. Parry, Surf. Sci.
$\bm{49}$, 433 (1975); \it{ibid.}, $\bm{54}$, 195 (1976)], the Hautman-Klein
method [J. Hautman and M.L. Klein, Mol. Phys. $\bm{75}$, 379 (1992)] and the
Lekner summations method [J. Lekner, Physica A$\bm{176}$, 485 (1991)]. All of
the three method studied in this paper may be applied to any quasi-two
dimensional systems, including those having not the specific symmetry of slab
systems. For the particular system used in this work, the Ewald method for
quasi-two dimensional systems is exact and may be implemented with efficiency;
results obtained with the other two methods are systematically compared to
results found with the Ewald method. General recommendations to implement with
accuracy, but not always with efficiency, the Lekner summations technique in
Monte Carlo algorithms are given.
","[{""version"":""v1"",""created"":""Fri, 10 Jan 2003 21:35:18 GMT""},{""version"":""v2"",""created"":""Sun, 23 Feb 2003 17:55:27 GMT""}]","2015-06-24"
"cond-mat/0301162","Onofre Rojas","Onofre Rojas and F. C. Alcaraz","Phase diagram of a coupled tetrahedral Heisenberg model","23 pages, 15 figures","Phys. Rev. B 67, 174401 (2003)","10.1103/PhysRevB.67.174401",,"cond-mat.stat-mech cond-mat.str-el",,"  The phase diagram of a coupled tetrahedral Heisenberg model is obtained. The
quantum chain has a local gauge symmetry and its eigenspectrum is obtained by
the composition of the eigenspectra of spin-1/2 XXZ chains with arbitrary
distribution of spin-3/2 impurities. The phase diagram is quite rich with an
infinite number of phases with ferromagnetic, antiferromagnetic or
ferrimagnetic order. In some cases the ground state and the low lying
eigenlevels of the model can be exactly calculated since they coincide with the
eigenlevels of the exactly integrable XXZ chain. The thermodynamical properties
of the model at low temperatures is also studied through finite-size analysis.
","[{""version"":""v1"",""created"":""Fri, 10 Jan 2003 21:38:52 GMT""},{""version"":""v2"",""created"":""Sun, 2 Mar 2003 21:25:00 GMT""}]","2009-11-10"
"cond-mat/0301163","Nikolai Chernov","N. Chernov, J. L. Lebowitz, Ya. Sinai","Dynamics of a Massive Piston in an Ideal Gas","86 pages, 12 figures","Russian Mathematical Surveys, volume 57, 2002, pp. 1-84",,,"cond-mat.stat-mech",,"  We study a dynamical system consisting of a massive piston in a cubical
container of large size $L$ filled with an ideal gas. The piston has mass
$M\sim L^2$ and undergoes elastic collisions with $N\sim L^3$ non-interacting
gas particles of mass $m=1$. We find that, under suitable initial conditions,
there is, in the limit $L \to \infty$, a scaling regime with time and space
scaled by $L$, in which the motion of the piston and the one particle
distribution of the gas satisfy autonomous coupled equations (hydrodynamical
equations), so that the mechanical trajectory of the piston converges, in
probability, to the solution of the hydrodynamical equations for a certain
period of time. We also discuss heuristically the dynamics of the system on
longer intervals of time.
","[{""version"":""v1"",""created"":""Fri, 10 Jan 2003 23:27:04 GMT""}]","2007-05-23"
