"astro-ph/0301645","Naoki Yoshida","Naoki Yoshida (CfA), Tom Abel (Penn State), Lars Hernquist (CfA),
  Naoshi Sugiyama (NAOJ)","Simulations of Early Structure Formation: Primordial Gas Clouds","Revised version accepted by ApJ. Description of semi-analytic models
  extended","Astrophys.J. 592 (2003) 645-663","10.1086/375810",,"astro-ph",,"  (abridged) We use large cosmological simulations to study the origin of
primordial star-forming clouds in a Lambda CDM universe, by following the
formation of dark matter halos and the cooling of gas within them. To model the
physics of chemically pristine gas, we employ a non-equilibrium treatment of
the chemistry of 9 species and include cooling by molecular hydrogen. We
explore the hierarchical growth of bound structures forming at redshifts z = 25
- 30 with total masses in the range 10^5 - 10^6 Msun. The complex interplay
between the gravitational formation of dark halos and the thermodynamic and
chemical evolution of the gas clouds compromises analytic estimates of the
critical H2 fraction. Dynamical heating from mass accretion and mergers opposes
relatively inefficient cooling by molecular hydrogen, delaying the production
of star-forming clouds in rapidly growing halos. We also investigate the impact
of photo-dissociating ultra-violet (UV) radiation on the formation of
primordial gas clouds. We consider two extreme cases by first including a
uniform radiation field in the optically thin limit and secondly by accounting
for the maximum effect of gas self-shielding in virialized regions. In both the
cases we consider, the overall impact can be described by computing an
equilibrium H2 abundance for the radiation flux and defining an effective
shielding factor.
  Based on our numerical results, we develop a semi-analytic model of the
formation of the first stars, and demonstrate how it can be coupled with large
N-body simulations to predict the star formation rate in the early universe.
","[{""version"":""v1"",""created"":""Fri, 31 Jan 2003 14:52:04 GMT""},{""version"":""v2"",""created"":""Sun, 2 Feb 2003 19:29:03 GMT""},{""version"":""v3"",""created"":""Tue, 8 Apr 2003 15:23:22 GMT""}]","2009-11-07"
"astro-ph/0301646","Eric M. Schlegel","Eric M. Schlegel (SAO) and Anandi Salinas (Univ of Texas)","The Chandra Observation of the IP TX Col","to appear in the proceedings of Cape Town Magnetic CV conference, ASP
  conference series; 7 pages, 5 figures",,,,"astro-ph",,"  We present a preliminary look at the serendipitous observation of the
intermediate polar TX Col by Chandra. The 52 ksec observation is uninterrupted,
providing an opportunity to disentangle the light curve and power spectra
components. We illustrate the energy-dependence of the power spectrum.
","[{""version"":""v1"",""created"":""Fri, 31 Jan 2003 14:53:37 GMT""}]","2007-05-23"
"astro-ph/0301647","Marc Balcells","Marc Balcells","Spheroid and disk signatures in galaxy bulges","Review at JENAM2002 Galaxy Dynamics Workshop (Porto, Portugal, 2002
  September 3-7). 12 pages, 4 figures, includes EAS style file",,,,"astro-ph",,"  Recent progress on the structure and dynamics of bulges is reviewed. Those
aspects that link galaxy bulges either to oblate spheroids akin to elliptical
galaxies or to rapidly-rotating, flattened systems more nearly resembling the
products of disk internal transformations, are highlighted. The analysis of
surface brightness profiles derived from HST data is reviewed to show that
unresolved nuclear components detected by HST have biased the determination of
surface brightness profiles obtained from the ground; r^1/4 profiles are
virtually nonexistent in galaxy bulges. Predictions from accretion N-body
models on the shape of surface brightness profiles are discussed. The position
of bulges on the Fundamental Plane of elliptical galaxies is examined to infer
clues on bulge population ages and bulge dynamical structure. Kinematic
diagnostics on the internal dynamics of bulges are examined. Finally, a new
approach to the kinematic analysis of galaxies, based on the use of synthetic
spectra of single stellar population models instead of the standard stellar
templates, is presented.
","[{""version"":""v1"",""created"":""Fri, 31 Jan 2003 14:58:11 GMT""}]","2007-05-23"
"astro-ph/0301648","Carollo Daniela","D. Carollo, D. Koester, A. Spagna, M.G. Lattanzi, S.T. Hodgkin","Model atmosphere analysis of the extreme DQ white dwarf GSC2U
  J131147.2+292348","4 pages, 2 figures, accepted for publication in Astronomy and
  Astrophysics Letters","Astron.Astrophys.400:L13,2003","10.1051/0004-6361:20030132",,"astro-ph",,"  A new model atmosphere analysis for the peculiar DQ white dwarf discovered by
Carollo et al. (2002) is presented. The effective temperature and carbon
abundance have been estimated by fitting both the photometric data
(UBJ,VRF,IN,JHK) and a low resolution spectrum (3500<lambda<7500 A) with a new
model grid for helium-rich white dwarfs with traces of carbon (DQ stars). We
estimate Teff ~ 5120 +/- 200 K and log[C/He] ~ -5.8 +/- 0.5, which make GSC2U
J131147.2+292348 the coolest DQ star ever observed. This result indicates that
the hypothetical transition from C2 to C2H molecules around Teff = 6000 K,
which was inferred to explain the absence of DQ stars at lower temperatures,
needs to be reconsidered.
","[{""version"":""v1"",""created"":""Fri, 31 Jan 2003 15:26:40 GMT""}]","2011-05-23"
"cond-mat/0301596","Albenque","F. Rullier-Albenque, H. Alloul, R. Tourbot","Respective influences of pair breaking and phase fluctuations in
  disordered high Tc superconductors","5 pages, 4 figures",,"10.1103/PhysRevLett.91.047001",,"cond-mat.supr-con cond-mat.str-el",,"  Electron irradiation has been used to introduce point defects in a controlled
way in the CuO2 planes of underdoped and optimally doped YBCO. This technique
allows us to perform very accurate measurements of Tc and of the residual
resistivity in a wide range of defect contents xd down to Tc=0. The Tc decrease
does not follow the variation expected from pair breaking theories. The
evolutions of Tc and of the transition width with xd emphasize the importance
of phase fluctuations, at least for the highly damaged regime. These results
open new questions about the evolution of the defect induced Tc depression over
the phase diagram of the cuprates
","[{""version"":""v1"",""created"":""Thu, 30 Jan 2003 16:22:28 GMT""}]","2009-11-10"
"cond-mat/0301597","Jose Maria Martin Olalla","J. M. Martin-Olalla, F. J. Romero, S. Ramos, M. C. Gallardo, J. M.
  Perez-Mato, E. K. H. Salje","The order parameter-entropy relation in some universal classes:
  experimental evidence","13 pp. 9 ff. 2 tab. RevTeX. Submitted to J. Phys.: Cond. Matter","Journal of Physics: Condensed Matter 15(14) 2423-2434 (2003)","10.1088/0953-8984/15/14/318",,"cond-mat",,"  The asymptotic behaviour near phase transitions can be suitably characterized
by the scaling of $\Delta s/Q^2$ with $\epsilon=1-T/T_c$, where $\Delta s$ is
the excess entropy and $Q$ is the order parameter. As $\Delta s$ is obtained by
integration of the experimental excess specific heat of the transition $\Delta
c$, it displays little experimental noise so that the curve $\log(\Delta
s/Q^2)$ versus $\log\epsilon$ is better constrained than, say, $\log\Delta c$
versus $\log\epsilon$. The behaviour of $\Delta s/Q^2$ for different
universality classes is presented and compared. In all cases, it clearly
deviates from being a constant. The determination of this function can then be
an effective method to distinguish asymptotic critical behaviour. For
comparison, experimental data for three very different systems, Rb2CoF4,
Rb2ZnCl4 and SrTiO3, are analysed under this approach. In SrTiO3, the function
$\Delta s/Q^2$ does not deviate within experimental resolution from a straight
line so that, although Q can be fitted with a non mean-field exponent, the data
can be explained by a classical Landau mean-field behaviour. In contrast, the
behaviour of $\Delta s/Q^2$ for the antiferromagnetic transition in Rb2CoF4 and
the normal-incommensurate phase transition in Rb2ZCl4 is fully consistent with
the asymptotic critical behaviour of the universality class corresponding to
each case. This analysis supports, therefore, the claim that incommensurate
phase transitions in general, and the A$_2$BX$_4$ compounds in particular, in
contrast with most structural phase transitions, have critical regions large
enough to be observable.
","[{""version"":""v1"",""created"":""Thu, 30 Jan 2003 17:20:11 GMT""}]","2007-05-23"
"cond-mat/0301598","Radovan Brako","Z. Crljen, P. Lazic, D. Sokcevic, R. Brako","Relaxation and reconstruction on (111) surfaces of Au, Pt, and Cu","8 pages, 3 figures, submitted to Physical Review B",,"10.1103/PhysRevB.68.195411","IRB-TH-1/03","cond-mat",,"  We have theoretically studied the stability and reconstruction of (111)
surfaces of Au, Pt, and Cu. We have calculated the surface energy, surface
stress, interatomic force constants, and other relevant quantities by ab initio
electronic structure calculations using the density functional theory (DFT), in
a slab geometry with periodic boundary conditions. We have estimated the
stability towards a quasi-one-dimensional reconstruction by using the
calculated quantities as parameters in a one-dimensional Frenkel-Kontorova
model. On all surfaces we have found an intrinsic tensile stress. This stress
is large enough on Au and Pt surfaces to lead to a reconstruction in which a
denser surface layer is formed, in agreement with experiment. The
experimentally observed differences between the dense reconstruction pattern on
Au(111) and a sparse structure of stripes on Pt(111) are attributed to the
details of the interaction potential between the first layer of atoms and the
substrate.
","[{""version"":""v1"",""created"":""Thu, 30 Jan 2003 16:59:00 GMT""}]","2009-11-10"
"cond-mat/0301599","Stephen Hill","S. Hill, R. S. Edwards, S. I. Jones, J. M. North, N. S. Dalal","Definitive spectroscopic determination of the transverse interactions
  responsible for the magnetic quantum tunneling in Mn12-acetate","7 pages, including figures, accepted for publication in Phys. Rev.
  Lett",,"10.1103/PhysRevLett.90.217204",,"cond-mat.mtrl-sci",,"  We present detailed angle-dependent single crystal electron paramagnetic
resonance (EPR) data for field rotations in the hard plane of the S=10 single
molecule magnet Mn12-acetate. A clear four-fold variation in the resonance
positions may be attributed to an intrinsic fourth order transverse anisotropy
(O44). Meanwhile, a four-fold variation of the EPR lineshapes confirms a
recently proposed model wherein disorder associated with the acetic acid of
crystallization induces a locally varying quadratic (rhombic) transverse
anisotropy (O22). These findings explain most aspects of the magnetic quantum
tunneling observed in Mn12-acetate.
","[{""version"":""v1"",""created"":""Thu, 30 Jan 2003 19:39:12 GMT""},{""version"":""v2"",""created"":""Thu, 10 Apr 2003 19:19:11 GMT""}]","2009-11-10"
"cond-mat/0301600","Maciej M. Duras","Maciej M. Duras","Dynamics of complex quantum systems with energy dissipation","4 pages; presented at poster session of the conference ""Dynamics and
  Statistics of Complex Systems""; May 17th, 2000 to May 18th, 2000; Max Planck
  Institute for the Physics of Complex Systems; Dresden, Germany (2000)",,,,"cond-mat.stat-mech",,"  A complex quantum system with energy dissipation is considered. The quantum
Hamiltonians $H$ belong the complex Ginibre ensemble. The complex-valued
eigenenergies $Z_{i}$ are random variables. The second differences $\Delta^{1}
Z_{i}$ are also complex-valued random variables. The second differences have
their real and imaginary parts and also radii (moduli) and main arguments
(angles). For $N$=3 dimensional Ginibre ensemble the distributions of above
random variables are provided whereas for generic $N$- dimensional Ginibre
ensemble second difference distribution is analytically calculated. The law of
homogenization of eigenergies is formulated. The analogy of Wigner and Dyson of
Coulomb gas of electric charges is studied.
","[{""version"":""v1"",""created"":""Thu, 30 Jan 2003 17:06:56 GMT""},{""version"":""v2"",""created"":""Wed, 2 Jul 2003 18:34:48 GMT""}]","2007-05-23"
"cond-mat/0301601","David Rabson","David A. Rabson, John F. Huesman, Benji N. Fisher","Cohomology for Anyone","21 pages + figures, bibliography, Mathematica code homology.m",,"10.1023/A:1026281621848",,"cond-mat",,"  Crystallography has proven a rich source of ideas over several centuries.
Among the many ways of looking at space groups, N. David Mermin has pioneered
the Fourier-space approach. Recently, we have supplemented this approach with
methods borrowed from algebraic topology. We now show what topology, which
studies global properties of manifolds, has to do with crystallography. No
mathematics is assumed beyond what the typical physics or crystallography
student will have seen of group theory; in particular, the reader need not have
any prior exposure to topology or to cohomology of groups.
","[{""version"":""v1"",""created"":""Thu, 30 Jan 2003 20:36:16 GMT""}]","2022-10-12"
"cond-mat/0301602","Patrick Rinke","Karsten Reuter and Matthias Scheffler","Composition and structure of the RuO2(110) surface in an O2 and CO
  environment: implications for the catalytic formation of CO2","12 pages including 8 figure files. Submitted to Phys. Rev. B. Related
  publications can be found at http://www.fhi-berlin.mpg.de/th/paper.html","Phys. Rev. B 68, 045407 (2003)","10.1103/PhysRevB.68.045407",,"cond-mat.mtrl-sci",,"  The phase diagram of surface structures for the model catalyst RuO2(110) in
contact with a gas environment of O2 and CO is calculated by density-functional
theory and atomistic thermodynamics. Adsorption of the reactants is found to
depend crucially on temperature and partial pressures in the gas phase.
Assuming that a catalyst surface under steady-state operation conditions is
close to a constrained thermodynamic equilibrium, we are able to rationalize a
number of experimental findings on the CO oxidation over RuO2(110). We also
calculated reaction pathways and energy barriers. Based on the various results
the importance of phase coexistence conditions is emphasized as these will lead
to an enhanced dynamics at the catalyst surface. Such conditions may actuate an
additional, kinetically controlled reaction mechanism on RuO2(110).
","[{""version"":""v1"",""created"":""Thu, 30 Jan 2003 17:54:01 GMT""}]","2009-11-10"
"cond-mat/0301603","Maciej M. Duras","Maciej M. Duras","An example of dissipative quantum system: finite differences for complex
  Ginibre ensemble","5 pages; presented at poster session of the conference ""Quantum
  dynamics in terms of phase-space distributions""; May 22nd, 2000 to May 26th,
  2000; Max Planck Institute for the Physics of Complex Systems; Dresden,
  Germany (2000)",,,,"cond-mat.stat-mech",,"  The Ginibre ensemble of complex random Hamiltonian matrices $H$ is
considered. Each quantum system described by $H$ is a dissipative system and
the eigenenergies $Z_{i}$ of the Hamiltonian are complex-valued random
variables. For generic $N$-dimensional Ginibre ensemble analytical formula for
distribution of second difference $\Delta^{1} Z_{i}$ of complex eigenenergies
is presented. The distributions of real and imaginary parts of $\Delta^{1}
Z_{i}$ and also of its modulus and phase are provided for $N$=3. The results
are considered in view of Wigner and Dyson's electrostatic analogy. General law
of homogenization of eigenergies for different random matrix ensembles is
formulated.
","[{""version"":""v1"",""created"":""Thu, 30 Jan 2003 18:13:05 GMT""},{""version"":""v2"",""created"":""Wed, 2 Jul 2003 18:19:48 GMT""}]","2007-05-23"
"cond-mat/0301604","Eira Seppala","K. P. J. Kyt\""ol\""a, E. T. Sepp\""al\""a, M. J. Alava","Elastic manifolds in disordered environments: energy statistics","Accepted for publication in Europhysics Letters","Europhys. Lett. 62, 35 (2003).","10.1209/epl/i2003-00360-9",,"cond-mat.dis-nn cond-mat.stat-mech",,"  The energy of an elastic manifold in a random landscape at T=0 is shown
numerically to obey a probability distribution that depends on size of the box
it is put into. If the extent of the spatial fluctuations of the manifold is
much less than that of the system, a cross-over takes place to the
Gumbel-distribution of extreme statistics. If they are comparable, the
distributions have non-Gaussian, stretched exponential tails. The low-energy
and high-energy stretching exponents are roughly independent of the internal
dimension and the fluctuation degrees of freedom.
","[{""version"":""v1"",""created"":""Thu, 30 Jan 2003 18:22:52 GMT""}]","2009-11-10"
"cond-mat/0301605","Maciej M. Duras","Maciej M. Duras","Quantum symmetrical statistical system: Ginibre-Girko ensemble","4 pages; presented at poster session of the conference ""The 32nd
  Symposium on Mathematical Physics (SMP 32)""; June 6th, 2000 to June 10th,
  2000; Institute of Physics, Nicholas Copernicus University; Torun, Poland
  (2000)",,,,"cond-mat.stat-mech",,"  The Ginibre ensemble of complex random Hamiltonian matrices $H$ is
considered. Each quantum system described by $H$ is a dissipative system and
the eigenenergies $Z_{i}$ of the Hamiltonian are complex-valued random
variables. For generic $N$-dimensional Ginibre ensemble analytical formula for
distribution of second difference $\Delta^{1} Z_{i}$ of complex eigenenergies
is presented. The distributions of real and imaginary parts of $\Delta^{1}
Z_{i}$ and also of its modulus and phase are provided for $N$=3. The results
are considered in view of Wigner and Dyson's electrostatic analogy. General law
of homogenization of eigenergies for different random matrix ensembles is
formulated.
","[{""version"":""v1"",""created"":""Thu, 30 Jan 2003 19:06:28 GMT""},{""version"":""v2"",""created"":""Wed, 2 Jul 2003 18:01:29 GMT""}]","2007-05-23"
"cond-mat/0301606","Maciej M. Duras","Maciej M. Duras","Stabilization of highly dimensional statistical systems: Girko ensemble","5 pages; presented at poster session of the conference ""Symposium on
  Entropy""; June 25th, 2000 to June 28th, 2000; Max Planck Institute for the
  Physics of Complex Systems; Dresden, Germany (2000)",,,,"cond-mat.stat-mech",,"  A quantum statistical system with energy dissipation is studied. Its
statisitics is governed by random complex-valued non-Hermitean Hamiltonians
belonging to complex Ginibre ensemble. The eigenenergies are shown to form
stable structure in thermodynamical limit (large matrix dimension limit).
Analogy of Wigner and Dyson with system of electrical charges is drawn.
","[{""version"":""v1"",""created"":""Thu, 30 Jan 2003 19:31:24 GMT""},{""version"":""v2"",""created"":""Wed, 2 Jul 2003 17:15:22 GMT""}]","2007-05-23"
"cond-mat/0301607","Maciej M. Duras","Maciej M. Duras","Statistics of infinite dimensional random matrix ensembles","5 pages; presented at poster session of the conference ""Statistical
  Mechanics of Space-Time Chaos""; July 12th, 2000 to July 16th, 2000; Max
  Planck Institute for the Physics of Complex Systems; Dresden, Germany (2000)",,,,"cond-mat.stat-mech",,"  A quantum statistical system with energy dissipation is studied. Its
statisitics is governed by random complex-valued non-Hermitean Hamiltonians
belonging to complex Ginibre ensemble. The eigenenergies are shown to form
stable structure in thermodynamical limit (large matrix dimension limit).
Analogy of Wigner and Dyson with system of electrical charges is drawn.
","[{""version"":""v1"",""created"":""Thu, 30 Jan 2003 19:46:07 GMT""},{""version"":""v2"",""created"":""Wed, 2 Jul 2003 16:50:39 GMT""}]","2007-05-23"
"cond-mat/0301608","Tomaz Rejec","Tomaz Rejec, Anton Ramsak","Formulae for zero-temperature conductance through a region with
  interaction","18 pages, 18 figures; to appear in Phys. Rev. B","Phys. Rev. B 68, 035342 (2003)","10.1103/PhysRevB.68.035342",,"cond-mat.mes-hall cond-mat.str-el",,"  The zero-temperature linear response conductance through an interacting
mesoscopic region attached to noninteracting leads is investigated. We present
a set of formulae expressing the conductance in terms of the ground-state
energy or persistent currents in an auxiliary system, namely a ring threaded by
a magnetic flux and containing the correlated electron region. We first derive
the conductance formulae for the noninteracting case and then give arguments
why the formalism is also correct in the interacting case if the ground state
of a system exhibits Fermi liquid properties. We prove that in such systems,
the ground-state energy is a universal function of the magnetic flux, where the
conductance is the only parameter. The method is tested by comparing its
predictions with exact results and results of other methods for problems such
as the transport through single and double quantum dots containing interacting
electrons. The comparisons show an excellent quantitative agreement.
","[{""version"":""v1"",""created"":""Thu, 30 Jan 2003 20:00:12 GMT""},{""version"":""v2"",""created"":""Wed, 11 Jun 2003 19:15:45 GMT""}]","2009-11-10"
"cond-mat/0301609","Maciej M. Duras","Maciej M. Duras","Statistics of complex dissipative systems","7 pages; presented at poster session of the conference ""Space Time
  Chaos: Characterization, Control and Synchronization""; June 19th, 2000 to
  June 23rd, 2000; Department of Physics and Applied Mathematics and Institute
  of Physics, University of Navarra, Pamplona, Navarra, Spain (2000)",,,,"cond-mat.stat-mech",,"  A quantum statistical random system with energy dissipation is studied. Its
statistics is governed by random complex-valued non-Hermitean Hamiltonians
belonging to complex Ginibre ensemble of random matrices. The eigenenergies of
Hamiltonians are shown to form stable structure. Analogy of Wigner and Dyson
with system of electrical charges is drawn.
","[{""version"":""v1"",""created"":""Thu, 30 Jan 2003 20:03:23 GMT""},{""version"":""v2"",""created"":""Wed, 2 Jul 2003 16:32:15 GMT""}]","2007-05-23"
"cond-mat/0301610","J. E. Hirsch","J.E. Hirsch","Electron-hole asymmetry is the key to superconductivity","Presented at the New3SC-4 meeting, San Diego, Jan. 16-21 2003; to be
  published in Int. J. Mod. Phys. B","Int. J. Mod. Phys. B 17, 3236 (2003)","10.1142/S021797920302079X",,"cond-mat.supr-con cond-mat.str-el",,"  In a solid, transport of electricity can occur via negative electrons or via
positive holes. In the normal state of superconducting materials experiments
show that transport is usually dominated by $dressed$ $positive$ $hole$
$carriers$. Instead, in the superconducting state experiments show that the
supercurrent is always carried by $undressed$ $negative$ $electron$ $carriers$.
These experimental facts indicate that electron-hole asymmetry plays a
fundamental role in superconductivity, as proposed by the theory of hole
superconductivity.
","[{""version"":""v1"",""created"":""Thu, 30 Jan 2003 21:00:11 GMT""},{""version"":""v2"",""created"":""Sat, 1 Feb 2003 00:16:47 GMT""}]","2008-05-19"
"cond-mat/0301611","J. E. Hirsch","J.E. Hirsch","Superconductors as giant atoms predicted by the theory of hole
  superconductivity","To be published in Phys.Lett.A","Phys.Lett.A 309, 457 (2003)","10.1016/S0375-9601(03)00204-4",,"cond-mat.supr-con cond-mat.str-el",,"  The theory of hole superconductivity proposes that superconductivity
originates in the fundamental electron-hole asymmetry of condensed matter and
that it is an 'undressing' transition. Here we propose that a natural
consequence of this theory is that superconductors behave as giant atoms. The
model predicts that the charge distribution in superconductors is
inhomogeneous, with higher concentration of negative charge near the surface.
Some of this negative charge will spill out, giving rise to a negative electron
layer right outside the surface of the superconductor, which should be
experimentally detectable. Also superconductors should have a tendency to
easily lose negative charge and become positively charged. Macroscopic spin
currents are predicted to exist in superconducting bodies, giving rise to
electric fields near the surface of multiply connected superconductors that
should be experimentally detectable.
","[{""version"":""v1"",""created"":""Thu, 30 Jan 2003 21:00:17 GMT""},{""version"":""v2"",""created"":""Sun, 2 Feb 2003 18:30:37 GMT""}]","2009-11-10"
"cond-mat/0301612","Xuedong Hu","Xuedong Hu and S. Das Sarma","Spin swap gate in the presence of qubit inhomogeneity in a double
  quantum dot","published version","Phys. Rev. A 68, 052310 (2003)","10.1103/PhysRevA.68.052310",,"cond-mat.mes-hall quant-ph",,"  We study theoretically the effects of qubit inhomogeneity on the quantum
logic gate of qubit swap, which is an integral part of the operations of a
quantum computer. Our focus here is to construct a robust pulse sequence for
swap operation in the simultaneous presence of Zeeman inhomogeneity for quantum
dot trapped electron spins and the finite-time ramp-up of exchange coupling in
a double dot. We first present a geometric explanation of spin swap operation,
mapping the two-qubit operation onto a single-qubit rotation. We then show that
in this geometric picture a square-pulse-sequence can be easily designed to
perform swap in the presence of Zeeman inhomogeneity. Finally, we investigate
how finite ramp-up times for the exchange coupling $J$ negatively affect the
performance of the swap gate sequence, and show how to correct the problems
numerically.
","[{""version"":""v1"",""created"":""Thu, 30 Jan 2003 22:03:38 GMT""},{""version"":""v2"",""created"":""Tue, 4 Feb 2003 17:19:28 GMT""},{""version"":""v3"",""created"":""Fri, 26 Nov 2004 20:55:32 GMT""}]","2009-11-10"
