"astro-ph/0301600","Andy Nelson","Andrew F. Nelson (University of Edinburgh, Edinburgh Scotland)","A Resolution Requirement for Disk Simulations Modeling Collapse","4pages. Final version of submission for the ""Scientific Frontiers in
  Research on Extrasolar Planets"" conference: June 2002 in Washington",,,,"astro-ph",,"  The accurate simulation of collapsed objects requires that a huge range of
spatial scales be well resolved if the result is not to be contaminated by
numerically induced fragmentation. In this context, `insufficient resolution'
means comparable to the local instability wavelength in the system. I define a
minimum resolution criterion for simulations of disk systems, using the
critical wavelength appropriate for disks.
","[{""version"":""v1"",""created"":""Thu, 30 Jan 2003 17:42:20 GMT""}]","2007-05-23"
"astro-ph/0301608","Fabrizio Tavecchio","Stefano Covino, Gabriele Ghisellini, Davide Lazzati, Daniele Malesani","Polarization of Gamma--Ray Burst Optical and Near-Infrared Afterglows","6 pages, 4 figures. Solicited talk at the meeting: ""Gamma Ray Bursts
  in the afterglow era - Third workshop."", Rome, September 2002","ASP.Conf.Ser.312:169,2004",,,"astro-ph",,"  Gamma-Ray Burst afterglow polarization measurements, in spite of their
intrinsic difficulties, have been carried out for a number of events that
begins to be adequate to draw some general statistical conclusions. Although
the presence of some degree of intrinsic polarization seems to be well
established, there are still open problems regarding the polarization time
evolution and the possible contribution of polarization induced by dust in the
host galaxies.
","[{""version"":""v1"",""created"":""Thu, 30 Jan 2003 17:19:38 GMT""}]","2008-11-26"
"astro-ph/0301612","James E. Taylor","James E. Taylor (Oxford), Arif Babul (Victoria)","The Evolution of Substructure in Galaxy, Group and Cluster Haloes I:
  Basic Dynamics","20 pages, 20 figures; submitted to MNRAS","Mon.Not.Roy.Astron.Soc. 348 (2004) 811","10.1111/j.1365-2966.2004.07395.x",,"astro-ph",,"  The hierarchical mergers that form the haloes of dark matter surrounding
galaxies, groups and clusters are not entirely efficient, leaving substantial
amounts of dense substructure, in the form of stripped halo cores or
`subhaloes', orbiting within these systems. Using a semi-analytic model of
satellite dynamics, we study the evolution of haloes as they merge
hierarchically, to determine how much substructure survives merging and how the
properties of individual subhaloes change over time. We find that subhaloes
evolve, due to mass loss, orbital decay, and tidal disruption, on a
characteristic time-scale equal to the period of radial oscillations at the
virial radius of the system. Subhaloes with realistic densities and density
profiles lose 25-45 per cent of their mass per pericentric passage, depending
on their concentration and on the circularity of their orbit. As the halo
grows, the subhalo orbits also grow in size and become less bound. Based on
these general patterns, we suggest a method for including realistic amounts of
substructure in semi-analytic models based on merger trees. We show that the
parameters in the resulting model can be fixed by requiring self-consistency
between different levels of the merger hierarchy. In a companion paper, we will
compare the results of our model with numerical simulations of halo formation.
","[{""version"":""v1"",""created"":""Thu, 30 Jan 2003 16:02:10 GMT""}]","2009-11-07"
"astro-ph/0301614","Luca Ciotti","V. Muccione and L. Ciotti","Collisionless evaporation from cluster elliptical galaxies","6 pages, 2 figures. To appear on ""Lecture Notes in Physics"",
  proceedings of the Workshop on ""Galaxies and Chaos. Theory and Observations"",
  Athens (September 16-19, 2002), G. Contopoulos and N. Voglis, eds",,"10.1007/978-3-540-45040-5_33","BAP-12-2002-28-DDA","astro-ph",,"  We describe a particular aspect of the effects of the parent cluster tidal
field (CTF) on stellar orbits inside cluster Elliptical galaxies. In particular
we discuss, with the aid of a simple numerical model, the possibility that
collisionless stellar evaporation from elliptical galaxies is an effective
mechanism for the production of the recently discovered intracluster stellar
populations. A preliminary investigation, based on very idealized galaxy
density profiles (Ferrers density distributions), showed that over an Hubble
time, the amount of stars lost by a representative galaxy may sum up to the 10%
of the initial galaxy mass, a fraction in interesting agreement with
observational data. The effectiveness of this mechanism is due to the fact that
the galaxy oscillation periods near equilibrium configurations in the CTF are
comparable to stellar orbital times in the external galaxy regions. Here we
extend our previous study to more realistic galaxy density profiles, in
particular by adopting a triaxial Hernquist model.
","[{""version"":""v1"",""created"":""Thu, 30 Jan 2003 16:17:04 GMT""}]","2015-06-24"
"astro-ph/0301615","Mario Livio","Mario Livio","Cosmology and Life","13 pages, no figures or tables. To be published in the proceedings of
  Carnegie Observatories Centennial Symposium II, ""Measuring and Modeling the
  Universe,"" held 12-22 November 2002, Carnegie Observatories, Pasadena, CA,
  USA",,,,"astro-ph",,"  I examine some recent findings in cosmology and their potential implications
for the emergence of life in the universe. In particular, I discuss the
requirements for carbon-based life, anthropic considerations with respect to
the nature of dark energy, the possibility of time-varying constants of nature,
and the question of the rarity of intelligent life.
","[{""version"":""v1"",""created"":""Thu, 30 Jan 2003 16:25:21 GMT""}]","2007-05-23"
"astro-ph/0301616","Eric F. Bell","Eric F. Bell (MPIA, Heidelberg), Daniel H. McIntosh, Neal Katz and
  Martin D. Weinberg (UMass)","A First Estimate of the Baryonic Mass Function of Galaxies","ApJ Letters, accepted. 4 pages, 2 embedded figures","Astrophys.J. 585 (2003) L117-L120","10.1086/374389",,"astro-ph",,"  We estimate the baryonic (stellar+cold gas) mass function of galaxies in the
local Universe by assigning a complete sample of Two Micron All Sky Survey and
Sloan Digital Sky Survey galaxies a gas fraction based on a statistical sample
of the entire population, under the assumption of a universally-applicable
stellar initial mass function. The baryonic mass function is similar to the
stellar mass function at the high mass end, and has a reasonably steep
faint-end slope owing to the typically high cold gas fractions and low stellar
mass-to-light ratios characteristic of low-mass galaxies. The Schechter
Function fit parameters are phi* = 0.0108(6) per cubic Mpc per dex of mass, M*
= 5.3(3)x10^10 solar masses, and alpha = -1.21(5), with formal error estimates
given in parentheses (for a Hubble constant of 100 km/s per Mpc). We show that
the neutral and molecular hydrogen mass functions derived using this indirect
route are in agreement with direct estimates, validating our indirect method.
Integrating under the baryonic mass function and incorporating all sources of
uncertainty, we find that the baryonic (stellar+cold gas) mass density implied
by this estimate is Omega_cold baryon = 0.0024+0.0007-0.0014, or 8% +4% -5% of
the Big Bang nucleosynthesis expectation.
","[{""version"":""v1"",""created"":""Thu, 30 Jan 2003 17:09:58 GMT""}]","2009-11-07"
"astro-ph/0301617","Adam Dobrzycki","A. Dobrzycki, K. Z. Stanek, L. M. Macri and P. J. Groot","New X-ray quasars behind the Small Magellanic Cloud","Revised version, AASTeX, 20 pages, 7 figures, accepted for
  publication in the Astronomical Journal, August 2003 issue","Astron.J.126:734,2003","10.1086/376740",,"astro-ph",,"  We present five X-ray quasars behind the Small Magellanic Cloud, increasing
the number of known quasars behind the SMC by ca. 40%. They were identified via
follow-up spectroscopy of serendipitous sources from the Chandra X-ray
Observatory matched with objects from the OGLE database. All quasars lie behind
dense parts of the SMC, and could be very useful for proper motion studies. We
analyze X-ray spectral and timing properties of the quasars. We discuss
applications of those and other recently discovered quasars behind the SMC to
the studies of absorption properties of the Cloud, its proper motion, and for
establishing the geometrical distance to the SMC.
","[{""version"":""v1"",""created"":""Thu, 30 Jan 2003 17:00:33 GMT""},{""version"":""v2"",""created"":""Wed, 7 May 2003 03:18:41 GMT""}]","2008-11-07"
"astro-ph/0301618","Marcus Ansorg","K. Sch\""obel, M. Ansorg","Maximal mass of uniformly rotating homogeneous stars in Einsteinian
  gravity","4 pages, 4 figures, 1 table, submitted to A&A, corrected eq. for W,
  W' in 3.1","Astron.Astrophys.405:405-408,2003","10.1051/0004-6361:20030634",,"astro-ph gr-qc",,"  Using a multi domain spectral method, we investigate systematically the
general-relativistic model for axisymmetric uniformly rotating, homogeneous
fluid bodies generalizing the analytically known Maclaurin and Schwarzschild
solutions. Apart from the curves associated with these solutions and a further
curve of configurations that rotate at the mass shedding limit, two more curves
are found to border the corresponding two parameter set of solutions. One of
them is a Newtonian lens shaped sequence bifurcating from the Maclaurin
spheroid sequence, while the other one corresponds to highly relativistic
bodies with an infinite central pressure. The properties of the configuration
for which both the gravitational and the baryonic masses, moreover angular
velocity, angular momentum as well as polar red shift obtain their maximal
values are discussed in detail. In particular, by comparison with the static
Schwarzschild solution, we obtain an increase of 34.25% in the gravitational
mass. Moreover, we provide exemplarily a discussion of angular velocity and
gravitational mass on the entire solution class.
","[{""version"":""v1"",""created"":""Thu, 30 Jan 2003 17:19:46 GMT""},{""version"":""v2"",""created"":""Mon, 17 Feb 2003 17:10:50 GMT""}]","2011-05-23"
"astro-ph/0301619","Andy Nelson","Andrew F. Nelson (1,2) and Willy Benz (3) ((1) MPIA Heidelberg
  Germany, (2) University of Edinburgh, Edinburgh, Scotland, (3) Universitaet
  Bern, Bern Switzerland)","On the Early Evolution of Forming Jovian Planets I: Initial Conditions,
  Systematics and Qualitative Comparisons to Theory","39 pages incl 13 figures. High resolution color figures at
  http://www.maths.ed.ac.uk/~andy/publications.html","Astrophys.J. 589 (2003) 556-577","10.1086/374545",,"astro-ph",,"  (abridged) We analyze the formation and migration of a proto-Jovian companion
in a circumstellar disk in 2d, during the period in which the companion makes
its transition from `Type I' to `Type II' migration, using a PPM code. Spiral
waves are generated by the gravitational torque of the planet on the disk.
Their effects are to cause the planet to migrate inward and the disk to form a
deep (low surface density) gap. Until a transition to slower Type II migration,
the migration rate of the planet is of order 1 AU/10$^3$ yr, and varies by less
than a factor of two with a factor twenty change in planet mass, but depends
near linearly on the disk mass. Although the disk is stable to self gravitating
perturbations (Toomre $Q>5$ everywhere), migration is faster by a factor of two
or more when self gravity is suppressed. Migration is equally sensitive to the
disk's mass distribution within 1--2 Hill radii of the planet, as demonstrated
by our simulations' sensitivity to the planet's assumed gravitational softening
parameter. Rapid migration can continue after gap formation. Gaps are typically
several AU in width and display the \mplan$^{2/3}$ proportionality predicted by
theory. Beginning from an initially unperturbed 0.05\msun disk, planets of mass
$M_{\rm pl}> 0.3$\mj can open a gap deep and wide enough to complete the
transition to slower \ttwo migration. Lower mass objects continue to migrate
rapidly, eventually impacting the inner boundary of our grid. This transition
mass is much larger than that predicted as the `Shiva mass' discussed in Ward
and Hahn (2000), making the survival of forming planets even more precarious
than they would predict.
","[{""version"":""v1"",""created"":""Thu, 30 Jan 2003 17:27:45 GMT""}]","2009-11-07"
"astro-ph/0301620","Andy Nelson","Andrew F. Nelson (1,2), Willy Benz (3) (1 MPIA Heidelberg Germany) (2
  University of Edinburgh, Edinburgh Scotland), (3 Universitaet Bern, Bern
  Switzerland)","On the Early Evolution of Forming Jovian Planets II: Analysis of
  Accretion and Gravitational Torques","52 pages including 20 figures. also available at
  http://www.maths.ed.ac.uk/~andy/publications.html","Astrophys.J. 589 (2003) 578-604","10.1086/374546",,"astro-ph",,"  (abridged) We find that a disk can supply a forming planet with mass at an
essentially infinite rate ($\sim1$\mj/25 yr) so that a gap could form very
quickly. We show that mass accretion rates faster than $\sim10^{-4}$\mj/yr are
not physically reasonable in the limit of either a thin, circumplanetary disk
or of a spherical envelope. Planet growth and ultimately survival are therefore
limited to the planet's ability to accept additional matter, not by the disk in
which it resides. We find that common analytic torque approximations predict
values that are a factor $\sim10$ larger than those obtained from the
simulations. Accounting for the disk's vertical structure (crudely modeled
through a gravitational softening parameter), small shifts in resonance
positions due to pressure gradients, to disk self gravity and to inclusion of
non-WKB terms in the analysis (Artymowicz 1993) reduce the difference to a
factor $\sim3-6$. Torques from the corotation resonances that are positive in
sign contribute 20-30% or more of the net torque on the planet. The assumption
of linearity underlying theoretical analyses is recovered in the simulations
with planets with masses below 0.5\mj, but the assumption that interactions
occur only at the resonances is more difficult to support. The detailed shape
of the disk's response varies from pattern to pattern, making its true position
less clear. We speculate that the finite width allows for overlap and mixing
between resonances and may be responsible for the remainder of the differences
between torques from theory and simulation, but whether accounting for such
overlap in a theory will improve the agreement with the simulations is not
clear.
","[{""version"":""v1"",""created"":""Thu, 30 Jan 2003 17:36:03 GMT""}]","2009-11-07"
"astro-ph/0301621","Norbert Przybilla","Rolf-Peter Kudritzki and Norbert Przybilla (IfA, Hawaii)","Blue Supergiants as a Tool for Extragalactic Distances - Theoretical
  Concepts","25 pages, 16 figures; Invited review at the International Workshop on
  ""Stellar Candles for the Extragalactic Distance Scale"", held in Concepcion,
  Chile, December 9-11, 2002, to be published in: ""Stellar Candles"", Lecture
  Notes in Physics, Springer-Verlag","Lect.Notes Phys. 635 (2003) 123-148","10.1007/978-3-540-39882-0_7",,"astro-ph",,"  Because of their enormous intrinsic brightness blue supergiants are ideal
stellar objects to be studied spectroscopically as individuals in galaxies far
beyond the Local Group. Quantitative spectroscopy by means of efficient
multi-object spectrographs attached to 8m-class telescopes and modern NLTE
model atmosphere techniques allow us to determine not only intrinsic stellar
parameters such as effective temperature, surface gravity, chemical composition
and absolute magnitude but also very accurately interstellar reddening and
extinction. This is a significant advantage compared to classical distance
indicators like Cepheids and RR Lyrae. We describe the spectroscopic
diagnostics of blue supergiants and introduce two concepts to determine
absolute magnitudes. The first one (Wind Momentum -- Luminosity Relationship)
uses the correlation between observed stellar wind momentum and luminosity,
whereas the second one (Flux-weighted Gravity -- Luminosity Relationship)
relies only on the determination of effective temperature and surface gravity
to yield an accurate estimate of absolute magnitude. We discuss the potential
of these two methods.
","[{""version"":""v1"",""created"":""Thu, 30 Jan 2003 22:32:34 GMT""}]","2015-06-24"
"astro-ph/0301622","Sangeeta Malhotra","S. Malhotra (STScI), J. X. Wang (JHU), J. E. Rhoads (STScI), T. M.
  Heckman (JHU), C.Norman (STScI)","No X-ray Bright Type II Quasars Among the Lyman-alpha Emitters","Accepted by ApJ letters","Astrophys.J.585:L25-L28,2003","10.1086/373917",,"astro-ph",,"  The Lyman-alpha emitters found at z=4.5 and 5.7 by the Large Area Lyman Alpha
(LALA) survey have high equivalent widths in the Lyman-alpha line. Such lines
can be produced by narrow-lined active galactic nuclei (AGNs) or by stellar
populations with a very high proportion of young, massive stars. To check for
Type-II (i.e., narrow-lined) quasars, we obtained a deep X-ray image of 49
Lyman-alpha sources in a single field of the ACIS instrument on the Chandra
X-ray Observatory. None of these sources were detected with a 3-sigma limiting
X-ray luminosity of 2.9x10^{43} ergs/s. For comparison, the two known high
redshift type-II quasars have luminosities of 4x10^{43} ergs/s before
extinction correction. The sources remain undetected in stacked images of the
49 lyman-alpha sources (with 6.5 Mega-seconds effective Chandra on-axis
exposure) at 3-sigma limits of 4.9x10^{42} ergs/s. The resulting X-ray to
lyman-alpha ratio is about 4-24 times lower than the ratio for known type-II
quasars, while the average Lyman-alpha luminosity of the LALA sample is in
between the two type-II's. The cumulative X-ray to Lyman-alpha ratio limit is
also below that of 90% of low-redshift Seyfert galaxies.
","[{""version"":""v1"",""created"":""Thu, 30 Jan 2003 21:02:04 GMT""}]","2009-11-07"
"astro-ph/0301623","Daniel Eisenstein","Daniel Eisenstein (Steward Observatory)","Large-Scale Structure and Future Surveys","Proceedings from Wide-Field Multi-Object Spectroscopy conference at
  NOAO in October 2001, to be published by the ASP Conference Series. 8 pages,
  LaTex, 1 figure",,,,"astro-ph",,"  As the 2dF Galaxy Redshift Survey and Sloan Digital Sky Survey move toward
completion, it is time to ask what the next generation of survey of large-scale
structure should be. I discuss some of the cosmological justifications for such
surveys and conclude that surveys at z=3 offer a critical advantage in their
ability to access linear-regime clustering at scales smaller than any current
survey and even the CMB. I discuss a possible implementation of such a survey
and highlight some of the potential science return.
","[{""version"":""v1"",""created"":""Thu, 30 Jan 2003 21:06:32 GMT""}]","2007-05-23"
"astro-ph/0301624","Bernardi","M. Bernardi, R. K. Sheth, J. Annis, S. Burles, D. J. Eisenstein, D. P.
  Finkbeiner, D. W. Hogg, R. H. Lupton, D. J. Schlegel, M. Subbarao, et al","Early-type galaxies in the SDSS. II. Correlations between observables","29 pages, 11 figures. Accepted by AJ (scheduled for April 2003). This
  paper is part II of a revised version of astro-ph/0110344","Astron.J. 125 (2003) 1849","10.1086/374256",,"astro-ph",,"  A magnitude limited sample of nearly 9000 early-type galaxies, in the
redshift range 0.01 < z < 0.3, was selected from the Sloan Digital Sky Survey
using morphological and spectral criteria. The sample was used to study how
early-type galaxy observables, including luminosity L, effective radius R_o,
surface brightness I_o, color, and velocity dispersion sigma, are correlated
with one another. Measurement biases are understood with mock catalogs which
reproduce all of the observed scaling relations and their dependences on
fitting technique. At any given redshift, the intrinsic distribution of
luminosities, sizes and velocity dispersions in our sample are all
approximately Gaussian. A maximum likelihood analysis shows that sigma ~
L^{0.25\pm 0.012}, R_o ~ L^{0.63\pm 0.025}, and R_o ~ I^{-0.75\pm 0.02} in the
r* band. In addition, the mass-to-light ratio within the effective radius
scales as M_o/L ~ L^{0.14\pm 0.02} or M_o/L ~ M_o^{0.22\pm 0.05}, and galaxies
with larger effective masses have smaller effective densities: Delta_o ~
M_o^{-0.52\pm 0.03}. These relations are approximately the same in the g*, i*
and z* bands. Relative to the population at the median redshift in the sample,
galaxies at lower and higher redshifts have evolved only little, with more
evolution in the bluer bands. The luminosity function is consistent with weak
passive luminosity evolution and a formation time of about 9 Gyrs ago.
","[{""version"":""v1"",""created"":""Thu, 30 Jan 2003 21:06:42 GMT""}]","2009-11-07"
"astro-ph/0301625","Dongsu Ryu","Dongsu Ryu (Chungnam National University, Korea), Jongsoo Kim (Korea
  Astronomy Observatory, Korea), Seung Soo Hong (Seoul National University,
  Korea), T. W. Jones (University of Minnesota, USA)","The Effect of Cosmic Ray Diffusion on the Parker Instability","19 pages including 3 figures, to appear in The Astrophysical Journal
  (v589 n1 May 20, 2003 issue)","Astrophys.J. 589 (2003) 338-346","10.1086/374392",,"astro-ph",,"  The Parker instability, which has been considered as a process governing the
structure of the interstellar medium, is induced by the buoyancy of magnetic
field and cosmic rays. In previous studies, while the magnetic field has been
fully incorporated in the context of isothermal magnetohydrodynamics, cosmic
rays have been normally treated with the simplifying assumption of infinite
diffusion along magnetic field lines but no diffusion across them. The cosmic
ray diffusion is, however, finite. In this work, we take into account fully the
diffusion process of cosmic rays in a linear stability analysis of the Parker
instability. Cosmic rays are described with the diffusion-convection equation.
With realistic values of cosmic ray diffusion coefficients expected in the
interstellar medium, we show that the result of previous studies with the
simplifying assumption on cosmic ray diffusion applies well. Finiteness of
parallel diffusion decreases the growth rate of the Parker instability, while
the relatively smaller perpendicular diffusion has no significant effect. We
discuss the implication of our result on the role of the Parker instability in
the interstellar medium.
","[{""version"":""v1"",""created"":""Thu, 30 Jan 2003 21:08:29 GMT""}]","2009-11-07"
"astro-ph/0301626","Bernardi","M. Bernardi, R. K. Sheth, J. Annis, S. Burles, D. J. Eisenstein, D. P.
  Finkbeiner, D. W. Hogg, R. H. Lupton, D. J. Schlegel, M. Subbarao, et al","Early-type galaxies in the SDSS. III. The Fundamental Plane","27 pages, 10 figures. Accepted by AJ (scheduled for April 2003). This
  paper is part III of a revised version of astro-ph/0110344","Astron.J. 125 (2003) 1866","10.1086/367794",,"astro-ph",,"  A magnitude limited sample of nearly 9000 early-type galaxies, in the
redshift range 0.01 < z < 0.3, was selected from the Sloan Digital Sky Survey
using morphological and spectral criteria. The Fundamental Plane relation in
this sample is R_o ~ sigma^{1.49\pm 0.05} I_o^{-0.75\pm 0.01} in the r* band.
It is approximately the same in the g*, i* and z* bands. Relative to the
population at the median redshift in the sample, galaxies at lower and higher
redshifts have evolved only little. If the Fundamental Plane is used to
quantify this evolution then the apparent magnitude limit can masquerade as
evolution; once this selection effect has been accounted for, the evolution is
consistent with that of a passively evolving population which formed the bulk
of its stars about 9 Gyrs ago. One of the principal advangtages of the SDSS
sample over previous samples is that the galaxies in it lie in environments
ranging from isolation in the field to the dense cores of clusters. The
Fundamental Plane shows that galaxies in dense regions are slightly different
from galaxies in less dense regions.
","[{""version"":""v1"",""created"":""Thu, 30 Jan 2003 21:09:19 GMT""}]","2009-11-07"
"astro-ph/0301627","Jonathan Granot","Jonathan Granot, Pawan Kumar, Tsvi Piran","The Jet Angular Profile and the Afterglow Light Curves","4 pages, 2 figures, contributed talk at the meeting ""Gamma Ray Bursts
  in the Afterglow Era - Third Workshop"", September 2002, Rome, Italy",,,,"astro-ph",,"  We investigate how the angular structure of GRB jets effects the afterglow
light curves at different viewing angles, $\theta_{v}$, from the jet symmetry
axis. A numerical hydrodynamical modeling for the evolution of a relativistic
collimated outflow, as it interacts with the surrounding medium, is carried
out, and compared to two simple models that make opposite and extreme
assumptions for the degree of lateral energy transfer. The Lorentz factor,
$\Gamma$, and kinetic energy per unit solid angle, $\epsilon$, are initially
taken to be power laws of the angle $\theta$ from the jet axis. We find that
the lateral velocity in the comoving frame, $v'_\theta$, is typically much
smaller than the sound speed, $c_s$, as long as $\Gamma\gg 1$, and the dynamics
of relativistic structured jets may be reasonably described by a simple
analytic model where $\epsilon$ is independent of time, as long as
$\Gamma(\theta=0)\ga$ a few. We perform a qualitative comparison between the
resulting light curves and afterglow observations. This constrains the jet
structure, and poses problems for a `universal' jet model, where all GRB jets
are assumed to be intrinsically identical, and differ only by our viewing
angle, $\theta_{v}$.
","[{""version"":""v1"",""created"":""Thu, 30 Jan 2003 22:06:18 GMT""}]","2007-05-23"
