"cond-mat/0308305","Ana Maria","Ana Maria Rey, B. L. Hu, Esteban Calzetta, Albert Roura, Charles Clark","Nonequilibrium Dynamics of Optical Lattice-Loaded BEC Atoms: Beyond HFB
  Approximation","34 pages, 7 figures","Phys. Rev. A 69, 033610 (2004)","10.1103/PhysRevA.69.033610","umdpp03-66","cond-mat.soft",,"  In this work a two-particle irreducible (2PI) closed-time-path (CTP)
effective action is used to describe the nonequilibrium dynamics of a Bose
Einstein condensate (BEC) selectively loaded into every third site of a
one-dimensional optical lattice. The motivation of this work is the recent
experimental realization of this system at National Institute of Standards and
Technology (NIST) where the placement of atoms in an optical lattice is
controlled by using an intermediate superlattice. Under the 2PI CTP scheme with
this initial configuration, three different approximations are considered: a)
the Hartree-Fock-Bogoliubov (HFB) approximation, b) the next-to-leading order
1/$\mathcal{N}$ expansion of the 2PI effective action up to second order in the
interaction strength and c) a second order perturbative expansion in the
interaction strength. We present detailed comparisons between these
approximations and determine their range of validity by contrasting them with
the exact many body solution for a moderate number of atoms and wells. As a
general feature we observe that because the second order 2PI approximations
include multi-particle scattering in a systematic way, they are able to capture
damping effects exhibited in the exact solution that a mean field collisionless
approach fails to produce. While the second order approximations show a clear
improvement over the HFB approximation our numerical result shows that they do
not work so well at late times, when interaction effects are significant.
","[{""version"":""v1"",""created"":""Fri, 15 Aug 2003 13:17:15 GMT""}]","2013-05-29"
"cond-mat/0308306","Lincoln D. Carr","L.D. Carr, G.V. Shlyapnikov and Y. Castin","Achieving a BCS transition in an atomic Fermi gas","4 pages, 1 figure. Phys. Rev. Lett. in press","Phys. Rev. Lett. 92, 150404 (2004)","10.1103/PhysRevLett.92.150404",,"cond-mat.supr-con",,"  We consider a gas of cold fermionic atoms having two spin components with
interactions characterized by their s-wave scattering length $a$. At positive
scattering length the atoms form weakly bound bosonic molecules which can be
evaporatively cooled to undergo Bose-Einstein condensation, whereas at negative
scattering length BCS pairing can take place. It is shown that, by
adiabatically tuning the scattering length $a$ from positive to negative
values, one may transform the molecular Bose-Einstein condensate into a highly
degenerate atomic Fermi gas, with the ratio of temperature to Fermi temperature
$T/T_F \sim 10^{-2}$. The corresponding critical final value of $k_{F}|a|$
which leads to the BCS transition is found to be about one half, where $k_F$ is
the Fermi momentum.
","[{""version"":""v1"",""created"":""Fri, 15 Aug 2003 13:42:48 GMT""},{""version"":""v2"",""created"":""Wed, 25 Feb 2004 23:45:40 GMT""}]","2009-11-10"
"cond-mat/0308307","Arne Traulsen","Arne Traulsen, Karen Lippert, Ulrich Behn","Generation of spatiotemporal correlated noise in 1+1 dimensions","9 pages, 3 figures","Phys. Rev. E 69, 026116 (2004)","10.1103/PhysRevE.69.026116",,"cond-mat.stat-mech",,"  We propose a generalization of the Ornstein-Uhlenbeck process in 1+1
dimensions which is the product of a temporal Ornstein-Uhlenbeck process with a
spatial one and has exponentially decaying autocorrelation. The generalized
Langevin equation of the process, the corresponding Fokker-Planck equation, and
a discrete integral algorithm for numerical simulation is given. The process is
an alternative to a recently proposed spatiotemporal correlated model process
[J. Garcia-Ojalvo et al., Phys. Rev. A 46, 4670 (1992)] for which we calculate
explicitely the hitherto not known autocorrelation function in real space.
","[{""version"":""v1"",""created"":""Fri, 15 Aug 2003 13:59:34 GMT""}]","2009-11-10"
"cond-mat/0308308","Ido Kanter","Ido Kanter, Haggai Kfir and Shahar Keren","An efficient joint source-channel coding for a D-dimensional array","19 pages and 12 figures",,,,"cond-mat.stat-mech cond-mat.dis-nn",,"  An efficient joint source-channel (S/C) decoder based on the side information
of the source and on the MN-Gallager Code over Galois fields, $q$, is
presented. The dynamical posterior probabilities are derived either from the
statistical mechanical approach for calculation of the entropy for the
correlated sequences, or by the Markovian joint S/C algorithm. The Markovian
joint S/C decoder has many advantages over the statistical mechanical approach,
among them: (a) there is no need for the construction and the diagonalization
of a $q \times q$ matrix and for a solution to saddle point equations in $q$
dimensions; (b) a generalization to a joint S/C coding of an array of
two-dimensional bits (or higher dimensions) is achievable; (c) using parametric
estimation, an efficient joint S/C decoder with the lack of side information is
discussed. Besides the variant joint S/C decoders presented, we also show that
the available sets of autocorrelations consist of a convex volume, and its
structure can be found using the Simplex algorithm.
","[{""version"":""v1"",""created"":""Fri, 15 Aug 2003 14:04:09 GMT""}]","2007-05-23"
"cond-mat/0308309","Mikhail Zverev","V.A.Khodel, P.Schuck, and M.V.Zverev","Spin degrees of freedom and flattening of the spectra of single-particle
  excitations in strongly correlated Fermi systems","7 pages, 15 figures","Phys. At. Nucl. 66, 1871 (2003)","10.1134/1.1619498",,"cond-mat.str-el",,"  The impact of long-range spin-spin correlations on the structure of a flat
portion in single-particle spectra $\xi(p)$, which emerges beyond the point,
where the Landau state loses its stability, is studied. We supplement the
well-known Nozieres model of a Fermi system with limited scalar long-range
forces by a similar long-range spin-dependent term and calculate the spectra
versus its strength $g$. It is found that Nozieres results hold as long as
$g>0$. However, with $g$ changing its sign, the spontaneous magnetization is
shown to arise at any nonzero $g$. The increase of the strength $|g|$ is
demonstrated to result in shrinkage of the domain in momentum space, occupied
by the flat portion of $\xi(p)$, and, eventually, in its vanishing.
","[{""version"":""v1"",""created"":""Fri, 15 Aug 2003 14:16:27 GMT""}]","2009-11-10"
"cond-mat/0308310","Jens Tobiska","J. Tobiska and Yu. V. Nazarov","Josephson junctions as threshold detectors for full counting statistics","4 pages, 3 figures","Phys. Rev. Lett. 93, 106801 (2004)","10.1103/PhysRevLett.93.106801",,"cond-mat.mes-hall",,"  We discuss how threshold detectors can be used for a direct measurement of
the full counting statistics (FCS) of current fluctuations and how to implement
Jose phson junctions in this respect. We propose a scheme to characterize the
full co unting statistics from the current dependence of the escape rate
measured. We il lustrate the scheme with explicit results for tunnel, diffusive
and quasi-ballis tic mesoscopic conductors.
","[{""version"":""v1"",""created"":""Fri, 15 Aug 2003 14:38:15 GMT""},{""version"":""v2"",""created"":""Tue, 5 Oct 2004 18:59:04 GMT""}]","2009-11-10"
"cond-mat/0308311","Masatsugu Suzuki","Masatsugu Suzuki, Itsuko S. Suzuki, and J\""urgen Walter","H-T phase diagram and the nature of Vortex-glass phase in a quasi
  two-dimensional superconductor: Sn metal layer sandwiched between graphene
  sheets","24 pages, 13 figures; Physica C (2003), in press","Physica C 402 (2004) 243-256","10.1016/j.physc.2003.10.001",,"cond-mat.supr-con",,"  The magnetic properties of a quasi two-dimensional superconductor, Sn-metal
graphite (MG), are studied using DC and AC magnetic susceptibility. Sn-MG has a
unique layered structure where Sn metal layer is sandwiched between adjacent
graphene sheets. This compound undergoes a superconducting transition at
$T_{c}$ = 3.75 K at $H$ = 0. The $H$-$T$ diagram of Sn-MG is similar to that of
a quasi two-dimensional superconductors. The phase boundaries of vortex liquid,
vortex glass, and vortex lattice phase merge into a multicritical point located
at $T^{*}$ = 3.4 K and $H^{*}$ = 40 Oe. There are two irreversibility lines
denoted by $H_{gl}$ (de Almeida-Thouless type) and $H_{gl^{\prime}}$
(Gabay-Toulouse type), intersecting at $T_{0}^{\prime}$= 2.5 K and
$H_{0}^{\prime}$ = 160 Oe. The nature of slow dynamic and nonlinearity of the
vortex glass phase is studied.
","[{""version"":""v1"",""created"":""Fri, 15 Aug 2003 14:39:43 GMT""}]","2016-08-16"
"cond-mat/0308312","Masatsugu Suzuki","Masatsugu Suzuki, Itsuko S. Suzuki, Robert Lee, and J\""urgen Walter","Magnetic-field induced superconductor-metal-insulator transitions in
  bismuth metal-graphite","9 pages, 9 figures; published in Phys. Rev. B 66, 014533 (2002)","Phys. Rev. B 66, 014533 (2002)","10.1103/PhysRevB.66.014533",,"cond-mat.supr-con",,"  Bismuth-metal graphite (MG) has a unique layered structure where Bi
nanoparticles are encapsulated between adjacent sheets of nanographites. The
superconductivity below $T_{c}$ (= 2.48 K) is due to Bi nanoparticles. The
Curie-like susceptibility below 30 K is due to conduction electrons localized
near zigzag edges of nanographites. A magnetic-field induced transition from
metallic to semiconductor-like phase is observed in the in-plane resistivity
$\rho_{a}$ around $H_{c}$ ($\approx$ 25 kOe) for both $H$$\perp$$c$ and
$H$$\parallel$$c$ ($c$: c axis). A negative magnetoresistance in $\rho_{a}$ for
$H$$\perp$$c$ (0$<H\leq$3.5 kOe) and a logarithmic divergence in $\rho_{a}$
with decreasing temperature for $H$$\parallel$$c$ ($H$ $>$ 40 kOe) suggest the
occurrence of two-dimensional weak localization effect.
","[{""version"":""v1"",""created"":""Fri, 15 Aug 2003 14:50:31 GMT""}]","2016-08-16"
"cond-mat/0308313","Denis Feinberg","O. Sauret and D. Feinberg","Spin current shot noise as a probe of interactions in mesoscopic systems","5 pages, 4 Figures, revised version, added references","Phys. Rev. Lett. 92, 106601 (2004)","10.1103/PhysRevLett.92.106601",,"cond-mat.mes-hall",,"  It is shown that the spin resolved current shot noise can probe attractive or
repulsive interactions in mesoscopic systems. This is illustrated in two
physical situations : i) a normal-superconducting junction where the spin
current noise is found to be zero, and ii) a single electron transistor (SET),
where the spin current noise is found to be Poissonian. Repulsive interactions
may also lead to weak attractive correlations (bunching of opposite spins) in
conditions far from equilibrium. Spin current shot noise can be used to measure
the spin relaxation time $T_1$, and a set-up is proposed in a quantum dot
geometry.
","[{""version"":""v1"",""created"":""Fri, 15 Aug 2003 15:30:21 GMT""},{""version"":""v2"",""created"":""Thu, 21 Aug 2003 13:01:09 GMT""},{""version"":""v3"",""created"":""Thu, 6 Nov 2003 13:27:31 GMT""}]","2009-11-10"
"cond-mat/0308314","Katalin Ga\'al-Nagy","Katalin Gaal-Nagy, Pasquale Pavone, and Dieter Strauch","Ab initio study of the beta$-tin->Imma->sh phase transitions in silicon
  and germanium","12 pages, 16 figures","Phys. Rev. B 69, 134112 (2004)","10.1103/PhysRevB.69.134112",,"cond-mat.mtrl-sci",,"  We have investigated the structural sequence of the high-pressure phases of
silicon and germanium. We have focussed on the cd->beta-tin->Imma->sh phase
transitions. We have used the plane-wave pseudopotential approach to the
density-functional theory implemented within the Vienna ab-initio simulation
package (VASP). We have determined the equilibrium properties of each structure
and the values of the critical parameters including a hysteresis effect at the
phase transitions. The order of the phase transitions has been obtained
alternatively from the pressure dependence of the enthalpy and of the internal
structure parameters. The commonly used tangent construction is shown to be
very unreliable. Our calculations identify a first-order phase transition from
the cd to the beta-tin and from the Imma to the sh phase, and they indicate the
possibility of a second-order phase-transition from the beta-tin to the Imma
phase. Finally, we have derived the enthalpy barriers between the phases.
","[{""version"":""v1"",""created"":""Fri, 15 Aug 2003 15:56:58 GMT""},{""version"":""v2"",""created"":""Thu, 22 Jan 2004 15:38:51 GMT""}]","2009-11-10"
"cond-mat/0308316","Des Johnston","D.A. Johnston, W. Janke and R. Kenna","Information Geometry, One, Two, Three (and Four)",,"Acta Phys.Polon. B34 (2003) 4923-4937",,,"cond-mat.stat-mech hep-lat",,"  Although the notion of entropy lies at the core of statistical mechanics, it
is not often used in statistical mechanical models to characterize phase
transitions, a role more usually played by quantities such as various order
parameters, specific heats or suscept ibilities. The relative entropy induces a
metric, the so-called information or Fisher-Rao m etric, on the space of
parameters and the geometrical invariants of this metric carry information
about the phase structure of the model.
  In various models the scalar curvature, ${\cal R}$, of the information metric
has been found to diverge at the phase transition point and a plausible scaling
relation postulated. For spin models the necessity of calculating in non-zero
field has limited analytic consideration to one-dimensional, mean-field and
Bethe lattice Ising models. We report on previous papers in which we extended
the list somewhat in the current note by considering the {\it one}-dime nsional
Potts model, the {\it two}-dimensional Ising model coupled to two-dimensional
quantum gravity and the {\it three}-dimensional spherical model. We note that
similar ideas have been ap plied to elucidate possible critical behaviour in
families of black hole solutions in
  {\it four} space-time dimensions.
","[{""version"":""v1"",""created"":""Fri, 15 Aug 2003 15:57:51 GMT""}]","2016-08-31"
"cs/0308022","Steven Bird","Steven Bird and Gary Simons","Extending Dublin Core Metadata to Support the Description and Discovery
  of Language Resources","12 pages, 1 figure","Computing and the Humanities, 37 (4), 2003",,,"cs.CL cs.DL",,"  As language data and associated technologies proliferate and as the language
resources community expands, it is becoming increasingly difficult to locate
and reuse existing resources. Are there any lexical resources for such-and-such
a language? What tool works with transcripts in this particular format? What is
a good format to use for linguistic data of this type? Questions like these
dominate many mailing lists, since web search engines are an unreliable way to
find language resources. This paper reports on a new digital infrastructure for
discovering language resources being developed by the Open Language Archives
Community (OLAC). At the core of OLAC is its metadata format, which is designed
to facilitate description and discovery of all kinds of language resources,
including data, tools, or advice. The paper describes OLAC metadata, its
relationship to Dublin Core metadata, and its dissemination using the metadata
harvesting protocol of the Open Archives Initiative.
","[{""version"":""v1"",""created"":""Thu, 14 Aug 2003 23:28:21 GMT""}]","2007-05-23"
"cs/0308023","Nikolai Chernov","N. Chernov, C. Lesort, N. Simanyi","On the complexity of curve fitting algorithms","8 pages, no figures","Journal of Complexity, Vol. 20, Issue 4, August 2004, pp. 484-492","10.1016/j.jco.2004.01.004",,"cs.CC cs.CV",,"  We study a popular algorithm for fitting polynomial curves to scattered data
based on the least squares with gradient weights. We show that sometimes this
algorithm admits a substantial reduction of complexity, and, furthermore, find
precise conditions under which this is possible. It turns out that this is,
indeed, possible when one fits circles but not ellipses or hyperbolas.
","[{""version"":""v1"",""created"":""Fri, 15 Aug 2003 15:37:43 GMT""}]","2010-08-12"
"gr-qc/0308047","Eirini Messaritaki","Eirini Messaritaki (University of Florida)","Radiation Reaction on Moving Particles in General Relativity","Doctoral Dissertation, 136 pages, 5 figures",,,,"gr-qc",,"  A particle in the vicinity of a Schwarzschild black hole is known to trace a
geodesic of the Schwarzschild background, to a first approximation. If the
interaction of the particle with its own field (scalar, electromagnetic or
gravitational) is taken into account, the path is no longer a background
geodesic and the self-force that the particle experiences needs to be taken
into consideration.
  In this dissertation, a recently proposed method for the calculation of the
self-force is implemented. According to this method the self-force comes from
the interaction of the particle with the Regular-Remainder scalar field,
electromagnetic potential or metric perturbation. That Regular-Remainder is
obtained by subtracting the Singular part (which exerts no force) from the
retarded scalar field, electromagnetic potential of metric perturbation
generated by the moving particle. First, the Singular scalar fields,
electromagnetic potentials and metric perturbations are calculated for
different sources moving in a Schwarzschild background. For that, the
Thorne-Hartle-Zhang coordinates in the vicinity of the moving source are used.
Then a mode-sum regularization method initially proposed for the direct scalar
field is followed, and the regularization parameters for the singular part of
the scalar field and for the first radial derivative of the singular part of
the self-force are calculated. Also, the numerical calculation of the retarded
scalar field for a particle moving on a circular geodesic in a Schwarzschild
spacetime is presented. Finally, the self-force for a scalar particle moving on
a circular Schwarzschild orbit is calculated and some results about the effects
of the self-force on the orbital frequency of the circular orbit are presented.
","[{""version"":""v1"",""created"":""Thu, 14 Aug 2003 18:19:48 GMT""}]","2016-08-31"
"gr-qc/0308048","Theodore A. Jacobson","Ted Jacobson","Introduction to Quantum Fields in Curved Spacetime and the Hawking
  Effect","Based on lectures given at the CECS School on Quantum Gravity in
  Valdivia, Chile, January 2002, 59 pages, 5 figures; v2 improved explanation
  of use of analyticity in Hawking effect derivation; v3 typo fixed in Fig.2",,,,"gr-qc hep-th",,"  These notes introduce the subject of quantum field theory in curved spacetime
and some of its applications and the questions they raise. Topics include
particle creation in time-dependent metrics, quantum origin of primordial
perturbations, Hawking effect, the trans-Planckian question, and Hawking
radiation on a lattice.
","[{""version"":""v1"",""created"":""Thu, 14 Aug 2003 18:38:16 GMT""},{""version"":""v2"",""created"":""Thu, 6 Nov 2003 09:43:22 GMT""},{""version"":""v3"",""created"":""Fri, 9 Apr 2004 19:06:45 GMT""}]","2007-05-23"
"gr-qc/0308049","Ralf Schutzhold","R. Sch\""utzhold and W. G. Unruh","Large-scale non-locality in ""doubly special relativity"" with an
  energy-dependent speed of light","5 pages RevTeX, several modifications","JETP Lett. 78 (2003) 431-435; Pisma Zh.Eksp.Teor.Fiz. 78 (2003)
  899-903","10.1134/1.1633311",,"gr-qc hep-th",,"  There are two major alternatives for violating the (usual) Lorentz invariance
at large (Planckian) energies or momenta - either not all inertial frames (in
the Planck regime) are equivalent (e.g., there is an effectively preferred
frame) or the transformations from one frame to another are (non-linearly)
deformed (``doubly special relativity''). We demonstrate that the natural (and
reasonable) assumption of an energy-dependent speed of light in the latter
method goes along with violations of locality/separability (and even
translational invariance) on macroscopic scales.
  PACS: 03.30.+p, 11.30.Cp, 04.60.-m, 04.50.+h.
","[{""version"":""v1"",""created"":""Thu, 14 Aug 2003 22:22:03 GMT""},{""version"":""v2"",""created"":""Fri, 29 Aug 2003 20:55:12 GMT""}]","2009-11-10"
"gr-qc/0308050","M. Alessandra Papa","The LIGO Scientific Collaboration: B.Abbott, et al","Setting upper limits on the strength of periodic gravitational waves
  using the first science data from the GEO600 and LIGO detectors","16 pages,8 figures","Phys.Rev.D69:082004,2004","10.1103/PhysRevD.69.082004","LIGO-P030008-E-Z","gr-qc",,"  Data collected by the GEO600 and LIGO interferometric gravitational wave
detectors during their first observational science run were searched for
continuous gravitational waves from the pulsar J1939+2134 at twice its rotation
frequency. Two independent analysis methods were used and are demonstrated in
this paper: a frequency domain method and a time domain method. Both achieve
consistent null results, placing new upper limits on the strength of the
pulsar's gravitational wave emission. A model emission mechanism is used to
interpret the limits as a constraint on the pulsar's equatorial ellipticity.
","[{""version"":""v1"",""created"":""Thu, 14 Aug 2003 22:31:14 GMT""}]","2008-11-26"
"hep-ex/0308034","Vitaly Eiges E.","K. Abe, et al. (Belle Collaboration)","Measurement of the D0 - anti-D0 lifetime difference using D0 -> Kpi/KK
  decays","12 pages, 6 figures (12 postscript files), submitted to Lepton Photon
  2003",,,"BELLE-CONF-347","hep-ex",,"  We report a preliminary measurement of the D0-anti-D0 mixing parameter y_CP
and the CP-violating parameter A_G using the decay D*+ -> D0 pi+ followed by D0
-> K- pi+ and D0 -> K+ K-. The results are obtained from a 158 fb^-1 data
sample collected near the Upsilon(4S) resonance with the Belle detector at the
KEKB asymmetric energy e+ e- collider.
","[{""version"":""v1"",""created"":""Fri, 15 Aug 2003 08:47:44 GMT""},{""version"":""v2"",""created"":""Mon, 18 Aug 2003 10:52:05 GMT""},{""version"":""v3"",""created"":""Wed, 3 Sep 2003 11:59:24 GMT""}]","2007-05-23"
"hep-ex/0308035","Masashi Hazumi","The Belle Collaboration: K. Abe, et al","Measurement of Time-Dependent CP-Violating Asymmetries in B0 --> phi
  Ks0, K+ K- Ks0, and eta' Ks0 Decays","10 pages, 4 postscript figures, submitted to Physical Review Letters,
  also contributed to the XXI International Symposium on Lepton and Photon
  Interactions at High Energies, Aug 11-16, 2003, Fermilab, Illinois USA","Phys.Rev.Lett.91:261602,2003","10.1103/PhysRevLett.91.261602",,"hep-ex",,"  We present an improved measurement of CP-violation parameters in B0 --> phi
Ks0, K+ K- Ks0, and eta' Ks0 decays based on a 140 fb-1 data sample collected
at the Upsilon(4S) resonance with the Belle detector at the KEKB
energy-asymmetric e+e- collider. One neutral B meson is fully reconstructed in
one of the specified decay channels, and the flavor of the accompanying B meson
is identified from its decay products. CP-violation parameters for each of the
three modes are obtained from the asymmetries in the distributions of the
proper-time intervals between the two B decays. We find that the observed CP
asymmetry in the B0 --> phi Ks0 decay differs from the standard model (SM)
expectation by 3.5 standard deviations, while the other cases are consistent
with the SM.
","[{""version"":""v1"",""created"":""Fri, 15 Aug 2003 00:39:33 GMT""},{""version"":""v2"",""created"":""Tue, 19 Aug 2003 19:34:40 GMT""},{""version"":""v3"",""created"":""Tue, 4 Nov 2003 03:27:36 GMT""},{""version"":""v4"",""created"":""Wed, 12 Nov 2003 03:07:55 GMT""}]","2008-11-26"
"hep-ex/0308036","Masashi Hazumi","The Belle Collaboration: K. Abe, et al","Measurement of CP-Violation Parameter sin(2phi1) with 152 Million BB-bar
  Pairs","11 pages, 4 postscript figures, contributed to the XXI International
  Symposium on Lepton and Photon Interactions at High Energies, Aug. 11-16,
  2003, Fermilab, Illinois USA",,,,"hep-ex",,"  We present a precise measurement of the standard model CP-violation parameter
sin(2phi1) based on a sample of 152 x 10^6 BB-bar pairs collected at the
Upsilon(4S) resonance with the Belle detector at the KEKB asymmetric-energy
e+e- collider. One neutral B meson is reconstructed in a J/psi Ks0, psi(2S)
Ks0, chi_c1 Ks0, eta_c Ks0, J/psi K*0, or J/psi KL CP-eigenstate decay channel
and the flavor of the accompanying B meson is identified from its decay
products. From the asymmetry in the distribution of the time interval between
the two B meson decay points, we obtain sin(2phi1) = 0.733 +/- 0.057(stat) +/-
0.028(syst).
","[{""version"":""v1"",""created"":""Fri, 15 Aug 2003 03:37:39 GMT""}]","2007-08-06"
