"astro-ph/0308267","Aaron Dotter","Aaron Dotter & Brian Chaboyer (Dartmouth College)","The impact of pollution on stellar evolution models","14 pages, 3 figures, AASTeX, to appear in the 10/10/03 issue of ApJ","Astrophys.J.596:496-500,2003","10.1086/377603",,"astro-ph",,"  An approach is introduced for incorporating the concept of stellar pollution
into stellar evolution models. The approach involves enhancing the metal
content of the surface layers of stellar models. In addition, the surface
layers of stars in the mass range of 0.5-2.0 Solar masses are mixed to an
artificial depth motivated by observations of lithium abundance. The behavior
of polluted stellar evolution models is explored assuming the pollution occurs
after the star has left the fully convective pre main sequence phase. Stellar
models polluted with a few Earth masses of iron are significantly hotter than
stars of the same mass with an equivalent bulk metallicity. Polluted stellar
evolution models can successfully reproduce the metal-rich, parent star tau
Bootis and suggest a slightly lower mass than standard evolution models.
Finally, the possibility that stars in the Hyades open cluster have accreted an
average of 0.5 Earth masses of iron is explored. The results indicate that it
is not possible to rule out stellar pollution on this scale from the scatter of
Hyades stars on a color-magnitude diagram. The small amount of scatter in the
observational data set does rule out pollution on the order of 1.5 Earth masses
of iron. Pollution effects at the low level of 0.5 Earth masses of iron do not
produce substantial changes in a star's evolution.
","[{""version"":""v1"",""created"":""Fri, 15 Aug 2003 14:16:17 GMT""}]","2009-11-10"
"astro-ph/0308268","Aaron Dotter","Aaron Dotter & Brian Chaboyer (Dartmouth College)","Stellar pollution and [Fe/H] in the Hyades","10 pages, 3 figures, AASTeX, accepted to the ApJL","Astrophys.J.596:L101-L104,2003","10.1086/379056",,"astro-ph",,"  The Hyades open cluster presents a unique laboratory for planet formation and
stellar pollution studies because all of the stars have essentially the same
age and were born from the same cloud of gas. Furthermore, with an age of
roughly 650 Myr most of the intermediate and low mass stars are on the main
sequence. Given these assumptions, the accretion of metal rich material onto
the surface of a star during and shortly after the formation of planetary
systems should be evident via the enhanced metallicity of the star. Building on
previous work, stellar evolution models which include the effects of stellar
pollution are applied to the Hyades. The results of several Monte Carlo
simulations, in which the amount of accreted material is drawn at random from a
Gaussian distribution with standard deviation equal to half the mean, are
presented. An effective temperature-[Fe/H] relation is produced and compared to
recent observations. The theoretical predictions presented in this letter will
be useful in future searches for evidence of stellar pollution due to planet
formation. It is concluded that stellar pollution effects at the mean level of
>=2 Earth masses of iron are ruled out by current observational data.
","[{""version"":""v1"",""created"":""Fri, 15 Aug 2003 14:27:11 GMT""}]","2009-11-10"
"astro-ph/0308269","Pascal Favre","W. Hajdas, P. B\""uhler, C. Eggel, P. Favre, A. Mchedlishvili and A.
  Zehnder","Radiation environment along the INTEGRAL orbit measured with the IREM
  monitor","5 pages, 7 figures, accepted for publication in A+A letters","Astron.Astrophys.411:L43-L48,2003","10.1051/0004-6361:20031251",,"astro-ph",,"  The INTEGRAL Radiation Environment Monitor (IREM) is a payload supporting
instrument on board the INTEGRAL satellite. The monitor continually measures
electron and proton fluxes along the orbit and provides this information to the
spacecraft on board data handler. The mission alert system broadcasts it to the
payload instruments enabling them to react accordingly to the current radiation
level. Additionally, the IREM conducts its autonomous research mapping the
Earth radiation environment for the space weather program. Its scientific data
are available for further analysis almost without delay.
","[{""version"":""v1"",""created"":""Fri, 15 Aug 2003 15:11:36 GMT""}]","2016-08-16"
"astro-ph/0308270","Myung Gyoon Lee","Myung Gyoon Lee","On the Formation of Giant Elliptical Galaxies and Globular Clusters","The proceedings of 28 pages, 14 figures (11 ps, 3 jpg), proceedings
  of APCTP 2nd Korean Astrophysics Workshop on ""Formation and Interaction of
  Galaxies"" (H.M.Lee & D. Ryu eds), to appear in the Journal of Korean
  Astronomical Society",,"10.5303/JKAS.2003.36.3.189",,"astro-ph",,"  I review the current status of understanding when, how long, and how giant
elliptical galaxies formed, focusing on the globular clusters. Several
observational evidences show that massive elliptical galaxies formed at $z>2$
($>10$ Gyr ago). Giant elliptical galaxies show mostly a bimodal color
distribution of globular clusters, indicating a factor of $\approx 20$
metallicity difference between the two peaks. The red globular clusters (RGCs)
are closely related with the stellar halo in color and spatial distribution,
while the blue globular clusters (BGCs) are not. The ratio of the number of the
RGCs and that of the BGCs varies depending on galaxies. It is concluded that
the BGCs might have formed 12--13 Gyr ago, while the RGCs and giant elliptical
galaxies might have formed similarly 10-11 Gyr ago. It remains now to explain
the existence of a gap between the RGC formation epoch and the BGC formation
epoch, and the rapid metallicity increase during the gap ($\Delta t \approx 2$
Gyr). If hierarchical merging can form a significant number of giant elliptical
galaxies $>10$ Gyr ago, several observational constraints from stars and
globular clusters in elliptical galaxies can be explained.
","[{""version"":""v1"",""created"":""Fri, 15 Aug 2003 15:51:38 GMT""}]","2015-06-24"
"cond-mat/0308267","Christian Korff","Christian Korff","The twisted XXZ chain at roots of unity revisited","10 pages, 2 figures. One footnote and some comments in the
  conclusions added","J. Phys. A: Math. Gen. 37 (2004) 1681-1689","10.1088/0305-4470/37/5/014",,"cond-mat.stat-mech math.QA nlin.SI",,"  The symmetries of the twisted XXZ spin-chain (alias the twisted six-vertex
model) at roots of unity are investigated. It is shown that when the twist
parameter is chosen to depend on the total spin an infinite-dimensional
non-abelian symmetry algebra can be explicitly constructed for all spin
sectors. This symmetry algebra is identified to be the upper or lower Borel
subalgebra of the sl_2 loop algebra. The proof uses only the intertwining
property of the six-vertex monodromy matrix and the familiar relations of the
six-vertex Yang-Baxter algebra.
","[{""version"":""v1"",""created"":""Thu, 14 Aug 2003 16:48:24 GMT""},{""version"":""v2"",""created"":""Fri, 22 Aug 2003 09:36:05 GMT""}]","2009-11-10"
"cond-mat/0308268","Kirill Belashchenko","K. D. Belashchenko, E. Y. Tsymbal, M. van Schilfgaarde, D. A. Stewart,
  I. I. Oleynik and S. S. Jaswal","Effect of interface bonding on spin-dependent tunneling from the
  oxidized Co surface","7 pages, revtex4, 4 embedded eps figures","Phys. Rev. B 69, 174408 (2004).","10.1103/PhysRevB.69.174408",,"cond-mat",,"  We demonstrate that the factorization of the tunneling transmission into the
product of two surface transmission functions and a vacuum decay factor allows
one to generalize Julliere's formula and explain the meaning of the ``tunneling
density of states'' in some limiting cases. Using this factorization we
calculate spin-dependent tunneling from clean and oxidized fcc Co surfaces
through vacuum into Al using the principal-layer Green's function approach. We
demonstrate that a monolayer of oxygen on the Co (111) surface creates a
spin-filter effect due to the Co-O bonding which produces an additional
tunneling barrier in the minority-spin channel. This changes the minority-spin
dominated conductance for the clean Co surface into a majority spin dominated
conductance for the oxidized Co surface.
","[{""version"":""v1"",""created"":""Thu, 14 Aug 2003 16:38:42 GMT""},{""version"":""v2"",""created"":""Mon, 15 Dec 2003 21:15:45 GMT""}]","2009-11-10"
"cond-mat/0308283","Nigel Cooper","N. R. Cooper","Exact Groundstates of Rotating Bose Gases close to a Feshbach Resonance","4 pages","Phys. Rev. Lett. 92, 220405 (2004)","10.1103/PhysRevLett.92.220405",,"cond-mat.mes-hall",,"  We study the groundstates of rotating Bose gases when interactions are
affected by a nearby Feshbach resonance. We show that exact groundstates at
high angular momentum can be found analytically for a general and realistic
model for the resonant interactions. We identify parameter regimes where the
exact groundstates are exotic fractional quantum Hall states, the excitations
of which obey non-abelian exchange statistics.
","[{""version"":""v1"",""created"":""Thu, 14 Aug 2003 16:57:43 GMT""}]","2009-11-10"
"cond-mat/0308288","Dmitri Krioukov","Dmitri Krioukov, Kevin Fall, and Xiaowei Yang","Compact Routing on Internet-Like Graphs","29 pages, 16 figures","INFOCOM 2004","10.1109/INFCOM.2004.1354495","IRB-TR-03-10","cond-mat.stat-mech cond-mat.dis-nn cs.NI",,"  The Thorup-Zwick (TZ) routing scheme is the first generic stretch-3 routing
scheme delivering a nearly optimal local memory upper bound. Using both direct
analysis and simulation, we calculate the stretch distribution of this routing
scheme on random graphs with power-law node degree distributions, $P_k \sim
k^{-\gamma}$. We find that the average stretch is very low and virtually
independent of $\gamma$. In particular, for the Internet interdomain graph,
$\gamma \sim 2.1$, the average stretch is around 1.1, with up to 70% of paths
being shortest. As the network grows, the average stretch slowly decreases. The
routing table is very small, too. It is well below its upper bounds, and its
size is around 50 records for $10^4$-node networks. Furthermore, we find that
both the average shortest path length (i.e. distance) $\bar{d}$ and width of
the distance distribution $\sigma$ observed in the real Internet inter-AS graph
have values that are very close to the minimums of the average stretch in the
$\bar{d}$- and $\sigma$-directions. This leads us to the discovery of a unique
critical quasi-stationary point of the average TZ stretch as a function of
$\bar{d}$ and $\sigma$. The Internet distance distribution is located in a
close neighborhood of this point. This observation suggests the analytical
structure of the average stretch function may be an indirect indicator of some
hidden optimization criteria influencing the Internet's interdomain topology
evolution.
","[{""version"":""v1"",""created"":""Thu, 14 Aug 2003 17:22:56 GMT""}]","2008-04-16"
"cond-mat/0308291","Gilberto Corso","L. S. Lucena, J. E. Freitas, G. Corso, and R. F. Soares","Anisotropy and percolation threshold in a multifractal support",,,"10.1590/S0103-97332003000300030",,"cond-mat.stat-mech",,"  Recently a multifractal object, $Q_{mf}$, was proposed to study percolation
properties in a multifractal support. The area and the number of neighbors of
the blocks of $Q_{mf}$ show a non-trivial behavior. The value of the
probability of occupation at the percolation threshold, $p_{c}$, is a function
of $\rho$, a parameter of $Q_{mf}$ which is related to its anisotropy. We
investigate the relation between $p_{c}$ and the average number of neighbors of
the blocks as well as the anisotropy of $Q_{mf}$.
","[{""version"":""v1"",""created"":""Thu, 14 Aug 2003 16:19:20 GMT""}]","2015-06-24"
"cond-mat/0308292","Masatsugu Suzuki","Masatsugu Suzuki, Itsuko S. Suzuki and J\""urgen Walter","Superconductivity and spin-glass like behavior in system with Pd sheet
  sandwiched between graphene sheets","21 pages, 15 figures; submitted to J. Phys.: Condensed Matter","J. Phys.: Condens. Matter 16 (2004) 903-918","10.1088/0953-8984/16/6/018",,"cond-mat.supr-con",,"  Pd-metal graphite (Pd-MG) has a layered structure, where each Pd sheet is
sandwiched between adjacent graphene sheets. DC magnetization and AC magnetic
susceptibility of Pd-MG have been measured using a SQUID magnetometer. Pd-MG
undergoes a superconducting transition at $T_{c}$ ($= 3.63 \pm 0.04$ K). The
superconductivity occurs in Pd sheets. The relaxation of $M_{ZFC}$ (aging),
which is common to spin glass systems, is also observed below $T_{c}$. The
relaxation rate $S(t)$ shows a peak at a characteristic time $t_{cr}$, which is
longer than a wait time $t_{w}$. The irreversibility between $\chi_{ZFC}$ and
$\chi_{FC}$ occurs well above $T_{c}$. The susceptibility $\chi_{FC}$ obeys a
Curie-Weiss behavior with a negative Curie-Weiss temperature ($-13.1 \leq
\Theta \leq -5.4$ K). The growth of antiferromagnetic order is limited by the
disordered nature of nanographites, forming spin glass-like behavior at low
temperatures in graphene sheets.
","[{""version"":""v1"",""created"":""Thu, 14 Aug 2003 16:36:12 GMT""}]","2016-08-16"
"cond-mat/0308293","Matteo Palassini","Matteo Palassini, Marta Sales, Felix Ritort","Order-parameter fluctuations in Ising spin glasses at low temperatures","7 pages, 7 eps figures, RevTex","Phys. Rev. B 68, 224430 (2003)","10.1103/PhysRevB.68.224430",,"cond-mat.dis-nn",,"  We present a numerical study of the order-parameter fluctuations for Ising
spin glasses in three and four dimensions at very low temperatures and without
an external field. Accurate measurements of two previously introduced
parameters, A and G, show that the order parameter is not self-averaging,
consistent with a zero-temperature thermal exponent value \theta' \simeq 0, and
confirm the validity of the relation G=1/3 in the thermodynamic limit in the
whole low-temperature phase, as predicted by stochastic stability arguments.
","[{""version"":""v1"",""created"":""Thu, 14 Aug 2003 17:59:50 GMT""}]","2009-11-10"
"cond-mat/0308294","Michael Dunlavy","M. J. Dunlavy and D. Venus","Critical Susceptibility Exponent Measured from Fe/W(110) Bilayers","-Submitted to Phys. Rev. B -Revtex4 Format -6 postscript figures",,"10.1103/PhysRevB.69.094411",,"cond-mat",,"  The critical phase transition in ferromagnetic ultrathin Fe/W(110) films has
been studied using the magnetic ac susceptibility. A statistically objective,
unconstrained fitting of the susceptibility is used to extract values for the
critical exponent (gamma), the critical temperature Tc, the critical amplitude
(chi_o) and the range of temperature that exhibits power-law behaviour. A
fitting algorithm was used to simultaneously minimize the statistical variance
of a power law fit to individual experimental measurements of chi(T). This
avoids systematic errors and generates objective fitting results. An ensemble
of 25 measurements on many different films are analyzed. Those which permit an
extended fitting range in reduced temperature lower than approximately .00475
give an average value gamma=1.76+-0.01. Bilayer films give a weighted average
value of gamma = 1.75+-0.02. These results are in agreement with the
-dimensional Ising exponent gamma= 7/4. Measurements that do not exhibit
power-law scaling as close to Tc (especially films of thickness 1.75ML) show a
value of gamma higher than the Ising value. Several possibilities are
considered to account for this behaviour.
","[{""version"":""v1"",""created"":""Thu, 14 Aug 2003 18:06:12 GMT""}]","2009-11-10"
"cond-mat/0308295","Adrian Gozar","A. Gozar, B.S. Dennis, T. Siegrist, Y. Horibe, and G. Blumberg","Inhomogeneous CuO_{6} Tilt Distribution and Charge/Spin Correlations in
  La_{2-x-y}Nd_{y}Sr_{x}CuO$_{4} around commensurate hole concentration","to be published in Phys. Rev. B",,"10.1103/PhysRevB.68.052511",,"cond-mat.str-el",,"  Phononic and magnetic Raman scattering are studied in
La$_{2-x-y}$Nd$_{y}$Sr$_{x}$CuO$_{4}$ with three doping concentrations: x ~
1/8, y = 0; x ~ 1/8, y = 0.4; and x = 0.01, y = 0. We observe strong disorder
in the tilt pattern of the CuO_{6} octahedra in both the orthorhombic and
tetragonal phases which persist down to 10 K and are coupled to bond disorder
in the cation layers around 1/8 doping independent of Nd concentration. The
weak magnitude of existing charge/spin modulations in the Nd doped structure
does not allow us to detect the specific Raman signatures on lattice dynamics
or two-magnon scattering around 2200 cm-1.
","[{""version"":""v1"",""created"":""Thu, 14 Aug 2003 18:15:24 GMT""}]","2009-11-10"
"cond-mat/0308296","Katja Lindenberg","Alexandre Rosas and Katja Lindenberg","Pulse Propagation in Chains with Nonlinear Interactions",,,"10.1103/PhysRevE.69.016615",,"cond-mat.soft cond-mat.stat-mech",,"  Pulse propagation in nonlinear arrays continues to be of interest because it
provides a possible mechanism for energy transfer with little dispersion. Here
we show that common measures of pulse dispersion might be misleading; in
strongly anharmonic systems they tend to reflect a succession of extremely
narrow pulses traveling at decreasing velocities rather than the actual width
of a single pulse. We present analytic estimates for the fraction of the
initial energy that travels in the leading pulses. We also provide analytic
predictions for the leading pulse velocity in a Fermi-Pasta-Ulam beta-chain.
","[{""version"":""v1"",""created"":""Thu, 14 Aug 2003 18:19:11 GMT""}]","2009-11-10"
"cond-mat/0308297","Yu. G. Makhlin","Yuriy Makhlin and Alexander Shnirman","Dephasing of solid-state qubits at optimal points","minor corrections and clarifications","Phys. Rev. Lett. 92, 178301 (2004)","10.1103/PhysRevLett.92.178301",,"cond-mat.mes-hall quant-ph",,"  Motivated by recent experiments with Josephson-junction circuits, we analyze
the influence of various noise sources on the dynamics of two-level systems at
optimal operation points where the linear coupling to low-frequency
fluctuations is suppressed. We study the decoherence due to nonlinear
(quadratic) coupling, focusing on the experimentally relevant 1/f and Ohmic
noise power spectra. For 1/f noise strong higher-order effects influence the
evolution.
","[{""version"":""v1"",""created"":""Thu, 14 Aug 2003 19:34:47 GMT""},{""version"":""v2"",""created"":""Mon, 22 Dec 2003 17:17:04 GMT""}]","2007-05-23"
"cond-mat/0308298","Nobuo Furukawa","Nobuo Furukawa and Yukitoshi Motome","Order N Monte Carlo Algorithm for Fermion Systems Coupled with
  Fluctuating Adiabatical Fields","9 pages with 4 figs","J. Phys. Soc. Jpn. 73, 1482 (2004)","10.1143/JPSJ.73.1482",,"cond-mat.str-el cond-mat.stat-mech",,"  An improved algorithm is proposed for Monte Carlo methods to study fermion
systems interacting with adiabatical fields. To obtain a weight for each Monte
Carlo sample with a fixed configuration of adiabatical fields, a series
expansion using Chebyshev polynomials is applied. By introducing truncations of
matrix operations in a systematic and controlled way, it is shown that the cpu
time is reduced from O(N^3) to O(N) where N is the system size. Benchmark
results show that the implementation of the algorithm makes it possible to
perform systematic investigations of critical phenomena using system-size
scalings even for an electronic model in three dimensions, within a realistic
cpu timescale.
","[{""version"":""v1"",""created"":""Thu, 14 Aug 2003 19:40:30 GMT""}]","2007-05-23"
"cond-mat/0308299","Steven C. Erwin","Steven C. Erwin and C. Stephen Hellberg","Is manganese-doped diamond a ferromagnetic semiconductor?","5 pages, 5 figures","Phys. Rev. B 68, 245206 (2003)","10.1103/PhysRevB.68.245206",,"cond-mat.mtrl-sci",,"  We use density-functional theoretical methods to examine the recent
prediction, based on a mean-field solution of the Zener model, that diamond
doped by Mn (with spin S=5/2) would be a dilute magnetic semiconductor that
remains ferromagnetic well above room temperature. Our findings suggest this to
be unlikely, for four reasons: (1) substitutional Mn in diamond has a low-spin
S=1/2 ground state; (2) the substitutional site is energetically unfavorable
relative to the much larger ""divacancy"" site; 3) Mn in the divacancy site is an
acceptor, but with only hyperdeep levels, and hence the holes are likely to
remain localized; (4) the calculated Heisenberg couplings between Mn in nearby
divacancy sites are two orders of magnitude smaller than for substitutional Mn
in germanium.
","[{""version"":""v1"",""created"":""Thu, 14 Aug 2003 20:57:03 GMT""}]","2009-11-10"
"cond-mat/0308300","George Kastrinakis","George Kastrinakis","Low temperature dephasing saturation from elastic magnetic spin disorder
  and interactions","This paper supersedes cond-mat/0210223","Phys. Rev. B. 72, 075137 (2005)","10.1103/PhysRevB.72.075137",,"cond-mat.dis-nn cond-mat.str-el",,"  We treat the question of the low temperature behavior of the dephasing rate
of the electrons in the presence of elastic spin disorder scattering and
interactions. In the frame of a self-consistent diagrammatic treatment, we
obtain saturation of the dephasing rate in the limit of low temperature for
magnetic scattering, in agreement with the non-interacting case. The magnitude
of the dephasing rate is set by the strength of the magnetic scattering rate.
We discuss the agreement of our results with relevant experiments.
","[{""version"":""v1"",""created"":""Thu, 14 Aug 2003 23:14:18 GMT""},{""version"":""v2"",""created"":""Sun, 17 Aug 2003 19:41:59 GMT""},{""version"":""v3"",""created"":""Thu, 20 Nov 2003 13:54:20 GMT""},{""version"":""v4"",""created"":""Mon, 5 Apr 2004 18:13:51 GMT""},{""version"":""v5"",""created"":""Mon, 28 Jun 2004 14:58:52 GMT""},{""version"":""v6"",""created"":""Fri, 18 Feb 2005 12:36:47 GMT""},{""version"":""v7"",""created"":""Tue, 26 Apr 2005 10:07:30 GMT""}]","2015-06-24"
"cond-mat/0308302","Andrew D. Greentree","Andrew D. Greentree, A. R. Hamilton, and F. Green","Charge shelving and bias spectroscopy for the readout of a charge-qubit
  on the basis of superposition states","4 pages, 3 figures, note slightly changed title, replaced with
  journal version","Phys. Rev. B 70, 041305(R) (2004)","10.1103/PhysRevB.70.041305",,"cond-mat.other quant-ph",,"  Charge-based qubits have been proposed as fundamental elements for quantum
computers. One commonly proposed readout device is the single-electron
transistor (SET). SETs can distinguish between localized charge states, but
lack the sensitivity to directly distinguish superposition states, which have
greatly enhanced coherence times compared with position states. We propose
introducing a third dot, and exploiting energy dependent tunnelling from the
qubit into this dot (bias spectroscopy) for pseudo-spin to charge conversion
and superposition basis readout. We introduce an adiabatic fast passage-style
charge pumping technique which enables efficient and robust readout via charge
shelving, avoiding problems due to finite SET measurement time.
","[{""version"":""v1"",""created"":""Fri, 15 Aug 2003 06:27:36 GMT""},{""version"":""v2"",""created"":""Tue, 27 Jul 2004 07:19:56 GMT""}]","2009-11-10"
"cond-mat/0308303","Augusto Gonzalez","Ricardo Perez, Augusto Gonzalez and Jorge Mahecha","Internal transitions of negatively charged magnetoexcitons in quantum
  dots","Presented as a poster in the Third Stig Lundqvist Conference on
  Advancing Frontiers of Condensed Matter Physics: Fundamental Interactions and
  Excitations in Confined Systems, Trieste, August 11 - 15","J. Phys.: Condens. Matter 15 (2003) 7681 - 7686","10.1088/0953-8984/15/45/007",,"cond-mat.mes-hall",,"  We report calculations of oscillator strengths for the far infrared
absorption of light by the excitonic complexes Xn- (the excess charge, n,
ranging from one to four) confined in quantum dots. The magnetic field is
varied in an interval which corresponds to ``filling factors'' between 2 and
3/5. Electron-hole interaction effects are seen in the deviations of the peak
positions from the Kohn lines, and in the spreading of the oscillator strengths
over a few final states. Transition densities are used as an additional tool to
characterize the absorption peaks.
","[{""version"":""v1"",""created"":""Fri, 15 Aug 2003 12:17:56 GMT""}]","2009-11-10"
"cond-mat/0308304","Ladislav \v{S}amaj","B. Jancovici and L. Samaj","Microscopic Calculation of the Dielectric Susceptibility Tensor for
  Coulomb Fluids II","22 pages","J. Stat. Phys. 114 (2004) 1211-1234","10.1023/B:JOSS.0000013972.61656.65",,"cond-mat.stat-mech",,"  For a Coulomb system contained in a domain \Lambda, the dielectric
susceptibility tensor \chi_{\Lambda} is defined as relating the average
polarization in the system to a constant applied electric field, in the linear
limit. According to the phenomenological laws of macroscopic electrostatics,
\chi_{\Lambda} depends on the specific shape of the domain \Lambda. In this
paper we derive, using the methods of equilibrium statistical mechanics in both
canonical and grand-canonical ensembles, the shape dependence of \chi_{\Lambda}
and the corresponding finite-size corrections to the thermodynamic limit, for a
class of general \nu-dimensional (\nu\ge 2) Coulomb systems, of ellipsoidal
shape, being in the conducting state. The microscopic derivation is based on a
general principle: the total force acting on a system in thermal equilibrium is
zero. The results are checked in the Debye-H\""uckel limit. The paper is a
generalization of a previous one [L. \v{S}amaj, J. Stat. Phys. 100:949 (2000)],
dealing with the special case of a one-component plasma in two dimensions. In
that case, the validity of the presented formalism has already been verified at
the exactly solvable (dimensionless) coupling \Gamma = 2.
","[{""version"":""v1"",""created"":""Fri, 15 Aug 2003 10:41:28 GMT""}]","2009-11-10"
