"hep-th/0308108","Saharian","Aram A. Saharian","On the energy-momentum tensor for a scalar field on manifolds with
  boundaries","25 pages, 2 figures, section and appendix on the surface energy for a
  spherical shell are added, references added, accepted for publication in
  Phys. Rev. D","Phys.Rev. D69 (2004) 085005","10.1103/PhysRevD.69.085005",,"hep-th gr-qc quant-ph",,"  We argue that already at classical level the energy-momentum tensor for a
scalar field on manifolds with boundaries in addition to the bulk part contains
a contribution located on the boundary. Using the standard variational
procedure for the action with the boundary term, the expression for the surface
energy-momentum tensor is derived for arbitrary bulk and boundary geometries.
Integral conservation laws are investigated. The corresponding conserved
charges are constructed and their relation to the proper densities is
discussed. Further we study the vacuum expectation value of the energy-momentum
tensor in the corresponding quantum field theory. It is shown that the surface
term in the energy-momentum tensor is essential to obtain the equality between
the vacuum energy, evaluated as the sum of the zero-point energies for each
normal mode of frequency, and the energy derived by the integration of the
corresponding vacuum energy density. As an application, by using the zeta
function technique, we evaluate the surface energy for a quantum scalar field
confined inside a spherical shell.
","[{""version"":""v1"",""created"":""Sat, 16 Aug 2003 09:13:43 GMT""},{""version"":""v2"",""created"":""Fri, 12 Dec 2003 09:20:43 GMT""}]","2009-11-10"
"math-ph/0308017","Valeri Dvoeglazov","Valeri V. Dvoeglazov","Is the Space-Time Non-Commutativity Simply Non-Commutativity of
  Derivatives?","8pp., no figures. Talk presented at the 8th International Conference
  on Squeezed States and Uncertainty Relations (ICSSUR'2003), Puebla, Pue.,
  M\'exico, June 9-13, 2003","Proceedings of the 8th International Conference on Squeezed States
  and Uncertainty Relations. Puebla, Mexico. Eds. H. Moya-Cessa et al. Rinton
  Press, 2003, p. 125-130",,"FFUAZ-FT-03-02","math-ph math.CA math.MP",,"  Recently, some problems have been found in the definition of the partial
derivative in the case of the presence of both explicit and implicit functional
dependencies in the classical analysis. In this talk we investigate the
influence of this observation on the quantum mechanics and classical/quantum
field theory. Surprisingly, some commutators of the coordinate-dependent
operators are not equal to zero. Therefore, we try to provide mathematical
foundations to the modern non-commutative theories. We also indicate possible
applications in the Dirac-like theories.
","[{""version"":""v1"",""created"":""Sat, 16 Aug 2003 00:07:23 GMT""}]","2007-05-23"
"math-ph/0308018","Soon-Tae Hong","Jaedong Choi, Soon-Tae Hong","Warped product approach to universe with non-smooth scale factor","10 pages","J.Math.Phys. 45 (2004) 642-651","10.1063/1.1637714",,"math-ph math.DG math.MP",,"  In the framework of Lorentzian warped products, we study the
Friedmann-Robertson-Walker cosmological model to investigate non-smooth
curvatures associated with multiple discontinuities involved in the evolution
of the universe. In particular we analyze non-smooth features of the spatially
flat Friedmann-Robertson-Walker universe by introducing double discontinuities
occurred at the radiation-matter and matter-lambda phase transitions in
astrophysical phenomenology.
","[{""version"":""v1"",""created"":""Sat, 16 Aug 2003 05:24:10 GMT""}]","2009-11-10"
"math-ph/0308019","Igor Krichever","I.M.Krichever and S.P.Novikov","2D Toda Chain, Commuting Difference Operators and Holomorphic Bundles","36 pages, Latex","Russ.Math.Surveys 58 (2003) 51-88","10.1070/RM2003v058n03ABEH000628",,"math-ph hep-th math.AG math.MP",,"  High rank solutions to the 2D Toda Lattice System are constructed
simultaneously with the effective calculation of coefficients of the high rank
commuting ordinary difference operators. Our technic is based on the study of
discrete dynamics of Tyurin Parameters characterizing the stable holomorphic
vector bundles over the algebraic curves (Riemann Surfaces).
","[{""version"":""v1"",""created"":""Sat, 16 Aug 2003 07:00:39 GMT""}]","2015-06-26"
"math/0308153","J. G. Wolff","J Gerard Wolff","Mathematics and Logic as Information Compression by Multiple Alignment,
  Unification and Search",,,,,"math.GM cs.AI math.LO",,"  This article introduces the conjecture that ""mathematics, logic and related
disciplines may usefully be understood as information compression (IC) by
'multiple alignment', 'unification' and 'search' (ICMAUS)"".
  As a preparation for the two main sections of the article, concepts of
information and information compression are reviewed. Related areas of research
are also described including IC in brains and nervous systems, and IC in
relation to inductive inference, Minimum Length Encoding and probabilistic
reasoning. The ICMAUS concepts and a computer model in which they are embodied
are briefly described.
  The first of the two main sections describes how many of the commonly-used
forms and structures in mathematics, logic and related disciplines (such as
theoretical linguistics and computer programming) may be seen as devices for
IC. In some cases, these forms and structures may be interpreted in terms of
the ICMAUS framework.
  The second main section describes a selection of examples where processes of
calculation and inference in mathematics, logic and related disciplines may be
understood as IC. In many cases, these examples may be understood more
specifically in terms of the ICMAUS concepts.
","[{""version"":""v1"",""created"":""Fri, 15 Aug 2003 16:24:53 GMT""}]","2007-05-23"
"math/0308154","Ofer Zeitouni","Eddy Mayer-Wolf, Alexander Roitershtein, Ofer Zeitouni","Limit theorems for one-dimensional transient random walks in Markov
  environments","Minor corrections in revised version. Paper to appear in Annals H.
  Poincare (Prob. & Stat.)",,,,"math.PR",,"  We obtain non-Gaussian limit laws for one-dimensional random walk in a random
environment assuming that the environment is a function of a stationary Markov
process. This is an extension of the work of Kesten, M. Kozlov and Spitzer for
random walks in i.i.d. environments. The basic assumption is that the
underlying Markov chain is irreducible and either with a finite state space or
with the transition kernel dominated above and below by a probability measure.
","[{""version"":""v1"",""created"":""Fri, 15 Aug 2003 17:24:54 GMT""},{""version"":""v2"",""created"":""Wed, 21 Apr 2004 20:05:24 GMT""}]","2007-05-23"
"math/0308155","Martin Scharlemann","Martin Scharlemann","Thin position in the theory of classical knots","33pp. 12 fig. A mildly updated version for final pubication",,,"UCSB 2003-19","math.GT",,"  This is a chapter that is to appear in the ""Handbook of Knot Theory"", edited
by William W. Menasco and Morwen B. Thistlethwaite.
","[{""version"":""v1"",""created"":""Fri, 15 Aug 2003 18:01:00 GMT""},{""version"":""v2"",""created"":""Mon, 29 Nov 2004 01:54:42 GMT""}]","2007-05-23"
"math/0308156","Peter M. Magyar","Peter Magyar (Michigan State University)","Littelmann paths for the basic representation of an affine Lie algebra","17 pages. Minor revisions from v1. See also
  http://www.math.msu.edu/~magyar/",,,,"math.RT math.CO math.QA",,"  We give a new model for the crystal graphs of an affine Lie algebra g^,
combining Littelmann's path model with the Kyoto path model. The vertices of
the crystal graph are represented by certain infinitely looping paths which we
call skeins.
  We apply this model to the case when the corresponding finite-dimensional
algebra g has a minuscule representation (classical type and E_6, E_7). We
prove that the basic level-one representation of g^, when considered as a
representation of g, is an infinite tensor product of fundamental
representations of g. A similar tensor product phenomenon holds for certain
Demazure submodules of the basic representation.
","[{""version"":""v1"",""created"":""Fri, 15 Aug 2003 21:55:40 GMT""},{""version"":""v2"",""created"":""Thu, 18 Sep 2003 18:24:56 GMT""}]","2007-05-23"
"math/0308157","Harold Widom","Harold Widom","On Asymptotics for the Airy Process","5 pages, LaTex file",,"10.1023/B:JOSS.0000022384.58696.61",,"math.PR math-ph math.MP",,"  The Airy process A(t), introduced by Pr\""ahofer and Spohn, is the limiting
stationary process for a polynuclear growth model. Adler and van Moerbeke found
a PDE in the variables s_1, s_2, and t for the probability that A(0)<s_1 and
A(t)<s_2. Using this they were able, assuming the truth of a certain conjecture
and appropriate uniformity, to obtain the first few terms of an asymptotic
expansion for this probability as t->infinity, with fixed s_1 and s_2. We shall
show that the expansion can be obtained by using the Fredholm determinant
representation for the probability. The main ingredients are formulas obtained
by the author and C. A. Tracy in the derivation of the Painlev\'e II
representation for the distribution function F_2 plus a few others obtained in
the same way.
","[{""version"":""v1"",""created"":""Sat, 16 Aug 2003 00:14:38 GMT""}]","2009-11-10"
"nucl-ex/0308013","Lawrence B. Weinstein","CLAS Collaboration: R.A. Niyazov, L.B. Weinstein, et al","Two-Nucleon Momentum Distributions Measured in 3He(e,e'pp)n","6 pages, 5 figures, submitted to PRL","Phys.Rev.Lett.92:052303,2004; Erratum-ibid.92:099903,2004","10.1103/PhysRevLett.92.052303",,"nucl-ex",,"  We have measured the 3He(e,e'pp)n reaction at 2.2 GeV over a wide kinematic
range. The kinetic energy distribution for `fast' nucleons (p > 250 MeV/c)
peaks where two nucleons each have 20% or less, and the third nucleon has most
of the transferred energy. These fast pp and pn pairs are back-to-back with
little momentum along the three-momentum transfer, indicating that they are
spectators. Experimental and theoretical evidence indicates that we have
measured distorted two-nucleon momentum distributions by striking the third
nucleon and detecting the spectator correlated pair.
","[{""version"":""v1"",""created"":""Fri, 15 Aug 2003 16:20:58 GMT""}]","2010-04-06"
"physics/0308061","Robert Knox","Laura E. Schmidt, H. L. Helfer, Robert S. Knox","Development of an elementary climate model: two-layer cellular case",,,,,"physics.ao-ph",,"  A qualitative understanding of the greenhouse effect has long been available
through models based on globally- and time-averaged quantities. We examine here
a simple 864-cell climatological model that emphasizes vertical radiative
energy transport within each cell. It reproduces yearly average temperatures
obtained earlier from one of these global models and predicts a locally
distributed non-radiative flux when observed temperatures are employed as input
data. Vertical and lateral transport of latent heat do not appear explicitly in
this model. They are apparently handled well by one non-radiative flux
variable, SNR, which shows a strong latitude dependence. Only the Sahara desert
and Saudi Arabian regions appear to be complex. For those interested in
climatology and construction of climate models, our model provides constraints
upon specifying averaged non-radiative energy transport. The model is a useful
simplification for learning about radiative energy transfer into and out of
Earth?s atmosphere and for representing the results of more sophisticated
models.
","[{""version"":""v1"",""created"":""Fri, 15 Aug 2003 16:48:55 GMT""}]","2007-05-23"
"physics/0308063","Giovanni Punzi","Giovanni Punzi","Sensitivity of searches for new signals and its optimization","Talk from PhyStat2003, Stanford, Ca, USA, September 2003, PSN
  MODT002. 5 pages, LaTeX, 6 eps figures. Reformatted according to conference
  style, small improvements in text and figures",,,,"physics.data-an hep-ex",,"  A frequentist definition of sensitivity of a search for new phenomena is
discussed, that has several useful properties. It is based on completely
standard concepts, is generally applicable, and has a very clear
interpretation. It is particularly suitable for optimization, being independent
of a-priori expectations about the presence of a signal, thus allowing the
determination of a single set of cuts that is optimal both for setting limits
and for making a discovery. Simple approximate formulas are given for the
common problem of Poisson counts with background.
","[{""version"":""v1"",""created"":""Fri, 15 Aug 2003 16:05:00 GMT""},{""version"":""v2"",""created"":""Thu, 4 Dec 2003 23:48:28 GMT""}]","2007-05-23"
"physics/0308064","Stefano Marchesini","S. Marchesini, H. N. Chapman, S. P. Hau-Riege, R. A. London, A. Szoke,
  H. He, M. R. Howells, H. Padmore, R. Rosen, J. C. H. Spence, U. Weierstall","Coherent X-ray Diffractive Imaging; applications and limitations","7 pages, 8 figures","Optics Express 11(19), 2344 (2003)","10.1364/OE.11.002344","UCRL-JC-155105","physics.optics",,"  The inversion of a diffraction pattern offers aberration-free
diffraction-limited 3D images without the resolution and depth-of-field
limitations of lens-based tomographic systems, the only limitation being
radiation damage. We review our experimental results, discuss the fundamental
limits of this technique and future plans.
","[{""version"":""v1"",""created"":""Fri, 15 Aug 2003 23:18:35 GMT""}]","2015-06-26"
"physics/0308065","Stephen Jewson","Stephen Jewson, Francisco Doblas-Reyes and Renate Hagedorn","The Assessment and Calibration of Ensemble Seasonal Forecasts of
  Equatorial Pacific Ocean Temperature and the Predictability of Uncertainty","Submitted to ASL",,,,"physics.ao-ph",,"  We evaluate the performance of two 44 year ensemble seasonal hindcast time
series for the Nino3 index produced as part of the DEMETER project. We show
that the ensemble mean carries useful information out to six months. The
ensemble spread, however, only carries useful information out to four months in
one of the models, and two months in the other.
","[{""version"":""v1"",""created"":""Sat, 16 Aug 2003 15:08:32 GMT""}]","2007-05-23"
