"cond-mat/0308322","Ron Lifshitz","Shahar Even-Dar Mandel and Ron Lifshitz","Symmetry of Magnetically-Ordered Three-Dimensional Octagonal
  Quasicrystals",,"Acta Crystallographica A 60 (2004) 179-194","10.1107/S0108767304002272",,"cond-mat.mtrl-sci",,"  The theory of magnetic symmetry in quasicrystals, described in a companion
paper [cond-mat/0304669], is used to enumerate all 3-dimensional octagonal spin
point groups and spin space-group types, and calculate the resulting selection
rules for neutron diffraction experiments.
","[{""version"":""v1"",""created"":""Fri, 15 Aug 2003 22:30:21 GMT""}]","2020-11-10"
"cond-mat/0308323","Charles Santori","Charles Santori, David Fattal, Jelena Vuckovic, Glenn S. Solomon, Edo
  Waks, Yoshihisa Yamamoto","Sub-microsecond correlations in photoluminescence from InAs quantum dots","8 pages, 8 figures","Phys. Rev. B 69, 205324 (2004)","10.1103/PhysRevB.69.205324",,"cond-mat.mes-hall quant-ph",,"  Photon correlation measurements reveal memory effects in the optical emission
of single InAs quantum dots with timescales from 10 to 800 ns. With above-band
optical excitation, a long-timescale negative correlation (antibunching) is
observed, while with quasi-resonant excitation, a positive correlation
(blinking) is observed. A simple model based on long-lived charged states is
presented that approximately explains the observed behavior, providing insight
into the excitation process. Such memory effects can limit the internal
efficiency of light emitters based on single quantum dots, and could also be
problematic for proposed quantum-computation schemes.
","[{""version"":""v1"",""created"":""Sat, 16 Aug 2003 02:16:42 GMT""}]","2009-11-10"
"cond-mat/0308324","Dr. Mario Rabinowitz","Mario Rabinowitz","Frequency Dependence of Superconducting Cavity Q and Magnetic Breakdown
  Field","6 pages","Appl.Phys.Lett.19:73-76,1971","10.1063/1.1653827",,"cond-mat.supr-con cond-mat.mtrl-sci",,"  A theoretical explanation is given to account for the unexpected observation
that L- and S-band Nb superconducting cavities were found to have lower Q and
lower magnetic breakdown field than those of the higher X-band frequencies.
Both effects can be related to the trapping of magnetic flux in the cavity
walls. The frequency dependence arises from the frequency dependence of the
resistivity of oscillating fluxoids. Calculations based on this model are in
agreement with experimental observations.
","[{""version"":""v1"",""created"":""Sat, 16 Aug 2003 04:47:19 GMT""}]","2008-11-26"
"cond-mat/0308325","Gordon Baym","Gordon Baym and C.J. Pethick","Vortex core structure and global properties of rapidly rotating
  Bose-Einstein condensates","11 pages in LateX, 3 figures","Phys.Rev.A69:043619,2004","10.1103/PhysRevA.69.043619",,"cond-mat.soft cond-mat.mes-hall",,"  We develop an approach for calculating stationary states of rotating
Bose-Einstein condensates in harmonic traps which is applicable for arbitrary
ratios of the rotation frequency to the transverse frequency of the trap
$\omega_{\perp}$. Assuming the number of vortices to be large, we write the
condensate wave function as the product of a function that describes the
structure of individual vortices times an envelope function, varying slowly on
the scale of the vortex spacing. By minimizing the energy, we derive
Gross-Pitaevskii equations that determine the properties of individual vortices
and the global structure of the cloud. For low rotation rates, the structure of
a vortex is that of an isolated vortex in a uniform medium, while for rotation
rates approaching the frequency of the trap (the mean field quantum Hall
regime), the structure is that of the lowest p-wave state of a particle in a
harmonic trap with frequency $\omega_{\perp}$. The global structure of the
cloud is determined by minimizing the energy with respect to variations of the
envelope function; for conditions appropriate to most experimental
investigations to date, we predict that the transverse density profile of the
cloud will be of the Thomas-Fermi form, rather than the Gaussian structure
predicted on the assumption that the wave function consists only of components
in the lowest Landau level.
","[{""version"":""v1"",""created"":""Sat, 16 Aug 2003 05:07:09 GMT""}]","2009-02-05"
"cond-mat/0308326","Joachim Ankerhold","Joachim Ankerhold and Hartwig Lehle","Low temperature electron transfer in strongly condensed phase","16 pages, 6 figures, revised version with minor changes",,"10.1063/1.1630297",,"cond-mat.stat-mech cond-mat.soft",,"  Electron transfer coupled to a collective vibronic degree of freedom is
studied in strongly condensed phase and at lower temperatures where quantum
fluctuations are essential. Based on an exact representation of the reduced
density matrix of the electronic+reaction coordinate compound in terms of path
integrals, recent findings on the overdamped limit in quantum dissipative
systems are employed. This allows to give for the first time a consistent
generalization of the well-known Zusman equations to the quantum domain.
Detailed conditions for the range of validity are specified. Using the Wigner
transform these results are also extended to the quantum dynamics in full phase
space. As an important application electronic transfer rates are derived that
comprise adiabatic and nonadiabatic processes in the low temperature regime
including nuclear tunneling. Accurate agreement with precise quantum Monte
Carlo data is observed.
","[{""version"":""v1"",""created"":""Sat, 16 Aug 2003 08:04:06 GMT""},{""version"":""v2"",""created"":""Mon, 27 Oct 2003 10:33:49 GMT""}]","2009-11-10"
"cond-mat/0308327","Jian Qi Shen","Jian Qi Shen and Fei Zhuang","Self-induced charge currents in electromagnetic materials, photon
  effective rest mass and some related topics","11 pages, Latex","Journal of Optics A: Pure and Applied Optics, vol. 6: 239-245
  (2004)","10.1088/1464-4258/6/2/015",,"cond-mat.mtrl-sci",,"  The contribution of self-induced charge currents of metamaterial media to
photon effective rest mass is discussed in detail in the present paper. We
concern ourselves with two kinds of photon effective rest mass, i.e., the
frequency-dependent and frequency-independent effective rest mass. Based on
these two definitions, we calculate the photon effective rest mass in the
left-handed medium and the 2TDLM media, the latter of which is described by the
so-called two time derivative Lorentz material (2TDLM) model. Additionally, we
concentrate primarily on the torque, which is caused by the interaction between
self-induced charge currents in dilute plasma (e.g., the secondary cosmic rays)
and interstellar magnetic fields (ambient cosmic magnetic vector potentials),
acting on the torsion balance of the rotating torsion balance experiment.
","[{""version"":""v1"",""created"":""Sat, 16 Aug 2003 08:57:47 GMT""}]","2009-11-10"
"cs/0308024","Steve Fisher","Rob Byrom, Brian Coghlan, Andrew W Cooke, Roney Cordenonsi, Linda
  Cornwall, Abdeslem Djaoui, Laurence Field, Steve Fisher, Steve Hicks, Stuart
  Kenny, Jason Leake, James Magowan, Werner Nutt, David O'Callaghan, Norbert
  Podhorszki, John Ryan, Manish Soni, Paul Taylor, Antony J Wilson","Relational Grid Monitoring Architecture (R-GMA)","Talk given at UK e-Science All-Hands meeting, Nottingham, UK,
  September 2-4, 2003. 7 pages of LaTeX and 5 PNG figures",,,,"cs.DC",,"  We describe R-GMA (Relational Grid Monitoring Architecture) which has been
developed within the European DataGrid Project as a Grid Information and
Monitoring System. Is is based on the GMA from GGF, which is a simple
Consumer-Producer model. The special strength of this implementation comes from
the power of the relational model. We offer a global view of the information as
if each Virtual Organisation had one large relational database. We provide a
number of different Producer types with different characteristics; for example
some support streaming of information. We also provide combined
Consumer/Producers, which are able to combine information and republish it. At
the heart of the system is the mediator, which for any query is able to find
and connect to the best Producers for the job. We have developed components to
allow a measure of inter-working between MDS and R-GMA. We have used it both
for information about the grid (primarily to find out about what services are
available at any one time) and for application monitoring. R-GMA has been
deployed in various testbeds; we describe some preliminary results and
experiences of this deployment.
","[{""version"":""v1"",""created"":""Fri, 15 Aug 2003 23:53:49 GMT""}]","2007-05-23"
"cs/0308025","Andras Lorincz","Andras Lorincz","Controlled hierarchical filtering: Model of neocortical sensory
  processing","Technical Report, 38 pages, 10 figures",,,,"cs.NE cs.AI cs.LG q-bio.NC",,"  A model of sensory information processing is presented. The model assumes
that learning of internal (hidden) generative models, which can predict the
future and evaluate the precision of that prediction, is of central importance
for information extraction. Furthermore, the model makes a bridge to
goal-oriented systems and builds upon the structural similarity between the
architecture of a robust controller and that of the hippocampal entorhinal
loop. This generative control architecture is mapped to the neocortex and to
the hippocampal entorhinal loop. Implicit memory phenomena; priming and
prototype learning are emerging features of the model. Mathematical theorems
ensure stability and attractive learning properties of the architecture.
Connections to reinforcement learning are also established: both the control
network, and the network with a hidden model converge to (near) optimal policy
under suitable conditions. Falsifying predictions, including the role of the
feedback connections between neocortical areas are made.
","[{""version"":""v1"",""created"":""Sat, 16 Aug 2003 07:31:57 GMT""}]","2007-05-23"
"gr-qc/0308051","Laszlo A. Gergely","M\'aty\'as Vas\'uth, Zolt\'an Keresztes, Andr\'as Mih\'aly, and
  L\'aszl\'o \'A. Gergely","Gravitational radiation reaction in compact binary systems: Contribution
  of the magnetic dipole-magnetic dipole interaction",,"Phys.Rev. D68 (2003) 124006","10.1103/PhysRevD.68.124006",,"gr-qc astro-ph",,"  We study the gravitational radiation reaction in compact binary systems
composed of neutron stars with spin and huge magnetic dipole moments
(magnetars). The magnetic dipole moments undergo a precessional motion about
the respective spins. At sufficiently high values of the magnetic dipole
moments, their interaction generates second post-Newtonian order contributions
both to the equations of motion and to the gravitational radiation escaping the
system. We parametrize the radial motion and average over a radial period in
order to find the secular contributions to the energy and magnitude of the
orbital angular momentum losses, in the generic case of \textit{eccentric}
orbits. Similarly as for the spin-orbit, spin-spin, quadrupole-monopole
interactions, here too we deduce the secular evolution of the relative
orientations of the orbital angular momentum and spins. These equations,
supplemented by the evolution equations for the angles characterizing the
orientation of the dipole moments form a first order differential system, which
is closed. The circular orbit limit of the energy loss agrees with Ioka and
Taniguchi's earlier result.
","[{""version"":""v1"",""created"":""Fri, 15 Aug 2003 16:17:40 GMT""}]","2016-08-16"
"gr-qc/0308052","Won Tae Kim","Won Tae Kim and Edwin J. Son","Exactly soluble model for self-gravitating D-particles with the wormhole","16 pages, 3 figures, revtex","JHEP 0309 (2003) 040","10.1088/1126-6708/2003/09/040","SOGANG-HEP 310/03","gr-qc hep-th",,"  We consider D-particles coupled to the CGHS dilaton gravity and obtain the
exact wormhole geometry and trajectories of D-particles by introducing the
exotic matter. The initial static wormhole background is not stable after
infalling D-particles due to the classical backreaction of the geometry so that
the additional exotic matter source should be introduced for the stability.
Then, the traversable wormhole geometry naturally appears and the D-particles
can travel through it safely. Finally, we discuss the dynamical evolution of
the wormhole throat and the massless limit of D-particles.
","[{""version"":""v1"",""created"":""Sat, 16 Aug 2003 08:15:45 GMT""}]","2009-11-10"
"hep-ex/0308042","Jeffrey Berryhill","B. Aubert, et al. (BABAR Collaboration)","Evidence for the Rare Decay B -> K*ll and Measurement of the B -> Kll
  Branching Fraction","7 pages, 2 postscript figues, submitted to Phys. Rev. Lett","Phys.Rev.Lett.91:221802,2003","10.1103/PhysRevLett.91.221802","BABAR-CONF-03/021, SLAC-PUB-10132","hep-ex",,"  We present evidence for the flavor-changing neutral current decay $B\to
K^*\ell^+\ell^-$ and a measurement of the branching fraction for the related
process $B\to K\ell^+\ell^-$, where $\ell^+\ell^-$ is either an $e^+e^-$ or
$\mu^+\mu^-$ pair. These decays are highly suppressed in the Standard Model,
and they are sensitive to contributions from new particles in the intermediate
state. The data sample comprises $123\times 10^6$ $\Upsilon(4S)\to B\bar{B}$
decays collected with the Babar detector at the PEP-II $e^+e^-$ storage ring.
Averaging over $K^{(*)}$ isospin and lepton flavor, we obtain the branching
fractions ${\mathcal B}(B\to K\ell^+\ell^-)=(0.65^{+0.14}_{-0.13}\pm
0.04)\times 10^{-6}$ and ${\mathcal B}(B\to
K^*\ell^+\ell^-)=(0.88^{+0.33}_{-0.29}\pm 0.10)\times 10^{-6}$, where the
uncertainties are statistical and systematic, respectively. The significance of
the $B\to K\ell^+\ell^-$ signal is over $8\sigma$, while for $B\to
K^*\ell^+\ell^-$ it is $3.3\sigma$.
","[{""version"":""v1"",""created"":""Sat, 16 Aug 2003 00:44:21 GMT""}]","2008-11-26"
"hep-ex/0308043","Anton Polouektov","Belle Collaboration","Measurement of the angle \phi_3 with Dalitz analysis of three-body D^0
  decay from B\to D^0 K process","25 pages, 14 figures, contributed paper at Lepton Photon 2003",,,,"hep-ex",,"  A new method to measure the angle $\phi_3$ of the CKM unitarity triangle
using a Dalitz analysis of the three-body decay of the $D^0$ meson from the
$B\to D^0 K$ process has been introduced recently. The method employs the
interference between $D^0$ and $\bar{D^0}$ to extract both the weak and strong
phases. We present a study of statistical and systematic errors of this method
using Monte Carlo simulation. A fit of the $D^0$ Dalitz distribution has been
performed based on a 140 fb$^{-1}$ sample collected by the Belle detector. We
observe the indication of a CP asymmetry with the significance of 2.4 standard
deviations. The 90% confidence interval obtained for the $\phi_3$ value is
$61^{\circ}<\phi_3<142^{\circ}$.
","[{""version"":""v1"",""created"":""Sat, 16 Aug 2003 06:52:55 GMT""}]","2012-08-27"
"hep-ph/0308163","Andrei Afanasev","Andrei Afanasev, C.E. Carlson","Single-Spin Beam Asymmetry in Semi-Exclusive Deep-Inelastic
  Electroproduction","4 pages, 2 figures, talk presented by AA at the Conference on the
  Intersections of Particle and Nuclear Physics (CIPANP 2003), New York City,
  May 2003",,,,"hep-ph nucl-th",,"  Recent measurements from Jefferson Lab show significant beam single spin
asymmetries in deep inelastic scattering. The asymmetry is due to interference
of longitudinal and transverse photoabsorption amplitudes which have different
phases induced by the final-state interaction between the struck quark and the
target spectators. We developed a dynamical model for a single-spin beam
asymmetry in deep-inelastic scattering. Our results are consistent with the
experimentally observed magnitude of this effect. We conclude that similar
mechanisms involving quark orbital angular momentum (`Sivers effect') are
responsible for both target and beam single-spin asymmetries.
","[{""version"":""v1"",""created"":""Fri, 15 Aug 2003 17:27:01 GMT""}]","2007-05-23"
"hep-ph/0308164","Bernd Kniehl","Bernd A. Kniehl, Lennart Zwirner","Prompt J/psi production in charged-current deep-inelastic scattering","31 pages, 6 figures","Nucl.Phys.B678:258-294,2004","10.1016/j.nuclphysb.2003.10.039","DESY 03-107","hep-ph",,"  We calculate the cross section of J/psi inclusive production in
lepton-nucleon deep-inelastic scattering via the weak charged current within
the factorization formalism of nonrelativistic quantum chromodynamics. The
hadronic system produced in association with the J/psi meson can be of
light-quark origin or contain charm. We take into account both direct
production and feed-down from directly-produced heavier charmonia. We provide
the cross sections of all contributing partonic subprocesses in analytic form.
We present theoretical predictions for the J/psi transverse-momentum and
rapidity distributions, which can be measured in current neutrino-nucleon
scattering experiments at CERN and Fermilab, and possibly at the future
electron-proton collider THERA at DESY. We find the cross section to be at the
edge of observability at DESY HERA.
","[{""version"":""v1"",""created"":""Fri, 15 Aug 2003 17:32:44 GMT""}]","2011-03-23"
"hep-ph/0308165","Nikolai Uraltsev","I.I.Bigi and N.Uraltsev","On Extracting Heavy Quark Parameters from Moments with Cuts","8 pages, LaTeX, two figure. Contributed to the Lepton-Photon
  Conference, 2003, FNAL","Phys.Lett. B579 (2004) 340-346","10.1016/j.physletb.2003.10.115","Bicocca-FT-03-21, UND-HEP-03-BIG03","hep-ph",,"  We point out that applying the photon energy cut significantly modifies the
moments of energy spectrum in B->X_s+gamma decays, with a certain class of
effects not accounted for in the mostly used OPE expressions. This leads to a
systematic bias in the extracted values of the b quark mass and other heavy
quark parameters. The apparent b quark mass increases typically by 70MeV or
more, together with an even more dramatic downward shift in the kinetic
expectation value. Accounting for these cut-related shifts brings different
measurements into a good agreement, when the OPE-based theory employs the
robust approach. These nonperturbative effects are exponential in the effective
hardness severely lowered by high cuts, and do not signify a breakdown of the
1/m_b expansion itself. Similar effects in semileptonic b->c decays are briefly
addressed. We stress the utility of the second moment of E_gamma once these
effects are incorporated.
","[{""version"":""v1"",""created"":""Fri, 15 Aug 2003 18:13:59 GMT""}]","2010-04-05"
"hep-ph/0308167","Pran Nath","Tarek Ibrahim and Pran Nath","Corrections to b, t quark masses and $\tau$ lepton mass in SUGRA
  including CP phases","Based on talk at SUGRA20 at Northeastern University, Boston, USA,
  March 17-21. 14 pages including 5 figures, Latex",,,,"hep-ph",,"  A brief review is given of recent analyses of the effects of CP phases on the
supersymmetric QCD and supersymmetric electroweak contibutions to the $b$ and
$t$ quark masses and to the $\tau$ lepton mass in SUGRA models. The effects of
CP phases on the supersymmetric contributions are found to be significanlty
large for the b quark mass as they can change both its sign and its magnitude.
Thus with the inclusion of CP phases the supersymmetric correction to the b
quark mass can be as much as fifty percent or more of the total b quark mass.
For the case of the $\tau$ lepton, the effects of CP phases on the
supersymmetric correction is also relatively large as it can again affect both
the sign and the magnitude of the $\tau$ mass correction. However, in this case
the overall correction is found to be only a few percent. The effect of CP
phases on SUSY contribution to the $t$ quark mass was also investigated.
However, in this case the overall correction is less than a percent with or
without the inclusion of phases. These results have important implications for
$b-\tau$ unification and for $b-t-\tau$ unification in the context of unified
theories.
","[{""version"":""v1"",""created"":""Fri, 15 Aug 2003 23:14:11 GMT""}]","2007-05-23"
"hep-ph/0308168","Roland M. Crocker","Roland M. Crocker, Carlo Giunti, and and Daniel J. Mortlock","Neutrino Interferometry In Curved Spacetime","25 pages, 1 .eps figure. Updated version -- with simplified notation
  -- accepted for publication in Phys.Rev.D. Extra author added","Phys.Rev. D69 (2004) 063008","10.1103/PhysRevD.69.063008",,"hep-ph astro-ph gr-qc",,"  Gravitational lensing introduces the possibility of multiple (macroscopic)
paths from an astrophysical neutrino source to a detector. Such a multiplicity
of paths can allow for quantum mechanical interference to take place that is
qualitatively different to neutrino oscillations in flat space. After an
illustrative example clarifying some under-appreciated subtleties of the phase
calculation, we derive the form of the quantum mechanical phase for a neutrino
mass eigenstate propagating non-radially through a Schwarzschild metric. We
subsequently determine the form of the interference pattern seen at a detector.
We show that the neutrino signal from a supernova could exhibit the
interference effects we discuss were it lensed by an object in a suitable mass
range. We finally conclude, however, that -- given current neutrino detector
technology -- the probability of such lensing occurring for a
(neutrino-detectable) supernova is tiny in the immediate future.
","[{""version"":""v1"",""created"":""Sat, 16 Aug 2003 02:38:00 GMT""},{""version"":""v2"",""created"":""Tue, 27 Jan 2004 19:56:34 GMT""}]","2012-08-27"
"hep-th/0308102","Igor Bandos","Igor A. Bandos, Jose M.Isidro","D=4 supergravity dynamically coupled to superstring in a superfield
  Lagrangian approach","15 pages, RevTex4, no figures. V2. References added, minor changes,
  submitted to Phys.Rev. D. V3. More references added","Phys.Rev. D69 (2004) 085009","10.1103/PhysRevD.69.085009","FTUV-03/0815","hep-th",,"  We elaborate a full superfield description of the interacting system of
dynamical D=4, N=1 supergravity and dynamical superstring. As far as minimal
formulation of the simple supergravity is used, such a system should contain as
well the tensor (real linear) multiplet which describes the dilaton and the
two-superform gauge field whose pull-back provides the Wess-Zumino term for the
superstring. The superfield action is given by the sum of the Wess-Zumino
action for D=4, N=1 superfield supergravity, the superfield action for the
tensor multiplet in curved superspace and the Green-Schwarz superstring action.
The latter includes the coupling to the tensor multiplet both in the Nambu-Goto
and in the Wess-Zumino terms. We derive superfield equations of motion
including, besides the superfield supergravity equations with the source, the
source-full superfield equations for the linear multiplet. The superstring
equations keep the same form as for the superstring in supergravity and
2-superform background. The analysis of gauge symmetries shows that the
superfield description of the interacting system is gauge equivalent to the
dynamical system described by the sum of the spacetime, component action for
supergravity interacting with tensor multiplet and of the purely bosonic string
action.
","[{""version"":""v1"",""created"":""Fri, 15 Aug 2003 16:32:39 GMT""},{""version"":""v2"",""created"":""Tue, 2 Sep 2003 15:12:29 GMT""},{""version"":""v3"",""created"":""Thu, 4 Sep 2003 15:54:25 GMT""}]","2009-11-10"
"hep-th/0308103","Pei-Ming Ho","Pei-Ming Ho","Regularization of Newton Constant, Trans-Planckian Dispersion Relation,
  and Symmetry of Particle Spectrum","9 pages, minor modification","Class.Quant.Grav. 21 (2004) 2641-2650","10.1088/0264-9381/21/11/009",,"hep-th",,"  We consider the possibility that the UV completeness of a fundamental theory
is achieved by a modification of propagators at large momenta. We assume that
general covariance is preserved at all energies, and focus on the coupling of a
scalar field to the background geometry as an example. Naively, one expects
that the gravitational interaction, like Yukawa interactions, will be
regularized by a propagator which decays to zero sufficiently fast above some
cutoff scale, but we show that in order to avoid the ultra-violet divergence,
the propagator should approach to a nonzero constant. This incompatibility
between the regularizations of gravitational and Yukawa interactions suggests
that a symmetry of the particle spectrum is needed for a UV complete
fundamental theory.
","[{""version"":""v1"",""created"":""Fri, 15 Aug 2003 19:13:57 GMT""},{""version"":""v2"",""created"":""Sun, 17 Aug 2003 03:08:34 GMT""},{""version"":""v3"",""created"":""Tue, 26 Aug 2003 20:56:19 GMT""},{""version"":""v4"",""created"":""Wed, 1 Oct 2003 13:41:47 GMT""}]","2009-11-10"
"hep-th/0308104","Hong Lu","H. Lu and J.F. Vazquez-Poritz","Four-Dimensional Einstein Yang-Mills De Sitter Gravity From Eleven
  Dimensions","Latex, 10 pages, references added","Phys.Lett. B597 (2004) 394-399","10.1016/j.physletb.2004.07.036",,"hep-th",,"  We obtain D=4 de Sitter gravity coupled to SU(2) Yang-Mills gauge fields from
an explicit and consistent truncation of D=11 supergravity via Kaluza-Klein
dimensional reduction on a non-compact space. The ``internal'' space is a
smooth hyperbolic 7-space (H^7) written as a foliation of two 3-spheres, on
which the SU(2) Yang-Mills fields reside. The positive cosmological constant is
completely fixed by the SU(2) gauge coupling constant. The explicit reduction
ansatz enables us to lift any of the D=4 solutions to D=11. In particular, we
obtain dS_2 in M-theory, where the nine-dimensional transverse space is an H^7
bundle over S^2. We also obtain a new smooth embedding of dS_3 in D=6
supergravity.
","[{""version"":""v1"",""created"":""Fri, 15 Aug 2003 20:13:01 GMT""},{""version"":""v2"",""created"":""Sun, 7 Sep 2003 18:24:33 GMT""}]","2009-11-10"
