"math/0308223","Sinan G\""unt\""urk","Nguyen T. Thao and C. Sinan Gunturk","Ergodic Dynamics in Sigma-Delta Quantization: Tiling Invariant Sets and
  Spectral Analysis of Error","33 pages, 6 figures",,,,"math.DS math.SP",,"  This paper has two themes that are intertwined: The first is the dynamics of
certain piecewise affine maps on the Euclidean space that arise from a class of
analog-to-digital conversion methods called Sigma-Delta quantization. The
second is the analysis of reconstruction error associated to each such method.
Sigma-Delta quantization generates approximate representations of functions by
sequences that lie in a restricted set of discrete values. These are special
sequences in that their local averages track the function values closely, thus
enabling simple convolutional reconstruction. In this paper, we are concerned
with the approximation of constant functions only, a basic case that presents
surprisingly complex behavior. An m'th order Sigma-Delta scheme with input x
can be translated into a dynamical system that produces a discrete-valued
sequence (in particular, a 0-1 sequence) q as its output. When the schemes are
stable, we show that the underlying piecewise affine maps possess invariant
sets that tile the Euclidean space up to a finite multiplicity. When this
multiplicity is one (the single-tile case), the dynamics within the tile is
isomorphic to that of a generalized skew translation on the m dimensional
torus. The value of x can be approximated using any consecutive M elements in q
with increasing accuracy in M. We show that the asymptotical behavior of
reconstruction error depends on the regularity of the invariant sets, the order
m, and some arithmetic properties of x. We determine the behavior in a number
of cases of practical interest and provide good upper bounds in some other
cases when exact analysis is not yet available.
","[{""version"":""v1"",""created"":""Sun, 24 Aug 2003 20:52:51 GMT""}]","2007-05-23"
"math/0308224","Cheol-Hyun Cho","Cheol-Hyun Cho","Holomorphic disc, spin structures and Floer cohomology of the Clifford
  torus","31 pages, 2 figures",,,,"math.SG math.DG",,"  We compute the Bott-Morse Floer cohomology of the Clifford torus in $\CP^n$
with all possible spin-structures. Each spin structure is known to determine an
orientation of the moduli space of holomorphic discs, and we analyze the change
of orientation according to the change of spin structure of the Clifford torus.
Also, we classify all holomorphic discs with boundary lying on the Clifford
torus by establishing a Maslov index formula for such discs. As a result, we
show that in odd dimensions there exist two spin structures which give
non-vanishing Floer cohomology of the Clifford torus, and in even dimensions,
there is only one such spin structure. When the Floer cohomology is
non-vanishing, it is isomorphic to the singular cohomology of the torus (with a
Novikov ring as its coefficients). As a corollary, we prove that any
Hamiltonian deformation of the Clifford torus intersects with it at least at
$2^n$ distinct intersection points, when the intersection is transversal.
  We also compute the Floer cohomology of the Clifford torus with flat line
bundles on it and verify the prediction made by Hori using a mirror symmetry
calculation.
","[{""version"":""v1"",""created"":""Mon, 25 Aug 2003 07:35:26 GMT""}]","2007-05-23"
"math/0308225","Yong-Geun Oh","Cheol-Hyun Cho and Yong-Geun Oh","Floer cohomology and disc instantons of Lagrangian torus fibers in Fano
  toric manifolds","38 pages","Asian J. Math. Vol. 10, No. 4 (2006), 773-814",,,"math.SG hep-th math-ph math.MP",,"  In this paper, we first provide an explicit description of {\it all}
holomorphic discs (``disc instantons'') attached to Lagrangian torus fibers of
arbitrary compact toric manifolds, and prove their Fredholm regularity. Using
this, we compute Fukaya-Oh-Ohta-Ono's (FOOO's) obstruction (co)chains and the
Floer cohomology of Lagrangian torus fibers of Fano toric manifolds. In
particular specializing to the formal parameter $T^{2\pi} = e^{-1}$, our
computation verifies the folklore that FOOO's obstruction (co)chains correspond
to the Landau-Ginzburg superpotentials under the mirror symmetry
correspondence, and also proves the prediction made by K. Hori about the Floer
cohomology of Lagrangian torus fibers of Fano toric manifolds. The latter
states that the Floer cohomology (for the parameter value $T^{2\pi} = e^{-1}$)
of all the fibers vanish except at a finite number, the Euler characteristic of
the toric manifold, of base points in the momentum polytope that are critical
points of the superpotential of the Landau-Ginzburg mirror to the toric
manifold. In the latter cases, we also prove that the Floer cohomology of the
corresponding fiber is isomorphic to its singular cohomology.
  We also introduce a restricted version of the Floer cohomology of Lagrangian
submanifolds, which is a priori more flexible to define in general, and which
we call the {\it adapted Floer cohomology}. We then prove that the adapted
Floer cohomology of any non-singular torus fiber of Fano toric manifolds is
well-defined, invariant under the Hamiltonian isotopy and isomorphic to the
Bott-Morse Floer cohomology of the fiber.
","[{""version"":""v1"",""created"":""Mon, 25 Aug 2003 14:19:05 GMT""}]","2007-05-23"
"math/0308226","Thomas William Dawson","Thomas William Dawson","Extensions of Normed Algebras","Ph.D. Thesis, University of Nottingham, 2003. 76 pages; plain TeX",,,,"math.FA",,"  We review and analyse techniques from the literature for extending a normed
algebra, A to a normed algebra, B, so that B has interesting or desirable
properties which A may lack. For example, B might include roots of monic
polynomials over A.
  These techniques have been important historically for constructing examples
in the theory of Banach algebras. We construct new examples in this way.
Elsewhere we contribute to the related programme of determining which
properties of an algebra are shared by certain extensions of it.
  Similarly, we consider the relations between the topological spaces, M(A) and
M(B), of closed, maximal ideals of A and B respectively. For example, it is
shown that if B is one of the types of 'algebraic extensions' of A constructed
in the thesis and M(B) has trivial first Cech-cohomology group then so has
M(A).
  The invertible group of a normed algebra is studied in Chapter 4; it is shown
that if a Banach algebra, A, has dense invertible group then so has every
integral extension of A. The context for this work is also explained: some new
results characterising trivial uniform algebras by means of approximation by
invertible elements are given. We show how these results partially answer a
famous, open problem of Gelfand.
  Results in Chapter 4 lead to the conjecture that a uniform algebra is trivial
if the group of exponentials of its elements is dense in the algebra. We
investigate this conjecture in Chapter 5. In the search for a counterexample,
we construct and establish some properties of `logarithmic extensions' of a
regular uniform algebra.
","[{""version"":""v1"",""created"":""Mon, 25 Aug 2003 09:51:02 GMT""}]","2007-05-23"
"math/0308227","Dumitru Daniel Poro\c{s}niuc","D.D.Porosniuc","A locally symmetric Kaehler Einstein structure on the cotangent bundle
  of a space form","12 pages, LaTeX2e","to appear in ""Balkan Journal of Geometry and Its Applications""
  Vol.9, 2004",,,"math.DG",,"  We obtain a locally symmetric Kaehler Einstein structure on the cotangent
bundle of a Riemannian manifold of negative constant sectional curvature.
Similar results are obtained on a tube around zero section in the cotangent
bundle, in the case of a Riemannian manifold of positive constant sectional
curvature. The obtained Kaehler Einstein structures cannot have constant
holomorphic sectional curvature.
","[{""version"":""v1"",""created"":""Mon, 25 Aug 2003 10:07:35 GMT""}]","2007-05-23"
"math/0308228","Sonia Natale","Nicolas Andruskiewitsch and Sonia Natale","Double categories and quantum groupoids","34 pages, amslatex. The statement in Proposition 3.10 has been
  corrected","Publ. Mat. Urug. 10 11-51 (2005).",,,"math.QA",,"  We give the construction of a class of weak Hopf algebras (or quantum
groupoids) associated to a matched pair of groupoids and certain cocycle data.
This generalizes a now well-known construction for Hopf algebras, first studied
by G. I. Kac in the sixties. Our approach is based on the notion of double
groupoids, as introduced by Ehresmann.
","[{""version"":""v1"",""created"":""Mon, 25 Aug 2003 10:30:27 GMT""},{""version"":""v2"",""created"":""Sun, 28 Sep 2003 16:32:19 GMT""}]","2007-05-23"
"math/0308229","Elmar Wagner","Konrad Schmuedgen and Elmar Wagner","Hilbert space representations of cross product algebras II","42 pages",,,,"math.QA",,"  In this paper, we study and classify Hilbert space representations of cross
product *-algebras of the quantized enveloping algebra $U_q(e_2)$ with the
coordinate algebras $O(E_q(2))$ of the quantum motion group and $O(\C_q)$ of
the complex plane, and of the quantized enveloping algebra $U_q(su_{1,1})$ with
the coordinate algebras $O(SU_q(1,1))$ of the quantum group $SU_q(1,1)$ and
$O(U_q)$ of the quantum disc. Invariant positive functionals and the
corresponding Heisenberg representations are explicitely described.
","[{""version"":""v1"",""created"":""Mon, 25 Aug 2003 12:53:48 GMT""}]","2007-05-23"
"math/0308230","Michael Skeide","Michael Skeide","Von Neumann Modules, Intertwiners and Self-Duality","5 pages","J. Operator Theory, 54 (119--124) 2005",,,"math.OA",,"  We apply the ideas of Muhly, Skeide and Solel [MSS03] of considering von
Neumann B-modules as intertwiner spaces for representations of B' to obtain a
new, simple and self-contained proof for self-duality of von Neumann modules.
This simplifies also the approach of [MSS03].
","[{""version"":""v1"",""created"":""Mon, 25 Aug 2003 13:03:11 GMT""}]","2007-05-23"
"math/0308231","Michael Skeide","Michael Skeide","Commutants of von Neumann Modules, Representations of B^a(E) and Other
  Topics Related to Product Systems of Hilbert Modules","To appear in Proceedings of ``Advances in Quantum Dynamics'', Mount
  Holyoke, 2002","In G.L. Price, B.M. Baker, P.E.T. Jorgensen, and P.S. Muhly,
  editors, Advances in quantum dynamics, number 335 in Contemporary
  Mathematics, pages 253--262. American Mathematical Society, 2003",,,"math.OA math.PR",,"  We review some of our results from the theory of product systems of Hilbert
modules. We explain that the product systems obtained from a CP-semigroup in a
paper by Bhat and Skeide and in a paper by Muhly and Solel are commutants of
each other. Then we use this new commutant technique to construct product
systems from E_0-semigroups on B^a(E) where E is a strongly full von Neumann
module. (This improves the construction from a paper by Skeide for Hilbert
modules where existence of a unit vector is required.) Finally, we point out
that the Arveson system of a CP-semigroup constructed by Powers from two
spatial E_0-semigroups is the product of the corresponding spatial Arveson
systems as defined (for Hilbert modules) in a paper by Skeide. It need not
coincide with the tensor product of Arveson systems.
","[{""version"":""v1"",""created"":""Mon, 25 Aug 2003 13:49:23 GMT""}]","2007-05-23"
"math/0308232","Denis Kochan","Denis Kochan","Pseudodifferential forms and supermechanics","10 pages","Czechoslovak Journal of Physics, Vol. 54, No. 2 (2004), s. 177-188","10.1023/B:CJOP.0000014400.74657.02",,"math.DG math.SG",,"  We investigate (pseudo)differential forms in the framework of supergeometry.
Definitions, basic properties and Cartan calculus (DeRham differential, Lie
derivative, inner product, Hodge operator) are presented; the symplectic
supermechanics (even and odd) is formulated; and the question of quantization
is discussed. In the framework of supermechanics, we investigate also classical
Hamiltonian systems converting to SUSY-QM after quantization.
","[{""version"":""v1"",""created"":""Mon, 25 Aug 2003 13:56:12 GMT""}]","2010-01-23"
"math/0308233","Victor H. Moll","John Hubbard and Victor H. Moll","A geometric view of rational Landen transformations",,"Bull. London Math. Soc. 35 (2003), 293-301",,,"math.AG math.DS",,"  In this paper, a geometric interpretation is provided of a new rational
Landen transformation. The convergence of its iterates is also established.
","[{""version"":""v1"",""created"":""Mon, 25 Aug 2003 14:04:08 GMT""}]","2007-05-23"
"math/0308234","Marcos Kiwi","Marcos Kiwi, Martin Loebl and Jiri Matousek","Expected length of the longest common subsequence for large alphabets","14 pages, 1 figure, LaTex",,,,"math.CO math.PR",,"  We consider the length L of the longest common subsequence of two randomly
uniformly and independently chosen n character words over a k-ary alphabet.
Subadditivity arguments yield that the expected value of L, when normalized by
n, converges to a constant C_k. We prove a conjecture of Sankoff and Mainville
from the early 80's claiming that C_k\sqrt{k} goes to 2 as k goes to infinity.
","[{""version"":""v1"",""created"":""Mon, 25 Aug 2003 15:10:42 GMT""}]","2007-05-23"
"math/0308235","Jouko Mickelsson","Jouko Mickelsson","Gerbes on quantum groups","10 AmsTex pages, no figures",,,,"math.DG hep-th",,"  We discuss an approach to quantum gerbes over quantum groups in terms of
q-deformation of transition functions for a loop group bundle. The case of the
quantum group SUq(2) is treated in some detail.
","[{""version"":""v1"",""created"":""Mon, 25 Aug 2003 15:38:21 GMT""}]","2007-05-23"
"math/0308236","Alex Chigogidze","A. Chigogidze and V. Valov","Extraordinary dimension of maps",,,,,"math.GN math.AT",,"  We establish a characterization of the extraordinary dimension of perfect
maps between metrizable spaces.
","[{""version"":""v1"",""created"":""Mon, 25 Aug 2003 15:57:56 GMT""}]","2007-05-23"
"nlin/0308026","Matthias Brack","J. Kaidel and M. Brack","Uniform approximations for pitchfork bifurcation sequences","LaTeX, 31 pp., 18 figs. Version (v3): correction of several misprints","Phys. Rev. E 70, 016206 (2004) (21 pp.)","10.1103/PhysRevE.70.016206",,"nlin.CD math-ph math.MP nlin.SI",,"  In non-integrable Hamiltonian systems with mixed phase space and discrete
symmetries, sequences of pitchfork bifurcations of periodic orbits pave the way
from integrability to chaos. In extending the semiclassical trace formula for
the spectral density, we develop a uniform approximation for the combined
contribution of pitchfork bifurcation pairs. For a two-dimensional double-well
potential and the familiar H\'enon-Heiles potential, we obtain very good
agreement with exact quantum-mechanical calculations. We also consider the
integrable limit of the scenario which corresponds to the bifurcation of a
torus from an isolated periodic orbit. For the separable version of the
H\'enon-Heiles system we give an analytical uniform trace formula, which also
yields the correct harmonic-oscillator SU(2) limit at low energies, and obtain
excellent agreement with the slightly coarse-grained quantum-mechanical density
of states.
","[{""version"":""v1"",""created"":""Mon, 25 Aug 2003 13:51:12 GMT""},{""version"":""v2"",""created"":""Thu, 2 Oct 2003 11:12:49 GMT""},{""version"":""v3"",""created"":""Wed, 10 Dec 2003 16:29:39 GMT""}]","2009-11-10"
"nlin/0308027","Pier Luigi Ramazza","L. Pastur, S. Boccaletti, P.L. Ramazza","Detecting local synchronization in coupled chaotic systems",,,"10.1103/PhysRevE.69.036201",,"nlin.CD",,"  We introduce a technique to detect and quantify local functional dependencies
between coupled chaotic systems. The method estimates the fraction of locally
syncronized configurations, in a pair of signals with an arbitrary state of
global syncronization. Application to a pair of interacting Rossler oscillators
shows that our method is capable to quantify the number of dynamical
configurations where a local prediction task is possible, also in absence of
global synchronization features.
","[{""version"":""v1"",""created"":""Mon, 25 Aug 2003 14:12:06 GMT""}]","2009-11-10"
"nucl-th/0308068","Armen Sedrakian","Armen Sedrakian, T.T.S. Kuo, Herbert M\""uther, Peter Schuck","Pairing in nuclear systems with effective Gogny and V_low-k interactions","11 pages, 2 figures, uses elsart.sty; v2: references added, Brueckner
  calculations for the V_low-k spectrum; v3: author name correction","Phys.Lett. B576 (2003) 68-74","10.1016/j.physletb.2003.09.090",,"nucl-th",,"  The pairing properties of nuclear systems are a sensitive probe of the
effective nucleon-nucleon interactions. We compare the 1S0 pairing gaps in
nuclear and neutron matter derived from the phenomenological Gogny interaction
and a renormalization group motivated low-momentum V_low-k interaction
extracted from realistic interactions. We find that the pairing gaps predicted
by these interactions are in an excellent agreement in a wide range of
sub-nuclear densities. The close agreement between the predictions of the
effective forces remains intact in the case where the single particle spectra
in neutron and nuclear matter are renormalized within the Hartree-Fock theory.
","[{""version"":""v1"",""created"":""Mon, 25 Aug 2003 09:56:01 GMT""},{""version"":""v2"",""created"":""Wed, 10 Dec 2003 16:23:20 GMT""},{""version"":""v3"",""created"":""Fri, 23 Apr 2004 18:05:52 GMT""}]","2015-06-26"
"nucl-th/0308069","Claudio Ciofi degli Atti","M. A. Braun, C. Ciofi degli Atti, L. P. Kaptari, H. Morita","Finite Formation Time in Electro-Disintegration of Few-Body Nuclei","3 pages, 4 figures. Presented at the 17th International IUPAP
  Conference on Few-Body Problems in Physics, 5-10 June 2003, Triangle
  Universities, Nuclear Laboratory, Durham, NC USA. To appear in Nuclear
  Physics A",,,,"nucl-th",,"  Inclusive and exclusive electro-disintegration of 2-H, 3-He and 4-He are
calculated within an approach where, besides the final state interaction (FSI),
also the finite formation time (FFT) of the hit hadron to its asymptotic
physical state is taken into account.
","[{""version"":""v1"",""created"":""Mon, 25 Aug 2003 15:59:26 GMT""}]","2007-05-23"
"physics/0308087","Niels Asger Mortensen","N.A. Mortensen, M. Stach, J. Broeng, A. Petersson, H.R. Simonsen, and
  R. Michalzik","Multi-mode photonic crystal fibers for VCSEL based data transmission","Accepted for Optics Express","Opt. Express 11, 1953 (2003).","10.1364/OE.11.001953",,"physics.optics",,"  Quasi error-free 10 Gbit/s data transmission is demonstrated over a novel
type of 50 micron core diameter photonic crystal fiber with as much as 100 m
length. Combined with 850$ nm VCSEL sources, this fiber is an attractive
alternative to graded-index multi-mode fibers for datacom applications. A
comparison to numerical simulations suggests that the high bit-rate may be
partly explained by inter-modal diffusion.
","[{""version"":""v1"",""created"":""Mon, 25 Aug 2003 10:00:27 GMT""}]","2015-06-26"
"physics/0308088","Sadhan Adhikari K.","Renat A. Sultanov and Sadhan K. Adhikari","Coulomb three-body systems and charge transfer collisions in a
  configuration-space approach","3 pages, 1 ps figure, Parallel session talk at the 17th international
  conference in few-body physics, Duke university, 2003, to appear in Nuclear
  Physics A","Nucl. Phys. A 737C (2004) 346-348",,,"physics.atm-clus",,"  Some low-energy three-body muon- and electron-transfer processes are
considered within the Faddeev-Hahn formulation using two-, six-, and ten-state
close-coupling approximation. We test our approach in bound-state problems for
systems H$_2^+$ and ($\mu^-$dd)$^+$ within six- and ten-state schemes, where
$d$ is a deuteron and $\mu$ a muon. We present results in the six-state model
for muonium formation from hydrogen. We also present results for muon-transfer
rates from muonic hydrogen isotopes to bare nuclei S$^{16}$ and Ar$^{18}$ in
reasonable agreement with experiment. For these heavier targets a polarization
potential is included and Coulomb potentials are treated exactly without
approximation or cut off.
","[{""version"":""v1"",""created"":""Mon, 25 Aug 2003 14:17:58 GMT""}]","2007-05-23"
"physics/0308089","Janaki Balakrishnan","J.Balakrishnan","Spatial curvature effects on molecular transport by diffusion","10 pages","Phys.Rev.E61, 4648 (2000)","10.1103/PhysRevE.61.4648",,"physics.bio-ph q-bio.SC",,"  For a substance diffusing on a curved surface, we obtain an explicit relation
valid for very small values of the time, between the local concentration, the
diffusion coefficient, the intrinsic spatial curvature and the time. We recover
the known solution of Fick's law of diffusion in the flat space limit. In the
biological context, this result would be useful in understanding the variations
in the diffusion rates of integral proteins and other molecules on membranes.
","[{""version"":""v1"",""created"":""Mon, 25 Aug 2003 14:35:52 GMT""}]","2009-11-10"
"physics/0308090","Alexander K. Motovilov","W. Sandhas, E. A. Kolganova, A. K. Motovilov, Y. K. Ho","Binding Energies and Scattering Observables in the ^3He^4He_2 Atomic
  System","Contribution to Proceedings of the 17th International IUPAP
  Conference on Few-Body Problems in Physics (Durham, North Carolina, USA, June
  5-10, 2003)","Few-Body Problems in Physics (Proc. of 17th Int. IUPAP Conf. on
  Few-Body Problems in Physics), Elsevier B.V., Amsterdam, 2004, pp.
  S337--S339.","10.1007/s00601-004-0046-2",,"physics.atm-clus nucl-th physics.chem-ph",,"  The ^3He^4He_2 three-atomic system is studied on the basis of a hard-core
version of the Faddeev differential equations. The binding energy of the
^3He^4He_2 trimer, scattering phase shifts, and the scattering length of a ^3He
atom off a ^4He dimer are calculated using the LM2M2 and TTY He-He interatomic
potentials.
","[{""version"":""v1"",""created"":""Mon, 25 Aug 2003 15:30:31 GMT""}]","2009-11-10"
"quant-ph/0308126","Lech Jakobczyk","L. Jakobczyk, A. Jamroz","Entanglement and nonlocality versus spontaneous emission in two-atom
  system","15 pages, 7 figures","Phys. Lett. A 318(2003),318-326","10.1016/j.physleta.2003.09.044",,"quant-ph",,"  We study evolution of entanglement of two two-level atoms in the presence of
dissipation caused by spontaneous emission. We find explicit fromulas for the
amount of entanglement as a function of time, in the case of destruction of the
initial entanglement and possible creation of a transient entanglement between
atoms. We also discuss how spontaneous emission influences nonlocality of
states expressed by violation of Bell - CHSH inequality. It is shown that
evolving system very quickly becomes local, even if entanglement is still
present or produced.
","[{""version"":""v1"",""created"":""Mon, 25 Aug 2003 12:48:16 GMT""}]","2015-06-26"
"quant-ph/0308127","Alexander I. Lvovsky","S. A. Babichev, B. Brezger, A. I. Lvovsky","Remote preparation of a single-mode photonic qubit by measuring field
  quadrature noise",,"Physical Review Letters 92, 047903 (2004)","10.1103/PhysRevLett.92.047903",,"quant-ph",,"  An electromagnetic field quadrature measurement, performed on one of the
modes of the nonlocal single-photon state $a|1,0>-b|0,1>$, collapses it into a
superposition of the single-photon and vacuum states in the other mode. We use
this effect to implement remote preparation of arbitrary single-mode photonic
qubits conditioned on observation of a preselected quadrature value. The
quantum efficiency of the prepared qubit can be higher than that of the initial
single photon.
","[{""version"":""v1"",""created"":""Mon, 25 Aug 2003 09:40:55 GMT""}]","2009-11-10"
"quant-ph/0308128","Okan Ozer","Okan Ozer and Bulent Gonul","New exact treatment of the perturbed Coulomb interactions","6 pages article in LaTEX (uses standard article.sty). No Figures.
  Please check ""http://www1.gantep.edu.tr/~ozer/"" for other studies of Nuclear
  Physics Group at University of Gaziantep","Modern Physics Letters A, Vol. 18, No. 36 (2003) 2581-2586","10.1142/S021773230301199X",,"quant-ph",,"  A novel method for the exact solvability of quantum systems is discussed and
used to obtain closed analytical expressions in arbitrary dimensions for the
exact solutions of the hydrogenic atom in the external potential $\Delta
V(r)=br+cr^{2}$, which is based on the recently introduced supersymmetric
perturbation theory.
","[{""version"":""v1"",""created"":""Mon, 25 Aug 2003 13:07:04 GMT""},{""version"":""v2"",""created"":""Fri, 7 Nov 2003 13:39:53 GMT""}]","2009-11-10"
"quant-ph/0308129","Andrew John Daley","A. J. Daley, P. O. Fedichev, and P. Zoller","Single Atom Cooling by Superfluid Immersion: A Non-Destructive Method
  for Qubits","14 pages, 9 figures, RevTeX 4","Phys. Rev. A 69, 022306 (2004)","10.1103/PhysRevA.69.022306",,"quant-ph cond-mat",,"  We present a scheme to cool the motional state of neutral atoms confined in
sites of an optical lattice by immersing the system in a superfluid. The motion
of the atoms is damped by the generation of excitations in the superfluid, and
under appropriate conditions the internal state of the atom remains unchanged.
This scheme can thus be used to cool atoms used to encode a series of entangled
qubits non-destructively. Within realisable parameter ranges, the rate of
cooling to the ground state is found to be sufficiently large to be useful in
experiments.
","[{""version"":""v1"",""created"":""Mon, 25 Aug 2003 15:34:35 GMT""}]","2009-09-29"
